bulletproof,"The Blood is in the water. The cuts no longer bring me down. Don't you even bother. I've seen enough to take you down. Love, hate, pride. bottled up inside. Let it go!. Gonna Let it go!. (BANG!). I'm feeling Superhuman. (BANG!). I'm invincible, I'm bulletproof. (BANG!). I'm at a revolution. (BANG!). I'm invincible, I'm bulletproof. (Don't you know I'm bulletproof?). The fight has made me stronger. I could never turn back now. Don't you point the finger. Your words no longer bring me down. I'm finally taking over. The truth has surfaced all around. The days of going under. Have risen up and can't be found. Love, hate, pride. bottled up inside. Let it go!. Gonna Let it go!. (BANG!). I'm feeling Superhuman. (BANG!). I'm invincible, I'm bulletproof. (BANG!). I'm at a revolution. (BANG!). I'm invincible, I'm bulletproof. (Don't you know I'm bulletproof?). (instrumental). Bulletproof!. Bulletproof!. (instrumental). Superhuman!. Revolution!. Love, hate, pride. bottled up inside. Let it go!. Gonna Let it go!. (BANG!). I'm feeling Superhuman. (BANG!). I'm invincible, I'm bulletproof. (BANG!). I'm at a revolution. (BANG!). I'm invincible, I'm bulletproof. (BANG!). I'm feeling superhuman. (BANG!). I'm invincible, I'm bulletproof. (BANG!). I'm at a revolution. (BANG!). I'm invincible, I'm bulletproof. Love, hate pride. bottled up inside!. Love, hate, pride. bottled up inside!. Love, hate, pride. bottled up inside!. Let it go!. Gonna Let it go!"
voodoo doll,"Don't pull my strings. I wanna know who died and crowned you king. You take this way too far and all your pain. Why do you take it out on me. You take it out on me, yeah. You're lighting up candles. Flying off the handle. Your crystal ball is lying. You can't control me. You can't hold me. Over your fire. No I'm not your voodoo doll. Not a victim strangled in your cloth. You think you got me underneath your spell. With your voodoo voodoo. You're playing dirty and your magic's black. I'm pulling needles out of my back. You think you cursed me but I won't fall. 'cause I'm not your voodoo voodoo doll. You know you haunt my dreams. Your so called power is not what it seems. Your darkest hour is not mine to face. So don't you take it out on me. Take it out on me, yeah. You're lighting up candles. Flying off the handle. Your crystal ball is lying. You can't control me. You can't hold me. Over your dying fire. No I'm not your voodoo doll. Not a victim strangled in your cloth. You think you got me underneath your spell. With your voodoo voodoo. You're playing dirty and your magic's black. I'm pulling needles out of my back. You think you cursed me but I won't fall. 'cause I'm not your voodoo voodoo doll. Don't pull my strings. I wanna know who died and crowned you king. No I'm not your voodoo doll. Not a victim strangled in your cloth. You think you got me underneath your spell. With your voodoo voodoo. You're playing dirty and your magic's black. I'm pulling needles out of my back. You think you cursed me but I won't fall. 'cause I'm not your voodoo voodoo doll. Yeah. Your voodoo doll. Not your voodoo voodoo"
pretty poison,"You say you love me. Then burn me again. It's so easy to let you in. Now I'm standing at the end again. You lifted me up. You're tearing me down. I don't know where to go from here. Feeding the rage that hides within. You have finally locked me in. Will you ever let me go?. Pretty poison you're in my veins. Go away, go away. I don't need you anymore. You trap me, you haunt me, you trick me again. You're the reason I always give in. You have pushed me to the edge again. You lifted me up. You're tearing me down. I don't know where to go from here. Feeding the rage that hides within. You have finally locked me in. Will you ever let me go?. Pretty poison you're in my veins. Go away, go away. Won't you leave me for just one day?. Just one day?. Pretty poison you're in my veins. Go away, go away. I don't need you anymore. Leave me alone, leave me alone. All the voices inside my head. Leave me alone, leave me alone. All the voices inside my head. Pretty poison you're in my veins. Go away, go away. Won't you leave me for just one day?. Just one day?. Pretty poison you're in my veins. Go away, go away. Won't you leave me for just one day?. Just one day?. Pretty poison you're in my veins. Go away, go away. I don't need you anymore"
3 leaf loser,"Biting the hand that feeds you, lying to the voice. Inside, reach out to beg for something this life. Is a lesson, take what you're given feeding on. Self destruction, waiting to explode again, no. Sign of resolution this life is a lesson, take what. You're given. You don't need direction to find your way, don't. You listen to yourself now and again killing. Time, killing you mind over matter, stop and. Listen to yourself now. Bend me before i breakdown, dying to be free. Within, it's not how you'd like to see it this life. Is a lesson, take what you're given forcing your. Self solution as you fall into line again, when. Will i find the answers this life is a lesson, take. What you're given. Falling to the ground, left face down as i recall. The mirrors ugly glare"
adrenaline,"My heart is beating faster can't control these feelings. anymore,. I've waited long enough I want it more than. anyone,. Its time to step up and deliver what you want to see,. My blood is pumping now this is how its gonna be,. Its 45 minutes of love,. I wanna see you push and you shove,. I'll show you just how far too go,. Its time to loose all control,. Its a feeling,. I can't control these feelings anymore,. Believe me,. My heart is racing and I can't seem to get. enough,. Am I dreaming,. Just like a drug but I know its just. adrenaline, go,. Just feel it,. Ooooh my heart is beating faster,. My adrenaline reaches its limit I can feel it taking. over me,. My head is spinning and it seems like I. can hardly breathe,. You get a taste its like a drug that you don't wanna. leave,. So if you want it let me see you put your fists in the. air,. Its 45 minutes of love,. I wanna see you push and you shove,. I'll show you just how far too go,. Its time to loose all control,. Its a feeling,. I can't control these feelings anymore,. Believe me,. My heart is racing and I can't seem to get. enough,. Am I dreaming,. Just like a drug but I know its just. adrenaline, go,. Just feel it,. Ooooh my heart is beating faster,. My heart is beating faster can't control these feelings. anymore,. I've waited long enough I want it more than. anyone,. Its time to step up and deliver what you want to see,. My blood is pumping now this is how its gonna be,. Its a feeling,. I can't control these feelings anymore,. Believe me,. My heart is racing and I can't seem to get. enough,. Am I dreaming,. Just like a drug but I know its just. adrenaline, go,. Just feel it,. Ooooh my heart is beating faster,. Its 45 minutes of love,. My heart is beating faster."
anthem for the underdog,You say you know just who I am. But you can't imagine. What waits for you across the line. You thought you had me. But I'm still here standing. And I'm tired of backing down. And I'm here now feelin' the pain. Of a thousand hearts. Been to hell and back again. I won't take this. You try so hard to bring me down. You can't break the broken. You still don't seem to understand. It's your turn to see just. How it feels to be me. How it feels to be knocked down. And you're here now feeling the pain. Of a thousand hearts. You've been to hell and back again. You can't take this. Remember. This feeling. How it feels to be alive. Now you see me through my eyes. And we're here now feeling the beat. Of a thousand hearts. Coming back to life again. We can make it. Remember. This feeling. Remember...
anthem for the underdog (picture perfect sessions),You say you know just who I am. But you can't imagine. What waits for you across the line. You thought you had me. But I'm still here standing. And I'm tired of backing down. And I'm here now feeling the pain. Of a thousand hearts. Been to hell and back again. I won't take this. You try so hard to bring me down. You can't break the broken. You still don't seem to understand. It's your turn to see just. How it feels to be me. How it feels to be knocked down. And you're here now feeling the pain. Of a thousand hearts. You've been to hell and back again. You can't take this. Remember. This feeling. How it feels to be alive. Now you see me through my eyes. And we're here now feeling the beat. Of a thousand hearts. Coming back to life again. We can make it. Remember. This feeling. Remember
arms of a stranger,"I came home early to see you,. Couldn't wait to hold you,. I've been away for so long now,. But as I walked through the doorway,. My heart was shattered,. To find that you're not alone,. When will I break into pieces,. Its your mistake,. I finally see that everything I thought was you was a lie,. Now your loves not dieing,. Its in the arms of a stranger,. The days just seem so much longer,. Now that I'm without you,. It never seems to get better,. I'll try to hold it together,. And I can't wait for,. The day you fade from my memory, yeah,. When will I break into pieces,. Its your mistake,. I finally see that everything I thought was you was a lie,. Now your loves not dieing,. Its in the arms of a stranger,. In the arms of a stranger,. In the arms of a stranger,. When will I break into pieces,. Its your mistake,. I finally see that everything I thought was you was a lie,. Now your loves not dieing,. Its in the arms of a stranger,. When will I break into pieces,. Its your mistake,. I finally see that everything I thought was you was a lie,. Now your loves not dieing,. Its in the arms of a stranger,. When will I break,. Its your mistake,. Everything I thought was you was a lie,. Now your loves not dieing,. Its in the arms of a stranger,. I came home early to see you, couldn't wait to hold you,. You're in the arms of a stranger."
back up,. I hear the words you say to me. I see the way you look at me. I know what's on your mind so. Stand up get up back up now. Just stay away. I know the fear you hold inside. I know what's weighing on your mind. There's nothing you can do so. Stand up get up back up. You're reaching out just to be like me. But you've fallen short. Still you're following me. You had the chance to bring me down. But there's nothing left. So just stay away from me. You can't stand to see my face. To know you'll never take my place. There's nothing you can do but. Stand up get up back up now. Just stay away. I feel the hate you push on me. I see the things that you can't see. I know what's on your mind so. Stand up get up back up. It's not the things you say to me. It's not the things that I believe. You try to bring me down. So stand up get up back up now Just stay away.
bitter,"Mother mother can you hear me,I keep trying. Just to find me all I know now, all you show me,. Endless questions, hopeless ending. This bitter pill is pushing me away and now I feel. Like there's nothing left to say and I pretend to. Look the other way but in the end will I be okay,. Will I be okay. Father father will you be there as I cry out. Silent again turning colder, frozen deeper,. Numb to this dream sleeping within. Before I face another day, won't you let stay asleep,. Lost among the dreams that always comfort me. And before I find my feet, won't you show me. What I need, what I need to walk again"
blessing,Offer my hand you spit in my face. Blinded by failures you can't face the shame. The walls of your fortress come tumbling down. You cry for a savior no ones around. Paint me a picture of how things went wrong. 'cause this violence play your favorite song. Swim through the void as black as your soul. Never forget. You've lost control of me. Never change who I am. Lies will never hide the truth. Pain is a blessing in disguise. I shiver at the thought of you. Now I'll see you on your way. As you fall from grace. Glued to the past a moth to a flame. Where will you hide. When you can't shift the blame. The further you fall the more that I gain. Never forget you've caused this pain. You feel. Burning deep inside of you. Behind the veil. Never take control of me. Never change who I am. Lies will never hide the truth. Pain is a blessing in disguise. I shiver at the thought of you. Now I'll see you on your way. As you fall from grace. No. You will never change. No no. You will never change. No. You will never change. No no. You will never change. You've lost control of me. Never change who I am. Lies will never hide the truth. Pain is a blessing in disguise. I shiver at the thought of you. Now I'll see you on your way. As you fall from grace
blind,"I'm not okay but patiently I wait. I sit here hoping that we will be saved. Am I too late or am I just in time?. It's just too dark to see through blinded eyes. And I can't see you walk away. 'Cause you're already gone. Because in this dark you are my light. The one that brings me back to life. I won't be okay doing this all alone. 'Cause love is always hard to find. But without you here lately, I'm blind. I'm awake, I saw you in my dreams. You came to me and never turned away. To be okay, something's gotta change. 'Cause with the lights on I still feel the same. I can't see you walk away. Tell me where did I go wrong?. Because in this dark you are my light. The one that brings me back to life. I won't be okay doing this all alone. In this life I have to choose. Between losing me and losing you. It's so unfair I do this on my own. 'Cause love is always hard to find. But without you here lately, I'm blind. I stumble, you don't let me fall. Maybe you love me after all. I'll take whatever brings you back. Nobody makes me feel like that. Please don't ever let me lose your light. In this dark you are my light. The one that brings me back to life. I won't be okay doing this all alone. In this life I have to choose. Between losing me and losing you. It's so unfair I do this on my own. 'Cause love is always hard to find. But without you here lately, I'm blind. Now I see through open eyes. That without you here lately I'm blind. I'm okay and patiently I wait"
broken,Freedom!. Alone again again alone. Patiently waiting by the phone. Hoping that you will call me home. The pain inside my love denied. Hopes and dreams swallowed by pride. Everything I need it lies in you. 'Cause I'm broken. I know I need you now. 'Cause deep inside I'm broken. You see the way I live. I know I know your heart is broken. When I turn away. I need to be broken. Take the pain away. I question why you chose to die. When you knew your truth I would deny. You look at me. The tears begin to fall. And all in all faith is blind. But I fail time after time. Daily in my sin I take your life. 'Cause I'm broken. I know I need you now. 'Cause deep inside I'm broken. You see the way I live. I know I know your heart is broken. When I turn away. I need to be broken. Take the pain away. All the hate deep inside. Slowly covering my eyes. All these things I hide. Away from you again. All this fear holding me. My heart is cold and I believe. Nothing's gonna change. Until I'm broken. This time. Let go!. 'Cause I'm broken. I know I need you now. 'Cause deep inside I'm broken. You see the way I live. I know I know your heart is broken. When I turn away. I need to be broken. Take the pain away. Broken. Broken. Broken. Broken
broken road,"Time moves slowly while you're gone. I haven't heard your voice in quite sometime. But I still see your face. I cannot erase the things you've done. And all the ways you caught me hangin on. Now you're gone, I moved on. And I don't feel so sorry. Can't you see I'm bleeding, but I won't bleed anymore. I held on for so long now. But I had to let you go. At the end of a broken road. I know it hurts to hear the truth. Well maybe I was never meant to be with you. And I cannot replace the tears of disgrace. That run for you. 'Cause running from the truth is what you do. Now you're gone, I moved on. And I don't feel so sorry. Can't you see I'm bleeding, but I won't bleed anymore. I held on for so long now. But I had to let you go. At the end of a broken road. You're all that I've ever known. And I cannot replace all these tears of disgrace. And I won't bleed for you anymore. Now you're gone, I moved on. And I don't feel so sorry. Can't you see I'm bleeding, but I won't bleed anymore. I held on for so long now. But I had to let you go. At the end of a broken road. . by:Milena Vieira"
broken-wwe mix,Alone again again alone. Patiently waiting by the phone. Hoping that you will call me home. The pain inside my love denied. Hopes and dreams swallowed by pride. Everything I need it lies in you‘Cause I’m broken. I know I need you now. ‘Cause deep inside I'm broken. You see the way I live. I know I know your heart is broken. When I turn away. I need to be broken. Take the pain awayI question why you chose to die. When you knew your truth I would deny. You look at me. The tears begin to fall. And all in all faith is blind. But I fail time after time. Daily in my sin I take your lifeAll the hate deep inside. Slowly covering my eyes. All these things I hide. Away from you again. All this fear holding me. My heart is cold and I believe. Nothing’s gonna change. Until I'm broken
bulletproof,"The Blood is in the water. The cuts no longer bring me down. Don't you even bother. I've seen enough to take you down. Love, hate, pride. bottled up inside. Let it go!. Gonna Let it go!. (BANG!). I'm feeling Superhuman. (BANG!). I'm invincible, I'm bulletproof. (BANG!). I'm at a revolution. (BANG!). I'm invincible, I'm bulletproof. (Don't you know I'm bulletproof?). The fight has made me stronger. I could never turn back now. Don't you point the finger. Your words no longer bring me down. I'm finally taking over. The truth has surfaced all around. The days of going under. Have risen up and can't be found. Love, hate, pride. bottled up inside. Let it go!. Gonna Let it go!. (BANG!). I'm feeling Superhuman. (BANG!). I'm invincible, I'm bulletproof. (BANG!). I'm at a revolution. (BANG!). I'm invincible, I'm bulletproof. (Don't you know I'm bulletproof?). (instrumental). Bulletproof!. Bulletproof!. (instrumental). Superhuman!. Revolution!. Love, hate, pride. bottled up inside. Let it go!. Gonna Let it go!. (BANG!). I'm feeling Superhuman. (BANG!). I'm invincible, I'm bulletproof. (BANG!). I'm at a revolution. (BANG!). I'm invincible, I'm bulletproof. (BANG!). I'm feeling superhuman. (BANG!). I'm invincible, I'm bulletproof. (BANG!). I'm at a revolution. (BANG!). I'm invincible, I'm bulletproof. Love, hate pride. bottled up inside!. Love, hate, pride. bottled up inside!. Love, hate, pride. bottled up inside!. Let it go!. Gonna Let it go!"
bury me,"Open your eyes and see what you find. This chance has passed us by. We're lost again. When I come to mind what do you see. A prison or paradise. Honestly I don't want to know. So bury me, bury me down. I dare you to make believe you're better now. I dare you to. I think of the times that I saw you cry. A pain with no alibi. We lost control. But I'd rather die than go through this life. Knowing that I'm to blame. Honestly time won't change a thing. So bury me, bury me down. I dare you to make believe you're better now. I dare you to bury me, bury me down. I dare you to make believe you're better now. I dare you to. All this pain has pulled me under. All this pain has run me to the end. So bury me, bury me down. I dare you to make believe you're better now. I dare you to bury me, bury me down. I dare you to make believe you're better now. I dare you to. Open your eyes. See what you find"
crash,As I lie tossing in my bed. Lost in my fears remembering what you said. And I try to hide the truth within. The mask of myself shows its face again. Still I lie time and time again. Will you deny me when we meet again?. And I feel like I'm falling. Farther every day. But I know that you're there. Watching over me. And I feel like I'm drowning. The waves crashing over me. But I know that your love. It will set me free. As I find truth where I found it times before. As I search for your hope. I'm finding so much more. And I try to be more like you. And I deny myself to prove my heart is true. And I feel like I'm falling. Farther every day. But I know that you're there. Watching over me. And I feel like I'm drowning. The waves crashing over me. But I know that your love. It will set me free. I hear your voice calling. The time has come for me. Inside this life I'm living. There's nothing left for me. My mind is slowly fading. So far away from me. Each time I start crawling. You're there watching me. And I feel like I'm falling. Farther every day. But I know that you're there. Watching over me. And I feel like I'm drowning. The waves crashing over me. But I know that your love. It will set me free. . Por: @rafael_lm
disappear,"Paint a perfect picture of. Everything I thought that this would be. But here's the truth. Its never easy. Strike a match. And light the fuse. As everything we were. Goes up in flames. And here's the truth. It's gonna kill me. Facing all my demon. Leaving all behind. I see now you're the reason. I don't wanna be here,. So I will move on. I'll be the last one. Standing. And I tasting your tears,. Now you're drowning your sorrows. And I'll just disappear. Tearing all your pictures of. All that's left of wasted memory. Of me and you. And this bitter ending. There must be a thousands ways. That we could watch our world come crashing down. But we found one. That's gonna kill me. Facing all my demon. Leaving all behind. I see now you're the reason. I don't wanna be here,. So I will move on. I'll be the last one. Standing. And I tasting your tears,. Now you're drowning your sorrows. And I'll just disappear. If I stay here with you. The only thing that I'll lose is me. So I gotta let go, I gotta let go. If I stay here with you. The only thing that I'll lose is me. So I gotta let go, I gotta let go. I don't wanna be here,. So I will move on. I'll be the last one. Standing. And I tasting your tears,. Now you're drowning your sorrows. And I'll just disappear. Dont wanna here. So I'll just disappear. I'm not, I won't came back,. I'm not, I'm never coming back. So I'll just disappear"
drowning in me,"Sometimes I feel so alone. Like a kid without a name. Despite all the scars that I let show. No one really knows my face. Because happiness is the mask. I choose to wear this time. To hide the hurt below. Cause there's a fire. That burns so deep inside. And the flames that rage. Are fueled by my pride. Yes, I need to let go. Of this consuming lie. But the bottle in my hand. Will get me through the night. In my life. I've walked down that road. Now I've go nowhere to go. I've going to be someone someday. But I might just have to wait. Because happiness is the mask. I choose to wear this time. To hide the hurt below. Cause there's a fire. That burns so deep inside. And the flames that rage. Are fueled by my pride. Yes, I need to let go. Of this consuming lie. But the bottle in my hand. Will get me through the night. It's drowning in me"
enemy,"See you look at me. With a look in your eyes. Like you've got an enemy in your sights. Now, I do not believe. This war will be over until you're forced to see. just how wrong you are. So you think you know who I am. You ain't seen nothin' yet. Back against the wall. Your guard begins to fall. But there's no sympathy. You're the enemy. You're my enemy. You're wanting to believe. I'm scared of what's coming. But I begin to see that you're weak. Now, don't show your teeth to me. It won't hide the fears. that are growing underneath. Your see-through pride. So you think you know who I am. You ain't seen nothin' yet. Back against the wall. Your guard begins to fall. But there's no sympathy. You're the enemy. You're my enemy. So you think you know who I am. You ain't seen nothin' yet. Back against the wall. Your guard begins to fall. But there's no sympathy. You're the enemy. You're my enemy. Time and time again. You push me to the end. But I feel better now. So much better now. So much better. You're my enemy!"
eric's song,Sometimes I feel like I am so far away. I'm lost inside my thoughts and I don't know what to say. I know I need you now more every day. I push I pull I run so far away. And I'll sick and tired of living this way. Sick and tired of being alone. Sick and tired of running from your love. Sometimes I feel like I am so far away. I'm lost inside my mind won't you help me find my way. And I know I need you now more every day. I push I pull I run so far away. And I'll sick and tired of living this way. Sick and tired of being alone. Sick and tired of running from your love. And I'll sick and tired of living this way. Sick and tired of being alone (x3). And I'll sick and tired of living this way. Sick and tired of being alone. Sick and tired of running from your love. Well I'm sick sick sick and tired baby
