panis angelicus,"Panis angelicus. fit panis hominum;. Dat Panis caelicus. figuris terminum. O res mirabilis!. manducat Dominum. Pauper, Pauper. servus et humilis. Pauper, Pauper. servus, servus et humilis. Translation. O Lord most Holy, O Lord most Holy. O loving Father, Thee would we be praising always. Help us to know Thee know Thee and love Thee. Father, Father, grant us Thy truth and grace;. Father, Father guide and defend us. Rule Thou our willful hearts,. Keep Thee our wand'ring thoughts. In all our sorrows let us find our rest in Thee. And in temptation's hour, Save through Thy mighty pow'r. Thine aid O send us; Hear us in mercy. Show us Thy favor So shall we live and sing praise. To Thee"
pedestal,"You're the coolest person. That I have ever seen. So perfect with your pretty face. On the TV screen. You're a god I know it. How you stand above them all. You are my perfect person. Man I'd hate to see you fall. Chorus. I want someone to believe in. Yeah well don't we all. In this life of imperfection. I need someone who won't fall. You got it, you got it, you got it all (2x). . Got a magazine today. That was full of you. Shocked to read the words they said. Tell me they're not true. Add you to my fallen list. One more has hit the ground. The fault was mine. I held you too high. Your only way was down. Chorus. Bridge. I can't deny this need inside. I have to find the perfect one. But I wonder if behind my need. There might just be a reason. Is my life just one big searching. For the one I can adore?. It never works. And I'm just left here wanting more. Could it be this hunger's there. To drive me to the one. Who's worthy of all worship?. Would my searching then be done?. Chorus"
porcelain heart,Broken heart. One more time. Pick yourself up. Why even cry?. Broken pieces. In your hands. Wonder how you'll make it whole. You know. You pray. This can't be the way. You cry. You say. Something's gotta change. And mend this porcelain heart. Of mine. Of mine. Someone said. A broken heart. Would sting at first. Then make you stronger. Wonder why this pain remains. Were hearts made whole just to break?. You know. You pray. This can't be the way. You cry. You say. Something's gotta change. And mend this porcelain heart. Of mine. Creator. Only You take brokeness. And create. It into beauty once again. You know. You pray. This can't be the way. You cry. You say. Something's gotta change. You know. You pray. This can't be the way. You cry. You say. Something's gotta change. And mend this porcelain heart. Please mend this porcelain heart. Of mine. Of mine. Creator. Mend this heart
psalm 73,"I've had enough of living life for only me. And reaching just for the things that keep destroying me. So sick of envying the lives of so many I see. Somehow believing that they have what I need. My God's enough for me. This world has nothing I need. In this whole life I've seen. My God's enough, enough for me. I can't explain why I suffer. though I live for You. Those who deny You they have it better than I do. Cover my eyes now so that my heart. can finally see. That in the end only You mean anything. Who have I in heaven but You. Nothing I desire but You. My heart may fail but not You. You are mine forever"
psalm 73 (my god's enough),"I've had enough of living life for only me. And reaching just for the things that keep destroying me. So sick of envying the lives of so many I see. Somehow believing that they have what I need. REFRÂO:. My God's enough for me. This world has nothing I need. In this whole life I've seen. My God's enough, enough for me. I can't explain why I suffer though I live for You. Those who deny You they have it better than I do. Cover my eyes now so that my heart can finally see. That in the end only You mean anything. (REFRÃO). Who have I in heaven but You. Nothing I desire but You. My heart may fail but not You. You are mine forever.. (REFRÃO)"
running out of time,"We are not blind, we know the truth,. still we won't stand, still we don't choose. we'd rather stay, so comfortable,. stuck in our world, that's under control. We may not pull the trigger but. we stand by and watch, then pretend not to see. silence is worse than evil done. what in the world have we become... (pre chorus). can't you seeee. (Chorus). That this is a war, so pick your side. It`s time to move not time to hide. Don't let lies make up your mind. cause can't you see, we`re running out of time. tomorrow will come, and one day we'll see,. the choices we made, made history.. Before it's too late, find where you stand,. so let's use our voice, while we still can. (pre chorus). can't you seeee. (Chorus). That this is a war, so pick your side. It`s time to move not time to hide. Don't let lies make up your mind. cause can't you see, we`re running out of time. God we`re crying let us feel again (2x). God we cry let us feel again"
she walked away,"She couldn't take one more day. Home was more her prison now. Independence called out. She had to get it. A fight was all she needed. To give her reason. She slammed the door with no goodbye. And knew that it was time. Now she's driving to fast. She didn't care to glance behind. And through her tears she laughed. It's time to kiss the past goodbye. I'm finally on my own. Don't try to tell me no. There's so much more for me. Just watch what I will be. Chorus. She walked away. Couldn't say why she was leaving. She walked away. She left all she had believed in. Not a day goes by. For the ones she's left behind. They're always asking ""why?"". And thoughts of her consume their mind. God please let her know. The love we tried to show. We'd promise anything. If you'd just bring her home. Chorus. Bridge. Tell her we love her. Tell her she's wanted. And one more thing God. Tell her please, come home. Please, come home. Chorus (2x). The choice is yours alone now. Tell me how this story....ends"
sing me a love song,The tension is thick in the air. Making it hard to see. I fear what is to come. And what will become of me. I say a prayer help me not run away. Will you please hold me. And sing me a love song again. Say the words that heal my heart. sing me a love song and then. Let your words remind me who I am. You've never failed me before. Why do I feel betrayed. If I close my heart to you now. The darkness would have its way. I crave your voice help me not fall away. Will you please hold me. 'Cause you are all I need. And all that I want is you with me. You are all I need. And all that I want is you with me
song for the broken,"I am the comfortable secure. The definition of this western world. And I have perfected deceit Even. I believe I'm above saving. I'll never let You see. I am the broken. I am the bruised. I am the poor ones. I have been used. It takes me falling to the ground. To admit to fully needing You. Then when I'm breathing my last breath. ""Come and save me"" I will cry to You"
stay with me,(Verse 1). And hope is getting though this night. and life is not dying in this fight. begging you to deliver me. confused why you won't take this pain from me. (Pre Chorus). my steps never felt so hard. the end never looked so far. If you won't take me out then please take me through this. (Chorus). So stay with me. so I won't leave. and make me see. that this is not forever. cause all I need is your love... pulling me. (all I know is you won't let me go). (Verse 2). What is the reason for this night. is hope found in moments with no light. does strength grow in our greatest fears. God I pray something good will come from this pain. (Pre Chorus). my steps never felt so hard. the end never looked so far. If you won't take me out then please take me through this. (Chorus). So stay with me. so I wont leave. and make me see. that this is not forever. cause all I need is your love... pulling me. (all I know is you won't let me go). (Bridge). With you here I know. I don't go alone. I am yours and so. Through the fire I go....
superchick,We met these sisters Barlow's their last name. Ordinary girls they don't live in lane. They don't rate with the guys that score cause they. don't flaunt what the boys what more. They don't date they won't date. They wanna see how they're gonna grow up. Who they're gonna be in the meantime. They might feel unloved when all the girls around them. are hooking up. But I know for sure it's never popular to be pure. And while some guys might be passing them by. I think they've caught someone's eye. (CHORUS). All the boys in the bad want a valentine from a Barlow. Girl. Boys think they're the bomb. Cause they remind them of their mom. Everyone needs to be loved. Everyone needs their own teenage fan club. Any attention can feel like a good thing. Dress to impress can be oh so tempting. You get noticed with your body. Sexual hypnosis by being hottie you might. Fell like public property. You might you might you shouldn't be no girl should. feel she has to trade her body. For love or be an old maid and yes there are guys who. are willing to wait. Ask a Barlow girl on her wedding day
superstar,"Well, I spent my life dreaming super dreams.. But I hate to wake cause it's then I see. That I'm nothing more than a dreamer.. Superstar in my dreams, I'm a dreamer.. See the lights of stardom were calling me. Because only then someone I would be.. So my goal in life was to get there. Never satisfied. Chorus. I wanna be a star. But is that all I'm really here for?. And if I'm not a star, will it be ok?. Could I still be someone?. Guess I'm scared to wake from these super dreams. Scared to live the life that's been waiting for me. What would life be like with no bright lights?. Tell me who I'd be with no spotlight?. God you'll have to say who I really am. Cause I can not live in this perfect dreamland.. But I've heard your dreams might be better. And I hope somehow they are. Chorus. Bridge. A superstar I may never be. And that is just a reality. Why can't we be. God's superstars?"
surrender,"My hands hold safely to my dreams. Clutching tightly not one has fallen.. So many years I’ve shaped each one. Reflecting my heart, showing who I am.. Now you’re asking me to show. What I’m holding Oh so tightly.. Can’t open my hand; can’t let go. Does it matter?. Should I show you?. Can’t you let me go?. Chorus. Surrender, surrender. You whisper gently. You say I will be free. I know but can’t you see. My dreams are me, My dreams are me. Say you have a plan for me. And that you want the best for my life.. Told me the world has yet to see. What you can do with one. That’s committed to your call.. I know of course what I should do. That I can’t hold these dreams forever.. But if I give them now to you. Will you take them. Away forever? Or can I dream again"
sweet revenge,"Did you see that I was hurt. Did you know that you had left me crying there. Now I’m holding all your words close till you feel this pain too, yeah. You live on so unaware. While I thought somehow this hate would heal me. But this hate is never ending and it’s only killing me. Oh sweet revenge you’ve lied again. I find I can’t get free till I release this vengeance that I seek. Forgive you, the only thing I want to live I’m ready to be free, to be free. Maybe you’ve been wounded too. Maybe all this is your self-protection. And all the hurts you thought were hidden. Are the ones now hurting me. So who will make this pattern end. I find I can’t get free till I release this vengeance that I seek. Forgive you, the only thing I want to live I’m ready to…. Break these chains. Won’t see this through. ‘Cause setting you free. It means my freedom too. Freedom too. I find I can’t get free till I release this vengeance that I seek. Forgive you, the only thing I want to live I’m ready to be free, to be free"
take me away,"Pushing my way through these crowded streets. Trying not to be swept away. Fighting just to keep this crowd from. Hiding You another day. So maybe this time I'll find You. And maybe this time I'll push through. To see You today, today. REFRÃO:. Won't You take me away. Won't You take me away. 'Cause I need some time to get away. Where only You could ever. Take me away, away, away. Too many days I've been distracted. Watched these crowds push You away. I'm so tired of feeling empty. Without You I waste these days. So maybe this time I'll find You. Just don't stop calling me to You. And I'll find my way today."
take my chances,"I’ve bowed out from this. Can I say I’m sick. And now it’s time for me to stand up and make you hear me. This world you rob innocence you never gave us a chance. We were born believing you had all the answers for me. Look out you will find out. That here I am so far from then so. I take my chances. And I don’t live for you. And I’ll say what I have to. So who cares (who cares). Who cares (who cares). Who cares what I prove. If we don’t speak who will. If we don’t fight we’re still. Stuck without a voice and we are tired of being silenced. Look out you will find out. That here I am so far from then so. I take my chances. And I don’t live for you. And I’ll say what I have to. So who cares (who cares). Who cares (who cares). Who cares what I prove. We are set apart (we are set apart). We’ve been chosen now (we are chosen now). We are children of God. So what holds us back. What’s holding us back, yeah. So I take my chances. And I don’t live for you. And I’ll say what I have to. So who cares (who cares). Who cares (who cares). Who cares what I prove"
tears fall,I have had the same dreams many times it haunts my mind. It starts with a light but it ends every time. Oh so many faces that this world will never see. A reason for your life but your heart will never beat. May our tears fall down. Let them soften this ground. May our hearts be found. God forgive us now. Oh what have we lost because we chose we'll never know. And loving you is better than feeling alone. And all our claims to freedom have become these heavy chains. And in the name of rights we keep filling nameless graves. Let the tears fall down. Let them soften this ground. Let our hearts be found. God forgive us now. Oooh
the guy song,"Where would we be today if no man ever had strength to believe yeah yeah. If no man had a vision further than their eyes could ever see yeah yeah yeah. They are the one’s who paved the way. To show you how you have been made for more, yeah. This is your day don’t let them take it away yeah yeah. This is your day don’t let them take it take it. This is your day don’t let them get in your way yeah yeah. This is your day so come on take it take your day. This world distracts you lies to you and hopes to keep you from your call yeah yeah. But don’t be fooled ‘cause don’t you see that you can stand up to it all yeah yeah. You’re unashamed, you’re unafraid to. Give up your life to serve the one who’s called you. This is your day don’t let them take it away yeah yeah. This is your day don’t let them take it take it. This is your day don’t let them get in your way yeah yeah. This is your day so come on take it take your day yeah. This is your day don’t let them take it away yeah yeah. This is your day don’t let them take it take it. This is your day don’t let them get in your way yeah yeah. This is your day so come on take it take your day"
thoughts of you,"Thoughts of You and how. You changed me. Fill my mind. Without You where would I be. So even though I've tried to express my thanks. It never comes out how I hoped. I want to say so much more so with these simple words. I'll try. Chorus. I love You. My heart is Yours, only Yours. I long to give You all of me. My everything, my everything. God I never could repay You. You gave everything. Without You where would I be. You still loved me even when I. Pushed You away. You stood there and waited. Till the day I'd return"
time for you to go,"I hope you don't mind. That I know your life. Because I read it every day. And all of your faults. Make me feel so good. Because the media stole my brain. It's so nice to have someone tell me what to think. What is it for, do we want more, do we want more?. And on and on it goes 'till all of us are sucked in.. So shut it off and see we're missing out on living. I am so done. Listening to you. Time for you to go. Time for you to go, whoa. I refuse give one more day to you. Time for you to go. Time for you to go, whoa. No more wasting my life. On this world's addiction. Time for me to take. You to find your place. I am letting go. Time for you to go. Isn't it nice to know. That the media will sway our votes. 'Cause seriously we've got to see. That they choose what we know. Our morals get thrown away. For the next big thing we've got to see. What is it for, do we want more, do we want more?. And on and on it goes till all of us are sucked in. So shut it off and see we're missing out on living. I am so done. Listening to you. Time for you to go. Time for you to go, whoa. No more wasting my life. On this world's addiction. Time for me to take. You to find your place. I am letting go. Time for you to go. We're missing out on His voice. We've traded God for ashes. We've got to think for ourselves. Where's our passion?. I am so done. Listening to you. Time for you to go. Time for you to go, whoa. No more wasting my life. On this world's addiction. Time for me to take. You to find your place. I am letting go. Time for you to go"
we pray,"We Pray. Words & Music by: Clint Lagerberg and Otto Price. . For the tired and the weary. Lost and confused. Hopeless and needy. With nothing to lose. For those who are falling. Or have already fallen away. Our hearts are exploding. With compassion and love. For a world that is crying. To be lifted up (oh...). (Chorus). We pray. Humbly we seek Your face. Broken yet unafraid. We leave it all in Your hands. We trust that You'll heal our lands. And know that You'll hear us when. We pray. Peace and forgiveness. For the nations at war. Strength in their weakness. When they can fight no more. Mercy, redemption, healing. And for You to be Lord of all. . Our hearts are exploding. With compassion and love. For a world that is crying. To be lifted up (oh...). . (Bridge). Father in Heaven. The Giver of life. Your Kingdom forever be glorified. We pray you will unite us. And heal our divide. We bow down before You. Oh Lord hear our cry (as)"
what child is this?,"What child is this who laid to rest. On Mary's lap is sleeping. Whom angels greet with anthems sweet. While shepherds watch are keeping. This, this is Christ the King. Whom shepherds guard and angels sing. Haste, haste to bring him laud. The babe, the son of Mary. Why lies he in such mean estate. Where ox and lamb are feeding. Good Christian fear, for sinners here. The silent Word is pleading. This, this is Christ the King. Whom shepherds guard and angels sing. Haste, haste to bring Him laud. The babe, the son of Mary. So bring Him incense, gold, and myrrh. Come peasant king to own Him. The King of kings, salvation brings. Let loving hearts enthrone Him. This, this is Christ the King. Whom shepherds guard and angels sing. Haste, haste to bring him laud. The babe, the son of Mary"
you led me,"Good morning. The night is over and gone. I thought once. This dark would last for so long. Pre Chorus. Feel the sunlight. On my face. You have brought me. Through this place. Chorus. Jesus, Jesus You found me. Through the long night you led me. You set me free. Do you see. Just what you've done in my life?. You gave me. More then I hoped for; now I. Pre Chorus. feel your sunlight. On my face. You have brought me. Through this place. Chorus. Pre Chorus. Chorus"
you're worthy of my praise,"I will worship, with all of my heart. I will praise you, with all of my strength. I will seek you, all of my days. I will follow, all of your ways. *refrao*. I will give you, all my worship. I will give you, all my praise. You alone, I long to worship. You alone, are worthy of my praise. I will bow down, and I'll hail you as king. I will serve you, I will give you everything. I will lift up my eyes to your throne. I will trust you, I will trust you alone. *refrão*(2x). i will worship (i will worship). i will bow down ( i will bow down). i will give you ( i will give you). worthy of my praise(4x). *refrão*(2x). You are worthy of my praise"
