for the beauty of the earth,"For the beauty of the earth,. For the glory of the skies;. For the love which from our birth,. Over and around us lies;. Lord of all, to Thee we raise. This, our hymn of grateful praise.. For the wonder of each hour,. Of the day and of the night;. Hill and vale and tree and flow'r,. Sun and moon, and stars of light;. Lord of all, to Thee we raise. This, our hymn of grateful praise.. For the joy of ear and eye,. For the heart and mind's delight;. For the mystic harmony,. Linking sense to sound and sight;. Lord of all, to Thee we raise. This, our hymn of grateful praise.. For the joy of human love,. Brother, sister, parent, child;. Friends on Earth and friends above,. For all gentle thoughts and mild;. Lord of all, to Thee we raise. This, our hymn of grateful praise."
"go, tell it on the mountain","Go, tell it on the mountain,. Over the hills and everywhere. Go, tell it on the mountain,. That Jesus Christ is born. The shepherds feared and trembled,. When lo! above the earth,. Rang out the angels chorus. That hailed the Savior's birth. Go, tell it on the mountain,. Over the hills and everywhere. Go, tell it on the mountain,. That Jesus Christ is born. Down in a lowly manger. The humble Christ was born. And God sent us salvation. That blessèd Christmas morn. Go, tell it on the mountain,. Over the hills and everywhere. Go, tell it on the mountain,. That Jesus Christ is born. Joyful, Joyful. Lord, we adore Thee. God of glory. Lord of love. Hearts unfold like flowers before Thee. Hail Thee as the sun above. Melt the clouds of sin and sadness. Drive the dark of doubt away. Giver of immortal gladness. Fill us with the light. Fill us with the light. Oh, fill us with the light of day.... Ain't that good news"
grey,"Grey's my favorite color. Black and white has never been my thing. I'll take my drink lukewarm now. Hot and cold is not the thing for me. Absolutes are hidden. I've buried my convictions. REFRÃO:. I can not be blind no more. Numb to what I'm living for. Help me stop this compromise that justifies these. lies. I need Your passion in this life, in this life. I don't want to impose. Who really needs to know what I believe. Cause no one likes rockin' boats. And who would care to see the way I see. Absolutes are hidden. I've buried my convictions. REFRÃO. So give me the fire, yeah. God give me Your fire. And raise this life higher.. REFRÃO 2x. Grey is my favorite color."
hallelujah (light has come),"Hmmm my Baby. Heaven sent you to me. All the world's been praying. Who will Save?. But who am I. That here tonight. I hold the one. Who'll Bring us life. Hallelujah,. We've been found. A child is born. To save us now. Hallelujah light has come. A Savior who will set us free. A Promise for those who believe. Do you hear the Angels. Sing for you my baby. Men and kings have come to. Bow to you. But here in my arms. So close to me. The son of God. Now all can see. Hallelujah We've been found. A child is born to save us now. Jesus Halleluiah light has come. A savior set us free. So praise to God on high. He has heard our cry"
harder than the first time,"I walked with you. Just like we've done for so long. You seemed so near. But even that's become so common. It's not just you, just been together so long. That I thought I knew everything about you. But today I saw; did you open up my eyes?. 'Cause I feel like I've just seen you for the first. time. Chorus. I didn't see you. But God I want to. You've come alive. and I think I've fallen harder than the first time. Was I so blind; how did I not see you?. Yet in all that time you never left my side. So for all my life, I will live to know you. So here I am; I'll take your hand. Chorus. (Bridge). I see your face; I feel you close. The love you've always shown me. Won't miss it now, can't waste a day. Jesus I'm yours completely. Chorus"
have yourself a merry little christmas,"Have yourself a merry little Christmas,. Let your heart be light. From now on,. our troubles will be out of sight. Have yourself a merry little Christmas,. Make the Yule-tide gay,. From now on,. our troubles will be miles away. Here we are as in olden days,. happy golden days of yore. Faithful friends who are dear to us. gather near to us once more. Through the years we all will be together. If the Lord allows. Hang a shining star upon the highest bough. And have yourself a merry little Christmas now"
hello sunshine,Hello sunshine it's been too long. since I felt your warmth upon my face. And how much have I missed. 'Cause I've been focused on everything wrong. This road just felt so long. I forgot to lift my head to see you. Oh my lovely shining for me. Let my eyes see all the beauty. Oh-oh. Hello sunshine since the moment. That I felt your beautiful warmth. I knew that I'd do anything. To keep this feeling of you. My heart comes alive. Oh who could add a day to this life. By drowning every dark sky. Oh my lovely shining for me. Let my eyes see all the beauty. Oh-oh. Fill my dark skies. Make me see the light. Life is fine so bring in the sunshine. Oh-oh. Whoa-oh let in the sunshine. Whoa-oh let in the sunshine. Whoa-oh let in the sunshine. Let in the sunshine
here's my life,Once again I said my goodbyes. To those I love most. My heart feels that familiar pain. As I long for home. ‘Cause this road is hard. When I feel so far. And God I’m crying out tonight. ‘Cause I’ve given you my life. But I’m tired and I’m missing what’s behind. So once more- here’s my life. On the day that you called my name. All that I knew changed. I found when I said yes that I’d. Never be the same. Though the call is hard. You are worth it all. God I’m cryin’ out tonight. ‘Cause I’ve given you my life. But I’m tired and I’m missing what’s behind. So once more. Even when the tears are fallin’. When I find I fear the calling. You remind me. Words you’ve spoken over my life. Promises I’ve yet to see. You comfort me. Yeah yeah. You comfort me. Yeah. You comfort me. Yeah. You comfort me. God I’m cryin’ out tonight. ‘Cause I’ve given you my life. But I’m tired and I’m missin’ what’s behind. So once more. God I’m cryin’ out tonight. ‘Cause I’ve given you my life. But I’m tired and I’m missin’ what’s behind. So once more – here’s my life. Here’s my life .
hope will lead us on,Shake off the shadows. Unlock the doors. And let hope live once more. 'Cause up from the ashes. A fire is woken. 'Cause those who are broken. Are becoming the chosen. So lift up your eyes. 'Cause we're not forgotten. And hope will lead us on. Our hearts come alive. With every moment. Become the flame. That shows us the way. So sing out your freedom. Sing it out loud. 'Cause though we are broken. We're becoming the chosen. So lift up your eyes. 'Cause we're not forgotten. And hope will lead us on. Oh we pray for the dawn. And we reach for the morning. And hope will lead us on. Oh the day will come. As we press on. When the battle's won. So lift up your eyes. 'Cause we're not forgotten. And hope will lead us on. Oh we pray for the dawn. And we reach for the morning. And hope will lead us on. And hope will lead us on. And hope will lead us on
i believe in love,"How long will my prayers seem unanswered. Is there still faith in me to reach the end. I’m feeling doubt I’m losing faith. But giving up would cost me everything. So I’ll stand in the pain and the silence. And I’ll speak to the dark night. I believe in the sun even when it’s not shining. I believe in love even when I don’t feel it. And I believe in God even when He is silent. And I, I believe. Though I can’t see my story’s ending. That doesn’t mean the dark night has no end. Its only here that I find faith. And learn to trust the one who writes my days. So I’ll stand in the pain and the silence. And I’ll speak to the dark night. I believe in the sun even when it’s not shining. I believe in love even when I don’t feel it. And I believe in God even when He is silent. And I…. No dark can consume Light. No death greater than this Life. We are not forgotten. Hope is found when we say. Even when He is silent. I believe in the sun even when it’s not shining. I believe in love even when I don’t feel it. And I believe in God even when He is silent. And I, I believe"
i belong to you,"Everybody needs to belong somewhere. Life can feel so alone without someone who cares. And when life becomes something just to get through. That's when I'm glad that I belong to you. CHORUS:. I belong to you. I belong to you. You're the one who would never let me down. Won't let me down. I belong to you. Sometimes life brings more pain than we can bare alone. And hope is gone and I have no strenght to stand on my own. But nothing helps, there's nothing that I can do. You surround me and show me I belong to you. [CHORUS]. And love is gone, there's no arms to run to anymore. I'm all alone, there's no one for me to live for. Letting go of the things I've always come to. That's when I need to feel that I belong to you. [CHORUS]"
i don’t regret,They’re telling me they’re concerned for the way I am living. That I’ll miss it all why would I think that God is that trusting. I can’t explain all the words He has spoken to my heart. Why I’d want him more. And I don’t regret choosing you. And I’m not ashamed. That it’s you who holds my heart. Why do we think if we trust God too much He will fail us. Nothing has come when I chose that in me I’d trust. Separate me you have called out to follow you blindly. I won’t fear you’re leading me. And I don’t regret choosing you. And I’m not ashamed. That it’s you who holds my heart. You have shown my ever wandering heart what love is. What on earth is more important than to have all of you. And I don’t regret choosing you. And I’m not ashamed. That it’s you who holds my heart. My heart
i need you to love me,"Why, why are You still here with me. Didn't You see what I've done?. In my shame I want to run and hide myself. But it's here I see the truth. I don't deserve You. But I need You to love me, and I. I won't keep my heart from You this time. And I'll stop this pretending that I can. Somehow deserve what I already have. I need You to love me. I, I have wasted so much time. Pushing You away from me. I just never saw how You could cherish me. 'Cause You're a God who has all things. And still You want me. And I need You to love me, and I. I won't keep my heart from You this time. And I'll stop this pretending that I can. Somehow deserve what I already have. yeah, yeah. Your love makes me forget what I have been. Your love makes me see who I really am. And Your love makes me forget what I have been. And I need You to love me, yeah. I need You to love me, yeah. And I'll stop this pretending that I can. Somehow deserve what I already have (2x). I need You to love me, yeah ..."
i'll be home for christmas,I'm dreamin' tonight of a place I love. Even more then I usually do. And although I know it's a long road back. I promise you. I'll be home for Christmas. You can plan on me. Please have snow and mistletoe. And presents round the tree. Christmas Eve will find me. Where the love light gleams. I'll be home for Christmas. If only in my dreams. I'll be home for Christmas. You can plan on me. Please have snow and mistletoe. And presents round the tree. Christmas Eve will find me. Where the love light gleams. I'll be home for Christmas. If only in my dreams. Please have snow and mistletoe. And presents round the tree. Christmas Eve will find me. Where the love light gleams. I'll be home for Christmas. If only in my dreams. Christmas Eve will find me. Where the love light beams. I'll be home for Christmas. If only in my dreams. If only in my dreams
image of god,"When my beauty fades away and all I see is gone. Reflection in my mirror doesn't please you anymore. What will be left within me. You promise me eternal bliss. Never ending happiness. If I'd only look and play the right part. But, Now look what's been left in me. Tell me why do I Why do I try. Try so hard to please you. Can you promise me, In a few years. You will even remember my name. Chorus:. And I am made in the image of God. I am loved for who I am. Your flashy Magazines & & billboards always scream. Your worth don't lie within, it's how you look it's how you dress. It's who you know. But, That's a deadly trap. I'm breaking all your rules and getting off your path. Cause I have come to see that where it leads is only heartbreak and shame. And who could be satisfied with that.. Tell me why do I Why do I try. Try so hard to please you (Yeah). Can you promise me, In a few years. You will even remember my name. Chorus:. And I am made in the image of God. I am loved for who I am. And though I may not please your eyes But always know, that. It's in me that God takes delight. Takes delight (la la la)"
it's the most wonderful time of the year,"It's the most wonderful time of the year. With the kids jingle belling. And everyone telling you ""Be of good cheer"". It's the most wonderful time of the year. It's the hap-happiest season of all. With those holiday greetings and gay happy meetings. When friends come to call. It's the hap- happiest season of all. There'll be parties for hosting. Marshmallows for toasting. And caroling out in the snow. There'll be scary ghost stories. And tales of the glories of. Christmases long, long ago. It's the most wonderful time of the year. There'll be much mistltoeing. And hearts will be glowing. When love ones are near. It's the most wonderful time of the year. There'll be parties for hosting. Marshmallows for toasting. And caroling out in the snow. There'll be scary ghost stories. And tales of the glories of. Christmases long, long ago. It's the most wonderful time of the year. There'll be much mistltoeing. And hearts will be glowing. When love ones are near. It's the most wonderful time. It's the most wonderful time. It's the most wonderful time. It's the most wonderful time of the year"
keep quiet,"Oh the things I've been sacrificed. So that I could bring You to this world. I want them to see You in me. But Your name just keeps them far from me. So I'll keep quiet. Let's hope they see I'm different. Jesus, Jesus how Your name offends us. Why are we so scared to tell this world You've saved us. When all of the hope of the world's in Your name. Why are we so scared to say. Oh Jesus. If I avoid to speak Your name. Tell me would You do the same to me. If relevance becomes my goal. Tell me will I lose You to its hold. Bus if I keep quit they'll never see I'm different. Jesus, Jesus how Your name offends us. Why are we so scared to tell this world You've saved us. When all of the hope of this world's in Your name. Why are we so scared to say. Oh Jesus. I'm sorry I've cared about my name more than Yours. I'm so sorry how could I hide You anymore. But if I keep quiet. They'll never see I'm different. Jesus, Jesus how Your name offends us. Why are we so scared to tell this world You've saved us. When all of the hope of the world's in Your name. Why are we so scared to say. Oh, Jesus"
let go,"Let Go. Yeah I trust in you. I remember times you. Lead me, this time it's. Bigger now, and I'm. Afraid you'll let me down.. But how can I be certain?... Will you prove yourself again.... Chorus:. 'Cause I'm about to let go. And live what i believe. I can't do a thing now, but. Trust that you'll catch me. When I let go, when I let go.... What is this doubt in me. Convincing me to fear the. Unknown, when all along you've. Shown, your plans are better. Than my own, and I know I won't. Make it, if I do this all alone. chorus:. 'Cause I'm about to let go. and live what I believe. I can't do a thing now but. Trust that you'll catch me,. When I let go...let go..(x3). . when I let go,when I let go. when I let go.. let go..(yeah)"
love is marching,"I was told when I was young. that anyone could change the world. It wouldn't come by power or strength... but through the ones who choose to love. Chorus. Cause every one will pass. And when we've breathed our last...... can we say. we have lived for more. and did we live to die for. lo.. lo... love. Can you feel His heart beating. the sound of love that`s marching on. and when our hearts begin to break. along with His, this world will change. Chorus. Cause every one will pass. so when we breathe our last...... can we say. we have lived for more. and did we live to die for. lo lo...love. Love is marching. to His heartbeat"
million voices,"Tell me who’d have thought that we would be so controversial. And stand against the normal yeah yeah. Are we too outspoken, loud, and messing up the comfortable. Well we’ve been messed up also yeah. How can we be silent. When a fire burns inside us. ‘Cause we’re a million strong and getting stronger still. They’ll remember we were here. With a million voices breaking silence till. They’ll remember we were here. We were made to start the riot, take on the impossible. And we will slay the giants. We are done with fake religion fighting now to find the movement. Won’t stop till we find it yeah yeah. How can we be silent. When a fire burns inside us. ‘Cause we’re a million strong and getting stronger still. They’ll remember we were here. With a million voices breaking silence till. They’ll remember we were here yeah. We’re a million strong and getting stronger still. They’ll remember we were here. With a million voices breaking silence till. They’ll remember we were here. We’re a million strong and getting stronger still. They’ll remember we were here. With a million voices breaking silence till. They’ll remember we were here. They’ll remember we were here. You will remember. Yes you’ll remember. You will remember. Yes you’ll remember"
mirror,"Mirror, Mirror on the wall; Have I got it?. 'Cause Mirror you've always told me who I am. I'm finding It's not easy to be perfect. So sorry, you won't define me. Sorry, you don't own me. Chorus. Who are you to tell me. that I'm less than what I should be?. Who are you? Who are you? Yeah.... I don't need to listen. to the list of things I should do. I won't try; no... I won't try. Mirror I am seeing a new reflection. I'm looking into the eyes of He who made me. To Him I have beauty beyond compare. I know He defines me. Chorus. You don't define me. You don't define me"
never alone,I waited for you today. But you didn't show. No no no.. I needed you today. So where did you go?. You told me to call. Said you'd be there. And though I haven't seen you. Are you still there?. Chorus. I cried out with no reply. And I can't feel you by my side. So I'll hold tight to what I know. You're here and I'm never alone. And though I cannot see you. And I can't explain why. Such a deep reassurance. You've placed in my life.. We cannot separate. 'Cause you're part of me.. And though you're invisible. I'll trust the unseen.. Chorus. I cried out with no reply. And I can't feel you by my side. So I'll hold tight to what I know. You're here and I'm never alone. We cannot separate. 'Cause you're part of me.. And though you're invisible. I'll trust the unseen.. Chorus. I cried out with no reply. And I can't feel you by my side. So I'll hold tight to what I know. You're here and I'm never alone
no one like you,"You are more beautiful than anyone ever. Everyday You're the same You never change no never. yeah, yeah. You are more beautiful than anyone ever. Everyday You're the same You never change no never. And how can I ever deny the love of my Savior. You are to me everything all I need forever. How could you be so good?. REFRÃO:. There is no one like You. There has never ever been anyone like You. Everywhere You are there earth or air surrounding. I'm not alone the heavens sing along. My God You're so astounding. How could You be so good to me. Eternally I believe that. (REFRÃO). How could You be so good to me. How could You be so good to me. We're not alone so sing along. We're not alone so sing along. Sing along, sing along. Here we go. (REFRÃO) (3x)"
"o come, o come, emmanuel","Oh, come, Oh, come, Emmanuel,. And ransom captive Israel. That mourns in lonely exile here. Until the Son of God appear. Rejoice! Rejoice! Emmanuel. Shall come to thee, O Israel. Oh, come, Thou Rod of Jesse, free. Thine own from Satan's tyranny;. From depths of hell Thy people save. And give them victory o'er the grave. Rejoice! Rejoice! Emmanuel. Shall come to thee, O Israel. Rejoice! Rejoice! Emmanuel. Shall come to thee, O Israel. Rejoice! Rejoice! Emmanuel. Shall come to thee, O Israel"
oh holy night,"O holy night,. the stars are brightly shining;. It is the night of. our dear Savior's birth!. Long lay the world. in sin and error pining,. Till He appeared. and the soul felt its worth.. A thrill of hope,. the weary world rejoices,. For yonder breaks. a new and glorious morn.. Fall on your knees,. O hear the angel voices!. O night divine,. O night when Christ was born!. O night divine, O night,. O night divine!. Truly He taught us. to love one another;. His law is love and. His gospel is peace.. Chains shall He break. for the slave is our brother. And in His name. all oppression shall cease.. Sweet hymns of joy in. grateful chorus raise we,. Let all within us. praise His holy name!. Christ is the Lord,. Oh praise His name forever,. His pow'r and glory evermore proclaim. His pow'r and glory. evermore proclaim.. Fall on your knees,. O hear the angel voices!. O night divine,. O night when Christ was born!. O night divine, O night,. O night divine!. gee^^"
on my own,"I can't believe that I'm here in this place again. How did I manage to mess up one more time?. This pattern seems to be the story of my life. Should have learned this lesson by the thousandth time.. 'Cause I promised myself I wouldn't fall. But here I've fallen. I guess I'm not as strong as I thought. All I can do is cry to you.. Chorus. Oh God you have to save me. You're my last and only hope. All my right answers fail me. I can't seem to make it on my own.. Always thought that I would be strong enough. What made all of them fall couldn't take me down. Yeah, did I think that I was above it all?. I have learned that pride comes before the fall. I can't promise myself that I won't fall. 'Cause here I've fallen. I know I'm not as strong as I thought. All I can do is cry to you.. Chorus. (break). Chorus"
one more round,"Round one wasn’t what I thought it’d be. Round two I’m struggling to breathe. 3,4,5,6,7 times I wonder why I stepped inside this ring. I may be knocked down and so bruised. But I’m here to tell you. I may be knocked down but not for the count- 1,2,3, 4. So take me one more round. I’ll just keep fighting. One more round. You messin’ me up but I’m still here. One more round. I’ll come out swinging. One more round. I’m telling you now I’m not gonna lose it here, yeah. It’s so hard to get up off the floor again. But I know that victory is when. I’m pushing through the pain that tries to feed me lies that I won’t reach the end. I may be bloodied and so bruised. But I’m here to tell you. That I may be knocked down but not for the count- 1,2,3, 4. So take me one more round. I’ll just keep fighting. One more round. You messin’ me up but I’m still here. One more round. I’ll come out swinging. One more round. I’m tellin’ you now I’m not gonna lose it. I am not defeated. Though you cannot see it. I have never won a battle on my own. I find strength in weakness. I find hope believing. God is for me- who can bring me down?. So take me one more round. I’ll just keep fighting. One more round. You messing me up, oh, but I’m still here. One more round. I’ll come out swinging. One more round. I’m telling you now I’m not gonna lose it here. here"
open heavens,"A cry rises from the ground. As all the earth begins to shake. Can you feel the spirit move you?. Calling all hearts to wake. Life is rising from these graves. A voice breaks the silence. And warms the dying heart. Oh, this is just the start cause. We will open heavens. And we'll start the flame now. All the earth will shake now. As we scream Your name. Our eyes, heaven opened wide. and passion filling every place. Now's the time. So let it him move you. Cause some things are about to break. We are falling on our face. Searching for movement. Give us fire in these days. Oh spirit, lead the way cause. We will open heavens. And we'll start the flame now. All the earth will shake now. As we scream Your name. Woah.... Cause we will open heavens. And we'll start the flame now. All the earth will shake now. As we scream Your name. Woah.... Hallelujah. Singing Hallelujah. We'll cry out from our hearts now. Hallelujah. Singing Hallelujah. Singing Hallelujah. We will cry out from our hearts now. Hallelujah. Hallelujah. We will cry out from our hearts now. Hallelujah"
our worlds collide,"Tonight the stars are dancing. To the songs the angels sing. I hear You whisper on the breeze. And every sound echoes the rhythm. Of your heart as I begin to fade. Into this lovely night. I'm alive. Cause our worlds collide. I'm lost in time. Heaven kisses me tonight. Your heart with mine. It beats in time. Now I know why I'm alive. Now that I've found You. I could never let You go away. You left my life never the same. Sing over me and let me hear the words. You wrote for me. Whisper the words and set my spirit free. Oh, sing to me"
