shout it out,"(Words & music by Giant - Baum - Kaye). Everybody listen to me. Put a smile on your face. There's no reason to be gloomy. This world's a wonderful place. So when I say again happy. Shout it out. Yeh, get happy now shout it out. Well there is no doubt you've a lot to shout about. Give a yell life is swell shout it out. Hey there little girl don't be sad. There's such good times to be had. Count your blessings one by one. Life's a ball, after all have some fun. I said c'mon get happy, shout it out. Yeh, get happy now shout it out. Well there is no doubt you've a lot to shout about. Give a yell life is swell shout it out. Now there's good feeling you can taste. While there's music life's no waste. While there's great things happening. There's no end to the joy life can bring. I said c'mon get happy, shout it out. Yeh, get happy now shout it out. Well there is no doubt you've a lot to shout about. Give a yell life is swell shout it out. As long as there's somebody you can love. As long as bright stars shine above. You've got no reason to be blue. Think what it means when all your dreams come true. I said c'mon get happy, shout it out. Yeh, get happy now shout it out. Well there is no doubt you've a lot to shout about. Give a yell life is swell shout it out. I said now there is no doubt you've a lot to shout about. Give a yell life is swell shout it out. There is no doubt you've a lot to shout about. Give a yell life is swell shout it out."
"show me thy ways, o lord","(Words & Music Hazel Shade). Show me Thy ways, O Lord. Show me Thy ways, O Lord. Help me love when I'm hated. Spread joy unabated. Show me Thy ways, O Lord. Jesus was more than just a man from Galilee. Christ the son of God, he died for you and me. They scorched him and walked him upon in delight (?). Still Jesus loved them, forgave and he cried. Show me Thy ways, O Lord. Show me Thy ways, O Lord. Help me love when I'm hated. Spread joy unabated. Show me Thy ways, O Lord. Show me Thy ways, O Lord. Help me love when I'm hated. Spread joy unabated."
signs of the zodiac,"Tony is a capricorn, a leader of men. And he has a kinda stubborn streak. But when it comes to the opposite sex. Tony's kinda shy and weak. Oh but he can be hot stuff. See the look on his face. If you want a wedding,. It's him you've gotta chase. Uh! uh! uh!. Signs of the zodiac, signs of the zodiac. The future is in those little signs of the zodiac. Michael is a scorpio, he can't make up his mind. Poor boy he can't decide at all. He wants one girl and then another. Soon there'll be none left but mother. Oh but michael that won't do. That just won't do at all. You can't marry your mother. Your mother's much too tall, ha ha. Ho ho. Signs of the zodiac, signs of the zodiac. The future is in those little signs of the zodiac. Billy is a libra - a sign of love. Billy has a one track mind. He's great in the kitchen and never complains. He's the happily married kind. Help is there in your future if you just look around. You don't know your astrology from a hole in the ground. Signs of the zodiac, signs of the zodiac. The future is in those little signs of the zodiac"
silent night,"(Words & music by Mohr - Gruber). Silent night, holy night.. All is calm, all is bright.. 'Round yon virgin mother and child.. Holy infant so tender and mild.. Sleep in heavenly peace,. Sleep in heavenly peace.. Silent night, holy night.. Shepherds quake at the sight.. Glorious strains from Heaven afar. Heavenly Hosts sing alleluia.. Christ the Saviour is born,."
silver bells,"Silver bells, silver bells. It's Christmas time in the city. Ring-a-ling, hear them ring. Soon it will be Christmas day. City sidewalks, busy sidewalks. Dressed in holiday style. In the air there's a feeling of Christmas. Children laughing, people passing. Meeting smile after smile. And on every street corner you'll hear. Silver bells, silver bells. It's Christmas time in the city. Ring-a-ling, hear them ring. Soon it will be Christmas day. Strings of streetlights, even stoplights. Blink a bright red and green. As the shoppers rush home with their treasures. Hear the snow crunch, see the kids bunch. This is Santa's big scene. And above all this bustle you'll hear. Silver bells, silver bells. It's Christmas time in the city. Ring-a-ling, hear them ring. Soon it will be Christmas day."
silvia,"These long lonely evenings. Here I am, on the phone. Wondering when she will call. She said, she would write me. Cause, she knows im alone. But I here nothing, at all. Im waiting, for a word of love from Silvia. You think she never heard of love, my Silvia. But when I'm with her, lord i forgive her. Cause' she's more than the whole world, to me. There's nothing like a word of love, from Silvia. The only one, I'm thinking of, is Silvia. Feeling so sad now. I'll be so glad now. If i just had my Silvia, with me. That old weeping willow, seems to whisper her name. ""Why did she go away? "". The tears on my pillow, there not hard to explain. There's nothing else i could say. I'm waiting for a word of love, from Silvia. You think she never heard a love, my Silvia. But, when I'm with her, lord i forgive her. Cause' she's more then the whole world, to me. There's nothing in the world, than my Silvia. The only one I'm thinking of is Silvia. Feeling so sad now, I'll be so glad now. If I just had my Silvia, with me"
sing you children,"(Words & music by Nelson - Burch). Oh Jonah he was desperate in the belly of the whale. Well Jonah had a plan, he knew he couldn't fail. He raised his head on high. And looking for the sky. And he sang his song so pretty. The whale told him goodbye. You got to sing you children sing. Sing you children sing. I only know one thing, hey! hey! hey!. Sing you children sing, everybody. Sing you children sing. Sing your troubles away. Well Moses said good Lord. Open up these waters for me. So I can get your chidren. Across the salty sea. Well the Lord parted the waters. And singing hand in hand. Moses and the children. Walked over to the promised land. You got to sing you children sing. Sing you children sing. I only know one thing, hey! hey! hey!. Sing you children sing, everybody. Sing you children sing. Sing your troubles away. Oh Joshua had a plan. At the walls of Jericho. He'd march around those walls. And on his horn he'd blow. That horn would play a tune. And sing a happy song. When Joshua got through. Those walls came tumbling down. You got to sing you children sing. Sing you children sing. I only know one thing, hey! hey! hey!. Sing you children sing, everybody. Sing you children sing. Sing your troubles away. You got to sing your troubles away. Sing your troubles away. Sing your troubles away. Sing your troubles away."
singing tree,"(Words & music by Owens - Solberg). You're the one who beckoned the wind. And fanned the flame when our love began. So don't pretend you don't know me. Our names are carved on you, singing tree. Oh singing tree. Sing to me. Call your friend. The roving wind. Maybe he can find my love. And bring her back, singing tree. Your leaves have turned from green to blue. Sometimes I think you loved her too. But since she left and our love died. You stand petrified, singing tree. Oh sing to me. Singing tree. Call your friend. The roving wind. Maybe he can find my love. And bring her back, singing tree. Oh sing to me. Singing tree. Call your friend. The roving wind."
slicin' sand,"(words & music by Sid Tepper - Roy Bennett). Take off your shoes, put down your hair. Turn on the music and we'll get somewhere. Dance, dance, dance, til nose gets tan. We're gonna have us a ball on the beach. a-slicin' sand. Hug me a heap, swing me a lot. We got a lot of ocean if it gets too hot. O-o-o, o-o-o, baby, take my hand. We'll have some real rockin' fun in the sun. a-slicin' sand. Come baby, come, let's dig some holes. You'll find it's heaven with sand on you soles. Yeah!. Slide through to the left, slide to the right. Slash down the middle baby hold me tight. O-o-o, o-o-o, baby, hold my hand. We'll have some real rockin' fun in the sun."
slowly but surely,"Slowly but surely I'm gonna wear you down. Slowly but surely I'm gonna bring you round. To my way of thinking, my way of kissing, my way of lovin'. Slowly but surely, I'm gonna make you mine. I ain't gonna rush ya', I'll let you meditate. Though I wanna crush ya' my arms will have to wait. I'll just take it easy, so nice and easy, real cool really. Slowly but surely, I'm gonna make you mine. Oh yeah! Mm-mm, I've got a feelin' I'm not wasting my time. Oh yeah! When you get the message it's going to be fine. Slowly but surely, the table's gonna turn. Slowly but surely, your lips are gonna burn. For what you've been missin' is my kind of kissin', my kind of lovin'. Slowly but surely, I'm gonna make you mine. Oh yeah! Mm-mm, I've got a feelin' I'm not wasting my time. Oh yeah! When you get the message it's going to be fine. Slowly but surely, the table's gonna turn. Slowly but surely, your lips are gonna burn. For what you've been missin' is my kind of kissin', my kind of lovin'. Slowly but surely, I'm gonna make you mine. I'm gonna make you mine. I'm gonna make you mine."
smokey mountain boy,(Words & music by Rosenblatt - Milrose). I'm just a Smokey mountain boy. Come back to the hills I love. Where the tops of pine all bend in the wind. And the deep blue sky above. The closer and closer I get to home. The more excited I am. Those were the mornings I'd roll out of bed. Start the day off with a hot corn bread. Smothered in huckleberry jam. I'm just a Smokey mountain boy. Come back to the hills I love. Where the tops of pine all bend in the wind. And the deep blue sky above. I can almost hear the hounds running through the woods. Close on the trail of the hare. How I long to be with them following the hounds. a-huntin' again. Gettin' me a big old grizzly bear. I'm just a Smokey mountain boy. Come back to the hills I love. Where the tops of pine all bend in the wind. And the deep blue sky above. I traveled around and met lots of girls. No matter how many I see. I left some pretty ones behind. I know back home is where I'll find. The girl whose love is meant for me. I'm just a Smokey mountain boy. Come back to the hills I love. Where the tops of pine all bend in the wind.
smorgasbord,"(Words & music by Tepper - Bennett). Some like their women short, some like them tall. I'll take them any size 'cause I love them all. I'm just wild about smorgasbord. I got a cravin' for smorgasbord. A little kiss here, a little kiss there. That's smorgasbord. Mmm. Some take just apple pie, some take just cake. I'll take the dish I please, please the dish I take. I'm just wild about smorgasbord. I got a cravin' for smorgasbord. A little kiss here, a little kiss there. That's smorgasbord. Mmm. Some like just southern belles, they got a one track mind. I go for all the belles except the wedding kind. I'm just wild about smorgasbord. I got a cravin' for smorgasbord. A little kiss here, a little kiss there. That's smorgasbord. Some like their women short, some like them tall. I'll take them any size 'cause I love them all, Mmm. Some take just apple pie, some take just cake."
snowbird,"Beneath this snowy mantle cold and clean. The unborn grass lies waiting. for its coat to turn to green. The snowbird sings a song he always sings. And speaks to me of flowers. that will bloom again in spring. When I was young my heart was young then too. Anything that it would tell me,. that's the thing that I would do. But now I feel such emptiness within. For the thing that I want most in life. Is the thing I can't win. Spread your tiny wings and fly away. And take the snow back with you. Where it came from on that day. The one I love forever is untrue. And if I could you know. that I would fly away with you. The breeze along the river seems to say. That she'll only break my heart again. should I decide to stay. So little snowbird take me with you when you go. To that land of gentle breezes. where the peaceful waters flow."
"so close, yet so far (from paradise)","(Words & music by Joy Byers). So close, yet so far from paradise. I hold, you in my arms, in paradise. Is mine, then you slip away. Like a child at play, and here am I. So close, yet so far from paradise. When you, are close to me, it's paradise. We kiss, oh my love, paradise. Is mine, then suddenly you're gone from me. Like a floating star, I see, and here am I. So close, yet so far from paradise. I reach out for you, but each time I do. I always find you gone. I know love is new, I'll take care of you. In my arms is where you belong. Just, a step away, are we from paradise. Take my hand, come away, to paradise. My love, I want you close to me. I need you desperately, oh here am I. Waiting for you. Here am I. Praying for you."
so glad you're mine,"(words & music by Arthur Crudup). My baby's long and tall,. She's like a cannonball.. Say, everytime she loves me,. Lordly, you can hear me squall.. She cried, Ooo-wee.. I believe I'll change my mind.. She said, ""I'm so glad I'm living"".. I cried, ""I'm so glad you're mine"".. My baby knows just how. To treat me right.. Gives me plenty loving. Morning, noon, and night.. She cried, Ooo-wee.. I believe I'll change my mind.. She said, ""I'm so glad I'm living"".. I cried, ""I'm so glad you're mine"".. When my baby does what she does to me,. I climb the highest mountain,. Dive in the deepest sea.. She cried, Ooo-wee.. I believe I'll change my mind.. She said, ""I'm so glad I'm living"".. I cried, ""I'm so glad you're mine"".. My baby's lips are red. And sweet like wine,. And when she kisses me,. I get high every time.. She cried, Oo-wee.. I believe I'll change my mind.. She said, ""I'm so glad I'm living"".."
so high,"(Traditional - arranged by Elvis Presley). Well,It is high (so high you can't get over it). So wide (so wide you can't get around it). So low (so low you can't get under it). Great God Almighty (you must come in at the door). Oh well, it's high (so high you can't get over it). It is wide (so wide you can't get around it). So low (so low you can't get under it). (you must come in at the door). Well I went down in the valley. You know I did over there ever stay. My soul got happy in the valley. You know I stayed right there all day. Well, He's high (so high you can't get over Him). And he's wide (so wide you can't get around Him). I know he's so low (so low you can't get under him). The mighty lamb (you must come in at the door). Well I ain't been to heaven but I""ve been told. The streets the streets are pearl. You know the mighty mighty. Mighty gates are gold. And it is high (so high you can't get over it). So wide (so wide you can't get around it). it is so low (so low you can't get under it). The mighty lamb (you must come in at the door). Well, It is high (so high you can't get over it). And it's wide (so wide you can't get around it). I know it's so low (so low you can't get under it)"
softly and tenderly,"Softly and tenderly Jesus is calling,. Calling for you and for me.. Patient and loving HeæŠ¯ waiting and watching;. Watching for you and for me.. Chorus:. Come home, come home,. Ye who are weary come home;. Earnestly, tenderly, Jesus is calling;. Calling, ""O sinner, come home!"". Repeat Chorus. Why should we linger when Jesus is pleading,. Pleading for you and for me?. Why should we wait, then, and heed not His mercies;. Mercies for you and for me?. Repeat Chorus. O for the wonderful love He has promised,. Promised for you and for me.. Though we have sinned He has mercy and pardon;. Pardon for you and for me.. Repeat Chorus. ."
softly as i leave you,"Softly (Softly). I will leave you (I will leave you softly). Softly (Softly). For my heart would break (For my heart would break). If you should wake (If you should wake). And see me go (And see me go). So I leave you (So I leave you). Softly (Softly). Long before you miss me (Long before you miss me). Long before your arms can beg me stay (Long before your arms can beg me stay). For one more hour (For one more hour). For one more day (For one more day). After all the years (After all the years). I can't bare the tears (I can't bare the tears). To fall (To fall). So softly, (So softly) so softly. (I will leave you there). I will leave you"
soldier boy,"(Words & music by David Jones - Theodore Williams). Soldier boy why feel blue. Don't you believe that she will be true. It's written in the blue. That she was meant for only you. Soldier boy tell me why do you cry. When you return she'll rush to your side. It's written in the book. That she was meant for only you. So prove your love is true. She'll be there to say ""I do"". And if you go o'er sea or land. She'll make you understand. While you're gone oh try to believe. Her love for you is really for real. It's written in the book. That she was meant for only you. So prove your love is true. She'll be there to say ""I do"". And if you go o'er sea or land. She'll make you understand. While you're gone oh try to believe. Her love for you is really for real. It's written in the book."
solitaire,"There was a man, a lonely man. Who lost his love, thru his indifference. A heart that cared that went unshared. Until it died within his silence. And solitaire is the only game in town. And every road that takes him, takes him down. While life goes on around him everywhere. He's playing solitaire. And keeping to himself, begins to deal. And still the king of hearts is well concealed. Another losing games comes to an end. And deals them out again. A little hope goes up in smoke. Just how it goes, goes without saying. There was a man, a lonely man. Who would command the hand he's playing. And solitaire is the only game in town. And every road that takes him, takes him down. While life goes on around him everywhere. He's playing solitaire. And keeping to himself, begins to deal. And still the king of hearts is well concealed. Another losing games comes to an end. And deals them out again. And solitaire is the only game in town. And every road that takes him, takes him down. While life goes on around him everywhere"
somebody bigger than you and i,"(Words & music by Lange - Heath - Burke). Who made the mountains, who made the trees. Who made the rivers flow to the sea. And who sends the rain when the earth is dry. Somebody bigger than you and I. Who made the flowers to bloom in the spring. Who made the song for the robins to sing. And who hung the moon and the stars in the sky. Somebody bigger than you and I. He lights the way when the road is long. He keeps you company. And with His love to guide you. He walks beside you. Just like He walks with me. When weâ€™re filled with despair. Who gives me courage to go from there. And who gives me faith that will never die. Somebody bigger than you and I."
something,"Something in the way she moves. Attracts me like no other lover. Something in the way she woos me. I don't want to leave her now. You know I believe and how. Somewhere in her smile she knows. All I gotta do is think of her. Something in her style that shows me. I don't want to leave her now. You know I believe and how. You're asking me will my love grow. I don't know, I don't know. You stick around and it may show. I don't know, I don't know. Something in the way she moves. Attracts me like no other lover. Something in the way she moves me. I don't want to leave her now. You know I believe and how. You're asking me will our love grow. I don't know, I don't know. You stick around and it may show. I don't know, I don't know. Something in the way she moves. All I gotta do is think of her. Something in her style that shows me. I don't want to leave her now"
something blue,"(Words & music: Paul Evans / Al Byron). Something old, the times gone by,. Something new, these tears I cry,. Something borrowed were those lips my lips knew. And thatâ€™s why Iâ€™m something blue.. Something old, the vows we made,. Something new, the price I paid,. Something borrowed, love was tried but not true.. Now my life is something blue.. I guess that I had better smile. Walking behind you down the aisle,. I feel Iâ€™m walking to my doom,. Iâ€™m really not the best man in this room.. Something old, the dreams we planned,. Something new, his wedding band,. Something borrowed was the heart I gave you,. You returned it torn in two.. Something old, the dreams we planned,. Something new, his wedding band,. Something borrowed was the heart I gave you,. You returned it torn in two.. And thatâ€™s why,. And thatâ€™s why Iâ€™m something blue.."
sometimes i feel like a motherless child,"Sometimes I feel like a motherless child. Sometimes I feel like a motherless child. Sometimes I feel like a motherless child. Long way from my home. Sometimes I wish I could fly. Like a bird up in the sky. Oh, sometimes I wish I could fly. Fly like a bird up in the sky. Sometimes I wish I could fly. Like a bird up in the sky. Closer to my home. Motherless children have a hard time. Motherless children have-a such a hard time. Motherless children have such a really hard time. A long way from home. Sometimes I feel like freedom is near. Sometimes I feel like freedom is here. Sometimes I feel like freedom is so near."
song of the shrimp,"(Words & music by Bennett - Tepper). I saw three shrimp in the water, two were old and gray. I swam a little bit closer and .. I heard the third one say. Goodbye mama shrimp, papa shake my hand. Here come the shrimper for to take me to Louisian'. Here come the shrimper for to take me to Louisian'. He showed his mama and papa, the shrimp newspaper he read. An invitation to all the shrimp and this is what it said. Free ride, New Orleans, stay in grand hotel. Big Creole gal who help you come out of your shell. Big Creole gal who help you come out of your shell. If I should live to be ninety, I will never forget. The little shrimp and the song he sang as he jumped into the net. Goodbye mama shrimp, papa shake my hand. Here come the shrimper for to take me to Louisian'. Here come the shrimper for to take me to Louisian'. Here come the shrimper for to take me to Louisian'. Here come the shrimper for to take me to Louisian'."
sound advice,"(Words & music by Baum - Giant). Some folks tell you what to do. They think they know more than you. They insist that they're givin' sound advice. But as sure as you're livin'. It ain't sound, it ain't nice. It just doesn't sound like sound advice. Some folks like to be the boss. They get up on their high horse. Oh they say that you're gettin, sound advice. There one thing I'm bettin'. It ain't wise, it ain't nice. You won't like the sound of their advice. Sound advice we're given. Just as sure as your as you're livin'. If your smart you'll think twice. When they start to sound off with advice. Sound advice we're given. Just as sure as your as you're livin'. If your smart you'll think twice. When they start to sound off with advice."
spanish eyes,"(Words & music by B. Kaemfert - C. Singleton - E. Snyder). Blue Spanish eyes teardrops are falling from your Spanish eyes. Please please don't cry, this is just adios and not good-bye. Soon I'll return, bringing you all the love your heart can hold. Please say ""Si Si"" say you and your Spanish eyes will wait for me. Soon I'll return, bringing you all the love your heart can hold. Please say ""Si Si"" say you and your Spanish eyes will wait for me."
speedway,"Take a ton of bolt and steel. A whole lotta sweat, a set of wheels. On the Speedway. The flag is down, pistons pound. Plenty of engines ripping around .. on the Speedway. Go for the money and lead the pack. Push the throttle and burn the track. Curl and swirl like you doin' a dance. Speedway's comin' and now's your chance. On the Speedway, on the Speedway, on the Speedway. Stoke that pedal down to the floor. As much as you give, crowd wants more. More, more, more, more, more on the Speedway. On the Speedway. Take a spin, hit the brakes. A young little girl .. shivers and shakes. On the Speedway. Clear the way, comin' through. Kiss from your baby just pushin' you. On the Speedway. Go for the money and lead the pack. Push the throttle and burn the track. Curl and swirl like you doin' a dance. Speedway's comin' and now's your chance. On the Speedway, on the Speedway, on the Speedway. Stoke that pedal down to the floor. As much as you give, crowd wants more. More, more, more, more, more on the Speedway. On the Speedway. On the Speedway, on the Speedway, on the Speedway. On the Speedway, on the Speedway, on the Speedway. On the Speedway, on the Speedway."
spinout,"(Words & music by Wayne - Weisman - Fuller). When her motor's warm, and she's purrin' sweet. Buddy let me warn ya', you're on a one-way street. She'll crowd ya' close, spin your wheels. Then you're gonna know how it feels. To spinout..spinout. Better watch those curves, never let her steer. If she can shake your nerves..boy. She can strip your gears. She'll get your heart, goin' fast. Then she'll let you run out of gas. So spinout...spinout. The road to love is full of, danger signs. Too many guys were lost. Who crossed those double lines. Doncha know she's out to prove, she can really score. Never saw parts move, boy. Like that before. To flag you down, that's her goal. Scoot before you lose control."
