it's over,"If time were not a moving thing. And I could make it stay. This hour of love we share. Would always be. There'd be no coming day. To shine a morning light. And make us realize our night is over. When you walk away from me. There is no place to put my hand. Except to shade my eyes against the sun. That rises over the land. I watch you walk away. Somehow I have to let you go. Cause it's over. If you knew just how I really feel. You might return and yet. There are so many times. That people have to love and then forget. Oh there might have been a way somehow. I have to force myself to say. It's over. So I turn my back,. Turn my collar to the wind. Move along in silence. Trying not to think at all. I set my feet before me. Walk the silent street before me. Now it's over. If time were not a moving thing. And I could make you stay. This hour of love we share. Would always be. There'd be no coming day. To shine a morning light. And make us realize our night is over"
it's still here,"(Words & music by Ivory Joe Hunter). The day you said we'd never part. You turned around and broke my heart. You had the nerve to tell me I would soon forget. Now you've been gone away one year. And I have not forgotten dear. The love I had for you so long. Is still here. Wow-oh. It's here, still here. Because my heart cannot believe. We're really through. And though you said we'd never part. You turned around and broke my heart. The love I had for you so long. Is still here. It's here, still here. Because my heart cannot believe. We're really through. Now you've been gone away one year. And I have not forgotten dear. The love I had for you so long. Is still here. Wow-oh. It's here, it's here, still here. Because my heart cannot believe. We're really through. And though you said we'd never part. You turned around and broke my heart. The love I had for you so long. Is still here. Wow-ow. It's here, still here. Because my heart cannot believe. We're really through. And though you said we'd never part. You turned around and broke my heart. The love I had for you so long. Is still here."
"it's your baby, you rock it","(words & music by Shiri Milete - Nora Fowler). You offered me a penny for my thoughts. And I told you then that woman won't stay caught. But you turned and loved her anyway. She broke your heart and all Iâ€™ve got to say. It's your baby, you rock it. It's your heartache, you bought it. You made the bed your sleeping in. And Iâ€™m tired of hearing about it friend. It's your baby you, rock it. Well you cried upon my shoulder like a baby. I'm sorry 'bout your troubles and your lady. But she done you like she done me. And Iâ€™ve used up all my sympathy. It's your baby you, rock it. It's your baby, you rock it. It's your heartache, you bought it. You made the bed your sleeping in. And Iâ€™m tired of hearing about it friend."
ito eats,"(words & music by Sid Tepper - Roy Bennett). Ito eat like teeth are out of style. Ito eat like teeth are out of style. Ito eating all the while. Eat Ito eat all the night and the day. Eat Ito eat all the night and the day. Ito is an eating boy. He never get enough from fish and poi. He eat everything he don't care what. He even eat the shell from the coconut. Eat Ito eat all the night and the day. Eat Ito eat all the night and the day. Hey, Ito little faster. Ito little slower. Ito eat like teeth are out of style. Ito eat like teeth are out of style. When you say that stranger smile."
jailhouse rock,"The warden threw a party in the county jail.. The prison band was there and they began to wail.. The band was jumpin' and the joint began to swing.. You should've heard those knocked out jailbirds sing.. Let's rock, everybody, let's rock.. Everybody in the whole cell block. Was dancin' to the jailhouse rock.. Spider murphy played the tenor saxophone,. Little joe was blowin' on the slide trombone.. The drummer boy from illinois went crash, boom, bang,. The whole rhythm section was the purple gang.. Let's rock, everybody, let's rock.. Everybody in the whole cell block. Was dancin' to the jailhouse rock.. Number forty-seven said to number three:. ""you're the cutest jailbird I ever did see.. I sure would be delighted with your company,. Come on and do the jailhouse rock with me."". Let's rock, everybody, let's rock.. Everybody in the whole cell block. Was dancin' to the jailhouse rock.. The sad sack was a sittin' on a block of stone. Way over in the corner weepin' all alone.. The warden said, ""hey, buddy, don't you be no square.. If you can't find a partner. Use a wooden chair."". Let's rock, everybody, let's rock.. Everybody in the whole cell block. Was dancin' to the jailhouse rock.. Shifty henry said to bugs, ""for heaven's sake,. No one's lookin', now's our chance to make a break."". Bugsy turned to shifty and he said, ""nix nix,. I wanna stick around a while and get my kicks."". Let's rock, everybody, let's rock.. Everybody in the whole cell block. Was dancin' to the jailhouse rock."
jesus walked that lonesome valley,"(Trad.). You've got to walk that lonesome valley. Well you gotta go by yourself. Well there ain't nobody else gonna go there for you. You gotta go there by yourself. Now mother walked that lonesome valley. Now mother walked, she walked it by herself. Well there ain't nobody else could ever walk it for her. She had to walk it, she had to walk it by herself. You've got to walk that lonesome valley. Well you gotta go by yourself. Well there ain't nobody else gonna go there for you. You gotta go there by yourself. Now father walked that lonesome valley. Now father walked it, he walked it by himself. Nobody else could walk it for him. Well he had to walk it, he had to walk it by himself. You've got to walk that lonesome valley. Well you gotta go by yourself. Well there ain't nobody else gonna go there for you. You gotta go there by yourself. Now John was a baptist. He was some folk say he was a Jew. He wrote that holy holy bible. The bible tells you, it plainly tells you. That he was, that he was a preacher too. You've got to walk that lonesome valley. Well you gotta go by yourself. Well there ain't nobody else gonna go there for you. You gotta go there by yourself. You've got to walk that lonesome valley. Well you gotta go by yourself. Well there ain't nobody else gonna go there for you."
jingle bell rock,"Jingle bell,. Jingle bell,. Jingle bell rock. Jingle bells swing and jingle bells ring. Snowing and blowing up bushels of fun. Now the jingle hop has begun. Jingle bell,. Jingle bell,. Jingle bell rock. Jingle bells chime in jingle bell time. Dancing and prancing in Jingle Bell Square. In the frosty air.. What a bright time, it's the right time. To rock the night away. Jingle bell time is a swell time. To go gliding in a one-horse sleigh. Giddy-up jingle horse, pick up your feet. Jingle around the clock. Mix and a-mingle in the jingling feet. That's the jingle bell,. That's the jingle bell,. That's the jingle bell rock"
johnny b. goode,"Deep down in Louisiana close to New Orleans. Way back up in the woods among the evergreens. There stood a log cabin made of earth and wood. Where lived a country boy named Johnny B. Goode. Who never ever learned to read or write so well. But he could play a guitar just like a ringin' a bell.. (Chorus). Go Go. Go Johnny Go Go (x4). Johnny B. Goode. He used to carry his guitar in a gunny sack,. Go sit beneath a tree by the railroad track. Oh the engineers would see him sittin in the shade,. Strummin with the rhythm that the drivers made,. People passin' by they would stop and say. ""Oh my but that little country boy can play"". (Chorus). His momma told him ""some day you will be a man,. And you will be the leader of a big ol' band. Many people comin' from miles around,. To hear you play your music till the sun go down,. Maybe some day your name will be in lights sayin. 'Johnny B. Goode' tonight"". (Chorus)"
joshua fit the battle,"(Arranged and adapted by Elvis Presley). Joshua fit the battle of Jericho. Jericho Jericho. Joshua fit the battle of Jericho. And the walls come tumbling down. God knows that. Joshua fit the battle of Jericho. Jericho Jericho. Joshua fit the battle of Jericho. And the walls come tumbling down. Good morning sister Mary. Good morning brother John. Well I wanna stop and talk with you. Wanna tell you how I come along. I know you've heard about Joshua. He was the son of Nun. He never stopped his work until. Until the work was done. God knows that. Joshua fit the battle of Jericho. Jericho Jericho. Joshua fit the battle of Jericho. And the walls come tumbling down. You may talk about your men of Gideon. You may brag about your men of Saul. There's none like good old Joshua. At the battle of Jericho. Up to the walls of Jericho. He marched with spear in hand. Go blow them ram horns, Joshua cried. 'Cause the battle is in my hands. God knows that. Joshua fit the battle of Jericho. Jericho Jericho. Joshua fit the battle of Jericho. And the walls come tumbling down. You may talk about your men of Gideon. You may brag about your king of Saul. There none like Joshua. At the battle of Jericho. They tell me, great God that Joshuaâ€™s spear. Was well nigh twelve feet long. And upon his hip was a double edged sword. And his mouth was a gospel horn. Yet bold and brave he stood. Salvation in his hand. Go blow them ram horns Joshua cried. 'Cause the devil can't do you no harm. Joshua fit the battle of Jericho. Jericho Jericho. Joshua fit the battle of Jericho. And the walls come tumbling down. Up to the walls of Jericho. He marched with spear in hand. Go blow them ram horns, Joshua cried. 'Cause the battle is in my hands. Then the lamb ram sheep horns began to blow. The trumpets began to sound. Old Joshua shouted glory. And the walls came tumblin' down. God knows that. Joshua fit the battle of Jericho. Jericho Jericho. Joshua fit the battle of Jericho. And the walls come tumbling down. Down, down, down, down, down."
judy,"(words & music by Redell). They say you found somebody new. Whose love will always be true. I don't know what it is to be alone. That's why I dread to know you're gone. Oh Judy, don't let our sweet love. Wither and die like flowers in the fall. Oh Judy, don't you know it's you. I love most of all. Oh, please come back I promise always to be true. Oh Judy, there'll never be anyone else dear but you. Oh, please come back I promise always to be true."
just a closer walk with thee,"I am weak, but Thou art strong;. Jesus, keep me from all wrong;. I'll be satisfied as long. As I walk, let me walk close to Thee.. Just a closer walk with Thee,. Grant it, Jesus, is my plea,. Daily walking close to Thee,. Let it be, dear Lord, let it be.. Through this world of toil and snares,. If I falter, Lord, who cares?. Who with me my burden shares?. None but Thee, dear Lord, none but Thee.. Just a closer walk with Thee,. Grant it, Jesus, is my plea,. Daily walking close to Thee,. Let it be, dear Lord, let it be.. When my feeble life is o'er,. Time for me will be no more;. Guide me gently, safely o'er. To Thy kingdom shore, to Thy shore.. Just a closer walk with Thee,. Grant it, Jesus, is my plea,. Daily walking close to Thee,. Let it be, dear Lord, let it be."
just a little bit,I don't want much. Just want a little bit. Don't want it all. Just a little bit. Give me an eeny weeny bit. A teeny weeny bit of your love. Turn your lamps down low. Slip me a kiss. Turn your lights down low. I won't let you resist. I want an eeny weeny bit. A teeny weeny bit of your love. Early in the mornin'. Well just a little bit. Around midnight. Just a little bit. I want an eeny weeny bit. A teeny weeny bit of your love. Walk with me. Just a little bit. I said talk to me. Just a little bit. I want an eeny weeny bit. A teeny weeny bit of your love. I want you to remember. To say that you'll be mine. Say you'll never leave me. Till the end of time. I want an eeny weeny bit. A teeny weeny bit of your love. I want an eeny weeny bit. A teeny weeny bit of your love.
just a little talk with jesus,"(Words & music by Clevant Derricks). I once was lost in sin but Jesus took me in. Well then a little light from heaven healed my soul. Well, he bathed my heart in love, and wrote my name above. Well just a little talk with my Jesus gonna it right. We'll just have a little talk with Jesus. We're gonna tell Him all about our troubles. He will hear our fainted cry. He will answer by and by. Oh well, when you feel a little prayer wheel turning. And you will know a little fire is burnin'. You will find a little talk with Jesus makes it right. You may have doubts and fears. Your eye be filled with tears. Oh well my Jesus is a friend who watches day and night. Well he wrote my name above, and he bathed my heart in love. Oh well just a little talk with my Jesus gonna make it right. Let us have a little talk with my Jesus. Please let us tell Him all about our troubles. He will hear our faintest cry. He will answer by and by. Now when you feel a little prayer wheel turning. You'll know just a little fire is burnin'. And have a little talk with my Jesus gonna makes it right. Well you may have doubts and fears. Your eye be filled with tears. Oh well now my Jesus is a friend who watches day and night. Well you go to Him in prayer. He answers my every prayer. Oh well just a little talk with my Jesus gonna makes it right. Now let us have a little talk with my Jesus. Tell Him all about our troubles. He will hear our faintest cry. And I know he's gonna answer by and by. Now when you feel a little prayer wheel turning. You'll know a little fire is burnin'. And have a little talk with my Jesus gonna makes it right."
just because,"Well, well, well. Just because you think you're so pretty. And just because your momma thinks you're hot. Well, just because you think you've got something. That no other girl has got. You've caused me to spend all my money. You laughed and called me old Santa Claus. Well, I'm telling you. Baby, I'm through with you. Because, well well, just because. Well, well, well. There'll come a time when you'll be lonesome. And there'll come a time when you'll be blue. Well, there'll come a time when old Santa. He won't pay your bills for you. You've caused me to lose all my women. And now, now you say we are through. Well, I'm telling you. Baby, I was through with you. A long long time ago. Well, just because you think you're so pretty. And just because your mama thinks you're the hottest thing in town. Well, just because you think you've got something. That nobody else has got. You've caused me to spend all of my money. Honey, you laughed and called me your old Santa Claus. Well, I'm telling you I'm through with you"
just call me lonesome,(Words & music by Rex Griffin). Why must I love a heartless woman. Who never knows the harm she's done. Though love is blind I should have known. Just call me lonesome from now on. I climb the stairs up to my room. But no-one greets me in my gloom. The silence tells me she is gone. Just call me lonesome from now on. These walls will hide me when I cry. I hope that heaven lets me die. What good is life when hope has gone. Just call me lonesome from now on
just for old time sake,"(Words & music: Sid Tepper / Roy C. Bennett). Just for old time sake. Wonâ€™t you give my heart a break,. Letâ€™s get together again,. Letâ€™s relive the time I was yours and you were mine,. Life was so wonderful then.. I know, now I know the day I let you go. I made my greatest mistake,. If you loved me then. You could love me once again,. Wonâ€™t you try just for old time sake.. I know, yes I know the day I let you go. I made my greatest mistake,. If you loved me then. You could love me once again,. Wonâ€™t you try just for old time sake.."
just pretend,"Just pretend, I'm holding you. And whispering things soft and low. And think of me, how it's gonna be,. Just pretend I didn't go. When I walked away, I heard you say. If you need me, you know what to do. I knew it then, I'd be back again. Just pretend I'm right there with you. And I'll come flying to you, oh yes. All the crying is true. Oh, I will hold you and love you again. But until then, well just pretend. Oh, it's funny but I can't recall the things. We said or why you're crying. But now I know it was wrong to go. I belong here by your side. And I'll come flying to you, oh yes. All the crying is true. Oh, I will hold you and love you again. But until then, well just pretend."
just tell her jim said hello,(Words & music by Leiber - Stoller). She's sitting right over there. I'd know that face anywhere. I'd run up and embrace her. But Iâ€™m ashamed to face her. Just tell her Jim said hello. I'd like to pour out my heart. But I don't know where to start. I'd like to tell her. What Iâ€™m really feeling but. Just tell her Jim said hello. Just tell her Jim said hello. Just tell her Jim and she'll know. Don't tell her Iâ€™m feeling blue. That's just between me and you. Don't say Iâ€™m thinking of her. Don't tell her I still love her. Just tell her Jim said hello. Just tell her Jim said hello. Just tell her Jim said hello.
kentucky rain,"Seven lonely days. And a dozen towns ago. I reached out one night. And you were gone. Don't know why you'd run,. What you're running to or from. All I know is I want to bring you home. So I'm walking in the rain,. Thumbing for a ride. On this lonely Kentucky backroad. I've loved you much too long. And my love's too strong. To let you go, never knowing. What went wrong. Kentucky rain keeps pouring down. And up ahead's another town. That I'll go walking thru. With the rain in my shoes,. Searchin for you. In the cold Kentucky rain,. In the cold Kentucky rain. Showed your photograph. To some old gray bearded man. Sitting on a bench. Outside a gen'ral store. They said ""Yes, she's been here"". But their memory wasn't clear. Was it yesterday,. No, wait the day before. So I fin'ly got a ride. With a preacher man who asked. ""Where you bound on such a cold dark afternoon?"". As we drove on thru the rain. As he listened I explained. And he left me with a prayer. That I'd find you."
king creole,"There's a man in New Orleans. Who plays rock and roll. He's a guitar man. With a great big soul. He lays down a beat. Like a ton of coal. He goes by the name of King Creole. You know he's gone, gone, gone. Jumpin' like a catfish on a pole. You know he's gone, gone, gone. Hip shaking King Creole. When the king starts to do it. It's as good as done. He holds his guitar. like a tommy gun. He starts to growl. From way down his throat. He bends a string. And ""that's all she wrote"". Well, he sings a song about a crawdad hole. He sings a song about a jelly roll. He sings a song about pork and greens. He wails some blues about New Orleans. Well, he plays something evil. Then he plays something sweet. No matter how he plays. You got to get up on your feet. When he gets the rockin' fever. baby, heaven sakes. He don't stop playin'. 'Till his guitar breaks."
king of the road,"Trailers for sale or rent,. Rooms to let - 50 cents,. No phone, no pool, no pets,. Ain't got no cigarettes, ah but. Two hours of pushing broom. buys an 8 by 12 four-bit room. He's a man of means by no means. King of the road.. Third box car midnight train. Destination Bangor, Maine. Old worn-out suits and shoes,. Don't pay no union dues.. He smokes old stogies he has found. Short, but not too big around. He's a man of means by no means. King of the road. (He knows) Every engineer on every train. All of their children and all of their names. And every hang-out in every town. Every lock that ain't locked. When no one's around.. I say, Trailers for sale or rent,. Rooms to let - 50 cents,. No phone, no pool, no pets,. Ain't got no cigarettes.. I've got two hours of pushing broom. buys an 8 by 12 four-bit room. He's a man of means by no means. King of the road"
king of the whole wide world,"(Words & music by Batchelor - Roberts). A poor man wants the oyster. A rich man wants the pearl. But the man who can sing when he hasn't got a thing. He's the king of the whole wide world. Come on let's sing, sing brother sing. 'Cos the man who can sing when he hasn't got a thing. He's the king of the whole wide world. The rich man wants the princess. The poor man just wants a girl. But the man who can sing when he hasn't got a thing. He's the king of the whole wide world. Come on let's sing, sing brother sing. 'Cos the man who can sing when he hasn't got a thing. He's the king of the whole wide world. A poor man wants to be a rich man. A rich man wants to be a king. But the man who can sing when he hasn't got a thing. He's the king of the whole wide world. Come on let's sing, sing brother sing. 'Cos the man who can sing when he hasn't got a thing. He's the king of the whole wide world. Come on let's sing, sing brother sing. 'Cos the man who can sing when he hasn't got a thing. He's the king of the whole wide world. Of the whole wide world."
kismet,"(Words & music by Sid Tepper - Roy C. Bennett). When you meet by chance, it's not by chance. It's kismet. When two hearts stand still, it's destiny's will. It's kismet. The wheel of fortune spins, round and around it goes. Who will the arrow point to, only kismet knows. Until you came by, kismet and I, were strangers. But now that you're here, it's suddenly clear we've met. This is my lucky day, love's in the cards I'd say. Thanks to kismet, kismet, kismet. Until you came by, kismet and I were strangers. But now that you're here, it's suddenly clear we've met. This is my lucky day, love's in the cards I'd say."
kiss me quick,"Kiss me quick, while we still have this feeling. Hold me close and never let me go. 'Cause tomorrows can be so uncertain. Love can fly and leave just hurting. Kiss me quick because I love you so. Kiss me quick and make my heart go crazy. Sigh that sigh and whisper oh so low. Tell me that tonight will last forever. Say that you will leave me never. Kiss me quick because I love you so. Let the band keep playing while we are swaying. Let's keep on praying that we'll never stop. Kiss me quick I just can't stand this waiting. 'Cause your lips are lips I long to know. For that kiss will open heaven's door. And we'll stay there forever more. Kiss me quick because I love you so"
kissin' cousins,"(Words & music by Wise - Starr). Well I've got a gal, she's as cute as she can be. She's a distant cousin but she's not too distant with me. We'll kiss all night. I'll squeeze her tight. But we're kissin' cousins 'n that's what makes it all right. All right, all right, all right. Oh I've got a girl and she taught me how to live. She can give a lot and she's got a lot to give. We'll kiss all night. I'll squeeze her tight. But we're kissin' cousins 'n that's what makes it all right. All right, all right, all right. Yes we're all cousins, that's what I believe. Because we're children of Adam and Eve. I got a girl and she wants a lot of love. That's the kind of trouble I need plenty of. We'll kiss all night. I'll squeeze her tight. But we're kissin' cousins 'n that'll make it all right. All right, all right, all right. We'll be kissin' cousins that'll make it all right. All right, all right, all right. Yes we're all cousins, that's what I believe. Because we're children of Adam and Eve. I got a girl and she wants a lot of love. That's the kind of trouble I need plenty of. We'll kiss all night. I'll squeeze her tight. But we'll be kissin' cousins 'n that'll make it all right. All right, all right, all right. We'll be kissin' cousins that'll make it all right. All right, all right, all right. We'll be kissin' cousins that's what makes it all right."
kissin' cousins (number 2),"(Words & music by Giant - Baum - Kaye). Cousins, kissin' cousins. Kissin's allowed 'cos we're proud to be cousins. What's a little teasin', huggin' and a-squeezin'. Between us cousins.. Oh it's so great to be one big family. And we show it, yes we show it. You see, we never feud, we're a happy brood. Folks all know it, yes they know it. Cousins, kissin' cousins. Honey we dress and we mess. We're just cousins,. Cousins, kissin' cousins."
known only to him,"(Words & music by Stuart Hamblen). Known only to him are the great hidden secrets. I'll fear not the darkness when my flame shall dim. I know not what the future holds. But I know who holds the future. It's a secret known only to Him. In this world of fear and doubt. On my knees I ask the question. Why a lonely, heavy cross I must bear. Then he tells me in my prayer. It's because I am trustworthy. He gives me strength far more than my share. Known only to him are the great hidden secrets. I'll fear not the darkness when my flame shall dim. I know not what the future holds. But I know who holds the future."
ku-u-i-po,(words & music by Perretii - Creatore - Weiss). Ku-u-i-po I love you more today. More today than yesterday. But I love you less today. Less than I will tomorrow. See the sweet Hawaiian rose. See it blossom see it grow. That's the story of our love. Ever since we said hello. As the years go passing by. We'll recall our wedding day. I will be there by your side. You will always hear me say.
lady madonna,"See how they run. Lady Madonna, children at your feet. Wonder how you manage to make ends meet. Saturday morning arrives without a suitcase. Sunday morning creep in like a nun. Friday's child forget to tie his suitcase. See how they run. Lady Madonna, children at your feet"
