my way,"And now the end is near. And so I face the final curtain. My friend, I'll say it clear. I'll state my case of which I'm certain. I've lived a life that's full. I've traveled each and every highway. And more, much more than this. I did it my way. Regrets, I've had a few. But then again, too few to mention. I did what I had to do. And saw it through without exemption. I planned each charted course. Each careful step along the byway. Oh, and more, much more than this. I did it my way. Yes, there were times, I'm sure you knew. When I bit off more than I could chew. But through it all when there was doubt. I ate it up and spit it out. I faced it all and I stood tall. And did it my way. I've loved, I've laughed and cried. I've had my fails, my share of losing. And now as tears subside. I find it all so amusing. To think I did all that. And may I say, not in a shy way. Oh, no, no not me. I did it my way. For what is a man, what has he got. If not himself, then he has not. To say the words he truly feels. And not the words from one who kneels. The record shows I took the blows. And did it my way. The record shows I took the blows. And did it my way"
can't help falling in love,"Wise men say, only fools rush in. But I can't help, falling in love with you. Shall I stay? Would it be a sin. If I can't help, falling in love with you?. Like a river flows, surely to the sea. Darling, so it goes somethings are meant to be. Take my hand, take my whole life too. For I can't help, Falling in love with you. Like a river flows, surely to the sea. Darling so it goes, somethings are meant to be. Take my hand, take my whole life too. For I can't help falling in love with you. For I can't help falling in love with you"
suspicious minds,"We're caught in a trap. I can't walk out. Because I love you too much baby. Why can't you see. What you're doing to me. When you don't believe a word I say?. We can't go on together. With suspicious minds. And we can't build our dreams. On suspicious minds. So, if an old friend I know. Drops by to say hello. Would I still see suspicion in your eyes?. Here we go again. Asking where I've been. You can't see these tears are real. I'm crying. We can't go on together. With suspicious minds. And we can't build our dreams. On suspicious minds. Oh let our love survive. Or dry the tears from your eyes. Let's not let a good thing die. When honey, you know. I've never lied to you. (we can't go on together). We can't go on together. With suspicious minds. And we can't build our dreams. On suspicious minds. We're caught in a trap. I can't walk out. Because I love you too much baby. Why can't you see. What you're doing to me. When you don't believe a word I say?. We're caught in a trap. I can't walk out. Because I love you too much baby"
always on my mind,"Maybe I didn't treat you,. Quite as good as I should have.. Maybe I didn't love you,. Quite as often as I could have.. Little things I should have said and done,. I just never took the time.. You were always on my mind.. You were always on my mind.. Maybe I didn't hold you,. All those lonely, lonely times.. And I guess I never told you,. I'm so happy that you're mine.. If I made you feel second best,. Girl I'm so sorry, I was blind.. You were always on my mind.. You were always on my mind.. Tell me.. Tell me that your sweet love hasn't died.. Give me.. Give me one more chance to keep you satisfied.. Satisfied.. Little things I should have said and done,. I just never took the time.. You were always on my mind.. You were always on my mind.. You were always on my mind.. You were always on my mind"
love me tender,"Love me tender, love me sweet,. Never let me go.. You have made my life complete,. And I love you so.. Love me tender, love me true,. All my dreams fulfill.. For my darlin' I love you,. And I always will.. Love me tender, love me long,. Take me to your heart.. For it's there that I belong,. And we'll never part.. Love me tender, love me true,. All my dreams fulfill.. For my darlin' I love you,. And I always will.. Love me tender, love me dear,. Tell me you are mine.. I'll be yours through all the years,. Till the end of time.. Love me tender, love me true,. All my dreams fulfill.. For my darlin' I love you,. And I always will."
suspicion,"Ev'rytime you kiss me. I’m still not certain that you love me. Ev'ry time you hold me. I’m still not certain that you care. Though you keep on saying. you really, really, really love me. do you speak the same words. To someone else when I’m not there. Suspicion torments my heart. Suspicion keeps us apart. Suspicion why torture me. Ev'rytime you call me. and tell me we should meet tomorrow. I can't help but think that. you're meeting someone else tonight. Why should our romance just. keep on causing me such sorrow?. Why am I so doubtful. whenever you're out of sight?. Darling, if you love me,. I beg you wait a little longer. Wait until I drive all. these foolish fears out of my mind. How I hope and pray that. our love will keep on growing stronger. Maybe I’m suspicious. 'cause true love is so hard to find."
bridge over troubled water,"When you're weary, feeling small. When tears are in your eyes I will dry them all. I'm on your side, oh, When times get rough. And friends just can't be found. Like a bridge over troubled water,. I will lay me down,. Oh, like a bridge over troubled water. I will lay me down. When you're down and out, when you're on the street. When evening falls so hard, I will comfort you. I'll take your part oh! when darkness falls and pain is all around. Yes, like a bridge over troubled water. I will lay me down. Oh, like a bridge over troubled water. I will lay me down. Sailing on, silver girl, sailing on by. Your time has come to shine. All your dreams are on their way. See how they shine. Oh, if you need a friend,. I'm sailing right behind. Yes, like a bridge over troubled water. I, I will ease your mind. Like a bridge over troubled water. I will ease your mind"
amazing grace,"Amazing grace, oh how sweet the sound. That saved a wreck like me. I once was lost, though now I'm found. I was blind, but now I see. When we've been there ten thousand years. Bright shining as the sun. We've no less days to sing God's praise. Then when, when we first begun. Through many dangers, toils and snares,. I have already come. It's grace that brought me safe thus far,. and grace will lead me home.. Amazing grace, oh how sweet the sound. To save a wreck like me. I once was lost, but now I'm found. I was blind, but now I see"
jailhouse rock,"The warden threw a party in the county jail.. The prison band was there and they began to wail.. The band was jumpin' and the joint began to swing.. You should've heard those knocked out jailbirds sing.. Let's rock, everybody, let's rock.. Everybody in the whole cell block. Was dancin' to the jailhouse rock.. Spider murphy played the tenor saxophone,. Little joe was blowin' on the slide trombone.. The drummer boy from illinois went crash, boom, bang,. The whole rhythm section was the purple gang.. Let's rock, everybody, let's rock.. Everybody in the whole cell block. Was dancin' to the jailhouse rock.. Number forty-seven said to number three:. ""you're the cutest jailbird I ever did see.. I sure would be delighted with your company,. Come on and do the jailhouse rock with me."". Let's rock, everybody, let's rock.. Everybody in the whole cell block. Was dancin' to the jailhouse rock.. The sad sack was a sittin' on a block of stone. Way over in the corner weepin' all alone.. The warden said, ""hey, buddy, don't you be no square.. If you can't find a partner. Use a wooden chair."". Let's rock, everybody, let's rock.. Everybody in the whole cell block. Was dancin' to the jailhouse rock.. Shifty henry said to bugs, ""for heaven's sake,. No one's lookin', now's our chance to make a break."". Bugsy turned to shifty and he said, ""nix nix,. I wanna stick around a while and get my kicks."". Let's rock, everybody, let's rock.. Everybody in the whole cell block. Was dancin' to the jailhouse rock."
unchained melody,"Oh, my love, my darling. I've hungered for your touch. A long lonely time. And time goes by, so slowly. And time can do so much. Are you, still mine?. I need your love. I need your love. God, spread your love to me. Lonely rivers. Flow to the sea, to the sea. To the open arms of the sea. Lonely rivers cry. Wait for me, wait for me. I'm coming home. Wait for me. My love, my darling. I've hungered for your kiss. Oh lonely, Lonely time. I need your love. I need your love"
kiss me quick,"Kiss me quick, while we still have this feeling. Hold me close and never let me go. 'Cause tomorrows can be so uncertain. Love can fly and leave just hurting. Kiss me quick because I love you so. Kiss me quick and make my heart go crazy. Sigh that sigh and whisper oh so low. Tell me that tonight will last forever. Say that you will leave me never. Kiss me quick because I love you so. Let the band keep playing while we are swaying. Let's keep on praying that we'll never stop. Kiss me quick I just can't stand this waiting. 'Cause your lips are lips I long to know. For that kiss will open heaven's door. And we'll stay there forever more. Kiss me quick because I love you so"
it's now or never,"It's now or never,. come hold me tight. Kiss me my darling,. be mine tonight. Tomorrow will be too late,. it's now or never. My love won't wait.. When I first saw you. with your smile so tender. My heart was captured,. my soul surrendered. I'd spend a lifetime. waiting for the right time. Now that your near. the time is here at last.. It's now or never,. come hold me tight. Kiss me my darling,. be mine tonight. Tomorrow will be too late,. it's now or never. My love won't wait.. Just like a willow,. we would cry an ocean. If we lost true love. and sweet devotion. Your lips excite me,. let your arms invite me. For who knows when. we'll meet again this way. It's now or never,. come hold me tight. Kiss me my darling,. be mine tonight. Tomorrow will be too late,. it's now or never. My love won't wait.."
burning love,"Lord Almighty,. I feel my temperature rising. Higher higher. It's burning through to my soul. Girl, girl, girl, girl. You gonna set me on fire. My brain is flaming. I don't know which way to go. Your kisses lift me higher. Like the sweet song of a choir. You light my morning sky. With burning love. Ooh, ooh, ooh, ooh,. I feel my temperature rising. Help me, I'm flaming. I must be a hundred and nine. Burning, burning, burning. And nothing can cool me. I just might turn into smoke. But I feel fine. Cause your kisses lift me higher. Like a sweet song of a choir. And you light my morning sky. With burning love. It's coming closer. The flames are now licking my body. Won't you help me. I feel like I'm slipping away. It's hard to breathe. And my chest is a-heaving. Lord have Mercy. I'm burning a whole where I lay. Your kisses lift me higher. Like the sweet song of a choir. You light my morning sky. With burning love. With burning love. Ah, ah, burning love. I'm just a hunk, a hunk of burning love. Just a hunk, a hunk of burning love. Just a hunk, a hunk of burning love. Just a hunk, a hunk of burning love. Just a hunk, a hunk of burning love. Just a hunk, a hunk of burning love"
loving you,"(words & music by Jerry Leiber - Mike Stoller). I will spend my whole life through. loving you, loving you.. Winter, summer, spring-time, too,. loving you, loving you.. Makes no difference where I go or what I do.. You know that I'll always be loving you.. If I'm seen with someone new,. don't be blue, don't be blue.. I'll be faithful I'll be true;. always true, true to you.. There is only one for me, and you know who.."
blue suede shoes,"Well, it's one for the money,. Two for the show,. Three to get ready,. Now go, cat, go.. But don't you step on my blue suede shoes.. You can do anything. but lay off of my Blue suede shoes.. Well, you can knock me down,. Step in my face,. Slander my name. All over the place.. Do anything that you want to do, but uh-uh,. Honey, lay off of my shoes. Don't you step on my Blue suede shoes.. You can do anything. but lay off of my blue suede shoes.. You can burn my house,. Steal my car,. Drink my liquor. From an old fruitjar.. Do anything that you want to do, but uh-uh,. Honey, lay off of my shoes. Don't you step on my blue suede shoes.. You can do anything. but lay off of my blue suede shoes."
you've lost that lovin' feelin',"(words & music by Mann - Weil). You never close your eyes. Anymore when I kiss your lips. There's no tenderness. Like before in you fingertips. You're trying hard not to show it,. But baby, baby I know it. You've lost that lovin' feelin', oh that lovin' feelin'. You've lost that lovin' feelin', now it's gone, gone, gone. There's no tenderness in your eyes. When I reach out for you. Girl, you're starting to criticize. Every little thing I do. It makes me just feel like crying. 'Cause baby, something beautiful's dying. You've lost that lovin' feelin', oh that lovin' feelin'. You've lost that lovin' feelin', now it's gone, gone, gone. Baby, baby, I get down on my knees for you. If you would only love me like you used to do. We had a love, love, love,. A love you don't find every day. Oh don't, don't, don't, don't take it away. Listen to me, talkin' to you. Bring back that lovin' feelin, oh, that lovin' feelin'. Bring back that lovin' feelin, now it's gone, gone, gone. And I can't go on, woh ... woh ... woh"
a little less conversation,"A little less conversation, a little more action please. All this aggravation ain't satisfactioning me. A little more bite and a little less bark. A little less fight and a little more spark. Close your mouth and open up your heart. and baby satisfy me. Satisfy me baby. Baby close your eyes and listen to the music. Drifting through a summer breeze. It's a groovy night and I can show you how to use it. Come along with me and put your mind at ease. A little less conversation, a little more action please. All this aggravation ain't satisfactioning me. A little more bite and a little less bark. A little less fight and a little more spark. Close your mouth and open up your heart. and baby satisfy me. Satisfy me baby. Come on baby I'm tired of talking. Grab your coat and let's start walking. Come on, come on. Come on, come on. Come on, come on. Don't procrastinate, don't articulate. Girl it's getting late, gettin' upset waitin' around. A little less conversation, a little more action please. All this aggravation ain't satisfactioning me. A little more bite and a little less bark. A little less fight and a little more spark. Close your mouth and open up your heart. and baby satisfy me. Satisfy me baby"
heartbreak hotel,"Well, since my baby left me. I found a new place to dwell. It's down at the end of lonely street. at Heartbreak Hotel. You make me so lonely baby. I get so lonely. I get so lonely I could die. And although it's always crowded. you still can find some room. Where broken hearted lovers. do cry away their gloom. You make me so lonely baby. I get so lonely. I get so lonely I could die. Well, the Bell hop's tears keep flowin'. and the desk clerk's dressed in black. Well they been so long on lonely street. They ain't ever gonna look back. You make me so lonely baby. I get so lonely. I get so lonely I could die. Hey now, if your baby leaves you. and you got a tale to tell. Just take a walk down lonely street. to Heartbreak Hotel"
how great thou art,"Oh Lord my God when I in awesome wonder. Consider all the *worlds thy hands have made. I see the stars, I hear the rolling thunder. Thy power throughout the universe displayed. REFRAIN:. Then sings my soul my savior God to thee. How great thou art. How great thou art. Then sings my soul my savior God to thee. How great thou art how great thou art. When thru the woods and forest glades I wander. And hear the birds sing sweetly in the trees. When I look down from lofty mountain grandeur. And hear the brook and feel the gentle breeze (Refrain). And when I think that God, his Son not sparing. Sent Him to die, I scarce can take it in. That on the cross my burden gladly bearing. He bled and died to take away my sin (Refrain). . When Christ shall come With shout of acclamation. To take me home What joy shall fill my heart. Then I shall bow in humble adoration"
i've got confidence,"When trouble is in my way. I can't tell the night from day. I toss from side to side. Like a ship on a raging tide. I don't worry and I don't fret. God has never failed me yet. Troubles comin' from time to time. But that's all right, 'cause I'm not the worrying kind. Because I, I've got confidence,. God is gonna see me through. No matter what the case may be. I know He's gonna fix it for me. Job was so sick so long. Till the flesh fell from his bones. His wife, cattle and children,. Everything that he had was gone. But Job he never dispared. He knew that God still cared. Sleepless days and sleepless nights. Job said honey that's all right. 'Cause I've got confidence. God is gonna see me through. No matter what the case may be. I know He's gonna fix it for me. Some folks wonder how I smile. Even though I'm going to trial. How can I have song. Everything is going wrong. I don't worry and I don't fret. God has never failed me yet. Trouble's coming from time to time. That's all right, I'm not the worrying kind"
sylvia,"These long lonely evenings. Here I am on the phone. Wondering if she will call. She said she would write me. 'Cause she knows I'm alone. But I hear nothing at all. I'm waiting for a word of love from Sylvia.. You think she'd never heard of love my Sylvia,. But when I'm with her Lord, I forgive her. 'Cause she's more than the whole world to me. There's nothing like a word of love from Sylvia. The only one I'm thinking of is Sylvia. Feeling so sad now, I'll be so glad now. If I just had my Sylvia with me. That old weepin' willow. Seems to whisper her name. Why did she go away. The tears on my pillow. They're not hard to explain. There's nothing else I can say. I'm waiting for a word of love from Sylvia.. You think she'd never heard of love my Sylvia,. But when I'm with her Lord, I forgive her. 'Cause she's more than the whole world to me. There's nothing in the world my Sylvia. The only one I'm thinking of is Sylvia. Feeling so sad now, I'll be so glad now. If I just had my Sylvia with me"
and i love you so,"And I love you so,. The people ask me how,. How I've lived till now. I tell them I don't know. I guess they understand. How lonely life has been. But life began again. The day you took my hand. And yes I know how lonely life can be. Shadows follow me. The night won't set me free. But I don't let the evening get me down. Now that you're around me. And you love me too. Your thoughts are just for me. You set my spirit free. I'm happy that you do. The book of life is brief. Once the page is read. All but love is dead. This is my belief"
where no one stands alone (with lisa marie presley),"Once I stood in the night. With my head bowed low. In the darkness as black as could be. And my heart felt alone and I cried oh Lord. Dont hide your face from me. Hold my hand all the way. Every hour, every day. From here to the great unknown. Take my hand, let me stand. Where no one stands alone. Like a king I may live in a palace so tall. With great riches to call my own. But I dont know a thing. In this whole wide world. Thats worse than being alone. Hold my hand all the way. Every hour, every day. From here to the great unknown. Take my hand, let me stand. Where no one stands alone. Take my hand, let me stand. Where no one stands alone"
silvia,"These long lonely evenings. Here I am, on the phone. Wondering when she will call. She said, she would write me. Cause, she knows im alone. But I here nothing, at all. Im waiting, for a word of love from Silvia. You think she never heard of love, my Silvia. But when I'm with her, lord i forgive her. Cause' she's more than the whole world, to me. There's nothing like a word of love, from Silvia. The only one, I'm thinking of, is Silvia. Feeling so sad now. I'll be so glad now. If i just had my Silvia, with me. That old weeping willow, seems to whisper her name. ""Why did she go away? "". The tears on my pillow, there not hard to explain. There's nothing else i could say. I'm waiting for a word of love, from Silvia. You think she never heard a love, my Silvia. But, when I'm with her, lord i forgive her. Cause' she's more then the whole world, to me. There's nothing in the world, than my Silvia. The only one I'm thinking of is Silvia. Feeling so sad now, I'll be so glad now. If I just had my Silvia, with me"
(excerpt from) the jaycees speech,"When I was a child, ladies and gentlemen, I was a dreamer.. I read comic books, and I was the hero of the comic book. I saw movies, and I. was the hero in the movie.So every dream I ever dreamed has come true a hundred. times. These gentlemen over there, these are the type who care, are dedicated.. You realize if it&acute;s not possible that they might be building the kingdom,. it&acute;s not far-fetched from reality. I&acute;d like to say that I learned. very early in life that:. 'Without a song the day would never end. Without a song a man ain&acute;t got a friend. Without a song the road would never bend. Without a song...'. So I keep singing a song.. Good night.."
"(it's a) long, lonely highway","It's a long lonely highway when you're travellin' all alone. And it's a mean old world when you got no-one to call your own. And you pass through towns too small to even have a name, oh yes. But you gotta keep on goin', on that road to nowhere. Gotta keep on goin', though there's no-one to care. Just keep movin' down the line. It's a long lonely highway without her by my side. And it's a trail full of teardrops that keep on being cried. My heart's so heavy it's a low down dirty shame oh yes. You gotta keep on goin', on that road to nowhere. Gotta keep on goin', though there's no-one to care. Just keep movin' down the line. I gotta rock for my pillow 'neath a weeping willow. And the cool grass for my bed. My drinking water's muddy so don't you tell me buddy. That I wouldn't be better off dead. It's a long lonely highway gettin' longer all the time. And if she don't come and get me. Well, I'm gonna lose my mind. So if you read about me tell her she's the one to blame, oh yes. You gotta keep on goin', on that road to nowhere. Gotta keep on goin', though there's no-one to care. Just keep movin' down the line. Movin' down the line. Movin' down the line"
(let me be your) teddy bear,"Baby let me be,. your lovin' Teddy Bear. Put a chain around my neck,. and lead me anywhere. Oh let me be. Your teddy bear.. I don't wanna be a tiger. Cause tigers play too rough. I don't wanna be a lion. 'Cause lions ain't the kind. you love enough.. Just wanna be, your Teddy Bear. Put a chain around my neck. and lead me anywhere. Oh let me be. Your teddy bear.. Baby let me be, around you every night. Run your fingers through my hair,. And cuddle me real tight."
(marie's the name of) his latest flame,A very old friend came by today. 'Cause he was telling everyone in town. About the love that he just found. And Marie's the name of his latest flame. He talked and talked and I heard him say. That she had the longest blackest hair. The prettiest green eyes anywhere. And Marie's the name of his latest flame. Though I smiled the tears inside were a-burning. I wished him luck and then he said goodbye. He was gone but still his words kept returning. What else was there for me to do but cry. Would you believe that yesterday. This girl was in my arms and swore to me. She'd be mine eternally. And Marie's the name of his latest flame. Though I smiled the tears inside were a-burning. I wished him luck and then he said goodbye. He was gone but still his words kept returning. What else was there for me to do but cry. Would you believe that yesterday. This girl was in my arms and swore to me. She'd be mine eternally. And Marie's the name of his latest flame. Yeah Marie's the name of his latest flame. Oh Marie's the name of his latest flame.
(now and then there's) a fool such as i,"(Now and then there's a fool such as I). Pardon me, if I’m sentimental. When we say goodbye. Don't be angry with me should I cry. When you're gone, yet I’ll dream. A little dream as years go by. Now and then there's a fool such as I. Now and then there's a fool such as I am over you. You taught me how to love. And now you say that we are through. I'm a fool, but I’ll love you dear. Until the day I die. Now and then there's a fool such as I. Now and then there's a fool such as I am over you. You taught me how to love. And now you say that we are through. I'm a fool, but I’ll love you dear. Until the day I die. Now and then there's a fool such as I. Now and then there's a fool such as I. Now and then there's a fool such as I"
(such an) easy question,"(words & music by Blackwell - Scott). Do you or don't you love me. Such an easy question. Why can't I get an answer. Tell me, will you or won't you need me. Such an easy question. Why can't I get an answer. All you do is give a sigh. And beat around the bush. Can it be that you're too shy. To give yourself a little old push. Can you or can't you tell me yes. It's such an easy question."
