lover leaver taker believer,"Oh my holy lord. Sets my soul on fire. Flames of love and sweet perfume. She's my heart's desire. She's an angel straight from hell. Pulls me to the deep. In the darkness way below. It's my heart she'll keep. Thunder underground. Watch the castle fall. Sound of wind it takes the sky. Winter takes us all. Mountain high against the sky. Watches as we pray. Laughing out and smiling proud. This is where we lay. Lover, leaver, taker, believer. Oh god hell fire. Watch his fingers raise. So he'll fall down to his knees. And watch the fire blaze. Satan plays his flute for you. The sound it burns to hear. Watch is eyes. His peace of mind slips in place of fear"
"lover, leaver","Oh my holy Lord!. She sets my soul on fire. Flames of love and sweet perfumeshe's my heart's desire. She's an angel straight from Hell. Draws me to the deep. In the darkness, way below. It's my heart she'll keep. Thunder underground. Watch the castle fall. Sound of wind, it takes the sky. Winter takes us all. Mountain-eye it hits the sky. Watches as we pray. Laughing out and smiling proud. This is where we lay. Lover. Leaver. Taker. Believer. Oh God! Hellfire. Witch of Endor raised. Saul did fall to his knees. Watched the fire blaze. Satan plays his flute for him. The sound it burns his ears. Watches as a piece of man. Slips and disappears. Lover. Leaver. Taker. Believer. Believer"
"lover, leaver (taker, believer)","Oh my holy lord. Sets my soul on fire. Flames of love and sweet perfume. She's my heart's desire. She's an angel straight from Hell. Draws me to the deep. In the darkness way below. It's my heart she'll keep. Yeah. Thunder underground. Watch the castle fall. Sound of wind it takes the sky. And winter takes us all. Mountain high against the sky. Watches as we pray. Laughing loud and smiling proud. This is where we lay. Lover. Leaver. Taker. Believer. Oh god hellfire. Witch of Endor raised. Saul would fall to his knees, watch the fire blaze. Satan plays his flute for him. The sound it burns his ears. Watches as the peace of man slips and disappears. Lover. Leaver. Taker. Believer. We've found ourself climbing stairs"
meet on the ledge,"We used to say that come the day. We'd all be making songs. Or finding better words. These ideas never lasted long. The way is up along the road. The air is growing thin. Too many friends who tried. Blown off this mountain with the wind. Meet on the ledge, we're gonna meet on the ledge. When my time is up I'll see all my friends. Meet on the ledge, we're gonna meet on the ledge. If you really mean it, it all comes round again. Now I see I'm all alone. That's the only way to be. You'll have your chance again. Then you can do the work for me. Meet on the ledge, we're gonna meet on the ledge. When my time is up I'll see all my friends. Meet on the ledge, we're gonna meet on the ledge. If you really mean it, it all comes round again. Meet on the ledge, we're gonna meet on the ledge. When my time is up I'll see all my friends. Meet on the ledge, we're gonna meet on the ledge. If you really mean it, it all comes round again. We're gonna meet on the ledge, on the ledge. All comes round again. We're gonna meet on the ledge"
mountain of the sun,"The sun shines brighter from above. And you're the woman that I love. Climb the mountain even higher. To kiss the sun fight the fire. Oh, well. I'll make you mine. You're my sunshine. I'll make you mine. You're my sunshine. Take me with you when you go. To be with you is all I know. As we ride, we light the fire. The second sun's our love's desire. Oh, well. I'll make you mine. You're my sunshine. I'll make you mine. You're my sunshine. The sun shines brighter from above. And you're the woman that I love. We climb the mountain even higher. Kiss the sun, fight the fire. I'll make you mine. You're my sunshine. I'll make you mine. You're my sunshine"
safari song,Ah yeah. Oh lady when ya come on down. Won't ya come on down. I said to my town. Oh mama when ya come on down. Won't ya come on down. I said to my home. Oo lady won't you move my way. Can't ya move my way. I'm getting hazy. Oh mama when you give your lovin'. When you give your love. You drive me crazy. Ah mama what you gonna do. With all that love in your heart. Ah mama what you gonna say. About that love in your heart. Oh mama when you walk this way. Why don't you give some lovin'. Oo mama what you gonna do. With all that lovin' in your heart. See mama gotta feel your everything. Feel your everything. I really wanna know. See mama when you shine you're shinin' bright. Give you're given right. I really want our love to grow. See mama when your heart is in its place. See that smilin' face. It's all I wanna do. See mama every time that you are near. It's when your gonna fear. You're never gonna come back home. Ah mama what you gonna do. With all that love in your heart. Ah mama what you gonna say. About that love in your heart. Oh mama when you walk this way. Why don't you give some lovin'. Oo mama what you gonna do. With all that lovin' in your heart. Do you remember what I said. When I got down on my knees. Gotta get your lovin' baby. Lovin's all I need. Don't make me beg now baby. Don't make me bleed. I gave you all a man could give. And you still walked out on me. Ah mama what you gonna do. With all that love in your heart. Ah mama what you gonna say. About that love in your heart. Oh mama when you walk this way. Why don't you give some lovin'. Oo mama what you gonna do. With all that lovin' in your heart. Your heart. Your heart. Your heart. Your heart. Lovin'. Burnin. Fire. Aw yeah
talk on the street,Oh mama you lie in ruin. Can't you see what you've done. Well I've been there before. What's this war that you won. Oh mama you walk this way. And I'm crying inside. Well I've been there before. And you know that it's time. And everybody's talking. But you never let them know. Yes I can hear them talking. Everyone knows. That's there's talking on the streets. Remember the days. When there's no one to defeat. Follow me down. To the mountain of the sun. Forgetting the end. As your new life has begun. Look mama the light is low. And the darkness near. Yes everyone is looking for me and you. And the night's what you fear. Walk someone they follow us. And you're all undone. Yes everyone is looking for me and you. And the war has begun. And everybody's talking. But you never let 'em know. Yes I can hear them talking. Everyone knows. That's there's talking on the streets. Remember the days. When there's no one to defeat. Follow me down. To the mountain of the sun. Forgetting the end. As your new life has begun. And everybody's talking. And you never let them know. Yes I can hear them talking. And you never let them know
the cold wind,"Oh sweet mama, lay me down in my grave. Leave me baby, I'm too far gone to save. The snow is comin', all the village folk know. This wicked shiver, chills me down to my soul. Only time will tell. Take the ox to town and you can sell. And leave me in my bed. Today. The Yankee peddler bargains with you on his way. Woe sweet mama's gotten herself a new dray. Keep the children snug as the wagon rolls on. When the cold wind blows most of them will be gone. Only time can tell. Take the ox to town and I'll get well. And leave me in my bed. Today. Only time will tell. You take the ox to town and you can sell. And leave me in my bed. Today"
the new day,"Let the new day shine its light on me. Shake the old way, nights too dark to see. Free tomorrow, it's bright with something new. Believe the righteous, and it will come true. You're a child in the garden. You're growing up I'll watch you bloom. And your dreams are not forgotten. You'll be a woman soon. Love isn't greed it's a need that goes unspoken. Love doesn't leave when you fade away. Pain isn't vain if it means your heart's been broken. Pain is the same as a means to heal. Let me try love, you know I'm only one. Live or die love, I tried and to me won. We're the future, it's hard to say we know. And the suture is what we have to sew. You are a child in the garden. You're growing up I'll watch you bloom. And your dreams are not forgotten. You'll be a woman soon. Love isn't greed it's a need that goes unspoken. Love doesn't leave when you fade away. Pain isn't vain if it means your heart's been broken. Pain is the same as means to heal. Love doesn't fade away (x2)"
watching over,Many long years amongst the trees. Many long years underground. To be the one that's never seen. The one that stands and watches over. I wonder when we'll realize. This is what we got left. And it's on demise. With the border rising. And the answers there. Still the children smiling. And we see no share. This is what we all have seen. Too many years getting down. Even thought we couldn't believe. It's only clearer in a mirror. I wonder when we all realize. This is what we got left. And it's on demise. With the border rising. And the answers there. Still the children smiling. And we see no share. Never seen. Never seen
when the curtain falls,"Well, you feel pretty and I love you so. You know I'm your biggest fan. I saw your picture and it's the best. The finest in the land. Camera lights and action. And words you know so well. You're in and out of fashion. In Hollywood of hell. When the curtain falls. Walk the hollow halls babe. Once a valley doll. Now you're not at all. No. Well I love you in that movie show. Can I have your autograph. It's so funny you have such charm. And whole thing made me laugh. Obetral and cocktails. You're counting all your rings. They all said they loved you. (Didn't they darlin'). Well they've taken all your things. When the curtain falls. Walk the hollow halls babe. Once a valley doll. Now you're not at all. No. Well listen darlin. It's been real swell. What can I say. You've got it all. You're a one woman show. But I'm not gonna' lie. You could use a little work. Well at your age. What've you got baby. When the curtain falls. Walk the hollow halls babe. Once a valley doll. Now you're not at all. Goodbye baby, goodbye"
you're the one,"Babe, ain't no denyin. That I've got you in my head. Girl, I'd be flyin. If you stood yourself and said. You're the one I want. You're the one I need. You're the one I have. So come on back to me. Girl, you're so young and pretty. But you're evil, you wouldn't know. Darling, ain't that a pity. Well I almost lost my mind. You're the one I want. You're the one I need. You're the one I have. So come on back to me. See, where we've been. That you'll hold my hand and stay awhile. You're the one I want. You're the one I need. You're the one I have. So come on back to me. Come on baby"
