lethal,"Go, try to go there. Door to door in a loop. Nobody found in their eye. Hidden scenes. Flooded dreams. Caring less. Please let me rust in a way I know. Wild it will be now soon. Let it rot and let be with no sun. (Chorus). Coming,. Does it all fit to me?. Is it over?. Growing in this town. Does it hold any mean?. Is it over?. Leaving me a step behind. Rolling and rolling. Lost in the sense of truth. Blind between dead and alive. Motorized. Blinded sight. Aiming less. Please let me rust in a way I know. Wild it will be now soon. Let it rot and let be with no sun. (Chorus). Coming,. Does it all fit to me?. Is it over?. Growing in this town. Does it hold any meaning?. Is it over?. Leaving me behind. Hide. Burns now to know. I got to get out. Give away your life. Give away your God. Give away, I demand to me. Give away your life,. Give away your God. Throw them away!. Give away your life. Give away your God. Give away, I demand to me. Give away your life,. Give away your God. Throw them away!. (Chorus). Coming,. Does it all fit to me?. Is it over?. Growing in this town. Does it hold any meaning?. Is it over?. Down, forever low."
logic behind heads or tails,"Moving figures from the night before,. Matching past days with moments to come.. Raging for noble values, three becoming one. You seem to know all my lives a past away from me. No conclusions, near of a breakdown. Among tricky options. Deal with it somehow. Wrong ways are going and don't turn around.. Shine, through a cloudy night a view that pictures bye.. Shine, just the two of us, no one but me and them!. I cannot believe the things you said to me, see no sign of you. (Can't get enough!). Hear a whisper, it follows me, perspective is coming through. (It feels like voodoo). It controls your empty side,. It denies all hopes you buy.. I walk, live, I breathe again. I try to read what’s between the lines of doubts on my shoulders,. It digs in my skin!. Among tricky options. Deal with it somehow. Wrong ways are going, don't turn around.. Shine, through a cloudy night a view that pictures bye.. Shine, just the two of us, no one but me and them!. Though we all refuse to know somewhere else to be. Unable to hide, writing fate through me. The choice isn't mine, unlock your mind!"
meeting her eyes,"Blind feelings went blind and fade in me. Quick as a blink, they seem to hypnotize. A scene's flowing towards his old home. Means he's holding truth behind. A reason to believe in me. A reason to believe in me. Real illusions fill my mind. Betrail comes to define. Life pointed directions. That wasn't meant to be. Holding on pressure. Pressure make us believe. Beware, don't believe in what your eyes will see!. Make him believe. Bring him to be. What the eye can see. The old lady is showing draws. That I have never seen. My brother is locked between two worlds. Because of me. Make him believe. Bring him to be. What the eye can see"
not free enough,"Weary and alone. My childhood is long gone. My eyes are dry. I feel like a stone. No one in a dozen years. No one seems to know. That I'm alive. Being held this long. One day I'll get out and live. (Chorus). Live it hard. One day I'll get out. Live it hard. One day I'll get out. To be long and remain. Looking back. Now I'm losing. Wind strikes me hard. Allied with an endless storm. Fearing to find. Where I belong. Crying frozen tears. Warming my godless soul. Am I alive?. Dead all along. One day I'll get out and live. (Chorus). Live it hard. One day I'll get out. Live it hard. One day I'll get out. To be long and remain. Looking back. I'm losing. Some bad events will come for you sometimes. Survive, tomorrow to meed. a little of all rights. Somehow. To season on. It's just rising indeed. And now regain the world. It's my ride. No more, now I breathe. And I own my way brother. Suddenly so nice. To regain the world is all that I've dreamed. In a manner usual. It`s alright. (Chorus). Live it hard. One day I'll get out. Live it hard. One day I'll get out. To be long and remain. Looking back. Now I'm losing. So come back. Where anyone is changing me. I can do what I think. It`s right among these walls. So come back. Where anyone chases me. Freedom can be found. Only when I'm alone"
"october, 17th","There´s nothing you can do to bring. him back to this life. You do not hold the key to your. dream. You deny every dream that you see!. Your heart´s still growing cold, you. don´t know how evil is your soul. You don´t see that difference. between,. From a lost soul and the guilt within"
reset the future,Have you ever felt that you can. No longer hold to your past. It’s like you have changed. When everything remains the same. And you just don’t fit inside you. You can’t stand being around you. You predict your days to come as unpredictable. I wasn’t born to follow. I rather write my own destiny. I just wanna hold life with my bare hands. CHORUS. Reset. I reset my future. I will. So I can call it mine. Reset. I reset the future. Reset right now. Have you ever felt you won’t last. Life is a cell filled with poisoned gas. You are trapped and framed for. Being different from the rest. And you just don’t care enough to. Try to change and be who they knew. I found the place where. I can be invincible. I’m not here to swallow. My pride or my misery. A story untold. By whom I was to be. CHORUS. Reset. I reset my future. Reset. So I can call it mine. Reset. I reset the future. Reset right now. And you just don’t fit inside you. You can’t stand being around you. You predict your days to come as unpredictable. I wasn’t born to follow. I rather write my own destiny. I just wanna hold life with my bare hands. And you just don’t care enough to. Try to change and be who they knew. I found the place where. I can be invincible. I’m not here to swallow. My pride or my misery. A story untold. By whom I was to be. CHORUS. Reset. I reset the future. Reset. So I can call it mine
rules of engagement,"Armored tanks storming out from the base. It tattoo the road with the world annihilation. Aircrafts getting ready to land. They are clouding the sky. Spread all over the radar. Keep marching men `till the end through the pain. When there, you lay all of your blood. Pronounce thirteen chapters of the “Art of War”. Determining the fate of men. When the first day ended of that bloody May. Lives were stolen, lost inside a maze. And now before my eyes. A city falls to the ground. You call our name and wherever we’ll be there. Hand-to-hand combat placed in the sand. Fueled the sun. Unraveled by rage. Keep bleeding bad through my vein for your sake. Keep firing hard, hostiles are down.. Pronounce thirteen chapters of the “Art of War”. Determining the fate of men. When the first day ended of that bloody May. Lives were stolen, lost inside a maze. And now before my eyes a city falls to the ground. You call our name and wherever we’ll be there. Call Us. Call Us. Call Us. Call Us. When the first day ended of that bloody May. Lives were stolen, lost inside a maze. And now before my eyes. A city falls to the ground. You call our name and wherever we’ll be there. When the first day ended of that bloody May. Lives were stolen and lost. And now before my eyes. A city falls to the ground. You call our name, we’ll be there"
so that life move along,"My time is ticking by. For you so many times, I cried.. Don’t let them steal your hope,. You’re stronger than you think,. What you are is not what it seems. Situations have been awful. But I know you’ll top these problems,. So that life moves along!. So that life can move along!"
said and done,"Call me when there’s a lack of faith. Call me shiver. A con of fate. I drew the line that divides men from child,. Sheeps from timber wolves. I hold the dark when light finds space. (Chorus). What have I done?. I am a prisoner. I extend my hand. And you deny it. What have you done?. Your home of sand and dust. You are letting it go. A life so meaningless,. With nothing to live for. Nothing to live for. . Call me when there`s a sense of haze. I am a whisper. An eco of fate. I`ve sold my life to rely on your eyes. Sweet and simple words. You bought me dark when I found grace. (Chorus). What have I done?. I am a prisoner. I extend my hand. And you deny it. What have you done?. Your home of sand and dust. You are letting it go. A life so meaningless,. With nothing to live for. Nothing to live for. . Flaw loves this drawing loss. The minute you draft for redemption. Loving the sleazy life?. One minute to overcome. I hope, what takes away will bring to me. What it takes to be alive?. I am distant from home. Strong forever. I hold you in my arms. (Chorus). What have I done?. I am a prisoner. I extend my hand. And you deny it. What have you done?. Your home of sand and dust. You are letting it go. A life so meaningless,. With nothing to live for. Nothing to live for. Nothing…"
shocking death bed confessions,"“Yes, I was excited that day.... This is a one way street and I was on the wrong way.. So I kept quiet with my thoughts,. I was not expecting something terrible to happen to me on that day.. So I decided to join this unit, over 6 years of training.... Remember I was in the second building,. the highest one.. It was hot…”. . Radio warning:. Check sides and rear.. In row we know which door to crash…. Ready, Set, Go!. (Fire escape is covered!). No one near, yet I know something was there.. “…and I was God damn right.”. Demo breaks? Don’t get me wrong,. This is the time bullets won’t paint your face.. Raid floats in the air.. Tension in and out.. Down, wait.... Cocking back the gun... on me!. How did they get me?. I had five men, giving full back up!. I felt the steel against my head.. Was I alone? I cannot believe!. Radio off, guns taken, someone lead me out.. Rushed inside a car, driving out of town.. What more now?!. Fierce, fast my, heart speeds.. Not knowing is screaming in silence.. If I had only my tracking device…. They’d be looking for me now.. . Car slows down,. Voices over,. Doors open…. Sun,. Damn. Blackened!. Under level, left, a light.. Cold weather, fearful sight…. Do you feel like dying tonight?. Yeah!. . Roaming,. Seems to be way off my case:. Red Dawn.. Driving into my crime memories,. Dive in my dark side.... Reward,. Wrong Cause,. Rotates.. We lie, you lie;. “Game goes on…”. . Willing to find. who is behind this grand scenario.. Creeping voyage,. Leading me along,. Long night…. Creepy Voyage!. Riot…. Awake?. Who decides?. Tomorrow may be... oh!. . (He lies down, restless alone.... A lifetime, his mind have shown, awake). He is all we’re after.. Choppers film the zone.. Wait until sundown;. we’ll strike at night.... . Lead me through a caveway;. Camouflage is on…. War survivor,. I have crossed the red lines.. Without fuel,. Accidental true.. Way before those lonely days of glory.. Signs.... . Memories, my mistakes, so long.... Comes back to me... Sorrow!. Leave me, let go, but it Haunts.. Eternally I’ll be my own crime.... Oh… no!. . In time to read what’s coming on.. A late and hungry fright.. Sooner or later I…. Will roarback at them!. It can’t be… no way!. Dead Rise?. . “By my side a simple man…”. Carries all the guilt.. . Too much to me,. I swear it now.. Too much to me…. Concerning to be found.. Against a wrong surrender…. Ahead a world of lies.. . Alert!!!. Daredevil me to end with this life!. This form, so bitter.. Wrong cause is now rotating towing me…. Another railroad!. . God… God may disappoint.. Is like divine,. Except I may not survive.. . Give all in?. Revolving.... Evolving.... Give all in?. Yeah…. (He goes near a window and listens... carefully.). Long waiting…. Rolling information down.. Wasting time…. “Wasted.”. . Now that I found. who is behind this grand scenario…. A day in my life…. Forever bleeds an evil mind.. Creeping voyage,. Yearning the years I was gone.. Creepy voyage!. Aiming heart and soul.. Visions remain in control…. . Careless health condition.... Death in someone’s body.. And…. Someone who will rely,. Heartfelt, so alone.. . Will it heal my wound?. A desperate fade into the light…. Will he live on?. It takes away from him,. The reason to fight!. . Hide…. In a world where we are alone,. So alone.. Only way to feel alive…. Taking other lives down.. I wait in the middle of the night. Unknown!. Wish I could fake this second soul…. It is really coming on.. I’m in deed not alone.. It is real!. Will it heal my wound?. Daily dose of a mean soul…. “Among the moral or ethical rules humanity has imposed on itself, not killing may rank as the first.. Yet there are exceptions.. Killing predators to prevent them from eating the sheep before we do seems fine.. The controversial part is when we try to analyze the blurry line that divides bad killing from the good or indifferent one.. I still live to pick the right ones...”. . Mayhem,. Red Eye,. Caught I!"
shocking deathbed confessions,"""Yes, I was excited that day.... This is a one way street and I was on the wrong way.. So I kept quiet with my thoughts,. I was not expecting something terrible to happen to me on that day.. So I decided to join this unit, over 6 years of training.... Remember I was in the second building,. the highest one.. It was hot..."". . Radio warning:. Check sides and rear.. In row we know which door to crash.... Ready, Set, Go!. (Fire escape is covered!). No one near, yet I know something was there.. ""...and I was God damn right."". Demo breaks? Don't get me wrong,. This is the time bullets won't paint your face.. Raid floats in the air.. Tension in and out.. Down, wait.... Cocking back the gun... on me!. How did they get me?. I had five men, giving full back up!. I felt the steel against my head.. Was I alone? I cannot believe!. Radio off, guns taken, someone lead me out.. Rushed inside a car, driving out of town.. What more now?!. Fierce, fast my, heart speeds.. Not knowing is screaming in silence.. If I had only my tracking device.... They'd be looking for me now.. . Car slows down,. Voices over,. Doors open.... Sun,. Damn. Blackened!. Under level, left, a light.. Cold weather, fearful sight.... Do you feel like dying tonight?. Yeah!. . Roaming,. Seems to be way off my case:. Red Dawn.. Driving into my crime memories,. Dive in my dark side.... Reward,. Wrong Cause,. Rotates.. We lie, you lie;. ""Game goes on..."". . Willing to find. who is behind this grand scenario.. Creeping voyage,. Leading me along,. Long night.... Creepy Voyage!. Riot.... Awake?. Who decides?. Tomorrow may be... oh!. . (He lies down, restless alone.... A lifetime, his mind have shown, awake). He is all we're after.. Choppers film the zone.. Wait until sundown;. we'll strike at night.... . Lead me through a caveway;. Camouflage is on.... War survivor,. I have crossed the red lines.. Without fuel,. Accidental true.. Way before those lonely days of glory.. Signs.... . Memories, my mistakes, so long.... Comes back to me... Sorrow!. Leave me, let go, but it Haunts.. Eternally I'll be my own crime.... Oh... no!. . In time to read what's coming on.. A late and hungry fright.. Sooner or later I.... Will roarback at them!. It can't be... no way!. Dead Rise?. . ""By my side a simple man..."". Carries all the guilt.. . Too much to me,. I swear it now.. Too much to me.... Concerning to be found.. Against a wrong surrender.... Ahead a world of lies.. . Alert!!!. Daredevil me to end with this life!. This form, so bitter.. Wrong cause is now rotating towing me.... Another railroad!. . God... God may disappoint.. Is like divine,. Except I may not survive.. . Give all in?. Revolving.... Evolving.... Give all in?. Yeah.... (He goes near a window and listens... carefully.). Long waiting.... Rolling information down.. Wasting time.... ""Wasted."". . Now that I found. who is behind this grand scenario.... A day in my life.... Forever bleeds an evil mind.. Creeping voyage,. Yearning the years I was gone.. Creepy voyage!. Aiming heart and soul.. Visions remain in control.... . Careless health condition.... Death in someone's body.. And.... Someone who will rely,. Heartfelt, so alone.. . Will it heal my wound?. A desperate fade into the light.... Will he live on?. It takes away from him,. The reason to fight!. . Hide.... In a world where we are alone,. So alone.. Only way to feel alive.... Taking other lives down.. I wait in the middle of the night. Unknown!. Wish I could fake this second soul.... It is really coming on.. I'm in deed not alone.. It is real!. Will it heal my wound?. Daily dose of a mean soul.... ""Among the moral or ethical rules humanity has imposed on itself, not killing may rank as the first.. Yet there are exceptions.. Killing predators to prevent them from eating the sheep before we do seems fine.. The controversial part is when we try to analyze the blurry line that divides bad killing from the good or indifferent one.. I still live to pick the right ones..."". . Mayhem,. Red Eye,. Caught I!"
shuffle up and deal,"Nine at the table. Sharpened skills. Aggressive players. Lights go dim for the thrill. Exchanging looks. Reading tells. Win in their eyes. Win in myself. Check it!. Bet it!. Or chose to fold!. Kings in hand It’s an all-in,. Flick of sweat on a nervous brow. Stimulates the crowd. Chips are placed measuring courage. Raise, Raise. All up to the sky. Our hearts beat faster. My heart is beating faster. Excited about the action. Lights go dim for the thrill. Just waiting the moment. I’m staring at the table. Feeling close to surreal. It’s up to you: check, bet or fold. Three words can lead it to the gold. Chips are placed measuring courage. Raise!. Check it!. Bet it!. Or choose to fold!. Kings in hand It’s an all-in,. Flick of sweat on a nervous brow. Stimulates the crowd. Chips are placed measuring courage. Raise, Raise. Call up to the sky. Our hearts beat faster. My heart is beating faster. Excited about the action. Lights go dim for the thrill. Just waiting the moment. I’m staring at the table. Feeling close to surreal. Increasing anxiety. It’s double or nothing for me. I calculated my odds and now. A Turn revealing a queen. The river flows with the king. It is time to show the cards,. and I’m. I’m all in. I’m all in. Check it!. Bet it!. Or choose to fold!"
so that life can move along,"my time is ticking by. For you so many times, I cried.. Don´t let them steal your hope,. You´re stronger than you think,. What you are is not what it. seems. Situations have been awful. But I know you´ll top these. problems. So that life moves along!. So that life can move along!"
tellavision another point of view,"Through his eyes I see it all,. His despair covers his fault. Everywhere is danger growing.. One more day, I pray for him to trust in me, believe in me.. My senses points to you but you don’t follow me, don’t even see.. My memory’s calling you, I know the truth inside. When all doors are closed you gave up your hope ‘cause you rather believe in your eyes.. I can show you the way to forever, but to you forever bleeds!. I craw searching for you, your light does never shine,. You gave up your hope cause you’d rather believe in your eyes.. Watching over you I see he’s coming. Challenging your efforts, no longer drawning. I see black vulture, movements all over me, surfing at the window,. Spelling my name, I figure they’re looking for me. Where’s is this all going?. You’d better accept the facts. (We are coming through!). You know she lives in you. (We live inside your pride). And you live in me.. The guilty is you and we’re here just to prove all you see is fiction and lie.. He’s talking to you, something that you hide.. The way to go through, one way that is you,. a picture of him on your side.. I did not betray, my brother who helped me raise,. I’ll be there for you even if I have to do a miracle, a sin or a crime."
the logic behind heads or tails,"Moving figures from the night before,. Matching past days with moments to come.. Raging for noble values, three becoming one. You seem to know all my lives a past away from me. No conclusions, near of a breakdown. Among tricky options. Deal with it somehow. Wrong ways are going and don’t turn around.. Shine, through a cloudy night a view that pictures bye.. Shine, just the two of us, no one but me and them!. I cannot believe the things you said to me, see no sign of you. (Can’t get enough!). Hear a whisper, it follows me, perspective is coming through. (It feels like voodoo). It controls your empty side,. It denies all hopes you buy.. I walk, live, I breathe again. I try to read what’s between the lines of doubts on my shoulders,. It digs in my skin!. Among tricky options. Deal with it somehow. Wrong ways are going, don’t turn around.. Shine, through a cloudy night a view that pictures bye.. Shine, just the two of us, no one but me and them!. Though we all refuse to know somewhere else to be. Unable to hide, writing fate through me. The choice isn’t mine, unlock your mind!"
the ride,"A river blends with night. Fire burning up inside. Sensation is gone. Ignition off. Don't care to steer the wheel. The body thinks on it's own. Let the devil know I'm in her house tonight. . (Refrão). I'm feeling the fall. The wind rides with me. Just turn the ignition off. This night belongs to me. You cannot stop me now. Turn the ignition off. . Stone thrown towards the surface. Sinking as the river flows. It's sinking down. I'm sinking down. An inner quest, a healing way of life. Keeps the fire urging up inside. Death and glory holding hands. . (Refrão). I'm feeling the fall. The wind rides with me. Just turn the ignition off. This night belongs to me. You cannot stop me now. Turn the ignition off. . And now a different shade of dark embraces the light. Cause I forgive myself for being me. My fortune is nothing more than a name to forget. Oh I am not afraid. . (Refrão). I'm feeling the fall. The wind rides with me. Turn the ignition off. This night belongs to me. You cannot stop me now. Turn the ignition off. . I'm free from it all.... It belongs to me.... You can't stop me now.... I'm turning ignition off"
thousand miles from you,"I see a thousand miles through you,. From love to just unfinished clues.. You always showed me how to live,. Always showed me how to live.. Go on and take this pain of mine,. I promise I will end this and die.. You've always showed me how to live,. Still show me how to live.. Eyes closed to see,. What lies inside of me,. Easily, you're going to find in me, you.. A thousand miles from you, endless way home,. I navigate on seas unknown.. Leave me so I can move on,. Build strength on my own.. Another time brand new for me.. Starts, a movie in slow motion,. Frame loosing colors,. Drying the oceans.. All there is, is a gray dark cloud,. Rising a shield facing my sun.. But I won't take cover,. I look over my shoulder,. Miles from you."
thrust into this game,"Intro. I don’t need no dialogue. I already have you. If I have to lie, steal, cheat or kill. My God as a witness. Verse. Mad as hell. I’m not gonna take this anymore. Go ahead. Make my day. It’s time for me to restore. And when it’s all over. I’ll be hungry again. And when it’s all over. I’ll be hungry again and again and again. Chorus. We own the rights. We’re just thrust into this game. Thrust into this game. The most dangerous plot. We’ve ever had to face. Thrust into this game. Verse. Made our past. from a big and empty jaw of lies. Broken bones. Scattered face. It’s time for me to be reborn. And when it’s all over. I’ll be hungry again. And when all hope is over. I’ll be hungry again and again and again. Chorus. We own the rights. We’re just thrust into this game. Thrust into this game. The most dangerous plot. We’ve ever had to face. Thrust into this game. Thrust into this game. The heat is off. Guitar Solo. Chorus. We own the rights. We’re just thrust into this game. Thrust into this game. The most dangerous plot. We’ve ever had to face. Thrust into this game. Chorus. We own the rights. We”re just thrust into this game. Thrust into!. We own the rights!. The most dangerous plot. We’ve ever had to face. Thrust into this game!"
to say goodbye,"Verse. And so it happened. Such a sad day,. It makes him wonder. Inspired by this pain. Friends and family gather now. They’re trying to reconnect. The priest at the altar. He’s talking to a saint. Pre Chorus. From a heart that won’t heal for now. From a friend that missed the chance. To say goodbye. Chorus. On a long road trip we’ll walk together. Recalling days. Walking on I see a new direction. Yes, I’m on it.. There I’ll be at peace so you remember,. Like wind and rain. On a long road trip we’ll walk together. Together. Verse. Life runs in circle. Most don’t understand. A day after another. Closer to the end. Pre Chorus. From a heart that won’t heal for now. From a friend that missed the chance. To say goodbye. Chorus. On a long road trip we’ll walk together. Recalling days. Walking on I see a new direction. Yes, I’m on it.. There I’ll be at peace so you remember,. Like wind and rain. On a long road trip we’ll walk together. Together. Solo. Lying on a star,. Flying through my dearest memories. A warm embrace. Candles bring the light,. Path is clear now for me to be. Chorus. On a long road trip we’ll walk together. Recalling days. Walking on I see a new direction. Yes, I’m on it.. There I’ll be at peace so you remember,. Like wind and rain. On a long road trip we’ll walk together. Together"
