evil genius,"They were so ecstatic when the letter arrived. A certified genius at the age of five. They planned his future so carefully. He was everything they hoped he'd be. He was a model child, a devoted son. Loved and admired by everyone. He played out every role, a ""T.V. hero"". He lived his life in a video fantasy. He was good at school, never failed a grade. They gave him hopes and dreams, and taught him not to hate. He had rules he learned to break for fun. Now he's hidin', `cause his fingerprints on the gun. Why'd ya' have to do it Evil Genius?. Was it justified in your mind?. Why'd ya' put us through it Evil Genius?. Was it justified in your mind anytime you held a grudge?. Was it something said that pushed you over the line?. Your best interests were in our minds. You kept it so well hidden, we never knew. No one ever expected anything like this from you. Why'd ya' have to do it Evil Genius?. Was it justified in your mind?. Why'd ya' put us through it Evil Genius?. Was it justified in your mind anytime you held a grudge?. Why'd ya' have to do it Evil Genius?. Was it justified in your mind?. Why'd ya' put us through it Evil Genius?. Was it justified in your mind anytime you held a grudge?."
fight it out,"I heard you say you're feelin' like a change now. Maybe, baby this could be arranged now. But I warn you that no exotic scenery. Will solve your problems or make you feel easy. You say you're happy, but I see apprehension. That little laugh of yours doesn't hide the tension. The precious book you clutch so tightly in your hands. Won't help you sleep at night, won't iron out your plans. You gotta Fight It Out with your heart. You got to Fight It, though it tears you apart. You got to Fight It Out, my friend. You got to do it for yourself. You got to say when. You ask advice, then resent my observations. If I didn't care, then I wouldn't make them. Can't change the past, so why let it haunt you. Can paint the future, but first you have to want to. You gotta Fight It Out with your heart. You got to Fight It, though it tears you apart. You got to Fight It Out, my friend. You got to do it for yourself. You got to say when. I can see how much you hurt inside. I know all about the tears you hide. You gotta Fight It Out with your heart. You got to Fight It, though it tears you apart. You got to Fight It Out, my friend. You gotta Fight It Out with your heart. You got to Fight It, though it tears you apart. You got to Fight It Out, my friend. You know that the lonely pay a price for love in the end. You know that the lonely pay a price for love in the end. It's always the lonely who pay a price for love in the end."
fire and ice,"Ooo, you're givin' me the fever tonight. I don't wanna give in. I'd be playin' with fire. You forget, I've seen you work before. Take `em straight to the top. Leave `em cryin' for more. I've seen you burn `em before. Chorus:. Fire and Ice. You come on like a flame. Then you turn a cold shoulder. Fire and Ice. I wanna give you my love. But you'll just take a little piece of my heart. You'll just tear it apart. Movin' in for the kill tonight. You got every advantage when they put out the lights. It's not so pretty when it fades away. Cause it's just an illusion in this passion play. I've seen you burn `em before. (Chorus). So you think you got it all figured out. You're an expert in the field, without a doubt. But I know your methods inside and out. And I won't be takin' in by Fire and Ice. (Chorus). You come on like a flame. Then you turn a cold shoulder. Fire and Ice. I wanna give you my love. But you'll just take a little piece of my heart. You come on like a flame. Then you turn a cold shoulder. Fire and Ice. You come on like a flame. Then you turn a cold shoulder. Fire and Ice."
get nervous,"Get Nervous...Get Nervous. Get Nervous...Get Nervous. Get Nervous...Get Nervous. Get Nervous...Get Nervous. Get Nervous...Get Nervous. I feel a little shaky, I can't control my nerves. I know you think I'm fakin', but can't you feel the curves?. I swear to you I feel it, it scares me half to death. It gathers in my throat and it gathers up my breath. Anxiety - Got me on the run. Anxiety - Yeah, I just need someone. Anxiety - Can't get nothin' done. Anxiety - Spoils all the fun. I'm picking up the telephone, there's no one I can call. I need somebody bad tonight, can't find no sleep at all. I wish I could relax, I just can't stop my mind. I wish I could collapse but my body's not that kind. Anxiety - Got me on the run. Anxiety - Yeah, I just need someone. Anxiety - Can't get nothin' done. Anxiety - Spoils all the fun. Can't you hear my heartbeat, hear the way it sounds?. Can't you hear my heartbeat, Y' hear the way it pounds?. Just give me somethin' to slow it down, Yeah. Sometimes in the city, sometimes in my car. I pound on the windows like a bee inside a jar. Anxiety - Got me on the run. Anxiety - Yeah, I just need someone. Anxiety - Can't get nothin' done. Anxiety - Spoils all the fun. Anxiety - Got me on the run. Anxiety - Yeah, I just need someone. Anxiety - Can't get nothin' done. Anxiety - Spoils all the fun. Get Nervous...Get Nervous. Get Nervous...Get Nervous. Get Nervous...Get Nervous."
gina's song,"(...no need for lyrics on this one, right?...)."
girl,"Do you like the way it feels when you get hurt?. Maybe you should take a long hard look at your self-worth. There's an emptiness inside. It started many years ago. You always try to fill it up. It's a familiar place you go. One day you'll just have to wake up, girl. [Chorus]. You know you got a lot to learn. You've got to do it for yourself. Find your own direction, don't rely on someone else. You got to know it in your heart. You've got to build it up with love, it isn't hard to rise above. Wake up, you don't wanna make up. You've got to do it for yourself. I know it feels sometimes that loneliness is worse. And with every change there comes a melancholy search. Now you can walk away from this. It doesn't have to bring you down. Have faith in destiny you what goes around, comes around. You don't have to stay and take it, girl. [Chorus]. Got nowhere to run. Got nowhere to hide. These changes will come if you just open your eyes. Got nowhere to run. Got nowhere to hide. You gotta do it for yourself. You gotta know it in your heart."
go,"You say you'll always be there. But I know you won't. You say you love me, you swear. But I know you don't. [Chorus]. I got better things I can do ya know. Than waste all of my time on you. Why don't you just go. You say I got it all wrong. That everything's changed. But I know where I belong. It's far, far away. [Chorus]. Pick yourself up, get yourself moving. Don't turn around, just keep on going. There's nothing you can say. To change my mind today. There's only one thing left to do. I guess you'll have to go. You say you're a different man. But you know that's a lie. The truth is gonna set you. Free and so am I."
hard to believe,"Yesterday's a by-line, words upon a page. Tomorrow is a deadline, sudden and it's strange. Hard To Believe. You ever would leave, but you did. Hard To Believe. You ever would leave. Nowhere to go, can't sit still. Look for a motive in the time that I kill. Thinking of ways. To fill up my empty days, to fill up my empty days. Hard To Believe. u'd leave when I need you. I need you so, it's Hard To Believe. Hard To Believe. You'd leave when I need you. I need you so, it's Hard To Believe. Love is such a fine line, the finest line I've known. But sorrow is no life line when you're all alone. Hard To Believe. You ever would leave, but you did. Hard To Believe. You ever would leave. Can't sleep a wink, up all night. The truth hurts, you know it cuts like a knife. Thinking of ways. To fill up my empty life, to fill up my empty life. Hard To Believe. You'd leave when I need you. I need you so, it's Hard To Believe. Hard To Believe. You'd leave when I need you. I need you so, it's Hard To Believe. Hard To Believe. You'd leave when I need you. I need you so, it's Hard To Believe. Hard To Believe. You'd leave when I need you. I need you so, it's Hard To Believe."
have it all,"You think that you're the second coming. Sorry to say it doesn't do it for me. Must be a drag when you're so stunning. In all that you are. And all that you hope to be. [Chorus]. You can have it all, take it all. Break it all, forsake it all. Want it all, choose it all. Use it with no stake at all. Keep it all, trash it all. Lead it just like sheep it all. Hate it all, love it all, and still. You'll have nothing. Yeh, yeh. You think that you can walk on water. Better be careful, it gets mighty deep. I'd be afraid of what my thoughts were. You never know who'd be willing. To take that leap. [Chorus]. When you look in the mirror. Do you see any clearer. Or are you blinded. By your own vision. Or have you ever thought. That maybe you were wrong. Or do you just reside. In your illusion"
heartbreaker,"Your love is like a tidal wave. Spinning over my head. Drownin' me in your promises. Better left unsaid. You're the right kind of sinner. To release my inner fantasy. The invincible winner. And you know that you were born to be. You're a Heartbreaker. Dream Maker, Love Taker. Don't you mess around with me!. You're a Heartbreaker. Dream Maker, Love Taker. Don't you mess around - No No No!. Your love has set my soul on fire. Burnin' out of control. You taught me the ways of desire. Now its takin' its toll. You're the right kind of sinner. To release my inner fantasy. The invincible winner. And you know that you were born to be. You're a Heartbreaker. Dream Maker, Love Taker. Don't you mess around with me!. You're a Heartbreaker. Dream Maker, Love Taker. Don't you mess around - No No No!. You're the right kind of sinner. To release my inner fantasy. The invincible winner. And you know that you were born to be. You're a Heartbreaker. Dream Maker, Love Taker. Don't you mess around with me!. You're a Heartbreaker. Dream Maker, Love Taker. Don't you mess around with me!. You're a Heartbreaker. Dream Maker, Love Taker. Don't you mess around with me!. You're a Heartbreaker. Dream Maker, Love Taker. Heartbreaker!"
hell is for children,"They cry in the dark, so you can't see their tears. They hide in the light, so you can't see their fears. Forgive and forget, all the while. Love and pain become one and the same. In the eyes of a wounded child. Because Hell. Hell Is For Children. And you know that their little lives can become such a mess. Hell. Hell Is For Children. And you shouldn't have to pay for your love with your bones and your flesh. It's all so confusing, this brutal abusing. They blacken your eyes, and then apologize. You're daddy's good girl, and don't tell mommy a thing. Be a good little boy, and you'll get a new toy. Tell grandma you fell off the swing. Because Hell. Hell Is For Children. And you know that their little lives can become such a mess. Hell. Hell Is For Children. And you shouldn't have to pay for your love with your bones and your flesh. No, Hell Is For Children. Hell. Hell is for Hell. Hell is for Hell. Hell Is For Children. Hell. Hell is for Hell. Hell is for Hell. Hell Is For Children. Hell. Hell is for Hell. Hell is for Hell. Hell Is For Children. Hell Is For Children. Hell Is For Children."
helter skelter,"When I get to the bottom. I go back to the top of the slide. An' I stop, an' I turn, an' I go for a ride. Til I get to the bottom. An' I see you again. Yeh. Do you, don't you, want me to love you?. I'm comin' down fast, but I'm miles above you. Tell me, tell me, tell me. Come on, tell me the answer. Well, you may be a lover but you ain't no dancer. Lookout. Helter Skelter. Helter Skelter. Helter Skelter, Yeh. Will you, won't you, want me to make you?. I'm comin' down fast. But don't let me break you. Tell me, tell me, tell me the answer. You may be a lover but you ain't no dancer. Helter Skelter. Helter Skelter. Helter Skelter. Lookout. When I get to the bottom. I go back to the top of the slide. An' I stop, an' I turn, an' I go for a ride. Til I get to the bottom. An' I see you again. Yeh. Do you, don't you, want me to make you?. I'm coming down fast, but don't let me break you. Tell me, tell me, tell me your answer. Well, you may be a lover but you ain't no dancer. Helter Skelter. Helter Skelter. Helter Skelter. Helter Skelter, Yeh)."
here's my heart,"Our two worlds met in strange surprise. I hid my love in thin disguise. I tried to leave, how could I stay?. What if my heart gave me away?. I always thought I'd be prepared. But love just caught me unaware. You said the words and I believed. I fell so hard, I fell so deep. Love can't hide, though it tries. Hearts catch fire, so has mine. Here's My Heart. So true love triumphs once again. It always makes it in the end. And if you let the heart run free. It will return faithfully. Love can't hide, though it tries. Hearts catch fire, all the time. Helpless love walks the line. Hearts catch fire, the hour is fine. Here's My Heart. Ooh, Ooh. Love can't hide, though it tries. Hearts catch fire, all the time. Helpless love walks the line. Hearts catch fire, so has mine. Here's My Heart. Here's My Heart. Here's My Heart. Here's My Heart. Ooh... Hey, Hey, Hey. From the movie soundtrack ""Metropolis"" (1984). Music composed by: Giorgio Moroder. Lyrics by Pete Bellotte. Produced by Neil Geraldo, Peter Coleman, and Giorgio Moroder."
hit me with your best shot,"Well you're the real tough cookie with the long history. Of breaking little hearts, like the one in me. That's O.K., lets see how you do it. Put up your dukes, lets get down to it!. Hit Me With Your Best Shot!. Why Don't You Hit Me With Your Best Shot!. Hit Me With Your Best Shot!. Fire Away!. You come on with a ""come on"", you don't fight fair. But that's O.K, see if I care!. Knock me down, it's all in vain. I'll get right back on my feet again!. Hit Me With Your Best Shot!. Why Don't You Hit Me With Your Best Shot!. Hit Me With Your Best Shot!. Fire Away!. Well you're the real tough cookie with the long history. Of breaking little hearts, like the one in me. Before I put another notch in my lipstick case. You better make sure you put me in my place. Hit Me With Your Best Shot!. Come On, Hit Me With Your Best Shot!. Hit Me With Your Best Shot!. Fire Away!. Hit Me With Your Best Shot!. Why Don't You Hit Me With Your Best Shot!. Hit Me With Your Best Shot!. Fire Away!"
hot child in the city,"Danger in the shape of something wild. Stranger dressed in black she’s a hungry child. No one knows who she is or what her name is. I don’t know where she came from or what her game is. . Hot Child In The City. Hot Child In The City. Running wild and looking pretty. Hot Child In The City. . So young to be loose and on her own. Young boys they all want to take her home. When she goes down town the boys all stop and stare. When she goes down town she walks like she just don’t care. . Hot Child In The City. Hot Child In The City. Running wild and looking pretty, yeah. Hot Child In The City. . Come on down to my place baby. We’ll talk about love. Come on down to my place woman. And we’ll make love. . Hot Child In The City. Hot Child In The City. Running wild and looking pretty. Hot Child In The City…. HOT CHILD IN THE CITY. ."
i don't want to be your friend,"Did you see me last night. I was there in the dark. I saw her look at you, the way I used to. When I still had your heart.. I watched you take her hand. There was love in your eyes. I remember when you looked at me that way too. Before we said good-bye. I Don't Want To Be Your Friend. I just want to be your lover. I don't think I can pretend. That you mean nothing to me. It's hard enough to say good-bye. Even when you know it's over. I Don't Want To Be Your Friend. I Want To Be Your Lover And when I think I've had enough. And I just can't stand the pain. I reminisce about the way it felt. To have you every day. You know that every time I hear your voice. I still get a thrill. And there's nothing I can do about it. Am I gone from your thoughts, forgotten somehow. When you be there with her. Does my memory stir, any part of you now. I know that I should concede, face the truth and all that. I know I should realize I'm not a part of your life anymore,. But I can't. I Don't Want To Be Your Friend. I just want to be your lover. I don't think I can pretend. That you mean nothing to me. It's hard enough to say good-bye. Even when you know it's over. I Don't Want To Be Your Friend. I Want To Be Your Lover."
i feel lucky,"You gotta go with what you know, absolutely right. Well, I can tell you I feel lucky tonight. I gotta feelin' in my heart, two more for the fight. Hey, I can tell you I feel lucky tonight. Oh, I Feel Lucky. I Feel Lucky tonight. Well maybe just lucky enough. til you win your love for me. I Feel Lucky. I Feel Good, yeh. Alright, huh, huh. You better get it while you can. Got to treat it nice. Well, let the good times roll, I feel lucky tonight. Midus in my touch, moonlight up my sleeve. Hey I'm your wild card baby, take a chance with me. Oh, I Feel Lucky. I Feel Lucky tonight. Well maybe just lucky enough. til you win your love for me. I Feel Lucky. I Feel Good, yeh. Alright, huh, huh. I Feel Lucky , Whoa. Miami, New York, Chicago, St. Louis, Los Angeles,. Austin, New Orleans, Detroit, Cleaveland. ----------------------------------- now. Take a look around. It's the only game in town, I feel lucky tonight. I ain't waitin' on love, no. I don't waste no time. Hey, I'm ---------- black cat across my path. Oh, I Feel Lucky. I Feel Lucky tonight. Well maybe just lucky enough. til you win your love for me. I Feel Lucky. I Feel Lucky tonight. Well maybe just lucky enough. til you win your love for me. I Feel Lucky , I feel good - alright. From the album ""True Love""."
i get evil,"There's two kinds of people that I just can't stand. An evil hearted woman and a lyin' man. But don't you lie to me, don't you lie to me. Because it makes me feel like it's as evil as I can be. Told me that you loved me a long time ago. The woman that you had, you don't want her no more. But don't you lie to me, don't you lie to me. Because it makes me feel like it's as evil as a woman can be. You told me that you loved me a long time ago. The woman that you had, you don't want her no more. But don't you lie to me, don't you lie to me. Because it makes me feel like it's as evil as a woman can be. Hey, don't you lie to me. Don't you lie to me. No, No, don't you lie to me. Don't you lie to me. Because it makes me feel like it's as evil as a woman can be. Don't you lie to me. Don't you lie to me baby - No. Don't you lie to me. No - don't you lie to me. From the album ""True Love""."
i need a lover,"I Need A Lover that won't drive me crazy. I Need A Lover that won't drive me mad. I Need A Lover that won't drive me crazy. I Need A Lover that won't drive me crazy. Someone to thrill me, and then go away. I Need A Lover that won't drive me crazy. Someone that knows the meaning of ah - Hey hit the highway. Well I've been walking the streets in the evening. Racing through this human jungle at night. I'm so confused, my mind is indifferent. Hey - I'm so weak, won't someone shut out that light. Electricity runs thru the video. And I watch from this hole I call home. And all the stonies that are dancin' to the radio. I got the world calling me tonight on the phone. I Need A Lover that won't drive me crazy. I Need A Lover that won't drive me mad. I Need A Lover that won't drive me crazy. Someone that knows the meaning of ah - Hey hit the highway. Well I'm not wiped out by this poolroom life I'm livin'. But I'm gonna quit my job, and go to school, and head back home. Now I'm not asking to be loved or be forgiven. Hey - I just can't face shakin' in this bedroom one more night alone. I Need A Lover that won't drive me crazy. I Need A Lover that won't drive me mad. I Need A Lover that won't drive me crazy. Someone that knows the meaning of ah - Hey hit the highway. I Need A Lover that won't drive me crazy. Someone to thrill me, and then go away. I Need A Lover that won't drive me crazy. I Need A Lover that won't drive me crazy. I Need A Lover that won't drive me mad. I Need A Lover that won't drive me crazy. Someone that knows the meaning of ah - Hey hit the highway."
i want out,"Ooh baby, got a hold on me, I can't deny it. You locked the door and you swallowed the key. And I... and I kept quiet. Yeah baby, got a hold on me, I didn't want to be alone. I stayed with you `cause I really believed. That I couldn't make it on my own. But I'm getting a little bit smarter. Gettin' tired of playin' the martyr. And I know what you're all about. I Want Out!. I Want Out!. Ooh baby, your lovin' told on me, I couldn't smile anymore. My friends all told me, baby can't you see?. But I wasn't seeing clear before. Now I'm getting a little bit smarter. Gettin' tired of playin' the martyr. And I know what you're all about. I Want Out!. I Want Out!. Ooh baby, got a hold on me, I didn't want to be alone. I stayed with you `cause I really believed. That I couldn't make it. I Want Out!. Ooh baby, got a hold on me. I Want Out!. Ooh baby, got a hold on me. I Want Out!. Ooh baby, got a hold on me. I Want Out!. Ooh baby, got a hold on me. I Want Out!. Ooh baby, got a hold on me. I Want Out!. Ooh baby, got a hold on me. I Want Out!. Ooh baby, got a hold on me. I Want Out!. Ooh baby, got a hold on me. I Want Out!."
i won't,"I was there when you cried like a baby. When you thought that maybe. Things weren't goin' your way. I was there when you asked me. Just â€˜cause you asked me and I didn't hesitate. Now that I need you, you turn away. Like I was nothing, like it was a big mistake. Come on baby, you know it ain't right. Tell me how do you sleep at night?. [Chorus]. I won't behave, sit quietly by while you take. Everything that I keep inside of me. I won't be still, Oh no, not I. â€˜Cause there's no way that I'd stay here. I'd rather die than love you. I'd rather die than love you. You know that I would rather die. It isn't fair to take someone's heart. Tear it apart, use it like you don't care. How does it feel to be hurt. It's gonna get worse. It's gonna get ugly, I swear. How many tears can one person cry. How much is enough. When's it time to say goodbye. Come on baby, you know it ain't right."
i'll do it,"Well the unseen sights look good to you. I notice how you survey the room. Awkward conversation and you're too polite. You know that's always a clue. I'm wasting my time tryin' to tell ya'. That you're making the mistake of your life. Cause you're so sure that you need to go. At any cost, at any price. But, I'll Do It. I'll send you out on your own, with no guarantee. I'll Do It. But when you wanna come home and you look for love. Don't look for me!. Tell me, when did everything start to go wrong?. And why was I the last one to know?. You're so good at hidin' your feelings. I'm so good at lettin' mine show. Well I know how great it feels together. But that just isn't enough. Cause I need more than your bedside manner. I need someone to love. So, I'll Do It. I guess there's nothin' to say, its all been said. I'll Do It. Make sure you want it this way, `cause when it's done this time. I'll be gone. I'll Do It. I'll send you out on your own, with no guarantee. I'll Do It. But when you wanna come home and you look for love. Don't look for me!. I'll Do It. I'll Do It. I'll Do It. I'll Do It. I'll Do It."
i'm gonna follow you,"I'm Gonna Follow You, `till I wear you down. I'm Gonna Follow You, `cause this here's my town. You don't know these streets the way that I do (I do, I do). You can't turn it on and off the way that I do (I do, I do). Ooo, Ooo.... I'm Gonna Follow You, `till I know your timing. You'll turn some corner soon, and find you can't get by me. You don't know these streets the way that I do (I do, I do). You can't turn it on and off the way that I do (I do, I do). You see yourself as some kind of lily of the valley. You come around here in your ballet slippers padding on my alley. And you know that you can't dance. Cause you know you never had the chance. I'm gonna dance for you!. Ooo, Ooo.... I'm Gonna Follow You, `till I wear you down. I'm Gonna Follow You, `cause this here's my town. You don't know these streets the way that I do (I do, I do). You can't turn it on and off the way that I do (I do, I do). You see yourself as some kind of lily of the valley. You come around here in your ballet slippers padding on my alley. And you know that you can't dance. Cause you know you never had the chance. I'm gonna dance for you!. Ooo, Ooo...."
i've got papers on you,"I've got papers on you baby. You gotta do what I say. I've got papers on you baby. You gotta do what I say. I mean business darlin', I'm too old to play. I've got papers on you baby. And I mean you're mine, all mine. I've got papers on you baby. And I mean you're mine, all mine. If you do just what I tell you darlin'. We're gonna get along real fine. Now the red light means stop. Green light means go. Tell you something once. I ain't gonna tell you no more. I've got papers on you baby. You gotta do what I say. I got old baby, and I'm too old to play. Well I see that you eat. And I see that you got a place to stay. I see that you eat. And I see you got a place to stay. But as long as live in this house. I ain't gonna let you have your way. I've got papers on you baby. And I mean in black and white. I've got papers on you. And I mean in black and white. Now I ain't hard to get along with. But you just gotta treat me right. From the album ""True Love""."
