only you,"I lost faith in myself, in everyone and everything around me. I thought I'd disappear, maybe you'd be better off without me. You showed me I was wrong, everybody needs someone. And love is not about perfection. You made no promises. Life is hard enough you said, without you. Only You, Only You. You're all that matters. Only You, Only You, Only You. Only You give me strength. When my world is shattered. Only You, Only You, Only You. I've walked this road some many times before. You'd think I'd know the way. But like the fool that I am, it always ends the same. You said that everyone deserves a little happiness. No one should have to be alone. Me, I'd be satisfied with just a little tenderness,. With you. Only You, Only You. You're all that matters. Only You, Only You, Only You. Only You break the chain. When my world is shattered. Only You, Only You, Only You. Only You, Only You. You're all that matters. Only You, Only You, Only You. Only You give me strength. When my world is shattered. Only You, Only You, Only You"
ooh ooh song,"Just when we think we conquered it. It seems we lose the fight again. But there's just no stoppin' it. It's like a bad dream that never ends. It puts up walls between us. That get harder, and harder, and harder, and harder, and harder. To remove. But we let it continue, like people in love always do. Ooh - Ooh. Ooh - Ooh. Ooh - Ooh. Lets not pretend that we're unique. Coz everybody's tasted loves illusion. We try to hide the fact that we. Got lost between the choas and confusion. And the love we feel. Is gettin' deeper, and deeper, and deeper, and deeper, and deeper. By the minute. But we let it slip away. Coz we don't know a good thing while we're in it. Ooh - Ooh. Ooh - Ooh. Ooh - Ooh. (Ending Background vocal:. ""Y el amor que sentimos es mas profundo"". ""The love that we feel is deeper""). From the album ""Tropico""."
out of the ruins,"It began as a summer just like the rest. Hopeful and filled with emotion. Lovers enjoying their sweet conquests. Pledging undying devotion. He felt the warm winds encircle his heart;. Softly, gently caressing all of his being. Every part, his love for her was unending. She was all that he dreamed of all of his life. For her there was no other. Happy were they as man and wife. Happy were they that summer. But all that it seemed was not meant to be,. The world was lost in indifference. And what began as a small incident ended up as hell. Then without warning all that they knew. Everything they'd been together was taken away,. Swift and cruel on that terrible night in summer. Out of the ruins he called her name. Echoing over and over. Silently waiting, but no one came. Out of the ruins that summer. But all that it seemed was not meant to be. The world was lost in indifference. And what began as a small incident ended up as hell. Out of the ruins he walked alone. Empty and broken forever. With nothing left but the sweet memory."
out-a-touch,"I've seen your picture in the paper. On the front page of magazines. I've pulled the trigger right at you. On billboards and movie screens. When I talk, it's to myself. Cause I know your kind, you're like everyone else. Maybe it'll work itself out in time, before I lose my mind. You, You're Out-A-Touch. All alone in a danger zone, and I think too much. Your Out-A-Touch. I keep your letters by the mirror. You're the subject of every dream. You're not so invincible, and I'm not what I might seem. When I look, it's in your eyes. And I know your look, you can hypnotize. How long does it have to last like this, a kodachrome kiss. You, You're Out-A-Touch. All alone in a danger zone, and I think too much. You, You're Out-A-Touch. You're in my sight all through the night. And I see too much. Your Out-A-Touch. Can't you see I'm obsessed. I'd do anything, I'm possessed. I'm in a constant rage with your luminary stage. I need you, I need you. I've seen your picture in the paper. On the front page of magazines. I've pulled the trigger right at you. On billboards and movie screens. When I look, it's in your eyes. And I know your look, you can hypnotize. How long does it have to last like this, a kodachrome kiss. You, You're Out-A-Touch. All alone in a danger zone, and I think too much. Your Out-A-Touch. I need you (7 times)."
outlaw blues,"It was rainin' in heaven when you went down. You were better than the best. Stayed a notch above the rest. It was rainin' in heaven when you went down. Your mother cried, said she told you so. But you touched the devil and couldn't let go. (Yeah). No one controls the Outlaw. You wrote the story with the movie in mind. An angel face with a criminal side. Celebraed as the rebel kind. The Outlaw. I wonder if you knew. They would turn your bad deeds into good. Paint you as a modern robinhood. It's high noon. Everywhere you go. And the guilt you feel is the weary soul. (Yeah). Of the Outlaw. Hearts weren't made to be ruled. And rules weren't made to be broken. It's cold and lonely at the end of your life. And nobody sleeps `til they turn out the lights. For the Outlaw. Where you gonna go, where you gonna hide. It's cold and lonely for the Outlaw. Where you gonna go, where you gonna hide. As the Outlaw. From the album ""Tropico""."
painted desert,"I hear your heartbeat but you're never there. Like a mirage, you haunt me everywhere. All day long. I burn for you, lonely in the night. I tried to live alone, but I just can't get it right. Ya' know that, this town's like a Painted Desert. Dead heat, movin' in the city. I'm lost in a Painted Desert. In a Painted Desert without you. I've done some thinkin', now that you're not here. I know your reasons, and they're still not clear. All I'm sure of is what I got to lose. I tried to be a better loser, but it's just no use. Ya' know that this town's like a Painted Desert. Dead heat, movin' in the city. I'm lost in a Painted Desert. In a Painted Desert without you. Walkin' in the sundown, I search in vain. Waitin' on the wind that whispers out your name. Through concrete canyons echoing a world of other faces. No direction looks like home. Where is my oasis?. Ya' know that this town's like a Painted Desert. Dead heat, movin' in the city. I'm lost in a Painted Desert. In a Painted Desert without you. In a Painted Desert without you. Where is my oasis?. From the album ""Tropico""."
papa's roses,"I picked a rose this morning. And it was so fresh, it looked like it was crying. I thought how sad to be so beautiful. Only to wither and die. Like Papa's Roses soft and pale. Like petals thrown in the dirt. Only silence is spoken here. All that grows here is hurt. And Papa's Roses. Papa wasn't really a hardened man. He could be tender at times. I remember, it was like it holiday. When he was gentle and kind. He gave those roses his heart and soul. I wish he'd saved some for me. It would've been such a simple thing,. For me to be, like Papa's Roses. Like Papa's Roses soft and pale. Like petals thrown in the dirt. Only silence is spoken here. All that grows here is hurt. And Papa's Roses. Voices that whisper soft and low. Forever buried inside. Haunted by images dark and cold. Forever burned in your mind. But I dreamed I could fly away. Like an angel I'd fly. To the places where I could forget. Forget that I was like Papa's Roses. Like Papa's Roses soft and pale. Like petals thrown in the dirt. Only silence is spoken here. All that grows here is hurt. And Papa's Roses."
payin' the cost to be the boss,"You act like you wanna listen when I'm talkin' to you. You think you oughta do baby, anything you wanna do. You must be crazy baby. You just gotta be, outta your mind. As long as I'm payin' the bills. I'm payin' the cost to be the boss. I'll drink if I wanna, and play a little poker too. I don't want to hear nothin' from ya. As long as I'm takin' care of you. As long as I'm workin' baby, payin' all the bills. I don't want no mouth from you 'bout the way I'm supposed to live. You must be crazy baby. You just gotta be, outta your mind. As long as I'm footin' the bill. I'm payin' the cost to be the boss. Now that you got me huh, you act like you're ashamed. You don't act like my man - you're just usin' my name. I'm gonna have all the money baby. I don't want no back talk. You don't like how I'm doin'. You can pick up your things and walk. You must be crazy baby. You just gotta be, outta your mind. As long as I'm payin' the bills. I'm payin' the cost to be the boss. From the album ""True Love""."
please come home for christmas,"Bells will be ringing, the glad - glad news. For what a Christmas to have the blues. My baby's gone and I have no friends. To wish me greetings once again. Oh, crowds will be singing Silent Night. Christmas carols by candlelight. Please come home for Christmas. Please come home for Christmas. If not for Christmas, by New Year's night. Friends and relations, send salutations. As sure as the stars shine above. Yes it's Christmas, Christmas my dear. It's the time of the year -- time of the year. To be with the one you -- the one you really love. Oh won't you tell me, we'll never grow old. Christmas and New Years will find you home. They'll be no more sorrow, no more grief and pain. Because I'll be happy that it's Christmas once again. Please come home for Christmas baby. They'll be no more sorrow, no more grief and pain. Because I'll be happy, Lord I'll be so happy. Happy once again. From the album ""True Love"""
please don't leave me,"I sit by my window, watch the clouds go by. Every moment is a one that I'm. Crying my heart out cause I'm not there with you. I feel like a fool I've got so much shame. I know I should just walk away. But what will I do with all this pain I feel for you. Please don't leave me. Not this time. I don't think I can survive it. I'll have nothing. Not even my pride. So please don't leave me. Not this time. So many nights I lay in bed. I stare at the place where you laid your head. I wonder who's lying with you instead of me. I can't make you feel it if it isn't there. No way to convince you if you just don't care. Look in your heart maybe you could spare a place for me. Please don't leave me. Not this time. I don't think I can survive it. I'd have nothing. Not even my pride. So please don't leave me. Not this time. You made your point. It's clear to me. There's somewhere else you'd rather be. But I can't bear the thought of life without you. I sit by my window, watch the clouds go by. But I can't bear the thought of life without you. Please don't leave me. Not this time. I don't think I can survive it. I'd have nothing. Not even my pride. So please don't leave me. Not this.. Please don't leave me. Not this time. I don't think I can survive it. I'd have nothing. Not even my pride. So please don't leave me."
precious time,"I don't want to argue about who is the victim. Cause maybe we both got burned. I don't want to talk about who is the traitor. Cause both of our loyalties turned. I don't want to fight about who is the liar. Cause there's too many ways to lie. I don't want to hear about who is the winner. Cause we both know it's a tie. Cut it out, drop it, count me out - baby stop it. Life is too short, so why waste Precious Time. Life is too short, so why waste Precious Time. You were on a liquid diet, you were sure you had to try it. And you lost all your pounds. The doctor's on vacation, so you took the medication. And wound up in lost and found. So we took a trip to Paris. Cause you swore that it would scare us out of our swift decline. All that I remember `bout those days in that September. Is the ""merci"" and the wine. Cut it out, drop it, count me out - baby stop it. Life is too short, so why waste Precious Time. Life is too short, so why waste. Precious Time, Precious Time, Precious Time. Oh, Precious Time. Life is too short, so why waste Precious Time. You talk on the telephone, long distance to New York or Rome. Some would say you got it made. Your home is like a fortress, no one comes in but the florist. The gardner, and the maid. You call me on the telephone, you say you feel so alone. Too tired to get dressed and get out. First you're happy, then you're sad. Somehow you always hang up mad. Excuse me if I shout. Cut it out, drop it, count me out - baby stop it. Life is too short, so why waste Precious Time. Life is too short, so why waste Precious Time. Life is too short, so why waste Precious Time. Precious Time, Precious Time, Oh Precious Time."
prisioner of love,"Cold hard labor, it's a labor of love. Convicted of crimes, the crimes of passion. Caught in a chain gang, the chain of fools. Solitary confinement, confined by the rules. I'm just a Prisoner. An inmate of love. Oh I'm a Prisoner. Captured by love. With no escape. No where to go. No place to hide. Hey, I'm a Prisoner!. I'm just a Prisoner. Mending the wounds, the wounds of lament. The knife cut deep, deep into my heart. The romance is over, my passions remain. Still bound to love by this ball and chain. I'm just a Prisoner. An inmate of love. Oh I'm a Prisoner. Captured by love. With no escape. No where to go. No place to hide. Hey, I'm a Prisoner!. I'm just a Prisoner. Oh I'm a Prisoner. Hey, I'm a Prisoner!. Find an escape, a key to the door. I gotta get out, can't take anymore. Make a clean break, to bury the past. I'll shed these chains and be free at last. I'm just a Prisoner. A Prisoner Of Love. I'm just a Prisoner. A Prisoner Of Love. Hey, I'm a Prisoner."
promises in the dark,"Never again, isn't that what you said?. You've been through this before. An' you swore this time you'd think with your head. No one, would ever have you again. And if takin' was gonna get done. You'd decide where and when. Just when you think you got it down. Your heart securely tied and bound. They whisper, Promises In The Dark. Armed and ready, you fought love battles in the night. But too many opponents made you weary of the fight. Blinded by passion, you foolishly let someone in. All the warnings went off in your head. Still you had to give in. Just when you think you got it down. Resistance nowhere to be found. They whisper, Promises In The Dark. But promises, you know what they're for. It sounds so convincing, but you heard it before. Cause talk is cheap and you gotta be sure. And so you put up your guard. And you try to be hard. But your heart says try again. You desperately search for a way to conquer the fear. No line of attack has been planned to fight back the tears. Where brave and restless dreams are both won and lost. On the edge is where it seems it's well worth the cost. Just when you think you got it down. Your heart in pieces on the ground. They whisper, Promises In The -- Dark."
purgatory,"We will be the forgotten ones. They will shake their heads and pity us. We who sacrificed our sons and daughters. With the sweet taste of victory on our lips. They will cry, but their tears will come too late. There is no redemption for the ones. Who choose to walk in the shadows. Oh sweet redeemer will you save a place for me. I am tired and I'm seeking restitution. Oh will you heal me, will you take away my pain. What I'm looking for is absolution. Getting out of Purgatory. Is no small accomplishment. And the price is high. And it comes with its own set of conditions. The choice is never clear and difficult to make. But it will not change them. They will just go on the way they always have. Oh sweet redeemer will you save a place for me. I am tired and I'm seeking restitution. Oh will you heal me, will you take away my pain. What I'm looking for is absolution."
rated x,"She's a personality, enjoying popularity. For making movies Rated X. Posing for a magazine, picture in a limousine. Someone simulating sex. Never thought that she could be. Lonely with her vanity. Wasted days and lonely nights. Working for the sugar man. Make each other happy man. Cause satisfaction's guaranteed all night. Drinking champagne is a past time. Making hot love is a main line. Money buys love and a wild time. Making hot love is a main line. Hot Love!. She wakes up, and breaks up. And wonders why love is unkind. She waits up, and makes up. And looks in the mirror to find. Pink champagne and diamond rings. Fascinating bright young things. Dancing at the discotechs. Starring from the silver screen. See you in a midnight dream - Rated X. Drinking champagne is a past time. Making hot love is a main line. Money buys love and a wild time. Making hot love is a main line. Drinking champagne is a past time. Making hot love is a main line. Money buys love and a wild time. Making hot love is a main line. Hot Love!. Come on, gimme' hot love."
red vision,"Firewalkers feel no pain from the coals. Ruled by passion beyond their control. Vengeance is king in the zone of Red Vision. Sparks fly and tempers flair. You see the enemy everywhere. Hate shines like burning bridges in your eyes. In love and war we stand alone. Trustin' nothin' but our own, Red Vision. Anger sharpens your point of view. Fans the fire in and around you. Farenheit in the realm of your senses. In love and war we stand alone. Trusting nothing but our own, Red Vision. Mind like a steel trap, heart like a prison. With tears of rage, we burn in our Red Vision. Once again, I'll walk the coals. Tiptoe through the minefields of your soul. I've come to take you home. Red Vision. Red Vision. Red Vision. Red Vision. Oh, Red Vision........ Written by: Neil Geraldo & Myron Grombacher."
rescue me (from the motion picture soundtrack 'speed'),"Pat Benatar - Rescue Me. Rescue me. Take me in your arms. Rescue me. I want your tender charm. 'Cause I'm lonely. And I'm blue. I need you. And your love too. Come on and rescue me. Come on, baby, and rescue me. Come on, baby, and rescue me. 'Cause I need you by my side. Can't you see that I'm lonely. Rescue me. Come on and take my heart. Take your love. And conquer every part. 'Cause I'm lonely. And I'm blue. I need you. And your love too. Come on and rescue me. Come on, baby, and rescue me. Come on, baby, and rescue me. 'Cause I need you by my side. Can't you see that I'm lonely. Rescue me. Take me in your arms. Rescue me. I want your tender charm. 'Cause I'm lonely. And I'm blue. I need you. And your love too. Come on and rescue me. (Come on baby). Take me baby (take me baby). Hold me baby (hold me baby). Love me baby (love me baby). Can't you see I need you baby. Can't you see that I'm lonely. Rescue me. Come on and take my hand. C'mon, baby and be my man. 'Cause I love you. 'Cause I want you. Can't you see that I'm lonely. Mmm-hmm (mmm-hmm). Mmm-hmm (mmm-hmm). Take me baby (take me baby). Love me baby (love me baby). Need me baby (need me baby). Mmm-hmm (mmm-hmm). Can't you see that I'm lonely."
rise (part 2),"They say the hand is quicker than the eye. And two wrongs don't make a right. I feel lightning when you walk by. You got the power to take me higher, yeh. Hear me when I say. Rise. See a better day. Come on. They say the power of love is to blame. Time stops when I speak your name. Now and forever you are the one. Love-light shining on and on and on. Rise. Hear me when I say. Come on, yeh. Rise. See a better day. Come on, yeh, yeh. They say the power of love is like the sun. Shining down on everyone. Hey, don't be frightened by what you feel. You got to know that the power of love is real. Hear me when I say. Rise. See a better day. Come on. Can you feel the power of love. From the album ""Gravity's Rainbow"""
river of love,"Hey baby, won't you sit down here next to me. Well I heard you're havin' trouble in love. Yeh, I know how that can be. Now love can hurt, I know it's true. Let me see what I can do. I know a place where you can find love. The kind you always dreamed of. Lets go down to the River-O-Love. Let me show you how sweet it can be. Down at the River-O-Love. Let the cool, clear water wash over you and me. in the River-O-Love. Hey Darlin', you know that love is strange. Seems the harder you try to hold on. The further it moves away. I know its hard to understand. But that's okay I got a plan. I know a place where you can find love. The kind you always dreamed of. Lets go down to the River-O-Love. Let me show you how sweet it can be. Down at the River-O-Love. Let the cool, clear water wash over you and me. in the River-O-Love. Lets go down to the River-O-Love. Let me drown in the River-O-Love. The River-O-Love. You don't have to be afraid. Coz I'll be right there by your side. We can take it slow baby. One long sweet ride. Lets go down to the River-O-Love. Let me show you how sweet it can be. Down at the River-O-Love. Let the cool, clear water wash over you and me. in the River-O-Love. Lets go down to the River-O-Love. Let me drown in the River-O-Love. The River-O-Love."
run between the raindrops,"It's always one thing or another, seems like we never get ahead. Reaching out for the brass ring, and landing in the dirt instead. We can't get past yesterday, we're only counting down from ten. It seems like every move we make, brings us back where we began. You've gotta Run Between The Raindrops. If you wanna see the sun. Run, Run, Run, Between The Raindrops. Run Between The Raindrops, if you wanna see the sun. Run, Run, Run, - Run Baby Run. Somewhere there's a sun that's shining. Somewhere we'll find a life that's good. Some way I'm gonna make it happen. Just like you always knew I could. We're treading water on a river of tears. And I don't know what to do. I can take a beating, but I ain't gonna let it happen to you, you. You've gotta Run Between The Raindrops. If you wanna see the sun. Run, Run, Run, Between The Raindrops. Run Between The Raindrops, if you wanna see the sun. You Gotta Run, Run, Run, - Run Baby Run. We're treading water on a river of tears. And I don't know what to do. You've gotta Run Between The Raindrops. If you wanna see the sun. Run, Run, Run, Between The Raindrops. Run Between The Raindrops, if you wanna see the sun. Run, Run, Run, - Run Baby Run. Run Between The Raindrops, if you wanna see the sun. You Gotta Run, Run, Run, - Run Baby Run. You Gotta Run, Run, Run, - Run Baby Run. Written by: Neil Geraldo & Myron Grombacher."
sanctuary,"Wise men say these are the facts of life. What ya can't read, you gotta write. What you don't know can hurt you, welcome to the wasteland. Hail Mary, hear me now - I'm in need of Sanctuary. Yes, these are hard times to be livin' in. Out in the Wasteland where love's a give away. I fall on my face like a rebel in the dirt. Sanctuary, Give me some protection. Baby, Baby cover me. Feelin' lost and so afraid. Just tryin' to keep the handle on the blade. Been such a long time runnin'. Behind these walls inside of me. Ain't nothin' clear as far as I see. Looks like a storm cloud breakin'. Off in the distance, I hear a drivin' beat - a drivin' beat. The sun goes down like a rebel in the dirt. Sanctuary, Give me some protection. Baby, Baby cover me. Sanctuary, Give me some affection. by, Baby shelter me. Heartache gonna worry me down -- I don't like it. Show me mercy, peace of mind. Stand beside me in these troubled times. Give me a reason to believe in now. Love and affection, they seem so far away, so far away. All I can do just to make it through the night. Sanctuary, Give me some protection. Baby, Baby cover me. Sanctuary, Give me some affection. Baby, Baby shelter me. Sanctuary, Sanctuary. Sanctuary, Sanctuary. From the album ""Gravity's Rainbow""."
sex as a weapon,"You really do know how to strut that stuff (strut that stuff). You really do know how to act tough (act tough). Your body's just like a centerfold. A fantasy (a fantasy), anyone would want to hold. Chorus:. Stop using Sex As A Weapon. Stop using Sex As A Weapon. You know you're already my obsession. Stop (stop) using Sex As A Weapon. Love is more than a one way reflection. Stop (stop) using Sex As A Weapon. With looks that kill and a mind that's twisted (twisted). I don't know why I can't resist it (resist it). I tell myself look the other way (other way). When you want me to (when you want me to). I, I always stay. (Chorus). You play with desire like it was a toy (toy). How much affection can you destroy?. You wrap my heart around your little finger. Sex, Sex, Sex, Sex, Sex, Sex, Sex As A Weapon. Stop using Sex As A Weapon. Stop using Sex. (Chorus). Stop using Sex As A Weapon. Stop using Sex As A Weapon. Stop using Sex. Stop using Sex As A Weapon. Stop using Sex (stop using sex, stop using sex). Sex As A Weapon, As A Weapon. Written by: Tom Kelly & Billy Steinberg."
shadows of the night,"We're running with the Shadows Of The Night. So baby take my hand, it'll be all right. Surrender all your dreams to me tonight. They'll come true in the end. You said - oh girl, it's a cold world. When you keep it all to yourself. I said you can't hide on the inside. All the pain you've ever felt. Ransom my heart, but baby don't look back. Cause we got nobody else. Chorus:. We're running with the Shadows of the Night. So baby take my hand, it'll be all right. Surrender all your dreams to me tonight. They'll come true in the end. You know that sometimes, it feels like. It's all moving way too fast. (Repeat Chorus Three Times). Use every alibi and words you deny. That love ain't meant to last. You can cry tough baby, it's all right. You can let me down easy, but not tonight. We're running with the Shadows of the Night. So baby take my hand, you'll be all right. Surrender all your dreams to me tonight. They'll come true in the end. We're running with the Shadows of the Night. So baby take my hand, it'll be all right. Surrender all your dreams to me tonight. They'll come true in the end. And now the hands of time are standin' still."
