here,"i was dressed for success. but success it never comes. and i'm the only one who laughs. at your jokes when they are so bad. and your jokes are always bad. but they're not as bad as this. come join us in a prayer. we'll be waiting waiting where. everything's ending here. and all the sterile striking it defends. an empty dock you cast away. and rain upon your forehead. where the mist's for hire if it's just too clear. let's spend our last quarterstance randomly. go down to the outlet once again. painted portraits of minions & slaves. crotch mavens and one night plays. are they the only ones who laugh?. at the jokes when they are so bad. and the jokes they're always bad. but they're not as bad as this. come join us in a prayer. we'll be waiting waiting where. everything's ending here. and all the spanish candles unsold. away have gone to this. and a ""run-on piece of mount on"". trembles, shivers, runs down the freeway. i guess she spent her last quarter randomly. i guess a guess is the best i'll do. last time last time. was the best time...."
frontwards,"I am the only one,. searching for you,. and if i get caught,. then the search is through. and the stories you hear,. you know they never add up. i hear the natives fussin'. at the data chart,. be quiet. the weather's on the night news.... empty homes,. plastic cones,. stolen rims. are they alloy or chrome?. well i've got style,. miles and miles,. so much style. that it's wasted,. so much style. that it's wasted. so much style. that its waste---------ed. she's the only one,. who always inhales. paris is stale. and it's war if we fail. And in the migrant hotels,. they never sleep,. they never will. their souls are crumbling. like a dirt clod. hold, your cigarette cuts. to the inside. empty homes,. plastic cones,. stolen rims,. are they alloy or chrome?. well i've got style,. miles and miles. so much style. that it's leavin'. it's pattern's torn. and we're weavin'. this battle's torn. and we're weavin'"
billie,"La, la, la, la, la, la, la, etc.. Billie and my friend the saint,. You're perfect in so many ways,. But you never looked hard. at a fetus in a jar. you never saw your mama change.. And this wonderland of spite,. Does not shine into your night,. Like widows are seen. As stigmatised beings,. Who ought to have second chance.. And hurricanes spin. Like debutantes in a trance.. Sue the fortune-teller,. Rue the rising tide,. General Washington,. patented that skull,. Throw him out.. Ship that hollandaise,. Feel the heart fell of touch. See the longer you tease,. The stronger the needs,. The highs and the fruit are long.. Up to the one a kid,. Call the bluff when the money's in,. You're a hungry matron,. And you are just what I need,. I was tired of the best years of my life.. Sue the fortune-teller,. Rue the rising tide,. General Washington,. Patented that skull,."
grave architecture,"come on in.... grave architecture (x2). walk the marble malls [?]. the monuments to those who fall. and it's a pocket less than narco shell-bit. stiff the crypt and the others are rough. and the hood's so rad. and i'm fucking glad. glad to see that, know what it means. it takes a lot. grave architecture (x2). stroll past the strip. is it old? am i clipped?. am i just a bathtub waiting to be gripped. or found on shady ground?. and the lampshade's poised on the overwhelm. drugs, and need the talent to breathe. it takes a lot. oh yeah, you wanna be like a blind fish. positive, we're positive-- go!. takes a lock-grip, baby. to put you to war. and i'm pushin' you back than ever ???. that'll push you hard. it takes em......."
the hexx,"Capistrano swallow, answer to your inner voice. and please return,. God installed that radar in your pointy little beak. so you'd return.. Epileptic surgeons with their eyes x'ed out. attend to the torn up kid.. salivate and reckon with all the sick things. that you did.. The secondary stumbles cause the cadence of the count. has lead them astray,. Pray their intuition leads them crashing into bodies. in a perfect way.. But I, I saw you reeling in a parking lot,. I, I saw you rallying round a parking lot,. Line up for the comfort and kick it on the bumper,. Know (no?) there is no leeway. you're standing on the freeway in love,. Motion, you were destined for the paupers grave.. Architecture students are like virgins. with an itch they cannot scratch,. Never build a building till you're 50. what kind of life is that?. Stalled out on an escalator. wishing which way to return up or down,. My Palestinian nephew got his face blown off."
range life,"After the glow, the scene, the stage,. The sad talk becomes slow but there's one thing I'll never forget:. Hey, you gotta pay your dues before you pay the rent. Over the turnstiles and out in the traffic. There's ways of livin' its the way I'm livin' right or wrong. Its all that I can do and I wouldn't wanna let you be. I wanna range life. If I could settle down. If I could settle down. Than I would settle down. I wanna range life. If I could settle down. If I could settle down. than I would settle down. Run from the pigs, the fuzz, the cops, the heat. Pass me your gloves. This crime, it is never complete. Until you snort it up or shoot it down. You're never gonna feel free. Out on my skateboard the night is just humming. And the gumsmacks are the pulse I'll follow. If my walkman fades. Well I got absolutely no one. No one but myself to blame. Don't worry, we're in no hurry. Schools out. What did you expect?. I wanna range life. If I could settle down. If I could settle down. Than I would settle down. I wanna range life. If I could settle down. If I could setle down. Than I would settle down. Out on tour with smashing pumpkins. Nature kids. I-- they don't have no function I dont understand a word they say. And I could really give a fuck. Stone Temple Pilots they're elegant bachelors. They're foxy to me, are they foxy to you?. I will agree they deserve absolutely nothin', nothin' more than me. Dreamin' dream dream dream dream.... ...So Alive!."
elevate me later,well you greet the tokens and stamps. underneath the fake-oil burnin' lamps. in the city we forgot to name. the concourse is four-wheeled shame. and the courthouse's double-breast. i'd like to check out your public protests. why you're complaining Ta!. you sleep with electric guitars. range rovin' with the cinema stars. and i wouldn't want to shake their hands. 'cause they're in such a high-protein land. because there's 40 different shades of black. so many fortresses and ways to attack. why you're complaining Ta!
carrot rope,"Spiral: I want to say:. SM: It's my second hand wonder,. a thing that recovers the doubt. Spiral: Slim door,. Mark: Like a rainstorm, you've got to do. what you want and say it. SM: It's of my design assembled at the cut. Spiral: Slim door,. SM: It's all right to shake, to fight, to feel. Mark: You go down, down, down, down. Spiral: Slim door,. SM: It's all right to shake, to fight, to feel. Mark: You go down, down, down, down. SM: Harness your hopes to the folks. with the liquor with the ropes,. Red, red ropes, periscopes. They've got everything will ever need. stored under the chair. Simmer, simmer, simmer down. Simmer, simmer, simmer down. Don't waste your precious breath. explaining that you are worthwhile. Simmer, simmer, simmer down. Simmer, simmer, simmer down. Be patient and I'll let you see my. Carrot rope, feed my thrill,. I got beat by weather. Carrot rope, feed my thrill,. I got beat by weather. Carrot rope, feed my thrill,. It's time to get me off of the ground,. The wicket keeper is down. (the wicked keep us down?). SM: Hey little boy, would you like to know. what's in my pocket or not. It's no ploy, it's no gimmick,. It's the chance of a lifetime to see. something that's never seen by mere mortals. Mark: Except me. Spiral:And myself. SM: And sweet I, so what do you say?. Would you like to play 20 questions with me?. SM: A little, little Christian lie,. A little, little Christian lie. Debating if it's time. to drop the bomb on you, my dear. A little, little Christian lie,. A little, little Christian lie. Let's get down to brass tacks and start it. A carrot rope, feed my thrill,. I got beat by weather. A carrot rope, feed my thrill,. I got beat by weather. Carrot rope, feed my thrill. It's time to get me off of the grounds. The wicket keeper is down,. The wicked keeper is down. And he gets me off of the grounds."
gold soundz,"go back to those gold soundz. and keep my advent to your self. because it's nothing i don't like. is it a crisis or a boring change?. when it's central, so essential,. it has a nice ring when you laugh. at the low life opinions. and they're coming to the chorus now.... i keep your address to yourself 'cause we need secrets. we need secrets crets crets crets crets crets back right now. because i never wanna make you feel. that you're social. never ignorant soul. believe in what you wanna do. and do you think that is a major flaw. when they rise up in the falling rain. and if you stay around with your knuckles ground down. the trial's over, weapon's found. keep my address to myself because it's secret. cuz it's secret cret cret cret [etc.]... back right now. so drunk in the august sun. and you're the kind of girl i like. because you're empty and i'm empty. and you can never quarantine the past. did you remember in december. that i won''t eat you when i'm gone. and if i go there, i won't stay there. because i'm sitting here too long. i've been sitting here too long. and i've been wasted. advocating that word for the last word"
summer babe,"Ice baby,. I saw your girlfriend and she was. eating her fingers like they're just another meal. but she waits there. in the levee wash she's. mixin' cocktails with a plastic-tipped cigar. My eyes stick to all the shiny robes. you wear on the protein delta strip. in abandoned house but i will wait there. i'll be waiting forever.... i'm waiting (waiting 8x)...(oh). Minerals, ice deposit daily, drop off. the first shiny robe. i've got a lot of things i want to sell, but. not here, babe-- you took them all. every time i sit around i find i'm shot. every time i sit around i find i'm shot. every time i turn around i find. every time i sit around i find. every time (6x).... you're my... summer babe. summer babe."
fillmore jive,"Hey lady, what do you need?. Do you think you'd like to come and bleed with me?. I'd like to invite you to a taste of my chalice. It's a special one, it's made of gold. (passed out). Passed out on your couch. You left me there (thank you). Let me sleep it off. I need to sleep it off. I need to sleep why don't you let me. I need to sleep why don't you. I need to sleep. I need to sleep. I need to sleep. I need to sleep, why won't you let me. I need to sleep. I need to sleep. I need to sleep. Why won't you, why won't you let me sleep?. The jam kids on the vespas. And glum looks on their faces. The street is full of punks. They got spikes. See those rockers with their long curly locks. Goodnight to the rock and roll era. Cause they don't need you anymore. Little girl, boy, girl,. bo...................y. Their composures are so distracted. Jasper's skinny arms. And the dance faction, a little too loose for me. Every night it's straight and narrow. Laws are broken, amusing era. walls are broke in the music era. Round and round and round and round she goes..... .... Pull out their plugs and they snort up their drugs. When they pull out their plugs and they snort up their drugs."
killing moon,"Under blue moon I saw you. So soon you'll take me. Up in your arms. Too late to beg you or cancel it. Though I know it must be the killing time. Unwillingly mine. Fate. Up against your will. Through the thick and thin. You must wait until. You give yourself to him. In starlit nights I saw you. So cruel you'll take me. Your lips a magic world. Your sky all hung with jewels. The killing moon. Will come too soon. Fate. Up against your will. Through the thick and thin. You must wait until. You give yourself to him. Cucumber, cu-cu-cumber, ca-ca-ca-ca-cabbage. Cucumber, cu-cu-cu-cu-cu-cu-cu-cu-cabbage. He's a yo-yo man. Always up and down. So take him to the end of his temper. Fate. Up against your will. Through the thick and thin. You must wait until. You give yourself to him..."
cut your hair,"(stop it!). Darlin' don't you go and cut your hair. Do you think it's gonna make him change?. ""I'm just a boy with a new haircut"". And that's a pretty nice haircut. Charge it like a puzzle. Hit men wearing muzzles. Hesitate you die. Look around, around. The second drummer drowned. His telephone was found. Music scene's crazy. Bands start up each and every day. (cool guitar sound here). I saw another one just the other day. A special new band. I remember lying. I don't remember a line. I don't remember a word. But I don't care, I care, I really don't care. Did you see the drummer's hair?. Advertising looks and chops a must. No big hair!. Songs mean a lot when songs are bought. And so are you. Face right down to the practice room. Attention and fame's a career. Korea, chorea, career"
stop breathin',"got struck by the first volley. of the war in the corps. never held my service. send em a wire, give em my best. this ammunition never rests. no one serves coffee, no one wakes up. stop breathin'. stop breathin'. breathin' for me now. write it on a postcard:. dad they broke me.. dad they broke me.. [repeat]. i can see the lines open shutters. and the leaves flocked on a grid. that's what they made my hero say. but nothing gets me off so completely. but when you put it down. ten feet down in the ground. call and response in the negative home. stop breathin'. stop breathin'. breathin' for me now. write it on a postcard:. dad they broke me.. dad they broke me.."
we dance,"there is no castration fear. in a chair you will be with me. we'll dance [x4]. but no one will dance with us. in this zany town. chim-chim-chim, sing a song of praise. for your elders, they're in the back. pick out some brazilian nuts for your engagement. check that expiration date, man,. it's later than you think. you can't enjoy yourself, i can't enjoy myself [x2]. move that swing and. watch it break strafe like an arc. but i won't be there to leave you ah-ah-ah. 'cause i don't have a clue anymore. maybe we could dance [x3] together. together. together. together. first time you'll see. and then you'll be. five times forever."
5-4= unity,five minus four equals unity. five minus four equals unity. yeah baby oooh. with impunity. impunity. a bottle of red. a bottle of white. i'll take my chances. show me how sweet romance is. five minus four equals unity.
all my friends,Everybody's goin out tonight. And everybody's hangin out tonight. It's alright. Listen to them. Show when they learn how to lie. You can sing along with them if you try. Holdin the spoken world up. I need it. I need it. I need it.. She's got a neck like a Saturday paper. You read it fast before the Sunday mass. Take it back it's nothing. it's nothing like it talks. Don't listen to me baby if you wanna survive. You did it you did you did it wrong.. Collapse. It's evident to me. Tonight. All the friends are strangers.. I'd like to take my story. To some place the don't know me. Creatures come out of the bars. Talk is small but you talk to Paul. Sold sex on Bird Cage walk. Boys are drinking and on the docks. Union man. I'm your friend. I need you when you listen to me. Weigh sand Buy Sand glass track. Closing off close off close off. OPEC dreams stock market close on the rock. And roll scale. Stereo. No more partridge family dreams to the home land. Divorce countries
angel carver blues,when they fall in they fall in from the roof. they grab on to me tightly as if i knew the way. when i fight for something i fight because i care. when i fight with you i fight but i don't care. everybody wants the questions to be asked. the questions are the answers to questions in themselves. ask me if i really need it. ask me if you want to get hit. hit it.
ann don't cry,"The damage has been done,. i am not having fun anymore.. Do what you do when you try. what you get when you see the light,. come down i'll set my hope. in a wonderful hospital man.. We got rooms to live room to live in. room to give but no room to give in,. but you never had a chance. no you never had a chance.. To those above take us out. throw us down shove us out.. We get down so so hard.. But your vulgar display. caught me off gaurd;. Cold cold boy with american heart. gonna run in and lock up the shots again. But ann don't you cry, don't you cry ann,. don't you cry. Don't you cry ann, don't you cry,. don't you cry ann, don't you cry.. Well my (he)art is not a wide open thing, i know,. there is hardly not a lot to say,. except i met her and her 5 false friends.. They go, they go. tied, tied, tied to the tracks. just remember the facts. Repeat until you're running aground again.. But ann don't you cry, don't you cry ann,. don't you cry. Don't you cry ann, don't you cry,. don't you cry ann, don't you cry.. Dear Ann, don't you cry you'll sever the love.. Take you away, don't you cry you'll sever the love. Don't you cry you'll sever the love.. Don't you believe in what they say. believe in what they say. believe in what they. leave in what they. believe in what they say 'bout me, sweet. Sweet Ann"
at & at,"maybe somone's gonna save me. my heart is made of gravy. and the laps i swim from lunatics don't count. open up your stocking. pull out all the things you never wanted. 'til room service calls. room service calls. open up your hands and let me see the things you keep in there. i want to split up fifty-fifty. that's the way we do it in this rogue's town. i've got all the glory in the world. and i hope it doesn't floor you before you go. room service calls. in the random falls -- go!. whenever (x6) eve eve ever i feel fine. i'm gonna walk away. from All This, all That.. the groovy groovy kitty and little little pity. with your slipshed (?) watch in back. and skinny skinny people don't like that. when you call on them. spell me.. spritzer on ice in new york city. isn't it a pity?. you never had anything to mix with that. listen to the tender behind the open chest in the hall. room service calls. i'm blue 'n green, green and blue-oooo. whenever (x4) ne ne ne ne never ho. i feel fi-i-ine, i'll walk the plank for you. i'll walk the plank. i wore your ?plank? for you in the d-d-d-d-dark. of the captain (seder row?). Jacob, Jacob Javitz, i'd like to thank you for everything. primarily your glass house. i'm workin' the ballin' stores 'n. i'm cashmir wrap sellin'. come along lads, join hands, 1. 2. 3. go! (guess, levis, guess, levis). whaaaahahaahahooohoaoohoo. the story it goes and a. distorted ghost. distorted ghost"
baptiss blacktick,"I'm just waiting waiting for the baptist. that sad suck-off left me in Damascus. I'm Just waiting waiting for the baptist. that sad suck-off, that shit left me now. I'm just wasting, wasting all the black ticks Queens way's rockers,. enough to make your ears twitch. I'm wasting, wasting all the Black chicks (tits?). Some reddish sins, some grey - is it now ???. I'm just waiting, waiting for a black jet. That fucker...Ahhhhhhh.... That fucker left me now. that suck left me now. that sun left me now.."
best friend's arm,"??? liar. (i can see, i can see, i can see, i can see). ???? ah come on, let's go. (i can see, i can see, i can see, i can see). yeah baby i've lost ???. ??. (i can see, i can see, i can see, i can see). everybody looks like. (i can see, i can see, i can see, i can see). when you lay that down with an eight-eight track, everybody laughs. but they don't know what you're sayin'. (i can see, i can see, i can see, i can see). ??? i guess if not.... (i can see, i can see, i can see, i can see). keep it under your best friend's arms [x9]. keep it under."
billie,"La, la, la, la, la, la, la, etc.. Billie and my friend the saint,. You're perfect in so many ways,. But you never looked hard. at a fetus in a jar. you never saw your mama change.. And this wonderland of spite,. Does not shine into your night,. Like widows are seen. As stigmatised beings,. Who ought to have second chance.. And hurricanes spin. Like debutantes in a trance.. Sue the fortune-teller,. Rue the rising tide,. General Washington,. patented that skull,. Throw him out.. Ship that hollandaise,. Feel the heart fell of touch. See the longer you tease,. The stronger the needs,. The highs and the fruit are long.. Up to the one a kid,. Call the bluff when the money's in,. You're a hungry matron,. And you are just what I need,. I was tired of the best years of my life.. Sue the fortune-teller,. Rue the rising tide,. General Washington,. Patented that skull,."
black out,"sunday driving past your own hall of fame. it's closed on weekdays, shut for good. pick out no one when you're talkin'. felt like rattlesnakes were walkin'. no one has a clue. the parting shots, the thin caught. fault line dancing across the frigid air shafts. a spastic grass, a criminal's child. count to ten and read. until the lights begin to bleed. lights; til you actually a-see the rays. and your thoughts they start turning. tells you lessons that you're learning. no one has a clue. the gauzy thoughts of those dirty scots. wrestling with the elements up on the trail high. i need to know. where does it go? how do i get there? what will i find?. (fun fun fun, fun for the summertime blues). (it's gonna set you free)."
blue hawaiian,"A welcome to my friends:. This house is a home and a home's where I belong. Where the feelings are warm and the foundations are strong. If my soul has a shape, well, then it is an ellipse. And this slap is a gift. 'Cause your cheeks have lost their lustre. You know, your cheeks have lost their lustre. You know, your cheeks have lost their lustre. You know, your cheeks have lost their lustre, lustre, lustre, lustre. Take it back -- send return out of time. Tape machine needs to be aligned. Aloha means goodbye, and also hello -- it's in how you inflect. Put the bark in the dog, and you've got a guardian. When the capital's S, it is followed by a T -- and it's probably me. And the tones are grouped in clusters. You know, the tones are grouped in clusters. Well the tones are grouped in clusters. You know the tones are grouped in clusters, clusters, clusters, clusters. Take it back -- kiss me into the past."
box elder,"Wasn't the question you asked me. It wasn't the answer I gave. That made me feel like I was on a train. Was a distant voice. Made me make a choice. That I had to get the fuck out of this town. I got a lot of things to do. A lot of places to go. I've got a lot of good things coming my way. And I'm afraid to say that you're not one of them.. Last time I was there. You were out on the couch. Pressed into a little electric 2. It was the way that you smiled. Made me know at once. That I had to get the fuck out of this town. 'Cause I've decide to make a stand. And I'm not gonna take your hand. I'm taking the next bus outta here, I'm gonna head for Box Elder, M.O.."
brinx job,"it's so funny we went right down to the store-we got the money so we'll put you down. we got the money, we got the money, we got the money. we got the money, we got money, we got the money. ho! we got the money now. and i won't even let you hoooooo....."
carrot hope,"Mark: I want to say:. SM: It's my second hand wonder,. a thing that recovers the doubt. Spiral: Slim door,. Mark: Like a rainstorm, you've got to do. what you want and say it. SM: It's of my design assembled at the cut. Spiral: Slim door,. SM: It's all right to shake, to fight, to feel. Mark: You go down, down, down, down. Spiral: Slim door,. SM: It's all right to shake, to fight, to feel. Mark: You go down, down, down, down. SM: Harness your hopes to the folks. with the liquor with the ropes,. Red, red ropes, periscopes. They've got everything you will ever need. stored under the chair. Simmer, simmer, simmer down. Simmer, simmer, simmer down. Don't waste your precious breath. explaining that you are worthwhile. Simmer, simmer, simmer down. Simmer, simmer, simmer down. Be patient and I'll let you see my. Carrot rope, feed my thrill,. I got beat by weather. Carrot rope, feed my thrill,. I got beat by weather. Carrot rope, feed my thrill,. It's time to get me off of the grounds,. The wicked keeping us down. SM: Hey little boy, would you like to know. what's in my pocket or not. It's no ploy, it's no gimmick,. It's the chance of a lifetime to see. something that's never seen by mere mortals. Spiral: Except me. Mark:And myself. SM: And sweet I, so what do you say?. Would you like to play 20 questions with me?. SM: A little, little Christian lie,. A little, little Christian lie. Debating if it's time. to drop the bomb on you, my dear. A little, little Christian lie,. A little, little Christian lie. Let's get down to brass tacks and start it. A carrot rope, feed my thrill,. I got beat by weather. A carrot rope, feed my thrill,. I got beat by weather. Carrot rope, feed my thrill. It's time to get me off of the grounds. The wicked keeping us down,. The wicked keeping us down. And he gets me off of the grounds. Spiral:Leg"
