carrot rope,"Spiral: I want to say:. SM: It's my second hand wonder,. a thing that recovers the doubt. Spiral: Slim door,. Mark: Like a rainstorm, you've got to do. what you want and say it. SM: It's of my design assembled at the cut. Spiral: Slim door,. SM: It's all right to shake, to fight, to feel. Mark: You go down, down, down, down. Spiral: Slim door,. SM: It's all right to shake, to fight, to feel. Mark: You go down, down, down, down. SM: Harness your hopes to the folks. with the liquor with the ropes,. Red, red ropes, periscopes. They've got everything will ever need. stored under the chair. Simmer, simmer, simmer down. Simmer, simmer, simmer down. Don't waste your precious breath. explaining that you are worthwhile. Simmer, simmer, simmer down. Simmer, simmer, simmer down. Be patient and I'll let you see my. Carrot rope, feed my thrill,. I got beat by weather. Carrot rope, feed my thrill,. I got beat by weather. Carrot rope, feed my thrill,. It's time to get me off of the ground,. The wicket keeper is down. (the wicked keep us down?). SM: Hey little boy, would you like to know. what's in my pocket or not. It's no ploy, it's no gimmick,. It's the chance of a lifetime to see. something that's never seen by mere mortals. Mark: Except me. Spiral:And myself. SM: And sweet I, so what do you say?. Would you like to play 20 questions with me?. SM: A little, little Christian lie,. A little, little Christian lie. Debating if it's time. to drop the bomb on you, my dear. A little, little Christian lie,. A little, little Christian lie. Let's get down to brass tacks and start it. A carrot rope, feed my thrill,. I got beat by weather. A carrot rope, feed my thrill,. I got beat by weather. Carrot rope, feed my thrill. It's time to get me off of the grounds. The wicket keeper is down,. The wicked keeper is down. And he gets me off of the grounds."
conduitforsale,"I'm tryin', I'm tryin'..... Imagine if you will Herr Proctor, alias a nobleman, son of son of scion. scion. Part of his rich inheritance, parcel in generous [divorced sense]. forklift beam. Certain plots of land and living quarters deemed by all. gentlemen, and wives thereof, to be grossly humane and frankly, quite. [undirty]. I'm tryin', I'm tryin'..... Herr Proctor, in his enviable good taste, tries quick escape gambit via local. periodicals, but no takers. The land [???] was stationed in a conduit. between two cells, a veritable no-man's-land, [rain, the flophouse, cog-. bone terrors] and carbon monoxide wallpaper. All [his brig-deck trina]. boys ask: is it livable?. I'm tryin', I'm tryin'..... Unable to bear the scandal, Ray, philanthropist, rents low-down scab. house in conduit, Herr Proctor offers said land for a song, but no one. wants to sing. In an attempt to maintain social privileges, yet mask it as. goodwill, he says to the conduit members, 'Take this rotten old tree and. make it bear fruit."" Cheers erupted throughout the [???] settlement. An. Italian male was heard to say, ""between here and there is better than. anything over there!"". I'm tryin', I'm tryin'"
cream of gold,"So much for destiny,. A pin prick on my knee,. The frost you paint. across our dead affair.. I sensed the toxic aura. from the second we touched,. You were stitched up venom. and I was the cursed from the Vedic.. Time is a one way track and I am not coming back,. I dream in beige why'd you leave me so far now,. Time tired you're tainted through,. wind (wins?), songs and substitutes,. I dream in beige why'd you leave me so far now.. The afterlife is steep,. We wonder and retreat,. And everyone is after us.. Skirt the gone street hawkers. with the black lemonade,. Keep an arrow trained on their. conflicted minds 'cause they stutter.. Time is the one way track and I am not coming back,. I dream in beige why'd you leave me so far now,. Time tired you're tainted through, (fruit?). wins, songs and substitutes,. I dream in beige why'd you leave me so far now,. I bleed in beige why'd you leave me so far now,. I bleed in beige why'd you leave me so far now,. I bleed in beige why'd you leave me so far now,. I bleed in beige why'd you leave me so far now!.."
cut your hair,"(stop it!). Darlin' don't you go and cut your hair. Do you think it's gonna make him change?. ""I'm just a boy with a new haircut"". And that's a pretty nice haircut. Charge it like a puzzle. Hit men wearing muzzles. Hesitate you die. Look around, around. The second drummer drowned. His telephone was found. Music scene's crazy. Bands start up each and every day. (cool guitar sound here). I saw another one just the other day. A special new band. I remember lying. I don't remember a line. I don't remember a word. But I don't care, I care, I really don't care. Did you see the drummer's hair?. Advertising looks and chops a must. No big hair!. Songs mean a lot when songs are bought. And so are you. Face right down to the practice room. Attention and fame's a career. Korea, chorea, career"
date with ikea,The actress is always breaking things. the things you made and she took you for. And I'm so tired -- I'd be lying -- I hope the prarie buys you more. The fitness coast is growing near. the shores they don't stay blond this year. That's why the marble lawns stay clear and warm in time. I want to stay but my time is wasting. The magic lands call my name. They want to fire a missle launcher. But I know I need to stay. We all know that by staying here it'll be a good high this year. So what's the use to staying there if you've got no use for time. The fitness coast is growing near. the shores they don't stay blond all year. the continent moves with growing fears. It's all for expensive lawn. I want to stay but my time is wasting. The magic lawns call my name. I want to fire a missle launcher. But I know I need to stay. I know I need to stay. (and fight the day.). I know I need to stay. (and fight the day.). I know I need to stay. (and fight the day.). I know I need to stay. (and fight the day.).
debris slide,maybe she is. maybe she's not. maybe we's. we's hack cough. wheeze hack cough. debris slide. maybe he is. maybe he's not. maybe I's. I's in the socket. eyes in the socket. so i'm gonna sock it. debris slide!.
elevate me later,well you greet the tokens and stamps. underneath the fake-oil burnin' lamps. in the city we forgot to name. the concourse is four-wheeled shame. and the courthouse's double-breast. i'd like to check out your public protests. why you're complaining Ta!. you sleep with electric guitars. range rovin' with the cinema stars. and i wouldn't want to shake their hands. 'cause they're in such a high-protein land. because there's 40 different shades of black. so many fortresses and ways to attack. why you're complaining Ta!
embassy row,"Old intuition -- on your dock we're fishin'. Come on now, give us a grade. A for effort, and a B for delivery. C for devotion when the world starts encroaching on your plans. Where is the savoir, where is the savoir -- he's not here right now. Where is the savoir, where is the savoir-faire?. Embassy row -- the fumes they lay low. On lanes that are wide -- where the limousines glide. On the wrought-iron gates and the bone china plates. And don't forget your manners where the anthems play. In a netherworld of foreign feeds. In a netherworld of foreign feeds. In a netherworld of foreign feeds. I'm gonna take the crown, I'm gonna take the crown. I'm gonna take the crown, I'm gonna take a crown. Maids, they are frisked -- and asses are kissed. I needed a visa -- I bought off a geezer. Political favors could make you a savior. In an open corner where the news is late. In a netherworld of foreign feeds. In a netherworld of foreign feeds. In a netherworld of foreign feeds. I'm gonna take the crown, I'm gonna take the crown. I'm gonna take a crown, I'm gonna take a crown. I need to get born, I need to get dead. I'm sick of the forms, I'm sick of being misread. By men in dashikis and their lefist weeklies. Colonized wrath -- their shining new path. The converted castle of moorish design. If you want to stay the weekend, well, we wouldn't mind. The plots they are hatching, the surface is scratching. In an open corner where the news is late. In a netherland of foreign beads. In a netherland of foreign beads. In a netherland of foreign beads. I'm gonna take you down, I'm gonna take the crown. I'm gonna take the crown, I'm gonna take the crown. I'm gonna take the crown, I'm gonna take the crown. I'm gonna take the crown, I'm gonna take the crown."
extradition,"the expedition has fifty goes. 40 roses and you blow. make your way way way way way way way far away. where you stay where you play. where do you play?. can you say what you need. when you really need it?. are you gonna feed it?. lady i know-know-know you don't. need no license for your petty, petty petty crime. ?if i should function two layer under?. around the circle luxury is so tough. so toughen up, toughen up,. i'm not tough enough. tonight we interact like seperate worlds. spoken barriers you hurl. saw you curl."
fame throwa,"fame throwa pass out the gold,. the diamon watch the last reward,. all the things we had before. you sold us out and took it all. head-borne cries from zenith sluts. astral rites from dead-end ruts. these ends are sickened wars [x2]. he's one of our nation's spies. he's one of our first recruits. i click with her leather thighs. he's one of our first recruits. how can you know?. in the distance lies a grower,. né–‘ Rudolph, king fame throwa,. son of groupie, bed-worn sexan. spent his cash convincing us. that the desert was a starscape. took our lives for satellites so we could cry:. naked, naked, foul.. he's one of our nation's spies. he's one of our first recruits. i click with her leather thighs. he's one of our first recruits."
far from you,"By: Brett M. Baker. 9/11/03. Iâ€™m running away from you (but in my mind)<<<<<<<This is the chorus. Youâ€™re to damn fast (I cant get away). I try to block you out (you find another way). All the things you did (didnâ€™t phase me). Thereâ€™s nothing you can do to (amaze me). I look into your eyes (I see nothing). Why did I stay (who fucking Knows).. Now I know the troubles (werenâ€™t worth it). I wish that I knew (a lot earlier). You treated me like shit (almost all the time). You made me feel like shit (on the inside). Chorus. I climbed out on a limb (you cut it down). So you could watch me fall (I hope its far from you). I moving on to better things, better people, better situations,. Iâ€™m moving to a better place (that better place is far from you).. Chorus. When the fake tears start to fill your eyes (I will not care). When you need a hug from someone (I will not be there). When you need a shoulder to lean on (my shoulder; I wonâ€™t share). When you need someone to call (donâ€™t you even dare)."
father to a sister of thought,"rotten device, i'll say it twice. i'm too much i'm too much comforted here. costs too much too much, we'll leave you. everywhere eyes, nowhere to die. no place to shove your sharpened heel. i'm looking looking for a tired face. in case you wanted to go. i know, i'm breathing in to the end. calling the bluffs, talking so tough. goodbye to the ugly steeple fear. good times for ever after. i'm just a man. you see who i am. i'm binding my hooks. and open the books. dirty black hearts. angel of corpus cristi. you're so misty, tell me what i want to hear. i know i'm reeling in...[x2]. to the end [x4]."
fight this generation,"woke up to people so tall to you. i can't so i won't stand. up chuck break luck. look for the splinters you might see where they come in. go down, sweet yardley. i won't let you fall down, sweet yardley. i won't let you fall down, here, now. ah- god damn the guts and the gore. nobody's crying 'cause there's no one to score for. come up sweet randy. i won't let you fall -what you got to lose?. what you got to prove?. who you gonna screw down here? ..now. here now ..i am.. here now..i am... here... now.... your life is about to-to come. away from the mirror in a rainshed. generation. fight this generation (x 15 or so). stop right."
fillmore jive,"Hey lady, what do you need?. Do you think you'd like to come and bleed with me?. I'd like to invite you to a taste of my chalice. It's a special one, it's made of gold. (passed out). Passed out on your couch. You left me there (thank you). Let me sleep it off. I need to sleep it off. I need to sleep why don't you let me. I need to sleep why don't you. I need to sleep. I need to sleep. I need to sleep. I need to sleep, why won't you let me. I need to sleep. I need to sleep. I need to sleep. Why won't you, why won't you let me sleep?. The jam kids on the vespas. And glum looks on their faces. The street is full of punks. They got spikes. See those rockers with their long curly locks. Goodnight to the rock and roll era. Cause they don't need you anymore. Little girl, boy, girl,. bo...................y. Their composures are so distracted. Jasper's skinny arms. And the dance faction, a little too loose for me. Every night it's straight and narrow. Laws are broken, amusing era. walls are broke in the music era. Round and round and round and round she goes..... .... Pull out their plugs and they snort up their drugs. When they pull out their plugs and they snort up their drugs."
fin,"Open call for prison architects. Send me your blueprints ASAP. Stack the walls such that I cannot breathe. Man is breedin' forever, because of the weather I hope soon to leave from. the east. No more absolutes, no more absolutes. Stick your penitentiary clothes inside the vent and run along, Leigh. Amateur seasalt gatherers colonized. They're good enough for Conrad Hilton, not good enough for my eyes. I trust you will tell me if I am making a fool of myself. Man is breedin' forever, breedin' forever, they come out and blister the. sea, oh yeah."
flux = rad,"child, don't you know. i don't want to let you go. child, don't you know. that. i don't wanna let you (x11). styles, they come and go. but i'm not going to let you go. styles, they come and go. but. i'm not gonna let you (x11)."
folk jam,"If you enjoy the company. of a descending family tree. Well tuck in your thoughts,. it's there or its not.. the feeling is mutual. Well pardon my birth i just slipped out. origins i can't brag about.. spawn of a bank inquisitor. And theives i wish.. Watch out the snitch also. involves himself in blackmail.. One would think the interests conflict.. Yeeeeah, hooo. (some meaningless gibberish about docks?). changing the order.... the air is so taut/tight i feel so thin. Hot as the come to closing in. Hot as the gun i'm closing in. and reeap the benefits. Beware the head of state. says that see believes in leprechauns. Irish folk tales scare the shit out of me, yeah. be as it may i'm happy to say i'm around. Miles accrued and passengers add up. the message on a mirror says ""stick with me"". Cause no one's there. to read your reflection when i'm gone. get it on."
forklift,"chinese spectate riding forklift,. mother says ""no"". can't i for...forklift me?. why? because i need money, work,. time is my life, not hers.. what does it mean?. of course work sucks: spend week in nevada. dancing with old lady full of nickels,. full of nickels and dimes. makes me tired, lose my..self. lose my cash. i get really fucked and then really drunk.... (something about playing cards and being from iowa. and the dealer had 21). nothing left back home with his forklift. driving past boss creamer, age 24. delta pi, phd. mr. creamer, tired of words,. looked at me,""life is a forklift.. now my mouth is a forklift. this i ask: that you serve as a forklift too.. christmas, christmas."
from now on,from now on. i make haste. to carry my skin. into the arm. must of ?????. never less. never less. cuaght might grow in to a mind that eats. like a big taste lie. i've laid low. from now on. this is a joke. when he sees the skin rought on me. play low. from now on. this is a joke. can i see the skin rot. on a dog stray's hide.
frontwards,"I am the only one,. searching for you,. and if i get caught,. then the search is through. and the stories you hear,. you know they never add up. i hear the natives fussin'. at the data chart,. be quiet. the weather's on the night news.... empty homes,. plastic cones,. stolen rims. are they alloy or chrome?. well i've got style,. miles and miles,. so much style. that it's wasted,. so much style. that it's wasted. so much style. that its waste---------ed. she's the only one,. who always inhales. paris is stale. and it's war if we fail. And in the migrant hotels,. they never sleep,. they never will. their souls are crumbling. like a dirt clod. hold, your cigarette cuts. to the inside. empty homes,. plastic cones,. stolen rims,. are they alloy or chrome?. well i've got style,. miles and miles. so much style. that it's leavin'. it's pattern's torn. and we're weavin'. this battle's torn. and we're weavin'"
give it a day,"Aych ay see two (half a canyon too). Increase Mather told her dad, yeah. ""I roundly disagree with you. You're vocal style's to preachy. All the yokels mock your teaching."". But Cotton, he was just so oblivious. To all their cutting pleas. Soon the townfolk took to it,. In every pew they looked to him. For guidance just like eyeless lambs. Awaiting that ol' kabob stand. The skeptics formed. The nation's born. They want to have it, Cotton's dream. But Increase had them mounted. And they burned on open fires. So the word spread just like small pox. In the Sudan. The gentry cried:. ""Give it a day!"" x6. Years and years have passed. Since the puritans invaded our soul. Just like those arab terrorists. You'll never know. But today the gods can't make us quake,. We see our lives as situations. Eyes are eyes and teeth are teeth,. Well mine are rotten underneath. I got two ways we can separate from the clan. If I could fly...I...could...fry. I hope you profited from this bulletin. And it stabilized your land. You're drenched, you're fired,. (You gentrified?). Your Alzheim clan, but. Your father is another one of them. I don't wanna mention him again, cause. I talked to him last night,. He hates my guts. We had a fight. And he called you a slut girl,. Why's that?. What did you do to him to make him think...?"
gold soundz,"go back to those gold soundz. and keep my advent to your self. because it's nothing i don't like. is it a crisis or a boring change?. when it's central, so essential,. it has a nice ring when you laugh. at the low life opinions. and they're coming to the chorus now.... i keep your address to yourself 'cause we need secrets. we need secrets crets crets crets crets crets back right now. because i never wanna make you feel. that you're social. never ignorant soul. believe in what you wanna do. and do you think that is a major flaw. when they rise up in the falling rain. and if you stay around with your knuckles ground down. the trial's over, weapon's found. keep my address to myself because it's secret. cuz it's secret cret cret cret [etc.]... back right now. so drunk in the august sun. and you're the kind of girl i like. because you're empty and i'm empty. and you can never quarantine the past. did you remember in december. that i won''t eat you when i'm gone. and if i go there, i won't stay there. because i'm sitting here too long. i've been sitting here too long. and i've been wasted. advocating that word for the last word"
grave architecture,"come on in.... grave architecture (x2). walk the marble malls [?]. the monuments to those who fall. and it's a pocket less than narco shell-bit. stiff the crypt and the others are rough. and the hood's so rad. and i'm fucking glad. glad to see that, know what it means. it takes a lot. grave architecture (x2). stroll past the strip. is it old? am i clipped?. am i just a bathtub waiting to be gripped. or found on shady ground?. and the lampshade's poised on the overwhelm. drugs, and need the talent to breathe. it takes a lot. oh yeah, you wanna be like a blind fish. positive, we're positive-- go!. takes a lock-grip, baby. to put you to war. and i'm pushin' you back than ever ???. that'll push you hard. it takes em......."
greenlander,On an icy island north. In the woods beside the church. We can bury crimson lockets filled with dirt. And when the April thaw. Brings us out again. We can bless the arrows. And the sun won't stall. And the land will never fall. On virgin fields we'll skate. Stand by children we'll create. Like the arctic wind we spin. A windmill's rose into the threshing soul. You can't thresh the snow. When the snow is sending. There's no divine grove. You can see the blankets go. Everything I did was right. Everything I said was wrong. Now I'm waiting for the night. To bring the dawn. Into the only room where the fire's warm. Where we keep our vices warm. And it's all that's left. All that's left is vices torn
grounded,"Doctor's leaving for the holiday season. got crystal ice picks, no gift for the gab. and in the parking lot is a sedan he bought. he never, he never complains when it's hot. he phoned the foreign daughter in a sauna playing contract bridge. they're soaking up the fauna, doing blotters. I don't know which...which...which.... boys are dying on these streets. I know the medical world could knock you out. to sell the coins that you jayed last Thursday. dine by candelight and hold your savings tight. you never, you never know when the bridge falls apart. we spoke of latent causes, sterile gauzes. and the bedside morale. we traipse around the table talking sentences. so incomplete... please! plea!. boys are dying on these streets...."
half a canyon,"ahhh!!! shit, baby.. canyon bro', your life is worked in. dream about the witch trials. you get all too lot of pepper in your forecast. beneath the shady mezzanine. keep it when you want to belong.... july fourth, raging fortune. dream about the witch trials. send in the romance of people with their dreadlocks. tied like windshields in the night. keep it when you want to belong.... i keep my head on for pretty jades. i keep my head up for ships and shades. i keep my head up for bitchy braids. i keep my head up for guilty ray.... waaaaaaaaaooow(x2). my..god..i can't believe i am still going(x2). allee! allee! allee! allee! allee! allee! allee! allee!...."
harness your hopes,Harness your hopes. On just one person. Because you know a harness. Was only made for one. Don't telegraph your passes. You'll end up with molasses. Cauterized with syrup. And syrup and molasses. And I'm checking out the asses. The assets that attract us. To anything that moves. We're deep inside the grooves. And it's time to shake the rations. 'Cause someone's gonna cash in. The plot it turns again. The reference starts at ten. Show me. A word that rhymes with pavement. And I won't kill your parents. And roast them on a spit. And a - don't you try to etch it. Or permanently sketch it. Or you're gonna catch a bad bad cold. And the freaks have stormed the white house. I moved into a lighthouse. It's on a scenic quay. Its oh so far away. Far away from the begining. The shroud is made of lenin. The yearling took the purse. The goth kid has a hearse. Heart breaking. Earth quaking. Kiwis they are home baking. Minds wide open truely. Leisure. A leisure suit is nothing. It's nothing to be proud of. In this late century. And I'm asking you to hold me. Just like the morning paper. Pinched between your pointer. Your index and your thumb. It's a semi automatic. Believers are ecstatic. You see the way they cling. The cold metallic sting. And I'm living in a coma. For Donna DeVorona. The harness made of hopes. The lovers on the ropes. Nun is to church. As the parrot is to perch. And my heart's wide open truely
haunt you down,"I got a leaf. And a spleef. Light that spleef. God bless that spleef in my mouth. Or should I say ja baby. Spin Doctors are crazy. Take it Butch. I got a life complete with my love. I got a wife, she fits in my leather gloves. I got a knife and I keep it above my heart for you. Rock on. It always sets me down. The way you tremble when you're down. And all the lies you tell. Come back to haunt you baby. Back to haunt you down. Come back to haunt you baby. Haunt you down. All right. Look Out. I've been to Christmas in France. I don't wanna have no pants. I've had Christmas in France. Where they don't wear any pants. I've had Christmas in Detroit. How do you think that feels?. I've been married in Cincinnati too. Hold Off. All you need your fill is waiting for your man to come home. All your deets undecided boxes. Are coming out. I'm coming out. I'm hungry for you. I can smell you on my hands. And it smells really good. Oh yeah. Hold me down and love me. Hold me down and love me. Keep that knife above me. I'll teach you how to look my age. If you wanna look old. I'll teach you how to look my age. If you wanna look old. I'll teach you how to look my age. I'll teach you how to act like over age, over age"
he reigns (the medley),"(feat. Papa San). Our god. Is an awesome God he reigns. From heaven above. With wisdom,power and love. Our God. Is an awesome God he reigns. From heaven above. With wisdom,power and love. Our God is an awesome God. You're marevelous and you're glorious. You're love has made me victorious. You took away the in us. Now we praise You cause you. You delivered us. There aint no stoppin us (naw). Devil there aint no blockin us (naw). Come on and clap your hands with us. Like this like that. [Vamp:]. He reigns. He reigns. He reigns."
