moline,"I knew there was trouble, so I left detroit. I left my old man, for a plane full of boys. for did he leave me that son of a bitch keith. yeah home after dawn. always smelling like pig. he took my share and still didn't care. yeah, he probably would have. killed me if I had stayed there. but I had a scheme so cool and so clean. I got me a ticket one way to moline. moline, moline, how have you been?. been here before, but it must have been a dream. moline, you see, your rivers turn green. the mississippi rises as wide as the sea. moline, it seems that this is for me. my name is nancy but here I'm coleen. yeah, moline. now I love paying ransom, life on my own. yeah, everything's better than in that bastard's home. and someday I'll buy, yeah look in I've been. I got my eye in the quad cities, here in moline. the place with the chapel on 4th avenue and 12th street. moline, moline, how have you been?. I probably been here before, but it must've been a dream. moline, you see, your rivers turn green. the mississippi rises as wide as the sea. moline, it seems that this is for me. you call me nancy and now I live in moline"
my father's son,"I come from genius and I am my father's son. Too bad he was a psychopath. And now I'm the next in line. Then there's dear mother, yeh shirley. She's a work of art. Never got top dollar, but she gave us all our start. Can I get a reprieve?. This gene pool drowning me. Can I get a release?. I'm a volunteer amputee. From the moment I fail. I call on Dna. Why such betrayal?. Got me tooth and nail. Yeh, How's about one conversation. With nothing else left to be had?. With this your young long lost son. And his never had dear old dad. Forget the insemination. And for that, I'm supposed to be glad?. What a pity you left us so soon. To climb your mountain of regret. Can I get a reprieve?. This gene pool dark and deep. Can I get a release?. Can I volunteer amputee. From the moment I fail. I call on Dna. Why such betrayal?. I gotta set sail. All the bright lights shining. As you're trying to breathe in thin air. Cannot forget your hiding. Collected wounds left unhealed. When every thought you're thinking. Sinks you darker than a new moon sky. Far away lights rising. In the whites of your eyes. Now father you're dead and gone. And I'm finally free to be me. Thanks for all your fucked-up gifts. For which I got no sympathy. Now I'm living in a war torn place. Hear the bombs, a 5th Symphony. Thanks for this and thanks for that. I gotta let go legacy. Can I get a reprieve?. This gene pool drowning me. Can I beg a release?. Can I volunteer amputee. From the moment I fail. I call on Dna. Why such betrayal?. I gotta set sail"
no more war,"No More War. I speak for a man who gave for this land. Took a bullet in the back for his pay. Spilled his blood in the dirt and the dust. He's back to say:. What he has seen is hard to believe. And it does no good to just pray. He asks of us to stand. And we must end this war today. With his mind, he's saying, ""No more!"". With his heart, he's saying, ""No more!"". With his life he's saying, ""No more war!"". With his eyes, he's saying, ""No more!"". With his body, he's saying, ""No more!"". With his voice, he's saying, ""No more war!"". Yeah, nothing's too good for a veteran. Yeah, this is what they say. So nothing is what they will get. And there's no American way. The lies we were told to get us to go. Were criminal (?)... let us be straight. Let's get to the point where our voices get heard. And I know what I'll say. With his mind, he's saying, ""No more!"". With his heart, he's saying, ""No more!"". With his life he's saying, ""No more war!"". With his eyes, he's saying, ""No more!"". With his voice, he's saying, ""No more!"". With his body, he's saying, ""No more war!"". No more innocents dying. No more terror rising. No more eulogizing. No more evangelizing. No more presidents lying. No more war. With our minds, we're saying, ""No more!"". With our hearts, we're saying, ""No more!"". With our lives, we're saying, ""No more war!"""
no way,"Here's a token of my openness. Of my need to not disappear. How I'm feeling, so revealing to me. I found my mind too clear. I just need someone to be there for.. me. I just want someone to be there for.. me. All the static in my attic-a. Shoots down my side nerve. To the ocean of my platitudes. Longitudes, latitudes, it's so absurd. I just need someone to be there for... I just want someone to be there for... Someone to be there for... 'Cause I'll stop trying to make a difference. I'm not trying to make a difference. I'll stop trying to make a difference. No way (2X). Ooh, let's call in an angel (3X). 'Cause I'll stop trying to make a difference. I'm not trying to make a difference. I'll stop trying to make a difference. No way. 'Cause I'll stop trying to make a difference. I'm not trying to make a difference. I'm not trying to make a difference. No way. No way, no way. Let's call in an angel. Who's calling an angel?"
not for you,"Restless soul, enjoy your youth. Like Muhammad hits the truth. Can't escape from the common rule. If you hate something, don't you do it too... too. Small my table, a-sets just two. Got so crowded, I can't make room. Oh, where did they come from? Stormed my room!. And you dare say it belongs to you... to you. This is not for you. Oh, not for you... ah, you. scream... my friends... don't call me. friends, no they don't scream. my friends don't call... my friends don't. All that's sacred comes from youth. Dedication, naive and true. With no power, nothing to do. I still remember, why don't you... don't you. This is not for you. Oh, never was for you... fuck you. This is not for you. Oh, this is not for you... yeah, you. This is not for you. Oh, not for you"
nothing as it seems,"Don't feel like home. He's a little out. All these words elope. It's nothing like your poem. Putting in, inputting in. Don't feel like methadone. A scratching voice all alone. It's nothing like your baritone. It's nothing as it seems. The little that he needs, it's home. The little that he sees. Is nothing he can sees. It's home. One uninvited chromosome. A blanket like the ozone. It's nothing as it seems. All that he needs, it's home. The little that he frees,. Is nothing he believes. Saving up a sunny day. Something maybe two tone. Anything of his own. A chip off the corner stone. Who's kidding? Rainy day. A one way ticket headstone. An occupation overthrown. A whisper through a megaphone. It's nothing as it seems. All that he needs, is home. And all that he sees. Is nothing he concedes,. It's home. And all that he frees. A little bittersweet, it's home. It's nothing as it seems. The little that you see, is home"
nothingman,"Once divided...nothing left to subtract.... Some words when spoken...can't be taken back.... Walks on his own...with thoughts he can't help thinking.... Future's above...but in the past he's slow and sinking.... Caught a bolt 'a lightnin'...cursed the day he let it go.... Nothingman... (2x). Isn't it something?. Nothingman.... She once believed...in every story he had to tell.... One day she stiffened...took the other side.... Empty stares...from each corner of a shared prison cell.... One just escapes...one's left inside the well.... And he who forgets...will be destined to remember...oh...oh...oh.... Nothingman... (2x). Isn't it something?. Nothingman.... Oh, she don't want him.... Oh, she won't feed him...after he's flown away.... Oh, into the sun...ah, into the sun.... Burn...burn.... Nothingman... (2x). Isn't it something?. Nothingman.... Nothingman... (2x). Coulda' been something.... Nothingman...."
oceans,"Hold on to the thread. The currents will shift. Glide me towards.... You know something's left. And we're all allowed. To dream of the next. Oh, ohh the next, time we touch.... Oooh... (4x). You don't have to stray. The oceans away. Waves roll in my thoughts. Hold tight the ring.... The sea will rise.... Please stand by the shore.... Oh, oh, oh, I will be.... I will be there once more.... Oooh... (4x). Uh huh, oh yeah... (2x)"
of the earth,On the rise and. Rise and fall. What they're sayin is. Nothin left at all. On the rise and. Catch and fall. All they're sayin is. Somethin that I don't like. Of the earth. On the rise and. Rise and fall. All they're sayin is. Comin back for more. On the rise and. Here-to-fore. On the scene is. Somethin I don't like. Of the earth. On the rise and. Rise and fall. All they're sayin is. Nothin I don't like. On the rise and. Rise and fall. All they're sayin is. Nothin I don't like. Of the earth
of the girl,Gossard. Oh he deals them off of the top. Ties them off.. Fills it up with his past. Gets carried away.. Oh half his life a hand me down wasted away.. Oh he fills it up with the love of a girl.. Oh he left it alone drilled the pain with money to buy.. How he makes his getaway. How he makes his getaway.. Oh he chose a path. Heavy the fall. Quarter to four.. Fills his night with the thought of a girl.. How he makes his getaway. How he makes his getaway..
off he goes,"Know a man, his face seemed pulled and tense. Like he's riding, on a motorbike in the strongest winds. So I approach with tact, suggest that he should relax. But he's always moving much too fast. Said he'll see me on the flipside. On this trip he's taken for a ride. He's been taking too much on. There he goes with his perfectly unkept clothes. There he goes. He's yet to come back, but I've seen his picture. It doesn't look the same up on the rack. We go way back. And I wonder about his insides. Its like his thoughts are too big for his size. He's been taken, where I don't know. Off he goes with his perfectly unkept hope. There he goes. And now I rub my eyes, for he has returned. Seems my preconceptions are what, should've been burned. For he still smiles, and he's still strong. Nothing's changed but the surrounding bullshit, that has grown. And now he's home, and we're laughing. Like we always did my same old, same old friend. Until a quarter to ten. I saw the strain creep in. He seems distracted and I know just what is going to happen next. Before his first step, He's off again"
olé,"Oh, what you say, what you say. What you say when your life ends?. What you gonna say? Olé!. Ah, what you say, what you say. What can you say of importance?. What you gonna say but ""Olé!""?. Ah, what you say, what you say. When there's too much you can't breathe in?. What you gonna say but ""Olé!""?. I ain't got words for what goes on. I ain't got time for all that's wrong. What do you say? meditate. Meditate, Olé!. What you say, what you say. When they give the guy the go-ahead?. What you gonna say? Olé!. What you say, what you say. When your spitting up on your bed?. What you gonna say? Olé!. What you say, what you say. When you've had enough of knuckleheads. What you gonna say? Olé!. What you say, what you say. What you say when you've seen enough bloodshed?. What you gonna say? stop!. I still can't help but wonder why. I'm feeling laughed at by the sky. What do you say, meditate?. Meditate, Olé!. Always laughing when your life ends. Always laughing when your life ends. Always laughing when your life ends. Always laughing when your life ends. Always laughing when your life ends. Always laughing when your life ends. Always laughing when your life ends. Always laughing when your life ends"
olympic platinum,"Olympic dream, olympic dream. If I could reach to the sky and touch it for my country. Get some on my finger and take in its smell. The smell of victory, land of the free, olympic dream,. OlympicDream. Olympic theme. My olympic dream. My promotion scheme. How hard can it be. How high can I jump. How high can I throw. How high can I run (I'm running very fast). How long can I hold my breath and stay underwater. And wave my legs around in perfect unison with my partner who. Doesn't really understand me. For my olympic dream, my olympic dream. I'll be like dwight stone. I'll be like bruce jenner. I'll be like that girl who trained all her life as a distance. Runner and then tripped with a quarter mile to go. But I... I will get up and I will run. I will run with the georgia peach breeze and I... I will win. I will win my... my olympic dream. My olympic dream. The gold's just not good enough. And I don't even think of the bronze. I'm living my life for olympic platinum. Olympic dream, my olympic theme. I'll sing like whitney (sing like whitney)"
once,"I admit it...what's to say...yeah.... I'll relive it...without pain...mmm.... Backstreet lover on the side of the road. I got a bomb in my temple that is gonna explode. I got a sixteen gauge buried under my clothes,. I play.... Once upon a time I could control myself. Ooh, once upon a time I could lose myself, yeah.... Oh, try and mimic what's insane...ooh, yeah.... I am in it...where do I stand?. Oh, Indian summer and I hate the heat. I got a backstreet lover on the passenger seat. I got my hand in my pocket, so determined,. Discreet, I pray.... Once upon a time I could control myself. Ooh, once upon a time I could lose myself, yeah, yeah.... You think I got my eyes closed. But I'm lookin' at you the whole fuckin' time.... Ooh, once upon a time I could control myself, yeah.... Once upon a time I could lose myself, yeah, yeah, yeah.... Once upon a time I could love myself, yeah.... Once upon a time I could love you, yeah, yeah, yeah.... Once (4x). Yeah...once, once...yeah, yeah.... Yeah, yeah, yeah, yeah, yeah...oww..."
open road,"Can I have some water up?. (You're the man, Eddie). (Eddie, you're the man). There's no way. To tell to be sure. Ticket I'm a-wantin'. This bus it's makin' way. Too many stops. I can't get a-movin'. Where's my destination?. I take a deep swallow. In my frustration. I'm takin all I got. It fits. In this little bag. All my life. I had empty pockets. All my life. I saw evil eyes. In old dark sockets. I cut 'em off. I cut 'em off. I said. ""I don't need them. to make life work"". I cut 'em off. I cut 'em off. I'll never think twice. If to them. I never ever talk. So here I go. I'm finally on my way. Once I said goodbye. That was my last wave. Here I am on the. On the open road. I've never felt better. Then when I am alone. (Eddie)"
other side,"it's not the same without you up here. can't find my wheels. your absence is what breeds this fear. warm breath and all it steals. you can't know how it feels to be in here. all the dark horse fields, befriendin' me. playin' ain't the same without you here. we've come to hate the golden rule. cannot seem to make the dots connect. the morning light don't show you near. you can't know what it's like to bleed from here. the blackened world goes white, it goes nowhere. oooh hoo... death ain't the same without you, dear. i make the others run and hide. new york streets seem to make it worse. all this noise inside the quiet. i can't hold on, the weight you bear. my body's broken fast, please lift me up. you can't know what it's like to be inside. your fading melodies can't beat my need. i'm not the same without you here. how can i quit to be there. sit and stare. stare. Begging for a prayer..."
out of my mind,"Out of my mind...out of my mind.... All of the time.... Wish you could help me mister.... Wish you could lift me up.... Wish you could pack my parachute mister.... Wish you could pull me up.. The winds have change, I'm stuck beneath the rain.... I wish you could help me up.... Out of my mind...out of my mind.... Once inside, I'm out of my mind.... Out of my mind...out of my mind.... Once inside, I'm out of my mind.... Wish you could help me, give me a pill.... Just a little drink that I could swill.. A little something, anything, anything, I'll try all.... I ain't got nowhere to go from here.. I'm just about this far. From drowning in my very own tears.. Out of my mind...out of my mind.... Once inside, I'm out of my mind.... Out of my mind...out of my mind.... I don't feel so hot.... out of my mind.... Where do I go? Where do I stay?. I got no place to lay in the hay.. Where do I go to soothe my head?. Guess I'll turn on music instead.. Where do I see? Where do I shine?. No one wants to take my mind.. Where do I go? How do I feel?. Guess I'll waste away in here.... Out of my mind...out of my mind..... Out of my mind every single time.... by Chefin"
parachutes,"Why deny. All the troubles when combined. With the missing links it. Don't feel like. Home now. That your gone. All the troubles suddenly. Explained infinitum. You're always wishing. And never here at home. You. All the dreams we shared and. Lights we turned on. But the house is getting dark. And I don't want to know your past. But together share the dawn. And I won't need nothing else. Cause when we're dead. We would've had it all and died. I would've fallen from the sky til you. Parachutes have opened now. Heaven knows if there's a ceiling. Come so low with the kneeling. Please know that I got all the friends I'm needing. Before my light go out. As the doors are closing now. And far away will be my home. And to grasp this, I don't know. But I don't need. Further back and forth, a wave will break on me today. And love. Wish the world could glow again with love. One can't seem to have enough. And war. Break the sky and tell me what it's for. I'll travel there on my own. And love. What a different life. Had I not found this love with you"
parting ways,Vedder. Behind her eyes there's curtains and they've been closed to hide the flames. Remains.. She know their futures burning but she can smile just the same. Same.. And though her mood is fine today there's a fear they'll soon be parting ways.. Standing like a statue. A chin of stone a heart of clay. Hey.. And thought he's too big a man to say there's a fear they'll soon be parting ways.. Drifting away. Drifting away. Drifting away. Away. Away..
pendulum,"Can't know what's high till you've been down so low. The future's bright, lit up with no where to go. to and fro the pendulum throws. We are here and then we go. my shadow left me long ago. Understand what we dont know. this might pass. this might last. this may go. easy come and easy go. easy left me a long time ago. I'm in the fire but I'm still cold. nothing works works for me anymore. ahh ahh ahh ahh ahh. to and fro the pendulum throws"
pilate,"Talk of circles, punching out. Looking in, drawing circles down. Falling off the south marking ground. Talking out of turn, drawing circles down. Like Pilate, I have a dog. Like Pilate, I have a dog. Walks me out of town, still one's a crowd. Making angels in the dirt, looking up, looking all around. Like Pilate, I have a dog (obeys, listens, kisses, loves). Like Pilate, I have a dog (obeys, listens, kisses, loves). Stunned by my own reflection. It's looking back, sees me too clearly. And I swore I'd never go there again. Not unlike a friend that. Politely drags you down, you down, you down, you down. Like Pilate, I have a dog (obeys, listens, kisses, loves) }x4."
porch,"What the fuck is this world. Running to? You didn't. Leave a message at least I. Coulda' learned your voice one last time. Daily minefield this could. Be my time how 'bout you?. Would you hit me?. Would you hit me?. Ohhh, ohh ohh,. Ohhh woah oh.. All the bills go by and. Initiatives are taken up,. By the middle.. There ain't gonna be any middle any more.. And the cross I'm bearing home. Ain't indicative of my place. Left the porch. Left the porch. Hear my name. Take a good look. This could be the day. Hold my hand. Walk beside me. I just need to say.... Hear my name. Take a good look. This could be the day. Hold my hand. Lie beside me. I just need to say. What can I take?. I just want to be. I know that I would not ever. Touch you,. Hold you,. Feel you,. In my arms,. Never again."
present tense,"Do you see the way that tree bends?. Does it inspire?. Leaning out to catch the suns rays. A lesson to be applied. Are you getting something out of this. All encompassing trip?. You can spend your time alone. Redigesting past regrets, oh. Or you can come to terms and realize. You're the only one who can't forgive yourself. Makes much more sense. To live, in the present tense. Have you ideas on how this life ends?. Check your hands and study the lines. Have you ever believed that the road ahead. Ascends off into the light?. Seems that needlessly it's getting harder. To find an approach and a way to live. Are we getting something out of this. All encompassing trip?. You can spend your time alone. Redigesting past regrets. Or you can come to terms and realize. You're the only one who cannot forgive yourself. Make much more sense. To live in the present tense"
"pry, to",P-r-i-v-a-c-y is priceless to me (4x). P-r-i-v-a-c-y (4x).
public image (public image ltd. cover),"Hello, hello, hello (ha, ha, ha). You never listen to a word that I said. You only seen me. For the clothes that I wear. Or did the interest go so much deeper. It must have been. The colour of my hair. The Public Image. What you wanted was never made clear. Behind the image was ignorance and fear. You hide behind this public machine. Still follow same old scheme. Public Image. Two sides to every story. Somebody had to stop me. I'm not the same as when I began. I will not be treated as property. Public Image. Two sides to every story. Somebody had to stop me. I'm not the same as when I began. Its not a game of monopoly. Public image. Public image. You got what you wanted. The public image belongs to me. It's my entrance. My own creation. My grand finale. My goodbye. Public image. Goodbye. http://www.vagalume.com.br/public-image-ltd/public-image.html#ixzz1DfN80bQd"
"push me, pull me","I had a false belief; I thought I came here to stay.. We're all just visiting, all just breaking like waves.. The oceans made me, but who came up with love?. Push me, pull me, push me, but pull me out.. So if there were no angels would there be no sin?. You better stop me before I begin.. But let me say:. If I behave, can you arrange a spacious hole in the ground?. Somewhere nice, make it nice. Where the land meets my pride.. Push me, pull me, or pull me out.. Like a cloud dropping rain I'm discarding all thought.. I’ll dry up leaving puddles on the ground.. I'm like an opening band for the sun.. Push me, pull me, or just pull me out…out…out…... I've had enough, said enough, felt enough, I'm fine.."
ramblings i,but i think your drums are. no cheep ones. hey everybody uh this is eddie from pearl jam. and jeff. and me too. and mike. and it's me mike. and i'd talk to you if i could fucking see you if i talk i'd fuck up the song so sorry. and he cusses too every time he talkes. and dave. daves here. daves not here and. dave is in the house. dave is here. I am the chief who undress in a green prom dress. he's not a quiet percussion one he's the new not quiet hard hitting one. i'm not the grinch cuse I didn't have a drink. anyway we all thought we'd wish you a merry Christmas. and we're very happy right now cause we're on tour with the chilli peppers. and that's them playing in the background and a happy new year. and god bless everyone everywhere. that was mike he's tiny Tim now. and this is eddie saying i'm a rhino and my skin is two feet thick. so we'll leave you with this song and thank you again bye. se you merry Christmas. merry christman woo no cheep ones. happy happyness is good. yes we like that. happy (x7) is good. you think the slayer tour is out or what. the slayer tours not happpering this year. we should probley rap this up cuse. See ya. being paied right now. bye merry Christmas. bye slayer happy new year. that was ment to blow up your speakers. this is my it's actually the devil in santa clauses suit after all if you switch the letters around in santa it speels satin. you gotta switch em around and change a couple of them. i just saw that last night on the news you know those little...
ramblings ii,lets do this thing it's doing right now hey. merry Christmas we thought we'd give you a little insight into our band psysgolgy. which one of us is really fucked up that's the question we pose to you. is it eric johnson or it'll be the guy on the next album not wearing shoes. eric is dead. we just looked at the artwork for the christman single and it's preatty damm good. it's been a really fun year and. we're a little more relaxed at this little. we're much more relaxed right now. thank you guys very much for supporting us so much. say something nice to the people edward. hi he's doing the shy retuine right now. i'm not shy i'm just pissed. he's pissed and shy. merry pissmass. all right bye see ya
rats,"They don't eat, don't sleep. They don't feed, they don't seethe. Bare their gums when they moan and squeak. Lick the dirt off a larger one's feet. They don't push, don't crowd. Congregate until they're much too loud. Fuck to procreate till they are dead. Drink the blood of their so called best friend. They don't scurry when something bigger comes their. way. Don't pack themselves together and run as one. Don't shit where they're not supposed to. Don't take what's not theirs, they don't compare. They don't scam, don't fight. Don't oppress an equals given rights. Starve the poor so they can be well fed. Line their holes with the dead ones bread. They don't scurry when something bigger comes their. way. Don't pack themselves together and run as one (2x). Don't shit where they're not supposed to. Don't take what's not theirs, they don't compare.... Rats... They don't compare (2x). Ben, the two of us need look no more (5X)"
