"hey foxymophandlemama, that's me","Don't you want people to love you?. My spanking, that's the only thing I want so much. Spanking, that's the only thing I want so much. That's the only thing I want so much. Don't you want people to love you?. My spanking, that's the only thing I want so much. That's the only thing I want so much. Why is that better than being hugged?. Why is that better than being hugged?. Because you get closer to the person. Closer to the person. Why is that better than being hugged?. Because you get closer to the person. Closer to the person. Just like a person having sex feels cared for. We wanna be loved, so we have sex together. And they feel loved about that. And this is the way it makes me feel loved. I want it, I dream about it, I think about it, I want it. Just like a girl wants sex with a boy, you know?. It's the way I'll always be probably. My last one was born in the system. See, they're stupid, very stupid, those people over there. They're stupid. These people are so below mentality, honest to god, really. You know what I mean, he got the nerve to bug me. You know what I mean, he got the nerve to bug me. This mentality, honest to god, really. You know what I mean, he got the nerve to bug me. Honest to god, really. You know what I mean, he got the nerve to bug me. Bug me, bug me, he got the nerve to bug me. Everything seems so eight ball. Everything seems so eight ball. And i, I don't know if that's my imagination, but, umm. Hey foxymophandlemama, that's me. And I don't know if that's my imagination, but, umm. Hey foxymophandlemama, that's me. Hey foxymophandlemama, that's me. Think they got me. Hey foxymophandlemama, that's me hmm. Hey foxymophandlemama, that's me. know if that's my imagination, but, umm. Hey foxymophandlemama, that's me. She prides herself on her cleaning habits. She prides herself on her cleaning habits. Hey foxymophandlemama, that's me. She prides herself on her cleaning habits. She prides herself on her cleaning habits. It's a lovely stupid mop, it is. There's something really screwey about no streaking. Is it any old dumb mop? It streaks. Come on mop, no streaking mop. I don't mind mop the floor, my mop streaks, I don't like it. It's not me, it's the mop come, I bought some new mops. Go away you stupid, dumb old sponge mop. I don't believe it now the floor looks beautiful. I don't believe it now the floor looks beautiful. I don't believe it old sponge mop. Dumb old sponge mop, dumb old sponge mop. Old sponge mop, dumb old sponge mop. You're right, this mop's stupid dumb old sponge mop. I don't believe it now the floor looks beautiful. That's why they call me mophandlemama. Now the floor looks beautiful. That's why they call me mophandlemama. That's why they call me mophandlemama. That's why they call me mophandlemama. In two weeks, before she could see herself not dressed. The twenty-third of may you know she disturbed no one today. The manager told her to completely forge. If you ever go to bed, I'll kill you. Do I tell the whole world that I'm mentally ill?. Go to the papers yeah, why not? Drum roll. I want to show them that. I can walk on my own without hands of theirs. And, I can still fantasize, but I keep it to myself. Keep it to myself keep it to myself. I think I deserve to be loved, don't you? Very much. So think I deserve to be loved. Keep it to myself keep it to myself. I think I deserve to be loved, don't you?. To be loved, don't you but I keep it to myself. Keep it to myself keep it to myself. I think I deserve to be loved, don't you?. And, I can still fantasize, but I keep it to myself. Keep it to myself keep it to myself. I think I deserve to be loved, don't you?. Very much so. Do you ever think that you would actually, really kill yourself?. Well, if I have thought about it real, uhh, real deep. Yes, I believe I would. I have thought about it real, uhh, real deep. Yes, I believe I would. And, I can still fantasize, but I keep it to myself. Keep it to myself keep it to myself. That I can walk without hands of theirs. And, I can still fantasize, but I keep it to myself. Keep it to myself keep it to myself. I think I deserve to be loved, don't you?. That I can walk without hands of theirs. And, I can still fantasize, but I keep it to myself. Keep it to myself keep it to myself. I think I deserve to be loved, don't you? Very much so. Do you ever think that you actually would kill yourself?. Well, if I have thought about it real, uhh, real deep. Yes, I believe I would"
history never repeats,"History never repeats. I tell myself before I go to sleep.... Don't say the words you might regret. I lost before, you know I can't forget.... There was a girl I used to know.... Well, she dealt my love a savage blow.... And I was so young, too blind to see.... But anyway, that's history.... And I say, history never repeats. I tell myself before I go to sleep.... And there's a light shining in the dark. Leading me on towards a change of heart.... You say I always play the fool.... I can't go on if that's the rule.... Better to jump than hesitate.... I need a change and I can't wait.... I say... history never repeats. I tell myself before I go to sleep.... And there's a light shining in the dark. Leading me on towards a change of heart...heart.... Never repeats...whoa.... History never repeats. History never re.... Deep in the night it's all so clear.... I lie awake with great ideas.... Lurking about in no man's land.... I think at last I understand.... History never repeats. I tell myself before I go to sleep.... And there's a light shining in the dark. Leading me on towards a change of heart.... Yeah!"
hitchhiker,You fool. Dude what do you think you're doing. So you're lost. My problem last night(?). Conductor says. Off of my train. Be understood(?). Guess those relationships ain't my thing. Even if I could. You ain't the kinda person I would help anyway. I'm about to explode. Cause I can't carry your load. Hitchiker. You're cool. You're coke and your calculations. We're friends. Only because of my situation. I'm about to unload. Cause I can't carry your load. Hitchhiker. So be gone. Too soon is too late. I don't want no delay. So be gone. Get you're food off someone else's plate. Go tell all of your friends. I'm an idiot(?)and your great. Hitchhiker. Now Go....
hold on,"Nothin' left for me.... I can't live down here no more.. I can't fall from a tree,. I got wings, it ain't my fault.. Understand what's right.... It's so hard to be alone.. It's never tight,. It's been so loose for so long.. Hold on... Hold on.... Understand my fear,. I never been this high before.. I can't fall from cheer alone.. It only takes a breath to believe.... I can't face one more day,. I have tried so many ways.. My life work, all I failed.. I can't waste away on zeal.... Hold on.... A voice tells me hold on.... Somewhere I feel...hold on.... Hold on..."
hunger strike,"I don't mind stealing bread. From the mouths of decadence. But I can't feed on the powerless. When my cup's already overfilled. Yeah. But it's on the table. The fire is cooking. And their farming babies. While the slaves are working. The blood is on the table. And their mouths are choking. But I'm growing hungry. Yeah. I don't mind stealing bread. From the mouths of decadence. But I can't feed on the powerless. When my cup's already overfilled. Oho, ah. But it's on the table. The fire is cooking. And their farming babies. While the slaves are working. And it's on the table. Their mouths are choking. But I'm growing hungry (Growing hungry). I'm growing hungry (Growing hungry). I'm growing hungry (Growing hungry)....."
i am a patriot,"And the rivers shall open for the righteous.... And the rivers shall open for the righteous.... And the rivers shall open for the righteous someday.... I was walking with my brother,. And he wondered, oh how I am.. Said what I believe in my soul. Ain't what I see with my eyes,. And there's no turning back this time.. I am a patriot, and I love my country,. Because my country is all I know.. Wanna be with my family,. People who understand me.. I got no place else to go.. I was walking with my girlfriend.. She looked so fine, I said. ""Baby, what's on your mind?"". Said I want to run like the lions. Released from their cages.... Released from the rages. Burning in my soul tonight.. I am a patriot, and I love my country,. Because my country is all I know.. And I ain't no communist,. And I ain't no socialist,. And I ain't no capitalist,. And I ain't no imperialist,. And I ain't no democrat,. Sure ain't no republican either,. I only know one party,. And that is freedom.. I am...I am...I am.... I am a patriot, and I love my country,. Because my country is all I know.. And the rivers shall open for the righteous,. And the rivers shall open for the righteous,. And the rivers shall open for the righteous someday.... Someday...someday..."
i am mine,"The selfish, they're all standing in line. Faithing and hoping to buy themselves time. Me, I figure as each breath goes by. I only own my mind. The North is to South what the clock is to time. There's east and there's west and there's everywhere life. I know I was born and I know that I'll die. The in between is mine. I am mine. And the meanings, it gets left behind. All the innocence lost at one time. Significant, between the lines. There's no need to hide. We're safe tonight. The ocean is full 'cause everyone's crying. The full moon is looking for friends at high tide. The sorrow grows bigger when the sorrow's denied. I only know my mind. I am mine. And the meaning, it gets left behind. All the innocents lost at one time. Significant, behind the eyes. There's no need to hide. We're safe tonight. And the feelings that get left behind. All the innocence broken with lies. Significant between the lines. We may need to hide. And the meanings that get left behind. All the innocents lost at one time. We're all diferent behind the eyes. There's no need to hide. Yeah"
i believe in miracles,"(I Believe In Miracles - Ramones). I used to be on an endless run.. Believe in miracles 'cause I'm one.. A have been blessed with the power to survive.. After all these years I'm still alive.. I'm out here cookin' with the band.. I'm no longer a solitary man.. Every day my time runs out.. Lived like a fool, that's what I was about, oh.. I believe in miracles.. I believe in a better world for me and you.. Oh, I believe in miracles.. I believe in a better world for me and you.. Tattoo your name on my arm.. I always said my girl's my good luck charm.. If she could find a reason to forgive,. Then I could find a reason to live.. I used to be on an endless run.. Believe in miracles 'cause I'm one.. A have been blessed with the power to survive.. After all these years I'm still alive.. I believe in miracles.. I believe in a better world for me and you.. Oh, I believe in miracles.. I believe in a better world for me and you.. I close my eyes and think how it might be.. The future's here today.. It's not too late.. It's not too late, yeah!. I believe in miracles.. I believe in a better world for me and you.. Oh, I believe in miracles.. I believe in a better world for me and you."
i got id,"My lips are shakin', my nails are bit off. Been a month since I've heard myself talk. All the advantage this life's got on me. Picture a cup in the middle of the sea. And I fight back in my mind. Never let's me be right, oh. I got memories, I got shit. So much it don't show.... I walked the line. When you held me in that night. I walked the line. When you held my hand that night.... An empty shell seems so easy to crack. Got all these questions, don't know who I could even ask. So I'll just lie alone and wait for the dream. Where I'm not ugly and you're lookin' at me. And I'll stay in a bed. Water blue,I've seen it... If just once, I could feel loved. Oh, stare back at me, yeah.... But I walked the line. When you held me in that night. Oh, I walked the line. When you held my hand that night. Oh, I walked the line. When you held me close at night. I paid the price, never held you in real life..."
i won't back down,"No, I won't back down (2x). You can stand me up at the gates of Hell, but I won't back down. I will stand my ground, won't be turned around. I will keep my world from draggin' me down, I won't back down. No, I won't back down. Hey, baby, there ain't no easy way out. Hey, I will stand my ground. No, I won't back down. Oh, I know what's right, I got just one life. I will keep this world from pushin' me around,. I'll stand my ground. No, I won't back down. Hey, baby, there ain't no easy way out. Hey, I will stand my ground (2x). And I won't back down. And I won't back down, no I won't back down"
i'm open,man lies in his bed in a room with no door. He waits hoping for a presence something anything to enter. After spending half his life searching he still felt as blank. As the ceiling at which he stared. He is alive but feels absolutely nothing. So is he?. When he was six he believed that the moon overhead followed him. By nine he had deciphered the illusion trading magic for fact. No tradebacks.... So this is what it's like to be an adult. If he only knew now what he knew then.... I'm open... (2x). Come on in... (4x). I'm open... (2x). Come on in... (4x). I'm open.... Lying sideways atop crumpled sheets and no covers he decides to dream.... Dream up a new self for himself...
i'm still here,"She wanted to see other people. I thought, ""well then, look around, they're. everywhere"". Said that she was confused.... I thought, ""darling, join the club"". 24 years old, mid-life crisis. Nowadays hits you when you're young. I hung up, she called back, I hung up again. The process had already started. At least it happened quick. I swear, I died inside that night. My friend, he called. I didn't mention a thing. The last thing he said was, ""be sound"", sound.... I contemplated an awful thing, I hate to admit. I just thought those would be such appropriate last words. But I'm still here. And small. So small.. how could this struggle seem so big?. So big.... While the palms in the breeze still blow green. And the waves in the sea still absolute blue. But the horror. Every single thing I see is a reminder of her. Never thought I'd curse the day I met her. And since she's gone and wouldn't hear. Who would care? what good would that do?. But I'm still here. So I imagine in a month... or 12. I'll be somewhere having a drink. Laughing at a stupid joke. Or just another stupid thing. And I can see myself stopping short. Drifting out of the present. Sucked by the undertow and pulled out deep. And there I am, standing. Wet grass and white headstones all in rows. And in the distance there's one, off on its own. So I stop, kneel. My new home.... And I picture a sober awakening,. A re-entry into this. Little bar scene. Sip my drink til the ice hits my lip. Order another round. And that's it for now,. Sorry.. Never been too good at happy endings..."
i've got a feeling,"I've got a feelin', a feelin' deep inside, oh yeah...oh yeah.... I've got a feelin', a feelin' I can't hide...oh no no...whoa no.... Yeah, yeah, I got a feelin', yeah.... Oh please believe me, I'd hate to miss the train...oh yeah...oh yeah.... Ooh, and if you leave me, I won't be late again, no no no, oh no.... Yeah, I've got a feelin', yeah...whew...ooh...oh yeah.... And I don't understand, how come nobody told me?. Why I'd want to sing like Milli Vanilli. All I ever wanted was someone who looked like you...you...oh.... I got a feelin', that keeps me on my toes, oh yeah, yeah, oh yeah.... Uh huh, I got a feelin', I think that everybody knows, oh yeah yeah, oh yeah.... Yeah, wow, I got a feelin', yeah...whoa.... Everybody had a good year, though we never saw the sunshine. Everybody had a wet dream, making Temple was a good time. Oh yeah, oh yeah, oh yeah. Everybody made a movie, everybody had one line. Everybody misses Andy, we'll be seein' him in no time. Oh yeah, oh yeah, oh yeah. Ooh yeah, I got a feelin', yeah...oh.... I got a feelin', a feelin' deep inside, oh yeah yeah, oh yeah.... Ooh, I got a feelin', a feelin' i can't hide, oh no no, oh no.... Yeah...I got a feelin', yeah...yeah...ah...ooh...yeah..."
immortality,"Vacate is the word. Vengeance has no place so near to her. Cannot find the comfort in this world. Artificial tear. Vessel stabbed, next up, volunteers?. Vulnerable, wisdom can't adhere. A truant finds home. And a wish to hold on. But there's a trapdoor in the sun. Immortality. As privileged as a whore. Victims in demand for public show. Swept out through the cracks beneath the door. Holier than thou, how?. Surrendered, executed, anyhow. Scrawl dissolved, cigar box on the floor. A truant finds home. And a wish to hold on too. But there's a trapdoor in the sun. I cannot stop the thought of running in the dark. Coming up a which way sign. All good truants must decide. Stripped and sold mom. An auctioned forearm. And whiskers in the sink. Truants move on. Cannot stay long. Some die just to live.... Ohh..."
in hiding,"I shut and locked the front door. No way in or out. I turned and walked the hallway. And pulled the curtains down. I knelt and emptied the mouth of every plug around. But nothing's sound, nothing's sound. I stayed where my last cab left me. Ignored all my rounds. Soon I was seeing visions and cracks along the walls. They're upside down. I swallow my words to keep from lying. I swallow my face just to keep from biting, I, I... I swallowed my breath and went deep, I was diving,. diving. I surfaced and all of my being was enlightened. Now...I'm in hiding, yeah. I'm in hiding, yeah. I'm in hiding, yeah. I'm in hiding. It's been about three days now. Since I've been aground. No longer overwhelmed and it seems so simple now. It's funny when things change so much. It's all state of mind. I swallowed my first to keep from lying. I swallowed my face just to keep from biting. I swallowed my breath and went deep, I was diving, I. was diving. I surfaced and all of my being was enlightened. Now I'm in hiding, yeah. I'm in hiding, yeah. I'm in hiding, yeah. Now I'm in hiding, yeah. I'm in hiding, yeah. I'm in hiding, yeah. I'm in hiding, yeah. I'm in hiding..."
in my tree,"Up here in my tree, yeah. Newspapers matter not to me, yeah. No more crowbars to my head, yeah. I'm trading stories with the leaves instead, yeah. Wave to all my friends, yeah. They don't seem to notice me, no. All their eyes trained on the street, yo, oh. Sidewalk cigarettes and scenes, (tem-pted). Up here so high I start to shake. Up here so high the sky I scrape. I'm so high I hold just one breath here within my chest. Just like innocence. (Eddie's down in his home). (Oh, the blue sky it's his home). (Eddie's blue sky home). (Oh, the blue sky it's his home). I remember when, yeah. I swore I knew everything, oh yeah. Let's say knowledge is a tree, yeah. It's growing up just like me, yeah. I'm so light the wind he shakes. I'm so high the sky I scrape. I'm so light I hold just one breath and go back to my nest. Sleep with innocence.... Up here so high the boughs they break. Up here so high the sky I scrape. Had my eyes peeled both wide open, and I got a glimpse. Of my innocence... got back my inner sense.... Baby got it, still got it"
in the moonlight,"In the moonlight. Gettin' wind out to get back, it's a. Steady shore to her land. It's gettin' closer to the fence. In the moonlight. Givin' two lost wings. A beautiful star sea. A wonderful sense of beauty. In the moonlight. It's a love drawn nearer. Darkened days are spent in. A night bird is followin' you all the time. Under a star-lined ceiling. And darkness, so sleep, ah. Your sense is revealed. In the moonlight. It's a love drawn nearer. Darkened days are spent in. A night bird is followin' you all the time. It's a love drawn nearer. Darkened days are spent in. A night bird is followin' you, it's followin' you. A night bird is followin' you all the time"
indifference,"I will light the match this morning. So I won't be alone. Watch as she lies silent. For soon that will be gone. Oh, I will stand arms outstretched. Pretend I'm free to roam. Oh, I will make my way through. One more day in hell. How much difference does it make?. How much difference does it make?. I will hold the candle. Until it burns up my arm. Oh, i'll keep taking punches. Until their will grows tired. Oh, I will stare the sun down. Until my eyes go blind. Hey, I won't change direction. And I won't change my mind. How much difference does it make?. How much difference does it make?. I'll swallow poison. Until I grow immune. I will scream my lungs out. Till it fills this room. How much difference.... How much difference.... How much difference does it make?. How much difference does it make?"
infallible,Keep on locking your doors. Keep on building your floors. Keep on just as before. Pay disasters no mind. Didn't get you this time. No friends left at the crime. Our ship's come in and it's sinking. Of everything that's possible. In the hearts and minds of man. Somehow it is the biggest things. That keep on slipping right through our hands. By thinking we're infallible. . Oh we are tempting fate instead. Time we best begin here at the end. Want a third second chance. Put your faith in big hands. Pay no more than a glance. All good things come to an end. This could be good as it gets. How's the view from the fence. You think we've been here before. You are mistaken. Of everything that's possible. In the hearts and minds of man. When progress could be plausible. In the verse we curse ourselves. By thinking we're infallible. Oh we are tempting fate instead. Time we best begin here at the end. Of everything that's possible. In the hearts and minds of man. Somehow it is the biggest things. That keep on slipping right through our hands. By thinking we're infallible. Oh we are tempting fate instead. Time we best begin here at the end. Keep on locking your doors. Keep on building your floors. Keep on just as before
inside job,"Underneath this smile lies everything. All my hopes and anger, pride and shame. Make myself a pact not to shut doors on the past. Just for today I am free. I will not lose my faith. It's an inside job today. I know this one thing well…. I used to try and kill love. the highest sin. Breathing insecurity out and in. Searching hope, I'm shown the way to run straight. Pursuing the greater way for all human light.. How I choose to feel is how I am.. How I choose to feel is how I am.. I will not lose my faith. It's an inside job today. Holding on, the light of night. On my knees to rise and fix my broken soul. Again. Let me run into the rain. To be a human light again. Let me run into the rain. To shine a human light today. Life comes from within your heart and desire. Life comes from within my heart and desire. Life comes from within your heart and desire"
insignificance,"All in all, it's no one's fault. Excuses turn to carbon walls. Blame it all on chemical intercourse. The swallowed seeds of arrogance. Breeding in the thoughts of ten. Thousand fools who fight irrelevance. The full moon is dead skin. The one down here's wearing thin. So set up the ten pins. As the human tide rolls in. Like a ball that's spinning. Bombs dropping down. Overhead, underground. It's instilled, to wanna live. Bombs dropping down. Please forgive our hometown. In our insignificance. Turn the jukebox up, he said. Dancing in irreverence. Play C-3, let the song protest. The plates begin to shift. Perfect lefts come rolling in. I was alone and far away. When I heard the band start playing. On the lip, late take off. Bombs dropping down. Overhead, underground. It's instilled, to wanna live. Bombs dropping down. Please forgive our hometown. In our insignificance. Feel like resonance of distance. In the blood, the iron lies. It's instilled, to wanna live. Bombs dropping down. Please forgive our hometown. In our insignificance. In our insignificance"
jeremy,At home. Drawing pictures. Of mountain tops. With him on top. Lemon yellow sun. Arms raised in a v. And the dead lay in pools of maroon below. Daddy didn't give attention. To the fact. That mommy didn't care. King jeremy the wicked. Ruled his world. Jeremy spoke in class today. Jeremy spoke in class today. Clearly I remember. Picking on the boy. Seemed a harmless little fuck. But we unleashed a lion. Gnashed his teeth and. Bit the recess ladies breast. How could I forget?. And he hit me with a surprise left. My jaw left hurting. Dropped wide open. Just like the day. Like the day I heard. Daddy didn't give affection. And the boy was something. That mommy wouldn't wear. King jeremy the wicked. Ruled his world. Jeremy spoke in class today. Jeremy spoke in class today. Jeremy spoke in class today. Try to forget this. Try to erase this. From the black board. Jeremy spoke in class today. Jeremy spoke in class today. Jeremy spoke in spoke in. Jeremy spoke in spoke in. Jeremy spoke in class today
