black,"Sheets of empty canvas,. Untouched sheets of clay.... Were laid spread out before me. As her body once did.. Oh all five horizons. Revolved around her soul. As the earth to the sun. Now the air I tasted and breathed. Has taken a turn. Oh and all I taught her was everything. Oh, I know she gave me all that she wore. And now my bitter hands chafe beneath the clouds. Of what was everything?. All the pictures have. All been washed in black,. Tattooed everything. I take a walk outside. I'm surrounded by some kids at play. I can feel their laughter so why do I sear?. Oh and twisted thoughts that spin 'round my head. I'm spinning, oh, I'm spinning. How quick the sun can drop away. And now my bitter hands cradle broken glass. Of what was everything. All the pictures have, all been washed in black,. tattooed everything.... All the love gone bad. Turned my world to black. Tattooed all I see, all that I am and all that I'll be...yeah.... I know someday you'll have a beautiful life,. I know you'll be a star,. In somebody else's sky,. But why? why?. Why can't it be, oh can't it be mine?"
last kiss,"Oh where, oh where can my baby be?. The Lord took her away from me. She's gone to heaven. so I've got to be good. So I can see my baby. when I leave this world. We were out on a date. in my daddy's car. we hadn't driven very far. There in the road. Up straight ahead. a car was stalled. the engine was dead. I couldn't stop. so I swerved to the right. I'll never forget. the sound that night. the screaming tires. the busting glass. the painful scream. that I heard last. Oh where, oh where can my baby be?. The Lord took her away from me. She's gone to heaven. so I've got to be good. So I can see my baby. when I leave this world. When I woke up. the rain was pouring down. There were people standing all around. Something warm flowing. through my eyes. but somehow I found my baby. that night. I lifted her head. she looked at me and said. ""Hold me darling just a little while"". I held her close. I kissed her, our last kiss. I'd found the love. that I knew I had missed. Well now she's gone. even though I hold her tight. I lost my love. my life that night. Oh where, oh where can my baby be?. The Lord took her away from me. She's gone to heaven. so I've got to be good. So I can see my baby. when I leave this world"
alive,"Son, she said, have I got a little story for you. What you thought was your daddy was nothin' but a.... While you were sittin' home alone at age thirteen. Your real daddy was dyin', sorry you didn't see him,. but I'm glad we talked.... Oh I, oh, I'm still alive. Hey I, oh, I'm still alive. Hey I, oh, I'm still alive. Hey...oh.... Oh, she walks slowly, across a young man's room. She said I'm ready...for you. I can't remember anything to this very day. 'Cept the look, the look.... Oh, you know where, now I can't see, I just stare.... I, I'm still alive. Hey I, but, I'm still alive. Hey I, boy, I'm still alive. Hey I, I, I, I'm still alive, yeah. Ooh yeah...yeah yeah yeah...oh...oh.... Is something wrong, she said. Well of course there is. You're still alive, she said. Oh, and do I deserve to be. Is that the question. And if so...if so...who answers...who answers.... I, oh, I'm still alive. Hey I, oh, I'm still alive. Hey I, but, I'm still alive. Yeah I, ooh, I'm still alive. Yeah yeah yeah yeah yeah yeah"
jeremy,At home. Drawing pictures. Of mountain tops. With him on top. Lemon yellow sun. Arms raised in a v. And the dead lay in pools of maroon below. Daddy didn't give attention. To the fact. That mommy didn't care. King jeremy the wicked. Ruled his world. Jeremy spoke in class today. Jeremy spoke in class today. Clearly I remember. Picking on the boy. Seemed a harmless little fuck. But we unleashed a lion. Gnashed his teeth and. Bit the recess ladies breast. How could I forget?. And he hit me with a surprise left. My jaw left hurting. Dropped wide open. Just like the day. Like the day I heard. Daddy didn't give affection. And the boy was something. That mommy wouldn't wear. King jeremy the wicked. Ruled his world. Jeremy spoke in class today. Jeremy spoke in class today. Jeremy spoke in class today. Try to forget this. Try to erase this. From the black board. Jeremy spoke in class today. Jeremy spoke in class today. Jeremy spoke in spoke in. Jeremy spoke in spoke in. Jeremy spoke in class today
just breathe,"Yes I understand. That every life must end. As we sit alone. I know someday we must go. Oh I'm a lucky man. To count on both hands. The ones I love. Some folks just have one. Yeah, others they got none. Stay with me. Let's just breathe. Practiced on our sins. Never gonna let me win. Under every thing. Just another human being. Yeah, I don't wanna hurt. There's so much in this world. To make me bleed. Stay with me, you're all I see. Did I say that I need you. Did I say that I want you. Oh if I didn't I'm a fool, you see. No one knows this more than me. 'Cause I come clean. I wonder every day. As I look upon your face. Everything you gave. And nothing you would take.... Nothing you would take. Everything you gave.... Did I say that I need you. Did I say that I want you. Oh if I didn't I'm a fool, you see. No one knows this more than me. That I come clean. Nothing you would take. Everything you gave.... Hold me till I die. Meet you on the other side"
even flow,"Freezin', rests his head on a pillow. Made of concrete, again. Oh, Feelin' maybe he'll see a little better,. Set a days, ooh yeah. Oh, hand out, faces that he sees time again. Ain't that familiar, oh yeah. Oh, dark grin, he can't help,. When he's happy looks insane, oh yeah. Even flow, thoughts arrive like butterflies. Oh, he don't know, so he chases them away. Someday yet, he'll begin his life again. Life again, life again.... Kneelin', looking through the paper. Though he doesn't know to read,. ooh yeah. Oh, prayin', out to something. that has never showed him anything. Oh, feelin', understands the weather of the winters on its way. Oh, ceilings,. few and far between all illegal halls of shame, yeah. Even flow, thoughts arrive like butterflies. Oh, he don't know, so he chases them away. Someday yet, he'll begin his life again. Whispering hands, gently lead him away. Him away, him away.... Yeah!. Woo...ah yeah...fuck it up.... Even flow, thoughts arrive like butterflies. Oh, he don't know, so he chases them away. Someday yet, he'll begin his life again, yeah. Oh, whispering hands, gently lead him away. Him away, him away.... Yeah!. Woo...uh huh...yeah, yeah, mommy, mommy..."
sirens,"Hear the sirens, hear the sirens. Hear the sirens, hear the circus so profound. I hear the sirens more and more in this here town. Let me catch my breath to breathe. Then reach across the bend. Just to know we're safe. I am a grateful man. The slightest bit of light. And I can see you clear. Have to take your hand, and feel your breath. For fear this someday will be over. I pull you close, so much to lose. Knowing that nothing lasts forever. I didn't care, before you were here. I danced in laughter with the everafter. But all things change, let this remain. Hear the sirens covering distance in the night. The sound echoing closer. Will they come for me next time?. For every choice, mistake I've made, It's not my plan. Or to send you in the arms of another man. And if you choose to stay, I'll wait, I'll understand. Oh, it's a fragile thing, this life we lead. If I think too much, I can't get over. Whelmed by the grace. By which we live our lives. With death over our shoulders. Want you to know, that should I go. I always loved you, held you high above, true. I study your face, and the fear goes away. Oh, it's a fragile thing, this life we lead. If I think too much, I can't get over. Whelmed by the grace. By which we live our lives. With death over our shoulders. Want you to know, that should I go. I always loved you, held you high above, true. I study your face, and the fear goes away. The fear goes away, the fear goes away. The fear goes away"
better man,"Waitin', watchin' the clock, it's four o'clock, it's got to stop. Tell him, take no more, she practices her speech. As he opens the door, she rolls over... Pretends to sleep as he looks her over... She lies and says she's in love with him,. Can't find a better man.. She dreams in color, she dreams in red,. Can't find a better man.. Can't find a better man. Can't find a better man. Ohh.... Talkin' to herself, there's no one else who needs to know;. she tells herself... Oh.... Memories back when she was bold and strong. And waiting for the world to come along.... Swears she knew it, now she swears he's gone. She lies and says she's in love with him,. Can't find a better man.... She dreams in color, she dreams in red,. Can't find a better man.... She lies and says she still loves him,. Can't find a better man.... She dreams in color, she dreams in red,. Can't find a better man.... Can't find a better man. Can't find a better man. Yeah.... She loved him, yeah.... She don't want to leave this way. She needs him, yeah.... That's why she'll be back again. Can't find a better man. Can't find a better man. Can't find a better man. Can't find a better...Man..."
i am mine,"The selfish, they're all standing in line. Faithing and hoping to buy themselves time. Me, I figure as each breath goes by. I only own my mind. The North is to South what the clock is to time. There's east and there's west and there's everywhere life. I know I was born and I know that I'll die. The in between is mine. I am mine. And the meanings, it gets left behind. All the innocence lost at one time. Significant, between the lines. There's no need to hide. We're safe tonight. The ocean is full 'cause everyone's crying. The full moon is looking for friends at high tide. The sorrow grows bigger when the sorrow's denied. I only know my mind. I am mine. And the meaning, it gets left behind. All the innocents lost at one time. Significant, behind the eyes. There's no need to hide. We're safe tonight. And the feelings that get left behind. All the innocence broken with lies. Significant between the lines. We may need to hide. And the meanings that get left behind. All the innocents lost at one time. We're all diferent behind the eyes. There's no need to hide. Yeah"
soldier of love,"Lay down your arms and surrender to me.. Oh lay down your arms and love me peacefully. Yea.. Use your arms for squeezing and pleasing. the one who loves you so.. Oh there ain't no reason for you to declare war on the. one who loves you so.. So forget the other boys because my love is real.. Come off your battlefield.. Lay down your arms and surrender to me.. Yea lay down your arms and love me peacefully. Yea.. Use your arms for squeezing and please cause that's. the way it's gotta be.. The weapons you're using are hurting me bad.. But someday you're gonna retreat.. Cause my love baby is the truest you've ever had.. I'm a soldier of love that's hard to beat.. Lay down your arms and surrender to me.. Lay down your arms and love me peacefully. Yea.. Use your arms to hold me tight.. Baby I don't wanna fight no more. (x2). Oh baby, lay down your arms. (x7). Please baby lay down your arms."
yellow ledbetter,"Unsealed. on a porch a letter sat. Then you said. 'I wanna leave it again'. Once I saw her. on a beach of weathered sand. And on the sand. I wanna leave it again, yeah. On a weekend. I wanna wish it all away, yeah. And they called. and I said that I want what I said. And then I call out again. And the reason. oughta' leave her calm, I know. I said 'I know what I wear. not a boxer or the bag'. Ah yeah...can you see them. out on the porch?. yeah, but they don't wave. I see them. round the front way, yeah. And I know and I know. I don't want to stay. Make me cry. I see, ooh. I don't know why there's something else. I wanna drum it all away. Oh, I said, I don't, I don't know what wear. there's a boxer or the bag'. Ah yeah...can you see them. Out on the porch?. yeah, but they don't wave. I see them. round the front way, yeah. And I know, and I know. I don't wanna stay at all. I don't wanna stay...yeah. I don't wanna stay. I don't wanna stay. I don't, don't wanna, oh...yeah...ooh...ohh..."
daughter,"Alone. Listless. breakfast table. in an otherwise empty room. Young girl. violins. center of her own attention. Mother reads aloud. child tries to understand it. Tries to make her proud. The shades go down. into her head. Painted room. can't deny there's something wrong. Don't call me daughter, not fit to. The picture kept will remind me. Don't call me daughter, not fit to. The picture kept will remind me. Don't call me. She holds the hand that holds her down. She will rise above. Don't call me daughter, not fit to. The picture kept will remind me. Don't call me daughter, not fit to be. The picture kept will remind me. Don't call me. Don't call me daughter, not fit to. The picture kept will remind me. Don't call me daughter, not fit to be. The picture kept will remind me. Don't call me. The shades go down. The shades go down. The shades go... go"
release,"Oh, oh, oh. I feel the world feel the chill. Which way to go?. Windowsill. I see the words on a rocking horse of time. I see the birds in the rain. Oh, oh. Oh, oh. Oh, dear dad, can you see me now?. I am myself, like you, somehow. I'll ride the wave where it takes me. I'll hold the pain, release me. Oh, oh yeah. Oh, oh. Oh, dear dad can you see me now?. I am myself, like you, somehow. I'll wait up in the dark for you to speak to me. I'll open up, Release me. Release me, Release me yeah, Release me. Oh, oh yeah. Oh, uh oh oh oh. Ah uh, uh huh"
state of love and trust,"Oh. State of love and trust. As I busted down the pretext. Sin still plays and preaches. But to have an empty court, uh huh. Nnd the signs are passin, grip the wheel. Can't read it. Sacrifice receiving the smell that's on my hands... hands... yeah. And I listen for the voice inside my head. Nothin', I'll do this one myself. Lay her down as priest does. Should the lord be acountin'. Will be in my honor, make it pain. Painfully quick, uh huh. Promises are whispered. In the age of darkness. Want to be enlightened. Like I want to be told the end... end, yeah. And the barrel shakes aimed directly at my head. Oh, help me, help me from myself. And I listen, from both sides of the bed. Nothin', I'll do this one myself. Oh oh oh myself... myself. Yeah, yeah. Hey, na, na, na, na, hey, that's something. Wanna back, back it away, yeah. And I listen, yeah, for the voice inside my head. Nothin', I'll do this one myself. Oh, ah, and the barrel waits, trigger shakes. Aimed right at my head. Won't you help me. Help me from myself. Eh oh eh o ehh. Eh oh eh o ehh. State of love"
oceans,"Hold on to the thread. The currents will shift. Glide me towards.... You know something's left. And we're all allowed. To dream of the next. Oh, ohh the next, time we touch.... Oooh... (4x). You don't have to stray. The oceans away. Waves roll in my thoughts. Hold tight the ring.... The sea will rise.... Please stand by the shore.... Oh, oh, oh, I will be.... I will be there once more.... Oooh... (4x). Uh huh, oh yeah... (2x)"
given to fly,"He could have tuned in, tuned in,. but he tuned out. A bad time, nothing could save him. Alone in a corridor, waiting, locked out. He got up out of there, ran for hundreds of miles. He made it to the ocean. Had a smoke in a tree. The wind rose up, set him down on his knee. Wave came crashing like a fist to the jaw,. Delivered him wings, ""hey, look at me now..."". Arms wide open with the sea as his floor. Oh, power, oh.... He's flying! Woah!. High! Wide! Oh.... He floated back down 'cause he wanted to share. His key to the locks on the chains. he saw everywhere. But first he was stripped,. and then he was stabbed. By faceless men, well... He still stands.. And he still gives his love, he just gives it away. The love he receives is the love that is saved. And sometimes is seen a strange spot in the sky. A human being that was given to fly. Flying! Woah.... Whole! Flying! Woah.... Flying woah.... Oh woah..."
wishlist,"I wish I was a neutron bomb. for once I could go off. I wish I was a sacrifice. but somehow still lived on. I wish I was a sentimental. ornament you hung on. the Christmas tree, I wish I was. the star that went on top. I wish I was the evidence. i wish I was the grounds. for fifty million hands up raised and opened toward the sky. I wish I was a sailor with. someone who waited for me. I wish I was as fortunate. as fortunate as me. I wish I was a messenger. and all the news was good. I wish I was the full moon shining. off a camaro's hood.. I wish I was an alien. at home behind the sun. I wish I was the souvenir. you kept your house key on. I wish I was the pedal break. that you depended on. I wish I was the verb to trust. and never let you down. I wish I was the radio song. the one that you turned up. I wish, I wish, I wish, I wish. I guess it never stops"
rearviewmirror,"I took a drive today. Time to emancipate. I guess it was the beatings made me wise. But I'm not about to give thanks,. or apologize. I couldn't breathe, holdin' me down. Hand on my face, pushed to the ground. Enmity gauged, united by fear. Forced to endure what I could not forgive. I seem to look away. Wounds in the mirror waved. It wasn't my surface most defiled. Head at your feet, fool to your crown. Fist on my plate, swallowed it down. Enmity gauged, united by fear. Tried to endure what I could not forgive. Saw things (4x). Clearer, clearer. Once you, were in my rearview mirror. I gather speed from you fucking with me. Once and for all I'm far away. I hardly believe, finally the shades are raised. Hey, yeah. Saw things so much clearer. Once you, once you. [Rearview mirror] (3x). Saw things so much clearer. Once you. Oh yeah"
elderly woman behind the counter in a small town,"I seem to recognize your face. Haunting, familiar,. yet I can't seem to place it. Cannot find the candle of thought. to light your name. Lifetimes are catching up with me. All these changes taking place,. I wish I'd seen the place. But no one's ever taken me. Hearts and thoughts they fade, fade away. Hearts and thoughts they fade, fade away. I swear I recognize your breath. Memories. like fingerprints are slowly raising. Me, you wouldn't recall,. for I'm not my former. It's hard when,. you're stuck upon the shelf. I changed by not changing at all,. small town predicts my fate. Perhaps that's what no one wants to see. I just want to scream hello. My God its been so long,. never dreamed you'd return. But now here you are, and here I am. Hearts and thoughts they fade, away. Hearts and thoughts they fade, fade away. Hearts and thoughts they fade, fade away. Hearts and thoughts they fade, away. Hearts and thoughts they fade, fade away. Hearts and thoughts they fade, fade away. Hearts and thoughts they fade, fade away. Hearts and thoughts they fade"
getaway,"Everyone's a critic looking back up the river. Every boat is leaking in this town. Everybody's thinking that they'll all be delivered. Sitting in a box like lost and found. But I found my place and it's alright. We all searching for our better way. Got yours off my plate, it's alright. I got my own way to believe. Find a lighthouse in the dark stormy weather. We all could use a sedative right now. Holy rollers sittin with their backs to the middle. All hands on deck, sinking is the bow. And if you wanna have to pray, it's alright. We all be thinking with our different brains. Get yours off my plate, it's alright. I got my own way to believe. It's ok. Sometimes you find yourself. Having to put all your faith. In no faith. Mine is mine, and yours won't take its place. Now make your getaway. Science says we're making love like the lizards. Try and say that fossils ain't profound. Simon says that we are not allowed to consider. Simon says ""Stand-up. Sit-down. You're out!"". But I found my place, and it's alright. Bearing witness to some stranger days. Get yours off my plate, it's alright. I got my own ways to believe. It's ok. Sometimes you find yourself. Being told to change your ways. There's no way. Mine is mine and yours won't take its place. Now make your getaway. It's ok. Sometimes you find yourself. Having to put all your faith. In no faith. Mine is mine, and yours won't take its place. Now make your getaway. It's ok. Sometimes you find yourself. Being told to change your ways. For Gods sake. Mine is mine and yours won't take its place. Now make your getaway. Make your getaway"
nothingman,"Once divided...nothing left to subtract.... Some words when spoken...can't be taken back.... Walks on his own...with thoughts he can't help thinking.... Future's above...but in the past he's slow and sinking.... Caught a bolt 'a lightnin'...cursed the day he let it go.... Nothingman... (2x). Isn't it something?. Nothingman.... She once believed...in every story he had to tell.... One day she stiffened...took the other side.... Empty stares...from each corner of a shared prison cell.... One just escapes...one's left inside the well.... And he who forgets...will be destined to remember...oh...oh...oh.... Nothingman... (2x). Isn't it something?. Nothingman.... Oh, she don't want him.... Oh, she won't feed him...after he's flown away.... Oh, into the sun...ah, into the sun.... Burn...burn.... Nothingman... (2x). Isn't it something?. Nothingman.... Nothingman... (2x). Coulda' been something.... Nothingman...."
do the evolution,"I'm ahead, I'm the man. I'm the first mammal to wear pants, yeah. I'm at peace with my lust. I can kill 'cause in God I trust, yeah. It's evolution, baby. I'm a beast, I'm the man. Having stocks on the day of the crash, yeah. On the loose, I'm a truck. All the rolling hills I'll flatten them out, yeah. It's herd behavior, uh huh. It's evolution, baby. Admire me, admire my home. Admire my son, he's my clone. Yeah, yeah, yeah, yeah. This land is mine, this land is free. I'll do what I want but irresponsibly. It's evolution, baby. I'm a thief, I'm a liar. There's my church. I sing in the choir:. Hallelujah, hallelujah. Admire me, admire my home. Admire my song, admire my clothes. 'cause we know appetite for a nightly feast. Those ignorant indians got nothing on me. Nothing, why?. Because, it's evolution, baby!. I am ahead, I am advanced. I am the first mammal to make plans, yeah. I crawled the earth, but now I'm higher. Twenty-ten, watch it go to fire. It's evolution, baby. It's evolution baby. Do the evolution. Come on. Come on, come on..."
come back,"If I keep holding out. Will the light shine through?. Under this broken roof. It's only rain that I feel. I've been wishin' out the days. Oh oh oh. Come back. I have been planning out. All that I'd say to you. Since you slipped away. Know that I still remain true. I've been wishin' out the days. Please say that if you hadn't have gone now. I wouldn't have lost you another way. From wherever you are. Oh oh oh oh. Come back. And these days, they linger on, yeah, yeah. And in the night, I've been waiting for. A real possibility that I may meet you in my dreams. I go to sleep. If I don't fall apart. Will my memory stay clear?. So you had to go. And I had to remain here. But the strangest thing to date. So far away and yet you feel so close. I'm not going to question it any other way. It must be an open door for you. To come back. And the days they linger on, yeah. Every night I'm waiting for. The real possibility that I may meet you in my dreams. Sometimes you're there and you're talking back to me. Come the morning I could swear you're next to me. And it's ok. It's ok, it's ok. I'll be here. Come back, come back. I'll be here. Come back, come back. I'll be here. Come back, come back. Oooooooo. Oooooooo. Oooooooo. Oooooooo"
once,"I admit it...what's to say...yeah.... I'll relive it...without pain...mmm.... Backstreet lover on the side of the road. I got a bomb in my temple that is gonna explode. I got a sixteen gauge buried under my clothes,. I play.... Once upon a time I could control myself. Ooh, once upon a time I could lose myself, yeah.... Oh, try and mimic what's insane...ooh, yeah.... I am in it...where do I stand?. Oh, Indian summer and I hate the heat. I got a backstreet lover on the passenger seat. I got my hand in my pocket, so determined,. Discreet, I pray.... Once upon a time I could control myself. Ooh, once upon a time I could lose myself, yeah, yeah.... You think I got my eyes closed. But I'm lookin' at you the whole fuckin' time.... Ooh, once upon a time I could control myself, yeah.... Once upon a time I could lose myself, yeah, yeah, yeah.... Once upon a time I could love myself, yeah.... Once upon a time I could love you, yeah, yeah, yeah.... Once (4x). Yeah...once, once...yeah, yeah.... Yeah, yeah, yeah, yeah, yeah...oww..."
garden,"The direction of the eye. So misleading. The defection of the soul. Nauseously quick. I don't question. Our existence. I just question. Our modern needs. I will walk...with my hands bound. I will walk...with my face blood. I will walk...with my shadow flag. Into your garden. Garden of stone. After all is done. We're still alone. I won't be taken. Yet I'll go...with my hands bound. I will walk...with my face blood. I will walk...with my shadow flag. Into your garden. Garden of stone. I don't show.... I don't share.... I don't need. What you have to give.... Ooooh, I will walk...with my hands bound. I will walk...with my face blood. I will walk...with my shadow flag. Into your garden. Garden, oohhh. I will walk...with my hands bound. I will walk...into your garden-. Garden of stone. I don't know.... I don't care.... I don't need. You, for me to live"
