sha la la la lee,"Picked her up on a Friday night. Sha la la la lee, yeah. I knew everything gonna be alright. Sha la la la lee, yeh. Sha la la la lee. I asked her 'where do you wanna go?'. Sha la la la lee, yeh. Well we went someplace, I don't know. Sha la la la lee, yeh. Sha la la la lee. I held her close and I asked her if she was gonna be my baby. It felt so good when she answered me. Oh yeh, oh yeh. Oh yeh, oh yeh, oh yeh. She looked good and she moved so fine. Sha la la la lee, yeh. And all the guys knew she was mine. Sha la la la lee, yeh. Sha la la la lee. I held her close and I asked her again if she was gonna be my baby. It felt so good when she answered me. Oh yeh, oh yeh. Oh yeh, oh yeh, oh yeh. Wanna know how my story ends?. Sha la la la lee, yeh. Well we invited just a few close friends. Sha la la la lee, yeh. Sha la la la lee. Sha la la la la la lee. Sha la la la la la lee. Sha la la la la la lee. Sha la la la la la lee. Sha la la la la la lee. Sha la la la la la la la la la lee. Sha la la la la la la la la la lee. Sha la la la la la la la la la lee. Sha la la la la la lee. Sha la la la la la lee. Sha la la la la la lee"
i can’t make it,I know how you’re feeling. I felt that way too. So don’t get hung up. ‘cause is heeling. I’m gonna help you through it all. I can’t make it if you can’t. I can’t take it if you can’t. I know that you’re heart strong. I know that you hold on. I can’t make it without you. I can’t make it without you. So open up you’re mind. As will as your heart. I can’t go on. knowing you’re not near me. I know that I could love you. ‘cause you kissed me with your eyes. but you ain’t got the strength to make it with me. I can’t sympathize. I can’t make it if. I can’t take it if you can’t. I know that you’re heart strong. I know that you hold on. I can’t make it without you. You know it’s true girl
itchycoo park,"Over bridge of sighs. To rest my eyes in shades of green. Under dreamin' spires. To Itchycoo Park, that's where I've been. What did you do there?. I got high. What did you feel there?. Well I cried. But why the tears then?. I'll tell you why. It's all too beautiful. It's all too beautiful. It's all too beautiful. It's all too beautiful. Feel inclined to blow my mind. Get hung up feeding ducks with a bun. They all come out to groove about. Be nicer than fun in the sun. Tell you what I'll do (what will you do?). I'd like to go there now with you. You can miss out school (won't that be cool). While I learn about the words of fools. What will we do there?. We'll get high. What will you touch there?. We'll Touch the sky. But why the tears then?. I'll tell you why. It's all too beautiful. It's all too beautiful. It's all too beautiful. It's all too beautiful. I feel inclined to blow my mind. Get hung up feeding ducks with a bun. They all come out to groove about. Be nicer than fun in the sun. It's all too beautiful. It's all too beautiful. It's all too beautiful. Ha! It's all too beautiful."
happiness stan,"Are you all sitting comftybold two square on your botty? then i'll begin.. . Once upon a time in a land of greens,. Where the sky was silky soft and full of coloured dreams,. Deep inside a rainbow lived Happiness Stan,. In a small Victoriana charabanc.. Evening will be here quite soon,. Stan can sit and watch the moon,. Watching as the white light,. Slowly makes the night bright,. Hours slipping by while time stands still.. Aaaaah, aaaaah, aaaaah, aaaaah.. Think of black and black will think for you,. It's coloured Stan in bruises, of the darkness that he knew,. For black had stolen half the moon away.. Aaaaah, aaaah, aaaah, aaaah, aaaah, aaaah, aaaah,. Aaaah, aaaah, aaaah, aaaah,. Aaaaah, aaaah, aaaah, aaaah, aaaah.. by DanDan(/dedligno)"
afterglow,"I'm happy just to be with you. And loving you the way I do. It's everything I need to know. Just resting in the afterglow of your.... Love. Love is all around me. Everywhere. Love has come to touch my soul. With someone who really cares. No one can deny us. People who once passed me by. Will turn their heads 'round. I'm happy just to be with you. And loving you the way I do, yeah. It's everything I need to know. Just resting in the afterglow of your love. You. Yes you have always been here. Feeling deep inside. A feeling that I could not see. Or touch, or try to hide. My love is in and around you. I bless the day that I found you. So (??) baby. I'm happy just to be with you. And loving you the way I do, yeah. It's everything I need to know. Just resting in the afterglow of your love. Love is like a voice in my head. Keeps turning 'round the things that we said. I'm happy just to be with you. And loving you the way I do, yeah. It's everything I need to know. Just resting in the afterglow of your love."
all or nothing,"thought you'd listen to my reason. But now I see, you don't hear a thing. Try to make you see, how it's got to be. Yes it's all, all or nothing. Yeah yeah, All or nothing. All or nothing, for me. Things could work out just like I want them to, yeah. If I could have the other half of you, yeah. You know I would, If I only could. Yes it's yeah, all or nothing. Oh yeah, all or nothing. You'll hear my children say, all or nothing, for me. I didn't tell you no lies. So don't you sit there and cry girl. Yeah, all or nothing. Oh yeah, all or nothing. Oh yeah, all or nothing. D'you know what I mean. You got to, got to, go to keep on trying, yeah. All or nothing, mm yeah. All or nothing, to keep on working on to me. All or nothing for me, for me, for me. Come on children, yeah. All or nothing, yeah,yeah, yeah, yeah. All or nothing, I kept on singing to myself. All or nothing, yeah for me, yeah"
all our yesterdays,"(And now for your delight,. The darling of Wapping Wharf laundrette,. Ronald Leafy a-Lane!). I just ain’t sure, what she said you know. I just ain’t sure, I know I’ve been a fool. I know I’ve got to wake, own up, I’ve been hung up. All the time I knew. I knew her love it just weren’t true. I know I’ve been a fool. She took me for a green up, shake up. Knew we’d break up. Fell from out the sky, thought she was mine. Records up her nose, cured me sunshine. It had to be this way. Sun clouded and the sky was grey. And when she went away. I knew she wouldn’t come back. Look back, she’d get sidetracked. Fell from out the sky, thought she was mine. Records up her nose, cured me sunshine"
become like you,"If I could find a way, would I become like you, yeah?. If I could throw myself away, would I become like you?. Would I know just where I stood?. Would my heart be made out of wood?. If I could be a brick, would I become like you, yeah?. If I could give my best friend a kick, would I become like you?. Would I know just where I was at?. Would my brains be where I sat?. Would I become like you?. (hello, they’re playing it again!)"
don't stop what you're doing,don't stop what you're doing. ..... and you told me that your love was strong. that you've never been in love so long. that's alright. I got something to tell you. are you listening?. your heart are gonna melt you. and you're feeling. just like a hot fire burn. like the sweetest song you've ever heard. I don't know. what make you feel this way. but I hope you never fly away. keep on flying with me. don't stop what you're doing
eddie's dreaming,"I see the sunshine, the sunshine sees me. I feel the breezes off of the sea. The palm trees are waving. The sand is so warm. But I’m only dreaming. I’m dreaming alone. Eddie’s dreaming (always dreaming). Eddie’s dreaming (always dreaming). I’m eating banana, my friends sit around. I tell them my stories. They won’t make a sound. The girls they’ll be dancing. To the beat of the foam. I’ll smoke and I’ll watch them. When I’m back home"
every little bit hurts,"Every little bit hurts [x2]. Every night I cry. Every night I sigh. Every night I wonder why. You treat me cold. Yet you won't let me go. Every little hurt counts [x2]. You say you're coming home. Yet you never phone. Leave me all alone. My love is strong for you. I'd do wrong for you. I can't take this loneliness you've given me. I can't go on giving my life away. [Bridge:]. Come back to me. Darling you'll see. I can give you all the things that you wanted before. If you will stay with me. Every little bit hurts [x2]. To you, I'm a toy. & you are the boy. Who has to say when I should play. Yeah, you hurt me, desert me. [Instrumental]. [Bridge]. Every little bit hurts"
feeling lonely,"I know that I can be lonely. So stay with me, don’t play with me. Don’t blow out everything. You’ve got to know how I feel. It’s my Achilles heel, feeling lonely. Things never change, but they weaken. And I can’t be, green memory. I’ve got to feel your smile. I feel that I am part of a wheel. It’s my Achilles heel, feeling lonely"
get yourself together,"I know that you miss him. I can tell by the way you kiss him. Get yourself together girl, all right. You say that you love him. But now he’s gone so please forget him. Get yourself together girl, all right. I’m just like you, so take my heed. You see me as a friend or a friend in need. Just get yourself together. So if you feel that you need me. I’m here beside you, can’t you see me?. Get yourself together and it’ll be all right"
goodbye sunshine i'm on my way,"Woh yeah, all right,. Oh yeah, all right.. I feel all right,. You know I feel all right,. I feel all right,. You know I feel all right,. I wanna think about the hard times that make you, yeah,. Think about the bad times that break you, yeah,. Think of all the good things, yeah, yeah, we done together,. Think about grey storms and stormy weather,. Ah, come on children,. Whatever you do don't kid me woman,. Woh no, Oh woh no.. I've got something I wanna tell ya, right,. Yeah, I got something I wanna show ya,. Something that I been thinking about for such a long time,. I just gotta let it out,. Oh, you know the other night,. Hhmm, as I lay sleeping baby,. I dreamed I held you in my arms,. When I woke up, I found I was mistaken,. Do you know that I hung my head and I cried,. That you are my sunshine, baby,. I really do believe you are my only sunshine, yeah,. You make me happy,. You make me happy,. You make me happy when my skies are grey,. You'll never know dear how much I love ya,. So go on and change my grey skies to blue,. Change my grey skies loving you, yeah, all right,. Just a little bit a softer,. Just a little bit a softer,. Just a little bit of quiet,. Just a little bit of quiet,. Just a little bit of soul,. Just a little bit of soul, yeah,. Yeah, yeah, yeah, yeah, yeah,. Yeah, yeah, yeah, yeah, yeah,. Yeah, yeah, yeah, yeah, yeah,. Yeah, yeah, yeah, ba byeeee,. Are you ready,. Hey hey, [Hey yeah],. My my my [My my my]. Yeah [yeah],. My [My],. Yeah, wow,. Come on children.... Whatever you do,. I wanna hear it own up each and every one of you,. Don't it make you feel all right,. {Yeah all right]. I've told ya that it's true baby,. W'oh yeah, all right, yeah."
green circles,"And with the rain a stranger came,. His eyes were filled with love and pain. He eat and slept and darkness fell,. And in his sleep his mind did tell of.... Green circles, green circles.. He dreamt of circles in the air,. And you and I and everywhere. He wanted all the world to be,. As free as he so they could see those.... Green circles [Circles of].... Green circles.. His face was worn, the lines they told,. The dust and patience of his load,. As with the dawn he went his way,. And with him went his love and pain and.... Green circles [Circles of].... Green circles.... Green circles, green circles,. Green circles, green circles,. Green circles, green circles,. Green circles, green circles,. Green circles [Circles of -],. Green circles [Circles of -],. Green circles [Circles of -],. Green circles [Circles of -],. Green circles [Circles of -],. Green circles [Circles of -],. Green circles [Circles of -],. Green circles [Circles of -],. Green circles [Circles of -],. Green circles [Circles of -],. Green circles.........."
happiness stan,"Are you all sitting comftybold two square on your botty? then i'll begin.. . Once upon a time in a land of greens,. Where the sky was silky soft and full of coloured dreams,. Deep inside a rainbow lived Happiness Stan,. In a small Victoriana charabanc.. Evening will be here quite soon,. Stan can sit and watch the moon,. Watching as the white light,. Slowly makes the night bright,. Hours slipping by while time stands still.. Aaaaah, aaaaah, aaaaah, aaaaah.. Think of black and black will think for you,. It's coloured Stan in bruises, of the darkness that he knew,. For black had stolen half the moon away.. Aaaaah, aaaah, aaaah, aaaah, aaaah, aaaah, aaaah,. Aaaah, aaaah, aaaah, aaaah,. Aaaaah, aaaah, aaaah, aaaah, aaaah.. by DanDan(/dedligno)"
happy days toy town,"Life is just a bowl of All-Bran. You wake up every morning and it's there. So live as only you can. It's all about enjoy it 'cos ever since you saw it. There aint no one can take it away.. So life is just a bowl of All-Bran - very true!. What you say has made it very clear. To be sure I'll live as best as I can. But how can I remember to keep it all together. When half the moon is taken away?. Well, I've got the very thing. If you can laugh and sing. Give me those happy days toytown newspaper smiles. Clap twice, lean back, twist for a while. When you're untogether and feeling out of tune. Sing this special song with me, don't worry 'bout the moon. Looks after itself. Steve: Can I have a go?. Ron: Yes. Steve: Yeah?. Ron: Sing now:. Give me those happy days toytown newspaper smile. Clap twice, lean back, twist for a while. Well now you've got the hang of it. There's nothing you can't do with it. If you're very tuned to it you can't go wrong.. All together!. Give me those happy days toytown newspaper smile. Clap twice, lean back, twist for a while. Well now we've got the hang of it. There's nothing we can't do with it. And now we're very into it we can't go wrong!. [Stanley Unwin's nonsense here]. Give me those happy days toytown newspaper smile. Clap twice, lean back, twist for a while. Well now we've got the hang of it. There's nothing we can't do with it. And now we're very into it we can't go wrong!"
here come the nice,"Here come the nice lookin' so good. He makes me feel like no one else could. He knows what I want, he's got what I need. He's always there if I need some sweet. Here come the nice (It's understood). Here come the nice (He'll make you feel so good). I'd be just like him (If I only could). You know you should. You know you should meet the man. The man gonna help you all he can. You don't need money to be wise. Here come the nice (It's understood). Here come the nice (He makes me feel so good). I'd be just like him (If only could). You know you should. Here come the nice lookin' so cool. Everyone knows the nice is no fool. He'll bring you up and show you around. He's always there when your feet hit the ground. Here come the nice (It's understood). Here come the nice (God he makes me feel good). I'd be just like him (If I only could). You know you should. You know you got to try to meet the man. This man's gonna teach you all he can. Ha! You don't need money (Money). Money to open your eyes. Here come the nice (It's understood). Here come the nice (God, he makes me feel good). I'd be just like him (If I only could). Here come the nice (Oh baby, baby, baby). Here come the nice (Here come the nice). I'd be just like him (If I only could). You know you should"
hey girl,"Girl, hold my hand (hand). Girl, I know you'll understand (stand). That I've been waiting for a long long time. Think everything's gonna turn out fine. Hey! Hey! It's alright. Hey! Hey! It's alright. Hey! Hey! My my my. Hey! Hey! Yeh yeh yeh. Girl, treat me kind (kind). And girl, I think you'll find (find). That no-one can love you better than me. Close your eyes and I think you'll see. Hey! Hey! It's alright. Hey! Hey! My my my. Hey! Hey! Come on children. Hey! Hey! My oh my. When I think of what I've missed. It makes me laugh inside. All the girls that I ain't kissed. Just to keep my pride. Yeh yeh yeh yeh. So girl, look around (round). And girl, see what we've found (found). We've found something we can't fight. Don't think twice it'll be alright now. Hey! Hey! It's alright. Hey! Hey! I said my my my yeh. Hey! Hey! Yeh It's alright. Hey! (Yeh!) Hey! Yeh! It's alright. Hey! (Hey!) Hey! Hey! It's alright. Hey! (Yeh!) Hey! Yeh! It's alright. Hey! (Aw!) Hey! Ooh! It's alright. Hey! (Ooh!) Hey! Yeh! It's alright. Hey! (C'mon!) Hey! Shake your head. Hey! (Alright) Hey! I promise that. Hey! (Yeh!) Hey! Oh it's alright. Hey! (everybody) Hey! It's alright when I say. Hey! Hey! Alright, alright, alright. Hey! Hey!"
i can’t make it,I know how you’re feeling. I felt that way too. So don’t get hung up. ‘cause is heeling. I’m gonna help you through it all. I can’t make it if you can’t. I can’t take it if you can’t. I know that you’re heart strong. I know that you hold on. I can’t make it without you. I can’t make it without you. So open up you’re mind. As will as your heart. I can’t go on. knowing you’re not near me. I know that I could love you. ‘cause you kissed me with your eyes. but you ain’t got the strength to make it with me. I can’t sympathize. I can’t make it if. I can’t take it if you can’t. I know that you’re heart strong. I know that you hold on. I can’t make it without you. You know it’s true girl
i'm sorry she's mine,listen boy I'm telling you. leave that girl you're talking to. you may take her hand. I think you're doing fine. ...... I'm sorry she's mine. I know that she looks real good. and you'd leave her if you could. she may go around. and dance all the time. but hold down fella. I'm sorry she's mine. she may go away from me. for a little time. but she runs back home to me. just to prove she's mine. don't you try to wear my shoes. try it with her and you'll lose. find another girl. and stop wasting my time. and don't find ...... I'm sorry she's mine
if i were a carpenter,"If I were a carpenter and you were a lady. Would you marry me anyway, would you have my baby?. If a tinker were my trade, would you still love me?. Carrying the pots I made, following behind me. Save my love through loneliness. Save my love for sorrow. I've given you my onliness. Come and give me your tomorrows. If I worked my hands in wood, would you still love me. Answer me, babe, yes, I would, I'd put you above me. If I were a miller at a mill wheel grinding. Would you miss your colored box, your soft shoes shining?"
it's too late,"my daddy told me there'd be girls like you. I kiss my dad, it's hard times too. I'm asking you, baby. what make me wait. you better love me now. before it's too late. now that I need you. now that I love you. I thought we'd make it. but I can't take it. I'm begging you baby. won't you give me ..... you better love me now. before it's too late. I know it's too late. yes I do. 'cause I can't fool myself no longer. and I hear my conscience keep on saying. it's too late"
itchycoo park,"Over bridge of sighs. To rest my eyes in shades of green. Under dreamin' spires. To Itchycoo Park, that's where I've been. What did you do there?. I got high. What did you feel there?. Well I cried. But why the tears then?. I'll tell you why. It's all too beautiful. It's all too beautiful. It's all too beautiful. It's all too beautiful. Feel inclined to blow my mind. Get hung up feeding ducks with a bun. They all come out to groove about. Be nicer than fun in the sun. Tell you what I'll do (what will you do?). I'd like to go there now with you. You can miss out school (won't that be cool). While I learn about the words of fools. What will we do there?. We'll get high. What will you touch there?. We'll Touch the sky. But why the tears then?. I'll tell you why. It's all too beautiful. It's all too beautiful. It's all too beautiful. It's all too beautiful. I feel inclined to blow my mind. Get hung up feeding ducks with a bun. They all come out to groove about. Be nicer than fun in the sun. It's all too beautiful. It's all too beautiful. It's all too beautiful. Ha! It's all too beautiful."
lazy sunday afternoon,"Wouldn't it be nice to get on wiv me neighbours( da da da do). But they make it very clear they've got no room for ravers. They stop me from groovin, they bang on me wall. They're doin me crust in it's no good at all,. Lazy sunday afternoon, I've got no mind to worry, close my eyes and. Drift away, Close my eyes and drift away.. Here we all are sittin in a rainbow(da da da do). Cor blimey hallo missus Jones hows your Berts lumbago?. I'll sing you a song with no words and no tune. I'll sing at your party while you suss out the moon, oh yeah. Lazy sunday afternoon, I got no mind to worry,. Close my eyes and drift away, Close my eyes and drift away,. Close my eyes and drift away. Aroo de de de do. Aroo de de de dido. Theres no one to see me theres nothin to say,. And no one can stop me from feelin this way. Lazy sunday afternoon I've got no mind to worry. Close my eyes and drift away. Close my eyes and drit away. close my eyes and drift away......."
long agos and worlds apart,"Please don't ask me how I know. The times before I met you long ago. If I could sit quite still. And times could pass me by. I'd sit quite still and pass the time. I'd have with you. In summer evenings it is everywhere. Ahh-ahh-ahh-ahh. Just like before we'll meet again. When we can think of long agos and worlds apart. That were but are no more. Hep,hep,do-wah-de-wah-de. Hep,hep,do-wah-de-wah-de. Hep,hep,do-wah-de-wah-de. Hep,hep,do-wah-de-wah-de. Hep,hep,do-wah-de-wah-de. Hep,hep,do-wah-de-wah-de. Hep,hep,do-wah-de-wah-de. Hep,hep,do-wah-de-wah-de. Heo,hep,do-wah-de-wah-de. .......fade....... by DanDan(/dedligno)"
mad john,"There was an old man who lived in the greenwood. nobody knew him or what he had done. but mothers would say to their children, ""Beware of Mad John."". . John would sing with the birds in the morning. laugh with the wind in the cold end of night. but people from behind their curtains, said he's not quite right.. John had it sussed he was living the life of a tramp. yes his bed was the cold and the damp but the sun was his friend. he was free. So here was a wise one who loved all the haters. he loved them so much that their hate turned to fear. and shaking from behind their curtains the loved ones would hear."
my mind’s eye,I’m seeking everyday. Looking at the sky. ever wondering why. I dream my dream’s away. And I’m living for today. In my mind’s eye. Things are clearer than before. Showing me the way. Asking me to stay. I’ll never close the door. To all this things and more. In my mind’s eye. Everybody I know. Saids I’ve changed. Laughing behind their hands. I thing their strange. People running everywhere. Running through my life. I couldn’t give a care. Because I couldn’t see. All that I can see. In my mind’s eye. In my mind’s eye
my way of giving,"I’ve been told it’s just a matter of time. Before you meet someone who’ll open your mind. But time’s on my side and nevertheless. I know the pain of too much tenderness. It’s all part of my way of giving. And I’m giving it all to you. More than love it’s a way of living. So what more would you have me do. Although I’m not a guy who means to hurt. And if at times it seems our love won’t work. I tell you honey, you must realise. And see confusion in my rounded eyes. It’s all part of my way of giving. And I’m giving it all to you. More than love it’s a way of living. And it’s me that you’re looking through"
red baloon,"Bought myself a red balloon and a blue surprise. Cause hidden in the read balloon was a peny for my eyes. She took her lovelight from my eyes. Oh blue surprise. She took her lovelight from my eyes. Blue surprise. Played with toys for children as a child I got. Haven't any time for children although I've got a lot, hey. She took her lovelight from my eyes. Oh blue surprise. She took her lovelight from my eyes. Blue surprise. Blue surprise, yeah. She took her lovelight from my eyes. Oh blue surprise. She took her lovelight from my eyes. Blue surprise. Yeah, blue surprise. Blue surprise, yeah. Blue surprise. Blue surprise. Vishnu's eyes. Loving eyes. Blue surprise. Blue surprise. Vishnu's eyes. Loving eyes"
rene,"There she is parading on the quayside. You can find her every night. Ah, waiting for a stevedore from Tyneside -. Why it's Rene, the docker's delight!. Well, if you just got off an oil tanker. And you've got the readies in the bin (Readies = cash and having them 'in the bin' means having money). Just make your way down to The Crown & Anchor [London pub famous for being a rock music venue through the 60's and 70's). Ask for Rene (ohh, hello ducks!) and you'll be well in.. She's Rene, the docker's delight, and a ship's in every night. Romping with a stoker from the coast of Kuala Lumpur. Love is like an 'ole in the wall. A line-up in the warehouse no trouble at all. If you can spare the money, you'll have a ball -. She'll have yours (It sounds like 'she'll have your oars out' but it's just the way he sings 'yours-a'. Well, there's a kid of every shape and colour. Safely hid in coal-sheds, double locked (this alludes to black kids by white prostitutes, hidden away). Where it's been said that Rene is the mother.. I wonder - well, there you go!. She's Rene, the docker's delight, and a ship's in every night. Groping with a stoker from the coast of Kuala Lumpur"
