rollin' over,"Goodbye sunshine I'm on my way. I'll be long time gone by the break of day. Tell everyone that I'm gonna find it. There ain't nothin' gonna stop me -. Rollin' Over, Rollin' Over. Save all your lovin' till I get home. To the sweetest lovin' sunshine that I've ever known. Tell everyone that I'm gonna find it. There ain't nothin' gonna stop me -. Rollin' Over, Shak-do-way. Rollin' Over, Yeah-yeah-yeah..."
runaway,As I walk alone I wonder what went wrong. With our love a love that was so strong. And as I still walk on I think of. The things we've done together. While our hearts were young. I'm walking in the rain. Tears are falling and I feel the pain. Wishing you were here by me. To end this misery and I wonder. I won-won-won-won wonder. Why why why why why why she ran away. And I wonder where she will stay. My little runaway run-run-run-run runaway. I'm walking in the rain. Tears are falling and I feel the pain. Wishing you were here by me. To end this misery and I wonder. I won-won-won-won wonder. Why why why why why why she ran away. And I wonder where she will stay. My little runaway run-run-run-run runaway. Run run run run runaway.....
sha la la la lee,"Picked her up on a Friday night. Sha la la la lee, yeah. I knew everything gonna be alright. Sha la la la lee, yeh. Sha la la la lee. I asked her 'where do you wanna go?'. Sha la la la lee, yeh. Well we went someplace, I don't know. Sha la la la lee, yeh. Sha la la la lee. I held her close and I asked her if she was gonna be my baby. It felt so good when she answered me. Oh yeh, oh yeh. Oh yeh, oh yeh, oh yeh. She looked good and she moved so fine. Sha la la la lee, yeh. And all the guys knew she was mine. Sha la la la lee, yeh. Sha la la la lee. I held her close and I asked her again if she was gonna be my baby. It felt so good when she answered me. Oh yeh, oh yeh. Oh yeh, oh yeh, oh yeh. Wanna know how my story ends?. Sha la la la lee, yeh. Well we invited just a few close friends. Sha la la la lee, yeh. Sha la la la lee. Sha la la la la la lee. Sha la la la la la lee. Sha la la la la la lee. Sha la la la la la lee. Sha la la la la la lee. Sha la la la la la la la la la lee. Sha la la la la la la la la la lee. Sha la la la la la la la la la lee. Sha la la la la la lee. Sha la la la la la lee. Sha la la la la la lee"
shake,"Listen while I'm talking to you. I tell you what we're going to do. There's a new thing goin' around. And I'll tell you what it's puttin' down. Move your body all around. And do, shake. Early in the morning. Shake. I said, later in the evening. Shake. I'm long gone baby, now. Shake. Shakin' like a bowl of soup. Legs go loop the loop. Put you hand upon your hip, now. Come on, and let your back bone slip, yeah. Move your body like your hip. Now, do, shake. Early in the morning. Shake. I said, later in the evening. Shake. That's the way you do it, now. Shake, come on. Ding a ling a ling. Oh baby, shakin' is the latest thing. You wanna really roll. You got to do this thing with soul. If you wanna really roll. You gotta do this thing with soul. Shake it, shake with all your mind, yeah. If you do it, do it right, now. Make you body loose []. And do, shake. Early in the morning. Shake. I said, later in the evening. Shake. I'm long gone baby now. Shake. If you wanna really roll. You gotta do this thing with soul. Shake it, shake with all your mind. If you do it, do it right, now. Make you body loose []. And do, shake. Early in the morning. Shake. I said, later in the evening. Shake. I'm long gone baby, now. Shake, oh yeah. All right. Early in the morning. Later on the evening. I says, come on children. You gotta get on the sea with me"
show me the way,"I’ve been walking with dawn. For my sleep hath been torn and my happiness gone. There’s an old man in me, who I talk to you see. He’s as old as the sun. Want to know just what I’ve been saying. Please, please, show me the way. All the truth I have known has been scattered and blown. I don’t know who I am. Someone else’s part I am playing. Please, please, show me the way"
something i want to tell you,I’ve got something I want to tell you. I’ve got something I want to say. All the things that you say and do girl. Don’t you know that they’re not my way. I don’t like what you’re running after. It’s not me that you’re thinking of. You forget what we’ve found together. You forget what we’ve found is love. The light in your eyes has faded. And your voice has another tone. I have cried all my tears already. Once again I am all alone. I got something I want to tell you. I got something I want to say
song of a baker,"From 'Ogdens Nut Gone Flake'. There's wheat in the field. And water in the stream. And salt in the mine. And an aching in me.. I can longer stand and wonder. Cos I'm driven by this hunger.. So I'll jug some water, bake some flour,. Store some salt and wait the hour.. When thinking of love,. Love is thinking for me. And the baker will come. And the baker I'll be. I'm depending on my labour,. The texture and the flavour. Hey!. I can no longer stand and wonder. Cos I'm driven by this hunger. So I'll jug some water, bake some flour.. Store some salt and wait the hour."
the autumn stone,"I was nowhere,. Till you changed my mind,. Love is sent through being good to you.. Then you were somewhere,. Somewhere hard to find,. Only what you always were, its true.. I'm looking for an open door,. Where I can sit, and play in peace with you.. Tomorrow changes. Fields of green today,. Yesterday is dead, but not my memory,. We were strangers,. And then you came to stay,. The sweetest spring dawn morning sings to me.. So now I've found a living sound,. That moves, that breathes and then makes love to me."
the hungry intruder,"Here am I. Tiny Fly. May I share your Shepherd's Pie? (English meal, mashed potato & mince. meat). What is this strange voice I hear?. Here I am. Look This Way. In the landscape on your tray. There's no need to ask a silly question. If I were you I hope you'd do the same. There's no doubt I'd help a hungry fly. To see you in a fix it's really such a shame. I'm so hungry. I could die. And now I'll a living fly. My name is Stan. I'm on a quest. Take your fill,. Take nothing less. I am that. That am I. And now I'll be a living fly"
the journey,"If tomorrow was today. It would yesterday. The sun is surely just a thought away. Where visions that men fail. To put to words to tale. And music that they try but cannot (p)lay. You're right it's just a dream, your company so kind. Hold very tightly please and we shall go out."
things are going to get better,"Things are going to get better. Times change, better later than never. Being true to myself. Makes me see all the more. Things are going to get better. Times fly, so don’t you upset her. And I know how I feel. And it’s time for a change. Things are going to get better. I said I knew it, I want to tell everybody. The moment that I met her. And it seems that my mind. Has survived on its own. Things are going to get better"
tin soldier,"I'm a little tin soldier. that wants to jump into your fire. you are a look in your eye. a dream passing by in the sky. I don't understand. all I need is treat me like a man. 'cause I ain't no child. take me like I am. I got to know that I belong to you. do anything that you want to do. sing any so song that you want me to sing to you. I don't need no aggravation. I just got to make you. I just got to make you my occupation. I got to know that I belong to you. do anything that you want to do. sing any so song that you want me to sing to you. All I need is your whispered hello. smiles melting the snow. nothing heard. you eyes are deeper than time. say a love that won't rhyme without words. so now I've lost my way. I need help to show me things to say. give me your love before mine fades away. I got to know that I belong to you. do anything that you want to do. sing any so song that you want me to sing to you. oh no no. I just want some reaction. someone to give me satisfaction. all I want to do is stick with you,'cause I love you"
understanding,"When people ask me what love's all about. There's one thing I can say. Some people believe just what I'm putting down. Understand your troubles away. [Chorus:]. You got to do this thing we're feeling. You got to know just what I'm meaning. You gotta believe just what I'm handing. Understanding, understanding. Yeah, alright alright. Hey hey. You see I love this life I lead. And I wanna love it with you. But people you don't understand. Just what I'm putting down. There's no more I can do. [Chorus]. Yeah, alright, come on. Just don't lose it. Come on children, I wanna hear you one more time. [Chorus]. You know what I'm singing about. My baby's gonna care, gonna make it alright. With a little understanding. We can make it through the night, yeah. Baby, baby give me some. You know I got to have some. All you know we need is just a little understanding. You can talk to me baby. Tell me what's on your mind. With a little understanding. Everything will be just fine. [Ad lib to end]"
universal,"There's such a lot of good ways to be bad. And so many bad ways to be good, haven't paid my rent yet. I tell them sorry but I haven't got the money anymore. Just for today I thought I'd leave home alone, hold hands with day. And if I'm so bad, why don't they take me away?. Just like what you hear with a shell pressed to your ear. That's the sea in the trees in the morning. Hello the Universal. Good morning Steve, well you won't believe me today. Working doesn't seem to be the perfect thing for me so I'll continue to play. And if I'm so bad why don't they take me away?. Well a hippy trippy name dropper came through my door. He said: I just bumped into Mick he told me you know where to score?. No not me friend, I mind my own and my own minds me. Well my love is at the foot of your hand come what may. But if June comes first please won't you take me away"
up the wooden hills to bedfordshire,"When you’re slipping into sleep, that’s the time to unwind. Sinking down into the deep, that’s the time of no time. When you’re slipping into sleep. All the sounds around you seem to have a new meaning. Leave your body behind you with a different feeling. When you’re slipping into sleep. The day is night, the night is day. So please out the light as I slip away. Up the wooden hills to Bedfordshire. Up the wooden hills to Bedfordshire. When you’re slipping into sleep, there’s a world you will find. That’s all yours and you can keep, that’s the only thing to keep. When you’re slipping into sleep. All the sounds around you seem to have a new meaning. Leave your body behind you with a different feeling. When you’re slipping into sleep"
"wham bam, thank you mam","Well she was a lady of charm. A prisoner of songs unsung. She was just a face that took. All her groovin' on his guitar. Hot cars, strange clothes, any ways your mind goes. Wham team, thank you mam. We'll boogie till the rooster crows. Oh yeah. We lived this way for so long. You said babe, never got it on. Oh no no no. Surprise surprise, I thought you ought to know. He chucked her out the door. Without a cent (cent, cent). Papa said grab your share but don't give a bad smell. Wham team god damn the devil planks. And wants some more yeah yeah. Sha la la la Shang a dorang shang a lang lang. Shang a lang mama, Sing it mama. Say it yes yes. Close your breath and hold your eyes. Turn the corner, a surprise, and there you are. Well, Id like to know why those old freaks. While walkin' through their moves. He seeks to keep you in your stick hole. And bash away your soul...surprise. C'mon"
what'cha gonna do about it,"I want you to know that I love you, baby. want you to know that I care. I'm so happy when you're 'round me. but I'm sad when you're not there. what'cha gonna do about it. I want you to give me your sweet sweet kisses. want you to hold me tight. I want you to come whenever I call you. and let me walk you home at night. what'cha gonna do about it"
