love is like a river,"You Used to Call Me Wicked. I Used to Call You Friend. They Say Your Life Is Wild. Compared to What Lifestyle. You Must Have Many Things to Remember. Cause Nothing Else in Your Life Has Really Changed. Everything Is Almost Like It Was Before. and I Don't Want to Do This Anymore. When You Lose Your Sight. Love Is Like a River. and There's Nothing to See. Love Is Like a River. She Was Just Like Me. Love Is Like a River. and Suddenly the Day Comes. Some Call It Love. Some Say They're Above That. Well I Believed in Love. I Called It Worth It. Some Call Me All the Time. Love Is Like a River. Well Love Is Like a River. Love Is Like a River. and When You Lose Your Sight. and Suddenly the Day Comes. Everything All Around Me Is Electric Now. But I Haven't Burned a Candle in a Real Long Time. and Only When Your Heart Says It's Over Does It Die. Well Love Is Like a River Running. Straight Back to the Sea. Some Call It Love. Some Say They're Above It Above That. Well I Believed in Love. I Called It Worth It Worth It. Well Some Call Me All the Time. Love Is Like a River. I Say You Can't Stay Home and Give Up the Fight. Love Is Like a River. I Think You're Uptight Lady Ooh, Out of Sight. That's Just What I Wanted to Hear Ooh, Out of Sight. You Know You Can't Stay Home. in the Middle of the Night. Love Is Like a River. You Can't Say no in the Middle of the Night. Love Is Like a River. I Think You're Uptight Lady Ooh, Out of Sight. and You Can't Say no in the Middle of the Night. Love Is Like a River. Well I Think You're Uptight Lady Uptight Lady. Ooh, Out of Sight Out of Sight, Baby"
love's a hard game to play,"Wake up my sweet child. There's something I've got to say to you tonite. It's time you took a look at me. Cause there's so much more to me. Than meets the eye. Well, there's more to love than makin' time. The harder you look the more you'll find. It's never easy no matter what they say. [Chorus:]. Love's a hard game to play. The heart's the price you pay. Love's a hard game to play. No matter what they say. Win or lose, no matter what they say. Love's a hard game to play. The problem here is not my fear. The trouble is you can't convince yourself. For tonight, let's lose the past. Make love last. Put our worries up on the shelf. We've been through thick and thin, and back again. And we can endure love's sweet pain. Remember, starting the fire is easy. The hardest part is learning how to keep the flame. Love's like walking a real fine line. You get too close and you'll go blind. Let go too long and it will all drift away. [Chorus]. Just when I feel like I'm losin' you. I hear them voices call. They say it's better to have lost at love. Than never to have loved at all. Lose or win, stand or fall. Well, there's more to love than makin' time. The harder you look, the more you'll find. It's never easy, no matter what they say"
mabel normand,"She's natural in her beauty. I guess you could say she's. An unapproachable comedienne. Haven't much faith in her talent. But she did her work. No comedienne has not been a clown. She did her work. But her heart was quietly crying. I guess she even felt guilty. 'Bout even dying. Sad mabel normand. So my friend is continuing. On a destructive road. His life passes before him like an. Unfortunate circumstance. He and his friend are at odds. And he is not winning. Why does someone always have to win?. He says it matters. Strange things do follow when you love someone. So you put that someone in exile. How 'bout I call you beloved exile. He called today. Says, ""don't give up"". I ask him, ""what are you talking about? "". I said things are not the same. Since you've been gone rome burned down. And it's still all the same. So I moved away from the house that held nothing. But waiting for messages. And all through the day's seasons. I went running with the sun. And I prayed every day for the answers. In a still and almost silent night. He began to hide his beauty. And I learned to say the words. Well, just whose side are you on, anyway?. You change sides. What does it matter?. Still you change... Sides. Every other day you just change sides. So, continue on your destructive road. Your life passes before me. Like an unknown circumstance. You and your friend are at odds. And you are not winning. But why does someone always have to win?. And all those races that are run. They cause patterns. Strange things do follow when you love someone. So you put that someone in exile. And you say, ""I'll write a book about it and call it beloved exile"". Well, her life was a gas. Simply everything that happened. Well, the old lady said, yes it was sad. She fought a losing battle. One day at a time. She might even make it through tomorrow. Maybe even another show, natural in her beauty. I guess you could just say she was unapproachable. Baby, comedienne. So beautiful. So beautiful. She fought a losing battle. She might even make it through tomorrow. So beautiful. So beautiful. Sad mabel normand. Sad girl. Sad girl. So beautiful"
maybe love will change your mind,"I'm Beside Myself. Cause I Don't Know and You Won't Tell. Your Distant World Has Somehow Pulled Me In. It's So Surreal. So Out of Time With You It Feels. to Give Again. But You Don't Need a Thing. Maybe Love Will Change Your Mind. Maybe This Time. Maybe Love Will Change Your Mind. Maybe This Time. a Look a Touch. Just Because I Wanted Them. to Mean So Much. You Might Not Feel the Same. the Day Would End. and You'd Go Back to Where You've Been. a Kiss For Luck. I Wish You Could Have Stayed. Maybe Love Will Change Your Mind. Maybe This Time. Maybe Love Will Make It Clear. Oh, What Words Would Keep You Here. Maybe Love Will Reach Your Heart. Thought I Saw It in the Dark. Maybe Love Will Change Your Mind. Maybe This Time. You Want Me to Be There. You Take Me Somewhere. You Show Me Your Lifeline. Reveal Your Other Side. I Would Say But the Words Won't Come. I Just Come Undone. All I Want to Do Is to Be Closer to You. La La La La La La La La La La. Maybe Love Will Change Your Mind. Maybe This Time. Maybe Love Will Make It Clear. Oh, What Words Would Keep You Here. Maybe Love Will Reach Your Heart. Thought I Saw It in the Dark. Maybe Love Will Change Your Mind. This Time Maybe Love. Maybe Love. Well You Want Me to Be There With You. Well There's Nothing More I'd Rather Do"
"mirror, mirror","And as all this comes to an end. So go the lilies of the valley. From this hour on. Brilliant is your danger. Darker than the image on the wall. Is the fear of it all. But he never said no to you baby. Mirror, Mirror. . Ooh, sometimes your frightened. And you don't know why. There's been a few things. Well, I know you really loved a lot. And then one day. In your bright blue sky. Well, I never did say why to you.... Why... You must know.... He said No not really. . Some of us will.... Some of us will never see the light. Some of us will only say,. Well, I don't want to fight about it. And then one day,. Well, you really fall in love. And you never did say. No to me did you?. He said, See ya!. . Mirror, mirror. Mirror, mirror. Mirror, mirror. . Memories fade like the wind. Oh, and she says. No, this will never come again. He says, Oh well... who can tell?. She says...I think you walk a thin line. Walk a thin line. She said you must know. He said No not really.... . Then there are the things,. Misunderstandings.... Well I know that there's a few things. That you really loved a lot.... I know, in spite of what you say,. One thing that I really wanted,. I really wanted you.... This will leave you. Haunted in your mirror"
mistaken love,"My soul has soared out of reach to great heights.... But the ground is further than I thought. Afraid of falling...this is a strange feeling.... Feel I have given up.... I never did love easily.... But I easily loved you. And I loved with such intensity. As the sea moves with the moon.... Taken love...taken love...taken love.... I've ridden with you beyond the wind. As I'm riding away with you now. Beginning to understand your pain.... Forces me to withdraw.... And now the tears...drown my face.... And leave behind them only ashes. And the beauty of you was just a dream.... Memories, earthquakes, and flashes.... Flashes...flashes...flashes.... Forsaken love, taken love, mistaken love.... I waited love.... I waited love.... I waited.... I waited...and you know I waited...I waited.... Because I wanted...I wanted.... You know I wanted.... I've ridden with you beyond the wind.... But I'm riding away from you now.... Now...now...now"
moonlight (a vampire's dreams),"Some call her strange. Lady from the mountains. And others say she's not really real. Like a candle burns bright. Wants to burn faster. But maybe then at least. She really feels. Burning like the candle in the middle. She's lonely, lost. She's disconnected. She finds no comfort. In her surroundings. Beautiful, insecure. She has nothing. She moves from situation to situation. Like a ghost. Then she sees him. A candle burning. Strange. She runs with the one she can't keep up with. Ooh it's so strange. He slows down. He's so desperate to stop her. Meet her in the middle. They both run from the one who hunts them. And they drop to the forest floor frozen. They drop to the forest floor frozen. He loves her. But he needs his life alone as well. But does he know. The road or the reasons why. If he leaves her. He'll be losing the chance. To stay alive. But the candle burns bright. Then the candle dies. Burning from the middle. Just like a candle. Strange. She runs with the one she can't keep up with. Ooh it's so strange. He slows down. He's so desperate to stop her. And they meet in the middle. They both run from the one who hunts them. They drop to the forest floor frozen. They drop to the forest floor frozen. Strange. She's laid on the floor in silent pain. Strange. He sat in a chair from months just staring. Strange. She knows too much to walk away. Strange. She couldn't do it anyway. Strange. She's laid on the floor in silent pain. Strange. He sat in a chair for months just staring. She knows too much to walk away. She couldn't do it anyway. He slows down. He slows down. He slows down. She couldn't do it. She couldn't do it. Aaaahhhh…. By: B_T"
nightbird,And the Summer Became the Fall. I Was Not Ready For the Winter. It Makes no Difference At All. 'cause I Wear Boots All Summer Long. My Eye Make Up Is Dark and It's Careless. Some Circles Around My Eyes. Sometimes the Real Color of My Skin. Is My Eyes Without Any Shadow. and When I Call. Will You Walk Gently. Thru My Shadow. the Ones Who Sing At Night. the Ones Who Sing At Night. the Ones You Dream Of. the Ones Who Walk Away. Capes Pulled Around Them Tight. Cryin' For the Night. Cry For the Nightbird Tonite. and So the Winter Is Really Here Now. and the Blankets That I Love. I Am Surrounded Sometimes. By Too Much Love. and When I Call. Will You Walk Gently. Thru My Shadow. the Ones Who Sing At Night. the Ones Who Sing At Night. the Ones You Dream Of. the Ones Who Walk Away. Capes Pulled Around Them Tight. Cryin' For the Night. Cry For the Nightbird Tonite. and the Darkened Eyes. Thru the Net of the Lace. in the Darkness. It's Hard to See Her Face. Pulls Back the Net. and You Feel the Touch. of Her Fingers. and You See She Turns the Eyes. and You See the Eyes of a Nightbird. the Ones You Dream Of. Finally the Nightbird. Finally the Nightbird. Tonite
no spoken word,"I Was Just That Old. That August Dark, Dark Day. Swear That You Never Saw Her Face. Swear That You Never Heard Her Say. No Spoken Word. No Small Command. What Was It She Wanted. They Say She Had Everything. No Spoken Word. No Small Command. What Was It She Wanted. They Say She Had Everything. What Shall I Do. What Shall I Say. Should I Say. Who All the Things. That I'd Like to Say to You. No Spoken Word. No Small Command. What Was It She Wanted. They Say She Had Everyting. Let's Make a Deal Here. Ooh, For One Night. Well Baby, You Fill the Night With The. Wind and the Rain and the Water. Oh, For One Night. Well, Just For One Night. You Know That Well That. Disasterous Sound. Now It Will Make Me Wiser. He Says, and It Will Make You Look. She Says, Look Out. I Don't Know How to Learn. From the Pages of a Book. Well I Either Say Too Much, Or I. I Don't Say Enough. Well I Play Too Hard. Still I'm Not Tough Enough. What Was It She Wanted. They Say She Had Everything. No Spoken Word. No Small Command. What Was It She Wanted. They Said She Had Everything. Ooh Come Around Tonight Indecent. Well. Ah, Ha Come Around. Tonight, Indecent Baby Well,. You Fill the Room. With the Rain and the Wind and the Water. If You Tell Me,. One More Time. Oh Baby, Take It Easy. Well, You Won't See Me Ever Again. Some People Walk Down That Darkened Street. With the Faith of a Child. And So Go the Faithless. But After Awhile, She Says. No Spoken Word. Let's Make a Deal Here. No Small Command. What Was It She Wanted. They Said She Had Everything. Ooh, I Don't Want to Know About It"
nothing ever changes,If It's Me That's Driving You to This Madness. Then There's One Thing That I'd Like to Say. Take a Look At Your Life and Your Lovers. Nothing Ever Changes. Ooh It Was Just the First Time. That I Ever Played For You. I Could Be the Dancer of Your Dreams. I Can Turn All Your Music On. I Can Make You Feel Alive. I Am Gone But I'm Never Gone From You. It Was Just the First Time. Come Back Little Boy. Baby Come Back Yeah Little Boy. Ooh It's Just Me That Lies Waiting. Well It Could Come From Anywhere. Ooh It Could Come Straight Straight From My Heart. Nothing Can Be Saved Here. I Can Turn All Your Music On. I Can Make You Feel Alive. I Am Gone But I'm Never Gone From You. It Was Just the First Time. Come Back Little Boy. Baby Come Back Yeah Little Boy. Nothing Ever Changes You Know It Doesn't. Nothing Ever Changes Oh You Know It Doesn't. Nothing Ever Changes You Know It Doesn't. Nothing Ever Changes
one more big time rock and roll star,"I told you last night or did you tell me. I think that it was me and I know that you heard it. I was crazy about you that's how it always was. Do you think about me now as I sing about this love. When it rains it pours. When there's no one at the door. Yes he did send me flowers. Well that was a long time ago. Sounded good on a. Delicate white-ribbon card. ""One more big time rock and roll star"". Just what I need. As you walk away you know that I will call. If it's just to say goodnight and that is all. Well alright that's a lie she says she wanted you to stay. But you know much better than she. She's better off this way. Undercover music lover. Oh undercover music lover and an art lover like me. There were candles, crystals, I was anyone's fantasy. Say I'm not 'cause the work just gets harder. The work gets.... Oh, one more big time rock and roll star"
ooh my love,"In the Shadow of the Castle Walls. Wherever Those Walls Were. Well You Used to Love to Be Behind Those Walls With Her. Within These Walls. Well He Watched From the Corridor. Watched From the Corner of His Eyes. Seemingly Waiting For the Time. When the Castle Walls Would All Fall Down. Yes It Was a Strain On Her. Watching Her Castles Fall Down. Oh But There Was a Time When He Called Her Angel. Where in the World Did You Come From?. in the Shadow of the Castle Walls. Wherever Those Walls Were. in This Land Or in That Land. Well the Castles All Seem to Belong to Her. and All This Talk About Love and Hate. and Our Separation Way On Down the Line. Well They Just Can't Wait, Can They?. no They Just Can't Wait. Yes It Was a Strain On Her. Watching Her Castles Fall Down. Oh But There Was a Time When He Called Her Angel. Where in the World Did You Come From?. Yes It Was a Strain On Her. Watching Her Castles Fall Down. Oh But There Was a Time When He Called Her Angel. Where in the World Did You Come From?. There Was a Light That Lighted the Way to the Chamber. Where They Spent All Their Time, Well. There Was a Light That Lighted the Way to the Chamber Door Where. They Seemed to Spend All Their Time. Ooh My Love Ooh My Love Ooh My Love. Yes It Was a Strain On Her. Watching Her Castles Fall Down. Oh But There Was a Time When He Called Her Angel. Where in the World Did You Come From?. Yes It Was a Strain On Her. Watching Her Castles Fall Down. Oh But There Was a Time When He Called Her Angel. Where in the World Did You Come From?. Yeah It Was a Strain On Her. Watching Her Castles Fall Down. Hey, Hey, Baby no One Can Take You Away From Me no No One. in the Shadow of the Castle Walls"
outside the rain,"Outside the rain. And the heart skips a beat. So you're lonely. Creature of the night. It's been almost a week. Can you love me only. Look at me, for a very long time. Long enough to know. Love is a word - i've been trying to find. Words don't matter. They don't matter at all. Maybe it's only a dream. I don't want to feel that. Well it's one more link - in the chain. I don't believe that. So you're still lonely. You say that it's been forever. Maybe you never knew me -. Maybe you thought that. I'd never change - but. You know i'm changing. - you're wrong -. And it's been like dying -. No love's that hard to find -. And i'm tired of -. I'm tired of trying. Outside the rain. And the heart skips a beat. So you're lonely. Look in my eyes. Touch my face. Baby, there's no one. That can take my place. Look in my eyes, touch my face. Baby there's no one that. Can ever replace that - heartache. Take away that heartache. Love is a word that some entertain. If you find it. You have won the game. Somebody said. ""outside the rain..."""
planets of the universe,"The bright light is lying down. Earth and the sea and the sky. Is at rest with the ocean. And the days go by. They go into the seas that have no shores. Haunted by that same closed door. Looking up at skies on fire. Leaving nothing left of us. To discover. And the planets of the universe, go their way. Not astounded by the sun or the moon, or by the day. You and I will simply disappear, out of sight. But I'm afraid soon there'll be, no light. No doubt, no pain. Come ever again, well. Let there be light in this lifetime. In the cool, silent moments of the nighttime. And the planets of the universe, go their way. Not astounded by the sun or the moon, or by the day. We will never change again, the way that we are changing. Well, you'll forget the chill of love but not the strain. Now I know. Well, I was wrong. To live for a dream. If I had my life to live over. I would never dream, no. I still wish you gone. And I will live alone. Yes, I will live alone. And the planets of the universe, go their way. Not astounded by the sun or the moon, or by the day. You and I will simply disappear, out of sight. But I'm afraid soon there'll be, no light. You will never love again the way you love me. You will never rule again the way you ruled me. You will never change again the way you're changing. You will never rule again the way you ruled me...."
races are run,"So many different kind of people. Trying to be the same. ""No way,"" baby. He said. Baby there's no way. If we could start again. Well who knows. Have we really changed. Some say we have. Reflecting our past. Who can say. Who can say. . Races are run. Some people win. Some people always have to lose. . Tell me I'm wrong. I can't believe you. We tried a thousand times before. Rained on reasons. Kept us believing. That there might still be more. . Races are run. Some people win. Some people always have to lose"
real tears,"There was another girl. She was much like you. She lived in the past. And had trouble with the future. Well, she walked with her head held high. And her hands held down at the sides. . It was everything that I had not wanted. There were reasons to be crazy. . (Chorus). Make no mistake about it. (When she stopped crying her eyes got bright). Make no mistake about it. (She walked with her head held high and her hands held down at her. sides). Make no mistake about it. ( Make no mistake about it... those were real tears). Make no mistake about it. (Make no mistake about it... I've always been unreal)"
reconsider me,"When you're all alone. And you need someone. Telephone and I'll come runnin'. Reconsider me. If the past still makes you down. Darlin', that was then and this is now. Reconsider me. And I'll never make you sad again. 'Cause I swear that I've changed since then. And I'll never make you sorry if you try. Let's let bygones be forgotten. Reconsider me. Reconsider me. You can go and be what you want to be. It will be alright if we disagree. I'm the one who cares and I hope you'll see. That I'm the one who loves you. Reconsider me. I promise that I'll never make you cry. I'll never make you sad again"
rhiannon,"Rhiannon rings like a bell thru the night. And wouldn't you love to love her. Takes to the sky like a bird in flight. And who will be her lover.... All your life you've never seen. A woman - taken by the wind. Would you stay if she promised you heaven. Will you ever win.... She is like a cat in the dark. And then she is the darkness. She rules her life like a fine skylark. And when the sky is starless. All your life you've never seen. A woman - taken by the wind. Would you stay if she promised you heaven. Will you ever win.... Will you ever win.... Rhiannon. Rhiannon. Rhiannon. Rhiannon. Rings like a bell thru the night. And wouldn't you love to love her. She rules her life like a bird in flight. And who will be her lover.... All your life you've never seen. A woman - taken by the wind. Would you stay if she promised you heaven. Will you ever win.... Will you ever win.... Rhiannon. Rhiannon. Rhiannon. Rhiannon. Taken by, taken by the sky.... Taken by, taken by the sky.... Taken by, taken by the sky.... Dreams unwind.. Love's a state of mind.. Dreams unwind.. Love's a state of mind."
rock a little (go ahead lily),"Sometimes It Rages... Rock a Little. Even When It's Calm... Still Rock a Little. Just Like the Sea... I Rock a Little. Say It Was Just Like Me. Still Rock a Little. Then You Knew Her... Funny Little Dancer. And You Watched Her All Night Long. You Were Trying to Learn From Her Teachers. One Thing That She Wanted. She Would Not Be Tangled Up... in It. Hit It,. It's About Time, Lily. Oh, I Know Lily. Rock a Little. Hit the Stage... Hit the Stage. Rock a Little. She's Home Now;. She Says I've Gone Far Beyond That Song. She Says Rock and Roll Ballerina. Where Else Would She Go?. He Knows His Daughter, Says. Where Does She Live?. He Says, Oh, Up There Somewhere. Then He Says, Go Ahead, Lily. Hit It,. Hit the Stage, Dancin'... Go On. Hit It... Well, I Know Lily. It's About Time, Lily. Hit It. Well, I Know Lily. It's About Time, Lily. Hit It. Hit the Stage. Hit It. Hit It, Lily. It's About Time, Lily. Hit It. I Know, Lily. It's About Time, Lily. Hit the Stage. Hit It, Lily. Lots of Them. And All One of a Kind. But the Most Importatn Thing Was. What Was On Her Mind. Pale... Pink... Satin... Worn Out in a Week. But You Loved You the Most. And You Said.... Go Ahead, Lily. Hit It. No Explanations and I Tell You No. You Say... Nothing. That Is How Songs Are Written. Stories Are Told, Rumours Are Started. That Is How Songs Are Written. Stories Are Told, Rumours Are Started. Go Ahead, Lily. Hit It. It's About Time Lily. Hit the Stage, Dancin'. I Know, Lily. Hit It. Hit the Stage. Go Ahead, Lily. Hit It. It's About Time Lily. Hit the Stage, Dancin'. I Know, Lily. Hit It. Hit the Stage. Go Ahead, Lily. Hit It. It's About Time Lily. Hit the Stage, Dancin'. I Know, Lily. Hit It. Hit the Stage"
rooms on fire,"Somewhere out in the back of your mind (somewhere). comes your real life and the life that you know. It seems like it was the creation of some of those same old things. It seemed to be the only thing left out in the light. She had trusted many.... But been unfamiliar with.... Almost everyone but you. Well maybe I'm just thinking that the rooms are all on fire. Everytime that you walk in the room. Well there is magic all around you, if I do say so myself... I have known this much longer than I've known you. She had trusted many... And then there would be someone who would enter into her presence. That she could sense for miles... She dreamed of her wanton luxury. And she laughed and she cried..and she tried to taunt him. and he hated to be separated... from that picture..No.... Well maybe I'm just thinking that the rooms are all on fire. everytime that you walk in the room. ooh, well there is magic all around you, if i do say so myself.... Well i have known this much longer than I've known you. long nets of white cloud my memory... long nest of white cloud my memory... ohh..there is magic.. all around you... everytime you walk in the room. Well maybe i'm just thinking that the rooms are all on fire. everytime that you walk in the room. well there is magic all around you, if i do say so myself... well i have known this much longer than i've known you... (repeat)."
