cathouse blues,"I got the cathouse blues. I wear the highest of high heel shoes. Whoa?. Whoa, darling. It? s hard to be surrounded. Where the women are lazy. And the men are rude. I got the can? t walk, don? t talk blues. I creep on cat? s feet. I don? t speak loose. Your? self in velvet. Forget we ever met. I got the closed-in, the cathouse blues. Blue-grey?. Eyes that say. I guess you don? t remember. I guess that I was younger. Touché?. The cat sleeps alone. Sleeps only in the sun. But she? ll awake the night and she? ll be gone. Singing the cathouse blues. I need some new red velvet shoes. I? m still a dreamer? s fancy. They say I? m pretty classy. I? m just a feline silky cat come true. I? m just a feline silky cat come true?. I? m just a feline silky cat come? true?. Yeah?"
cheaper than free,"Verse:. What's cheaper than free?. You and me. What's better then alone?. Going home. What does money not buy?. You and I. What's not to feel?. When love is real. Instrumental:. VERSE:. What's faster then a fast car?. A beating heart. What's deeper then a deep well?. The love into which I fell. More important then freedom?. Being needed. More exciting then high fashion?. High passion. Instrumental:. What's brighter then a smile. You child, You child. What's brighter then a smile. You child, You child. You child, You child. What's warmer then a sun drenched land. Your hand. Your hand. Your hand"
crying in the night,"She was that kind of lady. Times were hard. But she could come curling 'round you. Like fingers. But she'll leave you. Crying in the night. She will leave you. Crying in the night. She's going to leave you. Crying in the night. She's back in town. And she's looking around. Say you needed someone to depend on. You're all alone. She's the only one. Who can come take you far away. Take your breath away. Come on baby. She's the wrong kind a' girl. She's a come-on lady. She's a tarnished pearl. She'll take your money. She'll wreck your world. Wreck your world. She's a come-on baby. Come-on girl.. A ""come-on"" girl. Come on ... girl. She's back. And she's looking around. And she's looking around. And she's looking around"
crystal,"Do you always trust your first initial feeling. Special knowledge holds truth bears believing. I turned around. And the water was closing all around. Like a glove. Like the love that had finally, finally found me. Then I knew. In the crystalline knowledge of you. Drove me thru the mountains. Thru the crystal-like clear water fountain. Drove me like a magnet. To the sea. How the faces of love have changed turning. the pages. And I have changed oh, but you...you remain. ageless. I turned around. And the water was closing all around. Like a glove. Like the love that had finally, finally found me. Then I knew. In the crystalline knowledge of you. Drove me thru the mountains. Thru the crystal-like clear water fountain. Drove me like a magnet. To the sea"
doing the best i can (escape from berlin),"It was one for you it was three for me. It was very nice it was everything. So here it is in little pieces. I just played the part I didn't win or lose. Maybe next time I'll think about how I'm feeling. ""cause I'm doing the best that I can. And the whispered secrets go on and on. No one says anything to anyone. You watch after her and your word is law. She thought she was out there but nobody saw. I didn't win or lose I just threw the cards. But I paid a price for it. And it's alright, baby I'm doing the best that I can. And I'm trying hard to change I'm doing it the best that I can. Well because fate causes fortune and fortune takes it away. Well it's alright, baby I'm doing the best that I can. I was silent I was locked away. But I covered my tears. Silent all day. It's out of my hands here. In my distress well I wanted someone to blame me. In my devastation I wanted so to change. In my way disaster was the only thing that I could depend on. But it's alright, baby I'm doing the best that I can. Yes it's alright, baby I'm doing the best that I can. Because fate causes fortune and fortune takes it away. And then fortune causes nightmares nightmares that make you crazy. It's alright, baby I'm doing the best that I can. It's alright, baby I'm doing the best that I can. Oh he says well I hear you're doing fine and you're doing the best that you can. Well he says oh, I hear you're doing fine and you're doing the best that you can. Ooh she says it's alright, baby I'm doing the best that I can. Yes it's alright, baby I'm doing the best that I can. Oh and he says I hear you're doing fine and you're doing it the best that you can. Oh and he says ooh I hear she's doing fine and she's doing it the best that she can. Oh and I paid a price for it. I'm doing the best that I can"
don't let me down again,"Baby, baby don't treat me so bad. I'm the best boy that you ever had. You wanna leave now and find a new start. It's gonna kill me if you break my heart. . Ooh, once you let me down again. Ooh, you're just bound to see the end. . Baby, baby don't treat me this way. I'm gonna make it again someday. There's just one thing I'd like you to know. I got no more to lose if you go. . Ooh, once you let me down again. Ooh, you're just bound to see the end"
dreams,"Now here you go again. You say you want your freedom. Well who am I to keep you down. It's only right that you should. Play the way you feel it. But listen carefully to the sound. Of your loneliness. Like a heartbeat...drives you mad. In the stillness of remembering what you had. And what you lost.... And what you had.... And what you lost. Thunder only happens when it's raining. Players only love you when they're playing. Say...Women...they will come and they will go. When the rain washes you clean...you'll know. Now here I go again, I see the crystal visions. I keep my visions to myself. It's only me. Who wants to wrap around your dreams and.... Have you any dreams you'd like to sell?. Dreams of loneliness.... Like a heartbeat...drives you mad.... In the stillness of remembering what you had.... And what you lost. What you had.... And what you lost. Thunder only happens when it's raining. Players only love you when they're playing. Say...Women...they will come and they will go. When the rain washes you clean...you'll know"
edge of seventeen,"Just like the white winged dove.... Sings a song.... Sounds like she's singing.... Whoo... whoo... whoo.... Just like the white winged dove.... Sings a song.... Sounds like she's singing.... Ooo baby... ooo... said ooo. And the days go by.... Like a strand in the wind.... In the web that is my own.... I begin again. Said to my friend, baby.... Nothin' else mattered. He was no more... than a baby then. Well he... seemed broken hearted.... Something within him. But the moment... that I first laid.... Eyes... on... him... all alone.... On the edge of... seventeen. Just like the white winged dove.... Sings a song.... Sounds like she's singing.... ooo baby... ooo... said ooo.... Just like the white winged dove.... Sings a song.... Sounds like she's singing.... Ooo baby... ooo... said ooo. I went today... maybe I will go again.... Tomorrow. And the music there it was hauntingly.... Familiar. And I see you doing.... What I try to do for me. With the words from a poet.... And the voice from a choir. And a melody... nothing else mattered. Just like the white winged dove.... Sings a song.... Sounds like she's singing.... ooo baby... ooo... said ooo. Just like the white winged dove.... Sings a song.... Sounds like she's singing.... Ooo baby... ooo... said ooo. The clouds... never expect it.... When it rains. But the sea changes colours.... But the sea.... Does not change. And so... with the slow... graceful flow.... Of age. I went forth... with an age old.... Desire... to please. On the edge of... seventeen. Just like the white winged dove.... Sings a song.... Sounds like she's singing.... Ooo baby... ooo... said ooo. Just like the white winged dove.... Sings a song.... Sounds like she's singing.... Ooo baby... ooo... said ooo. Well then suddenly.... There was no one... left standing. In the hall... yeah yeah.... In a flood of tears. That no one really ever heard fall at all. Oh I went searchin' for an answer.... Up the stairs... and down the hall. Not to find an answer.... Just to hear the call. Of a nightbird... singing.... Come away... come away.... Just like the white winged dove.... Sings a song. Sounds like she's singing.... Ooo... baby ooo... said ooo. Just like the white winged dove.... Sings a song.... Sounds like she's singing.... Ooo... baby ooo... said ooo. Well I hear you in the morning.... And I hear you.... At nightfall.... Sometime to be near you.... Is to be unable... to hear you.... My love.... I'm a few years older than you.... Just like the white winged dove.... Sings a song.... Sounds like she's singing.... Ooo baby... ooo... said ooo"
enchanted,Crying in the morning... trying to be strong. Waiting for the spring to turn into the fall. Love don't mean what it says at all. And destiny says that I'm destined to fall. Enchanted... you thought you saw something in my eyes. Enchanted... it's a shame that you wanted me. You didn't try. Why the sad face... oh darling. Was it my darkness... shadow light. I mean to cause no trouble for you. That is the story of my life. Enchanted... you thought you saw something in my eyes. Enchanted... it's a shame that you wanted me. You didn't try. Enchanted... wo it's just a voice thru the night. Enchanted... well I hope you make it. You were gone... you were gone from me. When I remember someone... I remember their dreams. In those dreams... that no one knows of. My destiny says that I'm destined to run. Enchanted... OO... you thought you saw something in my eyes. Enchanted... it's a shame that you wanted me. You didn't try. Enchanted... well it's just a voice thru the night. Enchanted... well I hope you make it. Enchanted... well... I hope you make it. Wo... wo... wo. I hope you make it
every day,"Don't keep me hangin' on a string. Tell me what I feel is no big thing. Don't Turn away I'm Listening. Over and over again. Don't give me visions to explain. There are no doubts I feel the strain. Of all my senses yearning. Over and over again. Every day I see you. Every day I need you. Every way I breath you. On and on and on and on again. its not important to wonder why. What is just is no more imply. This simple thought repeating. Over and over again. Every day I see you. Every day I need you. Every way I breath you. On and on and on and on again. Imaging all the ways to cope. I close my eyes, that gives my hope. It cures the silence. Every day I see you. Every day I need you. Every way I breath you. On and on and on and on again."
everybody loves you,She was so enticed. By his smile. She was so unaffected. By his dream. For his dream of her. Was just not possible. She was so not that girl. It was just one of those things. That happened or didn't happen. A strand of golden hair tangled. Like the words of a song. Like a spider's web. And then he said. Everybody loves you. But you're so alone. Everybody knows your name. But you can't find your way home. No one really knows you. I'm the only one. She was so enchanted by his voice. She was so shaken by his words. His plan for her. Was just not possible. She had no words. Ooh it isn't just that. We cause each other such pain. Everywhere we go now. At home or on stage. Sometimes it was heavenly. Sometimes it was too heavy. I looked the other way. Everybody loves you. But you're so alone. Everybody knows your name. But you can't find your way home. No one really knows you. I'm the only one. Don't come here again. Unless fear of fire leaves you cold. And the cold makes you tired. If you feel it all. It's all about desire. About when you were true. About a bird on a wire. And that was you. She does still hear him. All night long. The same song over and over. It heals her heart. No voice of a stranger. Could play that part. It broke her heart. Broke her heart. Everybody loves you. But you're so alone. Everybody knows your name. But you can't find your way home. Everybody loves you. But you're so alone. Everybody knows your name. But you can't find your way home. No one really knows you. I'm the only one
fall from grace,"I choose to be his confidant. And to keep him from the fire. I choose to be quietly discreet. If that is his desire. I touch with gossamer wings. To be quiet around you. There is so much going on. You could easily. [Chorus:]. Wake up with a stranger. It's not something you plan. One night in a world of pain. And you finally understand. Not all the king's horses, not all the king's men. Could put it back together. You say you wouldn't do this for very long. The applause from it all is so defining. Well it bounces off the wall at you. When the miracle is happening. High priestess... she's the keeper of the peace in this. Twice as much, intensified. What people will do. To get... this... high. [Chorus]. And now alone in my room. As it all begins again. Was I so wrong. Why am I always so intense. In this same place I sit. The same place as before. Well I came all the way here. Just to watch you walk out that door. I didn't ask when you shook your head. I always accepted what you said. As the truth and the truth only. Well it's not enough that you depend on me. And it's not enough that you say you love me. It's not enough to just save face. Because sometimes. You just fall from grace. Sometimes. You just fall from grace. Maybe I am calmer now. Maybe things are fine. Maybe I made the whole thing up. Maybe it isn't a lie. Maybe the reason I say these things. Is to bring you back alive. Maybe I fought this long and this hard. Just to make sure you survive. Just to make sure you survive"
free fallin,"She's a good girl, loves her mama. loves Jesus, and America too. She's a good girl, crazy 'bout Elvis. Loves horses and her boyfriend too. It's a long day livin' in?Reseda. there's a free-way runnin' through the yard. and I'm a bad boy, cause I don't even miss her. I'm a bad boy for breakin' her heart. Chorus:. And I'm free, I'm free fallin'. All the vampires walkin' through the valley. move west down Ventura Blvd.. And all the bad boys are standing in the shadows. All the good girls are home with broken hearts. Repeat Chorus. I wanna glide down over Mulholland. I wanna write her name in the sky. I wanna free fall out into nothin'. Gonna leave this world for awhile. Repeat Chorus"
frozen love,"You may not be as strong as me. And I may not care to teach you. It may be hard to keep up with me. But I'll always be able to reach you. . And if you go forward, I'll meet you there. And if you climb up through the cold freezing air. Look down below you; search out above. And cry out to life for a frozen love. . Life gave me you; the change was made. And there's no beginning over. You are not happy, but what is love?. Hate gave you me for a lover.... . And if you go forward, I'll meet you there. And if you climb up through the cold freezing air. Look down below you; search out above. And cry out to life for a frozen love"
garbo,I love to waltz with a man in a dark linen suit. All alone -- at a party with someone I knew. From a time gone by -- turned to stone. You could be Garbo or even Marlene. You could be Marilyn.... Or you could forget. I play the part but then all of us do. And I do it so well as I do it to you. In this town full of strangers. In this town full of fools. Venus doesn't glitter when she stands next to you. When you're waltzing through stardom. You miss what you lose. Lose yourself in a silvery dress. For you think you must do what you feel you do best. And you musn't give it up for you're still but a guest. You could be Garbo or even Marlene.... Or you could forget.
gold,"When the lights go down. In the California town. People are in for the evening. I jump into my car. And I throw in my guitar. My heart beatin' time with the breathing. Driving over Kanan. Singing to my soul. 'Cause people out there turn the music into gold. My buddy Jim Bash. He is working pumping gas. And he makes two fifty for an hour. He's got rhythm in his hands. As he's tapping in the cans. Sings rock and roll in the shower. California girls are the prettiest in the world. Each one a song in the making. Singin' rhymes with me, I can hear the melody. Story is there for the taking."
gold and braid,"Though deep set and somewhat shadowed. Her life...her mystery. Well It's not so different than the way that he said. ""So don't hide behind your eyes from me that way baby"". ?. In his heart he wishes her stardom. His eyes want for her much more. That's not so different. Than the way that he said. ""There are so very few stars left"". ?. Don't hide behind your hair. It's a bit of gold and braid. Easy come the tears. You see a pathway ending with a doorway. You slip toward the doorway. Been waiting there all day. All these years. ?. Don't hide it. In his heart he wishes to forget her. Like to make it better. And hold her like a child. ?. Don't hide your eyes that way. Don't hide anything not anymore. Because I never did not love you. I never did run from you. In a dream I said to you. That I'd always love you"
hard advice,"Sometimes late at night. I turn on the radio. Your music fills the room. I just can? t seem to get away from you. Saw a life size paper doll of you. In a record store. My friends as well as me. Can? t seem to let you go. It was finished long ago. Sometimes he? s my best friend. Even when he? s not around. But the sound of his voice. Well, it follows me down. And reminds me. Another famous friend told me. Love does end. Make a clean break. He didn? t talk about heartache. You have to let him go. Oh oh. Get over it. Remember how it was. Before our infamous pasts had begun. You have to let him go. He gives such hard advice, oh. He gives such hard advice. He says don? t think twice. Turn off the radio. It was finished long ago. Go write some real songs. This is all wrong. Sometimes he? s my best friend. Even when he? s not around. But the sound of his voice. Well, it follows me down. And reminds me. Sometimes he? s my best friend. Even when he? s not around. But the sound of his voice. Well, it follows me down. And reminds me. You have to get over this. The pain? s gone on too long. Go and write some real songs. Stay out of music stores. Don? t buy that doll. Sometimes, sometimes. Turn off that radio. Turn off that radio. Don? t buy that doll. Don? t buy that doll"
has anyone ever written anything for you,"Has anyone ever written anything for you. In all your darkest hours. Have you ever heard me sing. Listen to me now. You know I'd rather be alone. Than be without you. Don't you know. . Has anyone ever given anything to you. In your darkest hours. Did you ever give it back. Well, I have. I have given that to you. If it's all I ever do. This is your song. . And the rain comes down. There's no pain and there's no doubt. It was easy to say. I believed in you everyday. If not for me. Then do it for the world. . Has anyone ever written anything for you. In your darkest sorrow. Did you ever hear me sing. Listen to me now. You know I'd rather be alone. Than be without you. Don't you know. . So, if not for me, then. Do it for yourself. If not for me then. Do it for the world. Poet...priest of nothing. Poet...priest of nothing"
how still my love,Still the same old story. What price glory. You make it easy. In the still of the night. In the still of the night.... How still my love. In the still of the night.... How still my.... Doing all you can for me. They say you're not the man for me. Don't make it easy. In the still of the night. In the still of the night.... How still my love. In the still of the night.... How still my love. Standing...in the doorway. Watching out to sea. Calling out to me. Yo go...your way. Go on...go on. But you don't forget me. Ooo no...you don't forget me. Oooo no...my lonely one. You're doing all you can for me. They say you're not the man for me. Don't I make it easy. In the still of the night. It's...me...talking to you. How still my love.... In the still of the night.... How still my love.... In the still of the night.... It's me that's talkin' to you. In the still of the night.
i can't wait,"Yes, I know you. Sometime she talks to him. Sometimes when she’s only dreaming. Then when she wakes up. Somehow she still believes him. Yes, I know you. Tho we’ve been out of touch. Yes, I know you. To be continued, it’s too much baby. I can’t wait I can’t wait. Well, I’ve got to know when I can see you again, now baby. I can’t wait I can’t wait. Am I wasting my time while you make up your mind. Well, I can’t wait I can’t wait. Yes, I know you. Tho we’ve been out of touch. I can’t wait I can’t wait. What can I do when I’m crazy for you. She wonders how many more hours. Her heart will feel broken. In secret she says she needs to see him. But no words are spoken. She dances around in a circle. Well she’s got that feeling now. Blame it on something at first sight. Put the blame on me if you want to. To be continued. I can’t wait I can’t wait. Am I wasting my time while you make up your mind. Well, I can’t wait I can’t wait. I got to know when I can see you again. Well, I can’t wait I can’t wait. I can’t wait I can’t wait. I can’t wait I can’t wait. How will we feel 20 years from now"
i don't care,"Why is it. I'm the one. Who is always cleaning up your mess. I Don't Care. Where you hide. I Don't Care. Where you go. I Don't Care. What you do. I Don't Care. What you said. I just care that you love me. You're in trouble again. For the wrong things. I didn't know her. I didn't know you. There she goes again. Ooh, she says. ""Do you think that this could be one? "". Cause' I don't really care unless you love me. I just care of the hard work I've owed you anywhere. What would my life be without you in it. (Each others broken, lost outside of this). I Don't Care!. You don't even have to believe. Just open your eyes and baby you'll see. I Don't Care!. I Don't Care!. I Don't Care. I Don't Care. Where you go. I Don't Care. What you say. I Don't Care. What you do. I Don't Care. What you want. I just care that you love me. And don't tell me anything else. Just tell me that you need me. Baby!. I just care of the hard work I've owed you anywhere. What would my life be without you in it. (Each others broken, lost outside of this). I Don't Care!. You don't even have to believe. Just remember what you said to me. Long ago, baby. And don't tell me anything else. Just tell me that you need me. And anything else. I Don't Care"
i miss you,"When I think about you. I think about how much I. Miss you when you're not around. When I think about you. I think about how much I. Can't wait to hear the sound. Of your laughter. Time and distance never matter. Well I miss you now. I have so many questions. About love and about pain. About strained relationships. About fame as only he could explain it to me. Seems like yesterday. I think about how much I. Wish that you were here with me now. The invisible girl that was my name. She walks in and walks out. And I'm sorry now. I'm sorry now. Well I miss you now. I have so many questions. About love and about pain. About strained relationships. About fame as only he could explain it to me. Tell me again. Paris to Rome, London to Paris. Always goodbye, I nearly couldn't bear it. Her heart settles down. She's back on that staircase. On the way up to her place. I miss you now. I have so many questions. About love and about pain. About strained relationships. About fame as only he could explain it to me. Tell me again. Paris to Rome, London to Paris. Always goodbye, I nearly couldn't bear it. Her heart settles down. She's back on that staircase. On the way up to her place. I miss you now. I have so many questions. About love and about pain. About strained relationships. About fame as only he could explain it to me. I miss you now. miss you now. miss you now."
i need to know,"Talk on the town says I might go solo. A good friend of mine saw you leavin' by your back door. (Chorus). I need to know I need to know. Well if you say you're gonna leave then you better say so. I need to know I need to know. Because I don't know how long. Well I can hold on. If you're makin' me wait. And you're leadin' me on. Ooh I need to know. I need to know. Who would've thought that I'd fall for his lies. All of a sudden it's me on the outside. (Chorus), guitar solo, (chorus). ""Take your violet and blue mornings with you!"""
i sing for the things,"You say I have everything. Well, I'm living on dreams and chains. But, I sing for the things money can't buy. You say you don't believe. Well could you just look at me. Look deep into my eyes... my love. Well, have you ever been in love. Have you touched the soul of someone. Did the fear inside you make you turn and run. I'll take off my cape for you. I'll take down my hair for you. Anything you want me to do... my love. Well, I'll sit home and wait for you. Oh, darling there's nothing that I'd rather do. Anything you want me to do... my love. Have you ever been in love. Have you touched the soul of someone, baby. Did the fear inside you make you turn and run. You say I have everything. Well, I've been living on dreams and chains. I sing for the things that money can't buy me. Have you ever been in love. Have you touched the soul of someone. Did the fear inside you make you turn and run. Anything... my love. Anything... my love. Any thing"
