"kristy, are you doing okay?","There's a moment in time. And it's stuck in my mind. Way back, when we were just kids. Cause your eyes told the tale. Of an act of betrayal. I knew that somebody did. Oh, waves of time. Seem to wash away. The scenes of our crimes. for you this never ends. Can you stay strong?. Can you go on?. Kristy are you doing okay?. A rose that won't bloom. Winter's kept you. Don't waste your whole life trying. To get back what was taken away. Though the marks on your dress. Had been neatly repressed. I knew that something was wrong. And I should have spoke out. And I'm so sorry now. I didn't know. Cause we were so young. Oh, clouds of time. Seem to rain on. Innocence left behind. And it never goes away. Can you stay strong?. Can you go on?. Kristy are you doing okay?. A rose that won't bloom. Winter's kept you. Don't waste your whole life trying. To get back what was taken away"
l.a.p.d.,"When cops are taking care of business I can understand. But the L.A. story's gone way out of hand. Their acts of aggression, they say they're justified. But it seems an obsession has started from the inside. They're shooting anyone who even tries to run. They're shooting little kids with toy guns. Take it to a jury but they don't give a damn. Because the one who tells the truth is always the. policeman. Chorus:. Beat all the niggers. Beat whoever you see. Don't need a reason. (We're) L.A.P.D.. The city of L.A. feels like a prison. With helicopters overhead and bullets whizzing by. Martial law ain't no solution. Police brutality's just social pollution. Beat all the white trash. Beat whoever you see. Don't need a reason. (We're) L.A.P.D.. They say they're keeping the peace. But I'm not buying it because a billy club ain't much. of a pacifier. Protecting your freedom. Now that's just a lie. It's an excuse for power that's more like an alibi. Law and order doesn't really matter. When you're the one getting bruisedand battered. You take it to a jury, they'll throw it in your face. Because justice in L.A. comes in a can of mace. Chorus"
leave it behind,Rage burns can't push it aside now. Can't forgive this grudge is alive now. All the rage eats you up inside. Can you leave it behind. What a surprise --. You're fucked with again Yeah. It's a way of life you need to get over. All the rage just eats you alive. Can you leave it behind. I don't know where it'll end. The sun has set. And I can't be friends. I don't know if I can forgive. The day is long. But you were so dead wrong.
let's hear it for rock bottom,In my perfect isolation. I can stay here for awhile. Antidotes and revelations. Just extend my own exile. Wasting away. The world’s right in front of me. Funny you should say. That it’s all in my head. Wasting away. We’re hitting rock bottom. And going down in flames. Well it’s not that bad. With my lack of observation. I can stay in here for days. Could you find my motivation. I can’t see it through this haze. Wasting away. The world’s right in front of me. Funny you should say. That it’s all in my head. Wasting away. We’re hitting rock bottom. And going down in flames. Well it’s not that bad. Wishing away. The world’s right in front of me. Call me anyway. Cause it’s all in my head. Wasting away. We’re hitting rock bottom. And going down in flames. Well it’s not that bad. Wasting all my days. What would Ivan say. Wasting all my days. What would Ivan say. Wasting away. We’re hitting rock bottom. Call me anyway. Cause I got two friends. Wasting away. We’re going down together. And all in all it’s not so bad. All in all it’s not so bad. It’s hard to know. Where to start and where to go. I will never say these words again
lightning rod,I am waiting. On a mountaintop. For the moment that the sky will strike. My apologies. Are forever lost. Soon to ashes in a flash of light. Miles away from me. Hope is fading soon. Gone forever it's a waste of time. My intentions. Like a sweeter room. Only bring to me a fading light. Locked up forever inside. I look to the stars and ask why. If they could just teach my dark heart to feel. All I've saved - why. Is thrown away. I am waning. Like a single bloom. Lost forever in the storm of life. My intentions. Like a sweeter room. Only bring to me a fading light. Locked up forever inside. I look to the stars and ask why. If they could just show these wounds how to heal. Here I am - oh why. My last stand - oh why. And I know For all the rising and falling there's nothing to show. Throw me down. It's been raining. And now I will pay. Woe is come to me. I am the lightning rod. I am waiting. On a mountaintop. Oh above me. He will strike me!. Locked up forever inside. I look to the stars and ask why. If they could just teach my dark heart to feel. All I am - oh why. My last stand - oh why. And I know. For all the rising and falling there's nothing to show
living in chaos,"Somewhere the time was right, could have been gone in ten. This world is hard to fight, hitting you once, hit it again. To know the way it feels, everyone gets knocked down. When you get up it¹s real, by taking it back, turn it around. Get on it, up on it. Get on it ­ wouldn't wanna be you. Get on it, out on it. Get on it ­ no one¹s gonna free you. You know, when you¹re keeping it slow. No matter where you wanna go ­ wouldn¹t wanna be you. Get on it, up on it. It's on ­ we're living in chaos. Somewhere along the line, things get chipped away. This place keeps going down, gets a little worse every day. I see hate and greed, this world¹s a messed up town. Embrace the pain and see, by taking it back, you turn it around."
long way home,Hey!. I'm driving down a dusty road. Hey!. I've got nowhere to go. Hey!. No place that I can call my own. On and on this road is burning. Break away!. I'm leaving all this crap behind. Break away!. The past is gone the future's blind. Break away!. Don't care how long it takes this time. On and on I'll take the long way home. The long way home. The long way home. If it's for me it's on the way home. Hey!. Like fragments of a broken mind. Hey!. I splinter by my own design. Hey!. The search is not a waste of time. On and on this road keeps burning. Break Away!. My hands are glued upon the wheel. Break Away!. The road ahead is all I feel. Break Away!. The only thing left that's real. On and on I'll take this long way home. The long way home. The long way home. I will go alone. I will go and find it on my own. What lays ahead you cannot find for me. On and on I'll take the long way home. The long way home. The long way home. If it's for me it's on the way home. The long way home. I'll take the long way home. I will go alone. I will go and find it on my own
me and my old lady,Me And My Old Lady. Lay in bed all day. And when I say I love her. Well she rolls the other way. But really she don't mean it. Everything she says. Still if I believe in love. There's nothing wrong. There's nothing wrong with my head. . Me and my old lady. Sit and sip on wine. And when she says she loves me. Will I say that love is blind. But really I don't mean it. Everything I say. Still if she believes in love. There's nothing wrong. There's nothing wrong with her head. . So what if we're making a scene now. You know she don't give a shit. When she's pawin' and grabbin' on me now. You know I don't mind a bit. It's all good and we. Ain't gonna change now. The world is unaware. So if you want to go on and stare. Cause we don't care. . She ain't no ball and chain. Me and my old lady. Suck each other dry. And when in that position. I'm the luckiest man alive. Quenching our libidos. Passing time away. Now that I believe in love. There's nothing wrong.
million miles away,"There was a time, looking through myself. Wanting to pretend. If I escaped, I could fill myself. I don't think you can. Been far and wide. But that hole inside. Never really leaves. When I went away, what I really left. Left behind was me. It's telling me. To be on my way home. Million miles away. I can't stay. Each passing day, every passing face. Seems like such a blur. I long to be. Home, silently. Lying next to her. Just to get back, by her side is all. All I need to be. Cause I went away. But what I really left. Left behind was me. I need to be. Getting on my way home. A million miles away. Million miles away. I can't take."
mission from god,"Never knew where to go. Never used to go to at night. Thinking but I didn't know. Never could seem to get it right. But I've made up my mind. Yeah I've made up my mind. I wanna feel important. I wanna feel alive. Don't talk to me. Don't talk to you. You know I'm lying. You know the truth. Yeah, I'm on a Mission From God. It sounds kinda crazy but I like it a lot. I'm an answer to the man up above. It's me he's speaking of. Yeah, so I'm just a fortunate son?. Everybody wants to be the chosen one. I'm on a mission. I'm on a mission from God. I went to Pensacola just to get an opinion. A perfect California get it straight in my mind. Take a new road, take a new direction. Maybe going to get it right. But I've made up my mind. Yeah I've made up my mind. I wanna feel important. I wanna feel alive. Don't talk to me. Don't talk to you. You know I’m lying. You know the truth. Yeah, I'm on a mission from God. It sounds kinda crazy but I like it a lot. I'm an answer to the man up above. It's me he's speaking of. Yeah, so I'm just a fortunate son?. Everybody wants to be the chosen one. I'm on a mission. I'm on a mission from God. If I could save the world. I might do it. I just might do it. Now it’s up to me. So are you worth it?. Are you really worth it?. If I can save the world. Yeah I'm on a Mission From God. Sounds kinda crazy but I like it a lot. I'm an answer to the man up above. It's me he's speaking of. On a mission, on a mission, on a mission, a mission, a mission, mission, mission, mission. Yeah I'm on a mission"
mota,"Mota!. Every day, well it's the same. That bong that's on the table starts to call my name. I take a hit and zone out again. I'll be paranoid and hungry by a quarter to ten. Watching reruns on my TV. I'm laughing off my ass at three's company. I don't know if I'm understood. but hearing Jimmy buffett never sounded so good. Your memory's gone and so is your life (your life). Mota boy. But losing out just never felt so right. Your enemy's you and so is your life (your life). Mota boy. But losing out might feel okay all night. Mota. I'm driving down to the Barrio. Going 15 miles an hour cause I'm already stoned. Give the guy a twenty and wait in the car. He tosses me a baggie then he runs real far. I take a hit but it smells like a clove. Oh fuck I got a baggie of oregano. This ritual is destroying me. But I guess it could be worse. It could be methedrine. Your memory's gone and so is your life (your life). Mota boy. But losing out just never felt so right. Your enemy's you and your couch is your life (your life). Mota boy. But losing out might take. Losing out might take, losing out might take you all night. Mota. Your memory's gone and so is your life (your life). Mota boy. But losing out just never felt so right. Your enemy's you and this is your life (yourlife). Mota boy. But losing out might feel okay all night. Yeah losing out might feel okay all life"
my & my old lady,Me And My Old Lady. Me and my old lady. Lay in bed all day. And when I say I love her. Well she rolls the other way. But really she don't mean it. Everything she says. Still if I believe in love. There's nothing wrong. There's nothing wrong with my head. Me and my old lady. Sit and sip on wine. And when she says she loves me. Will I say that love is blind. But really I don't mean it. Everything I say. Still if she believes in love. There's nothing wrong. There's nothing wrong with her head. So what if we're making a scene now. You know she don't give a shit. When she's pawin' and grabbin' on me now. You know I don't mind a bit. It's all good and we. Ain't gonna change now. The world is unaware. So if you want to go on and stare. Cause we don't care. She ain't no ball and chain. Me and my old lady. Suck each other dry. And when in that position. I'm the luckiest man alive. Quenching our libidos. Passing time away. Now that I believe in love. There's nothing wrong. There's nothing wrong with my head.
neocon,We are strong. We are right. We won't be pushed aside. We'll go on. We will fight. We will not compromise. We will never lose to you. We will never lose to you. We will never lose to you. We will never lose to you
never gonna find me,"Whaoooohoooohooooo. On a mission started by my own admission,. I will leave you all behind.. By direction I`ll create my own protection,. the real me you'll never find.. Aspirations turn to fear and desperation,. Nothing`s ever good enough for you.. Burning in sorrow cause I see there`s no tomorrow,. You'll only see what I want you to.. Never gonna find me,. Never gonna find me,. way down deep inside there is a real me,. I'm always gonna hide, and this is who you'll see.. Never gonna find me,. Never gonna find me,. way down deep inside they haven`t found me yet,. I'm always gonna hide, and this is who you'll get.. Whaoooohoooohooooo. On a mission to establish my attrition. you may think that you have won.. Your rejection has bought on my introspection,. I'll escape I`ll only run.. Accusations may destroy my motivation. I can feel it when you're pushing me.. Burn in sorrow cause I see theres no tomorrow,. Only I know which me you'll see.. Never gonna find me,. Never gonna find me,. way down deep inside there is a real me,. I'm always gonna hide, and this is who you'll see.. Never gonna find me,. Never gonna find me,. way down deep inside they haven`t found me yet,. I'm always gonna hide, and this is who you'll get.. Whaoooohoooohooooo. Break away.. Run.. Down inside.. I've got to. push it away.. Down.. I did not choose this.. God Dammit!. I don't really know, what I wanna say,. I can't afford to throw, can`t make it go away now.. Try to make it through, fuck your decision,. I can`t feel myself but I'm burning up now.. Whaoooohoooohooooo (never gonna find me). Whaoooohoooohooooo (never gonna find me). Whaoooohoooohooooo (never gonna). Whaoooohoooohooooo"
next to you (bonus track),"I can't stand it for another day. When you live so many miles away.. Nothing here is gonna make me stay,. (You) took me over, let me find a way.. I sold my house. I sold my motor, too.. All I want is to be Next To You.. I'd rob a bank. Maybe steal a plane.. You took me over,. Think I'm goin' insane.. What can I do,. All I want is to be next to you.. What can I do,. All I want is to be next to you.. I've had a thousand girls or maybe more,. But I've never felt like this before.. But I just don't know what's come over me,. You took me over, take a look at me.. What can I do,. All I want is to be next to you.. What can I do,. All I want is to be next to you.. All I want is to be next to you,. All I want is to be next to you,. All I want is to be next to you.. Saw my doctor he said give it time. Got this feeling, gonna lose my mind.. When all it is is just a love affair.. You took me over baby, take me there.. What can I do. All I want is to be next to you. What can I do. All I want is to be next to you. What can I do. All I want is to be next to you. What can I do. All I want is to be next to you."
nitro (youth energy),Our generation sees the world. Not the same as before. We might as well just throw it all. And live like there's no tomorrow. We are the ones. Who are living under the gun every day. You might be gone before you know. So live like there's no tomorrow. Ain't gonna waste this live. The official view of the world has changed. In a whole new way. Live fast cause if you don't take it. You'll never make it. So if you understand me. And if you feel the same. Then you will know what nitro means. You'll live like there's no tomorrow. Ain't gonna waste this live. There's no tomorrow. You ain't gonna live it for me.
nitro [youth energy],Our generation sees the world. Not the same as before. We might as well just throw it all. And live like there's no tomorrow. We are the ones. Who are living under the gun every day. You might be gone before you know. So live like there's no tomorrow. Ain't gonna waste this live. The official view of the world has changed. In a whole new way. Live fast cause if you don't take it. You'll never make it. So if you understand me. And if you feel the same. Then you will know what nitro means. You'll live like there's no tomorrow. Ain't gonna waste this live. There's no tomorrow. You ain't gonna live it for me.
no brakes,"Lain awake. I don't give a shit. If I even ever. Wake up in the morning. Down below. There's a pile of sin. Always waiting for a. Waiting for a warning. Burned at the stake. Inside I'm blistering. Not a whisper. Looking in you'd never know it. Miles below. I look up again. When you snap they say. Before you never show it. Someone said it's all right. Save it now, don't say it for my sake. Someone said it's all right. Faster now, you know I got no brakes. Fuses glow. Wounds of festering. Till the wind comes up. And takes it to the last pow. Back and forth. Staring at the wall. This room's a cage. I know that something's got to give now. Lain awake. I don't give a shit. If I even ever. Wake up in the morning. Down below. There's a pile of sin. Always waiting for a. Waiting for a warning. Someone said it's all right. Save it now, don't say it for my sake. Someone said it's all right. Faster now, you know I got no brakes(3X). No brakes (3X)"
no hero,"Once you said you'd stick to it until the end. I guess you lied, they call it suicide. Now you're gone. What was so wrong that you couldn't find a way to. carry on?. Second guess. Did I do my best. There was a friend I had. CHORUS. Johnny was a weirdo. So what did you expect?. I ain't no fucking hero. I'm just trying to survive myself. I should have known you went through it alone. I wonder why did you even try?. You could have come to me. I would have helped you see. You could have found a way to carry on. Second guess. Did I do my best. There was a friend I had.... CHORUS. 'Johnny's strange behavior was a tip-off,' they say. But I ain't no fucking savior. I'm just living day by day. Little things, little lives hanging 'til the end. I say it doesn't really mean nothing. Telling truth, telling lies. I used to have a friend. I say it don't really mean nothing. And I can't let this feeling go. Let this feeling go. Let this feeling go. By Ederson Henzel"
not the one,I'm not the one who made the world what it is today. I'm not the one who caused the problems started long ago. But now I deal with all the consequences that troubles our times. I carry on and never once have even questioned why. (yeah) I'm innocent. But the weight of the world is on my shoulders. (yeah) I'm innocent. But thet battles started are far from over. We're not the ones who leave the homeless in the streets at night. We're not the ones who've kept minorities and women down. Still we grow and then the problems they become our own. We carry on without even realizing why. (yeah) We're innocent. But the weight of the world is on our shoulders. (yeah) We're innocent. But thet battles started are far from over. We're not the ones whose pollution blackened our skies. And ruined our streams. We're not the ones who made the nuclear bombs. That threaten our lives. Wer'e not the ones who let the children starve in faraway lands. We're not the ones who made the streets unsafe to walk at night. And even if we try and not become so overwhelmed. And if we make some contribution to the plight we see. Still our descendants will inherit our mistakes of today. They'll suffer just the same as we and never wonder why.
nothing from something,"Things are coming down on me. They never seem to let it be. It seems like everything I say just starts another fight. The pressure's building up inside. I gotta let it out tonight. Shattered glass will cure my ills and make me feel alright. CHORUS. Gonna break it. And never stop running. Making nothing from something. Making nothing from something. . Cut me for the lion's share. It's mindless, but I don't care. 'Cause no matter what I say. I'm in a another fight. Take more shit, I've had enough. Tonight I'm gonna rip it up. Broken windows cure my ills and make me feel alright. . CHORUS."
nothingtown,Let’s make this complicated. Thinking is overrated. We’re busting out. Of this shitty little town. Green grass and colored lenses. Tear down these picket fences. Burn in our beds. While the city lies sleeping. Why oh why?. Are we starting up and going down?. My oh my. Just the two of us in Nothingtown. Our superhero play. We’ll leave this town today. Hold on tighter. With my lighter. Shining through. These city streets are burning. Rose red your wheels are turning. Make me believe. Someday we could really leave. Blindfold a new direction. Stop asking better questions. Don’t figure out. That we’re never getting out. Why oh why?. Are we starting up and going down?. My oh my. Just the two of us in Nothingtown. Our superhero play. We’ll leave this town today. And I’ll row it if you steer it. I’ll yell until you hear it. Hold on tighter. With my lighter. Shining through. Why oh why?. Are we starting up and going down?. My oh my. Just the two of us in Nothingtown. Our superhero play. Our dreams get in the way. And I’ll row it if you steer it. I’ll yell until you hear it. Hold on tighter. With my lighter. Shining through. Still stuck in Nothingtown. Still stuck in Nothingtown. Come on let’s go
o.c. guns,"Tiki tiki tiki tiki,. What up Holmes?. Huero! Puto! Pendejo! Cabron!. Tiki tiki tiki tiki,. What up Holmes?. Shoot them in the back when the beat, beat on.. Tiki tiki tiki tiki,. What up Holmes?. Chicabra! You Puto! Pendejo! Cabron!. Tiki tiki tiki tiki,. What up Holmes?. Shoot them in the back when the beat, beat on.. Punk ass gonna get it all right. OC Guns gonna come out tonight. Look at Muy Borracho come and go. Two in the front seat two in the back. Nothing good gonna come out of that. They're live in fast and rollin' slow. Tiki tiki tiki tiki,. What up Holmes?. You Hijo de Puta! Pendejo! Cabron!. Tiki tiki tiki tiki,. What up Holmes?. Shoot them in the back when the beat, beat on.. One shot gonna make it all right. OC guns gonna come out tonight. Take a look at that “Vaya Con dios”!. Two in the front seat two in the back. Nothing good gonna come out of that. They're living fast and rollin' slow. Tiki tiki tiki tiki,. What up Holmes?. Huero! Puto! Pendejo! Cabron!. Tiki tiki tiki tiki,. What up Holmes?. Shoot them in the back when the beat, beat on.. Follow me to a bottomless sea. Come out on top underneath. The palm threes (Gosh, so real!). Take it light where the sun shines bright. The BOOM BOOM BOOM is gonna. Drown out the night (I Just feel yah!). I've got to say what you are thinking. You've got to have it all day long. God's gift you take it without blinking. What was your swan is now your song. Tiki tiki tiki tiki,. What up Holmes?. You Hijo de Puta! Pendejo! Cabron!. Tiki tiki tiki tiki,. What up Holmes?. I Shoot them in the back, I Shoot them in the back. I'm going, I'm going down down. I'm going down, down, down"
oc life,"wannabe a member, wannabe a name. wannabe a local face that plays the social games. dancing through a time will bring you dinosaur trends. the limits of your mind is where the county line ends. listen to the media present it all as fact. following the lead cause you don't know how to act. travel in a straight line. cause you don't know your own way. they'll get you in the end. before you know you'll have a say. this o.c. life is not the life for me. insulated world, trade your happy thoughts. o.c. life is not the life so free. For you girls and boys. wannabe a member, wanna have some fame. fighting to stay ahead a part of the game. atm and starbucks (on) every corner are the norm. environment so sterile, it'll get you to conform. 714, wear it like a brand. contaminated future is [...]. fight all their rules, I don't see a better way. guess you're really in before you know you'll have a say. this o.c. life is not the life for me. insulated world, riot out your thoughts. o.c. life is not the life so free. pressure is for real, with artificial joys. for you girls and boys. check you out. you're all [...] fiend"
one fine day,"If I had a perfect day. I would have it start this way. Open up the fridge and have a tall boy. Yeah. Then I'd meet up with my friends. Head out to the game again. We don't even really care who wins. Now excitement seems to grow. When we're hangin' with the bro's. When we're chillin' and we pound a case of Stroh's. Now the game is cool to see. You can ""High 5"" on TV. Count the riot on the one two three. Operation is in sight. And the field is open wide. When you break it then you know you're still alive. If the cops don't make you pay. And you make your getaway. Then you know. That's one fine day. On that day before we're through. We could torch a car or two. Then have ourselves another tall boy. Yeah. Water hoses and batons. That's the real game that's on. I don't really give a shit who wins. I believe it's my god-given right. To destroy everything in my sight. Cause it never gets dull, it never gets old. The only thing it gets is more bold. Drinkin', fightin', going to the game. In our world it's a way to stay sane. If you're asking me. To have it my way, I'd say that's. One fine day."
