debris,"Darling, baby. Don't say maybe. Disobey me, I'll be. Like a bad penny. I twist the truth. I love your youth. You're losing grip. Take a trip, you,. You're going down. Going down. You're going down. Like fallen angels. I will mesmerise. You will paralyse. Framed in your game. Slowly fading. No one knowing. We are through. Count your blessings. Count to eighteen. Souls to perish. For a few stolen dreams only. As we've walked down the alley. On the misty afternoon. No one looked back nor forward. The city walls felt distant. Never at our reach. We're sentenced to your world. You're going down. You're going down. With me. You're going down with me. I will mesmerise. You will paralyse. Like fallen angels."
downfall,"In silence I'm walking through the darkness. Chasing the webs that haunt my mind. Voices are whispering inside my brain. Divine powers are tearing me apart. Demoniac forces with illusive grace. Beyond the truth, the downfall of Curon. Prophecy was fulfilled, eternal dawn. Away is the sun, legacy will be their fall. My dream will become grim reality. The sea and sky will cleanse this town. My lord has spoken, eternal hell. For those who decide to blaspheme. The waves of divinity will purify this village. So come, my children of the lord. Prophecy was fulfilled, eternal dawn. Away is the sun, legacy. This is your downfall. Rise children of the lord. Prophecy was fulfilled, eternal dawn. Away is the sun, legacy... the fall"
eléanor,Underneath the mask you've buried yourself into. It's coal-black. I am tired of the gulping that you do. Every day a new face. What if I unscrew. Your own identity. Wouldn't you guess there's nothing left of you?. The quicksand of life drags us. Down into the circle. One day. we might not catch you. I feel sorry for what you try to do. Breaking others down. to try and to pursue. Your own selfish interests. I am starting to get sick of you. Whatever happened ever since you left. You make yourself and me look like fools
even the spirits are afraid,You think you were earning. Burning the church of your god. You were yearning. Learning the birth of your dirt. Did you think you earned it. Burning your god. That you thought messed up your life?. You spill red. On my cloudy carpet. You think you were earning. Burning the church of your god. You were yearning. Learning the birth of your dirt. Did you think you earned it. Burning your god. That you thought messed up your life?. You spill red. On my cloudy carpet. Your skin turns dust. On my cloudy carpet. You think. You were earning. Burning. Your skin turns dust. No more you were yearning. Burning. Burning. Your skin turns dust. Your skin turns to dust. When holding it close to the sun. And it burns the skin from you're your precious sun. It burns the skin. It burns the skin. It burns the skin
falling up,"With a longing heart you turn the tides and. Say goodbye. With a love that always fades you hold on so tight. Hold back the tears. Legacy that stays so strong is pulling at. Your heart. All the castles that you made are falling apart. Love is waiting here. Come back, in these places. In these places this is all that you need when you. Want to come back. Blowing in the wind a taste of something. Tragically. Comes to find you when you fall and. When you're in need. See beneath the skin. Always waiting is a love that moves. Your pain away. Always waiting will embrace and. Wash the tears away. Places where this begin. Come back, in these places. In these places, this is all that you need when you. Want to come back. You make believe that the world is never going to. Haunt you. (This place is gone). That your love is always going to stay true. What do you see when you fall asleep. (Jesus is longing). That you will want the blood his hands can bleed"
fatigue,It's time to change...
fear the sea,"water travels by itself. inspires us to fear the sea. when it affects our state of mind. we drown in our make believe. those little drops that cover two thirds. eventually there will be nothing left. but water, this water. it rules but even so. it tears apart around us. throws itself high up in the sky."
forgotten,Have you forgotten. All this beauty. Around you?. All your worries. Could easily fade. Behind you. Who is pulling you back. With such strength?. I hear you calling. Your voice is bright. You hear me calling back. After finding. You're always right. You're always right. And i tried. Who is pulling you back. With such strength?. I hear you calling. . (fonte: site oficial)
forgotten reprise,Have you forgotten. All this beauty. Around you?. All your worries. Could easily fade. Behind you. Who is pulling you back?. The end is in all. With such. With her strength. . (fonte: site oficial)
frail (you might as well be me),You lead me. I do need redemption. Whenever I don't know. I feed you balance. We will not rest. Until the search ends. I bleed for you. I voluntarily give myself. I need my fraility. Oh so soon. I will unfold. I bleed for you.
gaya's dream,"[Infatuated by the extensiveness of the universe, it's easy to forget one of the most complex enigmas of this world: The human mind, a universe of it's own.]. Open the gates of the past. With the key to our hearts. Dream of the years gone by. Centuries through mankind's eyes. In the wasteland that grows inside. Within me I shall find myself. Slowly walking, pacing front. See through these blind eyes. Stepping on shadows, touching air. Stones move as I stand still. Seek the answers in the skies. As we don't even know ourselves. Silent, as the sun sets before our eyes. In the wasteland that grows inside. Within me I shall find myself. For years of space technology. Still we haven't learned. Like children we explore. Things we can't yet comprehend. Open the doors of the past. With the beating of a heart. Dream as the years go by. Carrying our own cross. Seek the answers in the skies. As we don't even know ourselves."
gemini i,"On the day that you woke me up. From our dream to your nightmare. I didn't know it was possible to feel so alone being with you. I tried to move, but you glued me to your side,. With all that you gave me. Did you catch the moon together. When I saw the look upon your face. I knew we had lost precious hours through our days. Did her skin feel as soft as you always said. mine are to your fingers?. Did her eyes look as deep into your soul. as you always said mine did. Hunting down all my strength to reveal that. clouds have appeared for regression. I tried to move but you've glued me to. your side with all that you gave me. Will I find my way home. When I saw the look upon your face. I knew we had lost precious hours through our days"
gemini ii,Did her skin feel as soft. as you always said mine are to your fingers?. Did her eyes look as deep into your soul. as you always said mine did?. Did you catch the moon together?. When I saw the look upon your face. I knew we had lost precious hours through our days. On that day that you woke me up. from our dream to your nightmare. I didn't know it was possible to feel so alone being with you. Will I find my way home?. When I saw the look upon your face. I knew we had lost precious hours through our days. When I tried to move aside. I found you've glued me to your side. I knew we had lost precious hours
golden grounds,As the sand. spreads wide open. and the glow of the sun. pearls the skin. All hope is craving fluids. and the yearning to where we've been. Golden grounds. so absorbing. When the heat of the sun. boils the skin. We have to stand the test of nature. to return to where we've been. Hold on my saviour. Keep my heart in holy dimensions. Drag me on your back. for one more day. One more day. One more day. You give. You learn. You live. You learn. I guess what ever you may find. It's all right to eat a piece of your mind. [Anneke van Giersbergen].
great ocean road,It is all there. The earth and the ocean. They contain the power. of our lives. This beautiful city. that surrenders. to the nightfall. Carving the grounds. we walk upon. And the air. We all dare. to ride it somehow. Blue and black is the sky. While tumbling down. Trapped into the freedom. of an aeroplane. Deprived of sleep. we jump into the deep. With no knowledge whatsoever. There is no place. on the face. of this earth. Only silence. is the sound.
heartbeat amplifier,"That poem is not funny. You're just laughing about those words. That describe my feelings, when I am hurt. But I just couldn't resist. to show you those lines. I just gave you a diamond. and you act like that's a crime. And I just got down in my soul. down on my knees. Give my permission to bleed. That look on your face makes it all clear. that my fear is not worth the tears. You have permission to go and die on the. streets where I find the words to ease my. mind that bleeds. I curse the damned who just laugh in you face. Give me permission to rearrange. Just laugh in your face. Drawing blood from people. People that are in pain."
her last flight,"Can't do that, please forget. The things I need, there's more than only to breath. Twisted and dreams, crying and defeat. Love and fear, Buried beneath those facts. Which controle, it's all there. Sent me grief, sent me joy. To become myself, trying to gather the truth. Eternal faith, blame myself. Pleasing the one, from inside. Cause there is where it's at, take my breath. Wet my eyes, turn me inside out and never lie. And if you cry, I'll take the side. That needs in the first place. Be my guest, I will not push. I will not try to take more than you want. Cause what would you have done if the truth. was done wrong. And please forget, we can't have those thing. And please forget, we'll act like we've just met. And please forget, we can do it all over again. Please forget we'll act like we've just met. I don't wanna do it right."
herbal movement,"The fabric softener of the mind. makes everything easy. and we slide down. Slide over, you. The fabric softener of the mind. makes everything lazy. and we dive down"
heroes for ghosts,"(I). Fading falling. Slow winds breaking soundscapes. And waves of velvet sweeping. Into me. You moved all that was in my world. And showed me all the new colours. In my universe where storms run. Falling, falling, falling, fall into me. I hear echoes of my speech. And I see shadows of my walk. I feel the past. I always look backwards. Fighting, floating. Tasting blood in my mouth. Ancient damp painting ruins. Feel the rising chill. I listened to the sound of your airs. We're watching stone saints fall over. While the black crows will be taking to the sky. Falling, falling, falling, fall into me. I hear echoes of my speech. And I see shadows of my walk. I feel the past. I always look backwards. (II). My heart is drifting through all shades of green. My head is thinking through meadows of the sea. Lonely as I am. Expanding the scene where I've never (ever) been. A promise at last to call back the past. To finish off with you - I'm finishing off with you. Sliding down"
home,I gave my life to you. And i have worked so hard. At it too. Would i do anything other. Than to raise you to be. The finest men?. After all this years. Of plough in through the breach. I have turn wise and grey. If ever you followed me. I've lived to see you grow. To be the finest men. I just followed my trail. And i found my way back home. In this life of hell. I wanted to display for you. I will never believe. Alone. In the cornice of this universal sky. Then completion often day pasess me by. As your honesty raises the light. We'll reach your baring heart. I will find the finest men. I just followed my trail. And i found my way back home. In this life of hell. I wanted to display for you. I will never leave you alone. I came in the shove. I will understand this freedom. And remind you of me. Will you pass me on. My pride?. I just followed my trail. And i found my way back home. In this life of hell. I wanted to display for you. I will never review. I found the life have. My way back home. Your lie had. My way back home. . (fonte: site oficial)
i can see four miles,Whatever you do. Whatever you say. Every time I'm here. And every time you're near. Those echoes keeps growing. I shut my eyes. I closed my mouth. Whatever you did. I shut my eyes. I closed my mouth. Unsteady feet on our parkway. Your finger on our door bell. The walls are getting closer in here. The shadow of dependence. Fills the hall with dusty air. Creeping up on my innocence. And the loss of your care
illuminating,Illuminating is what we are. When we will be on the stars. I will feel great. Without my weight. that I would feel. while on the ground. Who would have thought. that we could overcome. such a thing as. protruding the ozone layer. To find new species. on the stars. I will feel great. Without my weight. pulling me down. Would I still feel myself.
in between,"We ride along the great riverside. Ever so wide? the cleaver of clarity. She'll be wise enough to make assumption?. The moment we reach heavenly lands. Heavenly, heavenly. We focus on. We follow fatefuly. Fatefuly, fatefuly. Slowly and surely we'll find our way. Be at the present unexpected life is. All of we wanted. All that we choose to live. We will rise above and all the chances. In between. I tried to move it, you open up your mind. His baring city grounds. Make you never look behind. Gone. Maybe wise enough and you will understand. The moment she reach heavenly land. Heavenly, heavenly. We focus on. We follow fatefuly. Fatefuly, fatefuly. Slowly and surely we'll find our way. Be at the present unexpected life is. All of we wanted. All that we choose to live. We will rise above and all the chances. In between. Strong winds on desert grounds. Release the tendency. And hold it like a cloud. Enlighten and breezing. Hands us strained breeze. If only we understand. Strong winds on desert grounds. Foresee our lives. . (fonte: site oficial)"
in motion # 2,I see him turn away. Although my eyes are shut with emptiness. And again the rain falls down. Together with me. This blood in my body runs for you. Drink my tears as I cry. My heart and my mind crave for you. Drink my tears as I cry. It is sad how the rain falls down. Make me cry in vain. Leave one tear. Touch my face with your sigh. Leave me against the stream. One hundred worlds will see me. Passing by. I see you walk away. Falling down I cry and scream your name. And again the rain falls down. Together with me. My ache is yours as I am. Drink my tears as I cry
in motion #1,Kill me with your thoughts. Use your mind. Hand me over to this world. Into death.... Make me cry in vain. Leave one tear. Touch my face with your sigh. Leave me against the stream. One hundred worlds will see me. Passing by.... . (fonte: site oficial)
in motion #2,I see him turn away. Although my eyes are shut with emptiness. And again the rain falls down. Together with me. This blood in my body runs for you. Drink my tears as I cry. My heart and my mind crave for you. Drink my tears as I cry. It is sad how the rain falls down. Make me cry in vain. Leave one tear. Touch my face with your sigh. Leave me against the stream. A hundred worlds will see me. Passing by.... I see you walk away. Falling down I cry and scream your name. And again the rain falls down. Together with me. My ache is yours as I am. Drink my tears as I cry
in power we entrust the love advocated (cover),"Sail on silver wings. through this storm. what fortune love may bring. back to my arms again. the love of a former golden age.. I am disabled by fears concerning which course to take.. For, now that wheels are turning,. I find my faith deserting me.... This night is filledwith cries of. dispossessed children in search of Paradise.. A sign of unresolve that,. envisioned, drives the pinwheel on-and-on.. I am disabled by fears concerning which course to take.. When memory bears witness to. the innocence, consumed in dying rage!. The way lies through our love;. there can be no other means to the end,. or keys to my heart.... You will never find,. You will never find!"
in sickness and health,"The cruelty of this world persists. The cold wind speaks for our lost. Whispering words, weaving worlds. Her time has come, alas. A man with opened eyes. One stopped out of a dream. With a view held within his mind. The tears for his bride redeem. Watching this world falling apart. Like the dreams in a shallow sleep. Countless are the nights they shared. The mourning in his tears. But morning still has broken. A light in his world of dawn. All beauty turned to rot. His flowers, all are gone. Close the eyes of eternal love. Buries his face in his hands. Her face looks so alive. In the morning sun. But morning still has broken. A light in his world of dawn. All beauty turned to rot. His flowers, all are gone. Dreams are nothing but illusions. Illusions for one to see. It's the visual projection of our inside. And as empty as the heart in me."
jelena,"My friend. She tipped over. Out of childhood into sadness. She’s always shining. But nevertheless. Her beautiful heart is drowned in grief. Sugar horse, lives inside. Like a friend. In need. Far and wide she’ll gaze. Upon the flowers bloom. Jaded, her mind in a daze. From the medicine gloom. They leave her with her friend. A force of nature filled with strength. Sugar horse, lives inside. Like a friend. In need. . (fonte: site oficial)"
kevin's telescope,His hands hide inside a sleeve. and little feet play with the ground beneath him. while up in the sky is where he wants to be. Time will fly. and the wind plays with him. the night will give him its charm. While he walks home. his head's up in a cloud. he feels his pores fill up with fresh air. and there is no doubt. that one day he will be. where the eye of his telescope has already been. Night will pass. but he's a lot faster. no one can do him any harm
king for a day,"In everyone hides a king for a day. Nature's actors, in tragedies we play. But deep bows the head that bears the crown. For the weight of might can always pull us down. Soon my reign will end. I, a king without hands. Soon this day will end. As my tears descend. Everyone has his own dragons to slay. Look in her eyes, never turn away. Soon my reign will end. I, a king without hands. Soon this day will end. As my tears descend. Every treasure you find. And every road you take. Has it's opposite side. Sacrifices to make. Dream on.... Sleep on.... Time is my only fear. An enemy of sand. My dreams are old."
leaves,"I close your eyes with my mouth. Now you don't see anything. But you feel my breath all over. I can feel you too. Although I don't really know you. I don't really care. Cry with me, make my day. Tomorrow all will be gone. All the sweetness and all the fun. No, I don't wanna know.... Although I don't really know you. I don't really care. Now that you're gone i don't know. How to really feel inside. Baring the hope to see you again. I guess I never will. Now that I do really know you. Yes, I really care!. . (fonte: site oficial)"
liberty bell,"No brainwaves or activity. while the craft is in the air. It's getting dark, it's getting light. we are sitting in a chair. We have fastened every belt. we cannot float out of our seats. It's so enormously frightening. When our tail reaches superheat. Another timezone. a change of season. it is turning dark again. We're getting ready for yet. another orbit around our planet. It is time for the galactic cruise. To come to an end. One last view on the world. And the time we have spend. We are sitting in a chair. Sitting in a chair. Sitting in a chair"
life's what you make it,"Baby, life's what you make it. Can't escape it. Baby, yesterday's favorite. Don't you hate it. Everything's all right. Everything's all right. Baby, life's what you make it. Don't backdate it. Baby, don't try to shake it. Beauty is naked. Everything's all right. Everything's all right. Baby, life's what you make it. Celebrate it. Anticipate it. Yesterday's faded. Nothing can change it. Life's what you make it. Everything's all right. Everything's all right"
like fountains,"A scar inside. For such a long time. I'll do it all over again. Can't face the wounds. Have to go on. Stop remembering. Time by time shades reach the surface. A mental breakdown, they provide. Accept, clear up, clean up, go on. and soon I'll show some pride. There's enough to go on further. Don't force to forget. You seem to go on. When you are that strong, and fighting. What ever it takes. your will never breaks, you last and last. and I will be there for you my dear. for you to go on. When you are that strong, and fighting. Till the day I'm done with the shades. The rage I create towards myself, the hate. To claim the blame that I feel. To damage the dreams I need. Facing uncertainty. Facing the truth. Got to get on through. Blaming myself. Blame at last"
locked away,No sense at all. do what you want. you will obey for I will. hunt you. Untill you will be. Locked away (2x). just so what you'll. be scred of me. Behind my power. I will hide all my fears. Right now you are punished. for absolutely nothing. And I feel so good. Because once more. I don't have to be honest. With myself. While you're locked away. Just so that you'll. be scared of me. behind my power. I will hide al my fears
mandylion,Mandylion. in rememberance of Harold Gloudemans.
marooned,I know from a lesser tribe. I suppose the range of my intelligence. is way too wide. And you don't see me. 'cause I don't have much to say. My emotional outlet. is consuming the better part of me. And apart from the wrong words. a tortured cry is making me see. That you don't see me. 'cause I don't have much to say. hours and hours of jealousy. are passing me by. Although hollow silence. is the only wave. going through your brain. And you don't see me
meltdown,It's time to leave - this eerie sound. I cared but failed - the ones I love. I guess its just - what comes around. We try to bend - but then it breaks. What kind of mind - makes these odd shakes. I can't believe - it ends all here. You pull me down. You always failed. You pull me down - I fake a laugh - I sway. You broke my heart ? I fell so hard always. Because of you I'm still afraid today. It's time to leave - this eerie sound. I cared but failed - the ones I love. I guess its just - what comes around. You pull me down. You pull me down - I fake a laugh - I sway. You broke my heart ? I fell so hard always. Because of you I'm still afraid today. Because of you I'm still afraid today. I will not give you what you think that you earn from me. I will not make the same mistakes you always made. I tried to show you that I cared although you always failed. I was too young to have known better - better than you. You could have kept all those stories to your self. I tried to show you that I cared although you always failed. I was too young to have known better - better than you
miniature,I know the stories. Of undersea lights. It all seems so clear to me. From this astounding aerial view. I start to wonder. More about you. And your dreams. I'll follow each step you take. As I want to know your secrets too. Under the shelter of this evening sky. We can dream further than we ever thought aloud. It's always more simple than it seems. Tell me your story and I'll tell you mine. You'll find no more boundaries when you realize that love. Can overpower everything. Tell me your secret and I'll tell you mine. With every word you'll see there's no more need to hide. Our love can overpower everything. I know the secret of the stars with all their beauty and all their light. They just want to feel what we feel. Tell me your story and I'll tell you mine. Tell me your secret and I'll tell you mine
missing seasons,"I slide around on silver wings. I long for air as I strive for solid grounds. This space I have coloured with life and faith. These smiles and tears I've gathered from joy and rage. Hear the rain. Fear the shame. I feel the pain. See the rain. Am I insane. Am I to blame. I feel my thoughts go everywhere. Hung up on walls. Tuning in and fading out. This space I've coloured with life and faith,. These smiles and tears I've gathered from joy and rage. I see you tried. To say goodbye. I just sighed. You denied. To save your pride. You just lied. I hear your voice calling. I see your faith falling. This space I've coloured with life and pain,. These tears and smiles I've gathered from joy and rain"
monsters,"All you need all you need. All you need. Is all is now. All you need all you need. All you need. Is not what you're getting. All you live all you give. All you live. Fits in a teardrop. If you come closer. I'll show you how it feels. All you need all you need. All you need. Is all is now. All you live all you give. All you live. Fits in a teardrop. Give what's worth remembering. Give what's worth dying. Give it al. Oh, back for more. You just give it all. Oh, back for more. If you come closer. I'll show you how it feels. High is high. Low is low. Love is gone. The best ones are the first to. If you come closer. I'll show you how it feels. High is high. Low is low. Love is gone. [Zlaya Hadzich]."
morphia's waltz,"I see your eyes. Blue and wide open. Take your time. my divine creature. My arms will provide. undivided attention. Sleep, child sleep. rest your eyes. until the sun comes up. and you'll awake. to light, everyones day. up again. Rest your head. in my lap, honey. The day I wept. is when I had you my love. Sleep, child sleep. rest your eyes. until the sun comes up. and you'll awake. to light everyones day."
