the kids aren't alright,"When we were young the future was so bright (oh oh). The old neighborhood was so alive (oh oh). And every kid on the whole damn street (oh oh). Was gonna make it big and not be beat. Now the neighborhood's cracked and torn (oh oh). The kids are grown up but their lives are worn (oh oh). How can one little street. Swallow so many lives. Chances thrown. Nothing's free. Longing for what used to be. Still it's hard. Hard to see. Fragile lives, shattered dreams. Jamie had a chance, well she really did. Instead she dropped out and had a couple of kids. Mark still lives at home cause he's got no job. He just plays guitar and smokes a lot of pot. Jay committed suicide. Brandon OD'd and died. What the hell is going on. The cruelest dream, reality. Chances thrown. Nothing's free. Longing for what used to be. Still it's hard. Hard to see. Fragile lives, shattered dreams. Chances thrown. Nothing's free. Longing for what, used to be?. Still it's hard. Hard to see. Fragile lives, shattered dreams"
why don't you get a job?,"My friend's got a girlfriend. Man he hates that bitch. He tells me every day. He says ""man I really gotta lose my chick. In the worst kind of way"". She sits on her ass. He works his hands to the bone. To give her money every payday. But she wants more dinero just to stay at home. Well my friend. You gotta say. I won't pay, I won't pay ya, no way. nana Why don't you get a job. Say no way, say no way ya, no way. Tell me why don't you get a job?. I guess all his money, well it isn't enough. To keep her bill collectors at bay. I guess all his money, well it isn't enough. Cause that girl's got expensive taste. I won't pay, I won't pay ya, no way. nana Why don't you get a job?. Say no way, say no way ya, no way. Tell me why don't you get a job?. Well I guess it ain't easy doing nothing at all. But hey man free rides just don't come along. every day. Let me tell you about my other friend now. My friend's got a boyfriend, man she hates that dick. She tells me every day. He wants more dinero just to stay at home. Well my friend. You gotta say. I won't pay, I won't pay ya, no way. nana Why don't you get a job?. Say no way, say no way ya, no way. Tell me why don't you get a job?. I won't give, give me your money. I always pay. nana Why don't you get a job?. Say no way, say no way ya, no way. nana Why don't you get a job?"
pretty fly (for a white guy),"Give it to me baby, a-ha, a-ha!. Give it to me baby, a-ha, a-ha!. Give it to me baby, a-ha, a-ha!. And all the girls say I'm pretty fly (for a white guy). Uno, dos, tres, cuatro, cinco, cinco, seis. You know it's kind of hard just to get along today. Our subject isn't cool but he fakes it anyway. He may not have a clue, and he may not have style. But everything he lacks, well, he makes up in denial. So don't debate, play it straight. You know he really doesn't get it anyway. He's gonna play the field, and keep it real. For you no way, for you no way. So if you don't rate, just overcompensate. At least you'll know you can always go on Ricki Lake. The world needs wannabes. So hey, hey do that brand new thing. Give it to me baby, a-ha, a-ha!. Give it to me baby, a-ha, a-ha!. Give it to me baby, a-ha, a-ha!. And all the girls say I'm pretty fly (for a white guy). He needs some cool tunes, not just any will suffice. But they didn't have Ice Cube so he bought Vanilla Ice. Now cruising in his Pinto he sees homies as he pass. But if he looks twice they're gonna kick his lily ass. So don't debate, a player straight. You know he really doesn't get it anyway. He's gonna play the field, and keep it real. For you no way, for you no way. So if you don't rate, just overcompensate. At least you'll know you can always go on Ricki Lake. The world loves wannabes. So hey, hey do that brand new thing. Now he's getting a tattoo, yeah, he's gettin' ink done. He asked for a ""13"" but they drew a ""31"". Friends say he's trying too hard. And he's not quite hip. But in his own mind, he's the, he's the dopest trip. Give it to me baby, a-ha, a-ha!. Give it to me baby, a-ha, a-ha!. Give it to me baby, a-ha, a-ha!. Uno, dos, tres, cuatro, cinco, cinco, seis. So don't debate, a player straight. You know he really doesn't get it anyway. He's gonna play the field, and keep it real. For you no way, for you no way. So if you don't rate, just overcompensate. At least you'll know you can always go on Ricki Lake. The world needs wannabes. The world loves wannabes. So let's get some more wannabes. And hey, hey do that brand new thing!"
"you're gonna go far, kid","Show me how to lie. You're getting better all the time. And turning all against the one. Is an art that's hard to teach. Another clever word. Sets off an unsuspecting herd. And as you step back into line. A mob jumps to their feet. Now dance, fucker, dance. Man, he never had a chance. And no one even knew. It was really only you. And now you steal away. Take him out today. Nice work you did. You're gonna go far, kid. With a thousand lies. And a good disguise. Hit 'em right between the eyes. Hit 'em right between the eyes. When you walk away. Nothing more to say. See the lightning in your eyes. See 'em running for their lives. Slowly out of line. And drifting closer in your sights. So play it out I'm wide awake. It's a scene about me. There's something in your way. And now someone is gonna pay. And if you can't get what you want. Well it's all because of me. Now dance, fucker, dance. Man, I never had a chance. And no one even knew. It was really only you. And now you'll lead the way. Show the light of day. Nice work you did. You're gonna go far, kid. Trust, deceived!. With a thousand lies. And a good disguise. Hit 'em right between the eyes. Hit 'em right between the eyes. When you walk away. Nothing more to say. See the lightning in your eyes. See 'em running for their lives. Now dance, fucker, dance. He never had a chance. And no one even knew. It was really only you. So dance, fucker, dance. I never had a chance. It was really only you. With a thousand lies. And a good disguise. Hit 'em right between the eyes. Hit 'em right between the eyes. When you walk away. Nothing more to say. See the lightning in your eyes. See 'em running for their lives. Clever alibis. Lord of the flies. Hit 'em right between the eyes. Hit 'em right between the eyes. When you walk away. Nothing more to say. See the lightning in your eyes. See 'em running for their lives"
self esteem,"La, la, la, la, la, la, la, la, la, la. I wrote her off for the tenth time today. And practiced all the things I would say. But she came over, I lost my nerve. I took her back and made her dessert. Now I know I'm being used. That's okay, man, cause I like the abuse. I know she's playing with me. But that's ok cause I got no self esteem. We make plans to go out at night. I wait till 2 then I turn out the light. All this rejection's got me so low. If she keeps it up I just might tell her so. When she's saying, oh, that she wants only me. Then I wonder why she sleeps with my friends. When she's saying, oh, that I'm like a disease. Then I wonder how much more I can spend. Well I guess, I should stick up for myself. But I really think it's better this way. The more you suffer, the more it shows you really care. Right? Yeah!. Now I'll relate to this little bit. That happens more than I'd like to admit. Late at night she knocks on my door. She's drunk again and looking to score. Now I know I should say no. But it's kind of hard when she's ready to go. I may be dumb, but I'm not a dweeb. I'm just a sucker with no self esteem. When she's saying, oh, that she wants only me. Then I wonder why she sleeps with my friends. When she's saying, oh, that I'm like a disease. Then I wonder how much more I can spend. Well I guess, I should stick up for myself. But I really think it's better this way. The more you suffer, the more it shows you really care. Right? Yeah!"
come out and play,"You gotta keep 'em separated. Like the latest fashion. Like a spreading disease. The kids are strappin' on the way to the classroom. Getting weapons with the greatest of ease. The gangs stake out their own campus locale. And if they catch ya slippin' then it's all over pal. If one guy's colors and the other's don't mix. They're gonna bash it up, bash it up, bash it up, bash it up. Hey! Man you talking back to me?. Take him out (You gotta keep 'em separated). Hey! Man you disrespecting me?. Take him out (You gotta keep 'em separated). Hey! Don't pay no mind. You're under 18 you won't be doin' any time. Hey! Come out and play!. By the time you hear the siren. It's already too late. One goes to the morgue and the other to jail. One got wasted and the other's a waste. It goes down the same like the thousand before. No one's gettin' smarter no one's learnin' the score. Your never-ending spree of death and violence and hate. Is gonna tie your own rope, tie your own rope, tie your own. Hey! Man you disrespecting me?. Take him out (You gotta keep 'em separated). Hey! Man you talking back to me?. Take him out (You gotta keep 'em separated). Hey! Don't pay no mind. You're under 18 you won't be doin' any time. Hey! Come out and play!. It goes down the same like the thousand before. No one's gettin' smarter no one's learnin' the score. Your never-ending spree of death and violence and hate. Is gonna tie your own rope, tie your own rope, tie your own"
want you bad,"If you could only read my mind. You would know that things between us. Ain't right. I know your arms are open wide. But you're a little on the straight side. I can't lie. Your one vice. Is you're too nice. Come around now. Can't you see?. I want you. All tattooed. I want you bad. Complete me. Mistreat me. I want you to be bad bad bad bad bad. If you could only read my mind. You would know that I've been waiting. So long. For someone almost just like you. But with attitude, I'm waiting So come on. Get out of clothes time. Grow out those highlights. Come around now. Can't you see?. I want you. In a vinyl suit. I want you bad. Complicated. X-rated. I want you bad bad bad bad bad... bad. Don't get me wrong. I know you're only being good. But that's what's wrong. I guess I just misunderstood. I want you. All tattooed. I want you bad. Complicated. X- rated. I want you bad. I mean it. I need it. I want you bad bad bad bad bad...bad. really really bad"
gone away,"Maybe in another life. I could find you there. Pulled away before your time. I can't deal it's so unfair. And it feels. Yeah it feels like. heaven's so far away. And it feels. Yeah it feels like. the world has grown cold. Now that you've gone away. Leaving flowers on your grave. Show that I still care. (But) black roses and hail marys. Can't bring back what's taken from me. I reach to the sky. And call out your name. and if I could trade. I would. And it feels. And it feels like. Heaven's so far away. And it stings. Yeah it stings now. (The) world is so cold. Now that you've gone away. Gone away, gone away, yeah yeah yeah yeah yeah. Ouuhhh, ouhhh, ouhh yeah. I'll save your soul. woah woah. I reach to the sky. And call out your name. oh please let me trade. I would. And it feels. And it feels like. Heaven's so far away. And it feels. Yeah it feels like. (The) world is so cold. Now that you've gone away. Gone away, gone away, yeah yeah yeah yeah yeah. Ouuhhh, ouhhh, ouhh ohh oh yeah"
hit that,"The winds of fortune. Don´t blow the same. She had to get out. And make a change. She had a kid now. But much too young. Their baby daddy's. Out having fun. He's sayin' 'Now I´m on a roll. With all the girls I know'. His baby mama. She aint so slow. He's sayin' 'Now I´m on a roll. With all the girls I know'. I know you wanna Hit That. I know you wanna Hit That, Hit That. All of the world is getting with i say. Consequences are a lot but, hey. That´s the way. That´s the way things go. What was a family. Is now a shell. We´re raising kids now. Who raise themselves. Sex is a weapon. It´s like a drug. It gets around until. That crowd will eat you up. She's sayin' 'Now I´m on a run. I´m chasing guys for fun'. My baby daddy. It aint his only one. She's sayin' 'Now I´m on a run. I´m chasing guys for fun'. I know you wanna Hit That. I know you wanna Hit That, Hit That. Hey everybody´s getting with i say. Consequences are a lot but, hey. That´s the way. That´s the way things go. When the winds up. Broken up, really such a shame. But why not?. Take a chance, everything´s a game. And it don't stop. Hooking up, nothing´s gonna change. Well, the more he´s tryin'. The more he's buyin'. He says 'Now I´m on a roll. With all the girls I know'. His baby mama. Don´t need to know. He's sayin' 'Now I´m on a roll. With all the girls I know'. I know you wanna Hit That. I know you wanna Hit That, Hit That. All of the world is getting with i say. Consequences are allright but, hey. That´s the way. That´s the way things go. . Por Léo"
all i want,"ya, ya, ya, ya, ya. Day after day. Your hole life's a wreck. The powers that be just breathe down your neck. You get no respect. You get no relief. You gotta speak up and yell out your peace. Chorus:. So back off your rules. Back off your jive. Cause I'm sick of not living. To stay alive. Leave me alone. I'm not asking a lot. I just don't want be controlled. It's all I want. It's all I want. It's all I want. It's all I want. ya, ya, ya, ya, ya. How many times is it gonna take. Till someone around you hears what you say. You've tried being cool. You feel like a lie. You've played by their rules. Now it's their turn to try. Chorus. I said it before. I'll say it again. If you could just listen. then it might make sense. Chorus. Ya, Ya, Ya, Ya, Ya"
she's got issues,"I'm seeing this girl, and she just might be out of her mind. Well she's got baggage and it's all the emotional kind. She talks about closure and that validation bit. I don't mean to be insensitive, but I really hate that shit. And I say yeah yeah. Oh man she's got issues. And I'm gonna pay. Yeah yeah. She thinks she's the victim. Yeah. Now I know she'll feel abandoned. If I don't stay over late. And I know she's afraid to commit. But it's only our second date. And I say yeah yeah. Oh man she's got issues. And I'm gonna pay. Yeah yeah. She thinks she's the victim. and she takes it all out on me. I don't know why you're messed up. I don't know why your whole life is a chore. Just do me a favor. And check your baggage at the door. Now she talks about her ex nonstop, but I don't mind. But when she calls out his name in bed. That's where I draw the line. You told me a hundred times how your father left and he's gone. But I wish you wouldn't call me daddy. When we're gettin' it on. And I say yeah yeah. Oh man she's got issues. And I'm gonna pay. Yeah yeah. She's playing the victim. And taking it all out on me. My god she's got issues. And I'm gonna pay gonna pay gonna pay gonna pay gonna pay gonna pay. If you think I'm controlling. Then why do you follow me around. If you're not co-dependent. Then why do you let others drag you down. I don't know why you're messed up. I don't know why your whole life is a chore. Just do me a favor. And check your baggage at the door"
americana,"Well I'd like to tell you all about my dream it's a place. Where stripmalls abound and diversion's mere moments away. Where culture's defined. By the one's least refined. And you'll be left behind. If you don't fit in. It's all distorted. In americana my way. Well fuck you. Well my dream has come true. My vision has come true. Now give me my cable, fast food, four-by's, tat's right. away. I want it right now cause my generation don't like to wait. My future's determined by. Thieves, thugs, and vermin. It's quite an excursion. But it's okay. Everything's backwards. In americana my way. Well fuck you. Well my dream has come true. My vision has come true. Yeah, it's all coming true. I'm a product. Of my environment. So don't blame me, i just work here. But I wanna fuck you. My rights are denied by. Those least qualified. Trading profit for pride. But it's okay. Everything's backwards. In americana my way. Well fuck you. My nightmare has come true. My nightmare has come true. Yeah, it's all coming true"
original prankster,"You can do it!. Until the break up time. Life, Life, cannot go by the letter. Time Time, Prozac can make it better. Noise, Noise, any kind will do. Can you feel it slip away, when it's all on you. Crime, crime, rockin' like Janet Reno. Time, Time, 18 and life in Chino. Freud, Freud, all along its true. Well you see the common day catches up to you yeah!. CHORUS:. Knock down the walls. Its alive in you. Knock down the place. You alone it's true. Knock down the world. Its alive in you. You're gonna keep your head up through it all. You're gonna bust out ohh!. Original Prankster. Break out yeah!. Original yeah. Bust out ohh!. Original Prankster. You'll never stop now, stop now. That's what the main men say. You can do it!. You know it smells like shit, Goddamn!. Tag team, the double header. Son of Sam, fire always makes it better. Navigate with style and abplom. Cuz' wherever you're at that's the trip you's on. Lies, lies, says hes down at the Bahamas. Tries, tries, bang you little hoochie mammas. No way, none of this is true. When you see there'll come a day when the joke's on you yeah!. CHORUS. Hey!. You can do it!. Time, time, so good to see ya. Nine, nine, dont wanna be ya. Dime, dime, so good to see ya. Nine, nine, dont wanna be ya. Crime, crime, fine sensamilla. Crime, crime, fine sensamilla. Crime, crime, fine sensamilla. You'll see the common day catching up to you. CHORUS"
bad habit,"Hey man you know I'm really ok .. The gun in my hand will tell you the same .. But when i'm in my car, don't give me no crap,. 'Cause the slightest thing and just might snap .. When I go driving I stay in my lane .. But getting cut off- it makes me insane .. Open up the glove box,. Reach inside,. I'm gonna wreck this fuckers ride,. 'Cause I got a bad habit .. Of blowin' away,. Yeah, Yeah. I got a bad habit,. Yeah, Yeah. And it 'aint goin' away,. Yeah, Yeah---. Ohh Ohh Ooh ohh. Well they say the road's a dangerous place .. If you flip me off I'll get in your face .. You drive on my ass,. Your foot's on the gas,. And your next breath is your last-. 'Cause I got a bad habit. Of blowin' away,. Yeah, Yeah. I got a bad habit,. Yeah, Yeah. And it 'aint goin' away,. Yeah, Yeah---. Ohh Ohh Ooh ohh. Drivers are rude,. Such attitudes,. But when i show my piece-,. Complaints cease, Something's odd,. I feel like I'm God,. You stupid dumb-shit god-damn motherfucker. Open up the glove box,. Reach inside,. I'm gonna wreck this fuckers ride,. 'Cause I got a bad habit,. Of blowin' away,. Yeah, Yeah. I got a bad habit,. Yeah, Yeah. And it 'aint goin' away,. Yeah, Yeah---. Ohh Ohh Ooh ohh"
staring at the sun,"Maybe life is like a ride on a freeway. Dodging bullets while you're trying to find your way. Everyone's around, but no one does a damn thing. It brings me down, but I won't let them. If I seem bleak. Well you'd be correct. And if I don't speak. It's cause I can't disconnect. But I won't be burned by the reflection. Of the fire in your eyes. As you're staring at the sun. howooowoow. As you're staring at the sun. howooowoow. As you're staring at the sun. howooowoow. As you're staring at the sun. As you're staring at the sun!. HEY!. When I ran I didn't feel like a runaway. HEY!. When I escaped I didn't feel like I got away. HEY!. There's more to living than only surviving. Maybe I'm not there, but I'm still trying. Don't you hear me ?. I don't think that you relate. My will is something. That you can't confiscate. So forgive me, but I won't be frustrated. By destruction in your eyes. As you're staring at the sun. howooowoow. As you're staring at the sun. howooowoow. HEY!. When I ran I didn't feel like a runaway. HEY!. When I escaped I didn't feel like I got away. HEY!. There's more to living than only surviving. Maybe I'm not there, but I'm still trying. Though you hear me. I don't think that you relate. My will is something. That you can't confiscate. So forgive me, but I won't be frustrated. By destruction in your eyes. As you're staring at the sun. howooowoow. As you're staring at the sun. howooowoow. HEY!. Maybe life is like a ride on a freeway. HEY!. Dodging bullets while you're trying to find your way. HEY!. Everyone's around, but no one does a damn thing. It brings me down, but I won't let them. If I seem bleak. Well you'd be correct. And if I don't speak. It's cause I can't disconnect. But I won't be burned by the reflection. Of the fire in your eyes. As you're staring at the sun. howooowoow. As you're staring at the sun. howooowoow. As you're staring at the sun. howooowoow. As you're staring at the sun. As you're staring at the sun!"
gotta get away,"I'm gettin Edgy. All the time.. There's someone around me. Just a step behind.. It's kinda scary,. The shape I'm in.. The walls are shakin'. And they're closing in.. Too fast or. A bit too slow. I'm paranoid of people. And it's starting to show.. There's one guy that. I just can't shake. Over my shoulder. Is a big mistake.. Sitting on the bed. or lying wide awake.. There's demons in my head. And it's more than I can take.. I think I'm on a roll. But I think it's kinda weak.. Saying all I know is. I gotta get away from me. I tell you something. Just ain't right.. My head is on loose. But my shoes are tight.. Avoiding friends 'cause. They all bug.. Life is like a riddle. And I'm really stumped.. If you reason,. Don't you know. Your own preoccupation. Is where you'll go.. I think I'm being followed,. I look around. It's only my shadow. Creeping on the ground.."
(can't get my) head around you,"Deep inside your soul, there's a hole. You don't want to see. Every single day, what you say. Makes no sense to me. Even though I try. I can't get my head around you. Somewhere in the night, there's a light. In front of me. Heaven up above, with a shove. Abandons me. And even though I try. I fall in the river of you. You manage to bring me down too. All your faking,get up,get up,get up,get up. Shows you're aching,get up,get up,get up. Every single day, what you say. Makes no sense to me. Letting you inside isn't right. Cause you'll mess with me. I never really know. What's really going on inside you. I can't get my head around you. All your feeding, get up,get up, get up,get up. Shows you're bleeding,get up, get up,get up. Deep inside your soul, there's a hole. You don't want to see. You're covering it up, like a cut. With the likes of me. You know I've really tried. I can't do anymore about you. Yeah!. The cut's getting deeper. The hill's getting steeper. I guess I'll never know. What's really going on inside you. I can't get my head around you"
half-truism,"One is for envy and one just for spite. The cuts in my heart, they show in your eyes. Don't make it better. The twisting knife turns a blind self onto someone else. By self-liberation we'll leave this behind. Beyond swings and errors they ain't on our mind. To make it better, shake it off. It never mattered anyway. If we don't make it alive. Well, it's a hell of a good day to die. All our light that shines strong. Only last for so long. And it's ashes to ashes again. Should we even try to pretend?. All our light that shines strong. Only last for so long. The banner you're waving is burning in red. It's blocking the sunlight that shines overhead. You against the world, diamonds and pearls. Voices inside you churn: watch the city burn. Your own liberation will leave them behind. All mistakes and errors they ain't on your mind. Don't make it better 'cause. It never mattered anyway. If we don't make it alive. Well, it's a hell of a good day to die. All our light that shines strong. Only last for so long. And it's ashes to ashes again. Should we even try to pretend?. All our light that shines strong. Only last for so long. I won't calm down. The banner you're waving is burning in red. You against the world, diamonds and pearls. It never mattered anyway. If we don't make it alive. Well, it's a hell of a good day to die. All our light that shines strong. Only last for so long. And it's ashes to ashes again. Should we even try to pretend?. All our light that shines strong. Only last for so long"
"kristy, are you doing okay?","There's a moment in time. And it's stuck in my mind. Way back, when we were just kids. Cause your eyes told the tale. Of an act of betrayal. I knew that somebody did. Oh, waves of time. Seem to wash away. The scenes of our crimes. for you this never ends. Can you stay strong?. Can you go on?. Kristy are you doing okay?. A rose that won't bloom. Winter's kept you. Don't waste your whole life trying. To get back what was taken away. Though the marks on your dress. Had been neatly repressed. I knew that something was wrong. And I should have spoke out. And I'm so sorry now. I didn't know. Cause we were so young. Oh, clouds of time. Seem to rain on. Innocence left behind. And it never goes away. Can you stay strong?. Can you go on?. Kristy are you doing okay?. A rose that won't bloom. Winter's kept you. Don't waste your whole life trying. To get back what was taken away"
