nolan ryan,"I don't mean to be greedy or steal your moment. But sometimes I just got to rap circles around motherfuckers. It's hoodie baby!. Okay I don't really mean to be superficial. Don't wanna talk about the women and the money I got. But getting beautiful women is not the issue. 'Cause the women only coming when the money is hot. I'd rather be living my dreams than be living a lie. Homie everywhere you going you be killing the vibe. It's like you walk in the room and the people get quiet. We ain't talking 'bout you we just wanna be private. My shit's fly like a personal jet, I'm earning. Respect from every single person I met. You always looking in the mirror, you should learn to reflect. You old news, all we rap about it is current events. So if you started having doubts about your relevance. Change your name to my name for the hell of it. So you can reap the benefits of being fucking jealous. I'm the only one in the damn room like an elephant. Haha, everyone else is quiet. You understand?. Let's go. Tell me I'm fire, I'm better than that. Say I'm a liar, I never been that. Homie keep trying. Your wallet is on a permanent diet, it's never been fat. That shit is science. My shit apply every to motherfucker out there who try. You should retire. Blame it on tommy, and cry to your mommy, you never been fly. Rappers pretending it's all black and white. But I ain't got time for that clean shit. Oh, you'd rather be james dean?. I'd rather be me bitch. I'm just being honest. You don't usually wear those big ass glasses. The internet's forever. I'm talking this and that, this and that. Identical twins, homie, that's a sister act. You like riff and raff, but that's piss and trash. I'm at the top of the game like aristocrats. Got a vision and I'm gonna finish it. Watch all these haters go beg for their innocence. You talking shit there will be no forgiveness. Writing in permanent ink on the internet. Swallow your words never assume. People keep talking 'cause that's what they do. As long as they talking 'bout me and not talking 'bout you. Let's let the talking resume. Let's just assume you jealous of me, though. No necesito amigos, I'm all on my own like a free throw. 'Bout to make white girl money with burritos. (Shouts to chipotle, shouts to chipotle). Shit's so hot that you got to rewind it. New york city's finest on the diamond. I'm nolan ryan when I wind up. You strike out, and I'm making hits without even trying. There's no denying, I'm making noise like a siren. Every hungry motherfucker want a little piece. Fall back homie when I kill it on the beat. Got a shorty in the west and wifey in the east. Bitches just visit me after my shows. All of their clothes go invisibly, just like a cloak. Homie you're talking that wizardry. Best rapper out there, I mean that shit literally. (Let me finish). You got costco raps, I'm a commodity. These people buy my songs, wear my clothes. Come to shows, go online, and follow me. That's first team, bitch. Hoodie"
numbers,"Good girl, good girl. Can I get you inna my world, my world?. Wait another minute, let me clean up. Fresh in my adidas. Greet you at the door before we meet up. Thinking I'mma figure it out. I'm livin' it now, I'm multiplicatin', I'm playin' it loud. I take the remainder of everything that we've been doing. Until you belittle it down. But fuck it, cause if we end up bein' lonely. I know I can count on all my homies. So we goin' from one, these were the days that we had to run. Tell them to play and they get their gun. And if they shoot down the sky, they all run and hide. But I'll be here waitin' for all of my friends who were by my side. And when it ends it was you and I, why can't we all win together?. All these lucky numbers, they're never discovered. Just one in a million. These lucky numbers show what we're made of. We're scratching the paper. No it's never paid off, but my number will come. Bad girl, bad girl. Can I get you inna my world, my world?. Wait another minute let me wake up. Get some weed to break up. And I don't even smoke on most occasions. I been thinking about. Crushing some pills, taking them down. Get us some drinks and making the rounds. Do anything just to get your attention. I'll even go home and be eating you out. Fuck it, you know I'm kidding about it mostly. Only thing I count on is my homies. So we goin' from one, these were the days that we had to run. Tell them to play and they get their gun. And if they shoot down the sky, they all run and hide. But I'll be here waitin' for all of my friends who were by my side. And when it ends it was you and I, why can't we all win together?. All these lucky numbers, they're never discovered. Just one in a million. These lucky numbers show what we're made of. We're scratching the paper. No it's never paid off, but my number will come. And you can be the one for me when the other numbers aren't adding up. I've been thinking about you, thinking about you. And we can be like two digits, cause ain't no one equivalent to you. Imma hit it like ooh, hit it like ooh. All these lucky numbers, they're never discovered. Just one in a million. These lucky numbers show what we're made of. We're scratching the paper. No it's never paid off, but my number will come"
overtime,"Yo, outside her brooklyn apartment. She got a new crew now and I ain't part of it. Tattoo on her wrists, so the scars are hid. And I ain't trying to lose you like an argument. Fuck beef and everybody who started it. Walk in to the bar and they card the kid. Good, cause I'm twenty-five, but I only look twenty. I'm trying to survive in this world that we live in. There's truth and there's lies and not every decision you choose can rewind. You might blink in a moment and this shit be over. I'm fucking it up if I'm living inside. Wasting my time on the internet. This job never ends, nowadays. It's the only way we earning respect. It's hard to leave when we're earning a check. Working them late nights, every night. Motivation, super high. Double shift it, over drive. Make that money, multiply. Oh lord not this, walking home I wanna quit. But I stick around for the benefits. Clocking in that overtime, clocking in that overtime. Clocking in that overtime, clocking in that overtime. And I'm getting paid for it, paid for it, overtime. I'm pushing back when push comes to shove. Deep down, wondering why they ain't pushing us. I got friends with deals, I got friends who front. But just keep it real, cause who gives a fuck. If I was pusha t, I might push a brick. Working 24 7 just to push my shit. Cause if I slip, there'll be twenty other rappers, quick. Trying to fit in my shoes, but my feet just too big. I can't relax, I can't even sit back. With my girl on my bed, got my face to my mac. And I know she act disappointed in that. But how the fuck we gonna blow off a rap. So I stay grounded, never catch an ego. As far as we go, [?]. Love all my fans, without you, where would I be though?. Where would I be though?. Working them late nights, every night. Motivation, super high. Double shift it, over drive. Make that money, multiply. Oh lord not this, walking home I wanna quit. But I stick around for the benefits. Clocking in that overtime, clocking in that overtime. Clocking in that overtime, clocking in that overtime. And I'm getting paid for it, paid for it, overtime. Could it be so easy, well don't believe me. Cause you know good things take time. And please don't leave me, cause I need you with me. And there ain't no shortcuts left in this life. And the great things take love, love. And the great things take love, love. And the great things take love, love. And the great things take love, love, love. Are you putting in work?. Working them late nights, every night. Motivation, super high. Double shift it, over drive. Make that money, multiply. Oh lord not this, walking home I wanna quit. But I stick around for the benefits. Clocking in that overtime, clocking in that overtime. Clocking in that overtime, clocking in that overtime. And I'm getting paid for it, paid for it, overtime"
passing me by in '09 (feat. illustrate),"Passin' Me By 2009 right. It's Hoodie, Illa, Pharcyde. Yeah we about to kill it. [Verse 1: Hoodie Allen]. Now in my younger days I used to sport a shag. When I went to school I carried lunch in a bag. Wack, my backpack bigger than my body was. My Spanish teacher always telling me to adios. Out of the class cause I couldn't keep from talking. I my converse kicks, they lighting up when I was walking. To the principals office, I'm nauseous. Then I saw this pretty little thing and she was gorgeous. Had to make a move I was on this. So very nice to meet you. She told me she was new to school. I came at her like ""me too"". And that was just a lie for the hell of it. Plus we're at the age where the breasts are developing. So I say whatever just to relish in the moment that we had. Cause it's sad, the day I took her over to my pad. She met friend Chad and that's a terrible mistake. Cause the second that I turned around he asked her for a date. Like wait, hold up, now way. [Hook:]. She keeps on passing me by. (Never the less, I'll say it again). [Verse 2: Hoodie Allen]. And when I dream of something good. I think of me and Allie. Cause she was from the hood. But when she spoke it's like the valley. And no we're not in Cali. But like how was I to judge her. When the way that she flirted. Made me think I'm gonna fuck her. She was like no other. I just hope that she can see me. When the other though of me. As their little brother, Stevie. I'm the youngest in the class. So I'm her youngest suitor. And then she came right up to me. And said she need a tutor. All I could do is stare. Which had a project for the class. But I swear I didn't care. Now she had a bone to pick. But I swear that I was over it. I'm hoping it will happen. But I think I need a prayer. To get the Ugg boots off her feet and the tights. And then the cut-off shoulder hoodie, it'll be over tonight. Although it's getting real late, I made a move to her zone. Cause I won't have to hear about her go and taking me home. I said ""I get my learner's permit soon, I'm passing my road test"". And she was trying to block it when she thinkin' she knows best. Oh yes, I could tell we wanted the same. Except she wanted my brain. And I just wanted some brains. Oh my bad, it must've been a miscommunication. She said ""when you get older kid, damned if I'd be waiting"". So now I'm always skating, that day me an asshole. So now when girlies come on by, I'm telling them to pass low. [Hook]. Woo! It's Illustrate, what?. It's Illustrate or Hoodie Allen. Here we, here we, here we, here we, here we go!. [Verse 3: Illustrate]. They keep on passin' me by askin' why. I said but don't say Konichiwa. Now you see why. I can't but help but break a sweat over these divas. Jesus, help me when my speech flutters into a deep smother. Peep how much I lover but still than I'd say I fuck her. Got little game man, I'm dressing very basic. This one girl compared my attitude to Larry David. She incurred my first try, thought I learned my lesson. But her style so fly, that I wrote in instant message. My dear, my dear, my dear, my dear, you will not blow me. But you show me very well you would delve right into me. If I was G, but now you see, I'm not into any of that shit. I though that she was a queen, but now I see that she's a. I wish that I was farsighted like Pharcyde. Never been a smart guy, I'll deny these bizarre rides. Cause girls talk trash, love only the cash. Got no class so I had to let her pass. [Hook. Keeps passin' me by. She keeps passin' me by. [x3]"
people keep talking,"I'm gonna talk when I wanna talk. I don't need the long distance to plan this shit. Did it on my own with no management. Must be why nobody can manage him. A&r's always want to take advantages. Find a poor kid, sell him on a fantasy. But I've always been way above the average. That's why nobody else can compare to me. Other rappers don't offend me. Cause I got more drive than a bentley. In the driveway with a hemmy, dream girl rossum. I'm just tryna get an emmy. Fuck that, I just wanna get a grammy. Then add three more for my family. Got a plan but I never had a plan b. If you think you'll fail then you might as well drive in a camry. And I may never get the cover of that rolling stone. Didn't fit the vibe they were going for. But it's xxl, but I couldn't excel. They said we really don't get it but we're wishing you well. Oh well, lol, ain't got time for no print. Fame come and go when you rhyming so shit. Ain't gotta sign on no dotted line. But if I do, fuck you for criticizing. When I pick up the phone, they don't even call back. They just leave me a voicemail. They gon' tell you you changed and shit ain't the same. Like this shit was a choice, hell. My haters are kicking the bucket. It must have been hard to be wrong all along. But isn't it love when they memorize every damn word of your song?. Cause they be calling my phone but you already know. I be hitting ignore cause you late. I just throw it away, I don't care what they say at all. Cause people keep talking, people keep talking. But I don't hear nothing when people keep talking. One shot, two shot, three shot, super drunk. Four shot, wrong shot, jump shot, no fucks. Even when I spit it I'mma be the spitting image. Of somebody you recognize when you watching television. I'm just trying to be like jordan, I'm tired of being pippen. I've been coming off the bench and watching my haters get it. It's a young jake gyllenhaal, drop the beat cause I kill 'em all. Grab a seat cause I fill them all. Go hard motherfucker, ain't a pen involved. Y'all try to get up any way that you can. Step on the back of your favorite fan. Charging like 50 to take a quick picture. You scummy ass rappers are not in demand. And you certainly ain't in it for love. I'm just saying this shit cause it's true. I know that all of y'all wanted a bus cause the image important to you. Well I guess that's human nature. Selfish motherfuckers never do you favors. Till they all get dropped and they sent to waivers. Go shop get shelved like it's lord and taylor (what?). I'm the man in the city, well I guess that'd make you the miss. These rappers are acting all over the mic nowadays and they ain't ludacris. You tell me you hate I exist while your girlfriend is grooving to all of my songs. She made you a spotify playlist and there ain't no room for you dog?. Cause they be calling my phone but you already know. I be hitting ignore cause you late. I just throw it away, I don't care what they say at all. Cause people keep talking, people keep talking. But I don't hear nothing when people keep talking. ""Hello? Um hi I just wanna tell you if you're listening. You're my favorite artist ever, and I just so far and. You're just so amazing and I love your song 'no interruption'. And oh my God 'two lips' oh my God I can't wait. For the new music to come out and um I was really wondering. Will you follow me in instagram? Um [?] oh my God yes. And you have to come back to wisconsin because I made you. A bracelet and um oh my God I'm so nervous I'm sorry I'm like. A little girl okay um I gotta go take shit but it was really great. I guess talk to you ok bye hoodie. """
push you away,"Lamborghini doors split to the caption. A motherfucker living out a life in the Hamptons. Oh my gosh, tragic, is it though?. Ended way faster than anyone imagined. Living like a wealthy man, anything can happen. She was just a sundress spotted in Manhattan. Now we getting undressed back room on the mattress. Got a tiny apartment but I hope that you will crash here. They say I didn't pay my dues, I don't ever need it. If everything you say is true, I do not believe it. Money's piling up I just feel like a bulimic. Throw it up throw it up and I'll leave it. Cause I'm driving in a Chevy that her daddy done bought. Pedal's getting heavy cause she's never on course. Grabbing to the clutch while she's trying to grab on to me (on to me). So I'm telling her. Please don't get that close to me. Cause I just got a feeling that you won't like what you see. (like what you see). So you know I gotta. Push you away, push push you away. I gotta push you away, push push you away. I gotta (gotta). Please don't get that close to me (that close to me). Damn. Cheap wine plus the smell of some cigarettes. Goldilocks, there's another one in my bed. Let's keep the lights off, undercover, infrared. Telling me: ""I think I liked you better on the internet"". Living like a wealthy man, yeah she hates my lifestyle. Talking serious and hating it when I smile. I don't really need a wife, but I need her right now. Every mistake I make you taking me to time out. They say I didn't pay my dues, I don't ever need it. If everything you say is true, I do not believe it. Money's piling up I just feel like a bulimic. Throw it up throw it up and I'll leave it. Cause I'm driving in the city where my parents grew up. And the only thing that's changing is I finally blew up. Rollin down the window just to give myself some room to breathe. (room to breathe). So I'm telling her. Please don't get that close to me. Cause I just got a feeling that you won't like what you see. (like what you see). So you know I gotta. Push you away, push push you away. I gotta push you away, push push you away. I gotta (gotta). Please don't get that close to me (that close to me). Ba ba da ba ba da. Getting that close to me. Ba ba da ba ba da. Cause I been driving in this city in this pickup truck. And the only thing that matters' what you think of us. Packing up my bags, but I never really wanna leave (wanna leave). So I'm telling her. Please don't get that close to me (that close to me, that close to me). Cause I just got a feeling that you won't like what you see (I got a feeling that you won't like what you see). So you know I gotta. Push you away (I gotta), push push you away. I gotta push you away (I gotta), push push you away. I gotta (gotta). Please don't get that close to me (don't get that close to me)"
show me what you're made of,"I don't wanna give you up. I just wanna give you love. I don't wanna make it tough. Cause you don't wanna do too much. I don't want to say good-bye. I just want to stay the night. Show me what you are made of. Show me what you are made of. Yo, making out on my tour bus. So fresh probably thought it was a Corvette. And if you are wondering. Why your girl ain't making plans with you. Well mothafucka she ignored them. (fuck her, she ignored them). #Shewashangingwitharappernow. Remember when you were the shit, Manny Pacquiao. Things change so fast now a days. Cause you used to front hard. Now you are super good at backing out. One shot, two shot, now you are blacking out. Think you fucking with the king, what's your rationale. I'll be coming for the title, tell your girl to come over. She will be missing all the finals. (she be missing all her finals). I'm gonna teach you a thing or two. What's a fling for me, its probably a ring for you. I got Mary, Megan, Mindy, Morgan. I'ma smash em'... Billy Corgan. (Shwoop). I don't wanna give you up. I just wanna give you love. I don't wanna make it tough. Cause you don't wanna do too much. I don't want to say good-bye. I just want to stay the night. Show me what you are made of. Show me what you are made of. You don't gotta to turn me down. I'll come in when no one is home. Baby let me turn you on. Treat you like a new iphone. Girl you could be a star, fuck that you cause already are. Show me what you are made of. Show me what you are made of. Yo, Ray Allen in the 90s cause I got game. Two girls in my hotel and I'm not paying. She wanted to know my occupay. I said, I make money money make money money, hey. Like I rob banks, Uncle Phil Dough. Come to my place if you want a real show. She got me feeling like a Magic Mike. You're a beauty girl, tell me what the pageant is like. Skinny chick with a booty and got an appetite. If she catches looking I just act polite (like [x2] ). Yo what a conundrum, bitches are punch drunk. Love like Floyd Mayweather, just pumped em. Full of some Russian vodka. She said she out of my league like the Brooklyn Dodgers. Everyone tryin' to be the Mvp. I take your girl from courtside to show her the lockers, ugh. I don't wanna give you up. I just wanna give you love. I don't wanna make it tough. Cause you don't wanna do too much. I don't want to say good-bye. I just want to stay the night. Show me what you are made of. Show me what you are made of. You don't gotta to turn me down. I'll come in when no one is home. Baby let me turn you on. Treat you like a new iphone. Girl you could be a star, fuck that you cause already are. Show me what you are made of. Show me what you are made of. I do what I ever want. I say what ever I want. I live however I want (ever I want [x3] ). I steal what ever I want. I kill what ever I want. I fuck what I ever I want (ever I want [x3] ). I do what I ever I want. I say what ever I want. I live however I want (ever I want [x3] ). I steal what ever I want. I kill what ever I want. Show me what ever you want (ever you want [x2] ). [Jared Evan:]. Show me how you're made of [x8]. I don't wanna give you up. I just wanna give you love. I don't wanna make it tough. Cause you don't wanna do too much. I don't want to say good-bye. I just want to stay the night. Show me what you are made of. Show me what you are made of. You don't gotta to turn me down. I'll come in when no one is home. Baby let me turn you on. Treat you like a new iphone. Girl you could be a star, fuck that you cause already are. Show me what you are made of. Show me what you are made of"
sirens (feat. alex wiley),"[Verse 1 - Hoodie Allen:]. Check it. Started at the bottom like I'm looking at her booty. Asking me for money, I'm a blow it like I'm Hootie. Buffalo, where you find me, throwing Bills like I'm Flutie. She a product of the nineties, I'm a show her like I'm Truman, ooh. 'fore the night is over, she will beso me, muah. Got your girlfriend so obsessed with me, that Cecily strong. Making all of these bangers for girls who look like Topanga. Who grew up in Staten Island, banging 36 Chambers. Ya listening to history in the making now. Trying to retire at thirty with a vacation house. That money funny like Jefferson on a twenty. Ivy League like I'm hangin' out with Beyoncé and Jeezy now. Swaggin', I can see you impress. She on her knees and she ain't trying to confess. Save me the stress, ya girl already say I'm the best. She came to my show just to get my name on her chest. [Hook - Hoodie Allen:]. Call 9-1-1. Tell the operator she ain't lookin' for a player. We can have some fun. We could be together from now until whenever. Just call me up. And I'll put out the fire that be burning inside. We can roll in my ride and make the sirens go. She make the sirens go. [Verse 2 - Hoodie Allen:]. Working cause I love it, do it for my people. Words are like my ammo, bang, bang, reload. Watch me as I freak flows, ball hard on these beats though. Used to take the bus, now I whip it like I'm Devo. Nowadays we sittin' court side at every Knicks game. Close enough to go and hand Carmelo my mixtape. Models in my phone book, bout to make a mistake. Tell'em spread the love like we living in the sixties. My friends say that my life is like a movie dog. I'm bangin' actress after actress like they groupies dog. She think I'm James Bond, you just an afterthought. These rappers beggin' for any song in my catalogue. Working nine-to-five, but the opposite. Killing it so much, they bout to build me a monument. Tell her ""we can do it in the dorm room of your colleges. And she can rock my muthafucking world or earn an scholarship. [Hook - Hoodie Allen]. [Verse 3 - Alex Wiley:]. Okay, I know it's frowned upon, but I'm [?]. [?] in a text, I got your bitch in it, don't mention it. Those who want the D and I appreciate the sentiment. Can't afford to own it, I'm just leasing it and renting it. Cause I am not cuffing shit, I am not no odd boy. I'm more like a hot boy, Gucci leather socks boy. Fin dripping in the kitchen whippin' up the box toy. I get it for the low, I bet you get it for a lot boy. Last night at the Trump towers taking drunk showers. At the airport, they went through my bag and found a bunch of weed that was not ours. If it's not reeking than it's not sour. Smoke in her face, you don't need a vase for these bouquet, then buy flowers. [Hook - Hoodie Allen]. [Phone ring:]. Hey, Hoodie! What's going on man? Todd Ferman calling over from Gigantic Records. Man we just listened to your project, I got a bunch of writers up here, every one in the office is flippin' out. Man, I just wanted to call ya and let you know that we really, really love it, but we just wanna, you know, take it that next level. First thing I would want to do with you is get you a little bit more matured. Throw on a bowtie every now and then, carry a cane around, and wear a grey wig. But other than that, we really love it. Please call me when you get a chance. Once again, Todd Ferman, Gigantic Records. We love your album but we really want to change everything"
