keep fronting,"[Intro / Chorus: Big L sample]. I shoulda been out, I'm de-de-deadly. when I pu-pu-pull the pin out, keep frontin. I'ma try-try-try ya chin out. I knocked a lot-lot-lot-lot out of men out. Keep frontin, I'ma try-try-try ya chin out. I knocked a lot-lot. I knocked a lot-lot-lot out of men out. Keep frontin, keep frontin, keep frontin, keep frontin. [Bumpy Knuckles talking over sample]. Yo. Right now. I wanna teach all you MC's out there. How to be. Effective. Let's ride. [Freddie Foxxx a.k.a. Bumpy Knuckles]. Do y'all know what time it is when everybody game. is everybody else's hustle and everybody's shame. is somebody else's blame, whatever I became. I did it with hot rhymes and a lung full of flame. I never refrain, from loadin up and takin aim. Like chicks flows are different, I never cum/come the same. My mic will be the dame, written or off the brain. I show up with my chest pumpin hard like Notre Dame. I lose then I regain, hustle is in the vein. I'm drinkin protein shakes to muscle up the brain. In the black Chevy Suburban sippin champagne. with champagne, dick out doin the damn thang. We movin in the fast lane, with them black thangs. On the way to the Bronx, to do the ski-mask thang. I don't know what's so funny cause I ain't laughing. The part is for a dead body, guess who's casting. [Chorus]. [John Cena talking over sample]. Alright bro, I'm hearin you. I'ma see what I can do. See how I can rip it. And be, effective. Follow this. [John Cena]. Cena spittin with the Bump Bump Bump for the Knux. Your whole crew gettin dumped dumped dumped with the chumps. We rollin like Donald Trump Trump Trump with the bucks. Your bitch-ass gettin jump jump jumped cause you suck. Follow me, you stick around round round when it's hot. You claimin that you down down down but you not. You try to offer me a pound pound pound you get got. I can't wait to hear the sound sound sound of you shot. You hearin me, it's time to show show show I got plans. That's all you brought you bettter go go go get your mans. A legal hustle, ain't no no fuckin with grams. Stash the heat cause I can throw throw throw with my hands. I'm tellin you, on screen screen screen with these flicks. Catch me on the scene scene scene with three chicks. I fuck like a fiend fiend fiend with three dicks. Fuck a sixteen teen teen I'm just sick. [Chorus]. [Tha Trademarc over sample]. Yeah, what's good fellas. I'm feelin y'all man. Most these cats. Can't engineer, they career. Yeah, Trademarc, bout to. Bout to show y'all. How to be, effective. [Tha Trademarc]. My camou' colors dog they be beige and brown. That shit was all love 'til you cowards came around. With the same ol' sound that's why your payroll down. That's how the game go now that's why you ain't gain ground. Cause you stuck on then dog, you ain't on now. And that's how it's been baby cause you ain't know how. You move your pen lazy maybe or your beats don't pound. I move quicker than the word on the street go 'round. I write down every lesson that my peeps hold down. You let your heat go blaow if you ain't speak profound. I write sixteens down 'til I hit green now. Makin up slang, ain't know what shit mean now. Trademarc, Marc Predka, jot the real name down. You can catch it on every marquee in town. Sayin Trademarc, ain't nobody like you now. Probably sweatin this track dog, go wipe your brow. [Chorus - 2X]. [Bumpy Knuckles]. You see, that's all it takes. Is for a man to make an effort to be, effective. And if you're not, effective... then you're defective. Hahahaha.."
know the rep,"[Freddie Foxxx a.k.a. Bumpy Knuckles]. Hahahaha.... Y'all know the rep, yeah, listen. My name is Bumpy Knuckles, I write that fuckin flame. And kill for the right price I got a buckin name. My forty caliber too fresh, stuck in aim. We roll like 18 wheelers in the truckin game. I'm nice with mics there's nothin more I like. than to paralyze your left side and leave you all right. I be layin front of your crib with Tec-y all night. Tryin to get them 9 millimeters loaded up tight, listen. I'm like a Cadillac, I write a battle rap. so smooth contest you'll be out of that. Y'all know the beef is stewin, that Bumpy came to ruin. You may be signed but you don't know what the fuck you doin. I make aight hot, I make dope raw. And send you higher than a long Colt four-four. You know the only rap pimp that kept a ho poor. And slam a fool on his back and break the whole floor. [Chorus: Bumpy Knuckles]. A yes yes y'all, and you don't stop. We keep on, once the cops are gone. This is real street spit you best be warned. Tell your favorite MC the mic is on. A yes yes y'all, and you don't stop. We keep on, once the cops are gone. [John Cena]. Yeah, yeah. It's the J daddy, not Hov' or Jam Master. My mic is correct, but y'all know the hands faster. See you bitch rappers I'm attackin the pile. Y'all be cryin foul cause I'm hackin your style. I make sure you and your mans done. When I see y'all both drop, I'm the cat screamin And1. You see me on the team dog you know the game's over. Stones on my wrist, and a chip on my shoulder. Sixteens cashin in on another hot beat. Go cop me a drop with the butterscotch seats. And we better not meet, if we do you gon' see a change. Make sure you whole FACE gettin rearranged. We rollin up in the blacked out truck dog. It's Freddie Foxxx, now you deal with Corrupt Mob. It's gas on the fire, any time a track blaze. Squad known to beef up the Heat, just like the Shaq trade. [Tha Trademarc]. This my 9 to 5, this ain't no hobby cat. Copycat killers bite styles, my rhyme piles is heavy. Give me a beat, man I'll body that. Spittin that heat street raps man they nod to that. What you smilin at? You R&B, man that's hardly rap. You lost the beat, man you bought a map. Matter fact, here's my next rap, borrow that. Been off the street too long, I want my corner back. You ain't a player, you a armchair quarterback. You ride the beat like side streets on a flat. Don't play dumb, I know where you came from. You only seen slugs buddy after the rain come. Keep it subtle, Trademarc got you bitch. like babies suckin tits talkin 'bout mami let's cuddle. It's gon' be what it's gon' be, you duck down. A quiet cat with a violent rap, what now?. [Chorus]"
make it loud,"[John Cena at a live show]. It's the joint baby, GOTTA MAKE IT LOUD [crowd cheers]. SO LET ME HEAR SOME NOISE FROM THE CROWD [more cheering]. [Tazz] That's noise!. [Chorus 2X: John Cena]. It's the joint baby, gotta make it loud. Get the point yo you gotat make it loud. Everybody in the club make it loud. SO LET ME HEAR SOME NOISE FROM THE CROWD. [John Cena]. Yeah, yeah. We came to kick the door down, it's time to hit the floor now. Yo... we got some shit in store now. So; clap your hands while we let the sax blow. Not quite crispy green, but we came to stack dough. We ain't maxed yo, we just try and get this money right. Bills made of Spandex, I still keep my money tight. Never stoppin, all I see is the money like. the kid on the mic is too +Raw+ for your Monday night. If you got in free, or your fuckin cover's paid. Bounce to this motherfucker like you was some Rubbermaid. This ain't that Cristal sippin type shit. It's that bottle breakin, startin riot type shit. So jump up and down 'til ya break the floor. Yo we keep it underground like a basement tour. East coast reppin, stretchin out to L.A.. Not double oh seven but we +Die Another Day+, what. [Chorus]. [Tha Trademarc]. I tear up any track, front to back. Like Roy Jones takin on fifty year-old cats. makin comebacks, where you at, cats spit soft shit. like whispers and gloves, I'm not hearin that. It's all love maybe if you wanna rub baby. Anything but that, step back lady. Trademarc, John Cena, clubbin it up. We got Chaos on the one and two, cuttin it up. I'm all about laid back, don't jock, I hate that. I see through haters games, don't mistake that. I still got love if you buyin our shit. If you claim you hatin us, but you ridin our dicks. Everybody hear the name, Marc Predka. It's gonna ring like an echo for years, I never left ya. All y'all raise your glass to this shit. Cause Trademarc's the head of the class of misfits. [Chorus]. [John Cena]. We steal your top spot, and you not gettin your number back. Chop down competition like I was a lumberjack. Clear out the club floor, we keep 'em comin back. Tough to bring down like an overweight runningback. Yeah - and we blaze 'em baby. Trademarc, John Cena, we amazin baby. Yo we tear up any crew, leave a motherfucker worn. Y'all are just soft like some Cinemax porn. [Tha Trademarc]. I move a crowd like a bomb scare. Grab the mic when we hittin it right, if you want fear. Some say Trademarc, he ain't all there. We old school like when Sonny, was on Cher. Take it back like a Richard Pyror 8-track. And grab a chunk of your change like a state tax. Man please, we want platinum plaques. I want cream, green, cheddar cheese, to grab in stacks. [Chorus]. [scratching Trademarc to fade]. ""Chaos on the one and two, cuttin it up"". ""That's that shit!"". [crowd chanting] ""Ce-na, Ce-na, Ce-na"" [at the end]"
my time is now,"[Chorus: John Cena]. Your time is up, my time is now. You can't see me, my time is now. It's the franchise, boy I'm shinin now. You can't see me, my time is now!. [John Cena]. In case you forgot or fell off I'm still hot - knock your shell off. My money stack fat plus I can't turn the swell off. The franchise, doin big bid'ness, I live this. It's automatic I win this - oh you hear those horns, you finished. A soldier, and I stay under you fightin. Plus I'm stormin on you chumps like I'm thunder and lightning. Ain't no way you breakin me kid, I'm harder than nails. Plus I keep it on lock, like I'm part of the jail. I'm slaughterin stale, competition, I got the whole block wishin. they could run with my division but they gone fishin -. - with no bait, kid your boy hold weight. I got my soul straight, I brush your mouth like Colgate. In any weather I'm never better your boy's so hot. you'll never catch me in the next man's sweater. If they hate, let 'em hate, I drop ya whole clan. Lay yo' ass DOWN for the three second TAN. [Chorus]. [Tha Trademarc]. Yeah, uhh. It's gon' be what it's gon' be. Five pounds of courage buddy, bass tint pants with a gold T. Uhh - it's a war dance and victory step. A raw stance is a gift, when you insist it's my rep. John Cena, Trademarc, y'all are so-so. And talk about the bread you make but don't know the recipe for dough though. Aimin guns in all your photos, that's a no-no. When this pop, you'll liplock, your big talk's a blatant no-show. See what happens when the ice age melt. You see monetary status is not what matters, but it helps. I rock a timepiece by Benny if any. The same reason y'all could love me is the same reason y'all condemn me. A man's measured by the way that he thinks. Not clothing lines, ice links, leather and minks. I spent 20 plus years seekin knowledge of self. So for now Marc Predka's livin live for wealth. [Chorus] - repeat 2X"
right now,"[John Cena]. Yeah. You can't help but feel it. Can't help but feel this one. Uh-huh uh yeah. Excuse me for a minute while I lighten the mood. Just clap with me like the lightning do, yeah. A bit of soul food that you be bitin into. And if you feel me then I'm writin for you, uh-huh. Right now put another coat of wax on the ride. For a minute put the beef and the gats to the side. Cause this track's got a vibe to chill to. Enjoy life for 5 minutes, man it's not gon' kill you. It's okay to be hard and stay true man. But at the end of the day, we all hu-man. This one's for you, the ones that you close to. Show some love, it's what you supposed to. Right now, forget the ends and the Benz. Pop a cold one, man toast it wit'cha real friends. Call your folks, tell 'em you tight now. Cause everything lookin pretty good right now. [Chorus]. Right now baby, we all gon' ride. So place those things on your hips or side. The soul vibe gon' change, give way with fame. But sometimes the moral change or stay the same. Relax baby, right now you here. And sit back baby, with a round of beer. And cheer to those friends who crowded near. For those passed on in spirit they there. It's gon' be what it must, break bread wit'cha crew. If you got kids take the crust. It's all love baby, tell your girl she's strong. And whisper in her ear after dinner it's on. And take it slow baby, cause everything real. When you at family dinner y'all enjoy that meal. Thank God that you healthy and you keepin it tight. And keep your dreams lighthearted when you sleepin at. night. [Chorus]. [John Cena]. Yeah - and right now I'm showin love to my brothers. and my old man. To my girl, ""Let's Get it On"" like the slow jam. To everybody that I'm runnin down the road with. Y'all my family, I know that you know this. Fox, Rock, B's and Chaos. Y'all growin up with me man, true to life players. Grandma or grandpa watchin up above. Trademarc you my heart cousin, nothin but love. [Tha Trademarc]. Thanks momma, for all that you was. You a strongarm lady baby crazy with love. My sister raised me, those are the facts. And taught me how to rebuild when the order collapsed. And right now I'm blessed no stress no less. And thanks hip-hop for givin me back focus, huh. Yeah John, what can I say?. It's all love from day one, you showed me the way. [Chorus]"
running game,"[Chorus 2X: John Cena]. We roll by in the pimp ride (then we). Walk through with the pimp slide (y'all know me). Crew heavy on the thick side. Everybody feelin this, y'all know we serious. [John Cena]. I'll be makin you move so quick you can't see me in slow-mo. Get your throat cut when you step in the dojo. Y'all got no flow, we be makin hits. You like a proctologist, you feelin my shit. Yeah - you all hype like a street team. I spend more time holdin a mic than Mean Gene. Makin beat fiends scream, they be love the click. Roll solo to the party but I leave with ya chick. Cause she know that when I'm flowin it's hot. There's a party in my pants, she be blowin the spot. Buck naked in the old school drop, givin me skull again. She give me free yos, that's why I call her a mulligan. See me on TV, knows everything about me. You can't fuck with me, she can't fuck without me. And if you think she don't be lovin my thangs. That's like sayin you eat at Hooters for the buffalo wings, what?. [Chorus]. [Tha Trademarc]. Fuck record execs, promisin checks. I been cleanin tables now I'm seein labels, these chicks. sayin ""haven't we met,"" man holdin my breath. Feel like the lesser of two evils that I haven't seen yet. I got girls runnin game with a pimp strut. Big butt booty bitches tryin to link up. They walkin toward me, conversation and they body bore me. I got no game, it's just some bitches understand my story. Nas said it before, that's raw. If you leavin the club your clothes'll end up on the car floor. Man, I got no time for words after sex. I just kick you to the curb and be laughin next. Cause Trademarc is a clingy chick's nightmare. Even though you took me home, I won't spend the night there. I've had hookers to virgins, on they back. Wild sex all the way to dead lays like necrophiliacs. [Chorus]. [John Cena]. Johnny Cena got the girls, girls but I'm not Jay-Z. I play the field, I never let the field play me. You see my Chevy? You know there's ten chicks aboard. Plus the whip got more switches than the mixer board. I'm stickin your whore, while you flossin your Range. Gave her a dollar, she gave me back a buck and some change. She tried to swallow me whole, I brushed the back of her wig. She called my dick Frank White cause it's +Notoriously B.I.G.+. [Chorus]. Submitted by Lady BéHh"
summer flings,"Yeah we doin things now man. It's just another day in the life y'know. Always tryin to do some big bid'ness. Sometimes when we havin fun. Some shit goes down y'know, you ain't expectin nothin. Then, somethin come out of nothin. It was just another typical day in the summer. Me, Trademarc, Crouch and my little brother. We put the whips out, we cruise up to the strip man. Three wheel motion killin fools like a hit man. We on some chill shit, vibin out. But we still in the mix, fuck hidin out. On the corner of L Street, I locked eyes with her. I ain't steppin man this bitch had guys with her. She came through the crowd and walked over to me. Catchin P off guard, she actin like she knew me. Her name was Shannon, she was canon. She's hangin with Melissa, this big booty chick you couldn't miss her. This chick was like a fitted cap, all over my dome. Said she wanna be down, but I ain't takin her home. That's when she said she live right down the street. She love white chocolate, well I got somethin sweet. [Chorus 2X: female singer]. Saw you walkin down the street and I. heard you say you had somethin sweet for me. Lover.. (somethin sweet) lover.. somethin sweet. [Tha Trademarc]. We run game, {?} Blanson, what's your hon's name. I can take an Eva hot bitch like bum change. Playin hard to get when I step, I'm afraid. I can treat a chick like cheap gas and upgrade. Whatever you need, whatever you want. With Trademarc on your arm, girl what more could you flaunt. There's just something about us, summer fling got you wondering. where I'll be in spring, but that's another thing. I'll be out girl, quicker than tans. If you want somethin stick hurr, stick wit'cha man. I ain't lookin for a lover girl, I'm lookin for sex. I can tell you I got money or I'm pushin a Lex. Whatever gets you hot, that's what I say next. Gettin passed through the crew girl that's a safe bet. I think it's funny how it doesn't take a whole lot. Trademarc's like an open flame, getting girls hot. [Chorus]. [John Cena]. Yo... with these sweet flows, the streets knows. whether we pimped out in streets clothes, we the bomb like deep throws. My speech grows to reach hoes - all over the globe. I got class like a Ric Flair robe. [Tha Trademarc]. Man I'm in and out quick like Jordan in the zone. D takin out a bitch like a pass from Shaq to Kobe. You know me with a extra set of hands. a bitch couldn't hold me man I leave 'em lonely. [John Cena]. If I catch a glimpse of your chick when she smile and fine. I make sure she lose your number, she'd be dialin mine. I ain't about a wife even if she won this right. I'll fuck for seven days but stand for one night. [Tha Trademarc]. Man we decked out John, the strict gutter. I'll have a girl repeatin my name in sex like the bitch stutter. I got moves lookin butter with a tight fade. Forever dipped fresh man like Minot Gray. [Chorus]. Submitted by Lady BéHh"
this is how we roll,"[Chorus: repeat 2X]. Wheels is shinin.. deals we signin.. money's pilin... Low, this is how we roll. [John Cena]. Catch me in the black 'llac truck with the pickup back. The game weak, I'ma pick up slack. Hands high like a stick-up jack, fuck your boring rap. This East to West coast hittin like Warren Sapp. I'm fully focused, I walk with a purpose. Y'all are fuckin clowns, you belong in a circus. This is big bid'ness, we don't stop 'til the money home. Block shakin more buzz than a honeycomb. And I'm a savage in the booth. I'm on some movement shit, about to rally up the youth. Number one seed daddy walkin through the playoffs. You better quit rappin 'fore I start makin layoffs. Fuck a day off, I'm movin heavy for the payoff. You don't ride to this? We don't need you, stay off. Hate on this? I don't care what you said. Y'all can choke on a shit sandwich with no bread. [Chorus]. [Tha Trademarc]. I don't smile as such, buddy, ain't much funny. You touchy girlie rappers claimin that you fuckin gully. I live poor but look rich, I hit raw, you look bitch. You love me, that's why you got your style from me. Most sayin Marc Predka's overconfident. It's only cause they jeally that my profile is prominent. The dominant factor is the money I'm after. Your opinion ain't mean shit buddy - I ain't ask ya. It's gon' be what it's gon' be. It is what it is and was what it was so watch ya wordplay. Trademarc lay you where the buzzards and birds play. I write rhymes 'til ya boy is heard mayne. Cause alls I got, is my voice and word. Sophisticated rapper the dapper lover the don. It's on baby pah yeah word is bond. Cut the check and I'll rock, every word of the song - what now?. [Chorus]. [John Cena]. Yeah, yeah... yeah. I got that velcro flow, I'll make you stick to this. So many zeroes, my monetary is ridiculous. A glass of Chardonnay doesn't whine like you. I'm an Altered Beast with Einstein's IQ. Plus I shine bright too and I ride right through. In a leaned out, old school, skylight blue. I don't think there's a player nice. Keep your Cristal, I'm shoot Jagermeister. Foot to the floor and you ain't you keep the pace. Throw me a whore and call me Kobe cause you know that I'ma beat the case. I buy some land, and never even see the place. Vegeterian chicks, go on givin meat a taste. Throw away money like I hate on loot. Copped your CD it sounds great on mute. Words turn 'em to dust makin MC's disintergrate. My name get traffic like the California interstate, what?. [Chorus]. Submitted by Lady BéHh"
untouchables,"The Untouchable cat who's style is right,. I could be mistaken for the smooth and silent type,. My violence bites tight like it was vampires teeth,. I'm hammerin G, opponents are beat you put to sleep,. My radical brain will run your terrain,. I'm comin to game,. It's simple and plain,. Your hurtin', there's no numbin the pain,. Warpin' your frame, the complex, with ill techs, still flex, kill specs, on cassette decks... Mic checks and tight reps,. Collect all life bets,. We'll see how bright the lights get,. The illest attack,. I fight with artillery jack,. Then physically smack and verbally hung,. You stumble and fumble,. So I gain possession,. Music moves in cycles,. Natural progression,. Thuganmonics lesson is tought,. And Records are bought,. Analyze for lies and fillers,. Nowadays, Gorillas make skrilla if the markets correct,. All you need is a hook, and a hand to collect,. Lack cred, but respect MC's before me,. Don't blast the backheat but the streets can't ignore me,. Hands nice I rock it wit peace, leave ya hard reps soft,. Just like when Miami left the Big East. . you'll know my stees, yo we raising the bar.. assasinate the mainstream. you'll know my stees,. Trade-Mark n' John Cena, assasinate the mainstream.. (repeat)"
we didn't want you to know,"[20 second instrumental to open]. [Chorus: John Cena]. If you don't know by now, we runnin the game. Neck froze, got a mill' on the chain. Show respect to Cen' and Trade. Cut the check, believe we're paid. Y'all waitin for the single to drop. Look down on the charts cause we sittin on top. Everybody else feelin the flow. If you don't know by now (we didn't want you to know). [John Cena]. Get nasty, doin dirt don't put it past me. ""Appetite for Destruction,"" +Axl+ couldn't +Slash+ me. I got hounds that found where your stash be. They play my sound in towns, rats harass me. They know I'm nice, they ain't bettin on you. That's like playin roulette and bettin on blue. Cena gon' blow - you goin no place. Snatch your dame, show her my old face. Still walk tall with a staggered stance. Plus I hold on the club like I was Bagger Vance. Make you breakdance for me, have you doin headspins. Ship you to D.C., covered in Redskins. Catch me in a classic drop low with the wine paint. Plus I'm classic on the flow, every line great. Believe me, yo the speech is tight. I lay you down like when you sleep at night, big business. [Chorus]. [Tha Trademarc]. Y'all are cowards y'all found power and cower. The gunpowder a thousand shots an hour leavin blocks devoured. Have your family prayin for your survival. Bust shots and get cops bent out control like a spiral. Man get the fuck on if you got bangers involved. Man get the fuck on and keep your chambers revolved. Man get the fuck on and get your weight up. Man get the fuck on or you get laid up. Sippin BNB out the sceptre. It's not Trademarc to you dog it's still mister. Sophisticated, and Marc's never stuck up. I know when to shoot my mouth off and when to shut the fuck up. Every rhyme I write, worth writin. Every room I'm in, worth micin. I'm artistic, you must have missed it. When I said every rapper sucks I was bein optimistic. [Chorus]. [Tha Trademarc]. Trademarc's mind is dilated. Highly rated, madly envied, that mean we kindly hated. The nightcrawler brawl and have you missin. when we drag your body out to sea like fishermen. and takin everything that's glistenin. So run your chain or your dame, it's all the same. Just a verb exchanged - you listenin?. Man, I never leak what I think. And never sleep cause you miss the point of life when you blink. [John Cena]. Fuck with the kid I'll leave you laid up in intensive care. This monopoly, I ain't got intent to share. When it's time to do business, I got no friends. A true hustler, burn the candle at both ends. If anybody on the scene doubt. I show 'em so much green, you think I'm farmin fuckin bean sprouts. Wrist iced when I'm cracked ya mold. Cause revenge is a dish that is best served (cold). [Chorus]"
