basic thuganomics (freestlyle),"So, you think your untouchable???. Word life, this is basic thuganomics!. this is basic, basic thuganomics,. Word life!. Im untouchable but im forcin' you to feel me. Word life, this is basic...Basic Thuga...thuga...Thuganomics. Word life, im untouchable but im forcin' you to feel me!. Wheather fighting or spitting, my dicipline is unforgiving.. Got you backing up in the defensive position.. An ass-kicking anthem, heavyweight or bantem,. holding camps for ransom, the microphone phantom.. Teams hit the floor, its the new fight joint,. Like a broken needle kid your missing the point.. We dominate your conference with offense,thats no nonsense.. My theme song hits, get your reinforcements.. we strike quick with hard kicks,. ducking ice picks, bare-knuckle miss who fight this,. beat you lifeless, you'll never survive this.. you forgot like old timers,. two faced rappers walk away with four shiners.. The war rhymer, turning legeonds to old timers,. my incisors like a vipers biting through your one-liners.. New dead man inc. and we about to make you famous,. taking over Earth and still kicking in Uranus.. Word life, this is basic thuganomics!. This is basic...Basic thuganomics. Word life!. I'm untouchable, but im forcing you to feel me.. Word life, this is basic..Basic thuga...Thuga...Thuganomics.. Word life!. I'm untouchable, but i'm forcing you to feel me!. you ain't advanced enough to process,. potential for medical concepts,. some objects are foreigh like blot tests,. arts and sex are complex,. regardless of your finesse or your fitness,. its the condition of business,. your lame vision of an underground physical image. you're underneath to undermine your whole typical image with the precision of percentages and the collision of sentances.. poetry beats your mic's were untouchable like righteous sluts with no crevaces.. streets unite,. we rock righter with dumber beats.. you cats coudlnt come this hot in the summer heat.. but get two takes,. kill your birds the first time,. you better stay worthy of my filler or worse rhymes,. im better than nice,. check the veterans twice,. while your beside yourself with fear,. ill kill you and bury you twice.. despite the cover of night,. tracking your flight like guerrilla warfare,. where the grass is dense,. approaching me is a quick way to get refered to in the past tense.. Dead-da,. when the lights the mic is on,. the crowd is dead like intermission. when your on the titan-tron.. Word life, this is basic thuganomics!. this is basic, basic thuganomics,. Word life!. Im untouchable but im forcin' you to feel me. Word life, this is basic...Basic Thuga...thuga...Thuganomics. Word life, im untouchable but im forcin' you to feel me!"
beantown,"Yeah whassup baby? We gon' do some things right now. Show you how we do 'em in the Bean, y'knahmsayin?. N.Y. representin, Dirty South representin. Chi-Town, L.A., they all doin their thing. We got a lil' somethin bubblin in Beanpot over here y'know?. I got my crew right back gon' show you how it's done. Straight up, hittin one two like Manny Ortiz ya heard?. It's John Cena baby, and we heatin up the Beanpot. Big up Boston, you know the whole team hot. Yo we fresh, y'all a little bit stale. And we 'bout to make it ugly just like Kevin McHale. Cena takin over - I'm 'bout to make the scene mine. I got a tea party, baby meet me on the Green Line. Ain't too many kids that flow better than me. Roll thick like Yassir sideburns in seventy-three. Like Tom Brady and the Pats, we rollin kids. Cross me and pay a toll like the Tobin Bridge. From the home of the curse, y'all know what I mean. We like the left field wall, we stackin +Monster Green+. Knock you out of the park, you land on Yawkey Way. My shit be butter, but around here we say Parkay/parquet. I rent my own team, we takin over the industry. Like the big dick, baby nobody can finish me. [Chorus: scratched 4X]. ""Big up Boston!"" ""No one shows pity"". [Tha Trademarc]. Yeah, it's Trademarc baby, biggin up Boston, yeah. 6-1-7, 9-7-8, 7-8-1, 5-0-8, and 4-1-3. And I don't mean to brag, but it's in the bag. And we alone on top like we goin stag. It's a dynasty, that's how I see things. In four years we countin three rings. I'm the MVP, baby gimme that key ring. And me, Brady and Branch'll own our sweet thing. Yeah, and we ain't gon' stop. We at the Eagle {?}, cook 'em all as they flop. And T.O. takin on the B roll and that's the past. Beatin everybody and the salary cap. What now? You say titan's your rep. That's like Peyton winning big games out on Gillette. We don't forget y'all, we're keepin it grimy. Had the Steel Curtain lookin like venetian blinds. Yeah baby, that's how it go. That's why next year it's lookin like 3 in a row. [Chorus]. [Esoteric]. Yeah, uhh. It's Esoteric, tunin in. Puttin it down, for Boston Mass. Yo, I rep the Bean, y'all see the way it be. Home of Source magazine, the Pats and Edo. G. Steadily poetically I'm Bill Russell in command. Peace to Dorcester, Roxbury, Mattapan. Pack a man down quick like neanderthals. Standin tall after brawlin up in Fanueil Hall. As a young buck moms said I disobey. All she heard was no-ma/Nomar like fans in Fenway. But they sent him to the dugs, I'm like Manny when he shrugs. And {?} bug to the {?} women wearin {?} in the club. A deadly combination like venom hit your blood. Jason Varitek with the glove, it's all love. I'm like Schindler with the red sock, when I get hot. My aim is dangerous, like the Larry Bird set shot. It's clear now, you livin in fear now. Big up Boston, the champ is here now. [Chorus]"
chain gang is the click,"[Chorus]. We fight together we ride together right now we loud together chain gang is the click its trade mark. the trout it’s a basic thuganomics im raining fire like apache helicopters. We fight together we ride together right now we loud together chain gang is the click its trade mark. the truth it’s a basic thuganomics im raining fire like apache helicopters. [Verse 1 - John Cena]. Prepare for the worst we commin thunderin opposition wonderin how they get the drop on us we set up. and lock corners try to put a stop on us we react so quick the 5o couldn’t even call the cops on us. steady put the rocks on us but my chain stay still, still my name stay real spit the flame they feel I. no the game take skill that why the brains stay ill we bout to change the deal keep the champagne. chilled we sippin? With a molly rose yall belly meatin beef and nothing but bologna foes your phony. flows we stopping rise own the own the game yall is leasing with the option to buy your flight been. delayed kid you not gonna fly we got the army throw your hands to the sky this is chain gang bitch. don’t bother to check us yall don’t got to like us but you gon respect us motherfucker. [Chorus]. We fight together we ride together right now we loud together chain gang is the click its trade mark. the truth it’s a basic thuganomics im raining fire like apache helicopters. We fight together we ride together right now we loud together chain gang is the click its trade mark. the troth it’s a basic thuganomics im raining fire like apache helicopters. [Verse 2 - tha Trademarc]. Listen baby im just tryin to eat it’s the same game that put chain gang in the street got goons with. a few hundred clips in the heat it’s the same sex violence and money diein to meat got game im a fan. its music move me I found writhing rhymes was soothing don’t lose me never let the trout allude me the. skills I respect I expect u dolly some got gifts man but reflect it crudely that why I keep it real. like rejected movies what now and no what was or would be only sing along if you understood me the. seen hip hop dawg aint were it could be trademark will take yall right where it should be you actors. that’s where it stops you stars on stage yall adecrative props what now. [Chorus]. We fight together we ride together right now we loud together chain gang is the click its trade mark. the truth it’s a basic thuganomics im raining fire like apache helicopters. We fight together we ride together right now we loud together chain gang is the click its trade mark. the truth it’s a basic thuganomics im raining fire like apache helicopters. [Verse 3 - tha Trademarc & John Cena]. Look man my voice cristen in beats your vision see ripples on concrete for glisten heat whenever I. speak I walk streets? Trademarc john cena Freddie fox and rup corrupt mob the chain gang spittin the. same slang let the iron go bang bang and came man let the church bells ring ring to all yall coppin. the lot let it hang hang. [John Cena]. Yall think we lucky that aint nothen new to me cause luck is preparation lockin heads with. opportunity so far I just had to listen and learn play my position and earn with the vision and burn. now the shit is all turned and im reppin for pride where im from you either step up or step aside want. some get some stop drop and parral chain gang run this bitch lock stock and barrel. [Chorus]. We fight together we ride together right now we loud together chain gang is the click its trade mark. the truth it’s a basic thuganomics im raining fire like apache helicopters. We fight together we ride together right now we loud together chain gang is the click its trade mark. the truth it’s a basic thuganomics im raining fire like apache helicopters. We fight together we ride together right now we gon to get loud together chain gang is the click. click click click"
don't fuck with us,"[John Cena]. We keep it hoppin like the cars with the shocks. We spittin heat on your block. We new to the game, but runnin the spot. Numbin your knot, with basslines that'll make ya neck break. This rook'll take your queen and put ya king in checkmate. Open your mind without makin ya meditate. We real champs; y'all just featherweight. Time to get it straight, I push your wig back. Crew loaded up with extra bread like a Big Mac. Beefin with us? We're leavin you face down. Stompin bitch rappers like I'm straight outta A-Town. Runnin the playground like it was a track meet. Shoes on the whip that be bigger than Shaq's feet. We into big things, bank account's overgrown. All types of cheese - swiss, cheddar, provolone. Guaranteed to burn wax like candles. Track hittin hard to the head like shots of Jack Daniels. [Chorus 2X: John Cena]. Y'all, bitch, crews, don't wanna fuck with us. Y'all bound, to, lose, another one bites the dust. [Tha Trademarc]. It's Trademarc the truth, laid back, aloof. I'm God, as if you needed some proof. You ain't hard I can see it on you, {?}. Fuck a droptop, crop if I'm creepin on you. Click-clack nickelback knickknacks if you got heaters on you. Spittin back live rounders, with five pounders. If we meetin on two, I put a beatin on you. Your sound's tired buddy, that's why I'm sleepin on you. We lean back in the ride, with cream stackin the rawhide. The sound of God slide with a raw vibe. Straight military camel clothes ash brown boots. So sick, I've been handlin flows, since enamel was gold tooth. And branded by low. You cold fuck like eskimo hoes at 7 below. You slow, you be the last to think. My hands seen more fuckin dirt than bathroom sinks. [Chorus]. [John Cena]. I got punks, dumps and switches, dump chumpses bitches. We feed you to the sharks, you can sleep with the fishes. Clean you like dishes but I ain't no busboy. You ain't family, you ain't earnin my trust boy. Seen too many bitches that'll double cross ya. We bring more drama than the Laker roster. Get the click pissed, ain't nobody can save ya. Throw heat without lookin like Fernando Valenzuela. [Tha Trademarc]. Marc Predka's the name, the rest of you lame. I'm ego drivin, seen with different women, every size and frame. I refine my game by fuckin famous bitches. But it's all the same, it's just ex to the next. for sex or brain, misses or Mrs.. Married or not, my game don't stop. It's cars bars bonds and stocks you ain't see my flow. Y'all are small-time suckers like a knee-high hoe. [Chorus]"
flow easy,"First and foremost.... Flow easy, yo. Yo, yo, for the hood (for the hood). Everybody flow easy, ha ha, so easy. Yo, listen. For the corrupt mob, John Cena, Trademarc, listen. I embarass MC's who touch the mic with me. That's why they never holla when it's showtime - gimme. I spit poison like a black snake bit me. Guns up in the E-Class, D's can't get me. My foot is a 13, 12's don't fit me. My heart is cold and hard like Jack Frost bit me. So many new flows old flows start to panic. It's time they got built by the mic mechanic. Y'all heard, I stay in hood streets like curbs. And never forget, where I come from, word. I ain't goin broke, fuck you, I'll cop me a brick. And take it straight to the block, forget rap quick. Don't trip, Bump got a speed zone sign. For suckers who move too fast against mine. I'm pressed, pushin it full speed ahead. You left, bullet in chest, meet the dead, so. [Chorus]. Flow easy, turn up the mic it's time. to flow easy, whenever I spit my rhyme. I flow easy, the underground pound and grime. Flow easy, but yours don't sound like mine. I flow easy, turn up the mic it's time. I flow easy, whenever I spit my rhyme. I flow easy, the underground pound and grime. Flow easy, so yours don't sound like mine I flow easy. [Tha Trademarc]. Philosopher first, rapper second. Manifest the message, lessons involved. It all but hits you, aviate your crew and lift you. So what's the issue? Trademarc has got it locked before he meet you. Greet your mind before we even greet you. Won't mislead you, I ain't trustin people, cause I defeat you. Take it down a notch, slow your roll. Cause we crush spirits, like we stole your soul. I set styles off dog, y'all are fuckin mimics. Man I talk more shit than pro-lifers in abortion clinics. Run my mouth off like high school rumors. Man and grab microphones like pedophiles gropin late bloomers. Flow easy like your first day with white sneakers. You just a face in the crowd like packed bleachers. Huh, you better rock a sleeveless. Freddie Foxxx, Trademarc, John Cena breeze through. Y'all are fuckin divas. [Chorus]. [John Cena]. First and foremost I sure post potential like Carmelo. Turn a hard MC to jello. Make their skin yellow with fear while stayin mellow and clear. Man, we in for one hell of a year, yeah. Curse a fool like the Red Sox, we tighter than headlocks. I'm flowin easy with Freddie Foxxx. Known to hang it low like dreadlocks and y'all are too slow. Like wearing a weight vest and lead socks. I'm a fat kid, you feed me? I'm still hungry. Never let a bitch take a bill from me. Like Jordan in the 4th quarter, I'm still money. Best believe the flow water, we still runny. Make your stomach feel funny, I'm so sick. With 16 bars twice the value of gold brick. Make it known quick that I'm greedy, we got the rats and the cheese B. So believe me. [Chorus]"
if it all ended tomorrow,"What Would You Do If It All Ended Tomorrow?. Time Runnin Out, Ain't No One You Can Borrow. So Many Paths, which one you gonna follow?. What Would You Do If It All Ended Tomorrow?. What Would You Do If It All Ended Tomorrow?. Time Runnin Out, Ain't No One You Can Borrow. So Many Paths, which one you gonna follow?. What Would You Do, What Would You Do?. Uh, this is how it go down. I have the black-pound-silence so it don't make sound. I pile a 150 outta town, aint nobody around. I`m in the back seat breakin it down. My love has been a past week dawg lately I found. Our press made us turn the radio down. But God bless now they talkin bout layin me down. Now they on about shovels in the weight of the ground. What now?. Preachin on the way that they handle thing. Watin patiently to do the 6-foot Same Thing. Now, so I take a second look at my life. I made too many mistakes that I just couldn`t make. right. Should've been more focused than I take things light. When I'm gone this is what ya'll will say I was like. American fool, no not that baddest or cool. Just a big fish caught up in the shallowish pool. Not a big name playa, in fact its true. Never wanted this shit without the kats he knew. He got lucky rode the co-tails of everyones fame. In two weeks aint nobody gon' rememba his name. Fuck It. I'm ready to go, I done made records. Made monetary often that flow. More importantly though, I proved everyone wrong. It`s all over regardless what you say when Im gone. What now?. What Would You Do If It All Ended Tomorrow?. Time Runnin Out, Ain't No One You Can Borrow. So Many Paths, which one you gonna follow?. What Would You Do If It All Ended Tomorrow?. What Would You Do If It All Ended Tomorrow?. Time Runnin Out, Ain't No One You Can Borrow. So Many Paths, which one you gonna follow?. What Would You Do, What Would You Do?. I want ya'll to feel the wound, its the truth in my words. I been quiet for too long, the truth should be heard. It was a while back, 10:20 in the morn'. Kat should up on my lawn in the rug-ed uniform. Unexpected, theres a knock on my door. I met this fool in the club, I don' see him before. Open to great him, but the second he sees me. His eyes buckle, his voice is uneasy. But it's cool, I didn't even catch it at first. I check his shoulder, homie's rockin a purse. Now I know something's tricky, but I'm already sittin. down. Homie pipes up, you should hear what he's spittin out. Says I've been sleepin wit his wifey. And he ain't the type of kat to take that shit. lightly. I made a move and he told me homie wait. Reached in his purse pulled a chrome 38. He asked me if I'm ready to die. Said he was gonna pull my brains all over the sky. Said he was leavin the country, and he was straight. with the passports. Cocked the hammer, I'm thinkin my last thoughts. I'm in a bad way, nothin could save this.. I close my eyes hopin it's painless. Just waitin for the sound, ready to swallow too. But homie havin trouble with his follow through. By a miracle, I avoid the chalk ground. Homie's confused, he just wanna be talked down. His wife is sleepin through town and he knew it. Picked me outta the crowd but couldn't do it. Just lost it, and as he's walkin away. I realize life is short so I'm markin the day. Now it's full speed ahead, I'll rest when I'm dead. And I could give a Fuck what the next man said. I live how I wanna live. Buy what I wanna buy. Do what I wanna do. Try What I wanna try. Fear nothin, take chances. Not afraid to fail, always makin advances. So when I ride on the Grim Reaper Highway. No regrets bitch, I did it my way. Yeah (yeah, yeah, yeah). What Would You Do If It All Ended Tomorrow?. Time Runnin Out, Ain't No One You Can Borrow. So Many Paths, which one you gonna follow?. What Would You Do If It All Ended Tomorrow?. What Would You Do If It All Ended Tomorrow?. Time Runnin Out, Ain't No One You Can Borrow. So Many Paths, which one you gonna follow?. What Would You Do, What Would You Do?"
john cena rap (rock diss),"Rock wanted me to write his song. Tonight but I would never be his mouthpiece. Cause rock's like lebron james. He took his talent straight down to south beach. And for the past few weeks. Rock's been legitimately pissed. If you get stuck singing your song. Tonight rock it's all in the wrist. Could we please have a week where. You don't come out here and choke?. You may be g. I. Joe this summer, right now you're a g. I. Joke. Ever since I opened my mouth about. You you been beggin me to back off. So if rock and dwayne are the same person. I think y'all both are jackoffs. And after april 1st, you won't be making no more movies. You gon' need surgery on your face just. Like you had it on your boobies. Those poppin pecs they had more. Work than a locker room full of divas. I got a gift for rock tonight, I'ma give him a cleveland steamer. Team bring it? He's team lost it and the truth is gettin scary. Cause they weren't chantin ""rocky"". Last week, they were chantin ""tooth fairy"". Keep making fun of this fruity pebble rock. Cause I ain't even close to sick of it. I'm mr. Kung pao chicken. You just miami fried chicken-shit. And no, no, I don't have balls but. I got somethin in their place. I'ma beat yo' ass at wrestlemania. And put my nuts dead in yo' face!"
just another day,"Chorus: John Cena and Trademarc]. This is just another day in the life. Seven flight connectors - past due bill collectors. This is just another day in the life. Mo' money mo' problems - and I ain't got money to solve 'em. This is just another day in the life. Gettin mobbed by fans - man nobody even knows who I am. This is just another day in the life. This is just another day... in my life. [John Cena]. Everybody asking me - what you really like?. Is this really life? Do you really fight?. Do you fear the mic, when there's millions watchin?. Are you super rich now, how much grip you coppin?. You the new kid, now you getting some shine. When every vet sayin that it's not yo' time. My hustle is non-stop and it's not yo' grind. Plus I hear very clear, I'm not so blind. Beef I don't sweat it, sleep I don't get it. I remember your face it's just your name I forget it. These days they melt together as one. I got some plans to do shit that ain't never been done. Take this game into battles that ain't never been won. I ain't gon' walk through life, I think it's better to run. And yeah I'm eatin right if you askin. But the size of my wallet that's reflection of passion. [Chorus]. [Tha Trademarc]. Just another face in the crowd, so to speak. Huh, my electric was cut off last weak. No heat, no food, no money, no girls. And if life's my oyster then I ain't found pearls. Makin moves every day so the ends could meet. No gas money, so I use my legs and feet. Everybody I meet man, they likely saw. that I be in the same clothes from the night before. Shoes so old you can call 'em retros. Man I'm so damn broke, even my wallet echoes. I got a dollar and change; man, I'm under the gun. That buck's the only thing keepin me from bein a bum. That's why I'm writin these words man, so I can get on. So I can realize bein poor was makin me strong. And the only reason I can't rub pennies together. is cause I carry big bills, in genuine leather. [Chorus]. [Cena] Shakin hands with some fans by the thousands. [Marc] My place so poor, looks like public housin. [Cena] Gettin the Porsche when I shoulda got the CL6. [Marc] My ride broke down, I'ma kinda between whips. [Cena] Face on the X-Box, you played the game lately?. [Marc] Man I can't rent, I owe too much in late fees. [Cena] Do I, charter a jet, or fly first class?. [Marc] Do I take a cab? Bus seats hurt my ass. [Cena] Pay my jeweler in cash, he don't take a check. [Marc] The chain I rock, leaves a green mark on my neck. [Cena] Do I get the filet steak or the shrimp & crab mix?. [Marc] Do I get a number 3 or a number 6?. [Cena] Get in the club V.I.P. man they lettin me slide. [Marc] Man they bust me for dress code, I'm still outside. [Cena] Everybody wanna be down, but I ain't got no friends. [Marc] Man nobody's around, I ain't got no friends. [Chorus]"
