pistolvania (feat. freeway & jakk frost),"I can show you how the nine spit. It's Frost, Freeway, and Vinnie. from Jedi Mind Tricks, I'm on my grind trick. Niggas flows is hot but Frost greater. Y'all niggas don't exist like Luke without Vader. Got a young buck that remind me of Lando Calrissian. Smooth as Billy Dee when he sneak his pistols in. Like Colt 45 it works every time. Vinnie out there drinking on that (that's right). I know they out there thinking on that. Niggas think about creeping on Jakk. Probably mad cause his main bitch creeping with Jakk. Every third weekend with Jakk she sleeping with Jakk. How sleazy is that?. Y'all niggas talk drugs but you ain't seen the brick yet. I've been touching money since the Kid n Play Kick Step. But a house party to me is a crib full of fiends. Ready to cop that ziplock ready rock. Hip hop started out in the park. That's right, we used to do it when the weed would sparked. When the drinks start flowing and the green starts glowing. If you from the hood I know you feel me, keep going. Hip hop started out in the park. That's right, we used to do it when the weed would sparked. When the drinks start flowing and the green starts glowing. If you from the hood I know you feel me, keep going. Who the best motherfucker in the street. that you never heard?. The 45 separate your head and it severs nerves. Call me Koko B. Ware, I carry several birds. I'll demolish enemy scholars with every deadly word. These motherfuckers. don't know the pain that the stainless doing. I'mma let 'em take it back to the block and explain it to 'em. Cut a motherfucker head like Hussein would do him. Take his motherfucking bread now, it's painless to him. And feed the pitbulls that man's bones. Cause I'm here to fuck the game up like Pac-man Jones. I'm Kobe with rock, if not I'll fucking zone in the spot. But if you disrespect my mother or my home then you shot. I'm lonely a lot and that's the type of person who's deadly. And the 50 cal make your face look like spaghetti. Look at this feti, look at all this beautiful shit. A south Philly scumbag wearing Gucci and shit. It's over. Hip hop started out in the park. That's right, we used to do it when the weed would sparked. When the drinks start flowing and the green starts glowing. If you from the hood I know you feel me, keep going. Hip hop started out in the park. That's right, we used to do it when the weed would sparked. When the drinks start flowing and the green starts glowing. If you from the hood I know you feel me, keep going. . This is Jakk Frost, it's your boy Vinnie, Philly Freezer. We do it proper cause hip hoppers they really need us. I tote the semi. If you warned you won't really see it. How about a tough guy scream when he's shot. I ran terror from the same era as Biggie and Pac. This is Roc-a, we will pop you leave you paraplegic. You never there. I'm everywhere. I say I'm there then believe it. When you see me Louis Vuitton here in the drop yeah. Philly Freezer get paper all year. New Year's I'm on the ball, I'll be there when it drops. These snitch niggas saying I'm there when I'm not. Bet you when the bodies dropping they start calling the law. Rockafella heat spitters, Desert Eagle heat holders. Philly Freezer keep soldiers that'll ride for the cause. The Ak will heat niggas, it'll flip your Jeep over. If these niggas try me probably catch a body tomorrow yeah"
righteous kill,"I'm a fucking thunderstorm, you's a light shower. You a bitch, you shoot and miss like Dwight Howard. You can't battle the god, I'm too precise coward. That's like Khalid Muhammad saying he's White Power. This the machete that your organs getting sliced out with. The blind motherfucker in the village, Bryce Howard. My brain only function proper in the night hours. You might own a fucking label but the mic ours. My shit hi-tech, lord, like a plastic bomb. An asshole, I punch people with glasses on. Anybody disagreeable we mashing on. I only fuck with green and gold god magic wand. An encore is the only thing that you clapping on. I'm a pitbull, pussy, you a papillon. A bitch get a 40 from me, not a glass of Dom. I'm the G-29 in the assassin's palm. All I hear is danger, all I see is danger. All you hear is ""run, run, here come danger"". Shatter dreams like Freddy your thoughts rearrange ya. Stare death dead in the eyes, it'll change ya. It's a righteous kill, I don't do nothing but write and kill. Drink 40's, smoke L's, push the white and krill. I move strong and fast, I have a bison's will. I'm the motherfucking champ, I'm the fighting Phils. I'm from the city of the syrup and Vicodin pills. From the city the most fearless of fighters was filmed. The city where we have the most street veterans still. The Moors, Nuwaubians, Five Percenters will build. I'm from Philly motherfucker, the rawest it comes. I make your body disappear, I'm a sorcerer's tongue. You live your whole life in fear that the torture will come. I hope my music is revered like a portrait of Pun. I'm paranoid god here in my fortress with guns. I had a void god, filled it with whores and with blunts. I ain't have a choice god, I was born in the slums. I ain't have a voice god till I slaughtered the drums. All I hear is danger, all I see is danger. All you hear is ""run, run, here come danger"". Shatter dreams like Freddy your thoughts rearrange ya. Stare death dead in the eyes, it'll change ya. Yeah, the four-fifth is a melon popper. Hollow tips spin your body like a helicopter. Anything can move god if you sell it proper. And I've been through more viewings than a teleprompter. This is horrorcore beat, got hella monsters. My team's got more Gs than a spelling proctor. Y'all ain't never moved D, y'all are petty choppers. I got a vicious left hook, call me Eddie Thomas. But I'm raw with the right hand. Like Jack Johnson fighting against the white man. Yeah I'm about to shorten your life span. Evil shit can be good if it's in the right hands. I make motherfuckers burn, you a slight tan. I keep a motherfucking urn on my nightstand. So wait your motherfucking turn like a hype man. I bury you with the snitches under the white sand"
role of life,"Life, this role of life. This is Rock of Gibraltar rap. The Springfield M14 show you where the coffin's at. You motherfuckers don't belong in rap. Fuck with me you got a better chance. taking an abortion back. You lack flavour, put some sauce on that. I went to the Great Wall, put my fist through. and walked through that. Where this motherfucker's fortune at?. I'm a levitate his body, make it spin like a Laundromat. Motherfucker I was born to rap. I've been making records wild long. never did a song that's whack. How many have accomplished that?. I was wild as a young boy. shouldn't have put moms through that. Vinnie Paz been to Nam and back. I ain't never put the guns down cousin. so my palms is black. You a bitch, I ain't involved with that. I got a big trunk. and that's where Vinnie keep all of his corpses at. Life, this role of life. Silverback Gorilla walk through the minefield. We don't see eye to eye how you define real. Y'all are wondering if I'm out of my mind still. I just need some liquor and pills and I'm chill. I run with Puerto Rocks, Morenos and vagabonds. And Paz will shoot this motherfucker up like Barrie Bonds. I'm like a military doctor, Vinnie carry arms. My shit is military proper, Vinnie carry bombs. I kick in the door like Bi did. And the automatic weapons look like Ti crib. Vinnie fat, you'll never see my ribs. I don't call it loading bullets, I refer to it as feed my kids. All I think about is slaughtering y'all. This little motherfucker named Charles Hamilton. is harder than y'all. It's in the garbage with y'all. Listen to all you Myspace rappers, I'm a father to y'all. Life, this role of life. I write in the rain, turn beautiful night into pain. I turn life into a frightening game. I don't have love in me, it's just ice in my veins. My fist Hammer of Thor, I Tyson the game. This rap shit deep in my heart. Y'all was sleep from the start. But that just led to unbelievable art. And on top of that the god is unbelievably smart. My bare fists turn trees into bark. Y'all don't want any improvement at all. Y'all are devils, y'all are torturing the rule of law. My mind is a computer of war. And it's typically the biggest motherfucker. that'll usually fall. Give me one take cousin, the god out. A forty of eligibility. The forty Glock popping your eyes out. Now you never get a chance to see what the god 'bout. Life, this role of life. I'm not you rapper. I'm a G. Louie fucking dogs. The Genocide General. Heavy Metal King. Yo Bill, what up Daddy. The god Jus Allah. Sinatra where you at"
same story (my dedication) (feat. liz fullerton),"They say that things just cannot grow. Beneath the winter snow. So I have been told. You came into my mother's life at the right time. More than a step-father, more of like a lifeline. She ain't really had happiness since my pop died. She was living but living is always not alive. And my momma should be treated like a queen. You gave her everything she ever needed like a queen. Probably the most gentle G I ever seen. The love y'all shared I never seen in human beings. Y'all were together twelve years, never no fights. Not even a little argument. That was so nice. Three of us eating dinner together most nights. Working seven days a week. That ain't no life. But never once did I hear you complain. Even when they let you go never hear you with blame. It take a real man to walk through the rain. He was a real man who got sick. and fought through the pain. I am made of all four corners. All directions without the borders. I am strung so loose together. And you're a thread that holds forever. I'm not nobody's baby. You had your shit too. But you always came through for me. I walked in that morning and knew something was wrong. I tried to talk to you, Rock. You didn't respond. I called 9-1-1 and then ran for my moms. Waiting for the ambulance and I tried to be calm. Moms went with you. I stayed and held down the fort. I was nervous. I was crying and really distraught. I was alone by myself, just left with my thoughts. Mommy called. Told me that you had a stroke and fought. I ain't seen a hospital since my father died. I don't like it there. Memories is locked inside. When I walked inside the room we started to cry. I was just so happy that you was alive. And you told me how much that you hate the hospital. And that they thieves and trying to keep their pockets full. I think I hold myself a little bit responsible. When you was smoking all the time. I wasn't stopping you. Nevertheless you came home and that was real. A lot of therapy and doctors gave you lots of pills. You couldn't drive anymore. You had to stop and chill. And that's too much for anybody that can stop your will. But you never got back to your norm. You was proud. Didn't want any help from my mom. I left for tour and you asked me how long I'd be gone. And I could see inside your eyes. you knew something was wrong. I got back. Mommy told me you was sick again. Couldn't believe. that we was going through this shit again. I love you Rock and I'm always gonna miss you friend. And for me it's just the same story, different pen. I am made of all four corners. All directions without the borders. I am strung so loose together. And you're a thread that holds forever. I'm not nobody's baby. You had your shit too. But you always came through for me"
street wars (feat. clipse & block mccloud),"Yeah, bout as real as they come. Still pushing base like an African drum. The only other hands that it touched before Young. Was a Guala out of Dallas with shag like Tum Tum. Back to the hood where niggas started detoxing. Till I hit them corners with that motherfucking sheet rock. The rollers back bitch, the seal's on the back bitch. The six-three highlights the difference like an asterisks. Yes, the re-up game never dies. Soda makes the brick multiply. Push tons of monster with the pie. Keep water from the villain. Remember what it did to them gremlins?. Oh God, street wars when the heat warms up. In summertime niggas know what's up. Heavy armour, heavy drama, heavy karmas. We the reason haters scared of us. fucking their baby mamas. Soon as this product hits the street. You know they will be strung. They'll be dancing to the beat of this drum. Listen, It's addiction hey. You know we got em hooked like fiends. They open like a trunk. They'll be dancing to the beat of this drum. Listen, It's addiction. Yeah, I told Pusha, I told Mal. Vinnie move more white shit than a snowplough. Everybody knew the Guinea was so foul. The Sks with the bayonet, oh wow. I'll rob everything and leave you with a hungry gut. The hollow tips leave you looking like you got a Gumby cut. You think you fucking with the God then you's a funny fuck. Rambo knife cut your stomach like a tummy tuck. All you see is darkness when the gun bursts. The G36 melt your brain like a Pun verse. I act wild but I handle my funds first. I'm drunk all the time, blood quenches the son's thirst. I don't talk about the money I got. Because if money want my money then money gets shot. Rap shit don't work then I dumb on the block. With Pusha and Mal cooking up the drums in the pot. . Soon as this product hits the street. You know they will be strung. They'll be dancing to the beat of this drum. Listen, It's addiction hey. You know we got em hooked like fiends. They open like a trunk. They'll be dancing to the beat of this drum. Listen, It's addiction. Still with the coke man, same as it ever was. Re-up gang, we the shame of America. Eighties hysteria, the 'caine be my legacy. The feds got our names, they hang us in effigy. Best believe it come back like it never left. I write rhymes but I'll bet I'd make a better chef. They can't wait for it to dry, they like it better wet. And I'm heavy with the D like Eddie F. I whip it good, real good then I let it rest. Then I scrape the sides then I let em test. Yes, I got weight like Creatine. A gem star hit that chopping block like a guillotine. Know what I mean? Sitting on chrome rims. Not only paper, we stack brick like Stonehenge. Go against us? Haters got no wins. I trust no one and I don't need no friends"
warmonger,"My fist enters in your temple like an obelisk. It's blackness, darkness, abyss of joblessness. Everything you do is small, my shit is monstrous. I murder devils and any of their accomplices. My brain function on other levels of consciousness. My brain function on other levels of pompousness. You're listening to the bass and treble of godlessness. My thirty-eight will spit hate and level the populous. My esophogus breathes evil that just demolishes. Whether or not you're a believer in the Apocalypse. Y'all shit is sweeter than two faggots that's locking lips. It ain't a rapper competing with my obnoxiousness. It ain't nobody that's equal to my accomplishments. The Desert Eagle is legal and it astonishes. The Ar15 diesel and blow your mom to bits. It's hard to catch me, I'm Thurman Munson. and Carlton Fisk. Music is motivation for me to just go insane. Man I see it on paper, I know that I should be caged. And I'm trapped but I escaped it. By trapping in that trap for that paper. Music is motivation for me to just go insane. Man I see it on paper, I know that I should be caged. And I'm trapped but I escaped it. By trapping in that trap for that paper. Y'all know the flow is precise. You don't owe me your life. But that could change one roll of the dice. And then money try to go for his knife. I'm a levitate his body to the sky. until he's homies with Christ. Don't even fuck around, son is a goon. Son is bipolar, alcoholic, son is consumed. I breathe life into the sun and the moon. I breathe life into the most barren bloodiest womb. Y'all don't know y'all getting stalked in the shower. Populism is rebellion over corporate power. Politics is just the talk of the hour. It's a matter of time before they hit another office or tower. I don't care, I put the gun to your ribs. And the Desert E big, it'll separate mothers from kids. I walked around from Philly slums to the bridge. Been around the world eighty times. nobody can fuck with the kid. Yeah"
washed in the blood of the lamb,"""The only reward of those who make war upon Allah. and His messenger, and strive after corruption in the land. will be that they will be killed or crucified. or have their hands and feet on alternate sides cut off. or will be expelled out of the land. Such will be their degradation in the world. and in the Hereafter theirs will be an awful doom! "". If you listen to me then you know my father was G. And the apple don't fall too far from the tree. Me and you is different as we can possibly be. Me and you is just different philosophically. I don't think its anybody as obnoxious as me. I don't think that anybody else could parted the sea. I don't think that you wanna discuss the horror with me. If I was you I'd move a little bit more farther from me. It ain't nobody living more of a sergeant than me. It ain't nobody alive more of a prophet than me. It ain't nobody living possibly rocking with me. On the stage, in the studio, or boxing with me. Every second I'm awake there is a toxin in me. Anti-depressants, Suboxone, Oxycontin in me. Only a stupid motherfucker have a problem with me. Cause he don't know. I got the fucking problem-solver with me. [x4]. I was washed in the blood of the lamb. Whoever touches my hand. gonna leave enough blood in the sand. I was washed in the blood of the lamb. Whoever fuck with my fam suffering. A motherfucker should scram. I slaughter anything I get my hands on. Inside the Church of Anton with bloody pants on. I was in the land of Israel and heard ram's horn. I was in the sand with Ishmael and fought the sandstorm. I'm just waiting for the raven to thaw. Cause I don't argue with Mesopotamian law. I submit my will and faith into the grace of Allah. And the Mayan calendar say it's erasing us all. The four-fifth: you should see this thing. It's berserk. And y'all are royalty inside a fucking kingdom of dirt. How are y'all original when y'all ain't think of it first?. I just wish I could put everything I think into verse. But instead I decide to drink in a Russian bar. I'm Rasputin, I'm influencing a Russian Tsar. I'm Dave Lombardo on drums. Leave the percussion scarred. I drink the bottle to the bottom. Put my trust in God. [x2]. I was washed in the blood of the lamb. Whoever touches my hand. gonna leave enough blood in the sand. I was washed in the blood of the lamb. Whoever fuck with my fam suffering. A motherfucker should scram. Kill them whenever you confront them. and drive them out from where they drove you out!. For though killing is sinful, wrongful persecution. is even worse than killing. Do not fight against them near the holy mosque. unless they fight against you. But if they fight against you, kill them. for that is the reward of such unbelievers. Pazienza! Fourth disciple! The Assassin's creed!. Official Pistol Gang! Ha-ha-ha-ha-ha-ha!"
you can't be neutral on a moving train,"Governments lie all the time. Well, not just the American government. it's just in the nature of governments. Well, they have to lie. And since they don't represent the people. and so since they act against the interest of the people. The only way they can hold power. is if they lie to the people. (You don't know what I know. you can't see the spreading state. Of deception, I am cruel to myself. things will never be the same). If they told people the truth they wouldn't last very long. (I will hold my silence like a weapon in my hand. If I used it I would murder myself. You could never understand). Columbus came ashore. greeted with nothing but niceness. Sailing west in attempt to find gold and spices. Dominated by the popes in frenzy for ices. The Catholic church expelled Jews. and claimed it was righteous. The first man to see land would get a reward. And get a yearly pension for life clearly from God. A young sailor saw land said, ""We isn't far"". Columbus lied, said he saw it the evening before. They touched ground, they were greeted by the Arawak. Columbus had them locked up as prisoners. in an hour flat. He wanted to find their source of gold and that was that. And when they thought that wasn't fair. then he stabbed their back. When there was no more gold he took slaves instead. And left a quarter million Indians in Haiti dead. The men died in mines, the women died at work. The children died from lack of milk. and they died in the dirt. They were just taking advantage of a passive people. They were just being the savages of massive evil. That's the church work, that's the path of massive ego. That's the blood of Abraham. being stabbed by the steeple. In 1619 they were patiently waiting. For a ship that carried slaves. that was changing the nation. The white man was a cannibal praying to Satan. Hatred contempt a pity of patronization. That's the corner stone everything racism based in. The African had a more advanced civilization. Black was slave, master was white, rationalization. 50 million dead, that's Western civilization. At first they appeared in the North. And they were helpless in the face of superior force. And all of them were chained together. they really was lost. Racism isn't natural it's merely divorce. Before the slave trade black was considered distasteful. By the Oxford dictionary, I find it disgraceful. It's not a natural tendency to be bitter and hateful. It's the natural enemy of the critical staple. Slavery grew as the plantation system grew. The reason for that's kinda easily traceable. Society of helpless dependence was capable. Of saying, ""Fuck a slave master, you're in slavery too"". Seven slaves were put to death for murdering master. Fear of slave revolt had them developing faster. You a cataline killer, ineloquent bastard. I would burn the white man while smelling the ashes. From time to time white man was part of the resistance. White indentured servants wanted no part of the system. King Philip's War showed that if people would listen. That they can. maybe break the complex chain of oppression. Tyranny is tyranny, but that's a concession. But the women they was treated like that of possessions. Black women had it worse cause they was abused. That's the white justification of Aryan blues. The next move was to dominate the Mexicans. James Polk dominated them like they was next of kin. He sent Colonel Cross to lie to them and let them in. 11 days later, his skull was crushed, so message sent. ""We take nothing by conquest, "" that was the mantra. The military wasn't human, they was just monsters. Henry David Thoreau refused to pay his taxes. Denounced the Mexican War and got locked in shackles. The twentieth century opened, anger reemerged. Reality of ordinary life was being heard. Anarchists and feminists came from factory work. Communism, socialism seemed to be re-birthed. ""War is the health of the state"" is what Bourne said. And if you was born around that time you was born dead. The Espionage Act had people confused. Cause it was double talk. and they didn't know how it'd be used. Supposedly it was an act against spying. Dubois knew that that was bullshit and they was lying. Charles Schenck was arrested in Philadelphia. For printing and distributing leaflets. cause they was helping ya. He was indicted, tried and then found guilty. And spent six months in jail, don't that sound silly?. Had his freedom taken away by his own nation. But there's a lesson, do not submit to intimidation. The act still exists today and this shit is real. Supposedly Kennedy tried to have that shit appealed. Eugene Debs did ten years for no purpose. He obstructed the recruiting and enlistment service. The post office started taking mail privileges. Of magazines who printed anti-war sentiments. A Socialist named Fairchild had it right. He said that ""they can shoot me. but they can't make me fight"". They sentenced him to a year in jail. and that was reckless. 65, 000 men, conscientious objectors. They were sent to army bases to work there. They were treated sadistically and were hurt there. They were strangled with the hemp rope til they collapsed. And officers punched they stomach and they lower back. A garden hose was placed on they face with a nozzle. About six inches from them so they couldn't swallow. The war ended in nineteen hundred and eighteen (1918). The government was just trying to wipe the slate clean. Hemingway wrote Farewell to Arms. Dalton Trumbo wrote Johnny Got His Gun. The war was over but they didn't learn they lesson. Twin tactics of control, reform and repression. The patriotic fervor of war had been invoked. That's why the country that you live in is a Fucking Joke!. You cannot be neutral on a moving train. This is a story about the lies that your teacher told you. This is real actual factual. No lies in the whole record. If you don't believe me look it up. I'm trying to share the shit that I learned with y'all. Do the knowledge. Your government does not care about you. The people in power do not care about you. Understand that. Power to the people"
