end of days (feat. block mccloud),"The greatest form of control. is where you think you're free. when you're being fundamentally manipulated. and dictated to. One form of dictatorship. is being in a prison cell. and you can see the bars and touch them. The other one is sitting in a prison cell. but you can't see the bars but you think you're free. What the human race is suffering from is mass hypnosis. We are being hypnotized by people like this. newsreaders, politicians, teachers, lecturers. We are in a country and in a world that is being run. by unbelievably sick people. The chasm between what we're told is going on. and what is really going on is absolutely enormous. It's like we all know what's going down. But no one's saying shit. What happened to the home of the brave?. These motherfuckers, they're controlling us now. But no one's talking about it, made us modern day slaves. And everybody's just walking around. Head in the clouds. We won't awake until we're dead in the grave. By then it's too late, we need to be ready to raise up. Welcome to the end of days. Everybody enslaved, only some are aware. That the government releasing poison in the air. That's the reason I collect so many guns in my lair. I ain't never caught slipping, never underprepared. Yeah, the Shaitan army, they display it proudly. George Bush the grandson of Aleister Crowley. They want you to believe the lie that the enemy Saudi. The enemy ain't Saudi, the enemy around me. There's fluoride in the water, but nobody know that. It's also a prominent ingredient in Prozac. How could any government bestow that?. A proud people who believe in political throwback. That's not all that I'm here to present you. I know about the black pope in Solomon's Temple. Yeah, about the Vatican assassins. and how they will get you. And how they cloned Barack Hussein Obama. in a test tube. . It's like we all know what's going down. But no one's saying shit. What happened to the home of the brave?. These motherfuckers, they're controlling us now. But no one's talking about it, made us modern day slaves. And everybody's just walking around. Head in the clouds. We won't awake until we're dead in the grave. By then it's too late, we need to be ready to raise up. Welcome to the end of days. Whoever built the pyramids. had knowledge of electrical power. And you know that that's the information. that they suppress and devour. Who you think the motherfuckers. that crashed in the tower?. Who you think that made it turn into ash in an hour?. The same ones that invaded Jerome. The ones that never told you about. the skeletons on the moon. Yeah, the ones that poison all the food you consume. The ones that never told you. about Mount Vesuvius Tomb. The Bird Flu is a lie, the Swine Flu is a lie. Why would that even come as a surprise?. Yeah, the Polio vaccine made you die. It caused cancer and it cost a lot of people their lives. Do y'all know about Bohemian Grove?. How the world leader sacrificing children in robes?. Lucifer is God in the public school system. I suggest you open up your ears and you listen. . It's like we all know what's going down. But no one's saying shit. What happened to the home of the brave?. These motherfuckers, they're controlling us now. But no one's talking about it. made us modern day slaves. And everybody's just walking around. Head in the clouds. We won't awake until we're dead in the grave. By then it's too late, we need to be ready to raise up. Welcome to the end of days. . The greatest hypnotist on the planet Earth. is an oblong box in the corner in the room. It is constantly telling us what to believe is real. If you can persuade people that what they see. with their eyes is what there is to see you've got them. Because they'll laugh in your face of an explanation. then which portrays the big picture of what's happening. and they have"
god bless,"Boxcutter Pazzie. Y'all motherfuckers beat me in a dream. You better wake up and apologize. Aight, look. You can't out-maneuver me I'm in the peak position. I'm the creator of everything you perceive as wisdom. I build with O. G. God-body peep the vision. Ramirez over Whitaker that's just a weak decision. The God's nice with his hands, but don't think, though. Ak-47, Andrei Kirilenko. They thought Vinnie was 'Rican and not gringo. Needed hardbody production and called Bingo. I'm a guinea, I fuck around with casino bastards. A cataclysm, metabolism, amino-acids. Y'all motherfuckers sleeping like Christina Onassis. How you prove my father's dead, I never seen his ashes. I will kill motherfuckers, that is plainly said. And that's the thirteenth chapter to engage the dead. The most confidential part of what the Vader said. This a Vietnam song, Vinnie takes his head. Oh y'all want a fatal disease? (God bless). Oh y'all trying to prey on me? (God bless). Ain't nobody fucking with V (God bless). The seventh day best for me (So God rest). Everywhere that you see joy, I see the pain. It's just the infiltration of poison in my vein. Maybe it's a bit of paranoia in my brain. Or how I see the hasidim and goyim is the same. Maybe it's why I see Kaczynski as if he was sane. He was possibly the product of a Christian name. (Y'all are pagans). Leo Zagami told us about the shifting change. But y'all ain't listenin' to him. y'all just want to shift the blame. Or maybe y'all just think I'm twisted and I'm on one. Or that of the infernal power of the horned one. (Lucifer's free). You don't wanna shoot the fire so come on dun. You don't have the clarity to feel the power of God's drum. Do you overstand the God and his wealth?. Have you ever seen a person just demolish himself?. All you rat motherfuckers only lie to yourselves. I'm a end it for you pussy, say goodbye to yourself, stupid. Oh y'all want a fatal disease? (God bless). Oh y'all trying to prey on me? (God bless). Ain't nobody fucking with V (God bless). The seventh day best for me (So God rest). God Bless. So God rest"
intro,"He's a fighter, and fighter. You don't make fighters. Vinnie's a born fighter. And I could see that. That this kid when he was little. He was different from other kids. Yeah! Pazienza!. I'm Here Baby!. The way of the assassin is found in death. Meditation on inevitable death should be performed daily. Every day when one's body and mind are at peace. One should meditate on being ripped apart by arrows. Rifles, spears and swords. Being carried away by surging waves. Being thrown into the midst of a great fire. Being struck by lightning. Being shaken to death by a great earthquake. Falling from thousand foot cliffs. Dying of disease or committing seppuku. At the death of one's master. And every day without fail. One should consider himself as dead. This is the substance and the way of the assassin"
keep movin' on feat. shara worden,"I lost my job at the factory and that's disastrous. They said it's due to regulation and higher taxes. They ain't give me no notice. They knocked me off my axis. I can't pay the electric bill. It's total blackness. I suggested some incentives for innovation. But that was met with resistance like it's a sin of Satan. I'm losing my patience over here. I'm sick of waiting. And I ain't never expect to be in this situation. And the manufacturing jobs are fading fast (Damn). Can't do nothing else. I should've stayed in class. I have to wait till summertime to cut the blades of grass. I have this little bit of money. Have to make it last. I have children to feed. I have a loving wife. I had a hard time coming that was nothing nice. I keep asking myself what am I doing wrong. And they just look at me and tell me ""Keep it movin' on"". Keep movin' on. But I don't know where to go. Nowhere to go. Keep movin' on. It was like '91, '92. I remember people telling us. that ain't nobody signing you. There's no Italians or Puerto Ricans. that's shining through. Y'all should just go back and just do what y'all. was designed to do. We ain't listened to none of that. We hard-headed. We took it back to the lab and then the God set it. We smoked L's, drank liquor and we got wetted. And everything we did back then was barbaric. Around '94 had some labels take notice. They said that Stoupe was the illest. but that I ain't focused. The label execs needed to be explained dopeness. And that's around the time. I thought that it became hopeless. We was still in the street. D was moving strong. I was failing out of school. It wasn't cool with moms. I was asking myself, ""What was we doing wrong? "". And why the industry keep saying to keep it movin' on. Keep movin' on. But I don't know where to go. Nowhere to go. Keep movin' on. I signed up cause they promised me some college money. I ain't the smartest motherfucker but I'm not a dummy. They told me I would be stationed in places. hot and sunny. I had a lot of pride. Motherfuckers got it from me. These people over here innocent. They never harmed me. My sergeant tried to convince me. that they would try to bomb me. I feel like an outsider stuck inside this army. Everybody brainwashed. American zombies. I ain't realized how much it set me back. Until I lost my leg and then they sent me back. I don't have anything now. I'm left with scraps. From a government who created Aids, invented crack. People told me not to join. I tried to prove 'em wrong. Now I'm homeless and I'm cold without no food thas' warm. I keep asking myself, ""What did I do that's wrong? "". And the government telling me, ""Keep it movin' on"". Yeah, a wise man once said. There is no progress, without struggle. I'm a believer in that shit. I struggled my whole life. Feel me on this here. [Shara Worden]. Ohh, keep movin, keep movin (Pazienza). Keep movin, keep moovin on"
kill 'em all (feat. beanie sigel),"People want to think that this is the Wild West. we don't have any laws. What we don't have is enforcement of those laws. Senator Fumo argues tougher gun laws alone. won't stop shootings. Last time I checked we had a law against murder. It doesn't prevent people from killing people. The governor, the mayor, the Da. they all want stricter gun laws. Man, fuck all that bullshit! Vinnie Paz, what up?. Broad Street Bully in the building. I say kill them all! Exterminate these roaches!. Fuck that! You pay me or pay Carto!. Pay Pells or somebody. Hawkins or somebody. Pay me or pay the funeral home, nigger!. Kill all y'all niggers! What!. [Beanie Sigel:]. May death come to all those who cross us. The preachers, the pastors, the deacons, coffins. Church masses, closed caskets. Bible verses, long black hearses. Long-ass gats too big for holsters. Obituary posters is getting posted. The reaper closing in. He's getting closer. You just fake. You blink it's over. State prop soldier here. Sk shoulder gear. Ice grill who? Hold that stare. Half a clip. Now hold that there. Throw out your hip. Now roll that chair, yeah. You missed the list of the souls I spare. I double-checked that you ain't on that there. I squeeze weapons. Hollow points open up like the cobra head. Collapse lungs like a fold-up chair. Flat line! Clear. Kill 'em all, kill 'em all. Kill 'em all, kill 'em all. Kill 'em all, kill 'em all. Kill 'em all, kill 'em all. Kill 'em all, kill 'em all. Kill 'em all, kill 'em all. Kill 'em all, kill 'em all. Kill 'em all, kill 'em all. I rhyme like my life on the line. This fucking mic is mine. The past burglar, the mass murderer, the viper's shrine. A strong body could never conquer a righteous mind. Some think it's destiny. Some of you think it's Christ-designed. You consider what I'm doing like a magical art. I consider what I'm doing like a stab through the heart. My brain moves at light speed. Nothing fast as my thought. You might feel a slight breeze from the savage's heart. Y'all saying Vinnie is back but Vinnie never left. I just had these faggots hating. and watching my every step. Everything with Vinnie very deadly, every breath. Everything with Vinnie very heavy, heavenly flesh. Y'all ain't fucking with weight. I'm doing steady reps. I'mma sell my shit and then skate like I was Kerry Getz. I keep my biscuit right next to where my machete rest. Everything is everything but pussy death is death. Kill 'em all, kill 'em all. Kill 'em all, kill 'em all. Kill 'em all, kill 'em all. Kill 'em all, kill 'em all. Kill 'em all, kill 'em all. Kill 'em all, kill 'em all. Kill 'em all, kill 'em all. Kill 'em all, kill 'em all. Beez, what up, cuzo? State Prop! Broad Street Bullies!. Vinnie Paz, Vin Laden! Official Pistol Gang!. Ab Liva, what up, cuzo? D-Boys, reup gang!"
monster's ball,"I feel reinvigorated, don't fuck with the boss. I'd rather cut my own throat before suffering loss. Anybody fucking with me get hung on the cross. I have anger in me, don't make me summon the source. I go to war with the Glock. I go to war with anybody motherfucker, I'm a sorcerer ock. Fucking everything whether the bitch is gorgeous or not. I murder everything, that's just some of my torturous plot. If you righteous and you under attack. Like the Anbar Awakening and Sons of Iraq. The fifty cal is like a thunderous clap. If you think that you safe and nothing wrong. that's a presumptuous act. It ain't no tomorrow, I don't got a dime saved. And if you did it's in the Wall Street crime wave. It ain't nothing worse in the world than a mind slave. Going to war with my people how I define brave. I'm a monster. Ain't no one can fuck with the kid. I'm a monster. My jail brothers stuck with a bid. I'm a monster. Everything I do is precise. I'm a monster. Pazienza ruin your life. I'm a monster. Ain't no one can fuck with the kid. I'm a monster. My jail brothers stuck with a bid. I'm a monster. Everything I do is precise. I'm a monster. Pazienza ruin your life. Yeah you know that Vinnie he been nice. Y'all don't belong inside of the ring like you Kimb' Slice. I ain't gonna take all of your skin, just a thin slice. They call me John ""The Beast"" Mugabi when Vin fights. Vin Laden, Taliban, Hamas, and Al-Qaeda. You a snitch cop lover, you fuck with a traitor. I'm a motherfucking brick you constructed of paper. I dumped the motherfucking clip now you dust. and you vapour. I was there when all the planets was born. Before the Continental Drift. and when Atlantis was formed. When Gandhi told the Indians to stand and be strong. And took the British out with intellect. in spite of their brawn. I'm a monster. Ain't no one can fuck with the kid. I'm a monster. My jail brothers stuck with a bid. I'm a monster. Everything I do is precise. I'm a monster. Pazienza ruin your life. I'm a monster. Ain't no one can fuck with the kid. I'm a monster. My jail brothers stuck with a bid. I'm a monster. Everything I do is precise. I'm a monster. Pazienza ruin your life. Everything Pazienza do is hard body. I don't care if you Blood, Ñeta, or Godbody. I was devilish before the power of God got me. I just think I let the fucking sword of Allah chop em. Mossberg nine thirty-five is amazing. The Prada high-tops the same colour as raisin. He a rat, not even his mother can save him. That's what you get for being brothers with Satan. The thirty-eight practical, the Glock is for fair. And this for jail brothers something. they can knock on the tier. Yeah, I'll stick a knife in your esophagus queer. I'm an animal, every rhyme will demolish you queers. Gas high but you can get the D for a real price. This Sig Sauer 1911 is real nice. I'll stick through the wrist with a steel spike. And now maybe you'll overstand the pain. of the real Christ"
no spiritual surrender (feat. sick jacken),"I don't know why y'all scared now, this ain't a new game*. Christians been raping children over in Ukraine. I don't indulge in small talk, it's only true pain. I don't divulge the plan ahk, I fuck with Hussein. Acid is falling from the sky, fuck a new reign. This is a flammable liquified gas butane. Muggs gave me audio heroin, hit the. Blue vein. I ain't even Vinnie no more, Evil my new name. I'm like Elijah Muhammad carrying thoughts afar. Laws of nature and mathematical charts of god. I'm taking everything letting you faggot authors starve. War criminals are becoming the arbiters of law. And y'all are fouler than swallowing pork. Real talk, free speech under foreign assault. And y'all are burying your head in the dirt. The heavy metal king hold big shit. hit your head with the lock. . This shit is (raw) , the Jedi Mind's (raw). It's war with the metaphor and you ain't seen a storm before. You ain't Pac, get the fuck out of the underground floor. It's over, homie you ain't got no love anymore. Do it (raw) , the Psychorealm's (raw). This war's gonna end all, you ain't seen a storm before. I ain't taking this shit no more. We approach with a white skull when we assassinating y'all. I'm the father of anything that's been done before. I was sparring with you, I ain't even begun the war. I like darkness, I don't know what the sun is for. Y'all have small hammers, y'all must be the son of Thor. Don't need hands, telepathically the gun will draw. That's the reason that you motherfuckers is running for. I saw the angel Gabriel y'all who we coming for. Y'all lock your part the same hell when I confronted y'all. I can ascend without any physical death. I can repent without any physical breath. To me it's not a discussion it's invisible chess. And if the vodka not Russian then it ain't hitting the chest. I can talk about drugs, guns, deading your shit. I can talk about the Torah and dimensional shifts. The power of the almighty is what's sent through my lips. The power of the almighty when the sentinel spits. This shit is (raw) , the Jedi Mind's (raw). It's war with the metaphor and you ain't seen a storm before. You ain't Pac, get the fuck out of the underground floor. It's over, homie you ain't got no love anymore. Do it (raw) , the Psychorealm's (raw). This war's gonna end all, you ain't seen a storm before. I ain't taking this shit no more. We approach with a white skull when we assassinating y'all. I'm the complete rapper. the seventh son of the beast master. My heart is bigger than anyone and it beats faster. I'm a fucking king getting better with each chapter. Kiss the fucking ring, you'd better agree bastard. A sucker Mc like the Dmc classic. I'm not a fucking star yet but the seed planted. Energy of god head, Vinnie P tantric. I'm capable of levitating and speak Sanskrit. Yeah, and that's all part of the perfect machine. Part of perfect precision, part of the perfect regime. Part of purpose and the part of the work on my Deen. Perform wudhu make salah now the surface is clean. Everything meticulous, Vinnie's work is pristine. Fuck with me you'll take a trip under earth with the queen. I give a fuck about a critic, I'm searching for cream. My shit is filled with hollow tips so it bursts in ya spleen. This shit is (raw) , the Jedi Mind's (raw). It's war with the metaphor. and you ain't seen a storm before. You ain't Pac, get the fuck out of the underground floor. It's over, homie you ain't got no love anymore. Do it (raw) , the Psychorealm's (raw). This war's gonna end all, you ain't seen a storm before. I ain't taking this shit no more. We approach with a white skull when we assassinating y'all"
nosebleed (feat. r.a. the rugged man),"Ruin your idol, I'm glued to the Bible and my rifle. Losing your title instead of shooting you're suing for libel. Everybody hate me cause I stay true to the facts. The Ku Klux Klan hate me more than Jews and blacks. Yeah, you over for certain, you can pray to whoever. Jehovah, Buddha, Allah, Jesus, Mother Mary the Virgin. Is it the violence that the Tv taught us?. I grew up worshipping Charles Bronson. John Rambo, and Chuck Norris. Pazienza the Pazmanian Damien rapping the pain he in. Cracking your cranium. I'm macking Mahogany at the Palladium. I'm Bruce Leroy, you Eddie Arkadian. I got the gat and the black and the Arabian. I'm waterboarding like Dick Cheney. And yo, back at the first day of my birth. The moment I was born. I was condemned by the Catholic Church. Warsaw battling the streets we inhabited. I'm sugar like Ray Robinson, you ain't even saccharine. Leaving you staggering making an impact. New York, we created this rap. This a blatant attack, East Coast. we taking it back, come on. Life is love, death, pain. Nothing ain't left, ain't nothing to gain. Life is love, death, pain. Nothing ain't left, ain't nothing to gain. I'm letting these motherfuckers live. it was truly compassion. I'm brutally bashing cause I'm steadily losing my passion. Tell Louie to stab them or to shoot them. with two different Magnums. I'm usually packing, carry hawks like I'm Julian Jackson. I'll rob 'em for Gucci, I'm a thief. these are Lucifer's actions. I'm a provider, I'm a messiah, Jesus's assassin. I don't think it's anybody living. that truly could match them. I slaughter Buddha through the computer. Medusa's companion. A lot of rappers wanna beef with the lion. Ain't too many people that's as fucking lethal as I am. I feast them and fry them, Vinnie. so at peace with the violence. I exercise absolute power, peace to the tyrants. I'm old school like quarter waters and eating in silence. You new school like faggot rappers competing for prizes. I'mma send you to the afterlife, speak to Osiris. And when he ask you why you there. tell him the lethalest virus, yeah"
paul and paz (feat. paul wall & block mccloud),"I run the underworld, guy. I decide who does what and where they do it at. Why am I gonna run around and act. like I'm some teeny-bopper somewhere. for somebody else's money?. I make the money, man. I roll the nickels. The game's mine. I'm the king!. Gotta get fetti, gotta get that dough. Please don't hate me cause I hustle and it's all I know. We get fetti man, we get that flow. They hate us because we love paper chasing. Gotta get fetti, gotta get that dough. Please don't hate me cause I hustle and it's all I know. We get fetti man, we get that flow. They hate us because we love paper chasing. I'm the man with the plan and them rocks in my hand. In the Cadillac sitting on the fours. All the boppers so heavy but the haters mad at me. When I come around the corner so slow. I'm the shit where I'm from in the land of Screw. A go-getter chasing after bankrolls. If you're hating; don't try it cause I'm waiting so quiet. A player stay up on his toes. I got my mind on paper, not concerned with them haters. Them boys is talking down call me catch up later. See I pull up in that black on black like Darth Vader. Handing bars out the window, serving boys like a waiter. My mind on dollar signs so partner I'mma grind. Gotta punch that clock and paper-chase overtime. That paper is a fool if you put in work. I'mma hustle 'till I'm under the dirt, I gotta get it baby. I'm nice with the ox, you get cut like the raw white. Or hit you with a fucking silver bullet like Coors Light. I could tell a snitch if he don't walk through the door right. I could tell a snitch if he don't handle the four right. The fifth levitate your body to God's height. Flatline, long dark tunnel and saw light. I'mma ride dirty so motherfucker forget the law. Chicken wing, shrimp, fried rice, and the liquor store. It don't take a lot for me to have the pistol drawn. Get popped in front of me, I don't even assist the boy. Y'all are fronting, I don't know what the resistance for. Y'all are nothing. that's why that you keep you distance for. Anybody fuck with Vinnie getting laid to waste. I'mma have your white tee looking like it's tomato paste. You a joker, motherfucker, Vinnie play the ace. Paul take the thirty-eight snub and rearrange his face"
