bring the noise (public enemy & benny benassi),"Bass! How low can you go?. Death row. What a brother knows.. Once again, back is the incredible. the thyme animal. the incredible D, Public Enemy Number One. ""Five-O"" said, ""Freeze!"" and I got numb. Can I tell 'em that I really never had a gun?. But it's the wax that the Terminator X spun. Now they got me in a cell 'cause my records, they sell. 'Cause a brother like me said, ""Well.... ...Frarrakhan's a prophet and I think you ought to listen to. what he can say to you, what you ought to do."". Follow for now, power of the people, say,. ""Make a miracle, D, pump the lyrical"". Black is back, all in, we're gonna win. Check it out, yeah y'all, here we go again. Chorus: Turn it up! Bring the noise!. Never badder than bad 'cause the brother is madder than mad. At the fact that's corrupt as a senator. Soul on roll, but you treat it like soap on a rope. 'Cause the beats in the lines are so dope. Listen for lessons I'm saying inside music that the critics are blasting. me for. They'll never care for the brothers and sisters. now across the country has us up for the war. We got to demonstrate, come on now, they're gonna have to wait. Till we get it right. Radio stations I question their blackness. They call themselves black, but we'll see if they'll play this. Chorus: Turn it up! Bring the noise!. Get from in front of me, the crowd runs to me. My deejay is warm, he's X, I call him Norm, ya know. He can cut a record from side to side. So what, the ride, the glide should be much safer than a suicide. Soul control, beat is the father of your rock'n'roll. Music for whatcha, for whichin', you call a band, man. Makin' a music, abuse it, but you can't do it, ya know. You call 'em demos, but we ride limos, too. Whatcha gonna do? Rap is not afraid of you. Beat is for Sonny Bono, beat is for Yoko Ono. Run-DMC first said a deejay could be a band. Stand on its feet, get you out your seat. Beat is for Eric B. and LL, as well, hell. Wax is for Anthrax, still it can rock bells. Ever forever, universal, it will sell. Time for me to exit, Terminator X-it. Chorus.... From coast to coast, so you stop being like a comatose. ""Stand, my man? The beat's the same with a boost toast. Rock with some pizzazz, it will last. Why you ask?. Roll with the rock stars, still never get accepted as. We got to plead the Fifth, we can investigate. Don't need to wait, get the record straight. Hey, posse's in effect, got the Flavor Terminator. X to sign checks, play to get paid. We got to check it out down on the avenue. A magazine or two is dissing me and dissing you. Yeah, I'm telling you..."
california dreamin' (cover),Music Please.... All the leaves are.... California dreamin'. California.... Music Please.... All the leaves are brown and the sky is gray. I've been for a walk on a winter's day. I'd be safe and warm if I was in L.A.. California dreamin' on such a winter's day. California.... All the leaves are brown and the sky is gray. I've been for a walk on a winter's day. I'd be safe and warm if I was in L.A.. California dreamin' on such a winter's day. All the leaves are.... California.... All the leaves are brown and the sky is gray. I've been for a walk on a winter's day. I'd be safe and warm if I was in L.A.. California dreamin' on such a winter's day. California.... All the leaves are brown and the sky is gray. I've been for a walk on a winter's day. I'd be safe and warm if I was in L.A.. California dreamin' on such a winter's day. California.... [por Durval Vieira Junior]
california dreaming 2004 remix,Music please. Hey oh oh hey hey. Oh oh hey oh oh hey hey (X3). All the leaves are.... California... (X2). Music please. [Chorus]. All the leaves are brown. And the sky is grey. I've been for a walk. On a winter's day. I'd be safe and warm. If I was in L. A. California Dreamin'. On such a winter's day. Hey oh oh hey hey. Oh oh hey oh oh hey hey (X3). All the leaves are.... [Chorus]. California.... Hey oh oh hey hey. Oh oh hey oh oh hey hey (X3). [Chorus]. Hey oh oh hey hey. Oh oh hey oh oh hey hey (X3). All the leaves are.... California dream.... All the leaves are.... [Chorus]
castaway,"I’m wandering alone in an open space. Looking around for a human trace. Along the edge of this satellite. Losing the route in this empty sky. A prey of the ghosts of this galaxy. Losing myself in this ecstasy. No clock is turning to sign the time. Everything’s flowing through day and night. No noise is breaking my silent star. I’m on the run I can go so far. Flying in absence of gravity. Feeling the vibe of eternity. This is the lesson I had to learn. This is the treasure I had to earn. I am the owner of nowhere land. Queen of the castle that’s made of sand. Staring in front of the universe. Maybe someday I’ll be someone else. I’m sure I’ll do it, but till’ that day. Here on my star I am just a castaway. I’m wandering alone in an open space. Looking around for a human trace. Along the edge of this satellite. Losing the route in this empty sky. A prey of the ghosts of the galaxy. Losing myself in this ecstasy. No clock is turning to sign the time. Everything’s flowing through day and night. No noise is breaking my silent star. I’m on the run I can go so far. Flying in absence of gravity. Feeling the vibe of eternity. This is the lesson I had to learn. This is the treasure I had to earn. I am the owner of nowhere land. Queen of the castle that’s made of sand. Staring in front of the universe. Maybe someday I’ll be someone else. I’m sure I’ll do it, but till’ that day. Here on my star I am just a castaway"
change style,I never smoke crack cos. I'm breakin' out. Ok I'm gonna change the style. Ya' all. Like I'm wearin' the right style. I'm gonna doin' one in off the rap. You wanna make my poetry right
cinema (feat. gary go),"I could watch you for a lifetime. You're my favourite movie. A thousand endings. You mean everything to me. I never know what's coming. Forever fascinated. Hope you don't stop running. To me cause I'll always be waiting. You are a cinema, I could watch you forever. Action thriller, I could watch you forever. You are a cinema, a Hollywood treasure. Love you just the way you are. A cinema, a cinema, a cinema. A cinema, a cinema, a cinema. Stars spell out your name. Like in a science fiction drama. Romance roll in. Like a flower in the summer. You always keep me guessing. Forever my wonder. Hope you start undressing. All my dreams until the end of. You are a cinema, I could watch you forever. Action, thriller, I could watch you forever. You are a cinema, a Hollywood treasure. Love you, just the way you are. A cinema, a cinema, a cinema. A cinema, a cinema, a cinema. Never know what movie you're playing. Never know what movie you're playing. Never know what movie you're playing. Never know never know never know. You are a cinema, I could watch you forever. Action, thriller, I could watch you forever. You are a cinema, a Hollywood treasure. Love you just the way you are. A cinema, a cinema, a cinema. A cinema, a cinema, a cinema"
cinema (feat. gary go) (skrillex remix),"I could watch you for a lifetime. You're my favorite movie. A thousand endings. You mean everything to me. I never know what's comin'. Forever fascinated. Hope you don't stop runnin' to me. 'Cause I'll always be waitin'. You are my cinema. I could watch you forever. Action, thriller. I could watch you forever. You are my cinema. A Hollywood treasure. Love you just the way you are. My cinema, my cinema, my cinema.... Get up, get down. Three steps down. My DJ gonna break it down. Get up, get down. Three steps down. My DJ gonna break it down. Get up, get down. Three steps down. My DJ gonna break it down. Get up, get down. Lose that sound. Drop the bass. Stars spell out your name. Like in a science fiction drama. Romance growing. Like a flower in the summer. You always keep me guessin'. Forever my wonderful. Hope you start undressin'. All my dreams and take me under. You are my cinema. I could watch you forever. Action, thriller. I could watch you forever. You are my cinema. A Hollywood treasure. Love you just the way you are. My cinema, my cinema, my cinema.... Get up, get down. Three steps down. My DJ gonna break it down. Get up, get down. Three steps down. My DJ gonna break it down. Get up, get down. Three steps down. My DJ gonna break it down. Get up, get down. Lose that sound. Drop the bass. You are my cinema. I could watch you forever. Action, thriller. I could watch you forever. You are my cinema. A Hollywood treasure. Love you just the way you are. My cinema, my cinema, my cinema"
close to me (feat. gary go),"The distance. Come close. No resistance. I need you now, baby listen. You're the puzzle piece that I'm missing. I would do things that have never been done. To get you close to me. Why can't you see?. Why can't you see. That you should be close to me?. Close to me. You should be close to me. I would do things that have never been done. To get you close to me. You make me. So naked. My heart pumps. Anticipating. I fall from. The sky down. If you don't come right now. Close to me. You should be close to me. I would do things that have never been done. To get you close to me. I need you now, baby listen. You're the puzzle piece that I'm missing. I would do things that have never been done. To get you close to me. Close to me. You should be close to me. I would do things that have never been done. To get you. To get you. Close to me"
come fly away,"I'm glidin' in the beautiful sky,. it's such a clear day.. Go ridin' in,. your sweet lullabies,. come fly away.. I'm glidin' in the beautiful sky,. it's such a clear day.. Go ridin' in,. your sweet lullabies,. come fly away.. Feels like your beatin', beatin' the drumbeats into my heart.. Feels like there's nothin', nothin' around to make me. stop.. You are a motion that makes me high.. You are a dream that burns inside.. A magic potion, that's my soul.. Come fly with me.. Feels like your beatin', beatin' the drumbeats into my. heart.. Feels like there's nothin', nothin' around to make me. stop.. You are a motion that makes me high.. You are a dream that burns inside.. A magic potion, that's my soul.. Come fly with me.. I'm glidin' in the beautiful sky,. it's such a clear day.. Go ridin' in,. your sweet lullabies,. come fly away.. I'm glidin' in the beautiful sky,. it's such a clear day.. Go ridin' in,. your sweet lullabies,. come fly away.. I'm glidin' in the beautiful sky,. it's such a clear day.. Go ridin' in,. your sweet lullabies,. come fly away.. I'm glidin' in the beautiful sky,. it's such a clear day.. Go ridin' in,. your sweet lullabies,. come fly away.. I'm glidin' in the beautiful sky,. it's such a clear day.. Go ridin' in,. your sweet lullabïes,. come fly away."
control (feat. gary go),"I've been trying to breakout of the breakdown. Hoping to find a miracle in the meltdown. All the loving chaos that I'm surround. I dance dance to take me off the ground ground.. I've been closing my eyes so I can see you. Trying to make every other lover be you. I know all of my fantasies won't come true. I dance dance and pray that some of them do.. (Chorus). Hey-yeah, lift my emotion. Tonight, my heart is open. Let go, there's no confusion. Control is an illusion.. Control is an illusion.. Woo-ooo-oo-oo.. Control is an illusion.. I can't own ya love,. I can't own your love,. I gotta let it go in the night sky. When I look above. When I look above. I see it shining; I'll feel so aliiiiive.. Ready to let love back into my soul.. In the beauty, in the music, it's time to lose control of control.. (Chorus 2x). Control, control.. Control, control."
dance the pain away (feat. john legend),"I'll take my time. Let the tears fall down. From my face. Wash the pain away. We're all speeding. Lost in this race. And my heart's in a hearse. Can we put it in reverse, babe. Cause I can't even feel the drum and bass. It's drowned out by the beat my heart makes. I hear that song but something is wrong. My mind's a million miles away. Ohh, everybody's going to the floor. Maybe I don't want to dance anymore. Don't want to dance anymore. How can you dance the pain away. How can you dance the pain away. Oh dance the pain away. I can't dance the pain away. How can you dance the pain away. How can you dance the pain away. Oh dance the pain away. I can't dance the pain away. Touch that dial. I'm changing the station. Cause I can't smile. Like everyone else. Play my sad song. In heavy rotation. I won't go out. I'm trying to save myself. I can't even feel the drum and bass. It's drowned out by the beat my heart makes. I hear that song but something is wrong. My mind's a million miles away. Ohh, everybody's going to the floor. Maybe I don't want to dance anymore. Don't want to dance anymore. How can you dance the pain away. How can you dance the pain away. Oh dance the pain away. I can't dance the pain away. How can you dance the pain away. How can you dance the pain away. Oh dance the pain away. I can't dance the pain away. I can't dance tonight. Oh everybody's movin but I'm tired. I can't dance tonight. I try to keep it movin but I but I but I. I can't dance the pain away. I can't dance the pain away. I can't dance the pain"
don't touch too much,"You don't hesitate. You don't have no doubts. Don't invade my world. gently come inside. You keep pushing me babe. 'cause your wish is strong. won't you hurt my feelings. don't you make me wrong. Don't touch too much. you touch too much. Don't touch too much. you touch too much. Don't touch too much. Your kiss is so bewitching. and my heart is blind. you keep on seducing me. you know I'm not that kind. I don't want illusions. you must gove me time. to believe in what you say. love's so hard to find. Don't touch too much. you touch too much. Don't touch too much. you touch too much. Don't touch too much. Baby I keep crying. you keep blowing my mind. don't you hesitate no more. no, I'm not that kind. Don't touch too much. you touch too much. Don't touch too much. you touch too much. Don't touch too much"
electroman,"Chorus:. I am electro man, man , man, man,. You are electro girl, girl, girl, girl.. Electricity! come on!. Electricity! come on!. In the darkness we light up the sky,. I'm talking party,. So the darkness can die!. There's no opponents, can't temperate she and i. We're just a part of one of those secrets societies.. Oh, oh, tell me baby, baby can you feel my e-electricity!. I can really tell you what you really wanna be,. Come get me!. Oh, oh, take my hand!. Do you know who i am?. Chorus:. I am electro man, man, man, man!. You are electro girl, girl, girl, girl!. Electricity! come on!. Electricity! come on!. In the daylight, we wait for the night!. Vampires stay away from the fight!. I'll make you blood drained. Count it girl, i'll suck you dry,. If …something to chase you,. No you cannot die!. Oh, oh! aha, aha!. Turn around, break it down, check it now!. It's going down!. Chorus: (x2). I am electro man, man, man, man!. You are electro girl, girl, girl, girl!. Electricity! come on!. Electricity! come on!"
even if (feat. vassy),Even if the ocean disappeared. Even if the clouds would shed no tears. I've had everything I need right here. As long as you're next to me!. And even if the stars forgot to shine. Even if the Moon escaped the sky. And even if I search until I'm blind. I'll find a way to you. And even if the world forgot to turn. Even if the Sun refused to burn. And even if it takes me 'round the Earth. I'll find a way to you. And even if the stars forgot to shine. Even if the Moon escaped the sky. And even if I search until I'm blind. I'll find a way to you. Even if the seasons turn to black. Even if the ground will begins to crack. Nothing in this world will hold me back. Until you are next to me. Even if the ocean disappeared. Even if the clouds would shed no tears. I still had everything I need right here. As long as you're next to me!. And even if the stars forgot to shine. Even if the Moon escaped the sky. And even if I search until I'm blind. I'll find a way to you. And even if the world forgot to turn. Even if the Sun refused to burn. And even if it takes me 'round the Earth. I'll find a way to you. I'll find a way to you. I'll find a way to you. I'll find a way to you. I'll find a way to you. And even if the stars forgot to shine. Even if the Moon escaped the sky. And even if I search until I'm blind. I'll find a way to you
every single day,Hey guy - you're the one for me. Your face - the sweetest thing I've ever seen. Stop by - dedicate to me. Your time - your time. At night - it really gets to me. I find nobody is here with me. Stop by - say you'll stay with me. You're the one I really miss. Every single day - single hour. I can see your face - single day. Every single day - single hour. I can see your face - single day. Every single day - single hour. I can see your face - single day. Every single day - single hour. I can see your face - single day. Hey guy - you're the one for me. Those eyes - the loveliest I've ever seen. Stop by - Just to say to me. You're mine - you're mine. This time lay some love on me. I'm blind - to anything surrounding me. so fine when you're next to me. You're the one I can't resist
feel alive,"Uh uh uh uh uh. Uh ah uh uh uh. You can tell. When you are feeling love. And I can tell. That there is something in your eye. It's a tear, it's a tear. Falling down. It's a tear, it's a tear. Drying out. When you feel.... When you feel.... When you feel alive. Do you feel alive. When you feel alive. Do you feel alive. I can tell. That you are in love. And I know. What that little drop is in your eye. It's a tear, it's a tear. Of happiness. No more fear. No no more fear of loneliness. Do you feel. When you feel. When you feel. When you feel. When you feel alive. Do you feel alive. When you feel alive. Do you feel alive. When you feel alive. Do you feel alive. When you feel alive. Do you feel alive. I am burning, with this love. I am burning, is it love. I am burning, with this love. I am burning, is it love"
get loose,Getta getta getta. getta getta getta. Get loose. Wanna get loose. Getta getta getta. getta getta getta. Get loose. Wanna get loose
girls just wanna have fun (cyndi lauper remix),"Girls just want to have fun. Just want. Just want. Just want. Just want. Just want. Just want. Just want. Just want. Girls just want to have fun. Just want. Just want. Just want. Just want. Just want. Just want. Just want. Just want. Girls, they wanna have fun. Just want. Just want. Just want. Just want. Just want. Just want. Just want. Just want. Girls, they wanna have fun. Oh girls just want to have.... That's all they really want. Some fun. When the working day is done. Oh, girls, they wanna have fun. Oh, girls just wanna have fun. Girls, they wanna have fun. Oh, girls just want to have. Want to have fun. Want to have fun. Want to have fun. Want to have fun. Wanna have. Wanna have. Wanna, wanna, wanna have. Wanna, wanna, wanna have. Wanna, wanna, wanna have. Girls, want, wanna have fun. Girls just want to have fun. Just want. Just want. Just want. Just want. Just want. Just want. Just want. Just want"
good girl,"Up.. Down.. Sit.. Roll over.. Come here.. Shake.. . Bang. Bang.. Play dead, good girl.. (repeat)"
hit my heart,"Hey boy, it's not a game. You are the one to blame. My love is not your toy. You better be careful boy... You told a million lies to me. One day you said goodbye baby. I gave you one more chance. So please tell me baby... Are you gonna hit my heart?. Are you gonna leave me once again?. Baby, don't you hit my heart... Are you gonna break my heart?. Are you gonna make me cry again?. Baby, don't you break my heart... I'm not that kind of girl. I know what i deserve. My trust in you was wrong, darling. I won't do it anymore. You swear that you still care for me. You tell to come back again, honey. But you is always the same. Won't you tell me baby. Are you gonna hit my heart?. Are you gonna leave me once again?. Baby, don't you hit my heart... Are you gonna break my heart?. Are you gonna make me cry again?. Baby, don't you break my heart.."
i love my sex,"And I love my sex. I love my dresses, cars, perfumes and jewels. I love my man, my money, power. And I love my sex [x2]. And I love my sex [x2]. Sex. And I love my sex. I love my dresses, cars, perfumes and jewels. I love my man, my money, power. And I love my sex [x2]"
i wanna touch your soul,"Do you wanna spend a night with me?. Are you ready now to loose control?. C'mon baby, I can light your fire,. all night long.. I wanna touch your soul. Boom boom boom boom. Do you know what do you want to be?. Do you know what really turns you on?. Tell me arre you feeling free?. Don't you know. I wanna touch your soul"
i'm sorry,Are you sleeping?. Oh... I'm sorry.. Are you sleeping?. Oh... I'm sorry.. By Giuliano.
illusion,"I WANNA BE YOUR ILLUSION. BE YOUR ILLUSION. TO MAKE YOU HAPPY TONIGHT. ENJOY THIS TRIP WITH ME. I WANNA BE YOUR EMOTION, BE YOUR EMOTION. WHY DON'T YOU TURN OFF THE LIGHTS?. IMAGINE HOW WE COULD BE LIVING... SOMETIMES I WONDER WHY. WE HAVE NO LIMITS. EVERYTHING WE DO IS TRY. TO FIND OUT WHO WE ARE.. WE WON'T STOP PLAYING. THAT SPECIAL GAME OF LOVE. AND WHEN WE GET TOGETHER. THE TIME IS RUNNING. I'LL BE A DREAM THAT YOU'LL REMEMBER. OVER AND OVER. IF ONLY YOU TRY ME, IF ONLY YOU TOUCH ME. I WANNA BE YOUR ILLUSION. BE YOUR ILLUSION. TO MAKE YOU HAPPY TONIGHT. ENJOY THIS TRIP WITH ME. I WANNA BE YOUR EMOTION, BE YOUR EMOTION. WHY DON'T YOU TURN OFF THE LIGHTS?. IMAGINE HOW WE COULD BE LIVING... THROUGH THE DARKNESS OF THE TOWN. LOOKING FOR A LOVER. I'M PRAYING YOU TO STAY,. TO KEEP THE PROMISE YOU MADE. CAN'T YOU SEE IT BABY?. IT'S A PART OF THE GAME.. AND EVERYTIME THAT YOU SAY NO. YOU GOT ME GOING CRAZY,. I'M GOING OUT MY MIND. I'LL DO WHAT YOU WANT ME TO. I'M A VICTIM BABY.. JUST PUSH ME THROUGH. I WANNA BE YOUR ILLUSION. BE YOUR ILLUSION. TO MAKE YOU HAPPY TONIGHT. ENJOY THIS TRIP WITH ME. I WANNA BE YOUR EMOTION. BE YOUR EMOTION,. WHY DON'T YOU TURN OFF THE LIGHTS?. IMAGINE HOW WE COULD BE LIVING.. I WANNA BE YOUR ILLUSION I. WANNA DO WHAT MAKES YOU FEEL ALL RIGHT. IT'S A MATTER OF TIME NOW BABE,. IT'S A MATTER OF FACT NOW BABE. I'M GONNA MAKE YOU FEEL GOOD"
inside of me,"Hey u see.... What's inside of me. Hey u see.... What's inside of me. What's Inside of me!. What's. (12x). What's inside of me. Hey u see.... What's inside of me. What's inside of me!. Hey u see.... What's inside of me. It's cellgamy, it's purety, no! It's privity. What's inside of me, of me, of me, of me, of me.... What's inside of me. What's. (32x). Hey u see.... What's inside of me. Hey u see.... What's inside of me. What's inside of me!. What's inside of me.... Hey u see.... What's inside of me. Hey u see.... What's inside of me. What's inside of me!"
let it be,Let the sound rise up. Let the heart whirl drag you down. Let the sound rise up. Free your body follow me. Let it be. Let it be. Let the sound rise up. Let the heart whirl drag you down. Let the sound rise up. Free your body follow me. Let it be. Let it be
let this last forever,"The lights blur in the sky. The sun starting to die. As we're coming to light. A retro for the fade. No fear we are brave!. This night is gonna save us!. When the wind is in your hair. I just stare. For a second I don't care. I just stare. As the sun leaves and leaps through my hands, I think. Let this last forever. Let this last forever!. Oh, oh, ooh, oh, oh, oh. Let this last forever. Let this last forever!. Fall back to the ground. Spellbound by the sound. Surrender me now!. No need to be scared. True love's gonna get us there. And start to whirl around us!. As the sun leaves and leaps through my hands, I think. Let this last forever. Let this last forever!. Oh, oh, ooh, oh, oh, oh. Let this last forever. Let this last forever!"
light,"""Light, can you hear me?. Can you feel me? ohhhh...... Hey lalaa..... Oooo oh..... I am sitting in the sun. I can feel the power. Of a new dawn in my mind. Everything is bright. Love is all you love as well. Like a precious flower. I'm a spirit floating bound. In the universe. Light, shining in your eyes. Everyday, wash away the pain. Light, coming from my mind. We are one, the night has just begun. People walking through my world. I can see our (breathing). They are phrases, they are words. Of a simple verse. Put your gunsmen on the ground. Don't you hurt each other. Let your spirit hear the sound. In the universe. Light, shining in your eyes. Everyday, wash away the pain. Light, coming from my mind. We are one, the night has just begun. Light, shining in your eyes. Everyday, to wash away the pain. Light, coming from my mind. We are one, life has just begun. Life has just begun, we are one. Life has just begun. Oh yeah, ohohno.... Come on baby. Light, shining in your eyes. Everyday wash away the pain. Light, coming from my mind. We are one, the night has just begun. Light is just a constant. Light is just a color. Light, it is you. Because life is just a constant. Light is the all color. Light, is you"
