love and motion,"The glow i see. it's been following me. and it's brighter than before. it seems brighter than before. and you... and me.... we see perfectly. it seems lighter than before. so much brighter than before. and i could be the only one that you'd ever need. and you could be the only girl that i wait for (wait for, wait for...). 'cause you've got me and we've got nice. do you believe in love?. 1, 2, 3, 4 we've got love and motion, and motion, and motion (and motion...). The glow i see. it's been following me. and it's brighter than before. it seems brighter than before. and you... and me.... we hear perfectly. it seems louder than before. so much rouded than before. and i could be the only one that you'd ever need. and you could be the only girl that i wait for (wait for, wait for...). 'cause you've got me and we've got nice. do you believe in love?. 1, 2, 3, 4 we've got love and motion, and motion, and motion (and motion...). did you walk across the line?. did you shake it off your mind?. did you ever think that i would be the one to bring you back?. did you cover up the sound of a million golden days?. when the sun comes up we'll all be here together, it's ok. and i could be the only (just think about everything oh-oh) one that you'd ever need. and you could be the only (just think about everything...) girl that i wait for (wait for, wait for...). 'cause you've got me and we've got nice. do you believe in love?. 1, 2, 3, 4 we've got love and motion, and motion, and motion (and motion...). Lara-ra-ra-la-laaa-la Lara-ra-ra-la-lara-Ohhh.... Lara-ra-ra-la-laaa-la Lara-ra-ra-la-lara-Ohhh..."
love is gonna save us,Stones and flowers on the ground. We are lost and found. But love's gonna save us. Shadows walking in the crowd. We are lost and found. But love's gonna save us
make me feel,"You gonna be my man. You know it babe. You gonna be my friend. Oooh baby. So darling take my hand. Don't leave me waitin'. Don't wanna lose my friend. No no no no babe. Why don't you understand. And just say 'maybe'. My heart is in your hand. Oooh babe. Don't make me wait too long. Don't make me craze. Don't wanna be alone. No no no no. Make me feel. Make me feel, babe. Make me feel. Make me feel. Make me feel. Make me feel. Make me feel. This one's a funny game. It's so amazing. And never be the same. Oooh babe. You really turn me on. You know I'm ready. You make me lose control. No no no no babe. Now won't you let me say. And be your lady. 'Cos you can luck my way. Oooh babe. You really make me strong. The feeling's fading. I know we can't be wrong. No no no no. Make me feel. Make me feel, babe. Make me feel. Make me feel, babe. Make me feel. Make me feel. Make me feel. Make me feel"
my body,"Full speed. Brakes off, turn me. I didn't know that you could. Burn me, tasty, base beat. Just feel it coming over.. Oh boy I'm here to stay. Ride on the milky way. I'm leading you astray. Whoa whoa.. So where we gonna go. I'm pulling back my bow. I'll hit you in your oh. Whoa whoa whoa whoa.. My body. Your body. Oh boy I'm here to stay. Ride on the milky way. I'm leading you astray. Whoa whoa.. So where we gonna go. I'm pulling back my bow. I'll hit you in your oh. Whoa whoa whoa whoa.. I feel it when your body. Touched my body. Feel when your body. Pull closer to me now.. Your body. Touched my body. Feel it everybody. Whoa whoa whoa whoa whoa.. Twisted, Melody, pushing me. I didn't know you could. Flip me, chemistry, break beat. Just feel it rushing over. Oh boy I'm here to stay. Ride on the milky way. I'm leading you astray. Whoa whoa.. So where we gonna go. I'm pulling back my bow. I'll hit you in your oh. Whoa whoa whoa whoa.. My body. Your body. Oh boy I'm here to stay. Ride on the milky way. I'm leading you astray. Whoa whoa.. So where we gonna go. I'm pulling back my bow. I'll hit you in your oh. Whoa whoa whoa whoa.. My body. Your body. Whoa whoa whoa.. I feel it when your body. Touched my body. Feel when your body. Pull closer to me now.. Your body. Touched my body. Feel it everybody. Whoa whoa whoa whoa whoa.. I feel it when your body. Touched my body. Feel when your body. Pull closer to me now.. Your body. Touched my body. Feel it everybody. Whoa whoa whoa whoa whoa.. My body. Your body"
my house (feat. jean baptiste),"There was a man. From a distant land. He couldn't dance. No, he couldn't dance. He had a simple plan. Talked with his hands!. He couldn't dance. No, he couldn't dance. Give him a chance. Put you in a trance!. He'll make you dance. He'll make you dance. So hold on. Be quiet. Let's start a fire. Let's start a... riot. It's my house. Let's start a fire. Let's start a riot. Le-let's start a riot. It's my house. It's my... house. And we all danced down. Down to the floor. I hope you dance. Dance till you saw. He came and saw. And then he conquered. Just like Caesar. But he walks among us. And the beat, the beat. The beat that he played. Made us party all night. And raised hell until today. So hold on. Be quiet. Let's start a fire. Let's start a... riot. It's my house. Let's start a fire. Let's start a riot. Le-let's start a riot. It's my house. It's my... house. This is my... house. So let's burn it down. Burn it down, down. 'cuz this is my... house. You hear the music spinning?. You hear the music spinning?. So what was singing. You hear the music spinning. You hear the music spinning. You hear the music spinning. So what was singing. It feels like. Just like Heaven. When he plays. So just dance, dance. It's just like. Just like Heaven. When he plays. Dance, dance. So hold on. Be quiet. Let's start a fire. Let's start a... riot. It's my house. Let's start a fire. Let's start a riot. Le-let's start a riot. It's my house. It's my... house. This is my... house. So let's burn it down. Burn it down, down. 'cuz this is my... house. This is my... house. So let's burn it down. Burn it down, down. 'cuz this is my... house"
no matter what you do,Tell me what your spirit says. Show me what you pray. Teach me every single part. I'll be your guide. You are a prisoner. Looking for to be.... You can change your face. But can't change your mind. No matter what do you do {x7}. Tell me what your spirit says. Show me what you pray. Teach me every single part. I'll be your guide. You are a prisoner. Looking for to be.... You can change your face. But can't change your mind. No matter what do you do {x8}. Tell me what your spirit says. Show me what you pray. Teach me every single part. I'll be your guide. You are a prisoner. Looking for to be.... You can change your face. But can't change your mind. No matter what do you do {x4}. Tell me what your spirit says. Show me what you pray. Teach me every single part. I'll be your guide. You are a prisoner. Looking for to be.... You can change your face. But can't change your mind. No matter what do you do {x8}. Tell me what your spirit says. Show me what you pray. Teach me every single part. I'll be your guide. You are a prisoner. Looking for to be.... You can change your face. But can't change your mind. No matter what do you do {x8}
no milk today,"No milk today, my love has gone away. The bottle stands forlorn, a symbol of the dawn. No milk today, it seems a common sight. But people passing by don't know the reason why. How could they know just what this message means. The end of my hopes, the end of all my dreams. How could they know the palace there had been. Behind the door where my love reigned as queen. No milk today, my love has gone away. The bottle stands forlorn, a symbol of the dawn. No milk today, it wasn't always so. The company was gay, we'd turn night into day. But all that's left is a place dark and lonely. A terraced house in a mean street back of town. Becomes a shrine when I think of you only. Just two up two down"
paradise (feat. chris brown),"I'm here at the end, yeah. If I could go back to the start. I'd do it again, yeah. I'd live like never before. Now will you remember. Remember me when I'm gone?. Remember the heat, yeah. That's keeping you warm?. Saying brighter, now we're burning up, light up. Yelling turn it up, let go, let go, let go. In paradise, the closer I get to you. It feels like paradise. And I'd do anything you'd want me to. When we're in paradise. I'll see you on the other side, where it's alright. If tonight is the last night. I'll see you in paradise. If tonight is the last night. I'll see you in paradise. If tonight is the last night. I'll see you in paradise. You better be ready. 'Cause all good things come to an end. Spring into summer, my fire's burning again. Saying brighter, I'm not giving up, light up. Gonna live it up, let go, let go, let go. In paradise, the closer I get to you. It feels like paradise. And I'd do anything you'd want me to. When we're in paradise. I'll see you on the other side, where it's alright. If tonight is the last night. I'll see you in paradise. Paradise. If tonight is the last night. I'll see you in paradise. Paradise. Paradise. If tonight is the last night. I'll see you in paradise"
pump this party,"Yo Yo, DJ!. Pump this party!. Pump this party (X3). Yo Yo, DJ, pump this party. Pump this party (X3). Yo Yo, DJ, pump this party!. Pump this party (X3). Yo Yo, DJ, pump this party. Pump this party (X3). Yo Yo, DJ, pump this party. Pump this party (X3). Yo Yo, DJ, pump this party. Pump this party (X3). Yo Yo, DJ, pump this party. Pump this party (X3). Yo Yo, DJ, pump this party. Pump this party (X3). Yo Yo, DJ, pump this party. Pump this party (X3). Yo Yo, DJ, pump this party. Pump this party (X3). Yo Yo, DJ, pump this party. Pump this party (X3). Yo Yo, DJ, pump this party"
put it on me (feat. pitbull),"I don't see them haters. But they wanna be me. I don't see them haters. But they wanna be me. I see they girl and she leaving with me. I see they girl and she leaving with me. Sexy girl, go ahead and put it on me. Put it on me, put it on me. Sexy girl, go ahead and put it on me. Put it on me, put it on me. Sexy girl, go ahead and put it on me. Put it on me, put it on me. Sexy girl, go ahead and put it on me. Put it on me, put it on me. Sexy sexy, put it on me. Sexy sexy, put it on me. Sexy sexy, put it on me. Sexy sexy, put it on me. Sexy sexy, put it on me. Sexy sexy, put it on me. Sexy sexy, put it on me. Sexy sexy, put it on me"
put your hands up,"I'm shaking slowly to the beat. I like rolling on my feet. So people listen to the sound. Round round round round round. Put your hands up. Oh, yeah put your hands up. Yeah yeah. My satisfacion is complete. I keep on rolling on my feet. Just put your hands up to the sound. And turn around round round. Put your hands up. 1, 2, 3, 4... 1, 2, 3, 4. oh, yeah ah ah. yeah yeah. I like shaking all my body. Down to the beat. Relax my mind rolling down. On my feet. People put your hands up. When you hear the sound. People scream scream. Put your hands up"
rather be (feat. shanell),"You’ve been to every spot in this town,. And there’s no other place you rather be!. Chorus:. Turn up the lights, to show me,. Get up like a star,. Shining all over the world!. Turn up the lights in here,. Where I wanna be, standing at the edge of the world.. There’s no other place you rather be!. There’s no other place you rather be!. There’s no other place you rather be!. So come on, dance!. You ride it, it’s a party,. So come on, dance!. After midnight, we’re excited!. So, come on. Get your drinks on, spend your money,. Put your hands all over somebody!. ..the highest point, don’t you,. Ever come on down. You are everybody wants to be,. They all wanna go!. Chorus:. Turn up the lights, to show me,. Get up like a star,. Shining all over the world!. Turn up the lights in here,. Where I wanna be, standing at the edge of the world.. There’s no other place you rather be!. There’s no other place you rather be!. There’s no other place you rather be!. Every moment, everything thing in this world,. You’re the last vibing stone, on. …inside of you,. Everyone here feel what you gave to lose?. Chorus: (x3). Turn up the lights, to show me,. Get up like a star,. Shining all over the world!. Turn up the lights in here,. Where I wanna be, standing at the edge of the world.. There’s no other place you rather be!. There’s no other place you rather be!. There’s no other place you rather be!"
rocket in the sky,"Hey boy, Hey boy. Hey boy. When we first met. On the 31st. And it was Halloween. You know what I mean. And I was the one dressed up. as a rocket. that night. Please, please. Don’t ask me why. Hey boy, Hey boy. If you came over me. And said: Tell me. if you’re alone tonight. can I be by your side?”. Hey baby, ain’t we having fun Tonight. Little rocket in the sky. Little rocket in the sky. Tell me. Was a rocket in the sky. I’m a rocket in the sky. Baby baby. Ain’t we having fun tonight. I’ll be by yourside. I’ll be by yourside. Baby baby. I’ve been there all. Year long. Standing by the telephone. The telephone. Hey baby. If you care for me. Why don’t you call. And give me some dignity. Some decency. Rocket in disguise. Rocket in disguise. Don’t ask me why. Don’t ask me why. I’m a rocket in disguise. Don’t ask me why. I’m a rocket in disguise. Don’t ask me why. Tell me. I’m a rocket in disguise. Hey boy, Hey boy, Hey boy"
run to me,"Everyday I say a prayer. I need your love. I want you there. I long for you and no more loneliness. Inside my dreams. you're like a drum. your sound is good. like the beat of my heart. so take a ride. and fly me to a star. run to me run to me, baby. yes I know that you need me now. run to me run to me. I don't know how. run to me run to me, baby. 'cause I know that you want me now. run to me run to me. somehow. On the sea or on the air. everything will take you there. I don't know why. I need your love to share. So take a boat or take a plane. don't leave me here don't let me go insane. I'm only asking to see your face again. run to me run to me, baby. yes I know that you need me now. run to me run to me. I don't know how. run to me run to me, baby. 'cause I know that you want me now. run to me run to me. somehow. You're my lover. my one and only dream. I run for cover. don't leave me waiting here. You're my pleasure and you're my pain. You're givin' me emotions. You turn me round inside. and light my flame. you know that I'm your lady"
satisfaction,Push me. And then just touch me. Till I can get my satisfaction (x2). Satisfaction. Push me. And then just touch me. Till I can get my satisfaction (x2). Satisfaction. Satisfaction. Satisfaction
satisfaction vs short dick man(feat.gillette),"BENNY BENASSI VS GILLETTE. SATISFACTION VS SHORT DICK MAN (FEAT. GILLETTE). . PUSH ME , AND THEN YOU TOUCH ME. ‘TIL I CAN GET MY..... SATISFACTION. (PUT YOUR PANTS BACK ON HONEY...). PUSH ME, AND THEN YOU TOUCH ME. ‘TIL I CAN GET MY.... SATISFACTION,SATISFACTION, SATISFACTION..... 2X. DON’T WANNA NO SHORT DICK MAN 4X. PUSH ME, AND THEN YOU ...... AND THEN YOU ....TOUCH ME.... PUSH ME, TOUCH ME..... DON’T WANNA NO SHORT DICK MAN 4X. DON’T , DON’T , DON’T,..... DON’T WANNA, DON’T WANNA, DON’T WANNA, DON’T, DON’T..... DON’T WANNA NO SHORT DICK MAN. INNIE WEENY, TEENY WEENY. SHRIVELED LITTLE SHORT DICK MAN. DON’T , DON’T, DON’T,....... DON’T WANNA, DON’T WANNA, DON’T,...... 2X. DON’T WANNA NO SHORT DICK MAN. (PUSH ME). DON’T WANNA NO SHORT DICK MAN. (AND THEN YOU TOUCH ME). DON’T WANNA NO SHORT DICK MAN. (‘TIL I CAN GET MY....). DON’T WANNA NO SHORT DICK MAN. (PUSH, PUSH, PUSH..). OH-OH-OH-OH-OH-OH... ISN’T THAT CUTE AN EXTRA BELLY BUTTON. (PUSH, PUSH,PUSH, PUSH...). YOU NEED PUT YOUR PANTS BACK ON HONEY. (PUSH ME, PUSH ME, PUSH ME,.....). DON’T WANNA NO SHORT DICK MAN. (SATISFACTION). DON’T, DON’T, DON’T, DON’T,...... DON’T WANNA ,DON’T WANNA,....... DON’T WANNA NO SHORT DICK MAN. INNIE WEENY, TEENY WEENY. SHRIVELED LITTLE SHORT DICK MAN. DON’T, DON’T ,DON’T,DON’T...... DON’T WANNA, DON’T WANNA, DON’T,........ DON’T WANNA NO SHORT DICK MAN. 4X. DON’T WANNA NO SHORT DICK MAN. 4X. DON’T WANNA NO SHORT DICK MAN. (PUSH ME). DON’T WANNA NO SHORT DICK MAN. (AND THEN YOU TOUCH ME). DON’T WANNA NO SHORT DICK MAN. (‘TIL I CAN GET MY..). DON’T WANNA NO SHORT DICK MAN. (SATISFACTION). DON’T WANNA NO SHORT DICK MAN. PUSH ME. DON’T WANNA NO SHORT DICK MAN. SATISFACTION. SATIS-SATIS-SATISFACTION...... . BY*LLT*"
shocking silence,"Ah, aaah, aaah, aah (x7). With your fake smiles. Fake smiles. When you call my name. I known..... All your friends. Are getting better. Irritating restless looser. And your loves. Are getting faker. Before you've found. The magic powder.. You've done it. You've seen it. It doesn't help ya. Where is the great love. You showed me?. Oh I know it's gone. You drive me insane. With your fake smiles. When you call my name. I know you feel blame. You drive me insane. You twist me. Then you crushed me. With your fake smiles. When you call my name. I know you feel blame. You've done it. You've seen it. It doesn't help ya. Where is the great love. You showed me?. Oh I know it's gone. You drive me insane. With your fake smiles. When you call my name. I know you feel blame. You drive me insane. You twist me. Then you crushed me. With your fake smiles. When you call my name. I know you feel blame. Sweet like darling. Didn't get me to know ya. I didn't see it. You on your own now. It so much better. If you told me whatever. Your shocking silence is picking my nerves now. Sweet like darling. Didn't get me to know ya. I didn't see it. You on your own now. It so much better. If you told me whatever. Your shocking silence is picking my nerves now. With your fake smiles. When you call my name. I know you feel blame"
shooting helicopters (feat. serj tankian),"Now tell me that you need me. That you want me. That I'd love for you to know. Today we fall in love again. Electric dreams are empty. People plenty, and their voices ever born. Today we fall in love again. Now tell me that you need me. That you want me. That you'd love for me to know. Today we fall in love again, again, again, again. Please don't leave me. Stay with our true love. Now tell me that you need me. That you want me. That you'd love for me to know. Today we fall in love again. Bright lights elevation. Constellations raining down from far above. Today we fall in love again. Tell me that you need me. That you want me. That you'd love for me to know. Today we fall in love again, again, again, again"
"spaceship (feat. kelis, apl.de.ap, jean-baptiste)","Trip on spaceship. Trip on spaceship. Trip on space ship. Trip on spaceship. Sitting on top of the world. Watching the stars. Go by. I got my head in a dream. Got my head in the clouds. I can fly. I can fly. I can fly. So get high, get high. Get high, get high. So get high, get high. Get high, get high. Sitting on top of the world. Watching the stars. Go by. I got my head in a dream. Got my head in the clouds. I can fly, I can fly, I can fly. So get high, get high. Get high, get high. So get high, get high. Get high, get high. Sitting on top of the world. Watching the stars. Go by. I got my head in a dream. Got my head in the clouds. I can fly, I can fly, I can fly. So get high, get high. Get high, get high. So get high, get high. Get high, get high. You'd better move, check out the bassline groove. Take control of your body 'n soul. Let the rhythm just take control. Watch the beat drop say it Explode. Take the logic overload. Take the music around a globe. Take control of your body 'n soul, soul, soul. Let's go. Trip on spaceship, take off. Trip on spaceship, go on. Trip on spaceship, take off. Trip on spaceship, get on. Sitting on top of the world. Watching the stars. Go by. I got my head in a dream. Got my head in the clouds. I can fly, I can fly, I can fly. So get high, get high. Get high, get high. So get high, get high. Get high, get high. Sitting on top of the world. Watching the stars. Go by. I got my head in a dream. Got my head in the clouds. I can fly, I can fly, I can fly. So get high, come on, get high, come on. Get high, get high. So get high, get high. Get high, get high. Trip on spaceship, take off. Trip on spaceship, go on. Trip on spaceship, take off. Trip on spaceship, get on"
stop go,"Stop go back forward. Come further take it slow. Stop go back forward. Come further take it slow. Maybe if you make it in time. You must just be mine. Make a move and trow me a line. Come and make me shine, fine. Fine, fine. Stop go forward back go - forward. Come further take it slow. Move your ass as you know stop go. Take it. Maybe if you make it in time. You must just be mine. Make a move and trow me a line. Come and make me shine, fine. Fine, fine. La La La La La La La La. Stop go back forward. Come further take it slow. Stop go back forward. Come further take it slow. Maybe if you make it in time. You must just be mine. Make a move and trow me a line. Come and make me shine, fine. Fine, fine. Maybe if you make it in time. You must just be mine. Make a move and trow me a line. Come and make me shine, fine. Fine, fine. Stop go back forward. Come further take it slow. Stop go back forward. Come further take it slow. La La La La La La La La. La La. La La La"
summer jam,"This ain't nothing but a summer jam. Bronze skin and cinnamon tans whoa!. This ain't nothing but a summer jam. We're gonna party as much as we can. Hey-yeah, ooh, hey-yeah. Summer jam alright. Hey-yeah, ooh, hey-yeah. Tonight hotties wearing ""Prada""-skirts. Real tight temperature is rising. Feelin' real hot in the heat of the night. Midnight the party won't stop. until the morning light. I'm skopin' out the hotties with the light eyes. Be with me tonight. Can't get you outta my mind. I can't lie. Cause a girl like you is so hard to find. I'm waiting for the day to make you mine. Cause I can't take it. This ain't nothing but a summer jam. Bronze skin and cinnamon tans whoa!. This ain't nothing but a summer jam. We're gonna party as much as we can. Hey-yeah, ooh, hey-yeah. Summer jam alright. Hey-yeah, ooh, hey-yeah. Moonlight cruisin' down the boulevard. Strobe lights watching you your body's tight. Alright looking kinda freaky to me. Can't get you out of my mind. I can't lie. Cause a girl like you is so hard to find. I'm waiting for the day to make you mine. Cause I can't take it. This ain't nothing but a summer jam. Brown skin and cinnamon tans. This ain't nothing but a summer jam. We're gonna party as much as we can. Hey-yeah ooh hey-yeah. Summer jam alright. Hey-yeah ooh hey yeah. This ain't nothing but a summer jam. Brown skin and cinnamon tans. This ain't nothing but a summer jam. We're gonna party as much as we can. This ain't nothing but a summer jam. Brown skin and cinnamon tans. This ain't nothing but a summer jam. We're gonna party as much as we can. Hey-yeah ooh hey-yeah. Summer jam alright. Hey-yeah ooh hey yeah. Summer jam alright. By JP"
sweet dreams,Sweet dreams are made of this. Who am I to disagree?. Travel the world and the seven seas. Everybody's looking for something. Some of them want to use you. Some of the them wanna get used by you. Some of them want to abuse you. Some of them want to be abused. Sweet dreams are made of this. Who am I to disagree?. Travel the world and the seven seas. Everybody's looking for something. Some of them want to use you. Some of them wanna get used by you. Some of them want to abuse you. Some of them want to be abused. I wanna use you. And abuse you. I wanna know what's inside. Movin' on. Movin' on. Movin' on. Movin' on. Movin' on. Movin' on. Movin' on. Sweet dreams are made of this. Who am I to disagree?. Travel the world and the seven seas. Everybody's looking for something. Some of them want to use you. Some of the them wanna get used by you. Some of them want to abuse you. Some of them want to be abused. I'm gonna use you. And abuse you. I've gotta know what's inside. I'm gonna use you. And abuse you. I've gotta know what's inside
time,"Time, this is what you need. Time, this is what you need. Time, this is what you need. Time, this is what you need"
"trebles, trebles",Let me turn the radio on. And set the mood.... Trebles Trebles Start No. Trebles Trebles Start. Trebles Trebles Start No. Trebles Start the trigger toooooo. Trebles Trebles Start No. Trebles Trebles Start. Trebles Trebles Start No. Trebles Start ta ta ta. Trebles Trebles Start No. Trebles Trebles Start. Trebles Trebles Start No. Trebles Start the trigger toooooo. Trebles Trebles Start No. Trebles Trebles Start. Trebles Trebles Start No. Treble Start ta ta ta. Ta ta ta ta ta ta ta ta ta ta ta. Trebles Trebles Start No. Trebles Trebles Start. Trebles Trebles Start No. Trebles Start the trigger toooooo. Trebles Trebles Start No. Trebles Trebles Start. Trebles Trebles Start No. Trebles Start the trigger toooooo. Ta ta ta ta ta ta ta ta ta ta ta
