satisfaction,Push me. And then just touch me. Till I can get my satisfaction (x2). Satisfaction. Push me. And then just touch me. Till I can get my satisfaction (x2). Satisfaction. Satisfaction. Satisfaction
love and motion,"The glow i see. it's been following me. and it's brighter than before. it seems brighter than before. and you... and me.... we see perfectly. it seems lighter than before. so much brighter than before. and i could be the only one that you'd ever need. and you could be the only girl that i wait for (wait for, wait for...). 'cause you've got me and we've got nice. do you believe in love?. 1, 2, 3, 4 we've got love and motion, and motion, and motion (and motion...). The glow i see. it's been following me. and it's brighter than before. it seems brighter than before. and you... and me.... we hear perfectly. it seems louder than before. so much rouded than before. and i could be the only one that you'd ever need. and you could be the only girl that i wait for (wait for, wait for...). 'cause you've got me and we've got nice. do you believe in love?. 1, 2, 3, 4 we've got love and motion, and motion, and motion (and motion...). did you walk across the line?. did you shake it off your mind?. did you ever think that i would be the one to bring you back?. did you cover up the sound of a million golden days?. when the sun comes up we'll all be here together, it's ok. and i could be the only (just think about everything oh-oh) one that you'd ever need. and you could be the only (just think about everything...) girl that i wait for (wait for, wait for...). 'cause you've got me and we've got nice. do you believe in love?. 1, 2, 3, 4 we've got love and motion, and motion, and motion (and motion...). Lara-ra-ra-la-laaa-la Lara-ra-ra-la-lara-Ohhh.... Lara-ra-ra-la-laaa-la Lara-ra-ra-la-lara-Ohhh..."
i love my sex,"And I love my sex. I love my dresses, cars, perfumes and jewels. I love my man, my money, power. And I love my sex [x2]. And I love my sex [x2]. Sex. And I love my sex. I love my dresses, cars, perfumes and jewels. I love my man, my money, power. And I love my sex [x2]"
girls just wanna have fun (cyndi lauper remix),"Girls just want to have fun. Just want. Just want. Just want. Just want. Just want. Just want. Just want. Just want. Girls just want to have fun. Just want. Just want. Just want. Just want. Just want. Just want. Just want. Just want. Girls, they wanna have fun. Just want. Just want. Just want. Just want. Just want. Just want. Just want. Just want. Girls, they wanna have fun. Oh girls just want to have.... That's all they really want. Some fun. When the working day is done. Oh, girls, they wanna have fun. Oh, girls just wanna have fun. Girls, they wanna have fun. Oh, girls just want to have. Want to have fun. Want to have fun. Want to have fun. Want to have fun. Wanna have. Wanna have. Wanna, wanna, wanna have. Wanna, wanna, wanna have. Wanna, wanna, wanna have. Girls, want, wanna have fun. Girls just want to have fun. Just want. Just want. Just want. Just want. Just want. Just want. Just want. Just want"
hit my heart,"Hey boy, it's not a game. You are the one to blame. My love is not your toy. You better be careful boy... You told a million lies to me. One day you said goodbye baby. I gave you one more chance. So please tell me baby... Are you gonna hit my heart?. Are you gonna leave me once again?. Baby, don't you hit my heart... Are you gonna break my heart?. Are you gonna make me cry again?. Baby, don't you break my heart... I'm not that kind of girl. I know what i deserve. My trust in you was wrong, darling. I won't do it anymore. You swear that you still care for me. You tell to come back again, honey. But you is always the same. Won't you tell me baby. Are you gonna hit my heart?. Are you gonna leave me once again?. Baby, don't you hit my heart... Are you gonna break my heart?. Are you gonna make me cry again?. Baby, don't you break my heart.."
every single day,Hey guy - you're the one for me. Your face - the sweetest thing I've ever seen. Stop by - dedicate to me. Your time - your time. At night - it really gets to me. I find nobody is here with me. Stop by - say you'll stay with me. You're the one I really miss. Every single day - single hour. I can see your face - single day. Every single day - single hour. I can see your face - single day. Every single day - single hour. I can see your face - single day. Every single day - single hour. I can see your face - single day. Hey guy - you're the one for me. Those eyes - the loveliest I've ever seen. Stop by - Just to say to me. You're mine - you're mine. This time lay some love on me. I'm blind - to anything surrounding me. so fine when you're next to me. You're the one I can't resist
cinema (feat. gary go),"I could watch you for a lifetime. You're my favourite movie. A thousand endings. You mean everything to me. I never know what's coming. Forever fascinated. Hope you don't stop running. To me cause I'll always be waiting. You are a cinema, I could watch you forever. Action thriller, I could watch you forever. You are a cinema, a Hollywood treasure. Love you just the way you are. A cinema, a cinema, a cinema. A cinema, a cinema, a cinema. Stars spell out your name. Like in a science fiction drama. Romance roll in. Like a flower in the summer. You always keep me guessing. Forever my wonder. Hope you start undressing. All my dreams until the end of. You are a cinema, I could watch you forever. Action, thriller, I could watch you forever. You are a cinema, a Hollywood treasure. Love you, just the way you are. A cinema, a cinema, a cinema. A cinema, a cinema, a cinema. Never know what movie you're playing. Never know what movie you're playing. Never know what movie you're playing. Never know never know never know. You are a cinema, I could watch you forever. Action, thriller, I could watch you forever. You are a cinema, a Hollywood treasure. Love you just the way you are. A cinema, a cinema, a cinema. A cinema, a cinema, a cinema"
let this last forever,"The lights blur in the sky. The sun starting to die. As we're coming to light. A retro for the fade. No fear we are brave!. This night is gonna save us!. When the wind is in your hair. I just stare. For a second I don't care. I just stare. As the sun leaves and leaps through my hands, I think. Let this last forever. Let this last forever!. Oh, oh, ooh, oh, oh, oh. Let this last forever. Let this last forever!. Fall back to the ground. Spellbound by the sound. Surrender me now!. No need to be scared. True love's gonna get us there. And start to whirl around us!. As the sun leaves and leaps through my hands, I think. Let this last forever. Let this last forever!. Oh, oh, ooh, oh, oh, oh. Let this last forever. Let this last forever!"
cinema (feat. gary go) (skrillex remix),"I could watch you for a lifetime. You're my favorite movie. A thousand endings. You mean everything to me. I never know what's comin'. Forever fascinated. Hope you don't stop runnin' to me. 'Cause I'll always be waitin'. You are my cinema. I could watch you forever. Action, thriller. I could watch you forever. You are my cinema. A Hollywood treasure. Love you just the way you are. My cinema, my cinema, my cinema.... Get up, get down. Three steps down. My DJ gonna break it down. Get up, get down. Three steps down. My DJ gonna break it down. Get up, get down. Three steps down. My DJ gonna break it down. Get up, get down. Lose that sound. Drop the bass. Stars spell out your name. Like in a science fiction drama. Romance growing. Like a flower in the summer. You always keep me guessin'. Forever my wonderful. Hope you start undressin'. All my dreams and take me under. You are my cinema. I could watch you forever. Action, thriller. I could watch you forever. You are my cinema. A Hollywood treasure. Love you just the way you are. My cinema, my cinema, my cinema.... Get up, get down. Three steps down. My DJ gonna break it down. Get up, get down. Three steps down. My DJ gonna break it down. Get up, get down. Three steps down. My DJ gonna break it down. Get up, get down. Lose that sound. Drop the bass. You are my cinema. I could watch you forever. Action, thriller. I could watch you forever. You are my cinema. A Hollywood treasure. Love you just the way you are. My cinema, my cinema, my cinema"
run to me,"Everyday I say a prayer. I need your love. I want you there. I long for you and no more loneliness. Inside my dreams. you're like a drum. your sound is good. like the beat of my heart. so take a ride. and fly me to a star. run to me run to me, baby. yes I know that you need me now. run to me run to me. I don't know how. run to me run to me, baby. 'cause I know that you want me now. run to me run to me. somehow. On the sea or on the air. everything will take you there. I don't know why. I need your love to share. So take a boat or take a plane. don't leave me here don't let me go insane. I'm only asking to see your face again. run to me run to me, baby. yes I know that you need me now. run to me run to me. I don't know how. run to me run to me, baby. 'cause I know that you want me now. run to me run to me. somehow. You're my lover. my one and only dream. I run for cover. don't leave me waiting here. You're my pleasure and you're my pain. You're givin' me emotions. You turn me round inside. and light my flame. you know that I'm your lady"
no matter what you do,Tell me what your spirit says. Show me what you pray. Teach me every single part. I'll be your guide. You are a prisoner. Looking for to be.... You can change your face. But can't change your mind. No matter what do you do {x7}. Tell me what your spirit says. Show me what you pray. Teach me every single part. I'll be your guide. You are a prisoner. Looking for to be.... You can change your face. But can't change your mind. No matter what do you do {x8}. Tell me what your spirit says. Show me what you pray. Teach me every single part. I'll be your guide. You are a prisoner. Looking for to be.... You can change your face. But can't change your mind. No matter what do you do {x4}. Tell me what your spirit says. Show me what you pray. Teach me every single part. I'll be your guide. You are a prisoner. Looking for to be.... You can change your face. But can't change your mind. No matter what do you do {x8}. Tell me what your spirit says. Show me what you pray. Teach me every single part. I'll be your guide. You are a prisoner. Looking for to be.... You can change your face. But can't change your mind. No matter what do you do {x8}
beautiful people,"Everywhere everywhere. Everywhere I go. Everywhere that I've been. The only thing I see is. Is beautiful people. Beautiful people. Beautiful people. Beautiful people. Don't you know, don't you know. You're beautiful, don't you know. Don't you know, don't you know. Beautiful, don't you know, know, know. Live your life, live your life. Let the love inside. It's your life, it's your life. Got to play it right. Take your time, take your time. Take your sexy time. Lose your head, lose your head. Your beauty it's inside you. Inside you. Don't let 'em bring you down, no. The beauty is inside you. Don't let 'em bring you down. The beauty is inside you. Don't let 'em bring you down. Cos you start your life today. Livin' any thoughts you've dreamed off. Everywhere, everywhere. Everywhere I go. Everywhere that I've been. The only thing I see is. Is beautiful people. Beautiful people. Beautiful people. Beautiful people. Don't you know, don't you know. You're beautiful, don't you know. Don't you know, don't you know. Beautiful don't you know, know, know. Take your time, take your time. Take your sexy time. Lose your head, lose your head. Your beauty's deep inside. Inside you. Don't let 'em bring you down, no. Your beauty is inside you. Don't let 'em bring you down, no. The beauty is inside you. Don't let 'em bring you down. Everywhere, everywhere. Everywhere I go. Everywhere that I've been. The only thing I see is. Is beautiful people. Beautiful people. Beautiful people. Beautiful people. Don't you know, don't you know. You're beautiful, don't you know. Don't you know, don't you know. Beautiful don't you know, know, know"
who's your daddy?,Who´s Your Daddy?. You´r my Daddy!. Who´s Your Daddy?. I want you daddy. I want you more. I want mine. And I am yours. I want you stronger. I want you harder. I want you mine. Do you feel fine?. Who´s Your Daddy?(4X). You´r my Daddy. Come I will give it to you. You´r my Dady. Come I will give it to you. You´r my Daddy. Come I will make you groove. ahhhhhhhhhhhhhhhhhhhhhh. Who´s Your Daddy?. You´r my Daddy!. I want you Daddy. I want you more. I want you mine. And I am yours. I want you stronger. I want you harder. I want you mine. Do you feel fine?. Who´s your Daddy?(4X). You´r my Daddy!(3X). ahhhhhhhhhhhhhhhh. Who´s Your Daddy?. You´r my Daddy!. §_*pipokitah*_§. guarDa
paradise (feat. chris brown),"I'm here at the end, yeah. If I could go back to the start. I'd do it again, yeah. I'd live like never before. Now will you remember. Remember me when I'm gone?. Remember the heat, yeah. That's keeping you warm?. Saying brighter, now we're burning up, light up. Yelling turn it up, let go, let go, let go. In paradise, the closer I get to you. It feels like paradise. And I'd do anything you'd want me to. When we're in paradise. I'll see you on the other side, where it's alright. If tonight is the last night. I'll see you in paradise. If tonight is the last night. I'll see you in paradise. If tonight is the last night. I'll see you in paradise. You better be ready. 'Cause all good things come to an end. Spring into summer, my fire's burning again. Saying brighter, I'm not giving up, light up. Gonna live it up, let go, let go, let go. In paradise, the closer I get to you. It feels like paradise. And I'd do anything you'd want me to. When we're in paradise. I'll see you on the other side, where it's alright. If tonight is the last night. I'll see you in paradise. Paradise. If tonight is the last night. I'll see you in paradise. Paradise. Paradise. If tonight is the last night. I'll see you in paradise"
illusion,"I WANNA BE YOUR ILLUSION. BE YOUR ILLUSION. TO MAKE YOU HAPPY TONIGHT. ENJOY THIS TRIP WITH ME. I WANNA BE YOUR EMOTION, BE YOUR EMOTION. WHY DON'T YOU TURN OFF THE LIGHTS?. IMAGINE HOW WE COULD BE LIVING... SOMETIMES I WONDER WHY. WE HAVE NO LIMITS. EVERYTHING WE DO IS TRY. TO FIND OUT WHO WE ARE.. WE WON'T STOP PLAYING. THAT SPECIAL GAME OF LOVE. AND WHEN WE GET TOGETHER. THE TIME IS RUNNING. I'LL BE A DREAM THAT YOU'LL REMEMBER. OVER AND OVER. IF ONLY YOU TRY ME, IF ONLY YOU TOUCH ME. I WANNA BE YOUR ILLUSION. BE YOUR ILLUSION. TO MAKE YOU HAPPY TONIGHT. ENJOY THIS TRIP WITH ME. I WANNA BE YOUR EMOTION, BE YOUR EMOTION. WHY DON'T YOU TURN OFF THE LIGHTS?. IMAGINE HOW WE COULD BE LIVING... THROUGH THE DARKNESS OF THE TOWN. LOOKING FOR A LOVER. I'M PRAYING YOU TO STAY,. TO KEEP THE PROMISE YOU MADE. CAN'T YOU SEE IT BABY?. IT'S A PART OF THE GAME.. AND EVERYTIME THAT YOU SAY NO. YOU GOT ME GOING CRAZY,. I'M GOING OUT MY MIND. I'LL DO WHAT YOU WANT ME TO. I'M A VICTIM BABY.. JUST PUSH ME THROUGH. I WANNA BE YOUR ILLUSION. BE YOUR ILLUSION. TO MAKE YOU HAPPY TONIGHT. ENJOY THIS TRIP WITH ME. I WANNA BE YOUR EMOTION. BE YOUR EMOTION,. WHY DON'T YOU TURN OFF THE LIGHTS?. IMAGINE HOW WE COULD BE LIVING.. I WANNA BE YOUR ILLUSION I. WANNA DO WHAT MAKES YOU FEEL ALL RIGHT. IT'S A MATTER OF TIME NOW BABE,. IT'S A MATTER OF FACT NOW BABE. I'M GONNA MAKE YOU FEEL GOOD"
time,"Time, this is what you need. Time, this is what you need. Time, this is what you need. Time, this is what you need"
"trebles, trebles",Let me turn the radio on. And set the mood.... Trebles Trebles Start No. Trebles Trebles Start. Trebles Trebles Start No. Trebles Start the trigger toooooo. Trebles Trebles Start No. Trebles Trebles Start. Trebles Trebles Start No. Trebles Start ta ta ta. Trebles Trebles Start No. Trebles Trebles Start. Trebles Trebles Start No. Trebles Start the trigger toooooo. Trebles Trebles Start No. Trebles Trebles Start. Trebles Trebles Start No. Treble Start ta ta ta. Ta ta ta ta ta ta ta ta ta ta ta. Trebles Trebles Start No. Trebles Trebles Start. Trebles Trebles Start No. Trebles Start the trigger toooooo. Trebles Trebles Start No. Trebles Trebles Start. Trebles Trebles Start No. Trebles Start the trigger toooooo. Ta ta ta ta ta ta ta ta ta ta ta
control (feat. gary go),"I've been trying to breakout of the breakdown. Hoping to find a miracle in the meltdown. All the loving chaos that I'm surround. I dance dance to take me off the ground ground.. I've been closing my eyes so I can see you. Trying to make every other lover be you. I know all of my fantasies won't come true. I dance dance and pray that some of them do.. (Chorus). Hey-yeah, lift my emotion. Tonight, my heart is open. Let go, there's no confusion. Control is an illusion.. Control is an illusion.. Woo-ooo-oo-oo.. Control is an illusion.. I can't own ya love,. I can't own your love,. I gotta let it go in the night sky. When I look above. When I look above. I see it shining; I'll feel so aliiiiive.. Ready to let love back into my soul.. In the beauty, in the music, it's time to lose control of control.. (Chorus 2x). Control, control.. Control, control."
sweet dreams,Sweet dreams are made of this. Who am I to disagree?. Travel the world and the seven seas. Everybody's looking for something. Some of them want to use you. Some of the them wanna get used by you. Some of them want to abuse you. Some of them want to be abused. Sweet dreams are made of this. Who am I to disagree?. Travel the world and the seven seas. Everybody's looking for something. Some of them want to use you. Some of them wanna get used by you. Some of them want to abuse you. Some of them want to be abused. I wanna use you. And abuse you. I wanna know what's inside. Movin' on. Movin' on. Movin' on. Movin' on. Movin' on. Movin' on. Movin' on. Sweet dreams are made of this. Who am I to disagree?. Travel the world and the seven seas. Everybody's looking for something. Some of them want to use you. Some of the them wanna get used by you. Some of them want to abuse you. Some of them want to be abused. I'm gonna use you. And abuse you. I've gotta know what's inside. I'm gonna use you. And abuse you. I've gotta know what's inside
able to love,"Nobody business if I walk, talk, make luv scene. But I'm able to love. Able to live. Able to love. Nobody business if I walk, talk, make luv scene. But I'm able to love. Able to live. Able to love. Nobody business if I walk, talk, make luv scene. But I'm able to love. Able to live. Able to love.... Nobody business if I walk, talk, make luv scene. But I'm able to love. Able to live. Able to love. Able to live. Able to love.... Nobody business if I walk, talk, make luv scene. But I'm able to love. Able to live. Able to love. Able to live. Able to love. I'm available!. Able to live. Able to love.... Nobody business if I walk, talk, make luv scene. But I'm able to love. Nobody business if I walk, talk, make luv scene. But I'm able to love. Able to live. Able to love. Nobody business if I walk, talk, make luv scene. But I'm able to love. Able to live. Able to love. I'm available!. Nobody business if I walk, talk, make luv scene. But I'm able to love. Able to live. Able to love. Nobody business if I walk, talk, make luv scene. But I'm able to love. Able to live. Able to love. Nobody business if I walk, talk, make luv scene. But I'm able to love. Able to live. Able to love..."
love is gonna save us,Stones and flowers on the ground. We are lost and found. But love's gonna save us. Shadows walking in the crowd. We are lost and found. But love's gonna save us
turn me up,"Turn Me Up. Benny Benassi. Composição: Indisponível. play the music (x14). you've got the love i like. i've got to have you now. you're my emotions. don't leave me hanging around. baby please. why don't you understand. i only want to be your friend. you are my sweet release. i've got to have you now. you're my affection. don't leave me breaking down. everybody in the world. should hear what i'm saying. cause i wanna scream and tell the world today. turn me up, up, up..... play the music (x15). you are alive for me. i've got to have you now. you've got the power. don't leave me on the ground. touch me babe. you really turn me on. no, no, no don't leave me on my own. you are my one desire. i've got to have you now. i need direction. i'm gonna say it loud. everybody in the world should hear what i'm saying. cause i'm wanna scream and tell the world today. turn me up, up, up..... turn me down. turn me down. turn me up, up, up..... turn me up, up, up..... turn me down. turn me down. turn me up, up, up..... turn me down. turn me down.. turn me up, up, up..... turn me down"
put your hands up,"I'm shaking slowly to the beat. I like rolling on my feet. So people listen to the sound. Round round round round round. Put your hands up. Oh, yeah put your hands up. Yeah yeah. My satisfacion is complete. I keep on rolling on my feet. Just put your hands up to the sound. And turn around round round. Put your hands up. 1, 2, 3, 4... 1, 2, 3, 4. oh, yeah ah ah. yeah yeah. I like shaking all my body. Down to the beat. Relax my mind rolling down. On my feet. People put your hands up. When you hear the sound. People scream scream. Put your hands up"
inside of me,"Hey u see.... What's inside of me. Hey u see.... What's inside of me. What's Inside of me!. What's. (12x). What's inside of me. Hey u see.... What's inside of me. What's inside of me!. Hey u see.... What's inside of me. It's cellgamy, it's purety, no! It's privity. What's inside of me, of me, of me, of me, of me.... What's inside of me. What's. (32x). Hey u see.... What's inside of me. Hey u see.... What's inside of me. What's inside of me!. What's inside of me.... Hey u see.... What's inside of me. Hey u see.... What's inside of me. What's inside of me!"
able to love,"Nobody business if I walk, talk, make luv scene. But I'm able to love. Able to live. Able to love. Nobody business if I walk, talk, make luv scene. But I'm able to love. Able to live. Able to love. Nobody business if I walk, talk, make luv scene. But I'm able to love. Able to live. Able to love.... Nobody business if I walk, talk, make luv scene. But I'm able to love. Able to live. Able to love. Able to live. Able to love.... Nobody business if I walk, talk, make luv scene. But I'm able to love. Able to live. Able to love. Able to live. Able to love. I'm available!. Able to live. Able to love.... Nobody business if I walk, talk, make luv scene. But I'm able to love. Nobody business if I walk, talk, make luv scene. But I'm able to love. Able to live. Able to love. Nobody business if I walk, talk, make luv scene. But I'm able to love. Able to live. Able to love. I'm available!. Nobody business if I walk, talk, make luv scene. But I'm able to love. Able to live. Able to love. Nobody business if I walk, talk, make luv scene. But I'm able to love. Able to live. Able to love. Nobody business if I walk, talk, make luv scene. But I'm able to love. Able to live. Able to love..."
alone,"when I think about you. when I think about you. I am wild. I do not hold me. I am so alone. I am close to me. alone,alone,alone,alone,alone. when I think about you. when I think about you. I am wild. I do not hold me. I am so alone. I am close to me. alone,alone,alone,alone. when I think about you. when I think about you. I am wild. I do not hold me. I am so alone. I am close to me. alone"
beautiful people,"Everywhere everywhere. Everywhere I go. Everywhere that I've been. The only thing I see is. Is beautiful people. Beautiful people. Beautiful people. Beautiful people. Don't you know, don't you know. You're beautiful, don't you know. Don't you know, don't you know. Beautiful, don't you know, know, know. Live your life, live your life. Let the love inside. It's your life, it's your life. Got to play it right. Take your time, take your time. Take your sexy time. Lose your head, lose your head. Your beauty it's inside you. Inside you. Don't let 'em bring you down, no. The beauty is inside you. Don't let 'em bring you down. The beauty is inside you. Don't let 'em bring you down. Cos you start your life today. Livin' any thoughts you've dreamed off. Everywhere, everywhere. Everywhere I go. Everywhere that I've been. The only thing I see is. Is beautiful people. Beautiful people. Beautiful people. Beautiful people. Don't you know, don't you know. You're beautiful, don't you know. Don't you know, don't you know. Beautiful don't you know, know, know. Take your time, take your time. Take your sexy time. Lose your head, lose your head. Your beauty's deep inside. Inside you. Don't let 'em bring you down, no. Your beauty is inside you. Don't let 'em bring you down, no. The beauty is inside you. Don't let 'em bring you down. Everywhere, everywhere. Everywhere I go. Everywhere that I've been. The only thing I see is. Is beautiful people. Beautiful people. Beautiful people. Beautiful people. Don't you know, don't you know. You're beautiful, don't you know. Don't you know, don't you know. Beautiful don't you know, know, know"
