beautiful (feat. justin bieber),"I know, I know it's been a while. I wonder where you are, and if you think of me. Sometimes, 'cause you're always on my mind. You know I had it rough,. Trying to forget you but. The more that I look around,. The more I realize. You're all I'm looking for. What makes you so beautiful,. Is you don't know how beautiful you are to me. You're not trying to be perfect. Nobody's perfect, but you are, to me. It's how you take my breath away. Feel the words that I don't say. I wish somehow, I could say them now. Oh, oh, I could say them now, yeah. Just friends, the beginning or the end?. How do we make sense. When we're on our own. It's like you're the other half of me. I feel incomplete, I should've known. Nothing in the world compares. to the feelings that we share. So not fair. What makes you so beautiful,. Is you don't know how beautiful you are to me. You're not trying to be perfect. Nobody's perfect, but you are, to me. You try to take my breath away. Feel the words that I don't say. I wish somehow, I could say them now. Oh, it's not you, blame it all on me. I was running from myself. Cause I couldn't tell how deep that we. We were gonna be. I was scared it's destiny,. but it hurts like hell. Hope it's not too late, just a twist of faith. What makes you so beautiful,. Is you don't know how beautiful you are to me. You're not trying to be perfect. Nobody's perfect, but you are, to me. It's how you take my breath away. Feel the words that I don't say. I wish somehow, I could say them now. Oh, oh, I could say them now"
black heart,"I don't care about your good intentions. I care more about your bad dreams. I want a love on a new dimension. You know I'm gonna be. Under the blossom tree. (Come a little closer. won't you come a little closer to me?). You're my miracle. Under the blossom tree. (Come a little closer. won't you come a little closer to me?). Cause you're my miracle. In your black heart, is where you'll find me. Cutting through the cracks of the concrete. In your black heart, is where you'll find me. Waiting. You think love is a destination. Like a show on your Tv. You're a cry to your generation. But don't you cry to me. Under the blossom tree. (Come a little closer. won't you come a little closer to me?). You're my miracle. Under the blossom tree. (Come a little closer. won't you come a little closer to me?). You're my miracle. In your black heart, is where you'll find me. Cutting through the cracks of the concrete. In your black heart, is where you'll find me. Waiting, oh. In your black heart, is where you'll find me. Cutting through the cracks of the concrete. In your black heart, is where you'll find me. Waiting. Everything you ever wanted. Now it's happening, now it's happening. (black heart). Everything you ever wanted. Now it's happening, under the blossom tree. (black heart). Everything you ever wanted. Now it's happening, now it's happening. (black heart). Everything you ever wanted. Now it's happening, under the blossom tree. (black heart). Black heart. Black heart"
body language,"I think I'm in trouble,. I can't see the end. I call you my lover, you call me your friend. I keep it a secret, yeah even from you. I call you my lover, oh what can I do?. I've been lonely baby, I. I've been hangin' on the line. Been hangin' on the line. And if you love me baby. Don't, don't, don't hang up this time. Cause you know. Body language will do the trick. If you stay with me tonight,. then we'll talk it over. That's the danger, you're missing it. I just think we're overthinking it. I think we're overthinking it. Used to be perfect,. that we could be free. To do what we wanted,. you do it to me. We only just started, don't say it's the end. So call me your lover,. don't call me your friend. I've been lonely baby, I. I've been hangin' on the line. Been hangin' on the line. And if you love me baby. Don't, don't, don't hang up this time. Cause you know. Body language will do the trick. If you stay with me tonight,. then we'll talk it over. That's the danger, you're missing it. I just think we're overthinking it. I think we're overthinking it. Body language will do the trick. If you stay with me tonight,. then we'll talk it over. That's the danger, you're missing it. I just think we're overthinking it. Don't think it over. I just think we're overthinking it. Don't think it over. I just think we're overthinking it. Don't think it over. I just think we're overthinking it. Don't think it over. I just think we're overthinking it. Don't think it over. Body language will do the trick. If you stay with me tonight,. then we'll talk it over. That's the danger, you're missing it. I just think we're overthinking it. I think we're overthinking it"
both sides now,"Bows and flows of angel hair. And ice cream castles in the air. Feather cannons everywhere. I've looked at clouds that way. Now they only block the sun. They rain and snow on everyone. So many things i would have done. But clouds got in my way. I've looked at clouds from both sides now. I've looked at clouds from both sides now. From up and down and still somehow. It's clouds illusions i recall. I really don't know clouds at all. Moons and junes and ferris wheels. The dizzy, dancing way you feel. When every fairy tale comes true. I've looked at love that way. But now it's just another show. You leave 'em laughing when you go. And if you care don't let them know. Don't give yourself away. I've looked at love from both sides now. From give and take and still somehow. It's loves illusions i recall. I really don't know love at all. Tears and fears and feeling proud. To say i love you right out loud. Dreams and schemes and circus crowds. I've looked at life that way. But now old friends are acting strange. They shake their heads. They say i've changed. Well somethings lost and somethings gained. In living every day. I've looked at life from both sides now. I've looked at life from both sides now. From win and loose and still somehow. It's lifes illusions i recall. I really don't know life. I've looked at clouds from both sides now. From up and down and still somehow. It's clouds illusions i recall. I really don't know clouds at all. I really don't know life at all"
boy problems,"If you're gonna go then go. She said to me on the phone. So tired of hearin' all your boy problems. If you're gonna stay then stay. He's not gonna change anyway. So tired of hearin' all your boy problems. And I know that she's right. And I should not be offended. That I know what it looks like. From the outside. And I know that she's right. And I should not be offended. That I know what it looks like. From the outside, from the outside. Boy problems, who's got 'em?. I've got them too. Boy trouble, we've got double. Don't know what to do. I think I broke up with my boyfriend today. And I don't really care. I've got worse problems. (I broke up with my boyfriend). I think I broke up with my boyfriend today. And I don't really care. I've got worse problems. (I broke up with my boyfriend). ""Carly, you got to let it go! "". She said to me on the phone. So tired of hearin' all your boy problems. It could be the perfect day. He'll just make it rain anyway. So tired of hearin' all your boy problems. And I know that she's right. And I should not be offended. That I know what it looks like. From the outside. And I know that she's right. And I should not be offended. That I know what it looks like. From the outside, from the outside. Boy problems, who's got 'em?. I've got them too. Boy trouble, we've got double. Don't know what to do. I think I broke up with my boyfriend today. And I don't really care. I've got worse problems. (I broke up with my boyfriend). I think I broke up with my boyfriend today. And I don't really care. I've got worse problems. (I broke up with my boyfriend). What's worse?. Losin' a lover or losin' your best friend. What's worse is when you discover. You're not good for each other. She's been giving, you've been taking, taking, taking. Boy problems, who's got 'em?. I've got them too. Boy trouble, you've got double. Don't know what to do. I think I broke up with my boyfriend today. And I don't really care. I've got worse problems. (I broke up with my boyfriend). I think I broke up with my boyfriend today. And I don't really care. I've got worse problems. (I broke up with my boyfriend). Boy problems, who's got 'em?. I've got them too. Boy trouble, you've got double. Don't know what to do. Boy problems, who's got 'em?. I've got them too. Boy trouble, you've got double. Don't know what to do. Boy problems, who's got 'em?. I've got them too. Boy trouble"
bucket,"(There's a hole. in your bucket). Sun's out!. We got. A beach day. Forget. Yourself say. Why don't. We people watch?. Kids all playing. 'Round in the sand. (Little boy crying). Oh, no!. He's got. Some troubles. Got us laughing. As he throws. His shovel. Nothing's. Really going. As planned. I don't know. How we're. Gonna build. A castle now. Do you want. To start. Again somehow?. I'll stay. Until the sun. Comes down. Down, down. Are you smiling?. Look over. My shoulder. See. Your laughter. Bubble over. Lately. You've. Been working. Too hard. And i've. Been waiting. To recognize. That sparkle. That's. In your eyes. Those. Two dimples. On your cheeks. The joy. That lights. The fire. I don't know. How we're. Gonna build. A castle now. Do you want. To start. Again somehow?. I'll stay. Until the sun. Comes down. Down, down. There's a hole. In my bucket. Dear Liza. Dear Liza. There's a hole. In my bucket. Dear Liza. A hole. And i don't know. How. We're s'posed. To build. A castle now. Do you want. To start. Again somehow?. I'll stay. Until the sun. Comes down. Down. I'll stay. Until the sun. Comes. I don't know. How we're. Gonna build. A castle now. Do you want. To start. Again somehow?. I'll stay. Until the sun. Comes down. Down, down. 'Til the sun. Comes down. I'll stay. Sun's coming down. I'll stay. Sun's coming down. I'll stay. Sun's coming down. I'll stay"
bullseye,"I watch my heart trapezing to the water. I clap my hands, as you were taking a bow. I sat and watched you leaving for an hour. I still can't believe it now. Oh. It could have gone the other way. I could have been the one to make you stay. (Woah, oh, oh, oh, oh, oh, oh). I thought it would be you and I. Could have had a life supply. Or could have hit the bullseye. (Woah, oh, oh, oh, oh, oh, oh). Could have hit the bullseye. I saw my brother standing at the altar. I thought at you as they were taking their vows. I sat and watched this picture for an hour. I still believe somehow. Oh. It could have gone the other way. I could have been the one to make you stay. (Woah, oh, oh, oh, oh, oh, oh). I thought it would be you and I. Could have had a life supply. Or could have hit the bullseye. (Woah, oh, oh, oh, oh, oh, oh). Could have hit the bullseye. Bullseye. Bullseye. I could give you what you wanted. You never told me what you needed. I could give you what you wanted. Tell me what you need, tell me what you need. Cause it could have gone the other way. I could have been the one to make you stay. (Woah, oh, oh, oh, oh, oh, oh). Could have hit the bullseye. And I wish I was the other guy. I wish I was the one to make you cry. (Woah, oh, oh, oh, oh, oh, oh). Or could have hit the bullseye. And could have had a life supply. Or could have hit the bullseye. (Woah, oh, oh, oh, oh, oh, oh). Don't you know. Could have hit the bullseye. And, and, could have hit the bullseye"
call me maybe,"I threw a wish in the well,. Don't ask me, I'll never tell. I looked to you as it fell,. And now you're in my way. I trade my soul for a wish,. Pennies and dimes for a kiss. I wasn't looking for this,. But now you're in my way. Your stare was holdin',. Ripped jeans, skin was showin'. Hot night, wind was blowin'. Where you think you're going, baby?. Hey, I just met you,. And this is crazy,. But here's my number,. So call me, maybe?. It's hard to look right,. At you baaaabeh,. But here's my number,. So call me, maybe?. Hey, I just met you,. And this is crazy,. But here's my number,. So call me, maybe?. And all the other boys,. Try to chase me,. But here's my number,. So call me, maybe?. You took your time with the call,. I took no time with the fall. You gave me nothing at all,. But still, you're in my way. I beg, and borrow and steal. Have foresight and it's real. I didn't know I would feel it,. But it's in my way. Your stare was holdin',. Ripped jeans, skin was showin'. Hot night, wind was blowin'. Where you think you're going, baby?. Hey, I just met you,. And this is crazy,. But here's my number,. So call me, maybe?. It's hard to look right,. At you baby,. But here's my number,. So call me, maybe?. Hey, I just met you,. And this is crazy,. But here's my number,. So call me, maybe?. And all the other boys,. Try to chaaase me,. But here's my number,. So call me, maybe?. Before you came into my life. I missed you so bad. I missed you so bad. I missed you so, so bad. Before you came into my life. I missed you so bad. And you should know that. I missed you so, so bad. It's hard to look right,. At you baaaabeh,. But here's my number,. So call me, maybe?. Hey, I just met you,. And this is crazy,. But here's my number,. So call me, maybe?. And all the other boys,. Try to chaaase me,. But here's my number,. So call me, maybe?. Before you came into my life. I missed you so bad. I missed you so bad. I missed you so so bad. Before you came into my life. I missed you so bad. And you should know that. So call me, maybe?"
call me maybe (dead cat bounce remix),"I threw a wish in the well,. Don't ask me, I'll never tell. I looked to you as it fell,. And now you're in my way. I trade my soul for a wish,. Pennies and dimes for a kiss. I wasn't looking for this,. But now you're in my way. I threw a wish in the well,. Don't ask me, I'll never tell. I looked to you as it fell,. And now you're in my way. I trade my soul for a wish,. Pennies and dimes for a kiss. I wasn't looking for this,. But now you're in my way. Your stare was holdin',. Ripped jeans, skin was showin'. Hot night, wind was blowin'. Where you think you're going, baby?. I just met you,. This is crazy,. Here's my number,. Call me, maybe?. I just met you,. This is crazy,. Here's my number,. Call me, maybe?. I just met you,. This is crazy,. Here's my number,. Call me, maybe?. I just met you,. This is crazy,. Here's my number,. Call me, maybe?. I threw a wish in the well,. Don't ask me, I'll never tell. I looked to you as it fell,. And now you're in my way. I trade my soul for a wish,. Pennies and dimes for a kiss. I wasn't looking for this,. But now you're in my way. You took your time with the call,. I took no time with the fall. You gave me nothing at all,. But still, you're in my way. I beg, and borrow and steal. Have foresight and it's real. I didn't know I would feel it,. But it's in my way. Your stare was holdin',. Ripped jeans, skin was showin'. Hot night, wind was blowin'. Where you think you're going, baby?. I just met you,. This is crazy,. Here's my number,. Call me, maybe?. I just met you,. This is crazy,. Here's my number,. Call me, maybe?. I just met you,. This is crazy,. Here's my number,. Call me, maybe?. I just met you,. This is crazy,. Here's my number,. Call me, maybe?"
cry,"You're king of the castle. Whenever you're here, you know it feels right. Don't need to worry. Don't need a moon, I've got the spotlight. I want you to. Do you want to?. I want you to stay tonight. I want you to say ""I want you too"". He never wants to strip down to his feelings. He never wants to kiss and close his eyes. He never wants to cry-y-y, cry-y-y. I never really know when he'll be leaving. And even with hello I hear goodbye. He always makes me cry-y-y, cry-y-y. Wake up without you. Flood in my room, I see your headlights. And you got your reasons. You've got a way that makes it alright. I want you to. Do you want to?. I want you to stay tonight. I want you to say ""I want you too"". He never wants to strip down to his feelings. He never wants to kiss and close his eyes. He never wants to cry-y-y, cry-y-y. I never really know when he'll be leaving. And even with hello I hear goodbye. He always makes me cry-y-y, cry-y-y. Wake up without you. Wake up without you. Wake up without you. I wake up without you, boy. Cry-y-y, cry-y-y. Wake up without you. Wake up without you. Wake up without you. I wake up without you, boy. Cry-y-y, cry-y-y. You're king of the castle. Whenever you're here, you know it feels right. Don't need to worry. He never wants to strip down to his feelings. He never wants to kiss and close his eyes. He never wants to cry-y-y, cry-y-y. I never really know when he'll be leaving. And even with hello I hear goodbye. He always makes me cry-y-y, cry-y-y. Cry-y-y"
cup of tea,"A cup of tea, a cup of tea. I've been driving all night, you won't turn on your light that easily. And the On-Sign offers some shelter across the street. Guess I'll drink my trouble down with a cup of tea. You're over me, you're over me. I howl at your room like a wolf to the moon going crazy. With one more time, (??). Guess I'll sit and wait all night with my cup of tea. But it's getting cold in here, 24 hours dear. Are you with someone else tonight?. Distance was killing me, I thought how surprised you'd be. I hope we make sweet love after we fight. Na na na na na na na. Na na na na na na na. Na na na na na na na. I let it be, try to let it be. I be hot to your touch, you say I think too much, call me ‘baby'. And it'll all be fine once you are walking up the street. 'til then I'll sit and wait all night with my cup of tea. But darling, it's getting cold in here, yeah, 24 hours dear. Are you with someone else tonight?. Distance was killing me, I thought how surprised you'd be. I hope we make sweet love after we fight. Na na na na na na na. Na na na na na na na. Na na na na na na na. A cup of tea, a cup of tea. She's holding your waist like she'd give you a taste so easily. I won't cry, no, I'll just watch, and I will see. And I'll say my last goodbye with a cup of tea"
curiosity,"Break a bone. Got me on my knees. You break my heart. Just to watch it bleed. I'm sick with love. Sick like a disease. Don't call me up. Just so I can please you. I can't stand the way you're smiling. I can't stand the way I'm lying. I know, I know, I know you got the key. And you know, you know, you know that it's for me. It's not up to you, you know it's up to me but. Curiosity will never let me go. Oh oh oh oh oh oh,. Uh oh. Oh oh oh oh oh oh. Will never let me go. Oh oh oh oh oh oh. Uh oh. Oh oh oh oh oh oh. Look at me. Left here in the corner. Stupid girl. I really tried to warn her. Walked the streets all night. Until you came around. Knew that you would come. Before you ever even made a sound. I know, I know, I know you got the key. And you know, you know, you know that it's for me. It's not up to you, you know it's up to me but. Curiosity will never let me go. Oh oh oh oh oh oh. Uh oh. Oh oh oh oh oh oh. Will never let me go. Oh oh oh oh oh oh. Uh oh Curiosity. So don't break me tonight. This is crazy love. And you know I'm gunna follow you home. Through the rain. Cause I need your love. And you know I'm gunna follow you home.. Cause I need your love and you know I'm going to follow you.... I know, I know, I know you got the key. You know, you know, you know that it's for me. Well I think that we should try it out to see yeah. Curiosity. So don't break me tonight. This is crazy love. And you know I'm gunna follow you home. Through the rain. Cause I need your love. Yes I need your love. So don't break (don't break) me tonight (me tonight). This is crazy love. And you know I'm gunna follow you home. Through the rain. Cause I need your love. Yes I need your love. Will never let me go. Oh oh oh oh oh oh,. Uh oh. Oh oh oh oh oh oh. Will never let me go. Oh oh oh oh oh oh,. Uh oh Curiosity will never let me go"
cut to the feeling,"I had a dream, or was it real?. We crossed the line and it was on. We crossed the line. It was on this time. I've been denying how I feel. You've been denying what you want. You want from me, talk to me baby. I want some satisfaction. Take me to the stars, just say ""oh"". Ah, I wanna cut through the clouds. Break the ceiling. I wanna dance on the roof. You and me alone. I wanna cut to the feeling, oh yeah. I wanna cut to the feeling, oh yeah. I wanna play where you play with the angels. I wanna wake up with you all in tangles, oh. I wanna cut to the feeling, oh yeah. I wanna cut to the feeling, oh yeah. Cancel your reservations. No more hesitations this is on. I can't make it stop, give me all you got. I want it all or nothing, no more in between. Now give your everything to me. Let's get real baby. A chemical reaction. Take me in your arms and make me ""oh"". Ah, I wanna cut through the clouds. Break the ceiling. I wanna dance on the roof. You and me alone. I wanna cut to the feeling, oh yeah. I wanna cut to the feeling, oh yeah. I wanna play where you play with the angels. I wanna wake up with you all in tangles, oh. I wanna cut to the feeling, oh yeah. I wanna cut to the feeling, oh yeah. Take me to emotion, I want to go all the way. Show me devotion and take me all the way. Take me to emotion, I want to go all the way. Show me devotion and take me all the way. (all the way, all the way, all the way). Take me, take me, take me all the way. I wanna cut through the clouds. Break the ceiling. I wanna dance on the roof. You and me alone. I wanna cut to the feeling, oh yeah. I wanna cut to the feeling, oh yeah. I wanna play where you play with the angels. I wanna wake up with you all in tangles, oh. I wanna cut to the feeling, oh yeah. I wanna cut to the feeling, oh yeah. I wanna cut through the clouds. (mm, cut to the feeling). I wanna dance on the roof (oh, yeah). I wanna cut to the feeling. (I wanna cut to the feeling). I wanna cut to the feeling. (I wanna cut to the feeling)"
dear julien,"La la la la la la la la la la la. La la la la la la la la la la la. . [Chorus]. Dear Julien, don't make it hard. I wonder, did you read the letter that I sent you? Oh oh. So why do we have to go?. Living in a cave of snow. Didn't have the heart. Didn't have the heart. Didn't have the heart at all. Smells like daffodils feels like winter. It feels like winter. You got through to me. Directly yah. Just a splinter. But why do we have to go, why do we have to go?. (Oh oh oh oh oh oh). [Chorus]. Dear Julien, don't make it hard. I wonder, did you read the letter that I sent you oh oh. So why do we have to go. Living in a cave of snow. Didn't have the heart. Didn't have the heart. Didn't have the heart at all. La la la la la la la la la la la. La la la la la la la la la la la. Looks like love but it feels like lyin'. Feels like lyin!. You got through to me. Definitely yah. Oh no, denying. So why do we have to go, why do we have to go?. (oh oh oh oh oh oh). Why do we have to go?. Living in a cave of snow. [Chorus]. Dear Julien, don't make it hard. I wonder, did you read the letter that I sent you oh oh. So why do we have to go. Living in a cave of snow. Didn't have the heart. Didn't have the heart. Didn't have the heart at all. La la la la la la la la la la la. La la la la la la la la la la la. One more day, and I'll be sorry. Two more days then you'll be sorry. Three more days then we'll be sorry. Really really sorry. One more day, and I'll be sorry. Two more days then you'll be sorry. Three more days then we'll be sorry. Really really sorry. One more day, and I'll be sorry. Two more days then you'll be sorry. Three more days then we'll be sorry. Really really sorry. One more day, and I'll be sorry. Two more days then you'll be sorry. Three more days then we'll be sorry. Sorry. [Chorus]. Dear Julien, don't make it hard. I wonder, did you read the letter that I sent you oh oh. So why do we have to go. Living in a cave of snow. Didn't have the heart. Didn't have the heart. Didn't have the heart at all. La la la la la la la la la la la. La la la la la la la la la la la. Didn't have heart at all. La la la la la la la la la la la. La la la la la la la la la la la. I'm really really sorry"
drive,"I had a bad dream you are there, like you always are. I had a bad day, I don't care when I'm in your car. So drive so fast, baby through the night. Drive so fast, and they'll never gonna find you. Drive so fast, saying no goodbyes. Drive so fast, they are leaving all behind you. Ooh, I don't care about my lipstick. I just wanna drive you to love, love, love, love. Chasing the sun, don't wanna miss it. I just wanna drive you to love, love, love. Laughing at me in your head. With my teasing games. Let's talk about you. You're in love, wanna change my name. So drive so fast, baby though the night. Drive so fast, and they'll never gonna find you. Drive so fast, saying no goodbyes. Drive so fast, they are leaving all behind you. Ooh, I don't care about my lipstick. I just wanna drive you to love, love, love, love. Chasing the sun, don't wanna miss it. I just wanna drive you to love, love, love. Ooh, I don't care about my lipstick. I just wanna drive you to love, love, love, love. Chasing the sun, don't wanna miss it. I just wanna drive you to love, love, love. Boy, I get a kick out of you. You know I'm yours. The things you're making me do. I'm never thought, give me to the core. I just wanna drive you to love, love, love, love. I just wanna drive you to love, love, love. Ooh, I don't care about my lipstick. I just wanna drive you to love, love, love, love. Chasing the sun, don't wanna miss it. I just wanna drive you to love, love, love. Ooh, I don't care about my lipstick. I just wanna drive you to love, love, love, love. Chasing the sun, don't wanna miss it. I just wanna drive you to love, love, love"
