i really like you,"I really wanna stop. But I just gotta taste for it. I feel like I could fly with the boy on the moon. So honey hold my hand. You like making me wait for it. I feel like I could die walking up to the room, oh yeah. Late night watching television. But how'd we get in this position?. It's way too soon, I know this isn't love. But I need to tell you something. I really really really really really really like you. And I want you, do you want me, do you want me, too?. I really really really really really really like you. And I want you, do you want me, do you want me, too?. Oh, did I say too much?. I'm so in my head. When we're out of touch. I really really really really really really like you. And I want you, do you want me, do you want me, too?. It's like everything you say is a sweet revelation. All I wanna do is get into your head. Yeah we could stay alone, you and me, in this temptation. Sipping on your lips, hanging on by thread, baby. Late night watching television. But how we get in this position?. It's way too soon, I know this isn't love. But I need to tell you something. I really really really really really really like you. And I want you, do you want me, do you want me, too?. I really really really really really really like you. And I want you, do you want me, do you want me, too?. Oh, did I say too much?. I'm so in my head. When we're out of touch. I really really really really really really like you. And I want you, do you want me, do you want me, too?. Who gave you eyes like that?. Said you could keep them. I don't know how to act. Or if I should be leaving. I'm running out of time. Going out of my mind. I need to tell you something. Yeah, I need to tell you something. I really really really really really really like you. And I want you, do you want me, do you want me, too?. I really really really really really really like you. And I want you, do you want me, do you want me, too?. Oh, did I say too much?. I'm so in my head. When we're out of touch. I really really really really really really like you. And I want you, do you want me, do you want me, too?. I really really really really really really like you. And I want you, do you want me, do you want me, too?. I really really really really really really like you. And I want you, do you want me, do you want me, too?"
i really like you (blasterjaxx remix),"I really wanna stop. But I just gotta taste for it. I feel like I could fly with the boy on the moon. So honey hold my hand. You like making me wait for it. I feel like I could die walking up to the room, oh yeah. Late night watching television. But how'd we get in this position?. It's way too soon, I know this isn't love. But I need to tell you something. I really really really really really really like you. And I want you, do you want me, do you want me, too?. I really really really really really really like you. And I want you, do you want me, do you want me, too?. Oh, did I say too much?. I'm so in my head. When we're out of touch. I really really really really really really like you. And I want you, do you want me, do you want me, too?. Do you want me, do you want me, too?. It's like everything you say is a sweet revelation. All I wanna do is get into your head. Yeah we could stay alone, you and me, in this temptation. Sipping on your lips, hanging on by thread, baby. Late night watching television. But how we get in this position?. It's way too soon, I know this isn't love. But I need to tell you something. I really really really really really really like you. And I want you, do you want me, do you want me, too?. I really really really really really really like you. And I want you, do you want me, do you want me, too?. Oh, did I say too much?. I'm so in my head. When we're out of touch. I really really really really really really like you. And I want you, do you want me, do you want me, too?. And I want you, do you want me, do you want me, too?"
just a step away,"In the space between the words. In the silence of your eyes. In the hands that know the touch. It's the way i feel inside. Here we are. Dancing cross this floor together. With every step i take i seem to want you more than ever. You made me love you. Look into my eyes. I want to tell you. I'll never let you down. And i'll never go away. And if your ever feeling down. I'm just a step away. I'll never let you down. And i'll never go away. And if your ever feeling down. I'm just a step, just a step, just a step away. It's the beating of your heart. It's the tear i have to hide. It's the sound of your guitar. It's the way i feel inside. Here we are. Dancing cross this floor together. With every step i take i seem to want you more than ever. You made me love you. Look into my eyes. I want to tell you. I'll never let you down. And i'll never go away. And if your ever feeling down. I'm just a step away. I'll never let you down. And i'll never go away. And if your ever feeling down. I'm just a step, just a step, just a step away. If you need a shoulder. Or someone to hold you. I'll keep my arms open wide. I'll be the one who loves you. I'll be right there by your side. Here we are. Dancing cross this floor together. With every step i take i seem to want you more than ever. You made me love you. Look into my eyes. I want to tell you. I'll never let you down (i'll never let you down). And i'll never go away (and i'll never go away). And if your ever feeling down (and if your ever feeling down). I'm just a step away. I'll never let you down. And i'll never go away. And if your ever feeling down. I'm just a step away. I'll never let you down. And i'll never go away. And if your ever feeling down. I'm just a step, just a step, just a step away. In the space between the words. In the silence of your eyes. In the hands that know the touch. It's the way i feel inside"
katie's kicking in the corner,"We could go driving. Through the valley. You bring your guitar. I play the tamborine. Hey, a car so cute. I think of curtains. You're trying to show me. All the dead road kill that you see. Come on drive with me. I'm a good luck charm, see. We got a green light telling us to go. And I've been picking through your pockets. Oh, you are my rock. And I like skipping stones. [Chorus]. The bars at night with the rah rah rah. And Katie's kicking in the corner. She swings her hips to the oh na na. Like I think we're getting warmer. Oh, we're getting warmer now. Uh, yeah, yeh. You and me we think differently. We're still deciding. Baby, I don't know. Come on tell me nothing can destroy this. I am living for your happiness alone. [Chorus]. The bars at night with the rah rah rah. And Katie's kicking in the corner. She swings her hips to the oh na na. Like I think we're getting warmer. Oh, we're getting warmer now. Uh, yeah, yeh. Uh, yeah, yeh, yeh, yeh, yeh. Uh, yeah, yeh. [Chorus]. The bars at night with the rah rah rah. And Katie's kicking in the corner. She swings her hips to the oh na na. Like I think we're getting warmer. The bars at night with the rah rah rah. And Katie's kicking in the corner"
l.a. hallucinations,"I remember being naked. We were young freaks just fresh to L. A. Never cared about the fake kids. We would write and sing and wear whatever. But money makes your whole world spin. Til everything is dizzy and suddenly. Planes I'm hopping. Cards I'm dropping. No shop can fill me up. There's a little black hole in my golden cup so. You pour and I'll say stop. Planes I'm hopping. Cards I'm dropping. No shop can fill me up. There's a little black hole in my golden cup. So you pour and I'll say stop. Take me into your arms again. Shake me from L. A. hallucinations. Haven't seen the boy in ages. Used to stay up all night he and I. Filling up each of these pages. But the teeth come out when the camera flashes. We said we'd always be the same. But we lost each other in the game cause suddenly. Planes I'm hopping. Cards I'm dropping. No shop can fill me up. There's a little black hole in my golden cup so. You pour and I'll say stop. Planes I'm hopping. Cards I'm dropping. No shop can fill me up. There's a little black hole in my golden cup. So you pour and I'll say stop. Take me into your arms again. And shake me from L. A. hallucinations. Buzzfeed buzzards and Tmz crows. What can I say that you don't already know?. Buzzfeed buzzards and Tmz crows. If I just lie here then will you let me go?. Planes I'm hopping. Cards I'm dropping. No shop can fill me up. There's a little black hole in my golden cup so. You pour and I'll say stop. Planes I'm hopping. Cards I'm dropping. No shop can fill me up. There's a little black hole in my golden cup. So you pour and I'll say stop. Take me into your arms again. And shake me from L. A. hallucinations. Take me into your arms again. (Buzzfeed buzzards and Tmz crows. What can I say that you don't already know?). And shake me from L. A. hallucinations. (Buzzfeed buzzards and Tmz crows. If I just lie here, will you let me go?). Take me into your arms again. (Buzzfeed buzzards and Tmz crows. What can I say that you don't already know?). And shake me from L. A. hallucinations"
last christmas,"(I gave you my heart). (Merry christmas). Once bitten and twice shy. I keep my distance. But you still catch my eye. Tell me baby. Do you recognize me?. It's been a year. You know it doesn't surprise me. (Merry christmas). I wrapped it up and sent it. (Merry christmas). I loved you and I meant it. Now I know what a fool I've been. But if you kissed me now. I know you'd fool me again. Last Christmas. I gave you my heart. But the very next day you gave it away. This year. To save me from tears. I'll give it to someone special. Last Christmas. I gave you my heart. But the very next day you gave it away. This year. To save me from tears. I'll give it to someone special. A crowded room. Friends with tired eyes. I'm hiding from you. And your soul of ice. My God I thought you were. Someone to rely on. Me?. I guess I was a shoulder to cry on. A face on a lover with a fire in his heart. A man undercover but you tore me apart. (Merry christmas, merry christmas). Now I've found a real love you'll never fool me again. Last Christmas. I gave you my heart. But the very next day you gave it away. This year. To save me from tears. I'll give it to someone special. Last Christmas. I gave you my heart. But the very next day you gave it away. This year. To save me from tears. I'll give it to someone special"
let's get lost,I was never one to want to. Put my trust in someone else completely. And I was always one to want to up and run. When someone said they needed me. But you. You could be the one. You could be the one. Baby let's go get lost. I like the way you're drivin' slow. Keeping my fingers crossed. That maybe you'll take the long way home. Let's get lost. I don't wanna let you go. Keeping my fingers crossed. That maybe you'll take the long way home. Baby let's take the long way home. I was always shy and careful. I was sure that you would never look at me. Never wanted to discourage. Everything your eyes encouraged silently. But you. You could be the one. You could be the one. Baby let's go get lost. I like the way you're drivin' slow. Keeping my fingers crossed. That maybe you'll take the long way home. Let's get lost. I don't wanna let you go. Keeping my fingers crossed. That maybe you'll take the long way home. Baby let's take the long way home. Baby let's take the long way home. Let's get lost (let's get lost). You wanna get lost? (you wanna get lost?). Let's get lost (let's get lost). I wanna get lost. Oh Baby let's go get lost. I like the way you're drivin' slow. Keeping my fingers crossed. That maybe you'll take the long way home. Let's get lost. I don't wanna let you go. Keeping my fingers crossed. That maybe you'll take the long way home. Baby let's take the long way home. Baby let's take the long way home
love again,"Open up your heart to the ceiling. Don't you know it hurts for a reason. Time will take you back to believing. You'll learn to love again. You'll learn to love again. Stars, won't you shine on me. Won't you dance with me. Me and my baby. Life, is enough to cry. It's a lot to give and it's driving me crazy. I never meant to fight with you. I wanted us to stay together. And even now my love is true. I know that we can't be together. Open up your heart to the ceiling. Don't you know it hurts for a reason. Time will take you back to believing. You'll learn to love again. You'll learn to love again. Somewhere out there someone is breathing. Just for you their heart keeps on beating. Time will take you back to believing. You'll learn to love again. You'll learn to love again. Moon, where's the man in you. Show the way to us. The sky is turning black now. Moon, what you trying to do. It's too late for us and there's no turning back now. I never meant to fight with you. I wanted us to stay together. And even now our love is true. I know that we can't be together. Open up your heart to the ceiling. Don't you know it hurts for a reason. Time will take you back to believing. You'll learn to love again. You'll learn to love again. Somewhere out there someone is breathing. Just for you their heart keeps on beating. Time will take you back to believing. You'll learn to love again. You'll learn to love again. You'll learn to love again. You'll learn to love again. Open up your heart to the ceiling. Don't you know it hurts for a reason. Time will take you back to believing. You'll learn to love again. You'll learn to love again. Somewhere out there someone is breathing. Just for you their heart keeps on beating. Time will take you back to believing. You'll learn to love again. You'll learn to love again. You'll learn to love again. You'll learn to love again"
making the most of the night,"You and me, we've been hanging around. For the longest time. I know when you're done. Know what you need to get you high. Top down, like the wind through your hair. on a summer's night. Outside, all of your fears, leave them behind. Baby I'm speeding and red lights are run. What I got you need it, and I'll run to your side. When your heart is bleeding, I'm coming to get you. I know you've had a rough time. Here I've come to hijack you (hijack you) , I love you. I'm making the most of the night. I know you've had a rough time. Here I've come to hijack you (hijack you) , I love you. I'm making the most of the night. I know you've had a rough time. Here I've come to hijack you (hijack you) , I love you. I'm making the most of the night. Eyes wide, like you've never seen the ocean. never seen the tides. No hope, now you're seeing things that you'd lost sight of. Taking off, got your hands in the air. and you're feeling alright. Gold mines, glistening on my skin for you. Baby I'm speeding and red lights are run. What I got you need it, and I'll run to your side. When your heart is bleeding, I'm coming to get you. I know you've had a rough time. Here I've come to hijack you (hijack you) , I love you. I'm making the most of the night. I know you've had a rough time. Here I've come to hijack you (hijack you) , I love you. I'm making the most of the night. I know you've had a rough time. Here I've come to hijack you (hijack you) , I love you. I'm making the most of the night. Baby take my hand now, don't you cry. I won't let you sleep, I won't let you hide. No more tears, don't waste another day. Go on and fight, don't lay down to die. Come on get up, you'll make it through okay. Come on get up, don't waste another day. I know you've had a rough time. But here I've come to hijack you (hijack you) , I love you. I'm making the most of the night. I know you've had a rough time. Here I've come to hijack you (hijack you) , I love you. I'm making the most of the night. I know you've had a rough time. Here I've come to hijack you (hijack you) , I love you. I'm making the most of the night"
medley (call me maybe / this kiss),"I threw a wish in the well,. Don't ask me, I'll never tell. I looked to you as it fell,. And now you're in my way. I trade my soul for a wish,. Pennies and dimes for a kiss. I wasn't looking for this,. But now you're in my way. Your stare was holdin',. Ripped jeans, skin was showin'. Hot night, wind was blowin'. Where you think you're going, baby?. Hey, I just met you,. And this is crazy,. But here's my number,. So call me, maybe?. It's hard to look right,. At you baaaabeh,. But here's my number,. So call me, maybe?. Hey, I just met you,. And this is crazy,. But here's my number,. So call me, maybe?. And all the other boys,. Try to chase me,. But here's my number,. So call me, maybe?. Before you came into my life. I missed you so bad. I missed you so bad. I missed you so, so bad. Before you came into my life. I missed you so bad. And you should know that. I missed you so, so bad. It's hard to look right,. At you baaaabeh,. But here's my number,. So call me, maybe?. Hey, I just met you,. And this is crazy,. But here's my number,. So call me, maybe?. And all the other boys,. Try to chaaase me,. But here's my number,. So call me, maybe?. Before you came into my life. I missed you so bad. I missed you so bad. I missed you so so bad. Before you came into my life. I missed you so bad. And you should know that. So call me, maybe?. I went out last night. I'm going out tonight again. Anything to capture your attention (your attention). And she's a real sweet girl. And you know I got a boy. Somewhere, so can you feel the tension?. (feel the tension). And you. I always know where you are. And you always know where I am. We're taking it way too far. But I don't want it to end. This kiss is something I can't resist. Your lips are undeniable. This kiss is something I can't risk. Your heart is unreliable. Something so sentimental. You make so detrimental. And I wish it didn't feel like this. Cause I don't wanna miss this kiss. I don't wanna miss this kiss. You know you're just my type. And your eyes are lock and key. To my heart, tempting my confession. (my confession). And you're a real hot thing. But you know I've got a boy. Somewhere, so can you feel the tension?. (feel the tension). And you. I'm dancin' to where you are. And you're dancin' to where I am. We're takin' it way too far. But I don't want it to end. This kiss is something I can't resist. Your lips are undeniable. This kiss is something I can't risk. Your heart is unreliable. Something so sentimental. You make so detrimental. And I wish it didn't feel like this. Cause I don't wanna miss this kiss. But if you ask me to. I couldn't, I couldn't, I. You're leaning closer and. I shouldn't, I shouldn't, I. But if you ask me to. I couldn't, I couldn't, I. I shouldn't, I shouldn't, I shouldn't. I don't wanna miss this kiss. This kiss is something I can't resist. Your lips are undeniable. This kiss is something I can't risk. Your heart is unreliable. Something so sentimental. You make so detrimental. And I wish it didn't feel like this. Cause I don't wanna miss this kiss. I wish it didn't feel like this. I don't wanna miss this kiss"
melt with you,"If I could melt with you, I would. And find our way back to good. Tell the world to wait outside, just you and I. If I could hold on to your edge, and fall to your deepest dent. We would come true, if I could melt with you. (if I could melt with you). I've been thinking about it, I know something's wrong. Fading out in the distance, we've been in the songs. Best turn the clocks to somewhere. we won't ever stop, don't ever leave. If I could melt with you, I would. And find our way back to good. Tell the world to wait outside, just you and I. And if I could hold on to your edge, and fall to your deepest dent. We would come true, if I could melt with you. (if I could melt with you). Hearing echoes and voices, all I couldn't see. We have all kinds of choices. If it was u? to me, I'd turn the clocks to somewhere. we won't ever stop, don't ever leave. If I could melt with you, I would. And find our way back to good. Tell the world to wait outside, just you and I. If I could hold on to your edge, and fall to your deepest dent. We would come trough, if I could melt with you. And every time that passes by, I see you, I see you. Ever now and then, I like to pretend. If I could melt with you, I would. And find our way back to good. Tell the world to wait outside,. If I could hold on to your edge, and fall to your deepest dent. We would come true, if I could melt with you. If I melt with you. If we could come true. If I melt with you. If we could come true. If I melt with you."
mittens,"Home tonight,. Rest my head,. In my single childhood bed. Close my eyes,. Count to three,. Wish that you were here with me. Last year when my hands were cold,. You were always there to hold. So give me your warmest pair,. Your strongest pair of mittens,. Please. Something to get me through,. The loneliness of Christmas eve,. I fell for you, like crazy,. And I can't get thoughts of you, from me. So give me your warmest pair,. Your strongest pair of mittens,. Please. By my table I survive,. Fix the makeup from my eyes,. Fake a smile so they will see,. Wish that you were here with me. Last year when my hands were cold,. You were always there to hold. So give me your warmest pair,. Your strongest pair of mittens,. Please. Something to get me through,. The loneliness of Winter,. See, I fell for you, like crazy,. And I can't get thoughts of you, from me. So give me your warmest pair,. Your strongest pair of mittens,. Please. Shine your name,. Through the snow storm, baby,. You can break me,. To the bone, oh. I was wrong,. You were wrong to make me,. Feel like I was all alone,. Walking through my old home town,. No one else but me around,. Make an angel in the snow,. Pray that I can let you go. I fell for you, like crazy,. And I can't get thoughts of you, from me. So give me your warmest pair,. Your strongest pair,. Your warmest pair,. See, I fell for you like crazy. And and I can't get thoughts of you, from me. So give me your warmest pair,. Your strongest pair of mittens,. Please."
money and the ego,"Make my house of bricks. And I'll stick here when the world. Comes crashing down around me. Make your arms a willow tree. And you can bend with me. Any where that I am going. Sometimes its hard to see. Anything lovely. All the people around me going for. Money and the money and the egos. How can you ask me why. I need to know before I try. I've got to be sure there's more than. Money and the money and the ego. Keep your eyes on me. And I'll look to you so I can see. What I am here for. Pull the wool over my eyes. Please kiss this day goodbye. Only you can get me going. Sometimes its hard to see. Anything lovely. All the people around me going for. Money and the money and the egos. How can you ask me why. I need to know before I try. I've got to be sure there's more than. Money and the money and the ego. Giving up is all you've got. And giving up all you want. You hear yourself say you've lost the will, the power. Giving up is all you've got. And giving up is all you want. But don't be afraid to sit down in your shower. Stay in there for hours. Make my house of bricks. And I'll stick here when the world. Comes crashing down around me. Sometimes its hard to see. Anything lovely. All the people around me going for. Money and the money and the egos. How can you ask me why. I need to know before I try. I've got to be sure there's more than. Money and the money and the ego. (Got to be sure there's more). Money and the money and the ego. (Got to be sure there's more). Money and the money and the egos"
more than a memory,"Speak to me. You're walking closer and it's hard to breathe. I should be running but the heart's naive. And I expect too much. You were good to me. I left a scar that no one else can see. And now you're back here and reminding me. That I lost way too much. Do you know that night I almost said I loved you?. And you almost said it back. Are we gonna be more than a memory?. No matter how lame my apology. I let go of you,. You let go of me. Are we gonna be more than a memory?. Are you gonna just stand in front of me. Pretending I'm not your destiny. I'm not over you, are you over me?. Are we gonna be more than a memory?. I'm not over you, are you over me?. Are we gonna be more than a memory?. Say my name. Cause no one else can say it quite the same. It takes me back to your September days. I've missed you way too much. If I was good to you. But just to hear it breaks my heart in two. If there's a way to make it up to you. I'd wanna change so much you know I do. Do you know that night I almost said I loved you?. And you almost said it back. Are we gonna be more than a memory?. No matter how lame my apology. I let go of you,. You let go of me. Are we gonna be more than a memory?. Are you gonna just stand in front of me. Pretending I'm not your destiny. I'm not over you, are you over me?. Are we gonna be more than a memory?. Stay with me. I really need to hear you breathe. If words can't speak. Lay your body next to me. Are we gonna be more than a memory?. No matter how lame my apology. I let go of you,. You let go of me. Are we gonna be more than a memory?. Are you gonna just stand in front of me. Pretending I'm not your destiny. I'm not over you, are you over me?. Are we gonna be more than a memory?. More than a memory. Lame my apology. I'm not over you, are you over me?. Are we gonna be more than a memory?"
