all my love,"(Hook). Say you want my love. You can have it all. Seems like you're just my type, after all. I know you want a bad girl. Give him all of that. Take this all, won't give it back. I know you want all my love. I give you all of that. All of that, all of that, all of that. (Verse). You came whole way like 18 willer. Take on eat gonna get your fill up. I can't help she's out, cause you're not with her. You look around but ain't nothing realer, no. I ain't here to stop it, so baby boy, don't stop it. I like it my way, and my hips are just right here. (Pre-Hook). If you never had it boy. You don't know, you don't know, yeah. If you never had it boy. You don't know, you don't know, yeah. (Hook). Say you want my love. You can have it all. Seems like you're just my type, after all. I know you want a bad girl. Give him all of that. Take this all, won't give it back. I know you want all my love. I give you all of that. All of that, all of that, all of that"
bad bitches (feat. ester dean),"(Hook). A bad bitch like dope, she gets all the dough. A bad bitch like coke, she gets all the notes. A bad bitch low key, she hits all the notes. She have you singing in a key that you never heard before. Cause the bad bitch get it, make a nigger spend it. That's the only way he hit it, this ain't love, this is business. I ain't try to be your Mrs, I ain't looking for no love. Want that 50s, 10s and 20s? Yep, all of the above. My mama told me “make that nigger spending”. That's the only way you get it, these 50s, 10s and 20s. Bad bitches to the floor, bad bitches to the floor. Bad bitches to the floor, bad bitches to the floor. Bad bitches to the floor, bad bitches to the floor. Bad bitches to the floor, bad bitches to the floor. Where the bad bitches at, where the bad girls go?. Where the bad bitches at, where the bad girls go?. Bad bitches to the floor, bad bitches to the floor. Bad bitches to the floor, bad bitches to the floor. Bad bitches to the floor, bad bitches to the floor. Bad bitches to the floor, bad bitches to the floor. (Verse). Bad bitch like me will have a nigger dreaming. Bad bitch like me will have a nigger hoping. And wishing that he come back for more. Fuck him like she did before. And leave him with a twenty on the side. Yeah, she's super cold. (Hook). Cause the bad bitch get it, make a nigger spend it. That's the only way he hit it, this ain't love, this is business. I ain't try to be your Mrs, I ain't looking for no love. Want that 50s, 10s and 20s? Yep, all of the above. My mama told me “make that nigger spending”. That's the only way you get it, these 50s, 10s and 20s. Bad bitches to the floor, bad bitches to the floor. Bad bitches to the floor, bad bitches to the floor. Bad bitches to the floor, bad bitches to the floor. Bad bitches to the floor, bad bitches to the floor. Where the bad bitches at, where the bad girls go?. Where the bad bitches at, where the bad girls go?. Bad bitches to the floor, bad bitches to the floor. Bad bitches to the floor, bad bitches to the floor. Bad bitches to the floor, bad bitches to the floor. Bad bitches to the floor, bad bitches to the floor. Where the bad bitches at, where the bad girls go?. Where the bad bitches at, where the bad girls go"
balcony (feat. fabolous),"I don't wanna scream, I don't even wanna tell you. How good it is,. Because if it's a dream. I'd only wake myself up. And baby I don't wanna ruin this. Honestly, I was scared cause. I know you, were prepared. And you know what I was thinking. All my thoughts, all my cares. The same love on the balcony. Right there in new york city. I saw a tourist staring back at me. In times square in new york city. It's the world baby. She sassy, she classy, hair like she cassie. Say why your voices so raspy. Uh, I hope she nasty. Last night, good kush and Ciroc with a super freak. Told him put it on my black card,. Get it super sweet. We can do it right now girl, I don't give a fuck. Right here in the valley, we can do it in the truck. Got her legs on the dashboard, yeah I got a boulder. Don't know if the kush heat with the. Go, but I'll be back though. Had a couple drinks, later air it was perfect. The enjoying the scene, now breathe. We couldn't help it. All things have their purpose. The wind it blew, through my hair love. I stunned by your stare. From the sight of you, standing there love. I could walk, walk on air. Then we made love on balcony. Right there in new york city. I saw a tourist staring back at me. In times square in new york city. And in that moment the city was mine. I told her look, baby talk to me, you know I'ma talk. You know that tic talk... yeah you gonna get the.... Look I got you soaking wet. Yeah you my needle white, swish. Turn it right,. Tear you like I'm kevin hard, you gonn learn tonight. I ain't no funny nigga nah I ain't got jokes. Wake up in the morning tell your girls that you got choked. Bust it wide open, turn it up, blew it back. Turn that presidential suite, swerving deep, like a crack house. We're at the rich... and I got her on the balcony. One stop shop ain't nobody coming after me. Then we made love on balcony. Right there in new york city. I saw a tourist staring back at me. In times square in new york city. And in that moment the city was ours. Turn the lights on"
breathe again,"[Verse 1]. I looked in your eyes. And for the very first time I. Watched the sunrise in. Colours I've never seen before. It's like the sky was. A brighter shade of blue. I feel like I've been sleeping all this time. And now I'm awake. [Pre-Chorus]. All this times I've been missing. Doesn't matter now I'm living. Almost lost my faith in love. But since you came, in love I trust. [Chorus]. I can love again. I can breathe again. I can feel again. And it's cause of you I can. I can love again. I can breathe again. I can feel again. And it's cause of you I can. I can love again. I can breathe again. I can feel again. And it's cause of you I can. Cause of you I can. I can breathe again. I can breathe again. [Verse 2]. All my life I've wanted to be loved and. Kept in accepted with you there is no judgement. Sure love I thought that kiss me. That second last forever. Maybe I've been sleeping all this time. And now I'm awake. [Pre-Chorus]. All this times I've been missing. Doesn't matter now I'm living. Almost lost my faith in love. But since you came, in love I trust. [Chorus]. I can love again. I can breathe again. I can feel again. And it's cause of you I can. I can love again. I can breathe again. I can feel again. And it's cause of you I can. I can love again. I can breathe again. I can feel again. And it's cause of you I can. Cause of you I can. I can love again. I can breathe again. I can feel again. And it's cause of you I can. I can love again. I can breathe again. I can feel again. And it's cause of you I can. I can love again. I can breathe again. I can feel again. And it's cause of you I can. Cause of you I can"
call u out,"[Verse 1:]. Did you really think that you would keep a secret from me? When I know you like the back of my hand come on now. I can tell when you on the low tryna hide something. Tryna hide something.You cant hide nothing.. Ive been watching you for a minute I already know. What you doing you cant hide it from me come on now. I can tell when you on the low tryna hide something. Tryna hide something.You cant hide nothing.. [Chorus: x4]. Imma call you out. Imma call you out (Oh). [Verse 2:]. Im the illest chick you ever met you know thats a fact. I cut you off in a minute boy if you make me. You will never catch me asleep im awake baby. Im awake baby. You cant front on me.. You can save all your tired lies for someone that cares. Obviously you know I have no time to waste now.You will never catch me asleep im awake homie. Im awake homie. You cant front on me.. [Chorus: x4]. Imma call you out. Imma call you out (Oh). [Young Joc:]. Ok.Ok. Now what the business is? Whats that problem shorty? Tell me why acting like you cant pick up and call me? Like I did you wrong. Aint did ish. You my main thing. Forget them other fish. Baby I cant change. Cause im just me. Im committed plus them suckas quit it like next week. Its been me and you girl, for a long time. Whats all this call you out shit? Thats the wrong line.. [Chorus: x4]. Imma call you out. Imma call you out (Oh)"
can you feel me,"I know you sensin me missin you. Must be feeling a vibe. My heart is on fire, about to explode. Theres too much space between me and you. Gets hard over time, its a crime. I'm hoping my love overflows. And finds its way for me. Into your arms, where I belong. Come to me. I'm sending love at lightning speed. I've been in need since you've been gone. Heres my love, reaching you like I wanted. Call my name and I'll come running. Lovesick, boy I need you to heal me. Can you feel me?. Can you feel me?. Can you feel me?. Ca-ca-ca Can you feel me?. Ca-ca-ca Can you feel me? (me, me, me, me, me). Can you feel me?. Ca-ca-ca Can you feel me?. Ca-ca-ca Can you feel me? (me, me, me, me, me). Impulse is urging you to get closer to me. You're wondering why its so intense in your mind. Don't go against what you know. I'm where you wanna be. I'm hoping my love will fly. And find its way for me. Into your arms, where I belong. Come to me. I'm sending love at lightning speed. I've been in need since you've been gone. Heres my love, reaching you like I wanted. Call my name and I'll come running. Lovesick, boy I need you to heal me. Can you feel me?. Can you feel me?. Heres my love, reaching you like I wanted. Call my name and I'll come running. Lovesick, boy I need you to heal me. Can you feel me?. Can you feel me?. Feel me. Ca-ca-ca Can you feel me?. Ca-ca-ca Can you feel me? (me, me, me, me, me). Can you feel me?. Ca-ca-ca Can you feel me?. Ca-ca-ca Can you feel me? (me, me, me, me, me). I'm touching you, though you don't feel my hands on your skin. I'm loving you from a distance until there no end. You feel the vibration I make through the sound waves. Your love is my lifeline, I need to be saved. Feel me. Ca-ca-ca Can you feel me?. Ca-ca-ca Can you feel me? (me, me, me, me, me). Can you feel me?. Ca-ca-ca Can you feel me?. Ca-ca-ca Can you feel me? (me, me, me, me, me)"
can't do it without you,"Chorus. I can’t believe how you got me. and you love me this way (this way). I can’t do it without you babe (do it without you babe). Don’t ever leave, cause its so sweet,. how you love me this way (this way). I can’t do it without you babe (do it without you babe). It’s the special way we touch. How you cater to my needs (my needs). And the way you show you care for me (show you care for me). It’s the look in your eyes. When you tell me that you’re mine. And the way you’re always there for me (for me). It’s no wonder why I feel this way. Bridge. Thought about this love of ours. How intense it really is. And I figured it out,. I’ll never find better love than the love you give. Bet ya, can’t think without you. Not a doubt, that you’re the one I need. Look How Far we’ve come, since day one. This is how it’s supposed to be. Chorus. It’s the burning deep inside. It’s too hard to be denied. It’s the feeling when you’re right there to hold me (right there to hold me). And incase you ever have a doubt. I want to let you know this right now. I’m Yours, you give me all the reason I need. Bridge. Chorus. Don’t know what I’d do if. I didn’t have you with me. Don’t think I could make it. Through a single day without you (2x). Chorus"
ditto,"Cassie - Ditto. He said he had fallen so in love with me. and I said ditto, ditto, ditto. He told me I'm the only one that he could see. and I said ditto, ditto, ditto. It's been a while my baby. I told you we could love in spite of all the things that they see. I said I woudn't want no one if all you wanted was me. i knew right then you were the only one you're all that I need oooh. (knew that you were all that I need). (yeah). Baby now I gotta be (oh). part of you, you're part of me. All my heart, everything all this time you've been waiting. He said he had fallen so in love with me. and I said ditto, (ditto) ditto, (ditto) ditto (and he said). He told me I'm the only one that he could see. and I said ditto, ditto, ditto. I've looked far to find somebody that was there for me. Plus hes part of me nobody else could ever see (and I said). Aw baby, I need your loving. All I wanted was you (you're all that I wanted). (yeah). Baby now i gotta be (yeah). part of you, you're part of me. All my heart, everything all this time you've been waiting. I've thought about it oh so long (yeah). how much I want you more and more. I said baby if you want it from me,. boy you know that I will agree and that's when. He said he had fallen (he said) so in love with me. And I said ditto, (yeah) ditto, ditto (and that's when he told me yeah). He told me I'm the (that I'm the only one) only one that he could see (oh that's when I had to tell him). And I said ditto, ditto, ditto. And it's so funny how real love can be simple babe. when you find someone to share it with that feels the same. I can see it in your eyes the words you mean to say. and baby you can rest assure that I, that I feel the same way. He said he had fallen so in love with me. and I said ditto, ditto, ditto. He told me I'm the only one that he could see. and I said ditto, ditto, ditto. He said he had fallen so in love with me. and I said ditto, ditto, ditto. He told me I'm the only one that he could see. and I said ditto, ditto, ditto. By Du dudu & Edu"
do my dance (feat. too short),"(Intro). Fuck it right, boy. You know I like it when you. Fuck it, fuck it right, boy. (Hook). Do my dance on your dick. Uh, you know you love this shit. Do my dance on your dick. Uh, you know you love this shit. Do my dance on your dick. Uh, you know you love this shit. Do my dance on your dick. Uh, you know you love this shit. Imma do my dance on your chick. Uh, you know she love the dick. Do my dance on your chick. Uh, you know she love the dick. Do my dance on your chick. Uh, you know she love the dick. Do my dance on your chick. Uh, you know she love the dick. (Verse). Dance, dance, dance, on it. No worries when the lights off. Cause you know I know, oh, yeah. If you get on top, put the pillow tuck on my own, yeah. Get this girl with the window talk, yeah, I'm on it. Cause I whips whips right here. Whips whips right here. Get in shape when you got it. It's time and time off when I'm in here. Uh-uh, bring them lights off. Spark close right there. Riding around with a bad bitch. Not just right here. (Pre-Hook). No way, don't know what you've done to me. I'll be talking today, I'll be talking tonight. How much time is gonna take. Boy, it's time to take flight. (Verse). Hey, I'm back to pay-pay. Nobody gonna make the heat. In need of one to make it, make it hot. So many dollars on me. That railway, that blue dot, yeah, we drank ‘em all, all day. (Hook). Do my dance on your dick. Uh, you know you love this shit. Do my dance on your dick. Uh, you know you love this shit. Imma do my dance on your chick. Uh, you know she love the dick. Do my dance on your chick. Uh, you know she love the dick. (Verse). I pull her dress up on her waist, cause it's hot. Now it looks like we're fucking, but we're not. She just bouncing on my dick like a trampoline. Got her hands in the air like a champion. If I let her keep going she ain't never gonna stop. I don't wanna dance, I wanna make that pussy pop. Turn your bitch into some working, make her squirt. If you knew what she was doing you'd be hurt. This only one night I wanna spend with you, girl. So if I fuck her it's not the end of the world. She's wetter than the motherfucker Mississippi river. You can't forgive her? That bitch. (Hook). Do my dance on your dick. Uh, you know you love this shit. Do my dance on your dick. Uh, you know you love this shit. Imma do my dance on your chick. Uh, you know she love the dick. Do my dance on your chick. Uh, you know she love the dick"
don't go too slow,"Don't, don't go too slow. I like it when you go real hard. Don't go too slow. Hoo Whoa. I've waited for this since I saw you. Now it's finally that time. To explore the way I really feel about you. You got me weak in my knees, hoo whoa. Even like I can't believe, ha ah. So if you want it come get it from me don't waste my time. Listen when my body talks. Ooh boy I'm waitin' on you to put your lovin' on me. So hurry while the night's still young. And I promise that you will be, satisfied (satisfied). Don't, don't go too slow. I like it when you go real hard. Don't go too slow [x2]. Hoo Whoa. Can't you give me somethin' better?. Somethin' that I ain't seen yet?. Somethin' that can take my breath a, take my breath a, take my breath away. Hoo Whoa. What can keep me goin' babe. Ha ah. Cause if you can't I know somebody who can do it my way (my way). Who can listen to what my body says. Ooh boy I'm waitin for you to put your lovin' on me. On me so hurry while the night is still young. And I promise that you will be, promise you'll be satisfied (satisfied). So don't. Don't, don't go too slow. I like it when you go real hard. Don't go too slow [x2]. I'm warning you, don't go so slow. I'm warning you. I'm warning you, don't go so slow. I'm warning you. Don't, don't go too slow. I like it when you go real hard. Don't go too slow [x2]. I'm warning you, don't go so slow. I'm warning you. I'm warning you, don't go so slow. I'm warning you"
don't play it safe,"Hard to tell if you wanna stay. Don't need an invitation. For moves I want you to make. Coy but, boy, be sure, don't you wait. Swear I want you the same way. Boy, I'll give you the ring. Don't wanna wait for, wait for. All these rules and confirmations. If you want it, gotta take it. If we change the pace up. There's no room for complications. If you want it, gotta take it, yeah. Don't wait, baby. Don't play it safe. Go take the reins. Show me some things, yeah. Don't wait, baby. Don't play it safe. Go take the reins. Show me some things. And they say time is the. Time is the enemy. Why waste it now?. I've been ready. Hope we can move onto better things. Knowing that you can change it. Boy, I'll give you the reins. Don't wanna wait for, wait for. All these rules and confirmations. If you want it, gotta take it. If we change the pace up. There's no room for complications. If you want it, gotta take it, yeah. Don't wait, baby. Don't play it safe. Go take the reins. Show me some things, yeah. Don't wait, baby. Don't play it safe. Go take the reins. Show me some things. Don't wait, baby. Don't play it safe. Go take the reins. Show me some things, yeah. Don't wait, baby. Don't play it safe. Go take the reins. Show me some things"
end of the line,"Everytime you hear my music.... We're in a race and I'll finish mine. We just crossed the. Finish line. Had enough time to fix it. But it's over. Boy you overdid it. Way too much, too much, too much. Baby I was for you. And making this work. Now we're all broken up. End of the line. Baby are we supposed to be at the. End of the line. I see you and me at the. End of the line. End of the line. E-e-e-end of the line. We're over and done. But you're still telling me that you can't do right. I know we're meant to move on. So I'll just keep on running. It don't matter, it don't matter if you're coming back. It don't matter, it don't matter if you're coming back. You shouldn't waste your time. End of the line.... Finish line. We just crossed it. We just crossed the. Finish line. And boy you know. We can't pretend it's not over. Because. Boy you overdid it (this time). Way too much, too much, too much. Baby I was for you. And making this work. Now we're all broken up. End of the line. Baby are we supposed to be. At the end of the line. I see you and me at the. End of the line. End of the line. E-e-e-end of the line. We're over and done. But you're still telling me that you can't do right. I know we're meant to move on. So I'll just keep on running. It don't matter, it don't matter if you're coming back. It don't matter, it don't matter if you're coming back. You shouldn't waste your time. End of the line.... Finish line. Finish line. Over. End of the line. Baby are we supposed to be. At the end of the line. I see you and me at the. End of the line. End of the line. E-e-e-end of the line. We're over and done. But you're still telling me that you can't do right. I know we're meant to move on. So I'll just keep on running. It don't matter, it don't matter if you're coming back. It don't matter, it don't matter if you're coming back. You shouldn't waste your time. End of the line..."
gimme that,"Gimme that. Gimme that. Gimme that. Gimme that. If you wanna be my lover. Come give it to em straight baby. I don't wanna wait. We don't gotta tease each other. Ain't no need to play it safe. You know what I'm trying to say!. Why don't you undress me with your eyes, eyes?. Boy I'm down for anything tonight. Boy I'm down for anything tonight. Oh come on, it's you all over me. You might as well give it up coz you belong to me. You might as well give it up coz you belong to me. Chorus. Gimme that,. I know you got it even with your hands behind your back. Every time I feel it, I just don't know how to act. Get you tell the way I move it, I can handle that. Gimme that x6. Every time I feel it, I just don't know how to act. Get you tell the way I move it, I can handle that. Why don't you undress me with your eyes, eyes?. Boy I'm down for anything tonight x2. Oh come on, it's you all over me. You might as well give it up coz you belong to me x2. Chorus. Gimme that,. I know you got it even with your hands behind your back. Everytime I feel it, I just don't know how to act. Get you tell the way I move it, I can handle that. Gimme that x6. Every time I feel it, I just don't know how to act. Get you tell the way I move it, I can handle that. Chorus. Gimme that,. I know you got it even with your hands behind your back. Everytime I feel it, I just don't know how to act. Get you tell the way I move it, I can handle that. Gimme that x6. Every time I feel it, I just don't know how to act. Get you tell the way I move it, I can handle that"
hard,"HARD. . In the beginning. I had no doubts in my mind. We had our differences. But I thought it would be fine (so). Infactuated I was blinded by your kisses. You see me changing. Boy you had my mind twisted. [BRIDGE]. What if you know my every move. Couldn't be cool with any dudes. So I changed it all for you. But boy it's getting to hard. Cuz before this wasn't me. And how I thought a love would be. Boy I wanna be with you. But it's just too hard. [CHORUS]. We shouldn't have to try. It should just fall into place boy. Too hard, too hard. We shouldn't have to force love. Why can't we just fall. Too hard, too hard. Yeah I wanna be with you. But I don't wanna work (and). If it's not easy. Then maybe it's not worth it. No, it's too crazy (oh boy). It's too crazy. My heart is not in it no more. Too hard, too hard. Just being honest baby. You know I wanna love ya. But it's a constance battle. Every time I'm with ya. I gotta change this. I gotta change that. How ya gonna know me. If I can't be myself. [BRIDGE]. What if you know my every move. Couldn't be cool with any dudes. So I changed it all for you. Boy it's getting to hard. Cuz before this wasn't me. And how I thought a love would be. I wanna be with you. But it's just too hard. [CHORUS]. We shouldn't have to try. It should just fall into place boy. Too hard, too hard. We shouldn't have to force love. Why can't we just fall. Too hard, too hard. Yeah I wanna be with you. But I don't wanna work (and). If it's not easy. Then maybe it's not worth it. No, it's too crazy (oh boy). It's too crazy. My heart is not in it no more. Too hard, too hard. Ha, ha, ha, ha, hard.... To hard, to hard. Ha, ha, ha, ha, hard.... Oooh.... Don't wanna go. But I can't stay. Cuz I don't wanna stress anymore. Don't wanna change who i am. You can't love me for me. Then tell me why should we be. Too hard.... Oh too hard. Yay yay yay.... [CHORUS]. We shouldn't have to try. It should all just fall into place boy. Too hard, too hard. We shouldn't have to force love. Why can't we just fall. Too hard, too hard. Yeah I wanna be with you. But I don't wanna work (and). If it's not easy. Then maybe it's not worth it. No, it's too crazy (oh boy). It's too crazy. My heart is not in it no more. Too hard, too hard. Ha, ha, ha, ha, hard.... Too hard, too hard. Ha, ha, ha, ha, hard.... Oooh.... . by paulo.conde"
