hd,"This allow me even lying I ain't tryin to keep up. I got lowness all the talking now I'm bouncing pieces up. I just chance you got loss it you a flossin in the truck. Like it was yours all them horse like it is so so hard hard up. Now that you go you just have to see. Everything it was the one to me. How long would you think would be before. I saw in ace t. Oh I can see the key back. Everything you givin to me. That's mine but you gotta leave. 'cause I see in hd. Hey hey oh oh ohh. Hey hey oh oh ohh. I see in hd. Hd hd see you in high definition. You can't play me. See you in high definition. You can't play me see you in high definition. Aint calling I've been knowin... talk about. And let's talking boy keep... about my house. I can't help it if you can't get anybody is flying. Should have thought of that before. I should drop the door. Now that you go go and set you free. Everything it was the one to me hey. How long you think you'll be in. I saw in hd. Oh oh givin the key back oh oh. Everything you're givin to me. Oh that's mine but you gotta leave. 'cause I see in hd. Hey hey hey oh oh oh. Hey hey oh oh ohh. I see in hd. Hd hd see you in high definition. You can't play me. See you in high definition. So high, so high definition. So high, so high definition. Check it upon me. When I was... thinking upon me. I'm gonna sway acting. It's like a... it's like a. So high, so high definition. So high, so high definition. This allow me even lying I ain't tryin to keep up. I got lowness all the talking now I'm bouncing pieces up. I just chance you got loss it you a flossin in the truck. Like it was yours all them horse like it is so so hard hard up. Now that you go you just have to see. Everything it was the one to me. How long would you think would be before. I saw in ace t. Oh I can see the key back. Everything you givin to me. That's mine but you gotta leave. 'cause I see in hd. Hey hey oh oh ohh. Hey hey oh oh ohh. I see in hd. Hd hd see you in high definition. You can't play me. See you in high definition. . So high, so high definition. So high, so high definition. Check it upon me. When I was... thinking upon me. I'm gonna sway acting. It's like a... like a... yeah"
hope you're behaving (interlude),"Record your message after the tone. [beep]. [Cassie:]. Hey whats up it's me, uhm. I just finished a photo shoot,. I'm getting ready to go record. But uhm, I just wanted to check. on you and see how you were. I'm not home you know.... Hope you're behaving yourself.... Alright, well I miss you. I'll talk to you later"
i know what you want,"(Hook). I know what you want, I know what you want. I know what you want, I know what you want. I know what you want, I know what you want. I know what you want. You want everything, so let's do everything. (Verse). I'm in a two-door, I'm in a new lane. I gotta know my name, I need a new name. I know what you want. (Hook). I know what you want, I know what you want. I know what you want. You want everything, so let's do everything. (Verse). They moving too slow, we are a new play. So high I lift funny, your love is not safe. (Hook). I know what you want, I know what you want. I know what you want. You want everything, so let's do everything. Man down, where you're from, nigger. Fuck who you know, where you're from, my nigger?. Where your grandma stay home my nigger. Best rockabye I've grown my nigger"
i love it (feat. fabolous),"Pretty girls with them rolexes, no time for a hoe flexin. Pokin out of that wife beater, big cuffs she so texas. Big booty, that get attention, like a rap star and a gold necklace. Ass need management, and a bodyguard that wear 4 exes. Bad boy need a bad bitch, casolina need fappin. Me and you make hot shit. You the gasoline, I'm the match stick. Like woof, we will burn this bitch down. She turnt up and can nobody turn this bitch down. You want it, I need it, you got it, I'm fiending. A sauna, I'm hot as a phoenix. You fuck me, fuck me like you mean it. Spank me you know I've been a bad girl. But every bad boy needs a bad girl. I look into the mirror, like attitude, like that girl. Heard she nothing like me, the pearl are on and white teeth. Redbone so fisty. Hope you round wherever I be. I promise if I never did it then it's time to tell you. I love it, I love it, I love it. I love it, I love it, I love it. I love it, I love it, I love it. I love it, I love it, I love it. You say you wanna taste, alright. I'm steering through the stage, am I. Another round the pole and now. Just to make sure that she throw it down, on me. She throw it down, throw it down. …baby, let me break it down. Heard she don't do it like me, the pearl are on and white teeth. Redbone so fisty. Hope you round wherever I be. I promise if I never did it then it's time to tell you. I love it, I love it, I love it. I love it, I love it, I love it. I love it, I love it, I love it. I love it, I love it, I love it. Yeah, drop top with the ab showin. Drop top with the head blowing. Reggie shit start coming on. She stopped, popped and get along. I look back and smile at it. I'm on that like my name tattered. We are, dr, mami thinking my name is daddy. But no way, hose, I feed your a bottle of rose. And spank that for being bad, them words, they tell you don't say. Talking to me in spanish, tell you what my plan is. Bust you one, smoke one, when the smoke clears, I vanish. I love it, I love it, I love it. I love it, I love it, I love it. I love it, I love it, I love it. I love it, I love it, I love it"
i need love,"You just a cold blooded killer. But charming personality. Shining like glitter. But it don't really matter. I know, I know. He's a certified player. I know, I know. Got thirty-one flavors. I need a man. I can have all to myself. I don't want to share him with. Nobody else. So you can keep the cars,. credit cards and the crib. No I don't need your money. You can check out how I live. I need love. My heart needs love. But I can't give you a chance. And it's all because. I don't want to be. Hurt, hurt, hurt, hurt, hurt. I don't want to be. Hurt, hurt, hurt, hurt, hurt. So I don't need. I don't need, I don't need. I don't want to be. Hurt, hurt, hurt, hurt, hurt. I don't want to be. Hurt, hurt, hurt, hurt, hurt. I don't need a sugar daddy. To call me on the telephone. With a chick in the background. Sayin' he ain't coming. I know, I know. What's the use in fighting?. I know, I know. He don't even deny it. What's the point in wasting all of these goods?. I promise there'll come a time. when he wished he would. have stuck around. But he's just a sucker now. You remind me of my. E-e-e-e-ex. I don't need another. E-e-e-e-ex. I'd rather be doing my thing. On my own. With nobody to answer to. Cause I'm grown. I need love. My heart needs love. But I can't give you a chance. And it's all because. I don't want to be. Hurt, hurt, hurt, hurt, hurt. I don't want to be. Hurt, hurt, hurt, hurt, hurt. So I don't need. I don't need, I don't need. I don't want to be. Hurt, hurt, hurt, hurt, hurt. I don't want to be. Hurt, hurt, hurt, hurt, hurt. [K-Young]. I need that real deal. wanna know how it feels. to fall in love. A kind of love that's destined. For me. It's on its way. I won't be worried. So for now I'll just provided. For myself. So forget we ever met. I don't need your help. It's the crazy things you do. The things you do for love. I need love. My heart needs love. But I can't give you a chance. And it's all because. I don't want to be. Hurt, hurt, hurt, hurt, hurt. I don't want to be. Hurt, hurt, hurt, hurt, hurt. So I don't need. I don't need, I don't need. I don't want to be. Hurt, hurt, hurt, hurt, hurt. I don't want to be. Hurt, hurt, hurt, hurt, hurt"
i'm in love with you,"People of the world uh. (huh huh huh huh). Listen up, can you get this track any louder?. (huh huh huh huh). (chorus). I'm in love with you and every little thing you do. I'm in love with you (hey hey hey). I'm in love with you can't take my eyes off you. I'm in love with you. Yeah, I'm in love with you baby. you drive me crazy. I wanna get to know you. Yeah, I can tell that you want me. the way you pushed up on me I know. You want me to move. Closer, get closer. If you wanna go gotta let me know. Closer, get closer. To your luvin, uh I think I'm fallin'. (chorus). Yeah, from the first time I saw ya. said I couldn't ignore ya. I'de like to get to know ya. Yeah, you know it's getting late now. And I should be on my way now I know. You want me to move. Closer, get closer. If you wanna go gotta let me know. Closer, get closer. To your luvin, uh I think I'm fallin'. (chorus). When the feeling gets right into ya. and it's something bout tonight. and we can make it ours yeah. Baby its just an ilusion. It's something that I like. Boy I think I'm fallin'. Could it be?. (chorus) 2 x"
is it you?,"I'm looking for a lover not a friend. Somebody who can be there when I need someone to talk to. I'm looking for someone who won't pretend. Somebody not afraid to say the way they feel about you. And I'm looking for someone who understands how I feel,. Someone who can keep it real and who knows (the way). The way I like to have it my way. And I'm looking for someone who takes me there,. Wants to share, shows he cares. Thinking you're the one that I've been waiting for. Is it you? is it you?. Maybe you're the one I've been waiting for. Could you be the one for me?. Could you be the one I need?. Is it you? is it you?. Maybe you're the one I've been waiting for. Could you be the one for me? (Could you be?). Could you be the one I need?. I'm looking for someone to share my pain (Uh). Someone who I can run to, who would stay with me when it rains. Someone who I can cry with through the night. Someone who I can trust whose heart is right. And I'm looking for someone. And I'm looking for someone who understands how I feel,. Someone who can keep me real and who knows (the way). The way I like to have it my way. And I'm looking for someone who takes me there,. Wants to share, shows he cares. Thinking on the one that I've been waiting for. Is it you? is it you?. Maybe you're the one I've been waiting for. Could you be the one for me?. Could you be the one I need?. Is it you? is it you?. Maybe you're the one I've been waiting for. Could you be the one for me?. Could you be this one I need?. Someone who won't take me for granted. How much I care (How much I care). And appreciates that I'm there. Someone who listens. And someone I can call who isn't afraid of love to share. Is it you? is it you?. Maybe you're the one I've been waiting for. Could you be the one for me?. Could you be the one I need?. Is it you? is it you?. Maybe you're the one I've been waiting for. Could you be the one for me?. Could you be the one I need?"
iv,"Na na-na na-na na-na. Na na-na na-na na-na. Na na-na na-na na-na. Na na-na na-na na-na. Na na-na na-na na-na. Na na-na na-na na-na. Losing my focus... with everything. First was my eye sight. Then my heart and beat. I wish he was perfect. But with him this can't be. Because he is my poison, poison iv. This love is dangerous dangerous. Got my head spinning spinning out of control. Going everywhere everywhere. This love is dangerous dangerous. Now I'm sorry I had to let him go. I admitted I was in love, in love with ya with ya. Never been sicker sicker from the crazy things you do. Oh woh oh, oh woh oh. Love me back, you do this to me - poisoned iv. I was in love, in love with ya. Now I get the picture picture and I'm over you. Oh woh oh, oh woh oh. Love me back, you do this to me - poisoned iv. Na na-na na-na na-na. Na na-na na-na na-na. Na na-na na-na na-na. Poisoned iv. Na na-na na-na na-na. Na na-na na-na na-na. Na na-na na-na na-na. Poisoned. This love is dangerous dangerous. Got my head spinning spinning out of control. Going everywhere everywhere. This love is dangerous dangerous. Now I'm sorry I had to let him go. I admitted I was in love, in love with ya with ya. Never been sicker sicker from the crazy things you do. Oh woh oh, oh woh oh"
joint (no sleep),"That's my joint. Yeah gimme that beat. What's the point, we ain't being low-key. We ain't getting no sleep. Me and my crew all dressed up. We 'bout to hit these streets. 'bout to make niggas fall in love. Out here swerving, not giving a fuck. Cause we about to do it, do it. Do it 'til the break of that sun come up. We've been doing this shit a long time. We just put out shopping. We go get our life. I said, we've been doing. This shit a long time. We just pull up, hop out. Walk right up inside. We say, that's my joint. Yeah, gimme that beat. What's the point, we ain't being low-key. Fuck it though, we ain't getting no sleep. We ain't getting no sleep. That's my joint, yeah, gimme that beat. What's the point, we ain't being low-key. Fuck it though, we ain't getting no sleep. We ain't getting no sleep. On that floor (we on that floor). Hair tied up (hair tied up). Cause we about to get it. Know you like that booty, you can look. Don't touch (you can look don't touch). In your city, showing love (showing love). Holla when you see me, see me, see me. But please, don't spill that cup. (don't spill that cup). We've been doing this shit a long time. We just put out shopping. We go get our life. I said, we've been doing. This shit a long time. We just pull up, hop out. Walk right up inside. We say, that's my joint. Yeah, gimme that beat. What's the point, we ain't being low-key. Fuck it though, we ain't getting no sleep. We ain't getting no sleep. That's my joint, yeah, gimme that beat. What's the point, we ain't being low-key. Fuck it though, we ain't getting no sleep. We ain't getting no sleep. That's my joint, yeah, gimme that beat. What's the point, we ain't being low-key. Fuck it though, we ain't getting no sleep. We ain't getting no sleep. That's my joint, yeah, gimme that beat. What's the point, we ain't being low-key. Fuck it though, we ain't getting no sleep. We ain't getting no sleep"
just friends,Uh Uh. Yeah.... Chorus. We're just friends. I'm not tryin' to steal your man. Losing what's important to me. 'cos' of your insecurity. Stop trippin'. I'm not tryin' to steal your man. You look too good together. You know I would never. Verse 1. We've been friends for a long time. Growing on 6 years. And everytime I had some dramas. He was there with laughter or tears. But now hes got u girl (ooohh..). And im not tryin' to be disrespectful. We're just friends. It aint nuthin in ma heart. Chorus. Verse 2. He called me on the phone this morning. He asked 2 do it when you werent home. I hate that he has to keep things from you. But girl it is your own fault. 'cos you've got these insecure fears. But he and I have been friends for years. Stop making this something that it's not. Or you'll end up losing that love that you got. chorus x 2. Verse 3 (rap breakdown). I'm not tryin to play a part. I aint no one to study. Just a friend not adetioned. Girl of wifey. I know that you might be. I know that you cant see. What them bells if it up to you. Don't understand why you gettin crazy. He's your man and your his lady. I don't want to stand this again. Undertsand he's always going to make friends with me. So lose that insecurity. You don't have to worry about a thang. Chorus. (He's like ma best friend). (Don't wana hold him). (neva neva neva). believe I would never
just one nite,"(Cassie). Just one night to be with you again, cause i miss the way. that it felt when we made love ohh..... Just one night to be with you again, cause i miss the way miss the way we made love.. I ran across a picture, a picture of us, i admit i almost cryed ohhhhh...... It made me realize how much i miss yah. how my life ain't been the same since your gone, left on my own, left with an empty space. can't hide everything reminds me of you, next thing i know thats when i see your face.. and i know all i need,. Just one night to be with you again, cause i miss the way. that it felt when we made love,. Just one night to be with you again, cause i miss the way, miss the way we made love.. uh i hope that you've been ,that u've been missen, missen me the way i miss you, its so confsing my mind im losing, and i hide it everyday, left on my own left with an empty space. can't hide everything reminds me of you, next thing know thats when i see your face.. and i know all i need,. Just one night to be with you again, cause i miss the way. that it felt when we made love love love. Just one night to be with you again, cause i miss the way miss the way we, made love. (R. Les). Listen i miss you im scared ill be real with it nights get cold but i deal wit it me in the club with an ill fit it.. I know u feel me though uhhh.... cant sleep at all in my bed right you can try today get my head right, it like im trapped in some head lights i cant make moves, im thinkin back to the days we were so tight no lights make love right all night im have ill flashbacks like a strobe light i kno ya feel me girl. huh...... See i understand what u run fo so ur eyes dont cry but ur unsho all u really need is one more just one more i giv it to ya!!. Just one night to be with you again, cause i miss the way. that it felt when we made love love love. Just one night to be with you again, cause i miss the way miss the way we, made love yeah uhhh heh owwww"
keep on lovin' me,"Ah Ah Ah Ah The Dreamer. Ah Ah Ah Ah I'm with my girl Cassie. Ah Ah Ah Ah Ah The American Dreamer. Ah Ah Ah Ah with my girl Cassie. [Cassie]. Every time i turn around i hear something about you, All my girls telling me about the bad things you do, Everybody all up in my loui bag aint talking bout this there talkin bout that.. And they aint guna stop un till break us... in two, But you have my love and i have yours, Let them keep talkin i aint ever leaving baby i believe in you. [Chorus]. There's nuthin wrong with you, there's nuthin wrong with me, There's something wrong with the world just keep on loving me,There's nuthin wrong with you, there's nuthin wrong with me, There's something wrong with the world just keep on loving me, There's nuthin wrong with you, there's nuthin wrong with me, There's something wrong with the world just keep on loving me, There's nuthin wrong with you, there's nuthin wrong with me, There's something wrong with the world just keep on loving me. [The Dream]. I'm tired of feeling wrong when i know that were right, why should i give a sh** I'm tired of being nice, See i aint leaving her and she aint leaving me, So get used to it coz its how its gon be, It seems like the whole world know what this is,. If its up to em put there we can fix this, you dont know my love they can't judge us. [Chorus]. There's nuthin wrong with you, there's nuthin wrong with me, There's something wrong with the world just keep on loving me,There's nuthin wrong with you, there's nuthin wrong with me, There's something wrong with the world just keep on loving me, There's nuthin wrong with you, there's nuthin wrong with me, There's something wrong with the world just keep on loving me, There's nuthin wrong with you, there's nuthin wrong with me, There's something wrong with the world just keep on loving me. . Just keep on loving me , me me me me me me Just keep on loving me, me me me me ( i love you baby ) me me Just keepin on loving meeee Mwah just keep on loving meeeeeee Mwah meeeeeee Mwah Meeeeee Mwah meeeee take it back to AT yeah. [Chorus]. There's nuthin wrong with you, there's nuthin wrong with me, There's something wrong with the world just keep on loving me,There's nuthin wrong with you, there's nuthin wrong with me, There's something wrong with the world just keep on loving me, There's nuthin wrong with you, there's nuthin wrong with me, There's something wrong with the world just keep on loving me, There's nuthin wrong with you, there's nuthin wrong with me, There's something wrong with the world just keep on loving me,. Just keep on loving you, There's nuthin wrong with , There's something wrong with the world, There's nuthin wrong with you, There's something wrong with the world you see, There's nuthin wrong with you or me, There's something wrong with the world you see, there's nothin wrong with you or me there's something wrong with the world,. Ther's something wrong with the world, There's something wrong with the world,There's something wrong with the world eh eh eh eh , There's something wrong with the world, There's something wrong with the world eh eh eh eh eh. There's something wrong with the world!"
king of hearts,"You are the prince of charm. Seduction is your art. You never play my love. You're just my king of hearts. You are my king of hearts. If you're winning. You might as well admit it. And looking come and get it. Boy you can just forget it, forget it. If you're winning. You might as well admit it. And looking come and get it. Boy you can just forget it, forget it. You are the prince of charm. Seduction is your art. You never play my love. You're just my king of hearts. You are my king of hearts. You are the prince of charm. Seduction is your art. You never play my love. You're just my king of hearts. You are my king of hearts. Hear what you saying. Baby how you came in. It's obvious you playing. But you can just keep playing me, keep playing me. Keep playing, baby why you playing. It's obvious you gaming. But you can just keep playing me, keep playing me. You are the prince of charm. Seduction is your art. You never play my love. You're just my king of hearts. You are my king of hearts. You are the prince of charm. Seduction is your art. You never play my love. You're just my king of hearts. You are my king of hearts. And we go, and we go go go go. Boy we go, and we go go go go. King of hearts. King of hearts. King of hearts. King of hearts. You are the prince of charm. Seduction is your art. You never play my love. You're just my king of hearts. You are my king of hearts. And we go, and we go go go go. Boy we go, and we go go go go"
king of hearts (kanye west remix),"King of hearts (don't tell it now). King of hearts (don't tell it now). King of hearts (don't tell it now). King of hearts (don't tell it now). You are the prince of charm. Seduction is your art. You never play my love. You're just my king of hearts. You are my king of hearts. (Can you feel it?). If you're winning. You might as well admit it. And you can come and get it. Boy, you can just forget it, forget it. If you're winning (don't tell it now). You might as well admit it (don't tell it now). And you can come and get it (don't tell it now). Boy, you can just forget it, forget it (don't tell it now). You are the prince of charm. Seduction is your art. You never play my love. You're just my king of hearts. You are my king of hearts. (Can you feel it?). You are the prince of charm. Seduction is your art. You never play my love. You're just my king of hearts. You are my king of hearts. (Can you feel it?). Hear what you saying. Baby, why you gaming. It's obvious you playing. But you can just keep playing me, keep playing me. You playing, baby why you playing. It's obvious you gaming. But you can just keep playing me, keep playing me. You are the prince of charm. Seduction is your art. You never play my love. You're just my king of hearts. (Can you feel it?). You are my king of hearts. (Can you feel it?). King of hearts (don't tell it now). King of hearts (don't tell it now). King of hearts (don't tell it now). King of hearts (don't tell it now). You are the prince of charm. Seduction is your art. You never play my love. You're just my king of hearts. You are my king of hearts. (Can you feel it?). And we go, and we go go go go. And we go, and we go go go go. (Can you feel it?). King of hearts. King of hearts. King of hearts. King of hearts. King of hearts (don't tell it now). King of hearts (don't tell it now). (Can you feel it?). King of hearts (don't tell it now). King of hearts (don't tell it now). (Can you feel it?). You are the prince of charm. Seduction is your art. You never play my love. You're just my king of hearts. You are my king of hearts. And we go, and we go go go go. And we go, and we go go go go. (Can you feel it?)"
kiss me,"One touch can bring us closer. don't want this to be over. You know that you complete me. your love is what I need. Don't rush to see you leaving. stay with me while I'm sleeping. Cuz you know what you do to me. I'm weak and you know my heart is beating. [B-section]. One, two, three, kiss, that's when I know that we. Four, five, six, kiss, have the right chemistry. You don't have to hold back or be shy. I can tell you want me in your eyes. One, two, three, kiss, that's when I know that we. Four, five, six, kiss, have the right chemistry. Feels so good cuz I know that you're mine. boy I got my eyes closed cuz you know that I. [Chorus]. Love it when you kiss me. love it when our lips meet. You intoxicate me. I barely can breathe. I love when you kiss me [2x]. Ooh girl I'm coming over. you know I wanna hold ya. Kiss you, cuz I know you want me too. I want to give you what you'll like. So, so please don't be afraid to. to tell me what'll make you. reach the top (reach the top). girl I'm needing it. cuz baby I can feel your heart beating. [B-section]. [Chorus]. [Break]. [Repeat Chorus]"
