play,"I could wait all night and day. To go to a party sit down and wait. Give my request to the dj cuz my song hes gotta play. And when I hear that beat I get my body up out my seat. I grab a guy and move my feet. He's playing my song. Play, come on play that song,. Play it all night long. Just turn it up and turn it on. Play,. Come on dj play that song you know that it turns me on. (dj just play that song). Just turn it up and turn it on. Dj just play that song, cuz I wanna be dancing all night long. Just play my, play my, play my, play my, play my. Favorite song. I dont care if everybody's gone. turn it up cuz it turns me on. Keep dancing all night long,. Feels so right that it cant be wrong. I get chills up and down my spine. Whenever I hear that song of mine. When it stops better press rewind.. Let me hear it one more time!. Play, come on play that song,. Play it all night long. Just turn it up and turn me on. Play,. Come on dj play that song you know that it turns me on. (dj just play that song). Just turn it up and turn it on. Play, come on play that song,. Play it all night long. Just turn it up and turn me on. Play,. Come on dj play that song you know that it turns me on. (dj just play that song). Just turn it up and turn it on. I just wanna dance, is that a crime? alright then.... (yea thats the hottness right here). Play come on dj. Play play that song you know that it turns me on. (now mr dj i've asked you 3 times to play my song!). Play, come on play that song,. Play it all night long. Just turn it up and turn me on. Play,. Come on dj play that song you know that it turns me on. (dj just play that song). Just turn it up and turn it on. Play, come on play that song,. Play it all night long. Just turn it up and turn me on. Play,. Come on dj play that song you know that it turns me on. (dj just play that song). Just turn it up and turn it on. Play, come on play that song,. Play it all night long. Just turn it up and turn me on. Play,. Come on dj play that song you know that it turns me on. (dj just play that song). Just turn it up and turn it on. Play, come on play that song,. Play it all night long. Just turn it up and turn me on. Play,. Come on dj play that song you know that it turns me on. (dj just play that song). Just turn it up and turn it on"
pleasure is mine,"Baby relax, we've been waiting for this. and we deserve the heavenly bliss. that waits underneath the stars above. can't you hear them begging us: ""Let's make love"". From the bottom of my heart I give you my soul. Right here in this room the truth unfold. Is saying, stop playing, delaying the divine. The pleasure is mine. let me give some to you. We can take our time. nothing I'd rather do. To make you feel fine, to make your life shine. Give you moments you can treasure, forever, remember. The pleasure is mine. Mine, mine, all mine. Everyday I've been dreaming about how I'ts gonna be to find you out. To be sharing your kiss, to be just like this. What I wouldn't do for a taste of your lips. So let's not waste one second more. Let's cut the lights and let's lock the door. Is saying, stop playing, delaying the divine. The pleasure is mine. let me give some to you. We can take our time. nothing I'd rather do. To make you feel fine, to make your life shine. Give you moments you can treasure, forever, remember. The pleasure is mine. Mine, mine, all mine. The pleasure is mine. Mine, mine, all mine. Oh baby I don't want to breath. Don't want to change a single vibe. Nobody else I rather see. when you're like this before my eyes. Wanna be everything you need. keep you satisfied I'm praying, stop playing. Is saying, stop playing, ah ah ah aah. The pleasure is mine. let me give some to you. We can take our time. nothing I'd rather do. To make you feel fine, to make your life shine. Give you moments you can treasure, forever, remember. The pleasure is mine. Mine, mine, all mine. The pleasure is mine. Mine, mine, all mine. The pleasure is mine. let me give some to you. We can take our time. nothing I'd rather do"
plz read this,"Hey guys, how are you all,. its great fun here avin a ball,. yo niggers how ya doin?. me the diva i have everyfing. u dnt u lot av nothing. CHORU S. I have it u aint u av non i av all, dnt take ma call i dnt wanna no ya really,. its me n ma family really X3. hELP me i need sum help,. i do really hear me welp,. i cey at night and wonder why. why this is happening to me by the by,. i no its because im beautiful,. I no its because im wonderful,. but i dont giva a bull,. its just me n ma skull,. im used 2 it now,. i used 2 get called a cow,. but luk @ me now, better than u. i bet ya av had a boo hoo. Choros. STOP...............(wait 4 secs). like ma top. fuck u all ya retards. i have everything and the fast cars,. i have the best body no one complains. so im tellin u to stop complainin n LOVE me. ive always been loved so u can da da club!. Byexxx. luve Fern hi 2 mi skul"
promise me you'll try,I know it's on your heart. That a love like ours shall never fall apart. You're so afraid of the rain. So I'll take your hand. And I'll love you in the best way that I can. And I only expect the same. Chours:. Don't promise forever. Don't promise me the sun and sky. Don't pretent to know you'll never make me cry. Just hold me now. And promise me you'll try. Though I'm sure of what I feel. Never thought a love so true felt so unreal. And I'm a little afraid myself. But if you love me day by day. With an honest heart and just a little faith. Baby time will tell the tale. Chours(2x).
remember me this way,Every now and then we find a special friend. Who never lets us down. Who understands it all. Reaches out each time you fall. You're the best friend that I've found. I know you can't stay. But part of you will never ever go away. Your heart will stay. I'll make a wish for you. And hope it will come true. That life will just be kind. To such a gentle mind. If you lose your way. Think back on yesterday. Remember me this way. Remember me this way. I don't need eyes to see. The love you bring to me. No matter where I go. And I know that you'll be there. For ever more a part of me you're everywhere. I'll always care. I'll make a wish for you. And hope it will come true. That life will just be kind. To such a gentle mind. If you lose your way. Think back on yesterday. Remember me this way. Remember me this way. And I'll be right behind your shoulder watching you. I'll be standing by your side in all you do. And I won't ever leave as long as you believe. You just believe.... CHorus:. I'll make a wish for you. And hope it will come true. That life will just be kind. To such a gentle mind. And if you lose your way. Think back on yesterday. Remember me this way. Remember me this way. Reeee-member meeee thiiiiias waa-aay...
run the world,"We got it locked. They know, that. Whenever we around it goes down like Draino, and it’s nothing to spend these pesos, and you will never see us low low.. Ain't nothing greater, hanging out the window straight busting at you love haters. Bonny Clyde,. No other girl will ever ride like I ride. That’s why you need me on your passenger side,. Let me help you get that paper.. Hanging out the window busting at them love haters.. Me and you,. I’m the closest you’ll ever be to truth.. There’s never a question of what I’ll do. Uh huh for you.. With me you’ll never lose.. So, call on your girl that can hold you right. I'll be your protector I'll never forget you.. You need somebody that can hold you tight.. I'll be your armor. Keep you outta harm boy.. I'll be your anything, everything. Rock 'n' roll with you.. If things get too hot. Out in the cold with you.. Froze, froze with you.. Me and you together. Our love could run the world. Run the world. Our love could run the world. Run the world. Our love could run the world.. We'll make it through any weather baby. Don't pay them any attention. They'd all just drive you crazy. All that really matters is our love for one another. And all we'll ever have - is each other. Let a chit chatter come around. We both know she'll never be down. She'll never have your back. Wouldn't know how to act. I can't see it no better than that. So, call on your girl that can hold you right. I'll be your protector I'll never forget you.. You need somebody that can hold you tight.. I'll be your armor. Keep you outta harm boy.. I'll be your anything, everything. Rock 'n' roll with you.. If things get too hot. Out in the cold with you.. Froze, froze with you.. Me and you together. Our love could run the world. Run the world. Our love could run the world. Run the world. Our love could run the world.. Can't you see there's no love like you and me. Can't you see baby there's no other more powerful than we. Can't you see that I'm the only thing you'll ever need. Can't you see that, can't you see that. . @_felimm"
ryde or die,"Jennifer Lopez - Ryde Or Die Lyrics. Crazy over you. I don't know what to do. I don't understand why I'm crazy. Over you, I don't know what to do. I do. I would give up everything just to feel and be with you (if I had to). I would pawn the ring you gave to me just to feed you (if I had to). I would give my very last breath just to help save you (if I had to). I would tell a lie just because I know you are the truth. [Chorus:]. I'd ryde for you. 'Cause you're the truth. I'd die for you. Ooh, 'cause I'm a fool in love with you. And I'll do anything that pleases you. Only you. If I had to. I would throw away my only wish just to prove to you (if I had to). I would die all alone if living meant without you (if I had to). I would go through all the pain again just to find you (if I had to). I'd surrender all my love just because I love you. I don't understand why I'm crazy. over you, I don't know what to do. I don't understand why I'm crazy. over you, I don't know what to do. I'd ryde for you. 'Cause you're the truth. I'd die for you. Ooh, 'cause I'm a fool in love with you. And I'll do anything that pleases you. I'd ryde for you. 'Cause you're the truth. I'd die for you. Ooh, 'cause I'm a fool in love with you. And I'll do anything that pleases you. I wanna run to you. Breathe as one with you. Absent in time without you. Existing only for you. Every dream is of you. Only turn to you. My baby, my love. Only turn to you, woo, woo. I'd ryde for you. 'Cause you're the truth. I'd die for you. Ooh, 'cause I'm a fool in love with you. And I'll do anything that pleases you. I'm gonna run for you. I'd ryde for you. 'Cause you're the truth. I'd die for you. Ooh, 'cause I'm a fool in love with you. And I'll do anything that pleases you"
same girl,"My head's killing me, I'm losing sleep. And I'm waking up tired (of it all). Early in the morning, and there's something already. With my name always involved. I'm tryna get rid of the baggage. Fake friends I call them ""has-been"". Yeah they lying on stuff. And it's okay if they don't show me love (no). So they want me to lie down. They want me to crawl. They want me to cry now. But I'm never falling off. Why you tryna put the world up on my shoulder?. Get off of me, get off of me. Too damn grown, I don't owe nobody. Get off of me, get off of me. 'Cause in the end I'm still the same girl (same girl). Same girl (same girl). Same girl (same girl). I'm just the same girl (same girl). Same girl (same girl). Same girl (same girl). Tell me what I gotta do, I'm tryna make it clear to you. Not dealing with the attitude. I'm tired of tryna make you see that I'm still me. So I check my longitude and latitude. You're in my way, you better move. 'Cause I'm on the same ride. You know I'll never change. I'm loving everyday, I know I'm the same Jenny. From around the block. So they want me to lie down. They want me to crawl. They want me to cry now. But I've never fallen off. Why you tryna put the world up on my shoulder?. Get off of me, get off of me. Too damn grown, I don't owe nobody. Get off of me, get off of me. Why you tryna put the world up on my shoulder?. Get off of me, get off of me. Too damn grown, I don't owe nobody. Get off of me, get off of me. 'Cause in the end I'm still the same girl (same girl). Same girl (same girl). Same girl (same girl). I'm just the same girl (same girl). Same girl (same girl). Same girl (same girl). I'mma keep on going, keep on shining. Just gonna do me. I have to thank God 'cause he chose me. I'm still the same girl. Why you tryna put the world up on my shoulder?. Get off of me, get off of me. Too damn grown, I don't owe nobody. Get off of me, get off of me. Why you tryna put the world up on my shoulder?. Get off of me, get off of me. Too damn grown, I don't owe nobody. Get off of me, get off of me"
same girl (feat. french montana),"Jlo. Feel it getting closer. Stirring like I'm supposed. To Stop me, no sir. Haters getting closer. Stirring like I'm supposed. To Stop me, no sir. When you make it you were chosen. Say, damn you in trouble. Mama told me stay out of that corner. Thank God we made it out that corner. Going crazy, now them suicide doors. Irs watching your money on the forbes. Shorty on me got a bag. Haters wanna see me in a body bag. My head's killing me. I'm losing sleep. And I'm waking up tired of it all. Early in the morning. And there's something already. With my name always involved. I try to get rid of the baggage. Fake friends I call them ""has-been"". Yeah, they mind all stuck. And it's ok if they don't show me love. no. They want me to lie down. They want me to crawl. They want me to cry now. But I've never fallen off. Why you tryna put the world up. On my shoulders?. Get off of me. Get off of me. Too damn grown. I don't owe nobody. Get off of me. Get off of me. Why you tryna put the world up. On my shoulders?. Get off of me. Get off of me. Too damn grown. I don't owe nobody. Get off of me. Get off of me. Cuz in the end I'm still the same girl. (same girl). Same girl (same girl). Same girl (same girl). I'm just the same girl (same girl). Same girl (same girl). Same girl (same girl). Show me what I gotta do. I'm tryna make it clear to you. Not dealing with the attitude. I'm tired of tryna make you see that. I'm still me. Switched up my longitude and latitude. You're in my way, you better move. 'Cause I'm on the same ground No. I never changed. I'm loving every day. I know that I'm the same jenny from. Around the way. They want me to lie down. They want me to crawl. They want me to cry now. But I've never fallen off. Why you tryna put the world up. On my shoulders?. Get off of me. Get off of me. Too damn grown. I don't owe nobody. Get off of me. Get off of me. . Why you tryna put the world up. On my shoulders?. Get off of me. Get off of me. Too damn grown. I don't owe nobody. Get off of me. Get off of me. Cuz in the end I'm still the same girl. (same girl). Same girl (same girl). Same girl (same girl). I'm just the same girl (same girl). Same girl (same girl). Same girl (same girl). I'ma keep on growing. Keep on shinin' Just wanna do me. I had to thank. God 'cause he chose me. I'm still the same girl. When I was dead broke. There was nobody. Back to the walls, nobody. Still the same old nigga. Thirty new cars, thirty chains. Oh nigga. Been real, count money, get it hot. Oh la la. Been real, count money, get it hot. oh la la. Why you tryna put the world up. On my shoulders?. Get off of me. Get off of me. Too damn grown. I don't owe nobody. Get off of me. Get off of me. Why you tryna put the world up. On my shoulders? (up on my). Get off of me. Get off of me Too damn grown. I don't owe nobody. (I don't owe nobody). Get off of me. Get off of me"
santa clause lane,"I remember last christmas eve. Something happened that i couldn't believe. I went for a walk while the snow came down. And when it stopped,I was in a different town. And the sign said have no fear,your not lost your here. Chorus:. Walkin this christmas. down santa claus lane. no need to wonder. no need explain. just have some faith in what you see. your right here where you wanna be. walkin this christmas down santa claus lane.. down santa claus lane. Elves were standing in the street. Snowmen and reindeer came out to greet. Silver bells chimed from far away. as Santa rode by in an open sleigh. and he told me have no fear. your not lost your here. Chorus:. Walkin this christmas. down santa claus lane. no need to wonder. no need to explian. just have some faith in what you see. your right here where you wanna be. walkin this christmas down santa claus lane. down santa claus lane. I don't know how. I don't know when. but one day i'll be back again. And he told me have no fear. your not lost your here..... Chorus:. Walkin this christmas down santa claus lane. no need to wonder. no need to explain. just have some faith in what you see. your right here where you want to be. Walkin this christmas down santa claus lane. (santa claus lane). down santa claus lane. down santa claus lane. (santa claus lane). down santa claus lane"
sarah rill,"He was always such a nice boy. The quiet one. With good intentions. He was down for his brother. Respectful to his mother. A good boy. but good don't get attention. One kid with a promise. The brightest kid in school. He's not a fool. Reading books about science and smart stuff. It's not enough, no. Cause smart dont make you cool, whoa. He's not invisible anymore. With his Father's 9 and a broken fuse. Since he walked through that classroom door. He's all over primetime news. Mary's got the same size hands. As Marilyn Monroe. She put her fingers in the imprints. at Mann's Chinese Theatre show. She coulda been a movie star. Never got the chance to go that far. Her life was stole. Now we'll never know. No no no no oh. They were crying to the camera. Said he never fitted in. He wasn't welcomed. He showed up to the parties. He was hanging in. Some guys puttin' him down. Bullying him round round. Now I wish I woulda talked to him. Gave him the time of day. Not turn away. If I woulda been the one to maybe go this far. He might have stayed at home. Playing angry chords on his guitar. He's not invisible anymore. With his baggy pants and his legs in chains. Since he walked through that classroom door. Everybody knows his name. Mary's got the same size hands (Oh). As Marilyn Monroe. She put her fingers in the imprints (Ooh). at Mann's Chinese Theatre show. She coulda been a movie star. Never got the chance to go that far. Her life was stole. Now we'll never know. (Now we'll never know, oh). Greg was always getting net from 20 feet away (20 feet away). He had a tryout with the Sixers. Couldn't wait for Saturday (Saturday). Now we're never gonna see him slam. Flying high as Kobe can. His life was stole (Stole). Oh now we'll never know. Now we'll never never never know. Mmm now we'll never never never never know. Stole (Stole). Oh whoa yeah yeah yeah yeah yeah yeah. Mary's got the same size hands (Same size hands). As Marilyn Monroe(Oh). She put her fingers in the imprints. at Mann's Chinese Theatre show(She was gonna be a star). She coulda been a movie star (Oh no). Never got the chance to go that far (Never got the chance). Her life was stole (Stole, stole). Oh now we'll never know. (Now we'll never never know, no). Greg was always getting net from 20 feet away (He had game, oh). He had a try out with the Sixers. Couldn't wait for Saturday. Now we're never gonna see him slam (Never see him). Flying high as Kobe can. His life was stole (Stole, oh). Oh now we'll never know. (Now we'll never never know). Oh no no no. Yeah their lives were stole. now we'll never know. (Stole). We we're here all together yesterday. (Stole)."
secretly,"It's like I'm lost. I don't know. But this feeling. That I have about you. Will you ever know?. Secretly I’m wanting you. And I’m hoping you want me too. I smell your scent across the room. And I can’t wait to get next to you. Whatever I see.... Whatever I hear.... Whatever I do.... Oh baby, has got me thinking of you. Secretly, I’m wanting you. And I’m hoping you want me too. I smell your scent across the room. And I can’t wait to get next to you. Whenever you speak.... Whenever you move.... Whenever you breathe.... Baby, let me touch you. Secretly, I’m wanting you. And I’m hoping you want me too. I smell your scent across the room. And I can’t wait to get next to you. Secretly, I’m wanting you. And I’m hoping you want me too. I smell your scent across the room. And I can’t wait to get next to you. (You smell so good). (I just wanna...kiss you). (I wanna...lay with you). (I dunno how to tell you)."
should've never,"I've been so caught up. In the thought of me and you. Even though I love someone else. I know my heart belongs to you. Tell me how did we ever let the situation get this far. Maybe we should just try to hide the things we feel inside. Things I know we can't deny. (Chorus:). Should've never told you. That I cared about you. Didn't think that it would be, so bad. Should've never kissed you. Should've never held your hand. Got to find a way to let these feelings go. What did I do the day I let you slip into my soul. It was then, when I realized. That I would always want you in my life. No one else can know of the things. That we've been saying on the telephone. It would be so bad. If they even knew that me and you. Were secretly into each other. (Chorus:). Should've never told you. That I cared about you. Didn't think that it would be, so bad. Should've never kissed you. Should've never held your hand. Got to find a way to let these feelings go. (Bridge:). I'm so scared, trembling inside. Cause I'm feeling like somebody else already knows. Oh my god, I love you both so much. And to have to choose between the two. Is hurting me so deep inside. (Chorus:). Should've never told you. That I cared about you. Didn't think that it would be, so bad hum. Should've never kissed you. Should've never held you hand. I don't ever want to feel this way again. (Chorus:). Should've never told you. That I cared about you. Should've never kissed you. Should've never held your hand (6x)"
so good,"The man on your own. Why don't you put some base on your tongue?. Can't you see that here is lonely?. Taking care of all day long. You're making me leave. Shoulda give me a reason to breathe. Definitely not, no that's not what I mean. I'm so done with pleasing you. I'm so over needing you. All this space just gave me room so I could fly. What I thought would make me die. Makes me feel like I'm alive. Boy your words don't carry weight to hold me down. I'm still so good over you. I'm still so good over you. Even if I didn't have a dollar in the bank. Even if you were my only way. I'm still so good over you. I'm still good. The man on your own. Why don't you put some base on your tongue?. Can't you see that here is lonely?. Taking care of all day long. You're making me leave. Shoulda give me a reason to breathe. Definitely not, no that's not what I mean. I'm so done with pleasing you. I'm so over needing you. All this space just gave me room so I could fly. What I thought would make me die. Makes me feel like I'm alive. Boy your words don't carry weight to hold me down. . I'm still so good over you. I'm still so good over you. Even if I didn't have a dollar in the bank. Even if you were my only way. I'm still so good over you. I'm still good. I'm still good. I'm still good. I bet you think I need you. I'm telling I don't, you've lost your mind. I used to be so see-through. But now I never let you on my mind. I'm worth a bunch of millions. But you be acting like your money is mind. I want the Eiffel chilling. I'll be damned if I let you blow my eye. Baby what you think about life. Without me by your side. I bet you wanna get it right. But even if you get it right. I'm still so good over you. I'm still so good over you. Even if I didn't have a dollar in the bank. Even if you were my only way. I'm still so good over you. I'm still good. I'm still good. I'm still good"
