hold you down (feat. fat joe),"(Verse 1). (Jennifer:). Now you've been holding me down. For such a long time now. From back then. To now in my story. Straight from the hood. You've always been there for me. And ya had my back. (When they) Back when everybody said. I wasn't anything. It was you who had me holdin' on. No matter what was goin' on. So whatever ya need I got you. (Fat Joe:). Reminiscing that 6 train from way back. Now it's skyblue Phantoms and stretch Maybachs. For sweepin them floors in them Bronx apartments. Mira esta que on the red carpet. When Pun died you was the first to call me. I never told you. But you was there for me. Whatever you need, I be there for you. Crack, I got ya back, for real, true story. (Bridge). (Jennifer:). Now my loyalty, will always be. With you, if you just promise me. That you'll stay real just like you are. 'Cause baby you don't have to change (no). (Chorus). (Jennifer:). You don't know how much you mean to me. Whenever you down. You know that you can lean on me. No matter the situation. Boy, I'm gon' hold you down. (Fat Joe:). You don't know how much you mean to me. Whenever you down. You know that you can lean on me. No matter the situation. Girl, I'm gon' hold you down. (Verse 2). (Fat Joe:). 2005 Rakim and Jody Watley. Why'd she paint such a picture so perfect. Quite possibly. The real expression from Bx. To South Beach. I'ma always hold you down, girl. You can count on me. (Jennifer:). So remember this whenever I call. We go back too far. We've been through it all. Even though we haven't spoke. In so long. Ain't nothing has changed. Not a damn thing, baby. (Bridge). (Jennifer:). Now my loyalty, will always be. With you, if you just promise me. That you'll stay real just like you are. 'Cause baby you don't have to change, 'cause. (Chorus). (Jennifer:). You don't know how much you mean to me. Whenever you down. You know that you can lean on me. No matter the situation. Boy, I'm gon' hold you down. (Fat Joe:). You don't know how much you mean to me. Whenever you down. You know that you can lean on me. No matter the situation. Girl, I'm gon' hold you down. (Verse 3). (Fat Joe:). Like green it's the autumns. Some things must stay. This industry, yeah, I fought it. Made me this way. Get between me and J.Lo. I simply stay. You better off sweepin' leaves. On a windy day (no). (Jennifer:). So I don't care about the situation. I'm a ride for you if there's a complication. Every time you had my back and all. When we were young. And now you're Joey Crack and all. (Bridge). [Jennifer:]. Now my loyalty, will always be. With you, if you just promise me. That you'll stay real just like you are. 'Cause baby you don't have to change because. (Chorus). (Jennifer:). You don't know how much you mean to me. Whenever you down. You know that you can lean on me. No matter the situation. Boy, I'm gon' hold you down. (Fat Joe:). You don't know how much you mean to me. Whenever you down. You know that you can lean on me. No matter the situation. Girl, I'm gon' hold you down. (Jennifer and Fat Joe:). You don't know how much you mean to me. Whenever you down. You know that you can lean on me. No matter the situation. I'm gon' hold you down"
hooked on you,"I am hooked on you. I am ready to go. I am ready to dance. Are you?. I wanna see it. Lights turn on like 90 degrees. Standing on the wall but baby not me. Taking center stage come on the floor. Rolling till I break doing this and more. Lights turn on like 90 degrees. Standing on the wall but baby not me. Taking center stage come on the floor. Rolling till I break doing this and more. Do it to the floor, boy shake. Do it till the windows break. The whole room vibrates. And it's like an earthquake. Do it to the floor, boy shake. Do it till the windows break. The whole room vibrates. And it's like an earthquicke. Just lace them shoes tight. And bring your talk to the floor (that's right). Under these lights (we working it hard). I take him back to the hood. Cause I'm hooked I'm hooked on you.. I'm hooked, I'm hooked on you. I'm hooked, I'm hooked on you. On you, on you. I say it again like I said it before. I'm in the middle took it to the floor. Shadows on the wall, steam is on my back. Sweat dripping hard, feel it drip, drip, drop. I say it again like I said it before. I'm in the middle took it to the floor. Shadows on the wall, steam is on my back. Sweat dripping hard, feel it drip, drip, drop. Do it to the floor, boy shake. Do it till the windows break. The whole room vibrates. And it's like an earthquicke. Do it to the floor, boy shake. Do it till the windows break. The whole room vibrates. And it's like an earthquicke. Just lace them shoes tight. And bring your talk to the floor (that's right). Under these lights we working it hard. I take him back to the hood. Just lace them shoes tight. And bring your talk to the floor (that's right). Under these lights we working it hard. I take him back to the hood. Cause I'm hooked I'm hooked on you.. I'm hooked, I'm hooked on you. I'm hooked, I'm hooked on you. On you, on you. Just lace them shoes tight. And bring your talk to the floor (that's right). Under these lights we working it hard. I take him back to the hood. Cause I'm hooked I'm hooked on you.. I'm hooked, I'm hooked on you. I'm hooked, I'm hooked on you. On you, on you. Look right here baby don't stop now. Forget the people and forget the crowd. Loving in the club no not right now. Sweating until it heart while the music's loud. Look right here baby don't stop now. Forget the people and forget the crowd. Loving in the club no not right now. Sweating until it heart while the music's loud. Like that, like that. I like it like that. I like it like that. My neck and my back. Like that, like that. I like it like that. I like it like that. My neck and my back. Just lace them shoes tight. And bring your talk to the floor (that's right). Under these lights we working it hard. I take it back to the hood. Cause I'm hooked I'm hooked on you. (on you). I'm hooked, I'm hooked on you (on you). I'm hooked, I'm hooked on you (on you). On you, on you. You, you, you, you"
hypnotico,"All the girls that know that they're sexy. Come on!. Flip it, slap it down, it's gonna get nasty. Hypnoti-notico, hypnoti-notico. Shake me, shake those earthquakes, cause I'm in the ci-ity. Hypnoti-notico, hypnoti-notico. Love me for my body, I'm original sexy. Hypnoti-notico, hypnoti-notico. All the boys, all love it when we do our thing. We're just some silly heartbreakers tonight (tonight). All the boys, all want it, but it don't mean a thing. We got tonight (tonight). We're just some silly heartbreakers tonight. All the boys, all love it when we do our thing. We're just some silly heartbreakers tonight (tonight). All the boys, all want it, but it don't mean a thing. We got tonight (tonight). We're just some silly heartbreakers tonight. Hypnoti-notico, hypnoti-notico. Red eyes, widen envious smiles. Hypnoti-notico, hypnoti-notico. Sunburn, baby, hurts like cra-azy. Hypnoti-notico, hypnoti-notico. Hungry for some yum, yum, gonna get me some, some. Hypnoti-notico, hypnoti-notico. All the boys, all love it when we do our thing. We're just some silly heartbreakers tonight (tonight). All the boys, all want it, but it don't mean a thing. We got tonight (tonight). We're just some silly heartbreakers tonight. All the boys, all love it when we do our thing. We're just some silly heartbreakers tonight (tonight). All the boys, all want it, but it don't mean a thing. We got tonight (tonight). We're just some silly heartbreakers tonight. Ah ah ah ah ah. Hypnoti-notico, hypnoti-notico. Ah ah ah ah ah. Hypnoti-notico, hypnoti-notico. All the boys go crazy. All the boys go crazy. Hypnoti-notico, hypnoti-notico. Whine up your body like you're a boricua. All of the men have a silly heartbreaker. Hypnoti-notico, hypnoti-notico. All the boys, all love it when we do our thing. We're just some silly heartbreakers tonight (tonight). All the boys, all want it, but it don't mean a thing. We got tonight (tonight). We're just some silly heartbreakers tonight. All the boys, all love it when we do our thing. We're just some silly heartbreakers tonight (tonight). All the boys, all want it, but it don't mean a thing. We got tonight (tonight). We're just some silly heartbreakers tonight. Tonight. All the boys, all want it, but it don't mean a thing. We got tonight (tonight). We're just some silly heartbreakers tonight. Hypnoti-notico, hypnoti-notico"
i can't go,"I can´t go. I can´t desist. I´m prisioner here, here in my place. You are very special for my, but I don´t no. Chorus. I love you, but you mistreated me. I love you, but I don´t no. I love you, but I go. I´m prisioner in my life,. I love you. I Jenni from the block. I´m anithing you need. I can´t go. I can´t desist. I´m prisoner here, here in my place. Help me please. I go die without you. I love you, but you mistreated me. I love you, but I don´t no. I love you, but I go. I can´t go"
i could fall in love,I could lose my heart tonight. If you don't turn and walk away. 'Cause the way I feel I might. Lose control and let you stay. 'Cause I could take you in my arms. And never let go. CHORUS:. I could fall in love with you. I could fall in love with you. I could only wonder how. Touching you would make me feel. But if I take that chance right now. Tomorrow will you want me still. So I should keep this to myself. And never let you know. I could fall in love with you. I could fall in love with you. And I know it's not right. And I guess I should try. To do what I should do. But I could fall in love. fall in love with you. I could fall in love with you. (-spanish solo-). So I should keep this to myself. And never let you know
i got you,"Jennifer Lopez - I Got You Lyrics. Right here. Something in the dark shot glasses, you know. Something that you can lean to. Something that you can ride to. Something that you can step to. You know. Sometimes real love can be. Not seen 'cause you're thinkin'. What's right in front of you. Can't be the one for you. Then one day you realize that. There are feelings that you can't hold back. And you're so caught up. Now that's all you think of. Crazy how. All that talk of us not able to last. Just because of mistakes we made in the past. But they fail to understand. [Chorus:]. I got you. And nobody can come to change a thing. 'Cause you gotta know. You got me. And it feels so good to have your back now. I'm so proud. I got you. And if somebody tries to take you from me. They will see I've got you. You got me. I got you. Things are often said to. Doubt what I feel for you. But words that people say. Won't take my love away. Although it hurts sometimes, it's alright. But why they say some things that ain't right. I never know but please understand that baby, it ain't nothing. All that talk of us not able to last. Just because of mistakes we made in the past. But they fail to understand. I got you. And nobody can come to change a thing. 'Cause you gotta know. You got me. And it feels so good to have your back now. I'm so proud. I got you. And if somebody tries to take you from me. They will see I've got you (I got you, baby). You got me (you got me, baby). I got you (I got you, baby). You got me (you got me, baby). So that's all that people can do. Nevermind all the love, all that you. gotta do is simply love, trust, and just stay.... Together we'll get through whatever if we. Don't let speculations make situations up. We'll be alright. I got you. And nobody can come to change a thing. 'Cause you gotta know. You got me. And it feels so good to have your back now. I'm so proud. I got you. And if somebody tries to take you from me. They will see I've got you (I got you, baby). You got me (you got me, babe). I got you. And nobody can come to change a thing (feels so good inside). 'Cause you gotta know. You got me. And it feels so good to have your back now. I'm so proud. I got you. And if somebody tries to take you from me. They will see I've got you (I got you). You got me (yes, you got me, baby). I got you (nothing come between us). You got me (you got me). I got you (through whatever). You got me (you're all that I need). I got you (oh, baby). You got me (forever, baby). I got you (I got you). You got me (you got me). I got you. You got me"
i love you,"i love you! with all my heart. & until i die we'll never be apart. if you feel the same let me know. & if you don't let me go. i call you every night just to here you say hi. then i hang up & close my eyes. i have a vision of you & me holdin hands. i hear us makin future plans. i love to see you smie. you make everything worth while. i love it when you hold me tight. you never bring me to tears. with you i share my dreams,secrets,& fears. when i'm with you i know i'm in love. i know god sent you from up above. you never tell me a lie. you're the perfect guy. even when you act crazy. i tell everyone ""that's my baby"". i will never deny the love i have for you. but tell me do you love me too. it's you that i will always admire. you're my hopes dreams & my one desire. my life before you was never this great. i'm happy free & i have faith. i wish i could die. standing by your side. i wanna be your wife. for the rest of my life. i'm the only girl for you in this world. so promise there won't be another girl. if i ever lost you i would brake down in cry. & forever i would hide. if i cried you'd care. if i was hurt you'd be there. i just wanna let you know. that i would forever more. love you so"
i luh ya papi (feat. french montana),"I put it down for a brother like you. Give it to you right in the car, that's you. We can first give you some of this, that's you. And you're all loving that J. Lo, true. Hold up, I can get you thrown up. Pull your trigger, go and get your gun up. All the time I hear her talk. Put a pin in it, now I'm ready, let it rock. Keep it number 1, that's easy mathematics. Keep it number 1, baby, ain't no static. Got that hourglass for you, baby. Look at these legs. No brakes, go green, no red. If you wanna kill the body, gotta start with the head. Put it on you, I'mma need about 4-5 beds. Cause I love my papi. I didn't see it, but I see it now. Think I love you, and I need you now. Ain't had none like you in a while. I luh ya papi, I luh ya papi. I luh ya, luh ya, luh ya, luh ya papi. I luh ya papi. I luh ya, luh ya, luh ya, luh ya papi. I luh ya papi. I luh ya, luh ya, luh ya, luh ya papi. Yeah, that my papi. I luh ya, luh ya, luh ya, luh ya papi. I put it down for a brother like you. Give it to you right in the car, that's you. We can first give you some of this, that's you. And you're all loving that J. Lo, true. Oh that 24 hour. Feeling like I want one when it's crowded. If you wanna hear your name, I shout it. Boy, you the shit, go and take a power shower. And I'm feeling like it's me and you, I don't doubt it. You can drop it how you want. I ain't trying to call Miley. I'm loving me some you. Started from the bottom, baby, then we went roof. Cause I love my papi. I didn't see it, but I see it now. Think I love you, and I need you now. Ain't had none like you in a while. I luh ya papi, I luh ya papi. I luh ya, luh ya, luh ya, luh ya papi. I luh ya papi. I luh ya, luh ya, luh ya, luh ya papi. I luh ya papi. I luh ya, luh ya, luh ya, luh ya papi. Yeah, that my papi. I luh ya, luh ya, luh ya, luh ya papi. I luh ya papi. I luh ya, luh ya, luh ya, luh ya papi. I luh ya papi. I luh ya, luh ya, luh ya, luh ya papi. I luh ya papi. I luh ya, luh ya, luh ya, luh ya papi. Yeah, that my papi. I luh ya, luh ya, luh ya, luh ya papi. [French Montana]. I love you, mami, I-I love you, mami. Baby, you the shit, I-I love you, mami. Shorty got me catching feelings. And that rave drop reaching for the ceiling. Southside Bronx, [?] just overseas. Take the pants out here, drop to her knees. Oh my, I'm a don like Omar. Speed it up slow ma, throw it back, throw my. Rock-rock Gators like mother chords players. You can hate to love us. You can love to hate us. From the bottom it been real. From the bottom shorty been trill. And even though we made it to the top. Still J. Lo from the-the the block. Ey, I love you, mami, I love you, mami. Baby, you the shit, I-I love you, mami. I think I love just who you are. We haven't grown apart, this is just the start. Where life begin all the way to the end. And we started as friends, boy I do love. I luh ya papi, I luh ya papi. I luh ya, luh ya, luh ya, luh ya papi. I luh ya papi. I luh ya, luh ya, luh ya, luh ya papi. I luh ya papi. I luh ya, luh ya, luh ya, luh ya papi. Yeah, that my papi. I luh ya, luh ya, luh ya, luh ya papi. I luh ya papi. I luh ya, luh ya, luh ya, luh ya papi. I luh ya papi. I luh ya, luh ya, luh ya, luh ya papi. I luh ya papi. I luh ya, luh ya, luh ya, luh ya papi. Yeah, that my papi. I luh ya, luh ya, luh ya, luh ya papi"
i need love,"Oh, oh oh.... This is where my story begins. Standing here with you I'm about to give in. And I'm gonna give all I can give. Even though in previous relationships. I might have been mischievous. I wasn't already ready I admit to this. But what a good feeling it is. I've had a lot of crushes close to nothing like this. Everytime the subject would come up. I made up every excuse that I could think of. I used to run but now I'm getting warmed up. In a few words this feeling I could sum up. CHORUS. I need love. For the first time in my life. I need love. Ain't no love up in the club. I need love. Want to cuddle up to somethin'. That make me feel like I'm somethin'. Gettin' sick and tired of frontin' [2x]. I need. I was hangin' out with my friends. Seven nights a week If there's a party I'm in. I started getting sick of it. But when I looked back I didn't know what it meant. I guess I wasn't interested. In finding something real though I was looking for it. You should've been looking for me. But you opened up my eyes and now I can see. And everytime the subject would come up. When they say ""I love you"" Then I only dumb up. A lot of guys putting a girl or shut up. But you're the only guy that told me your love was endless. A lot of words with feeling can not sum up. But first I had to figure out who I was. To try and understand that there ain't no shortcuts. Now the only thing that's missing is your love. I need love. For the first time in my life. I need love. Ain't no love up in the club. I need love. Want to cuddle up to somethin'. That make me feel like I'm somethin'. Gettin' sick and tired of frontin' [2x]. I need. [OTHER]. Slow dance, hold hands. All I want is romance. If it's real, let me know it's real. Baby take a chance. 'Cause I been looking for a man who could understand me. And I got a lot of love to give. Baby don't you hear me [2x]. CHORUS [3x]. [OTHER]. (Por Fernando Azevedo)"
i wish i wasn't,[Verse 1]. I'm home alone again. And you're out hangin with your friends. So you say. Somehow I know it's not quite that way. It's getting pretty late. And you haven't checked on me all day. When I. called you didn't answer. Now I'm feeling like your ignoring me. I wish that you were home. Holding me tight in your arms. And I wish I could go back. To the day before we met. And skip my regret. [Chorus:] I wish I wasn't in love with you. So you couldn't hurt me. it just ain't fair the way you treat me. No you don't. deserve me. Wasting my time thinking bout you when you ain't never gon change. I wish I wasn't in love with you so I. wouldn't feel this way. [Verse 2]. When you touch me my heart melts. And everything you did wrong I forgive. So you play me and take advantage. Of the love. that I feel for you. Why you wanna hurt me so bad. I believed in you that's why I'm so mad. Now I'm drowning in. disappointment. And it's hard for me to even look at you. And I wish that you were home. Holding me tight in your arms. And. I wish I could go back. To the day before we met. And skip my regret. [Chorus]. [Bridge]. Said you care about me. But from what I see. I ain't feeling that. So I disagree. Gave you all my love. And understanding. And you're treating me like your enemy. So leave me alone. Don't want nothing from you. Just go back where you came from. This house is no longer your home. You are not welcome no no no more. [Chorus]. [Verse 3]. Hear you knockin' at the door again. I'm wonderin' should I let you in. I open uo the door and see. The flowers for me. So. beautiful in your hand. Please stop begging me to take you back. I've always been a sucker for romance. And before you know. it I concede. You're all over me. Oh no here I go again. I wish I wasn't in love with you. So you couldn't hurt me
i'm coming out,"I'm comin' out. mmmm...... I'm comin'. I'm comin' out. yeah. I'm comin' out. I'm, comin', out. I'm comin' out (I'm comin') I wan the world to know, I got to let it show.. (I'm comin'). I'm comin' out (comin') I wan the world to know, I got to let it show.. There's a new me comin' out. And I just have to live. And I wanna give. I'm completely positive. I think this time around. I just wanna do it. Like ya never knew it. Ya know I'll make it through. The time has come for me to break out of this shell. I have to shout, that I am comin' out. (Chorus). There's a night to show the world. All that I want to be. And all my abilities. Cuz there's so much more to me. Some how I'll have to make them. Just understand. I've got it well in hand. And oh how I have planned. I'm spreding love, there is no need to fear. And I just feel so good, every time I hear. (Chorus). I'm comin' out. I'm comin'. I'm, comin', out. I'm comin'. I'm, comin', out. I'm comin'. I'm, comin', OUT!!!. Said I'm comin' out! YEAH!. (Chorus)"
i'm glad,"Verse 1:. Baby when I think about (about, about). The day that we first met (the day that we first met). Wasn't lookin for what I found. But I found you. and I'm bound to find happiness in being around you. Chorus:. I'm glad when I'm makin love to you. I'm glad for the way you make me feel. I love it cause you seem to blow my mind every time. I'm glad when I walk you hold my hand. I'm happy that you know how to be a man. I'm glad that you came into my life. I'm so glad. Verse 2:. I dig the way that you get down. (you get down for 'bout). And you still know how to hold me. (and you still know how to hold me). Perfect blend, masculine. I think I'm in love, damn finally. Chorus. Bridge:. I'm glad, that you, turned to, out to be. That certain someone special. who makes this life worth living. I'm glad, you're here, just loving me. So say that you won't leave. Cause since the day you came. In I've been glad. *Instrumental break*. Chorus"
i'm gonna be alright,"Ohhh yeah,. Yes I did baby...Yes I did. It's funny 'cause for a while. I walked around with a smile. But deep inside. I could hear voices telling me this ain't right. Don't you know it's not for you. I always knew what I had to do. But it's hard to get away. 'cause I love you. I just tried to stay. I used to say I couldn't do it. But I did it. After telling everybody that I wasn't with it. Though it brings tears to my eyes. I can feel it. And I know inside I'm gonna be alright. I said I couldn't do it. But I did it. After telling everybody that I wasn't with it. Though it brings tears to my eyes. I can feel it. And that voice inside says I'm gonna be alright. Friends of mine say to me. They say you got control over me. You're not alone. I played my part. I saw the way you were from the start. Could I expect so much from you. You had a girl when I first met you. Did the best that you could do. Now I realize that I can't change you. I used to say I couldn't do it. But I did it. After telling everybody that I wasn't with it. Though it brings tears to my eyes. I can feel it. And I know inside I'm gonna be alright. I said I couldn't do it. But I did it. After telling everybody that I wasn't with it. Though it brings tears to my eyes. I can feel it. And that voice inside says I'm gonna be alright. Said I wouldn't walk away. Somedays I want to stay. But leaving you is what I need to do to be okay. Never thought it would be true. Me livin' without you. But now it's time for me to make that move. I used to say I couldn't do it. But I did it. After telling everybody that I wasn't with it. Though it brings tears to my eyes. I can feel it. And I know inside I'm gonna be alright. I said I couldn't do it. But I did it. After telling everybody that I wasn't with it. Though it brings tears to my eyes. I can feel it. And that voice inside says I'm gonna be alright"
