booty (feat. pitbull),"Big, big booty. What you got a big booty. Big, big booty. What you got a big booty. Big, big booty. What you got a big booty. Big, big booty. What you?. Big, big booty. What you got a big booty. My baby. Your gorgeous. I mean you're mine. You're sexy. But most of all you are just absolutely booty-full. Have you seen her on the dancefloor. She got the boom, shake the room. That's the lightning in the thunder. You wanna meet her, you wanna touch her. See the light in her eyes. And it starts to make you wonder. . All the sexy girls in the party. Go and grab a man. Bring him to the dancefloor. Go and light them jeans. Don't you worry you're dancing. It's his birthday. Give him what he ask for. Let me show you how to do it. Big, big booty. What you got a big booty. Work. Big, big booty. What you got a big booty. Shake that. Big, big booty. What you got a big booty. Big, big booty. What you?. The way she moves. I know you want her. She like the fire, get you right. That's the lightning in the thunder. You wanna meet her, you wanna touch her. Hold on tight for the ride. Cause you know you're gonna love her. All the sexy girls in the party. Go and grab a man. Bring him to the dancefloor. Go and light them jeans. Don't you worry you're dancing. It's his birthday. Give him what he ask for. Let me show you how to do it. Big, big booty. What you got a big booty. Work. Big, big booty. What you got a big booty. Shake that. Big, big booty. What you got a big booty. Big, big booty. What you?. [Pitbull]. Booty, booty, booty. Booty everywhere. Look at her booty, stop, stare. They love her booty. Hell yeah. The way she twerking, not fair. She got a booty, and a swollen thong. And if you do it better, do it dirty all night long. Booty, tooty, booty, you know the plan. So much booty, shakes us the plan to demand. I wanna take that big ol booty shopping at the mall. I wanna pick it up and put that booty in my car. Baby your booty is a movie star. Oscar award winning of them all. Now give me that. Mesmerize by the size of the. You can find it if you like take your time. I can guarantee you'll have the time of your life. Throw up your hands if you love a big booty. Big big big big big big booty. What you?. Big big big big big big booty. What you?. Big big big big big big. Let me show you how to do it. Work. Shake that. Go to work. Big, big booty. What you got a big booty. Big, big booty. What you got a big booty. Big, big booty. What you got a big booty. Big, big booty. What you got a big booty. Shake that"
brave,"It's a new day. New day. And it's evident. You must've been heaven sent. So we should be hesitant. But I'm not at all. Just feeling more confident. Just using my common sense. Just trusting that I'm loving it. I can't refuse an offer so benevolent. Can't assume he's gonna use me. And after him never call again. Don't be afraid. Don't be afraid. This is your day. This is your day. Chorus:. It's time to be brave. Say I'm not afraid. Not anymore. I used to be calm. Now the temperature's changed. It just ain't the same. I'm not afraid. I'm not afraid. 'Cause I've become brave. As the light of day. Straight into a cave. To show me the way. That I might be saved. Now I'm turning the page. Thanks to the power of love I can love. Because I am brave. (I am brave, I am brave, yeah, oh...). I heard him say. This thing movin' too fast for him. It's a feeling that I'm straddling. Foolishly adamant. But it's all in his eyes. Really wish he would let me in. 'Cause the same way you scared of him. He's scared of bein' hurt again. it's time to let go. Let go of your heart. It's time for a brand new start. Never know we might never part. Baby don't be afraid. Don't be afraid. This is your day. This is your day. Chorus:. It's time to be brave. Say I'm not afraid. Not anymore. I used to be calm. Now the temperature's changed. It just ain't the same. I'm not afraid. I'm not afraid. 'Cause I've become brave. As the light of day. Straight into a cave. To show me the way. That I might be saved. Now I'm turning the page. Thanks to the power of love I can love. Because I am brave. I wouldn't take back. Anything that I've gone through. I pray for strength. For anything that I'm gonna do. Whether it's joy or it's pain. I'm still okay. I'm gonna be alright. Because I'm not afraid. No I am brave!. Chorus:. Say I'm not afraid. Not anymore. I used to be calm. Now the temperature's changed. It just ain't the same. I'm not afraid. I'm not afraid. 'Cause I've become brave. As the light of day. Straight into a cave. To show me the way. That I might be saved. Now I'm turning the page. Thanks to the power of love I can love. Because I am brave. Yeah.... I am brave.. (Por Fernando Azevedo)"
can you see,"Some say that we should not be together,. And that I deserve so much better.. But they are just blind,. I would choose to be with you or simply die.. You would be blind to not see how I feel,. And that my love is strong and real.. Baby can you see,. How much you mean to meâ€¦. Can you see that I would die for you. Or are you just blind too?. Some people don't see very much,. But they can see I love your every touch.. Every now and thenâ€¦. I feel your touch upon my skin.. It sends chills down my spine,. I'm going to love you till the end of time.. Baby can you see,. How much you mean to meâ€¦. Can you see that I would die for you. Or are you just blind too?. Those who can see it all,. Can see that it is for you I'm going to fall.. You make me feel so happy, you make me smile.. You make my whole life worth while.. Sometimes baby we fight,. But its because I love you, and its going to be alright.. Baby can you see,. How much you mean to meâ€¦. Can you see that I would die for you. Or are you just blind too?"
cariño,"Baby, never have I ever wanted anyone. Like I want you babe. Come and, let me show you just how much I feel inside. I got so much love. Oh baby when I get near you, ooh. I can't control what I'm feeling, baby. I got so much love to give you. That I would probably want you all the time. (Coro:). (Carino, quedate conmigo carino). I gotta have your love. (Carino, quedate conmigo carino). Need to feel your touch. (Carino, quedate conmigo carino). Never get enough. (Carino, carino). I wish that I. Could spend all my days and nights wrapped in your arms. Spending time with you. 'Cause all I see in this world. Is me and you and no one else, ooh. I want you more and more. Oh baby please understand me. I think that you deserve me, oh yeah. Cause I'm the type that would give you. All the love and affection that you need. Repeat 1 (2x). Asi, un poquito mas suavecito. Ah, uh-uh asi es que me gusta. Ahora, ahora, eso!. Repeat 1"
charades,Break and you buy it. Nothing? s for free. Especially my body. Especially me. Break and you bought it. I pray that you don? t. Don? t do what all guys do. Do what all guys do. Just forgetting to be social. When you turn to dishonest. Think that running the streets worthy. That just turns months into weeks into days. I wanna be cordial. I? m just speaking your conscience. You want to take it but I won't give it away. Leave me and I? ll miss I never made. Try to play a game I never learned. No one ever wins at love charade. You think that you? re the only that ever say. You love me when it? s over. Break and you buy it. This one is on me. Don? t start away. Don? t cause a scene. Start up a fire. Pray that you don? t. Don? t do what all guys do. Do what all guys do. Just forgetting to be social. When you turn to dishonest. Think that running the streets worthy. That just turns months into weeks into days. I wanna be cordial. I? m just speaking your conscience. You want to take it but I won't give it away. Leave me and I? ll miss I never made. Try to play a game I never learned. No one ever wins at love charade. You think that you? re the only that ever say. You love me when it? s over. You shoulda took your time. Did it right when you had me baby. You shoulda took your time. Shoulda took your time. You shoulda took your time. Did it right when you had me baby. She was playing games all those love charades. You want to take it but I won't give it away. Leave me and I? ll miss I never made. Try to play a game I never learned. No one ever wins at love charade. You think that you? re the only that ever say. You love me when it? s over
charge me up,"Running out of juice. It?s a matter of seconds now. I?m shutting down. Desperate when I mo-ove. My battery is screaming loud. Im shutting down. Its an addiction. I I I want more more more. Give me some boom boom boom. Give me some oh oh oh. Keeps up my engine with a hundred thousand volts. Ignite the room room room. Im going loco loco loco. [Chorus]. Throw me down like lightning volts. Take control of my body every single bone. I come alive when you charge me up baby. Charge me up baby charge me up once and again. Im dancing in the danger zone. So wired up but I just want another dose. I come alive when you charge me up baby. Charge me up baby charge me up once and again. Ohhhh ohhhh ohhh charge me up once and again. Ohhhh ohhhh ohhhh charge me up once and again. . This is my disease my predatory instinct call. Im bout? to fall oh oh oh. Shock me fill me up. Proceed Ill give you all you want, im bout to fall. Its an addiction. I I I want more more more. Give me some boom boom boom. Give me some oh oh oh. Keeps up my engine with a hundred thousand volts. Ignite the room room room Im going loco loco loco. [Chorus]. Throw me down like lightning volts. Take control of my body every single bone. I come alive when you charge me up baby. Charge me up baby charge me up once and again. Im dancing in the danger zone. So wired up but I just want another dose. I come alive when you charge me up baby. Charge me up baby charge me up once and again. Ohhhh ohhhh ohhh charge me up once and again. Ohhhh ohhhh ohhhh charge me up once and again. [Bridge]. Running real low. I?m moving in slow mo. Charge me up ,shift me up, I need a reload. Running real low. I?m moving in slow mo. Charge me up ,shift me up, I need a reload. [Chorus]. Throw me down like lightning volts. Take control of my body every single bone. I come alive when you charge me up baby. Charge me up baby charge me up once and again. Im dancing in the danger zone. So wired up but I just want another dose. I come alive when you charge me up baby. Charge me up baby charge me up once and again. Ohhhh ohhhh ohhh charge me up once and again. Ohhhh ohhhh ohhhh charge me up once and again. . LeandroCesar12"
cherry pie,"Jennifer Lopez - Cherry Pie. Hey. Yeah you. You had a dark, sexy vibe about ya. And a strange way you turn me on. The way you look said a lot about ya. As if you really didn't give a-unh!. I told myself not to fall for you. 'Cause I can see that you don't follow rules. I should've just walked away. But your eyes were telling me to stay. Damn, why do the wild ones turn me on. [Chorus:]. It's like cherry pie, you can't deny it. Driving fast, you ought to try it. That's what it feels like. Letting touch you everywhere. Breaking rules and didn't care. That's what it feels like. A real rebel kinda fella. The kind that I would never trust. I could read what your mind was thinking. It's like you still didn't give a-hey!. It's funny how those kind of guys. Have a way of getting what they want. And even good girls though they try. It's if they just can't stay away. Damn, why do the wild ones turn me on. It's like cherry pie, you can't deny it. Driving fast, you ought to try it. That's what it feels like. Letting touch you everywhere. Breaking rules and didn't care. That's what it feels like. It's like cherry pie, you can't deny it. Driving fast, you ought to try it. That's what it feels like. Letting touch you everywhere. Breaking rules and didn't care. That's what it feels like. I can be your cherry pie. And you can be my cream on top. Come on!. I can be your cherry pie. And you can be my cream on top. . I can be your cherry pie. And you can be my cream on top. I can be your cherry pie. And you can be my cream on top. It's like cherry pie, you can't deny it. Driving fast, you ought to try it. That's what it feels like. Letting touch you everywhere. Breaking rules and didn't care. That's what it feels like"
come over,"Baby. I need to see you. Please. Come over. When you come to my room for a little game. to you, i'll do very erotic things. i wanna make love babe, very slowly. three times in a row, all night i'll go. CHORUS:. I love when you come over, please come over. and when you come it gives my feva'. Body next to mine, love dance, syncopated time. sugar rush keeps me high, sweet kiss on my thigh. I wanna make love babe very badly. feels good in the air, everytime you're here. CHORUS. Don't keep me waiting, anticipating love i am saving for you. Hear what I am saying, you I am craving. love is here waiting for you. all day you're staying, please no delaying. patiently waiting for you. Don't keep me waiting. no time for playing sitting here waiting for you. Come over. CHORUS until fade...."
control myself,"No me puedo controlar. Aqui con el Señor LL Cool J. Y aqui estoy... ya tu sabes. Uno, dos, tres, muevete!. [Jermaine Dupri:]. Ya'll know what this is...So...So...Def!. [Verse 1:]. [LL Cool J:]. The club was far from empty. It was crowded at the entry (Woo!). I slide right through like how I do. This girl began to tempt me (Uh-huh!). She said her name Shayeeda. I could tell her mama feed her (Yeah!). When they tight and thick them jeans don't fit. I'm L, nice to meet ya (Uh-oh!). I could feel my body yearning. The room just started turning. Didn't want to go out on the floor. but this girl was so determined. My brain began to sizzle. I'm sweatin' just a little. On the dance floor in the middle. She turned around and giggle. She said. [Chorus:]. [Jennifer Lopez:]. You got, you got, you got. what it takes to make me leave my man. [LL Cool J:]. It's hard to control myself (Aww!). It's hard to control myself. You got, you got, you got. What it takes to make this boy be bad (Be bad). It's hard to control myself. It's hard to control myself. [Jennifer Lopez:]. It's hard for me to control myself (Me too). and to hold myself back from jumpin' on ya. like I wanna, like I wanna, wanna. [Verse 2:]. [LL Cool J:]. Temptation is a mother. How we lust for one another (Yeah). We barely know each other. Yet we're waddling like we're lovers. The air is full of passion. The strobe lights are flashin'. The hustlers throw cashin'. The bartender keeps splashin'. Her moves were so erotic. Her gaze was so hypnotic. I begged this girl to stop it. But she continued to pop it. [Both:]. You know I know you like it. Let me hit you on your Sidekick. Because the afterparty is at my body. Meet me you're invited. [LL Cool J:]. She said. [Chorus:]. [Jennifer Lopez:]. You got, you got, you got. what it takes to make me leave my man. [LL Cool J:]. It's hard to control myself. It's hard to control myself. You got, you got, you got. What it takes to make this boy be bad (Be bad). It's hard to control myself. It's hard to control myself. [Jennifer Lopez:]. It's hard for me to control myself (Say what). and to hold myself back from jumpin' on ya. like I wanna, like I wanna, wanna. [Verse 3:]. [LL Cool J:]. She licked, off, her lip, gloss. Her hips, tossed, back, and forth. Side, to side, and up, and down. She touched, the ground, it turned, me out. I'm battling desire. Lord help me douse this fire. This internal inferno. Hotter than a shot of Cuervo. Her top was short and purple. Belly dancing in a circle. When I feel like this I can't resist. Stop it don't make me hurt you (make me hurt you). [Jermaine Dupri:]. She said. [Chorus:]. [Jennifer Lopez:]. You got, you got, you got. what it takes to make me leave my man. [LL Cool J:]. It's hard to control myself. It's hard to control myself (Oh). You got, you got, you got. What it takes to make this boy be bad (Be bad). It's hard to control myself. It's hard to control myself. [Jennifer Lopez:]. It's hard for me to control myself (Say what). and to hold myself back from jumpin' on ya. like I wanna, like I wanna, wanna. [LL Cool J:]. Zezeze.... [Both:]. Zezeze.... [Jermaine Dupri:]. Uh, yeah, I need everybody to report to the dance floor. Right...now!. [LL Cool J:]. Shake it, shake it, shake it. [Jermaine Dupri:]. Haha, you know what this is"
could this be love,"Ooh, Ooh,. Love makes no promises,. If you only knew,. What I've been going through,. Waiting and wanting you,. Could this be love,. How, tell me how will I know,. Will my heart make me believe it so,. Or can I trust the way I feel,. If you could read my mind,. You see how hard I've tried,. Still I can't decide,. Chorus:. If you only knew,. What I've been going through,. Waiting and wanting you,. Could this be love,. Oh, tell me could this be love,. Do you know if it's true,. That real love lasts a life time,. Does it shine like the stars up in the sky,. And do you know if you can fall for,. Just a moment,. Is a moment for all time,. Why, why am I so unsure,. Is that love knocking at my door,. Or the sound of my beating heart,. If you could read my mind,. You know I just can't hide,. What I feel inside,. (CHORUS). Could this be love,. Could this be love,. I wanna know,. If you only knew."
countdown,"Top to bottom. Now it's perfection. Now he (he he). Fits my description. Swag delicion, most specticious(?). How he g-g-g-g-get them. And I want him (gotta have him). Countdown baby, Imma get it. Gonna take off when I hear start start. Run the red light, when we lock eyes, I.... Gonna go down, when I countdown. He already know, ready set go go go go. (Chorus:). 10 I was bout to leave,. 9 But you're right on time. 8 Baby please don't wait,. 7, 6, 5,. 5 He came through the door,. 4 And then crossed the floor,. 3 Eyes on me,. 2 This is what he said, you're the 1(1)1(1). Baby you're the 1 you're the 1(1)1(1). This is what he said, you're the 1(1)1(1). Baby you're the 1 you're the 1(1)1(1). This is what he said. Gotta love him, he got it wired. Now He (He He), Starting up my fire(?). off the meter, overloaded. And I Know. He Want And He Like it (Gotta have it). Countdown Babym He Gon' Get It. Gonna take off when I hear start-start. Run the red light, when we lock eyes, I.... Gonna go down, when I countdown. He already know, ready set go go go go. (Chorus:). 10 I was bout to leave,. 9 But your right on time. 8 Baby please don't wait,. 7, 6, 5,. 5 He came through the door,. 4 And then crossed the floor,. 3 Eyes on me,. 2 This is what he said, you're the 1(1)1(1). Baby you're the 1 you're the 1(1)1(1). This is what he said, you're the 1(1)1(1). Baby you're the 1 you're the 1(1)1(1). This is what he said. On your mark.... (He said I'm ready, I'm ready) Let's go..... (?). 10 to 1 Cause I'm the one, so let 'em know.... The one is me baby and you're the one for meeee. (Chorus)"
dance again (feat. pitbull),"Dance, yes, love, next. Dance, yes, love, next. Shimmy, shimmy, yah. Shimmy, yam. Shimmy, yay. I'm a ol' dirty dog all day. No way, José. Your girl only go one way. ¡Ay, mi madre!. You should check that out. Maybe you ain't turn her out. Maybe it's none of my business. But for now work it out. Let's get this. Nobody knows what I'm feeling inside. I find it so stupid, so why should I hide. That I love to make love to you, baby. (Yeah, make love tonight). So many ways wanna touch you tonight. I'm a big girl, got no secrets this time. Yeah, I love to make love to you, baby. (Yeah, make love tonight). If this would be a perfect world. We'd be together then. (Let's do it, do it, do it). Only got just one life, this I've learned. Who cares what they're gonna say. (Let's do it, do it, do it). I wanna dance. And love. And dance. Again. I wanna dance. And love. And dance. Again. Dance, yes, love, next. Dance, yes, love, next. Baby, your fire is lighting me up. The way that you move, boy,. Is reason enough. That I love to make love to you, baby. (Yeah, make love tonight). I can't behave, oh, I want you so much. Your lips taste like heaven. So why should I stop?. Yeah, I love to make love to you, baby. (Yeah, make love tonight). If this would be a perfect world. We'd be together then. (Let's do it, do it, do it). Only got just one life, this I've learned. Who cares what they're gonna say. (Let's do it, do it, do it). I wanna dance. And love. And dance. Again. I wanna dance. And love. And dance. Again. Mr. Worldwide and the world's most beautiful woman. Modern day Hugh Hef (uh, yes). Playboy to the death (uh, yes). Is he really worldwide? (Uh, yes!). Mami, let me open your treasure chest. Play dates, we play mates. I'm the king at snatching queens. Check mate. What you think?. It's a rumour. I'm really out of this world. Moon, luna. Make women comfortable, call me bloomer. Can't even show love, cause they'll sue ya. But I told them ""Hallelujah, have a blessed day"". So ahead of myself. Everyday's yesterday. Want the recipe?. It's real simple, little bit of voli. And she'll open sesame. Now, dance, yes, love, next. Dance, yes, love, next. If this would be a perfect world. We'd be together then. (Let's do it, do it, do it). Only got just one life, this I've learned. Who cares what they're gonna say. (Let's do it, do it, do it). I wanna dance. And love. And dance. Again. I wanna dance. And love. And dance. Again"
dance with me,"Too much is on your mind. Gotta let it go. Can't worry all the time just let it flow. You say you need a break there's nothing i can do. Sitting here listening to you. Baby what's this you teel me. Things ain't been goin'your way. Just take it form me its gonna be alright. So let's go out tonight and we can leave all our cares behind. Chorus. Dance the night away party 'till the sun comes up. Go grab a friend get on the floor. Come on and dance, dance, dance with me dj if you please. Nobody's on the wall that's what i like. Come closer to me now and hold me tight. Tell me just how you're feeling right now. Are you really havi'n a good time. Baby what's this you teel me. Things ain't been goin'your way. Just take it form me its gonna be alright. So let's go out tonight and we can leave all our cares behind. Chorus. Up in the club out on the floor. Move to the beat dancin' with me. Dj, dj play my music dance the night away. Chorus 2x"
dear ben,"I just can't control myself. Can't be with no one else. It seems I'm addicted to the way. you like to touch me. I don't think they understand. Why I love at your command. From the words you speak so deep. Our bodies meet, I have to have you.... Chorus. I love you... you're perfect. A manifestation of my dreams. You make my...body feel. About a million different things.... I think God made you for me. A mix of passionate and fidelity. Baby you're so complete. I write this song to let you know. That you will always be. To me, my lust, my love, my man,. my child, my friend. and my king...(my king). I love you... you're perfect. A manifestation of my dreams. You make my...body feel. About a million different things.... There's no way. I'd leave you. It's just not a reality. Sometimes I.... Feel like I'm.... Livin' in a fantasy..."
