love in the milky way,"She's a girl with many quirky ways. She can take you to another place. Where she'll explore you and adore you in her way. She won't give you time to hesitate. What she looks for is to fascinate. To unveil you and derail you,. Come what may, come what may. She'll give you love in the milky way (love in the. milkyway). She'll give you love in the milky way. What you want she'll give you. She has bought a place in Budapest. And the clientele are her hostess. But when she's smiling she's beguiling. So they say what you want, what you need. She'll give you love in the milky way (love in the. milky way). What you want she'll give you. Love in the milky way (love in the milky way). She'll give you. So they say what you want. Yeah they say what do you need. Come what may, what you want, come what may. She'll give you love in the milky way (love in the. milky way). What you want - she'll give you. Love in the milkyway (love in the milkyway). She'll give you love in the milky way (love in the. milky way). What you want - she'll give you love in the milkyway. (love in the milky way). What you want she'll give you..."
love to love you,"I would love to love you like you do me. I'd love to love you like you do me. There's a pillar in my way you see. I'd love to love you like you do me. I met you on a sunny Autumn day. You instantly attracted me when asking for the way. God if I had known the pain I'd make you feel. I would have stopped this start of us, and turned upon my heel. Go you should leave me. Time make it be alright. Go you must leave me. Time will help you see the light. You don't need me. Time make it be alright. Go you must leave me. Believe me when I tell you... (Chorus). You recognised my barrier to love. I know there's nothing worse than unrequited love (unrequited love). So I prayed to God that I could give the love you gave to me. But something's lying in my way, preventing it to be. Go you should leave me. Time make it be alright. Go you must leave me. Believe me when I tell you. (Chorus). (Chorus). Break those pillars down. Break those pillars down. Take those pillars down, down, down. Oh, take those pillars down. (Love to love you like you do me). Break those pillars down. (Love to love you like you do me). Oh take those pillars down. (Love to love you). (Love to love you). (Love to love you). Take those pillars down. (Love to love you)"
make you mine,"Wondering, waiting for the day to fade away. So I can hold you. Once again and chase the fears away. Lie with me. Show me how you feel. I'm falling for you deeper everyday. But when the night turns over. I'll lie with you. When the morning wakes you. I'm there by you. When the daylight takes you. I'll miss you. 'Til you come back home to me. When I can make you mine, oh mine ... oh yeah. Wanting you. Every waking moment I'm on fire [I'm on fire / I'm on fire]. Always needing you. I'm aching for you only, I'll never tire. Promise me. This is how we'll be. I'm falling deeper everyday. But when the night turns over. I lie with you. When the morning wakes you. I'm there by you. When the daylight takes you. I'll miss you. 'Til you come back home to me. When you come back home to me. I'll break you. I'll chase you. You'll find that you can't stand to be away. not for a day [not for a day]. And when life defies you. I'll be the soul you'll never go astray. And you'll be mine iiine, mine, mine, mine. [Fly with me, loose reality]. I'm falling deeper everyday. So when the night turns over. I'll lie with you. When the morning wakes you. I'm there for you. When the daylight takes you. I'll miss you. 'Til you come back home to me. And I can make you mine. When the night turns over. I'll lie with you. When the morning wakes you. I'm there by you. When the daylight takes you. I'll miss you. 'Til you come back home to me. And I can make you mine, oh mine... oh mine... oh mine"
miracle,"You let an open window. breathe over your bed. A whisper in the moonlight. The miracle of life. Synchronized emotion. No battle left to fight. Harmony in motion. The miracle of life. And oh precious and lonely you are. Cherish as only you are. Not born but already. Changing our world. Beautiful girl. (You're a beautiful, wonderful miracle). Beautiful boy. (You're a beautiful, wonderful miracle). I want for you the ocean. Filled deep with all your dreams. No feeling left unopened. The miracle of life. And oh how precious and lovely you are. Cherished as only you are. Not born but already changin our world. Beautiful boy. (You're a beautiful, wonderful miracle). Beautiful girl. (You're a beautiful, wonderful miracle). Na na na, na, na, na.... And oh so precious and lovely you are. Cherished as only you are. Not born but already changing our world. (already changing our X3). Beautiful girl. (You're a beautiful, wonderful miracle). Beautiful boy. (You're a beautiful, wonderful miracle). And when it comes to loving. We´ll give you all we got. Begining at the botton. We´ll never gonna stop. little world. (you´re a beautiful, wonderful miracle). Oh, yeah, beautiful wonderful yeah. fade out"
moorlough shore,"Your hills and dales and flowery vales. That lie near the Moorlough Shore.. Your vines that blow by Borden's grove.. Will I ever see you more. Where the primrose glows. And the violet grows. Where the trout and salmon play.. With my line and hook delight I took. To spend my youthful days.. Last night I went to see my love,. And to hear what she might say.. To see if she'd take pity on me,. Lest I might go away.. She said, ""I loved an Irish lad,. And he was my only joy,. And ever since I saw his face. I have loved that soldier boy."". Perhaps your soldier lad is lost. Sailing over the sea of Maine.. Or perhaps he's gone with some other one. You may never see him again.. Well if my Irish lad is lost,. He's the one I do adore,. And seven years I'll wait for him. By the banks of the Moorlough Shore."
my lagan love,"Where Lagan stream sing lullaby. There blows a lily fair. When twilight gleam is in her eyes. The night is on her hair. And like a love - sick lenanshee. She hath my heart in thrall. No life have I, no liberty. With love is lord of all. And sometimes when the beetles horn. Hath lulled the eve to sleep. I steal unto her shieling low. And through her dooreen peep. There on the cricket's singing stone. She stirs the bog wood fire. And hums in soft sweet undertones. The song of heart's desire. Her welcome like her love for me. Is from her heart within. Her warm kiss is felicity. That knows no taint of sin"
nightwish,"Oh, setting Sun,. Thy red rays maketh me cry.. They remind me of the one. Whose love awaits me in the sky.. A bridal bed awaits us both. After the landscape of death I cross.. Before my sorrows I must die,. Nightwish I send through the starlit sky.. The voice of nightly winds has awakened me,. Amidst all the grief they embrace me with relief.. Beneath my dreams and wishes. I long for thy caresses.. A bridal bed awaits us both,. After the landscape of death I cross.. Before my sorrows I must die,. Nightwish I send through the starlit sky.. ""Passed away in silence. The flute from the realm unseen. Empties its heart. Making love to me. With its enchanting melody.. Light of Orion,. Shadow of Andromeda,. Call of the dancing Universe.. Their love I must enter. Before thou can blame my soul. That is peace"""
no frontiers,"If life is a river and your heart is a boat. And just like a water baby, baby, born to float,. And if life is a wild wind that blows way on high,. And your heart is Amelia dying to fly,. Heaven knows no frontiers and I've seen heaven in your eyes. And if life is a bar room in which we must wait,. 'round the man with his fingers on the ivory gates,. Where we sing until dawn of our fears and our fates,. And we stack all the dead men in self addressed crates,. In your eyes faint as the singing of a lark,. That somehow this black night,. Feels warmer for the spark,. Warmer for the spark,. To hold us 'til the day,. When fear will lose its grip,. And heaven has its way,. Heaven knows no frontiers,. And I've seen heaven in your eyes. If your life is a rough bed of brambles and nails,. And your spirit's a slave to man's whips and man's jails,. Where you thirst and you hunger for justice and right,. And your heart is a pure flame of man's constant night,. In your eyes faint as the singing of a lark,. That somehow this black night,. Feels warmer for the spark,. Warmer for the spark,. To hold us 'til the day when fear will lose its grip,. And heaven has its way,. And heaven has its way,. When all will harmonise,. And know what's in our hearts,. The dream will realise. Heaven knows no frontiers,. And I've seen heaven in your eyes,. Heaven knows no frontiers,. And I've seen heaven in your eyes."
no go baby,"Walk on by my fruitless market. Hills and hips and heartache. Tear stains kiss my swollen belly. Angel echo there. But it's fading. I am wasteful. I still feel you. No go baby. I still want you. No go baby. Spring clean your room. When I am asleep. Light, house coats and vacuums. Put me back all spick and span. Brand new. Like you weren't there. Yes, I'm brand new. New born virgin. I still feel you. No go baby. I still want you. No go baby. I'm so sorry. No go baby. I won't hold you. No go baby. I wrote this song long time ago. Before you ever were. About another little soul. Who never made it here"
no good for me,"I see a home in a quiet place. I see myself in a strong embrace. And I feel protection from the human race. It's not parental. But it's a fantasy, not a reality. And it's no good, no, no good for me, you have no idea. That I'm walking through the clouds. When you're looking at me. I'm feeling like a child. Vulnerability. I am shaking like a leaf if you move beside me. And you're all that I see. But it's no good for me. You have a home You have a home, in a quiet place?. And someone else feels your strong embrace. She is protected and she needs no chase. And do you love her?. You're a mystery, you are the heart of intrigue. You're no good no no good for me. You have no idea. That I'm walking through the clouds. When you're looking at me. I'm feeling like a child. Vulnerability. I am shaking like a leaf if you move beside me. And you're all that I see. But it's no good for me. No it's no good for me, no good for me. It's a make-believe, you have no idea. That I'm walking through the clouds. When you're looking at me. I'm feeling like a child. Vulnerability. I am shaking like a leaf if you move close to me. And you're all that I see. But it's no good for me. Through the clouds. When you're looking at me. I'm feeling like a child. Vulnerability. I am shaking like a leaf if you move beside to me. And you're all that I see. But it's no good for me. Fade Out"
no more cry,"I wanna feel just like before. Before the rain came in my door. Shook me up. Turned me round and made me cry till I would drown. Stole the daylight. Brought the night so much anger I would fight. Bust my youth into the blue. Saw all the loneliness in you. Wanna help you. Give you love. Shine some light up in the mud. Fill the empty. Find a rhyme. A brighter day. A better time. But I'm wondering where I'm gone can't find the truth within my song. All I have I'll give to you. To let you know you're not alone. I'm telling you. Smiling for you only. I'm trying for you solely. I'm praying for you only. No more cry. No more cry. I wanna hear you laugh again. It's not the ache to bring you down. No we'll never be the same. If only I could take your pain. If it's true what people say. There is still beauty in each day. We'll find comfort in her strength. And one day soon we'll meet again. I'm telling you. Smiling for you only. I'm trying for you solely. I'm praying for you only. No more cry. No more cry. I'm singing for you only. I ready for you only. I'm praying for you only. No more cry. No more cry. Reach out for your love. Shout out for your love. Listen for your love. Believe in her love. I'm telling you. I'm telling you. Fighting for you only. I'm trying for you only. No more cry. No more cry. I'm singing for you only. I worry for you only. But its you saves me from lonely. No more cry. No more cry. No, no more cry. No more cry. No more cry"
nobody knows,"i was on a street. with a common name. i prayed for love. yeah i even begged. i had a vision of you. that carried me through. now it's just magic worlds. in a shaman's dream. i fear no man, i fear no pain. i had a vision of you. that carried me through. and nobody really knows what i would do for you. nobody really knows how much i love you. nobody really knows, nobody knows. nobody knows, nobody knows. i cleared my mind. and i turned around. grateful to the one. who had laid me down. i was silent in love. pourin down from above. like so much rain it fell. and pierced my brains. the trees all alive with their colors. like the dreams of man. i had a vision of you. that carried me through. and nobody really knows what i would do for you now. nobody really knows how much i love you baby. nobody really knows, nobody knows. nobody knows, nobody knows."
ok,"i am not ok. with this tv in my face. and liar after liar. with nothin' bout nothin' higher. i am on the outside. peerin' in to your world. and all the boys and girls are singin'. save me, save me from the one who only rapes me. take away my tv. don't want your fuckin' recipe. it's all decay decay decaynot today today today. take away my tv. don't want your fuckin' therapy. it's all decay decay decay. not today, not today. it's our world and i'm on fire. with anger and desire. not the kind that they feed to me. with their emptiness and greed greed greed. i don't give a fuck what you say about me. everything you are is just a tool to me. so just set up the mic and let me do my thing. in the consciousness of each and every sentient being. rainin' down like a thunderstorm into your mind. maybe not the first, the second, or even the third time. but eventually, you won't be able to put me down. you'll be havin' me with breakfast in your coffee grounds."
old town,The girl's a fool. She broke the rule. She hurt him hard. This time he will break down. She's lost his trust. And so she must. Now all is lost. The system has broke down. Romance has broke down. This boy is crackin' up. This boy has broken down. This boy is crackin' up. This boy has broke down. She plays it hard. She plays it tough. But that’s enough. The love is over. She's broke his heart and that is rough. But in the end he'll soon recover. The romance is over. This boy is crackin' up. This boy has broken down. This boy is crackin' up. This boy has broke down. Ola. [Solo]. This boy is crackin' up. This boy has broken down. This boy is crackin' up. This boy has broke down. I've been spending my money. In the old town. It's not the same honey. With you not around. I've been spending my time. In the old town. I sure miss you honey. Now you're not around. You're not around. This old town. Ola. This boy is crackin' up. This boy has broken down. Yeah yeah. This boy is crackin' up. This boy has broke down. This boy is crackin' up crackin up. This boy has broken down. Yeah yeah. This boy is crackin' up. This boy has broke down. This boy has broken down. This boy has broke down
on my father's wings,If you were with me now. I'd find myself in you. If you were with me now. You're the only one who knew. All the things we planned to do. I want to live my life. The way you said I would. With courage as my light. Fighting for what's right. Like you made me believe I could. And I will fly on my father's wings. To places I have never been. There is so much I've never seen. And I can feel his heartbeat still. And I will do great things. On my father's wings. This world I'll never see. My dreams that just won't be. This horse's stride. with one days ride. Will have covered more. distance than me. But I will fly on my father's wings. To places I have never been. There is so much I've never seen. And I can feel his heartbeat still. And I will do great things. On my father's wings. Someday with his spirit to guide me. And his memory beside me. I will be free to. Fly on my father's wings. To places I have never been. There is so much I've never seen. And I can feel his heartbeat still. And I will do great things. On my father's wings. On my father's wings.
on your own,"Oh, oh, goodnight hush now baby, go to sleep. I've read your bedtime story, kissed your cheek. And just like Humpty Dumpty, yeah, the damage is deep. I've taken a tumble but now I roll to my feet. Oh, baby I'm sure, 'cause. Oh, I have such clarity, I'm flying above. You've lost all control, what are you gonna do now?. You're on your own, yes you are. You're on your own, yes you are. Goodbye sugar sweetness, love so deep. This game is truly over, time to weep. Oh, Baby I'm true, 'cause. Oh, I have such clarity, I'm flying above. You've lost all control, what are you gonna do now?. You're on your own, baby, yes you are. You're on your own, yes you are. Oh, I have such clarity, I'm flying above. I've lost all control, what are you gonna do now?. You're on your own, baby, yes you are. You're on your own, yes you are, yeah...."
one night,"Long day and I'm ready, I'm waiting for your call. 'Cos I've made up my mind. My heart aches with a hunger and the want that you were mine. No I cannot deny. So for one night - is it alright. That I give you. My heart - my love - my heart. Just for one night. My body - my soul. Just for one night. My love - my love. For one night - one night - one night. When morning awakes me. Well I know I'll be alone. And I feel I'll be fine. So don't you worry about me. I'm not empty on my own. For inside I'm alive. That for one night - it was so right. That I gave you. My heart - my love - my heart. Just for one night. My body - my soul. Just for one night. My love - I loved. For one night - one night - one night. For one night - it was so right. That I gave you. My heart - my love - my heart. Just for one night. My body - my soul. Just for one night. My love - my love. For one night - one night - one night. One night"
only love can break your heart,"When you were young and on your own. How did it feel to be alone. I was always thinking of games that I was playing. Tryin' to make best of my time. But only love can break your heart. Try to be sure right from the start. Yes, only love can break your heart. What if your world should fall apart. I have a friend I've never seen. He hides his head inside a dream. Someone should call him and see can come out. Try to lose the down that he's found. But only love can break your heart. Try to be sure right from the start. Yes, only love can break your heart. What if your world should fall apart. I have a friend I've never seen. He hides his head inside a dream. But only love can break your heart. Try to be sure right from the start. Yes, only love can break your heart. What if your world should fall apart. fall apart."
only when i sleep,"You're only just a dreamboat. Sailing in my head. You swim my secret oceans. Of coral blue and red. Your smell is incense burning. Your touch is silken yet. It reaches through my skin. Moving from within. Clutches at my breast. CHORUS:. But it's only when I sleep. See you in my dreams. Got me spinning round and round. Turning upside down. But I only hear you breathe. Somewhere in my sleep. Got me spinning round and round. Turning upside down. (Only when I sleep). When I wake up from slumber. Your shadows disappeared. Your breath is just a sea mist. Surrounding my body. I'm working through the day time. But when it's time to rest. I'm lying in my bed. Listening to my breath. Falling from the edge. It's only when i sleep. yeah, yeah, yeah, yeah.... It's only when i sleep. Until the sky. Where the angels fly. I'll never die. Higly dangerous. It's reaches through my skin. Moving from the within. Clutches at my breast. But it's only when I sleep. See you in my dream. Got me spinning round and round. Turning upside down. But i only hear you breathe. In the bed I lie. No needs to cry. My sleep crying. Higly dangerous"
overcome,even now. the world is bleedin'. but feelin' just fine. all numb in our castle. where we're always free to choose. never free enough to find. i wish somethin' would break. cuz we're runnin' out of time. and i am overcome. i am overcome. holy water in my lungs. i am overcome. these women in the street pullin' out their hair. my master's in the yard. givin' light to the unaware. this plastic little place. is just a step amongst the stairs. and i am overcome. i am overcome baby. holy water in my lungs. i am overcome. so drive me out. out to that open field. turn the ignition off. and spin around. your help is here. but i'm parked in this open space. blockin' the gates of love. i am overcome. i am overcome. holy water in my lungs. i am overcome. beautiful drowning. this beautiful drowning. this holy water. this holy water is in my lungs. and i am overcome. i am overcome. i am overcome. i am overcome.
peggy gordon,"O Peggy Gordon, You are my darling. Come sit you down upon my knee. And tell to me the very reason. Why I am slighted so by thee. I'm so in love that I can't deny it. My heart lies smothered in my breast. But it's not for you to let the world know it. A troubled mind can know no rest. I put my head to a glass of brandy. It was my fancy, I do declare. For when I'm drinking, I'm always thinking. And wishing Peggy Gordon was here. I wish I was in some lonesome valley. Where womankind cannot be found. Where little birds sing upon the branches. And every moment has a different sound. O Peggy Gordon, You are my darling. Come sit you down upon my knee. And tell to me the very reason"
people like you,"in a dream i had. you were standin all alone. with a dyin' world below. and a microphone. singin' hallejuhah. i finally broke their mold. whatever its gonna take. good luck, keep it real. where (are) the boys in LIVE?. they're pissin' in the mainstream. open up your cage. focus all your rage. the world needs people like you. in a dream i had. i was on a stage with queen. michael stipe and elton john. bono and springsteen. singin hallejuhah, rock and roll is king. whatever its gonna take. good luck, keep it real. where (are) the boys in LIVE?. they're pissin' in the mainstream. open up your cage. focus all your rage. the world needs people like you. people like you!. people like you!. motherfuckers like you!. people like you!. in a dream i had. you were standin all alone. with a dyin' world below. and a microphone. singin' hallejuhah. i finally broke their mold. whatever its gonna take. good luck, keep it real. where (are) the boys in LIVE?. they're pissin' in the mainstream. open up your cage. focus all your rage. the world needs people like you. . people like you."
queen of hollywood,She drove a long way through the night. From an urban neighborhood. She left her mother in a fight. For a dream misunderstood. And her friends they talk on corners. They could never comprehend. But there was always something different. In the way she held a stare. And the pictures that she painted. Were of glamour and of flair. And her boyfriend though he loved her. Knew he couldn't quite fulfill. He could never meet her there. She's never gonna be like the one before. She read it in her stars that there's something more. No matter what it takes no matter how she breaks. She'll be the Queen of Hollywood. And the cynics they will wonder. What's the difference with this dream. And the dreams of countless others. All they believe in TV. They see their handprints in a sidewalk. Flashing cameras on the scene. And a shining limousine. She's never gonna be like the one before. She read it in her stars that there's something more. No matter what it takes no matter how she breaks. She'll be the Queen of Hollywood. She's believing in a dream. Queen of Hollywood It's a loaded fantasy. Now her mother collects cut-outs. And the pictures make her smile. But if she saw behind the curtains. It could only make her cry. She's got hand prints on her body. Sad moonbeams in her eyes. not so innocent a child. She's never gonna be like the one before. She read it in her stars that there's something more. No matter what it takes no matter how she breaks. She'll be the Queen of Hollywood. Queen of Hollywood. No she's never gonna be like the one before. She read it in her stars that there's something more. No matter what it takes and even though she breaks. She'll be the Queen of Hollywood. She's the Queen of Hollywood and. Her friends still talk On Corners. She's the Queen of Hollywood
