dreams,"Now here you go again, you say you want your freedom. Well who am I to keep you down. It's only right that you should play the way you feel it. But listen carefully to the sound. Of your loneliness.... Like a heartbeat drives you mad. In the stillness of remembering what you had. And what you lost. [Refrain]. Thunder only happens when it's raining. Players only love you when they're playing. yeh, women they will come and they will go. When the rain washes you clean you'll know, you'll know. Now here I go again, I see the crystal visions. I keep my visions to myself. It's only me who wants to wrap around your dreams and. Have you any dreams you'd like to sell. Dreams of loneliness.... Like a heartbeat drives you mad. In the stillness of remembering what you had. And what you lost. Thunder only happens when it's raining. Players only love you when they're playing. yeh, women they will come and they will go. When the rain washes you clean you'll know, you'll know. Thunder only happens when it's raining. Players only love you when they're playing. yeh, women they will come and they will go. When the rain washes you clean you'll know, you'll know. You'll know, whoa-o-oa, you'll know"
only when i sleep,"You're only just a dreamboat. Sailing in my head. You swim my secret oceans. Of coral blue and red. Your smell is incense burning. Your touch is silken yet. It reaches through my skin. Moving from within. Clutches at my breast. CHORUS:. But it's only when I sleep. See you in my dreams. Got me spinning round and round. Turning upside down. But I only hear you breathe. Somewhere in my sleep. Got me spinning round and round. Turning upside down. (Only when I sleep). When I wake up from slumber. Your shadows disappeared. Your breath is just a sea mist. Surrounding my body. I'm working through the day time. But when it's time to rest. I'm lying in my bed. Listening to my breath. Falling from the edge. It's only when i sleep. yeah, yeah, yeah, yeah.... It's only when i sleep. Until the sky. Where the angels fly. I'll never die. Higly dangerous. It's reaches through my skin. Moving from the within. Clutches at my breast. But it's only when I sleep. See you in my dream. Got me spinning round and round. Turning upside down. But i only hear you breathe. In the bed I lie. No needs to cry. My sleep crying. Higly dangerous"
runaway,"Say it's true. There's nothing like me and you. I'm not alone. Tell me you feel it too. And I would runaway. I would runaway, yeah yeah. I would runaway. I would runaway with you. Because I, I'm fallin' in love with you. No, never, I'm never gonna stop. Falling in love with you. Close the door. Lay down upon the floor. And by candlelight. Make love to me through the night. 'Cause I have runaway. I have runaway, yeah yeah. I have runaway, runaway,. I have runaway with you. Because I, I'm fallin' in love with you. No, never, I'm never gonna stop. Falling in love with you. With you, my love. With you. And I would runaway. I would runaway, yeah yeah. I would runaway. I would runaway with you. Because I, I'm fallin' in love with you. No, never, I'm never gonna stop. Falling in love with you. I'm fallin' in love with you. No, never, I'm never gonna stop. Falling in love with you. Runaway yeah,runaway yeah. Runaway, runaway,runaway, runaway. runaway yeah,runaway yeah,. Runaway, runaway, runaway yeah.... With... you..."
radio,"It´s late at night, and i´m feeling down. There's couples standing in the street. Sharing summer kisses and silly sounds. So I step inside, pour a glass of wine. With a full glass and empty heart. I search for something to occupy my mind. But you are in my head. Swimming forever in my head. Tangled in my dreams. Swimming forever. (chorus). So I listen to the radio (listen to the radio). And all the songs we used to know. (listen to them). So I listen to the radio (listen to the radio). Remember where we used to go. Now it´s morning light, and it´s cold outside. Caught up in a distant dream. I turn and think that you are by my side. So I leave my bed and I try to dress. Wondering why my mind plays tricks. And fools me into thinking you are there. But you´re still in my head. Swimming forever in my head. Not lying in my bed. Just swimming forever. Repeat chorus (2x). You are in my head. Swimming forever. Repeat chorus. (listen to them) I listen to the radio. And all the songs we used to know. I listen to the radio (listen to the radio). To all the songs we used to know. I listen to the radio (listen to the radio). To all songs, all the songs we used to know hey. (listen to the radio, listen to them). All the songs we used to know. (listen to the radio, listen to them). Yeah yeah. (listen to the radio, listen to them). Yeah. (listen to the radio)"
at your side,"When the daylight's gone. And you're on your own. And you need a friend. Just to be around. I will comfort you. I will take your hand. And I'll pull you through. I will understand. And you know that.... I'll be at your side. There's no need to worry. Together we'll survive. Through the haste and hurry. I'll be at your side. When you feel like you're alone. And you've nowhere to turn. I'll be at your side. If life's standing still. And your soul's confused. And you cannot find. What road to choose. If you make mistakes (make mistakes). You can't let me down (let me down). I will still believe (still believe). I won't turn around. And you know that.... I'll be at your side. There's no need to worry. Together we'll survive. Through the haste and hurry. I'll be at your side. If you feel like you're alone (feel like you...). And you've nowhere to turn. (Side...). I'll be at your side. (I'll be, I'll be at your side). I'll be at your side. (I'll be, I'll be at your side). (I'll be at your side). I'll be at your side. There's no need to worry. Together we'll survive. Through the haste and hurry. I'll be at your side. If you feel like you're alone (feel like you...). You've got someone to go (somewhere to go...). 'Cos I'm at your side"
what can i do,"I haven't slept at all in days. It's been so long since we have talked. And I have been here many times. I just don't know what i'm doing wrong. Chorus:. What can I do to make you love me?. What can I do to make you care?. What can I say to make you feel this?. What can I do to get you there?. There's only so much I can take. And i just got to let it go. And who knows I might feel better. If I don't try and I don't hope. (Chorus). No more waiting, no more aching,. No more fighting, no more trying.... Maybe there's nothing more to say. And in a funny way I'm calm. Because the power is not mine. I'm just gonna let it fly. (chorus). Love me..."
everybody hurts,"When your day is long ... and the night. The night is yours alone. When you think you've had enough... of this life, well hang on.. Don't let yourself go. Cause everybody cries. And everybody hurts... sometimes.. Sometimes everything is wrong.. Now it's time to sing along.. When your day is night alone (hold on, hold on). If you feel like letting go (hold on). When you're sure you've had too much... of this life, well hang on.. Cause everybody hurts... sometimes. Take comfort in your friends. Everybody hurts.. Don't blow your hand. Oh, no.. Don't blow your hand.. If you feel like you're alone, no, no, no, you're not alone. If you're on your own... in this life,. The days and nights are long. When you sure you've had too much ... of this life, to hang on.. Well, everybody hurts sometimes, everybody cries.. Sometimes. And everybody hurts ... sometimes.. And everybody hurts sometimes. So, hold on, hold on.. Hold on, hold on. Hold on, hold on. Hold on, hold on.. (repeat & fade) (Everybody hurts. You are not alone.)"
breathless,"The daylight's fading slowly. But time with you is standing still. I'm waiting for you only. The slightest touch and I feel weak. I cannot lie. From you I cannot hide. I'm losing the will to try. Can't hide it, can't fight it. Chorus:. So go on,go on. Come on and leave me breathless. Tempt me, tease me. Until I can't deny this. Lovin' feeling. Make me long for your kiss. Go on,go on. Yeah, come on. And if there's no tomorrow. And all we have is here and now. I'm happy just to have you. You're all the love I need somehow. It's like a dream. Although I'm not asleep. I never want to wake up. Don't lose it, don't leave it. Chorus:. So go on,go on. Come on, leave me breathless. Tempt me, tease me. Until I can't deny this. Lovin' feeling. Make me long for your kiss. Go on,go on. Yeah, come on. And I can't lie. From you I cannot hide. I've lost the will to try. Can't hide it, can't fight it. Chorus:. So go on,go on. Come on, leave me breathless. Tempt me, tease me. Until I can't deny this. Lovin' feeling. Make me long for your kiss. Go on, go on. Come on, leave me breathless. Go on, go on. Come on, leave me breathless. Go on, go on. Come on, leave me breathless. Go on, go on"
so young,"Yeah, yeah, yeah, yeah, yeah. We are taking it easy, bright and breezy, yeah. We are livin' it up just fine and dandy, yeah. We are caught in a haze on these lazy summer days. Spending all of our nights just laughing and kissing, yeah. And it really doesn't matter that we don't eat. And it really doesn't matter if we never sleep. No it really doesn't matter, really doesn't matter at all. Cause we are so young now, we are so young, so young now. And when tomorrow comes we can do it all again. We are chasin the moon just runnin wild and free. We are following through every dream and every need. And it really doesn't matter if we don't eat. And it really doesn't matter that we get no sleep. No it really doesn't matter, really doesn't matter at all. Cause we are so young now, we are so young, so young now. And when tomorrow comes we'll just do it all again. Yeah we are so young now, we are so young, so young now. And when tomorrow comes, we can do it all again. Yeah we are so young now, we are so young now. And when tomorrow comes, we'll just do it all again. All again, all again, yeah, all again, all again. Yeah, yeah, yeah, so young now, we are so young, so young now. And when tomorrow comes we'll just do it all again. Yeah we are so young now, we are so young, so young now. And when tomorrow comes we'll just do it all again. We are so young, yeah, yeah, . (repeat till fade)"
long night,"It doesn't really matter now you're gone. You never were around that much to speak of. Didn't think that I could live without you, baby. It couldn't be that hard to live alone. But I'm all, all alone again. Thinking you will never say. that you'll be home again. And it's gonna be a long night. And it's gonna be cold without your arms. And I`m gonna get stage fright caught. in the headlights. It's gonna be a long night. And I know I'm gonna lose this fight. Once upon a time we fell in love. And I thought that I would be the only one. But now I'm on, I'm on my own again. Thinking you will never show. you won't be home again. And it's gonna be a long night. And it's gonna be cold without your arms. And I`m gonna get stage fright caught. in the headlights. It's gonna be a long night. And I know I'm gonna lose this fight. Lost in your arms baby. Lost in your arms. Now I'm on my own again. Thinking you will never show. you won't be home again. And it's gonna be a long night. And it's gonna be cold without your arms. And I`m gonna get stage fright caught. in the headlights. It's gonna be a long night. And I know I'm gonna lose this fight. I'm gonna get stage fright caught in the headlights. It's gonna be a long night. And I know I'm gonna lose this fight. I'm lost in your arms baby. Lost in your arms"
all the love in the world,"I'm not looking for someone to talk to. I've got my friends, I'm more than okay. I've got more than a girl could wish for. I live my dreams, but it's not all they say. Still I believe. (I'm missing...). I'm missing something real. I need someone who really sees me. (Don't want to wake...). Don't want to wake up alone anymore. Still believing you'll walk through my door. All I need is to know it's for sure. Then I'll give all the love in the world. I've often wondered if love's an illusion. Just to get you through the loneliest days. I can't critisise it, I had no hesitations. My imagination just stole me away. Still I believe. (I'm missing...). I'm missing something real. I need someone who really sees me. (Don't want to wake...). Don't want to wake up alone anymore. Still believeing you'll walk through my door. All I need is to know it's for sure. Then I'll give all the love in the world. (Guitar/Tin whistle solo). Love's for a lifetime. Not for a moment. So how can i throw it away. I'm only human. And nights grow colder. With no one to love me that way. I need someone who really sees me. (Don't want to wake...). And I won't wake up alone anymore. Still believeing you'll walk through my door. You'll reach for me and I'll know it's for sure. Then I'll give all the love in the world. (Don't want to wake up alone anymore). All alone. (Don't want to wake up alone). Just reach for me. (Don't want to wake up alone). Don't want to be alone. (Don't want to wake up alone). Don't want to wake up alone. (Don't want to wake up alone). Let me know it's sure. (Don't want to wake up alone). Still believe in someone. (Don't want to wake up alone). When you reach for me. (Don't want to wake up alone). Let me know it's for real. [Fade]"
angel,"""Angel"". She lived like she knew nothing lasts. Didn't care to look like anyone else. And she was beautiful, so beautiful. I still hear her laugh like she's here. Shower it down on all the young. It isn't so wrong to have such fun. Forever angel. I hope they love you like we do. Forever angel. I'll be proud to be like you. Be like you. (I'll be proud to be like you). Does the sun shine up at you when you are looking down?. Do you get along with the others around?. It's got to be better than before. You don't need to worry now you're gone. Forever angel. I hope they love you like we do. Forever angel. I'll be proud to be like you. Be like you. Just like you. And when i go to sleep at night. I'll thank you for each blessed thing surrounding me. For every fall I'll ever break. Each moment`s breath I wanna taste. Confidence and conscience. Decadent extravagance. Never ending providence. For loving when I had the chance. Forever angel. I hope they love you like we do. Forever angel. I'll be proud to be like you. Forever angel. I'll be proud to be like you. Forever angel. I'll be proud to be like you"
when the stars go blue,"Dancin' where the stars go blue. Dancin' where the evening fell. Dancin' in your wooden shoes. In a wedding gown. Dancin' out on 7th street. Dancin' through the underground. Dancin' little marionette. Are you happy now?. Where do you go when you're lonely. Where do you go when you're blue. Where do you go when you're lonely. I'll follow you. When the stars go blue, blue. When the stars go blue, blue. When the stars go blue, blue. When the stars go blue. Laughing with your pretty mouth. Laughing with your broken eyes. Laughing with your lover's tongue. In a lullaby. Where do you go when you're lonely. Where do you go when you're blue. Where do you go when you're lonely. I'll follow you. When the stars go blue, blue. When the stars go blue, blue. When the stars, when the stars go blue, blue. When the stars go blue. When the stars go blue, blue, blue. Stars go blue. When the stars go blue. Where do you go when you're lonely. Where do you go when you're blue, yeah. Where do you go when you're lonely. I'll follow you, I'll follow you, I'll follow you. I'll follow you, I'll follow you, yeah. Where do you go, yeah. Where do you go, Where do you go"
queen of hollywood,She drove a long way through the night. From an urban neighborhood. She left her mother in a fight. For a dream misunderstood. And her friends they talk on corners. They could never comprehend. But there was always something different. In the way she held a stare. And the pictures that she painted. Were of glamour and of flair. And her boyfriend though he loved her. Knew he couldn't quite fulfill. He could never meet her there. She's never gonna be like the one before. She read it in her stars that there's something more. No matter what it takes no matter how she breaks. She'll be the Queen of Hollywood. And the cynics they will wonder. What's the difference with this dream. And the dreams of countless others. All they believe in TV. They see their handprints in a sidewalk. Flashing cameras on the scene. And a shining limousine. She's never gonna be like the one before. She read it in her stars that there's something more. No matter what it takes no matter how she breaks. She'll be the Queen of Hollywood. She's believing in a dream. Queen of Hollywood It's a loaded fantasy. Now her mother collects cut-outs. And the pictures make her smile. But if she saw behind the curtains. It could only make her cry. She's got hand prints on her body. Sad moonbeams in her eyes. not so innocent a child. She's never gonna be like the one before. She read it in her stars that there's something more. No matter what it takes no matter how she breaks. She'll be the Queen of Hollywood. Queen of Hollywood. No she's never gonna be like the one before. She read it in her stars that there's something more. No matter what it takes and even though she breaks. She'll be the Queen of Hollywood. She's the Queen of Hollywood and. Her friends still talk On Corners. She's the Queen of Hollywood
would you be happier?,"Whoo!. Have you ever wondered where the story ends and how it all began?. I do (I do I do I do...). Did you ever dream you were the movie star with popcorn in your hand?. I did (I did I did I did...). Do you ever feel you're someone else inside and no one understands?. You are (you are you are you are...). And wanna disappear inside a dream but never wanna wake?. Wake up. Then you stumble on tomorrow. And trip over today. Would you be happier if you weren't so un-together?. Would sun shine brighter if you played a bigger part?. Would you be wonderful if it wasn't for the weather?. You're gonna be just fine (gonna be just fine). Are you not afraid to tell your story now, but everyone is gone?. It's too late (it's too late it's too late it's too late...). Was everything you've ever said or done not the way you planned?. Mistake. And so you promise that tomorrow. Be different than today. Would you be happier if you weren't so un-together?. Would sun shine brighter if you played a bigger part?. Would you be wonderful if it wasn't for the weather?. You're gonna be just fine (gonna be just fine). I think you're gonna be just fine. You're gonna be just fine (fine). So don't worry baby (don't worry baby). And you're racing for tomorrow. Not finished with today. Would you be happier if you weren't so un-together?. Would sun shine brighter if you played a bigger part?. Would you be wonderful if it wasn't for the weather?. I think you're gonna be just fine (gonna be just fine). Would we be happier if we weren't so un-together?. Would sun shine brighter if we played a bigger part?. Would we be wonderful if it wasn't for the weather?. I think we're gonna be just fine (gonna be just fine). I think you're gonna be just fine. Don't worry baby. You're gonna be just fine. Don't worry honey. You're gonna be just fine. Don't worry baby. You're gonna be just fine."
son of solomon,Early morning light. Anyone awake. Let him kiss me on my mouth. For he loves me like I'm wine. Son of Solomon. I'm the darkest of them all. But you see the light in my soul. Will you kiss me on my mouth?. Will you love me like I'm wine?. Son of Solomon. Where will go. I'll follow you. Follow you alone. I seek and you. You find me. Son of Solomon. My own. I never had a friend. In the dead of night. Will kiss me on my mouth?. Will you love like I'm wine?. Son of Solomon. Where you will go. I'll follow you. Follow you alone. I seek and you. You find me. Son of Solomon. My own. Where you will go. I'll follow you. Follow you alone. I seek and you. You find me. Son of Solomon. My own. Where you will go. I'll follow you. Follow you alone. I seek and you. You find me. Son of Solomon. My own. Early morning light. Anyone awake. Let him kiss me on my mouth. For he loves me like I'm wine. Son of Solomon. Will kiss me on my mouth?. Will you love me like I'm wine?. Son of Solomon
a love divine,My heart's a broken place. Seeking a state of grace. Where love survives. Wild in an urban world. Come steal my night. Make heaven mine. Say when we catch the light. We're gonna flame so high. Only way to burn. We're passing wonder why. To the other side. Where ever hides. A firefly you glow. Where I can only go. For every storm that breaks. Every sky that wakes. I'll be at your side. For ever and a day. Take you in every way. Feel a love divine. We hold the hand of time. Just you and I. Feel a love divine. Coz when we burn. We flame. A carnival of light. Reaching for the sky. A firefly you glow. Where I can only go. For every storm that breaks. Every sky that wakes. I'll be at your side. For ever and a day. Take you in every way. Feel a love divine. So to the end we blaze. And every cloud we chase. You're my alibi. Above the darkest sky. We found a way to fly. A love divine. A love divine. Every storm that breaks. Every sky that wakes. I'll be at your side. For ever and a day. Take you in every way. A love divine. So to the end we blaze. And every cloud we chase. You're my alibi. Above the darkest sky. We found a way to fly. A love divine. I feel a love divine. Yeah. Yeah yeah. Yeah yeah. OOhh. Yeah yeah. OOhh. Yeah yeah. Love divine
little wing,"Now she's walking through the clouds. With a circus mind. That's running wild. Butterflies and zebras. And moonbeams and fairytales. All she ever thinks about is riding with the wind. When I'm sad she comes to me. With a thousand smiles. She gives to me free. It's alright, it's alright she says. Take anything you want from me. Anything. Fly little wing"
summer sunshine,"Everyone's changing, I stay the same. I'm a solo cello outside a chorus. I've got a secret, it's time for me. to tell that you've been keeping me warm. Just sweet beginnings and bitter endings. In coffee city we borrowed heaven. Don't give it back I've never felt so wanted. Are you taking me home?. You tell me you have to go. In the heat of summer sunshine I miss you. Like nobody else. In the heat of summer sunshine I'll kiss you. And nobody needs to know. Now that you've left me there's no returning. I keep comparing you're always winning. I try to be strong but you'll never be more wanted. Will you make me at home?. Don't tell me you have to go. In the heat of summer sunshine I miss you. Like nobody else. In the heat of summer sunshine I'll kiss you. And nobody needs to know. To sweet beginnings and bitter endings. In coffee city we borrowed heaven. Don't give it back winter is coming. And I need to stay warm. In the heat of summer sunshine I miss you. Like nobody else. In the heat of summer sunshine I'll kiss you. And nobody needs to know. In the heat of summer sunshine I miss you. Like nobody else. In the heat of summer sunshine I'll kiss you. And nobody needs to know"
one night,"Long day and I'm ready, I'm waiting for your call. 'Cos I've made up my mind. My heart aches with a hunger and the want that you were mine. No I cannot deny. So for one night - is it alright. That I give you. My heart - my love - my heart. Just for one night. My body - my soul. Just for one night. My love - my love. For one night - one night - one night. When morning awakes me. Well I know I'll be alone. And I feel I'll be fine. So don't you worry about me. I'm not empty on my own. For inside I'm alive. That for one night - it was so right. That I gave you. My heart - my love - my heart. Just for one night. My body - my soul. Just for one night. My love - I loved. For one night - one night - one night. For one night - it was so right. That I gave you. My heart - my love - my heart. Just for one night. My body - my soul. Just for one night. My love - my love. For one night - one night - one night. One night"
irresistible,"You're irresistible, you're mine. Don't want you for the weekend, don't want you for a day. Don't need a love divided, don't want to feel this way.. See I want you to need me, (the way that I need you). Just like I need you (the way I see you). And I want you to see me, like no one before. Chorus:. You're irresistible, you're natural, and physical. It's indefinable, it's magical, illogical.. So make-you-mineable,. You're mine. So can't you see I'm tortured, oh cant you hear my pain?. If youd just let me show you (show you). I'll be your summer rain. Then you'll feel that you want me (the way I feel it). Just like I want you ( the way I want you). And you know nothing is better,. It's like nothing before. Chorus:. You're irresistible, you're natural, and physical. It's indefinable, magical, illogical,. So make-you-mine-able,. You're mine. Now you feel what I'm feeling (dont you feel what I'm feeling). Don't you know that it's more (it can take you places). It can take you places, like never before. Chorus:. You're irresistible, you're natural, and physical.. It's indifineable, magical, and illogical,. So make-you-mine-able,. Your mine."
